"Status","Start Time","Stop Time","Duration in ms","Parent Suite","Suite","Sub Suite","Test Class","Test Method","Name","Description"
"passed","Mon Jun 13 21:17:02 GMT 2022","Mon Jun 13 21:18:18 GMT 2022","76011","","JIT-Dashboard-003c-DETAILOF-saving","","JIT-Dashboard-003c-DETAILOF-saving","[DEATIL-OF] As a user, I should save the selected option when switching between tables","[DEATIL-OF] As a user, I should save the selected option when switching between tables",""
"passed","Mon Jun 13 21:21:18 GMT 2022","Mon Jun 13 21:22:05 GMT 2022","47145","","JIT-Database-003-Check-create-empty-and-duplicated-column","","JIT-Database-003-Check-create-empty-and-duplicated-column","As a user, I cannot add empty column definition","As a user, I cannot add empty column definition",""
"passed","Mon Jun 13 21:21:47 GMT 2022","Mon Jun 13 21:23:56 GMT 2022","129664","","JIT-Database-007-Check-validation-column-definition-type-TEXT","","JIT-Database-007-Check-validation-column-definition-type-TEXT","As a user, I should check the validation of TEXT column definition","As a user, I should check the validation of TEXT column definition",""
"passed","Mon Jun 13 21:27:02 GMT 2022","Mon Jun 13 21:28:49 GMT 2022","106854","","JIT-Mobile-010-JITDEF14-rename-without-focusing","","JIT-Mobile-010-JITDEF14-rename-without-focusing","As a user, I could rename the screen/molecule without focusing","As a user, I could rename the screen/molecule without focusing",""
"passed","Mon Jun 13 21:30:36 GMT 2022","Mon Jun 13 21:31:19 GMT 2022","43053","","JIT-Module-002a-DEEPLINK-default","","JIT-Module-002a-DEEPLINK-default","As a user, I can add module Deeplink and remove it","As a user, I can add module Deeplink and remove it",""
"passed","Mon Jun 13 21:20:10 GMT 2022","Mon Jun 13 21:21:18 GMT 2022","68034","","JIT-Dashboard-006e-DELETEOF-delete-column","","JIT-Dashboard-006e-DELETEOF-delete-column","[DELETE-OF] As a user, I should see the params will be removed when column is deleted","[DELETE-OF] As a user, I should see the params will be removed when column is deleted",""
"passed","Mon Jun 13 21:21:18 GMT 2022","Mon Jun 13 21:23:07 GMT 2022","108559","","JIT-Database-004-Check-validation-column-definition-type-INTEGER","","JIT-Database-004-Check-validation-column-definition-type-INTEGER","As a user, I should check the validation of INTEGER column definition","As a user, I should check the validation of INTEGER column definition",""
"passed","Mon Jun 13 21:30:02 GMT 2022","Mon Jun 13 21:30:54 GMT 2022","52203","","JIT-Module-001a-CLOUDINARY-default","","JIT-Module-001a-CLOUDINARY-default","As a user, I can add module Cloudinary and remove it","As a user, I can add module Cloudinary and remove it",""
"passed","Mon Jun 13 21:26:37 GMT 2022","Mon Jun 13 21:28:06 GMT 2022","88469","","JIT-Mobile-006-Molecule-update-molecule","","JIT-Mobile-006-Molecule-update-molecule","As a user, I can update molecule with positive and negative cases","As a user, I can update molecule with positive and negative cases",""
"passed","Mon Jun 13 21:31:43 GMT 2022","Mon Jun 13 21:32:57 GMT 2022","74332","","JIT-Module-005a-FORCE-MOBILE-UPDATE-database","","JIT-Module-005a-FORCE-MOBILE-UPDATE-database","[FORCE-MOBILE-UPDATE] - Check adding and auto-table & columns","[FORCE-MOBILE-UPDATE] - Check adding and auto-table & columns",""
"passed","Mon Jun 13 21:25:48 GMT 2022","Mon Jun 13 21:26:36 GMT 2022","47609","","JIT-Mobile-003-Screen-delete-screen","","JIT-Mobile-003-Screen-delete-screen","As a user, I can delete screen","As a user, I can delete screen",""
"passed","Mon Jun 13 21:48:02 GMT 2022","Mon Jun 13 21:49:01 GMT 2022","59543","","JIT-API-006c-DELETE-relation","","JIT-API-006c-DELETE-relation","As a user, I check column display when having relation for API DELETE","As a user, I check column display when having relation for API DELETE",""
"passed","Mon Jun 13 21:31:14 GMT 2022","Mon Jun 13 21:32:28 GMT 2022","73751","","JIT-Module-003-JPBANK-default","","JIT-Module-003-JPBANK-default","[JPBANK] - Check adding and auto-generated API","[JPBANK] - Check adding and auto-generated API",""
"passed","Mon Jun 13 21:15:32 GMT 2022","Mon Jun 13 21:17:09 GMT 2022","97001","","JIT-Dashboard-002e-LISTOF-delete-column","","JIT-Dashboard-002e-LISTOF-delete-column","As a user, I should see the params will be removed when column is deleted","As a user, I should see the params will be removed when column is deleted",""
"passed","Mon Jun 13 21:22:05 GMT 2022","Mon Jun 13 21:22:56 GMT 2022","50824","","JIT-Database-003-Check-create-empty-and-duplicated-column","","JIT-Database-003-Check-create-empty-and-duplicated-column","As a user, I cannot add duplicated column definition","As a user, I cannot add duplicated column definition",""
"passed","Mon Jun 13 21:51:45 GMT 2022","Mon Jun 13 21:52:40 GMT 2022","55428","","JIT-API-007d-POST-API-Add-new-endpoint","","JIT-API-007d-POST-API-Add-new-endpoint","[GET-POST] Create, update and delete new POST API endpoint","[GET-POST] Create, update and delete new POST API endpoint",""
"passed","Mon Jun 13 21:27:29 GMT 2022","Mon Jun 13 21:28:38 GMT 2022","69538","","JIT-Mobile-013-JITDEF-reflect-delete-screen-innavigation-tree","","JIT-Mobile-013-JITDEF-reflect-delete-screen-innavigation-tree","As a user, I should see screen will be removed in navigation tree after deleting screen","As a user, I should see screen will be removed in navigation tree after deleting screen",""
"passed","Mon Jun 13 21:24:08 GMT 2022","Mon Jun 13 21:24:53 GMT 2022","45032","","JIT-Database-011f-COLUMN-ENUM-duplicated","","JIT-Database-011f-COLUMN-ENUM-duplicated","As a user, I should check counld not add duplicated item","As a user, I should check counld not add duplicated item",""
"passed","Mon Jun 13 21:15:42 GMT 2022","Mon Jun 13 21:16:57 GMT 2022","74333","","JIT-Dashboard-003b-DETAILOF-new-column","","JIT-Dashboard-003b-DETAILOF-new-column","[DEATIL-OF] As a user, I should add new column in dashboard params","[DEATIL-OF] As a user, I should add new column in dashboard params",""
"passed","Mon Jun 13 21:26:49 GMT 2022","Mon Jun 13 21:27:44 GMT 2022","54836","","JIT-Mobile-007-Molecule-delete-molecule","","JIT-Mobile-007-Molecule-delete-molecule","As a user, I can delete molecule","As a user, I can delete molecule",""
"passed","Mon Jun 13 21:46:44 GMT 2022","Mon Jun 13 21:47:56 GMT 2022","71761","","JIT-API-006a-DELETE-check-default","","JIT-API-006a-DELETE-check-default","As a user, I check default value in API DELETE","As a user, I check default value in API DELETE",""
"passed","Mon Jun 13 21:50:43 GMT 2022","Mon Jun 13 21:51:40 GMT 2022","57235","","JIT-API-007c-GET-detail-API-Add-new-endpoint","","JIT-API-007c-GET-detail-API-Add-new-endpoint","[GET-detail-API] Create, update and delete new GET API endpoint","[GET-detail-API] Create, update and delete new GET API endpoint",""
"passed","Mon Jun 13 21:18:52 GMT 2022","Mon Jun 13 21:20:08 GMT 2022","76303","","JIT-Dashboard-005d-UPDATEOF-delete-table","","JIT-Dashboard-005d-UPDATEOF-delete-table","[UPDATE-OF] As a user, I should see the table is not displayed in dashboard list after removed","[UPDATE-OF] As a user, I should see the table is not displayed in dashboard list after removed",""
"passed","Mon Jun 13 21:17:39 GMT 2022","Mon Jun 13 21:18:54 GMT 2022","74390","","JIT-Dashboard-004c-CREATEOF-saving","","JIT-Dashboard-004c-CREATEOF-saving","[CREATE-OF] As a user, I should save the selected option when switching between tables","[CREATE-OF] As a user, I should save the selected option when switching between tables",""
"passed","Mon Jun 13 21:15:32 GMT 2022","Mon Jun 13 21:17:01 GMT 2022","88694","","JIT-Dashboard-002b-LISTOF-new-column","","JIT-Dashboard-002b-LISTOF-new-column","[LIST-OF] As a user, I should add new column in dashboard params","[LIST-OF] As a user, I should add new column in dashboard params",""
"passed","Mon Jun 13 21:32:47 GMT 2022","Mon Jun 13 21:35:32 GMT 2022","165760","","JIT-Module-007b-APPLE-LOGIN-databse-api","","JIT-Module-007b-APPLE-LOGIN-databse-api","[APPLE-LOGIN], I check auto-generate column and api","[APPLE-LOGIN], I check auto-generate column and api",""
"passed","Mon Jun 13 21:29:11 GMT 2022","Mon Jun 13 21:31:37 GMT 2022","145579","","JIT-Mobile-027.1.ImagePreviewCode","","JIT-Mobile-027.1.ImagePreviewCode","As a user, I should check Preview code of Image component","As a user, I should check Preview code of Image component",""
