"Status","Start Time","Stop Time","Duration in ms","Parent Suite","Suite","Sub Suite","Test Class","Test Method","Name","Description"
"passed","Mon Jun 13 21:17:35 GMT 2022","Mon Jun 13 21:18:57 GMT 2022","81812","","JIT-Dashboard-004a-CREATEOF-default","","JIT-Dashboard-004a-CREATEOF-default","[CREATE-OF] As a user, I should add default column in dashboard params","[CREATE-OF] As a user, I should add default column in dashboard params",""
"passed","Mon Jun 13 21:41:56 GMT 2022","Mon Jun 13 21:43:08 GMT 2022","72568","","JIT-API-004a-GET-detail-check-default","","JIT-API-004a-GET-detail-check-default","As a user, I check default value in API GET-detail","As a user, I check default value in API GET-detail",""
"passed","Mon Jun 13 21:27:30 GMT 2022","Mon Jun 13 21:29:13 GMT 2022","102442","","JIT-Mobile-012-JITDEF-remove-poperty-info-after-deleting-navigation","","JIT-Mobile-012-JITDEF-remove-poperty-info-after-deleting-navigation","As a user, I should see the property infos need to be removed after the navigation was deleted","As a user, I should see the property infos need to be removed after the navigation was deleted",""
"passed","Mon Jun 13 21:26:03 GMT 2022","Mon Jun 13 21:27:02 GMT 2022","58862","","JIT-Mobile-005-Moelcule-create-new-molecule","","JIT-Mobile-005-Moelcule-create-new-molecule","As a user, I can create new molecule with positive and negative cases","As a user, I can create new molecule with positive and negative cases",""
"passed","Mon Jun 13 21:32:54 GMT 2022","Mon Jun 13 21:34:10 GMT 2022","75379","","JIT-Module-008a-FB-LOGIN-default-edit","","JIT-Module-008a-FB-LOGIN-default-edit","[FACEBOOK-LOGIN], I can add module Facebook Login and edit its infos","[FACEBOOK-LOGIN], I can add module Facebook Login and edit its infos",""
"passed","Mon Jun 13 21:15:32 GMT 2022","Mon Jun 13 21:17:09 GMT 2022","96857","","JIT-Dashboard-002d-LISTOF-delete-table","","JIT-Dashboard-002d-LISTOF-delete-table","[LIST-OF] As a user, I should see the table is not displayed in dashboard list after removed","[LIST-OF] As a user, I should see the table is not displayed in dashboard list after removed",""
"passed","Mon Jun 13 21:39:31 GMT 2022","Mon Jun 13 21:40:40 GMT 2022","69789","","JIT-API-003a-POST-check-default","","JIT-API-003a-POST-check-default","As a user, I check default value in API POST","As a user, I check default value in API POST",""
"passed","Mon Jun 13 21:21:32 GMT 2022","Mon Jun 13 21:23:49 GMT 2022","136293","","JIT-Database-006-Check-validation-column-definition-type-STRING","","JIT-Database-006-Check-validation-column-definition-type-STRING","As a user, I should check the validation of STRING column definition","As a user, I should check the validation of STRING column definition",""
"passed","Mon Jun 13 21:32:00 GMT 2022","Mon Jun 13 21:33:06 GMT 2022","66490","","JIT-Module-006a-SMS-default","","JIT-Module-006a-SMS-default","[SMS], I can add module SMS login with Twilio and remove it","[SMS], I can add module SMS login with Twilio and remove it",""
"passed","Mon Jun 13 21:23:59 GMT 2022","Mon Jun 13 21:24:56 GMT 2022","57046","","JIT-Database-011e-COLUMN-ENUM-delete-all","","JIT-Database-011e-COLUMN-ENUM-delete-all","As a user, I should delete all items and check all items are not displayed","As a user, I should delete all items and check all items are not displayed",""
"passed","Mon Jun 13 21:25:10 GMT 2022","Mon Jun 13 21:26:24 GMT 2022","74467","","JIT-Database-014-DEFECT-Check-duplicate-table-name","","JIT-Database-014-DEFECT-Check-duplicate-table-name","As a user, I cannot update to duplicate name","As a user, I cannot update to duplicate name",""
"passed","Mon Jun 13 21:25:55 GMT 2022","Mon Jun 13 21:28:10 GMT 2022","134552","","JIT-Mobile-004-Screen-duplicate-screen","","JIT-Mobile-004-Screen-duplicate-screen","As a user, I can duplicate screen with positive and negative cases","As a user, I can duplicate screen with positive and negative cases",""
"failed","Mon Jun 13 21:44:14 GMT 2022","Mon Jun 13 21:45:27 GMT 2022","72883","","JIT-API-005a-PUT-check-default","","JIT-API-005a-PUT-check-default","As a user, I check default value in API PUT","As a user, I check default value in API PUT",""
"passed","Mon Jun 13 21:28:37 GMT 2022","Mon Jun 13 21:29:37 GMT 2022","60970","","JIT-Mobile-021-DEFECT.Params.keep-params-after-refresh-page","","JIT-Mobile-021-DEFECT.Params.keep-params-after-refresh-page","As a user, I should check the params will be kept after refresh page","As a user, I should check the params will be kept after refresh page",""
"passed","Mon Jun 13 21:49:05 GMT 2022","Mon Jun 13 21:49:32 GMT 2022","26652","","JIT-API-007a-GROUP-API-CRUD","","JIT-API-007a-GROUP-API-CRUD","[GROUP-API] Create, update and delete group API","[GROUP-API] Create, update and delete group API",""
"passed","Mon Jun 13 21:24:30 GMT 2022","Mon Jun 13 21:25:26 GMT 2022","55325","","JIT-Database-012b-RELATION-empty-duplicate","","JIT-Database-012b-RELATION-empty-duplicate","[RELATION], I should see the error duplicate when leaving foreign key empty","[RELATION], I should see the error duplicate when leaving foreign key empty",""
"passed","Mon Jun 13 21:43:14 GMT 2022","Mon Jun 13 21:44:10 GMT 2022","56154","","JIT-API-004c-GET-detail-relation","","JIT-API-004c-GET-detail-relation","As a user, I check column display when having relation for GET-detail","As a user, I check column display when having relation for GET-detail",""
"passed","Mon Jun 13 21:17:39 GMT 2022","Mon Jun 13 21:19:57 GMT 2022","138418","","JIT-Dashboard-004d-CREATEOF-delete-table","","JIT-Dashboard-004d-CREATEOF-delete-table","[CREATE-OF] As a user, I should see the table is not displayed in dashboard list after removed","[CREATE-OF] As a user, I should see the table is not displayed in dashboard list after removed",""
"passed","Mon Jun 13 21:19:31 GMT 2022","Mon Jun 13 21:20:29 GMT 2022","58195","","JIT-Dashboard-006b-DELETEOF-new-column","","JIT-Dashboard-006b-DELETEOF-new-column","[DELETE-OF] As a user, I should add new column in dashboard params","[DELETE-OF] As a user, I should add new column in dashboard params",""
"passed","Mon Jun 13 21:17:15 GMT 2022","Mon Jun 13 21:18:21 GMT 2022","66213","","JIT-Dashboard-003e-DETAILOF-delete-column","","JIT-Dashboard-003e-DETAILOF-delete-column","[DEATIL-OF] As a user, I should see the params will be removed when column is deleted","[DEATIL-OF] As a user, I should see the params will be removed when column is deleted",""
"passed","Mon Jun 13 21:21:28 GMT 2022","Mon Jun 13 21:23:21 GMT 2022","112895","","JIT-Database-005-Check-validation-column-definition-type-FLOAT","","JIT-Database-005-Check-validation-column-definition-type-FLOAT","As a user, I should check the validation of FLOAT column definition","As a user, I should check the validation of FLOAT column definition",""
"passed","Mon Jun 13 21:40:46 GMT 2022","Mon Jun 13 21:41:52 GMT 2022","65348","","JIT-API-003c-POST-relation","","JIT-API-003c-POST-relation","As a user, I check column display when having relation for API POST","As a user, I check column display when having relation for API POST",""
"passed","Mon Jun 13 21:20:27 GMT 2022","Mon Jun 13 21:21:03 GMT 2022","35969","","JIT-Database-001b-TABLE-empty","","JIT-Database-001b-TABLE-empty","As a user, I cannot create table with empty name","As a user, I cannot create table with empty name",""
"passed","Mon Jun 13 21:23:13 GMT 2022","Mon Jun 13 21:24:11 GMT 2022","58390","","JIT-Database-011a-COLUMN-ENUM-default","","JIT-Database-011a-COLUMN-ENUM-default","As a user, I should check the basic validation","As a user, I should check the basic validation",""
"passed","Mon Jun 13 21:20:29 GMT 2022","Mon Jun 13 21:21:15 GMT 2022","45893","","JIT-Database-001c-TABLE-duplicate","","JIT-Database-001c-TABLE-duplicate","As a user, I cannot create table with duplicate name","As a user, I cannot create table with duplicate name",""
"passed","Mon Jun 13 21:15:32 GMT 2022","Mon Jun 13 21:17:13 GMT 2022","100561","","JIT-Dashboard-002a-LISTOF-default-column","","JIT-Dashboard-002a-LISTOF-default-column","[LIST-OF] As a user, I should add default column in dashboard params","[LIST-OF] As a user, I should add default column in dashboard params",""
"passed","Mon Jun 13 21:23:25 GMT 2022","Mon Jun 13 21:25:14 GMT 2022","109180","","JIT-Database-011c-COLUMN-ENUM-delete-items","","JIT-Database-011c-COLUMN-ENUM-delete-items","As a user, I should delete 1 item and check not display in default dropdown","As a user, I should delete 1 item and check not display in default dropdown",""
"passed","Mon Jun 13 21:17:53 GMT 2022","Mon Jun 13 21:18:56 GMT 2022","62997","","JIT-Dashboard-004e-CREATEOF-delete-column","","JIT-Dashboard-004e-CREATEOF-delete-column","[CREATE-OF] As a user, I should see the params will be removed when column is deleted","[CREATE-OF] As a user, I should see the params will be removed when column is deleted",""
"passed","Mon Jun 13 21:21:49 GMT 2022","Mon Jun 13 21:23:15 GMT 2022","86061","","JIT-Database-008-Check-validation-column-definition-type-DATE-TIME","","JIT-Database-008-Check-validation-column-definition-type-DATE-TIME","As a user, I should check the validation of DATETIME column definition","As a user, I should check the validation of DATETIME column definition",""
"passed","Mon Jun 13 21:28:32 GMT 2022","Mon Jun 13 21:30:34 GMT 2022","121658","","JIT-Mobile-019.1.ViewPreviewCode","","JIT-Mobile-019.1.ViewPreviewCode","As a user, I should check Preview code of View component","As a user, I should check Preview code of View component",""
"passed","Mon Jun 13 21:38:29 GMT 2022","Mon Jun 13 21:39:26 GMT 2022","57568","","JIT-API-002c-GET-list","","JIT-API-002c-GET-list","As a user, I check column display when having relation for GET-list","As a user, I check column display when having relation for GET-list",""
"passed","Mon Jun 13 21:30:56 GMT 2022","Mon Jun 13 21:32:21 GMT 2022","84417","","JIT-Module-002b-DEEPLINK-edit-infos","","JIT-Module-002b-DEEPLINK-edit-infos","As a user, I can update module Deeplink","As a user, I can update module Deeplink",""
"passed","Mon Jun 13 21:54:51 GMT 2022","Mon Jun 13 21:56:15 GMT 2022","84576","","JIT-API-008-DEFECT-Check-column-file-type","","JIT-API-008-DEFECT-Check-column-file-type","[DEFECT] As a user, I check column type file not display in request params of GET list Api","[DEFECT] As a user, I check column type file not display in request params of GET list Api",""
"passed","Mon Jun 13 21:33:34 GMT 2022","Mon Jun 13 21:34:55 GMT 2022","81344","","JIT-Module-009a-GOOGLE-LOGIN-default-edit","","JIT-Module-009a-GOOGLE-LOGIN-default-edit","[GOOGLE-LOGIN], I can add module Google Login and edit its infos","[GOOGLE-LOGIN], I can add module Google Login and edit its infos",""
"passed","Mon Jun 13 21:20:08 GMT 2022","Mon Jun 13 21:21:31 GMT 2022","82787","","JIT-Dashboard-006d-DELETEOF-delete-table","","JIT-Dashboard-006d-DELETEOF-delete-table","[DELETE-OF] As a user, I should see the table is not displayed in dashboard list after removed","[DELETE-OF] As a user, I should see the table is not displayed in dashboard list after removed",""
"passed","Mon Jun 13 21:34:11 GMT 2022","Mon Jun 13 21:35:25 GMT 2022","73778","","JIT-Module-010a-LINE-LOGIN-default-edit","","JIT-Module-010a-LINE-LOGIN-default-edit","[LINE-LOGIN], I can add module Line Login and edit its infos","[LINE-LOGIN], I can add module Line Login and edit its infos",""
"passed","Mon Jun 13 21:29:42 GMT 2022","Mon Jun 13 21:30:13 GMT 2022","31080","","JIT-Module-000-temp","","JIT-Module-000-temp","As a user, I can add module Search","As a user, I can add module Search",""
"passed","Mon Jun 13 21:22:04 GMT 2022","Mon Jun 13 21:23:13 GMT 2022","68918","","JIT-Database-010-Check-validation-column-definition-type-FILE","","JIT-Database-010-Check-validation-column-definition-type-FILE","As a user, I should check the validation of FILE column definition","As a user, I should check the validation of FILE column definition",""
"passed","Mon Jun 13 21:25:40 GMT 2022","Mon Jun 13 21:26:36 GMT 2022","56636","","JIT-Mobile-001-Screen-create-new-screen","","JIT-Mobile-001-Screen-create-new-screen","As a user, I can create new screen with positive and negative cases","As a user, I can create new screen with positive and negative cases",""
"passed","Mon Jun 13 21:30:04 GMT 2022","Mon Jun 13 21:31:22 GMT 2022","78235","","JIT-Module-001b-CLOUDINARY-edit-infos","","JIT-Module-001b-CLOUDINARY-edit-infos","As a user, I can update module Cloudinary","As a user, I can update module Cloudinary",""
"passed","Mon Jun 13 21:18:38 GMT 2022","Mon Jun 13 21:19:40 GMT 2022","61922","","JIT-Dashboard-005b-UPDATEOF-new-column","","JIT-Dashboard-005b-UPDATEOF-new-column","[UPDATE-OF] As a user, I should add new column in dashboard params","[UPDATE-OF] As a user, I should add new column in dashboard params",""
"passed","Mon Jun 13 21:24:52 GMT 2022","Mon Jun 13 21:25:42 GMT 2022","49846","","JIT-Database-013-DEFECT-Check-default-value-when-changing-type","","JIT-Database-013-DEFECT-Check-default-value-when-changing-type","As a user, I should check the default value when changing the type","As a user, I should check the default value when changing the type",""
"passed","Mon Jun 13 21:23:25 GMT 2022","Mon Jun 13 21:25:13 GMT 2022","107154","","JIT-Database-011b-COLUMN-ENUM-add-items","","JIT-Database-011b-COLUMN-ENUM-add-items","As a user, I should add new item and select in default dropdown","As a user, I should add new item and select in default dropdown",""
"passed","Mon Jun 13 21:28:54 GMT 2022","Mon Jun 13 21:31:32 GMT 2022","158338","","JIT-Mobile-025.1.TextPreviewCode","","JIT-Mobile-025.1.TextPreviewCode","As a user, I should check Preview code of Text component","As a user, I should check Preview code of Text component",""
"failed","Mon Jun 13 21:34:39 GMT 2022","Mon Jun 13 21:35:57 GMT 2022","77425","","JIT-Module-010b-LINE-LOGIN-databse-api","","JIT-Module-010b-LINE-LOGIN-databse-api","[LINE-LOGIN], I check auto-generate column and api","[LINE-LOGIN], I check auto-generate column and api",""
"passed","Mon Jun 13 21:21:05 GMT 2022","Mon Jun 13 21:21:41 GMT 2022","36000","","JIT-Database-002-Check-default-column-definition","","JIT-Database-002-Check-default-column-definition","As a user, I should see the default column definition","As a user, I should see the default column definition",""
"passed","Mon Jun 13 21:28:37 GMT 2022","Mon Jun 13 21:29:37 GMT 2022","59604","","JIT-Mobile-020-DEFECT.View.keep-percentage-mode","","JIT-Mobile-020-DEFECT.View.keep-percentage-mode","As a user, I should check the % mode of Height is not reset after select another View component","As a user, I should check the % mode of Height is not reset after select another View component",""
"passed","Mon Jun 13 21:17:15 GMT 2022","Mon Jun 13 21:18:43 GMT 2022","88190","","JIT-Dashboard-003d-DETAILOF-delete-table","","JIT-Dashboard-003d-DETAILOF-delete-table","[DEATIL-OF] As a user, I should see the table is not displayed in dashboard list after removed","[DEATIL-OF] As a user, I should see the table is not displayed in dashboard list after removed",""
"passed","Mon Jun 13 21:24:24 GMT 2022","Mon Jun 13 21:25:30 GMT 2022","66487","","JIT-Database-012a-RELATION-basic","","JIT-Database-012a-RELATION-basic","[RELATION] check the basic relation","[RELATION] check the basic relation",""
"passed","Mon Jun 13 21:25:40 GMT 2022","Mon Jun 13 21:27:02 GMT 2022","81408","","JIT-Mobile-002-Screen-update-screen","","JIT-Mobile-002-Screen-update-screen","As a user, I can update screen with positive and negative cases","As a user, I can update screen with positive and negative cases",""
"passed","Mon Jun 13 21:21:55 GMT 2022","Mon Jun 13 21:23:06 GMT 2022","71348","","JIT-Database-009-Check-validation-column-definition-type-BOOLEAN","","JIT-Database-009-Check-validation-column-definition-type-BOOLEAN","As a user, I should check the validation of BOOLEAN column definition","As a user, I should check the validation of BOOLEAN column definition",""
"passed","Mon Jun 13 21:19:09 GMT 2022","Mon Jun 13 21:20:13 GMT 2022","63123","","JIT-Dashboard-005e-UPDATEOF-delete-column","","JIT-Dashboard-005e-UPDATEOF-delete-column","[UPDATE-OF] As a user, I should see the params will be removed when column is deleted","[UPDATE-OF] As a user, I should see the params will be removed when column is deleted",""
"passed","Mon Jun 13 21:18:48 GMT 2022","Mon Jun 13 21:19:55 GMT 2022","67160","","JIT-Dashboard-005c-UPDATEOF-saving","","JIT-Dashboard-005c-UPDATEOF-saving","[UPDATE-OF] As a user, I should save the selected option when switching between tables","[UPDATE-OF] As a user, I should save the selected option when switching between tables",""
"passed","Mon Jun 13 21:20:24 GMT 2022","Mon Jun 13 21:21:05 GMT 2022","41048","","JIT-Database-001a-TABLE-new","","JIT-Database-001a-TABLE-new","As a user, I can create new table","As a user, I can create new table",""
"passed","Mon Jun 13 21:25:12 GMT 2022","Mon Jun 13 21:26:14 GMT 2022","61849","","JIT-Database-015a-INDEX-Check-duplicate-empty","","JIT-Database-015a-INDEX-Check-duplicate-empty","As a user, I check empty and duplicate index","As a user, I check empty and duplicate index",""
"passed","Mon Jun 13 21:33:58 GMT 2022","Mon Jun 13 21:35:52 GMT 2022","113470","","JIT-Module-009b-GOOGLE-LOGIN-databse-api","","JIT-Module-009b-GOOGLE-LOGIN-databse-api","[GOOGLE-LOGIN], I check auto-generate column and api","[GOOGLE-LOGIN], I check auto-generate column and api",""
"failed","Mon Jun 13 21:35:07 GMT 2022","Mon Jun 13 21:36:09 GMT 2022","61861","","JIT-Module-011b-GUEST-LOGIN-databse-api","","JIT-Module-011b-GUEST-LOGIN-databse-api","[GUEST-LOGIN], I check auto-generate column and api","[GUEST-LOGIN], I check auto-generate column and api",""
"passed","Mon Jun 13 21:36:31 GMT 2022","Mon Jun 13 21:37:05 GMT 2022","33863","","JIT-API-001-Check-general-info","","JIT-API-001-Check-general-info","As a user, I check general info","As a user, I check general info",""
"passed","Mon Jun 13 21:19:25 GMT 2022","Mon Jun 13 21:21:27 GMT 2022","122260","","JIT-Dashboard-006a-DELETEOF-default","","JIT-Dashboard-006a-DELETEOF-default","[DELETE-OF] As a user, I should add default column in dashboard params","[DELETE-OF] As a user, I should add default column in dashboard params",""
"passed","Mon Jun 13 21:34:41 GMT 2022","Mon Jun 13 21:36:25 GMT 2022","103619","","JIT-Module-011a-GUEST-LOGIN-default-edit","","JIT-Module-011a-GUEST-LOGIN-default-edit","[GUEST-LOGIN], I can add module Guest Login and edit its infos","[GUEST-LOGIN], I can add module Guest Login and edit its infos",""
"passed","Mon Jun 13 21:18:39 GMT 2022","Mon Jun 13 21:19:56 GMT 2022","77422","","JIT-Dashboard-005a-UPDATEOF-default","","JIT-Dashboard-005a-UPDATEOF-default","[UPDATE-OF] As a user, I should add default column in dashboard params","[UPDATE-OF] As a user, I should add default column in dashboard params",""
"passed","Mon Jun 13 21:27:09 GMT 2022","Mon Jun 13 21:28:06 GMT 2022","56452","","JIT-Mobile-011-JITDEF50-disable-add-duplicate-screen-in-stack","","JIT-Mobile-011-JITDEF50-disable-add-duplicate-screen-in-stack","As a user, I could add duplicate screen in stack","As a user, I could add duplicate screen in stack",""
"passed","Mon Jun 13 21:53:47 GMT 2022","Mon Jun 13 21:54:46 GMT 2022","59599","","JIT-API-007f-DELETE-API-Add-new-endpoint","","JIT-API-007f-DELETE-API-Add-new-endpoint","[DELETE-API] Create, update and delete new DELETE API endpoint","[DELETE-API] Create, update and delete new DELETE API endpoint",""
"passed","Mon Jun 13 21:20:41 GMT 2022","Mon Jun 13 21:21:28 GMT 2022","46879","","JIT-Database-001d-TABLE-update","","JIT-Database-001d-TABLE-update","As a user, I can update the value of the table","As a user, I can update the value of the table",""
"broken","Mon Jun 13 21:25:25 GMT 2022","Mon Jun 13 21:31:17 GMT 2022","351466","","JIT-Database-016a-COUNTER-CACHE-Create-by-relation","","JIT-Database-016a-COUNTER-CACHE-Create-by-relation","[COUNTER-CACHE] create new counter cache column by selecting in relation popup","[COUNTER-CACHE] create new counter cache column by selecting in relation popup",""
"passed","Mon Jun 13 21:23:13 GMT 2022","Mon Jun 13 21:24:56 GMT 2022","103245","","JIT-Database-010-Check-validation-column-definition-type-FILE","","JIT-Database-010-Check-validation-column-definition-type-FILE","As a user, I should check the validation of FILE column definition for Format Area","As a user, I should check the validation of FILE column definition for Format Area",""
"failed","Mon Jun 13 21:37:10 GMT 2022","Mon Jun 13 21:38:16 GMT 2022","66099","","JIT-API-002a-GET-list-check-default","","JIT-API-002a-GET-list-check-default","As a user, I check default value in API GET list","As a user, I check default value in API GET list",""
"passed","Mon Jun 13 21:15:33 GMT 2022","Mon Jun 13 21:17:20 GMT 2022","106801","","JIT-Dashboard-002c-LISTOF-saving","","JIT-Dashboard-002c-LISTOF-saving","[LIST-OF] As a user, I should save the selected option when switching between tables","[LIST-OF] As a user, I should save the selected option when switching between tables",""
"passed","Mon Jun 13 21:17:34 GMT 2022","Mon Jun 13 21:18:37 GMT 2022","62807","","JIT-Dashboard-004b-CREATEOF-new-column","","JIT-Dashboard-004b-CREATEOF-new-column","[CREATE-OF] As a user, I should add new column in dashboard params","[CREATE-OF] As a user, I should add new column in dashboard params",""
"failed","Mon Jun 13 21:31:42 GMT 2022","Mon Jun 13 21:33:22 GMT 2022","99722","","JIT-Module-004-EMAIL-LOGIN","","JIT-Module-004-EMAIL-LOGIN","[EMAIL-LOGIN] - Check adding and auto-generated API","[EMAIL-LOGIN] - Check adding and auto-generated API",""
"failed","Mon Jun 13 21:33:17 GMT 2022","Mon Jun 13 21:35:02 GMT 2022","104593","","JIT-Module-008b-FB-LOGIN-databse-api","","JIT-Module-008b-FB-LOGIN-databse-api","[FACEBOOK-LOGIN], I check auto-generate column and api","[FACEBOOK-LOGIN], I check auto-generate column and api",""
"passed","Mon Jun 13 21:23:15 GMT 2022","Mon Jun 13 21:24:14 GMT 2022","59074","","JIT-Database-008-Check-validation-column-definition-type-DATE-TIME","","JIT-Database-008-Check-validation-column-definition-type-DATE-TIME","As a user, I should check the validation of DATE column definition","As a user, I should check the validation of DATE column definition",""
"passed","Mon Jun 13 21:23:41 GMT 2022","Mon Jun 13 21:24:36 GMT 2022","55038","","JIT-Database-011d-COLUMN-ENUM-delete-selected-items","","JIT-Database-011d-COLUMN-ENUM-delete-selected-items","As a user, I should delete 1 selected item and check is will be removed in default dropdown","As a user, I should delete 1 selected item and check is will be removed in default dropdown",""
"passed","Mon Jun 13 21:32:13 GMT 2022","Mon Jun 13 21:34:46 GMT 2022","152793","","JIT-Module-006c-SMS-database-api","","JIT-Module-006c-SMS-database-api","[SMS], I check auto-generate column and api","[SMS], I check auto-generate column and api",""
"passed","Mon Jun 13 21:49:36 GMT 2022","Mon Jun 13 21:50:39 GMT 2022","62414","","JIT-API-007b-GET-list-API-Add-new-endpoint","","JIT-API-007b-GET-list-API-Add-new-endpoint","[GET-list-API] Create, update and delete new GET API endpoint","[GET-list-API] Create, update and delete new GET API endpoint",""
"passed","Mon Jun 13 21:19:47 GMT 2022","Mon Jun 13 21:20:44 GMT 2022","57268","","JIT-Dashboard-006c-DELETEOF-saving","","JIT-Dashboard-006c-DELETEOF-saving","[DELETE-OF] As a user, I should save the selected option when switching between tables","[DELETE-OF] As a user, I should save the selected option when switching between tables",""
"passed","Mon Jun 13 21:29:07 GMT 2022","Mon Jun 13 21:32:09 GMT 2022","181647","","JIT-Mobile-026.1.ButtonPreviewCode","","JIT-Mobile-026.1.ButtonPreviewCode","As a user, I should check Preview code of Button component","As a user, I should check Preview code of Button component",""
"passed","Mon Jun 13 21:15:32 GMT 2022","Mon Jun 13 21:17:01 GMT 2022","88733","","JIT-Dashboard-001-Check-general-info","","JIT-Dashboard-001-Check-general-info","As a user, I check general info and update table name","As a user, I check general info and update table name",""
"passed","Mon Jun 13 21:52:44 GMT 2022","Mon Jun 13 21:53:42 GMT 2022","57654","","JIT-API-007e-PUT-API-Add-new-endpoint","","JIT-API-007e-PUT-API-Add-new-endpoint","[PUT-API] Create, update and delete new PUT API endpoint","[PUT-API] Create, update and delete new PUT API endpoint",""
"passed","Mon Jun 13 21:15:32 GMT 2022","Mon Jun 13 21:17:05 GMT 2022","93246","","JIT-Dashboard-003a-DETAILOF-default","","JIT-Dashboard-003a-DETAILOF-default","[DEATIL-OF] As a user, I should add default column in dashboard params","[DEATIL-OF] As a user, I should add default column in dashboard params",""
"passed","Mon Jun 13 21:32:32 GMT 2022","Mon Jun 13 21:33:49 GMT 2022","77592","","JIT-Module-007a-APPLE-LOGIN-default-edit","","JIT-Module-007a-APPLE-LOGIN-default-edit","[APPLE-LOGIN], I can add module Apple Login and edit its infos","[APPLE-LOGIN], I can add module Apple Login and edit its infos",""
"passed","Mon Jun 13 21:31:48 GMT 2022","Mon Jun 13 21:34:08 GMT 2022","140203","","JIT-Module-005b-FORCE-MOBILE-UPDATE-api","","JIT-Module-005b-FORCE-MOBILE-UPDATE-api","[FORCE-MOBILE-UPDATE] - Check adding and auto-table & columns","[FORCE-MOBILE-UPDATE] - Check adding and auto-table & columns",""
"passed","Mon Jun 13 21:45:40 GMT 2022","Mon Jun 13 21:46:40 GMT 2022","59842","","JIT-API-005c-PUT-relation","","JIT-API-005c-PUT-relation","As a user, I check column display when having relation for API PUT","As a user, I check column display when having relation for API PUT",""
