"Status","Start Time","Stop Time","Duration in ms","Parent Suite","Suite","Sub Suite","Test Class","Test Method","Name","Description"
"passed","Thu Nov 03 18:43:57 GMT 2022","Thu Nov 03 18:44:38 GMT 2022","41231","","JIT-Module-017b-GOOGLE-ANAL-edit-infos","","JIT-Module-017b-GOOGLE-ANAL-edit-infos","[GOOGLE-ANAL] As a user, I can update module Google Analytics","[GOOGLE-ANAL] As a user, I can update module Google Analytics",""
"failed","Thu Nov 03 19:30:44 GMT 2022","Thu Nov 03 19:31:17 GMT 2022","32953","","JIT-Database-012d-RELATION-multiple-2-direction","","JIT-Database-012d-RELATION-multiple-2-direction","[RELATION], I should add multiple relation 2 directions","[RELATION], I should add multiple relation 2 directions",""
"passed","Thu Nov 03 18:51:54 GMT 2022","Thu Nov 03 18:53:39 GMT 2022","105615","","JIT-API-002b-GET-list-update-info","","JIT-API-002b-GET-list-update-info","As a user, I update info for GET-list","As a user, I update info for GET-list",""
"passed","Thu Nov 03 18:39:29 GMT 2022","Thu Nov 03 18:40:52 GMT 2022","83343","","JIT-Module-006a-SMS-default","","JIT-Module-006a-SMS-default","[SMS], I can add module SMS login with Twilio and remove it","[SMS], I can add module SMS login with Twilio and remove it",""
"passed","Thu Nov 03 18:41:27 GMT 2022","Thu Nov 03 18:43:14 GMT 2022","107632","","JIT-Module-011a-GUEST-LOGIN-default-edit","","JIT-Module-011a-GUEST-LOGIN-default-edit","[GUEST-LOGIN], I can add module Guest Login and edit its infos","[GUEST-LOGIN], I can add module Guest Login and edit its infos",""
"passed","Thu Nov 03 18:43:43 GMT 2022","Thu Nov 03 18:44:33 GMT 2022","50388","","JIT-Module-016a-SENDGRID-default","","JIT-Module-016a-SENDGRID-default","[SENDGRID] As a user, I can add module SendGrid and remove it","[SENDGRID] As a user, I can add module SendGrid and remove it",""
"broken","Thu Nov 03 19:43:07 GMT 2022","Thu Nov 03 19:45:17 GMT 2022","130337","","JIT-Export-003-Scenario_ROR_2","","JIT-Export-003-Scenario_ROR_2","As a user, I check export the project type ROR no key successfully with scenario 2","As a user, I check export the project type ROR no key successfully with scenario 2",""
"passed","Thu Nov 03 18:26:23 GMT 2022","Thu Nov 03 18:38:53 GMT 2022","750324","","JIT-Mobile-009-SEARCH-Components","","JIT-Mobile-009-SEARCH-Components","[MOBILE-SEARCH] As a user, I search component and drag them to preview screen","[MOBILE-SEARCH] As a user, I search component and drag them to preview screen",""
"passed","Thu Nov 03 18:18:23 GMT 2022","Thu Nov 03 18:19:33 GMT 2022","70152","","JIT-Database-001b-TABLE-empty","","JIT-Database-001b-TABLE-empty","[TABLE] As a user, I cannot create table with empty name","[TABLE] As a user, I cannot create table with empty name",""
"passed","Thu Nov 03 18:20:41 GMT 2022","Thu Nov 03 18:21:43 GMT 2022","62261","","JIT-Database-009-COLUMN-type-BOOLEAN","","JIT-Database-009-COLUMN-type-BOOLEAN","[COLUMN] As a user, I should check the validation of BOOLEAN column definition","[COLUMN] As a user, I should check the validation of BOOLEAN column definition",""
"passed","Thu Nov 03 18:43:50 GMT 2022","Thu Nov 03 18:44:42 GMT 2022","51259","","JIT-Module-016b-SENDGRID-edit-infos","","JIT-Module-016b-SENDGRID-edit-infos","[SENDGRID] As a user, I can update module SendGrid","[SENDGRID] As a user, I can update module SendGrid",""
"passed","Thu Nov 03 18:28:28 GMT 2022","Thu Nov 03 18:29:46 GMT 2022","77320","","JIT-Mobile-022a-TEXT-General-info","","JIT-Mobile-022a-TEXT-General-info","[MOBILE-TEXT] As a user, I should check the general infomation of Text is correct: Name, Key, unique key, delete component","[MOBILE-TEXT] As a user, I should check the general infomation of Text is correct: Name, Key, unique key, delete component",""
"passed","Thu Nov 03 18:17:06 GMT 2022","Thu Nov 03 18:17:59 GMT 2022","53544","","JIT-Dashboard-005e-UPDATEOF-delete-column","","JIT-Dashboard-005e-UPDATEOF-delete-column","[UPDATE-OF] As a user, I should see the params will be removed when column is deleted","[UPDATE-OF] As a user, I should see the params will be removed when column is deleted",""
"passed","Thu Nov 03 18:36:47 GMT 2022","Thu Nov 03 18:37:39 GMT 2022","52503","","JIT-Module-001a-CLOUDINARY-default","","JIT-Module-001a-CLOUDINARY-default","As a user, I can add module Cloudinary and remove it","As a user, I can add module Cloudinary and remove it",""
"passed","Thu Nov 03 18:33:20 GMT 2022","Thu Nov 03 18:34:26 GMT 2022","65991","","JIT-Mobile-034b-SCROLLVIEW-General-info","","JIT-Mobile-034b-SCROLLVIEW-General-info","[MOBILE-SCROLLVIEW] As a user, I should check the general infomation of Scroll View is correct: Name, Key, unique key, delete component","[MOBILE-SCROLLVIEW] As a user, I should check the general infomation of Scroll View is correct: Name, Key, unique key, delete component",""
"broken","Thu Nov 03 19:45:33 GMT 2022","Thu Nov 03 19:46:41 GMT 2022","68805","","JIT-Export-004-Scenario_ROR_2","","JIT-Export-004-Scenario_ROR_2","As a user, I check export the project type ROR with key successfully with scenario 2","As a user, I check export the project type ROR with key successfully with scenario 2",""
