"Status","Start Time","Stop Time","Duration in ms","Parent Suite","Suite","Sub Suite","Test Class","Test Method","Name","Description"
"passed","Thu Nov 03 18:20:11 GMT 2022","Thu Nov 03 18:21:03 GMT 2022","51925","","JIT-Database-008-COLUMN-type-DATE-TIME","","JIT-Database-008-COLUMN-type-DATE-TIME","[COLUMN] As a user, I should check the validation of DATETIME column definition","[COLUMN] As a user, I should check the validation of DATETIME column definition",""
"passed","Thu Nov 03 18:19:45 GMT 2022","Thu Nov 03 18:21:27 GMT 2022","102149","","JIT-Database-004-COLUMN-type-INTEGER","","JIT-Database-004-COLUMN-type-INTEGER","[COLUMN] As a user, I should check the validation of INTEGER column definition","[COLUMN] As a user, I should check the validation of INTEGER column definition",""
"passed","Thu Nov 03 18:13:51 GMT 2022","Thu Nov 03 18:15:40 GMT 2022","109017","","JIT-Dashboard-002e-LISTOF-delete-column","","JIT-Dashboard-002e-LISTOF-delete-column","As a user, I should see the params will be removed when column is deleted","As a user, I should see the params will be removed when column is deleted",""
"passed","Thu Nov 03 18:29:06 GMT 2022","Thu Nov 03 18:30:23 GMT 2022","76509","","JIT-Mobile-026b-BUTTON-General-info","","JIT-Mobile-026b-BUTTON-General-info","[MOBILE-BUTTON] As a user, I should check the general infomation of Button is correct: Name, Key, unique key, delete component","[MOBILE-BUTTON] As a user, I should check the general infomation of Button is correct: Name, Key, unique key, delete component",""
"passed","Thu Nov 03 19:47:04 GMT 2022","Thu Nov 03 19:47:43 GMT 2022","39691","","JIT-Export-007-Existing-Scenario-ROR-withkey","","JIT-Export-007-Existing-Scenario-ROR-withkey","As a user, I check export the existing project type ROR with key successfully","As a user, I check export the existing project type ROR with key successfully",""
"passed","Thu Nov 03 18:21:20 GMT 2022","Thu Nov 03 18:22:13 GMT 2022","52631","","JIT-Database-011a-COLUMN-ENUM-default","","JIT-Database-011a-COLUMN-ENUM-default","[COLUMN] As a user, I should check the basic validation","[COLUMN] As a user, I should check the basic validation",""
"passed","Thu Nov 03 18:34:31 GMT 2022","Thu Nov 03 18:37:39 GMT 2022","188613","","JIT-Mobile-041b-PREVIEW-NAVIGATION-with-navigation-setup","","JIT-Mobile-041b-PREVIEW-NAVIGATION-with-navigation-setup","[MOBILE-PREVIEW-NAVIGATION] As a user, I could open preview screen with setting the screen navigation","[MOBILE-PREVIEW-NAVIGATION] As a user, I could open preview screen with setting the screen navigation",""
"broken","Thu Nov 03 19:30:30 GMT 2022","Thu Nov 03 19:31:43 GMT 2022","73050","","JIT-Database-012c-RELATION-multiple-1-direction","","JIT-Database-012c-RELATION-multiple-1-direction","[RELATION], I should add multiple relation 1 direction","[RELATION], I should add multiple relation 1 direction",""
"passed","Thu Nov 03 20:02:39 GMT 2022","Thu Nov 03 20:09:15 GMT 2022","396564","","JIT-Preview-001-Preview-[NEW]-NextJS-TODO","","JIT-Preview-001-Preview-[NEW]-NextJS-TODO","[PREVIEW-NEW] As a user, I check preview function for project TODO with NextJS","[PREVIEW-NEW] As a user, I check preview function for project TODO with NextJS",""
"passed","Thu Nov 03 18:56:16 GMT 2022","Thu Nov 03 18:57:19 GMT 2022","62773","","JIT-API-007f-DELETE-API-Add-new-endpoint","","JIT-API-007f-DELETE-API-Add-new-endpoint","[DELETE-API] Create, update and delete new DELETE API endpoint","[DELETE-API] Create, update and delete new DELETE API endpoint",""
"passed","Thu Nov 03 18:48:34 GMT 2022","Thu Nov 03 18:51:33 GMT 2022","179632","","JIT-Web-004b-ACTION-NAVIGATION-with-param","","JIT-Web-004b-ACTION-NAVIGATION-with-param","[WEB-ACTION-NAVIGATION] As a user, I could add action type navigation with params and check preview code","[WEB-ACTION-NAVIGATION] As a user, I could add action type navigation with params and check preview code",""
"broken","Thu Nov 03 19:42:57 GMT 2022","Thu Nov 03 19:45:10 GMT 2022","132954","","JIT-Export-001-Scenario_ROR_1","","JIT-Export-001-Scenario_ROR_1","As a user, I check export the project type ROR no key successfully with scenario 1","As a user, I check export the project type ROR no key successfully with scenario 1",""
"passed","Thu Nov 03 19:46:14 GMT 2022","Thu Nov 03 19:46:58 GMT 2022","43223","","JIT-Export-006-Existing-Scenario-ROR-nokey","","JIT-Export-006-Existing-Scenario-ROR-nokey","As a user, I check export the existing project type ROR no key successfully","As a user, I check export the existing project type ROR no key successfully",""
"passed","Thu Nov 03 18:26:12 GMT 2022","Thu Nov 03 18:28:01 GMT 2022","108475","","JIT-Mobile-005b-MOLECULE-Navigate-edit-screen","","JIT-Mobile-005b-MOLECULE-Navigate-edit-screen","[MOBILE-MOLECULE-EDIT] As a user, I can see the molecule in Screen and use Edit button see the content of this molecule","[MOBILE-MOLECULE-EDIT] As a user, I can see the molecule in Screen and use Edit button see the content of this molecule",""
"broken","Thu Nov 03 19:31:53 GMT 2022","Thu Nov 03 19:33:02 GMT 2022","68828","","JIT-Database-014-DEFECT-Check-duplicate-table-name","","JIT-Database-014-DEFECT-Check-duplicate-table-name","[DEFECT] As a user, I cannot update to duplicate name","[DEFECT] As a user, I cannot update to duplicate name",""
"passed","Thu Nov 03 18:39:57 GMT 2022","Thu Nov 03 18:41:10 GMT 2022","73111","","JIT-Module-006b-SMS-edit-infos","","JIT-Module-006b-SMS-edit-infos","[SMS], I can add module SMS login with Twilio and edit its infos","[SMS], I can add module SMS login with Twilio and edit its infos",""
"passed","Thu Nov 03 19:31:25 GMT 2022","Thu Nov 03 19:32:07 GMT 2022","41752","","JIT-Dashboard-002d-LISTOF-delete-table","","JIT-Dashboard-002d-LISTOF-delete-table","[LIST-OF] As a user, I should see the table is not displayed in dashboard list after removed","[LIST-OF] As a user, I should see the table is not displayed in dashboard list after removed",""
"passed","Thu Nov 03 19:19:33 GMT 2022","Thu Nov 03 19:20:17 GMT 2022","44579","","JIT-Dashboard-003d-DETAILOF-delete-table","","JIT-Dashboard-003d-DETAILOF-delete-table","[DEATIL-OF] As a user, I should see the table is not displayed in dashboard list after removed","[DEATIL-OF] As a user, I should see the table is not displayed in dashboard list after removed",""
"failed","Thu Nov 03 19:30:08 GMT 2022","Thu Nov 03 19:30:36 GMT 2022","27515","","JIT-Database-012b-RELATION-empty-duplicate","","JIT-Database-012b-RELATION-empty-duplicate","[RELATION], I should see the error duplicate when leaving foreign key empty","[RELATION], I should see the error duplicate when leaving foreign key empty",""
"passed","Thu Nov 03 18:13:50 GMT 2022","Thu Nov 03 18:14:50 GMT 2022","59954","","JIT-Dashboard-002c-LISTOF-saving","","JIT-Dashboard-002c-LISTOF-saving","[LIST-OF] As a user, I should save the selected option when switching between tables","[LIST-OF] As a user, I should save the selected option when switching between tables",""
"passed","Thu Nov 03 18:16:50 GMT 2022","Thu Nov 03 18:17:47 GMT 2022","57451","","JIT-Dashboard-005d-UPDATEOF-delete-table","","JIT-Dashboard-005d-UPDATEOF-delete-table","[UPDATE-OF] As a user, I should see the table is not displayed in dashboard list after removed","[UPDATE-OF] As a user, I should see the table is not displayed in dashboard list after removed",""
"passed","Thu Nov 03 18:26:28 GMT 2022","Thu Nov 03 18:27:30 GMT 2022","62303","","JIT-Mobile-011-JITDEF50-disable-add-duplicate-screen-in-stack","","JIT-Mobile-011-JITDEF50-disable-add-duplicate-screen-in-stack","[DEFECT] As a user, I could add duplicate screen in stack","[DEFECT] As a user, I could add duplicate screen in stack",""
"passed","Thu Nov 03 19:20:50 GMT 2022","Thu Nov 03 19:22:11 GMT 2022","80627","","JIT-Dashboard-004b-CREATEOF-new-column","","JIT-Dashboard-004b-CREATEOF-new-column","[CREATE-OF] As a user, I should add new column in dashboard params","[CREATE-OF] As a user, I should add new column in dashboard params",""
"passed","Thu Nov 03 19:26:27 GMT 2022","Thu Nov 03 19:27:15 GMT 2022","48453","","JIT-Dashboard-006a-DELETEOF-default","","JIT-Dashboard-006a-DELETEOF-default","[DELETE-OF] As a user, I should add default column in dashboard params","[DELETE-OF] As a user, I should add default column in dashboard params",""
"passed","Thu Nov 03 18:55:00 GMT 2022","Thu Nov 03 18:57:01 GMT 2022","121098","","JIT-API-007c-GET-detail-API-Add-new-endpoint","","JIT-API-007c-GET-detail-API-Add-new-endpoint","[GET-detail-API] Create, update and delete new GET API endpoint","[GET-detail-API] Create, update and delete new GET API endpoint",""
"failed","Thu Nov 03 19:35:20 GMT 2022","Thu Nov 03 19:35:41 GMT 2022","20897","","JIT-API-001-Check-general-info","","JIT-API-001-Check-general-info","As a user, I check general info","As a user, I check general info",""
"passed","Thu Nov 03 18:42:08 GMT 2022","Thu Nov 03 18:42:56 GMT 2022","48154","","JIT-Module-013a-AWS-default","","JIT-Module-013a-AWS-default","[AWS] As a user, I can add module AWS SES Integration and remove it","[AWS] As a user, I can add module AWS SES Integration and remove it",""
"passed","Thu Nov 03 18:57:29 GMT 2022","Thu Nov 03 18:58:45 GMT 2022","76218","","JIT-Database-015d-INDEX-STRING-column-config","","JIT-Database-015d-INDEX-STRING-column-config","[INDEX-STRING] As a user, I config index from column setting && check on index popup","[INDEX-STRING] As a user, I config index from column setting && check on index popup",""
"passed","Thu Nov 03 18:17:36 GMT 2022","Thu Nov 03 18:18:25 GMT 2022","49158","","JIT-Dashboard-006c-DELETEOF-saving","","JIT-Dashboard-006c-DELETEOF-saving","[DELETE-OF] As a user, I should save the selected option when switching between tables","[DELETE-OF] As a user, I should save the selected option when switching between tables",""
"passed","Thu Nov 03 18:43:52 GMT 2022","Thu Nov 03 18:44:38 GMT 2022","45679","","JIT-Module-017a-GOOGLE-ANAL-default","","JIT-Module-017a-GOOGLE-ANAL-default","[GOOGLE-ANAL] As a user, I can add module Google Analytics and remove it","[GOOGLE-ANAL] As a user, I can add module Google Analytics and remove it",""
"passed","Thu Nov 03 18:55:10 GMT 2022","Thu Nov 03 18:56:21 GMT 2022","70918","","JIT-API-007d-POST-API-Add-new-endpoint","","JIT-API-007d-POST-API-Add-new-endpoint","[GET-POST] Create, update and delete new POST API endpoint","[GET-POST] Create, update and delete new POST API endpoint",""
"failed","Thu Nov 03 19:34:19 GMT 2022","Thu Nov 03 19:35:10 GMT 2022","51607","","JIT-Mobile-022d-TEXT-Check-PADDING-MARGIN","","JIT-Mobile-022d-TEXT-Check-PADDING-MARGIN","[MOBILE-TEXT] As a user, I should check the PADDING & MARGIN infomation of Text is correct: Top, Bottom, Right, Left.","[MOBILE-TEXT] As a user, I should check the PADDING & MARGIN infomation of Text is correct: Top, Bottom, Right, Left.",""
"passed","Thu Nov 03 18:35:55 GMT 2022","Thu Nov 03 18:42:36 GMT 2022","401021","","JIT-Mobile-043a-ACTION-AUTHENTICATION-PHONE-no-param","","JIT-Mobile-043a-ACTION-AUTHENTICATION-PHONE-no-param","[MOBILE-ACTION-AUTHENTICATION-PHONE] As a user, I could add action type authentication without params and check preview code","[MOBILE-ACTION-AUTHENTICATION-PHONE] As a user, I could add action type authentication without params and check preview code",""
"passed","Thu Nov 03 18:44:48 GMT 2022","Thu Nov 03 18:45:28 GMT 2022","40166","","JIT-Module-019b-GOOGLE-ANALYTICS-edit-infos","","JIT-Module-019b-GOOGLE-ANALYTICS-edit-infos","[GOOGLE-ANALYTICS] As a user, I can update module Google Analytics information for each environment","[GOOGLE-ANALYTICS] As a user, I can update module Google Analytics information for each environment",""
"passed","Thu Nov 03 19:28:40 GMT 2022","Thu Nov 03 19:29:46 GMT 2022","66164","","JIT-Database-005-COLUMN-type-FLOAT","","JIT-Database-005-COLUMN-type-FLOAT","[COLUMN] As a user, I should check the validation of FLOAT column definition","[COLUMN] As a user, I should check the validation of FLOAT column definition",""
"passed","Thu Nov 03 18:42:13 GMT 2022","Thu Nov 03 18:43:08 GMT 2022","55227","","JIT-Module-013b-AWS-edit-infos","","JIT-Module-013b-AWS-edit-infos","[AWS] As a user, I can update module AWS SES Integration","[AWS] As a user, I can update module AWS SES Integration",""
"passed","Thu Nov 03 18:35:08 GMT 2022","Thu Nov 03 18:40:35 GMT 2022","327778","","JIT-Mobile-042b-ACTION-NAVIGATION-with-param","","JIT-Mobile-042b-ACTION-NAVIGATION-with-param","[MOBILE-ACTION-NAVIGATION] As a user, I could add action type navigation with params and check preview code","[MOBILE-ACTION-NAVIGATION] As a user, I could add action type navigation with params and check preview code",""
"broken","Thu Nov 03 19:22:17 GMT 2022","Thu Nov 03 19:26:19 GMT 2022","242283","","JIT-Dashboard-001-Check-general-info","","JIT-Dashboard-001-Check-general-info","As a user, I check general info and update table name","As a user, I check general info and update table name",""
"passed","Thu Nov 03 18:25:03 GMT 2022","Thu Nov 03 18:25:37 GMT 2022","33905","","JIT-Mobile-003-SCREEN-Delete","","JIT-Mobile-003-SCREEN-Delete","[MOBILE-SCREEN] As a user, I can delete screen","[MOBILE-SCREEN] As a user, I can delete screen",""
"failed","Thu Nov 03 19:35:48 GMT 2022","Thu Nov 03 19:37:34 GMT 2022","105760","","JIT-Database-015c-INDEX-CRUD-multiple","","JIT-Database-015c-INDEX-CRUD-multiple","[INDEX] As a user, I check add and update single index","[INDEX] As a user, I check add and update single index",""
"passed","Thu Nov 03 18:13:51 GMT 2022","Thu Nov 03 18:15:16 GMT 2022","84940","","JIT-Authorization-002-GROUP-search","","JIT-Authorization-002-GROUP-search","[AUTH - GROUP] As a user, I want to create multiple new group authorization and search","[AUTH - GROUP] As a user, I want to create multiple new group authorization and search",""
"passed","Thu Nov 03 18:15:56 GMT 2022","Thu Nov 03 18:16:53 GMT 2022","56922","","JIT-Dashboard-004d-CREATEOF-delete-table","","JIT-Dashboard-004d-CREATEOF-delete-table","[CREATE-OF] As a user, I should see the table is not displayed in dashboard list after removed","[CREATE-OF] As a user, I should see the table is not displayed in dashboard list after removed",""
"passed","Thu Nov 03 18:21:03 GMT 2022","Thu Nov 03 18:22:55 GMT 2022","112294","","JIT-Database-010b-COLUMN-FILE-format-file","","JIT-Database-010b-COLUMN-FILE-format-file","[COLUMN] As a user, I should check the validation of FILE column definition for Format Area","[COLUMN] As a user, I should check the validation of FILE column definition for Format Area",""
"passed","Thu Nov 03 18:20:56 GMT 2022","Thu Nov 03 18:21:53 GMT 2022","56486","","JIT-Database-010a-COLUMN-FILE-validation","","JIT-Database-010a-COLUMN-FILE-validation","[COLUMN] As a user, I should check the validation of FILE column definition","[COLUMN] As a user, I should check the validation of FILE column definition",""
"passed","Thu Nov 03 18:45:27 GMT 2022","Thu Nov 03 18:46:40 GMT 2022","73378","","JIT-Team-005-Invite-duplicate-email","","JIT-Team-005-Invite-duplicate-email","[INVITE-DELETE] Invite new email and invite again","[INVITE-DELETE] Invite new email and invite again",""
"passed","Thu Nov 03 18:45:26 GMT 2022","Thu Nov 03 18:46:55 GMT 2022","89127","","JIT-Web-001a-PAGE-Create-new","","JIT-Web-001a-PAGE-Create-new","[PAGE] As a user, I can create new screen with positive and negative cases","[PAGE] As a user, I can create new screen with positive and negative cases",""
"passed","Thu Nov 03 19:20:24 GMT 2022","Thu Nov 03 19:21:28 GMT 2022","64582","","JIT-Module-009a-GOOGLE-LOGIN-default-edit","","JIT-Module-009a-GOOGLE-LOGIN-default-edit","[GOOGLE-LOGIN], I can add module Google Login and edit its infos","[GOOGLE-LOGIN], I can add module Google Login and edit its infos",""
"passed","Thu Nov 03 18:21:51 GMT 2022","Thu Nov 03 18:22:50 GMT 2022","59193","","JIT-Database-011b-COLUMN-ENUM-add-items","","JIT-Database-011b-COLUMN-ENUM-add-items","[COLUMN] As a user, I should add new item and select in default dropdown","[COLUMN] As a user, I should add new item and select in default dropdown",""
"passed","Thu Nov 03 18:39:26 GMT 2022","Thu Nov 03 18:41:23 GMT 2022","117014","","JIT-Module-005b-FORCE-MOBILE-UPDATE-api","","JIT-Module-005b-FORCE-MOBILE-UPDATE-api","[FORCE-MOBILE-UPDATE] - Check api","[FORCE-MOBILE-UPDATE] - Check api",""
"broken","Thu Nov 03 19:22:52 GMT 2022","Thu Nov 03 19:26:55 GMT 2022","242600","","JIT-Dashboard-005a-UPDATEOF-default","","JIT-Dashboard-005a-UPDATEOF-default","[UPDATE-OF] As a user, I should add default column in dashboard params","[UPDATE-OF] As a user, I should add default column in dashboard params",""
"passed","Thu Nov 03 19:39:31 GMT 2022","Thu Nov 03 19:40:21 GMT 2022","49433","","JIT-Database-015k-INDEX-BOOLEAN-column-config","","JIT-Database-015k-INDEX-BOOLEAN-column-config","[INDEX-BOOLEAN] As a user, I config index from column setting && check on index popup","[INDEX-BOOLEAN] As a user, I config index from column setting && check on index popup",""
"passed","Thu Nov 03 18:37:41 GMT 2022","Thu Nov 03 18:38:24 GMT 2022","43165","","JIT-Module-002a-DEEPLINK-default","","JIT-Module-002a-DEEPLINK-default","As a user, I can add module Deeplink and remove it","As a user, I can add module Deeplink and remove it",""
"passed","Thu Nov 03 18:26:15 GMT 2022","Thu Nov 03 18:27:13 GMT 2022","57668","","JIT-Mobile-007-MOLECULE-Delete","","JIT-Mobile-007-MOLECULE-Delete","[MOBILE-MOLECULE] As a user, I can delete molecule","[MOBILE-MOLECULE] As a user, I can delete molecule",""
"broken","Thu Nov 03 19:45:23 GMT 2022","Thu Nov 03 19:49:04 GMT 2022","221430","","JIT-Export-002-Scenario-ROR-withkey-1","","JIT-Export-002-Scenario-ROR-withkey-1","As a user, I check export the project type ROR with key successfully with scenario 1","As a user, I check export the project type ROR with key successfully with scenario 1",""
"passed","Thu Nov 03 19:49:27 GMT 2022","Thu Nov 03 19:50:48 GMT 2022","80509","","JIT-Export-010a-Export-RoR-TODO","","JIT-Export-010a-Export-RoR-TODO","[SMOKE] As a user, I check exprting project TODO with RoR","[SMOKE] As a user, I check exprting project TODO with RoR",""
"passed","Thu Nov 03 18:53:39 GMT 2022","Thu Nov 03 18:55:01 GMT 2022","82431","","JIT-API-007ba-GET-list-API-Add-new-endpoint","","JIT-API-007ba-GET-list-API-Add-new-endpoint","[GET-list-API] Create, update and delete new GET API endpoint","[GET-list-API] Create, update and delete new GET API endpoint",""
"passed","Thu Nov 03 18:40:42 GMT 2022","Thu Nov 03 18:42:22 GMT 2022","99123","","JIT-Module-008a-FB-LOGIN-default-edit","","JIT-Module-008a-FB-LOGIN-default-edit","[FACEBOOK-LOGIN], I can add module Facebook Login and edit its infos","[FACEBOOK-LOGIN], I can add module Facebook Login and edit its infos",""
"passed","Thu Nov 03 18:35:00 GMT 2022","Thu Nov 03 18:36:53 GMT 2022","112847","","JIT-Mobile-042a-ACTION-NAVIGATION-no-param","","JIT-Mobile-042a-ACTION-NAVIGATION-no-param","[MOBILE-ACTION-NAVIGATION] As a user, I could add action type navigation without params and check preview code","[MOBILE-ACTION-NAVIGATION] As a user, I could add action type navigation without params and check preview code",""
"passed","Thu Nov 03 18:26:51 GMT 2022","Thu Nov 03 18:28:07 GMT 2022","75728","","JIT-Mobile-013-JITDEF-reflect-delete-screen-innavigation-tree","","JIT-Mobile-013-JITDEF-reflect-delete-screen-innavigation-tree","[DEFECT] As a user, I should see screen will be removed in navigation tree after deleting screen","[DEFECT] As a user, I should see screen will be removed in navigation tree after deleting screen",""
"passed","Thu Nov 03 18:26:01 GMT 2022","Thu Nov 03 18:27:20 GMT 2022","79403","","JIT-Mobile-005-MOLECULE-Create-new","","JIT-Mobile-005-MOLECULE-Create-new","[MOBILE-MOLECULE] As a user, I can create new molecule with positive and negative cases","[MOBILE-MOLECULE] As a user, I can create new molecule with positive and negative cases",""
"passed","Thu Nov 03 18:28:29 GMT 2022","Thu Nov 03 18:33:37 GMT 2022","308299","","JIT-Mobile-022b-TEXT-Check-TEXT","","JIT-Mobile-022b-TEXT-Check-TEXT","[MOBILE-TEXT] As a user, I should check the TEXT infomation of Text is correct: Text content, Font, Size, Font weight, Line Height, Spacing, Color, Italic, Underline","[MOBILE-TEXT] As a user, I should check the TEXT infomation of Text is correct: Text content, Font, Size, Font weight, Line Height, Spacing, Color, Italic, Underline",""
"passed","Thu Nov 03 18:38:26 GMT 2022","Thu Nov 03 18:39:22 GMT 2022","55831","","JIT-Module-004a-EMAIL-LOGIN-default","","JIT-Module-004a-EMAIL-LOGIN-default","[EMAIL-LOGIN] - Check adding and auto-generated API","[EMAIL-LOGIN] - Check adding and auto-generated API",""
"passed","Thu Nov 03 18:41:26 GMT 2022","Thu Nov 03 18:43:14 GMT 2022","107189","","JIT-Module-010a-LINE-LOGIN-default-edit","","JIT-Module-010a-LINE-LOGIN-default-edit","[LINE-LOGIN], I can add module Line Login and edit its infos","[LINE-LOGIN], I can add module Line Login and edit its infos",""
"passed","Thu Nov 03 19:28:06 GMT 2022","Thu Nov 03 19:28:30 GMT 2022","24105","","JIT-Database-003a-COLUMN-empty","","JIT-Database-003a-COLUMN-empty","[COLUMN] As a user, I cannot add empty column definition","[COLUMN] As a user, I cannot add empty column definition",""
"passed","Thu Nov 03 18:24:11 GMT 2022","Thu Nov 03 18:25:46 GMT 2022","94781","","JIT-Database-015a-INDEX-Check-duplicate-empty","","JIT-Database-015a-INDEX-Check-duplicate-empty","[INDEX] As a user, I check empty and duplicate index","[INDEX] As a user, I check empty and duplicate index",""
"passed","Thu Nov 03 18:15:53 GMT 2022","Thu Nov 03 18:16:39 GMT 2022","46155","","JIT-Dashboard-004c-CREATEOF-saving","","JIT-Dashboard-004c-CREATEOF-saving","[CREATE-OF] As a user, I should save the selected option when switching between tables","[CREATE-OF] As a user, I should save the selected option when switching between tables",""
"passed","Thu Nov 03 18:28:27 GMT 2022","Thu Nov 03 18:29:41 GMT 2022","73074","","JIT-Mobile-021-DEFECT.Params.keep-params-after-refresh-page","","JIT-Mobile-021-DEFECT.Params.keep-params-after-refresh-page","[DEFECT] As a user, I should check the params will be kept after refresh page","[DEFECT] As a user, I should check the params will be kept after refresh page",""
"passed","Thu Nov 03 18:31:33 GMT 2022","Thu Nov 03 18:34:21 GMT 2022","167510","","JIT-Mobile-031a-DIVIDER-Check-PreviewCode","","JIT-Mobile-031a-DIVIDER-Check-PreviewCode","[MOBILE-DIVIDER] As a user, I should check the Preview code of Divider component","[MOBILE-DIVIDER] As a user, I should check the Preview code of Divider component",""
"passed","Thu Nov 03 18:44:37 GMT 2022","Thu Nov 03 18:46:32 GMT 2022","114867","","JIT-Module-018c-ADMIN-DASHBOARD-USER-column-infos","","JIT-Module-018c-ADMIN-DASHBOARD-USER-column-infos","[ADMIN-DASHBOARD-USER], I check the column infos from Admin Dashboard User","[ADMIN-DASHBOARD-USER], I check the column infos from Admin Dashboard User",""
"passed","Thu Nov 03 18:16:24 GMT 2022","Thu Nov 03 18:17:15 GMT 2022","51586","","JIT-Dashboard-005b-UPDATEOF-new-column","","JIT-Dashboard-005b-UPDATEOF-new-column","[UPDATE-OF] As a user, I should add new column in dashboard params","[UPDATE-OF] As a user, I should add new column in dashboard params",""
"passed","Thu Nov 03 19:00:20 GMT 2022","Thu Nov 03 19:02:21 GMT 2022","121188","","JIT-Database-015i-INDEX-DATETIME-column-config","","JIT-Database-015i-INDEX-DATETIME-column-config","[INDEX-DATETIME] As a user, I config index from column setting && check on index popup","[INDEX-DATETIME] As a user, I config index from column setting && check on index popup",""
"passed","Thu Nov 03 18:45:59 GMT 2022","Thu Nov 03 18:48:31 GMT 2022","152029","","JIT-Web-001e-PAGE-Search","","JIT-Web-001e-PAGE-Search","[WEB-PAGE] As a user, I can search correct screen with keyword","[WEB-PAGE] As a user, I can search correct screen with keyword",""
"broken","Thu Nov 03 19:33:10 GMT 2022","Thu Nov 03 19:34:22 GMT 2022","71506","","JIT-Database-016b-COUNTER-CACHE-Create-by-adding-column","","JIT-Database-016b-COUNTER-CACHE-Create-by-adding-column","[COUNTER-CACHE] create new counter cache column by adding column","[COUNTER-CACHE] create new counter cache column by adding column",""
"passed","Thu Nov 03 18:18:14 GMT 2022","Thu Nov 03 18:18:55 GMT 2022","40374","","JIT-Database-001a-TABLE-new","","JIT-Database-001a-TABLE-new","[TABLE] As a user, I can create new table","[TABLE] As a user, I can create new table",""
"passed","Thu Nov 03 18:43:28 GMT 2022","Thu Nov 03 18:44:12 GMT 2022","44043","","JIT-Module-015b-SCOUT-edit-infos","","JIT-Module-015b-SCOUT-edit-infos","[SCOUT] As a user, I can update module Scout","[SCOUT] As a user, I can update module Scout",""
"passed","Thu Nov 03 18:44:38 GMT 2022","Thu Nov 03 18:45:24 GMT 2022","45558","","JIT-Module-019a-GOOGLE-ANALYTICS-default","","JIT-Module-019a-GOOGLE-ANALYTICS-default","[GOOGLE-ANALYTICS] As a user, I can add module Google Analytics and remove it","[GOOGLE-ANALYTICS] As a user, I can add module Google Analytics and remove it",""
"passed","Thu Nov 03 18:19:18 GMT 2022","Thu Nov 03 18:20:45 GMT 2022","87618","","JIT-Database-003b-COLUMN-duplicated","","JIT-Database-003b-COLUMN-duplicated","[COLUMN] As a user, I cannot add duplicated column definition","[COLUMN] As a user, I cannot add duplicated column definition",""
"passed","Thu Nov 03 18:30:30 GMT 2022","Thu Nov 03 18:31:39 GMT 2022","68979","","JIT-Mobile-029b-TOUCHABLE-General-info","","JIT-Mobile-029b-TOUCHABLE-General-info","[MOBILE-TOUCHABLE] As a user, I should check the general infomation of Touchable is correct: Name, Key, unique key, delete component","[MOBILE-TOUCHABLE] As a user, I should check the general infomation of Touchable is correct: Name, Key, unique key, delete component",""
