"Status","Start Time","Stop Time","Duration in ms","Parent Suite","Suite","Sub Suite","Test Class","Test Method","Name","Description"
"passed","Thu Nov 03 18:34:04 GMT 2022","Thu Nov 03 18:35:18 GMT 2022","73940","","JIT-Mobile-035b-FLATLIST-General-info","","JIT-Mobile-035b-FLATLIST-General-info","[MOBILE-FLATLIST] As a user, I should check the general infomation of FlatList is correct: Name, Key, unique key, delete component","[MOBILE-FLATLIST] As a user, I should check the general infomation of FlatList is correct: Name, Key, unique key, delete component",""
"passed","Thu Nov 03 18:47:21 GMT 2022","Thu Nov 03 18:49:33 GMT 2022","131560","","JIT-Web-002e-MOLECULE-Search","","JIT-Web-002e-MOLECULE-Search","[WEB-PAGE] As a user, I can search correct molecule with keyword","[WEB-PAGE] As a user, I can search correct molecule with keyword",""
"passed","Thu Nov 03 18:19:07 GMT 2022","Thu Nov 03 18:19:34 GMT 2022","27614","","JIT-Database-002-COLUMN-default","","JIT-Database-002-COLUMN-default","[COLUMN] As a user, I should see the default column definition","[COLUMN] As a user, I should see the default column definition",""
"passed","Thu Nov 03 18:37:37 GMT 2022","Thu Nov 03 18:38:51 GMT 2022","73344","","JIT-Module-001b-CLOUDINARY-edit-infos","","JIT-Module-001b-CLOUDINARY-edit-infos","As a user, I can update module Cloudinary","As a user, I can update module Cloudinary",""
"passed","Thu Nov 03 19:22:07 GMT 2022","Thu Nov 03 19:22:46 GMT 2022","39142","","JIT-Dashboard-004e-CREATEOF-delete-column","","JIT-Dashboard-004e-CREATEOF-delete-column","[CREATE-OF] As a user, I should see the params will be removed when column is deleted","[CREATE-OF] As a user, I should see the params will be removed when column is deleted",""
"passed","Thu Nov 03 18:32:22 GMT 2022","Thu Nov 03 18:33:30 GMT 2022","67611","","JIT-Mobile-032b-CAROUSEL-General-info","","JIT-Mobile-032b-CAROUSEL-General-info","[MOBILE-CAROUSEL] As a user, I should check the general infomation of Carousel is correct: Name, Key, unique key, delete component","[MOBILE-CAROUSEL] As a user, I should check the general infomation of Carousel is correct: Name, Key, unique key, delete component",""
"passed","Thu Nov 03 19:18:53 GMT 2022","Thu Nov 03 19:19:30 GMT 2022","36692","","JIT-Dashboard-003c-DETAILOF-saving","","JIT-Dashboard-003c-DETAILOF-saving","[DEATIL-OF] As a user, I should save the selected option when switching between tables","[DEATIL-OF] As a user, I should save the selected option when switching between tables",""
"passed","Thu Nov 03 18:22:05 GMT 2022","Thu Nov 03 18:23:08 GMT 2022","63141","","JIT-Database-011c-COLUMN-ENUM-delete-items","","JIT-Database-011c-COLUMN-ENUM-delete-items","[COLUMN] As a user, I should delete 1 item and check not display in default dropdown","[COLUMN] As a user, I should delete 1 item and check not display in default dropdown",""
"passed","Thu Nov 03 18:17:59 GMT 2022","Thu Nov 03 18:18:50 GMT 2022","50704","","JIT-Dashboard-006e-DELETEOF-delete-column","","JIT-Dashboard-006e-DELETEOF-delete-column","[DELETE-OF] As a user, I should see the params will be removed when column is deleted","[DELETE-OF] As a user, I should see the params will be removed when column is deleted",""
"passed","Thu Nov 03 18:58:57 GMT 2022","Thu Nov 03 19:00:09 GMT 2022","72113","","JIT-Database-015f-INDEX-INTEGER-column-config","","JIT-Database-015f-INDEX-INTEGER-column-config","[INDEX-INTEGER] As a user, I config index from column setting && check on index popup","[INDEX-INTEGER] As a user, I config index from column setting && check on index popup",""
"passed","Thu Nov 03 18:30:17 GMT 2022","Thu Nov 03 18:31:31 GMT 2022","73724","","JIT-Mobile-028b-ICON-General-info","","JIT-Mobile-028b-ICON-General-info","[MOBILE-ICON] As a user, I should check the general infomation of Icon is correct: Name, Key, unique key, delete component","[MOBILE-ICON] As a user, I should check the general infomation of Icon is correct: Name, Key, unique key, delete component",""
"passed","Thu Nov 03 18:42:30 GMT 2022","Thu Nov 03 18:43:20 GMT 2022","50467","","JIT-Module-014a-BASIC-AUTH-default","","JIT-Module-014a-BASIC-AUTH-default","[BASIC-AUTH] As a user, I can add module Basic Authentication and remove it","[BASIC-AUTH] As a user, I can add module Basic Authentication and remove it",""
"broken","Thu Nov 03 19:27:22 GMT 2022","Thu Nov 03 19:28:28 GMT 2022","66305","","JIT-Database-001d-TABLE-update","","JIT-Database-001d-TABLE-update","[TABLE] As a user, I can update the value of the table","[TABLE] As a user, I can update the value of the table",""
"passed","Thu Nov 03 18:26:35 GMT 2022","Thu Nov 03 18:27:42 GMT 2022","67249","","JIT-Mobile-012-JITDEF-remove-poperty-info-after-deleting-navigation","","JIT-Mobile-012-JITDEF-remove-poperty-info-after-deleting-navigation","[DEFECT] As a user, I should see the property infos need to be removed after the navigation was deleted","[DEFECT] As a user, I should see the property infos need to be removed after the navigation was deleted",""
"passed","Thu Nov 03 18:24:50 GMT 2022","Thu Nov 03 18:25:56 GMT 2022","65921","","JIT-Mobile-001a-SCREEN-Search","","JIT-Mobile-001a-SCREEN-Search","[MOBILE-SCREEN] As a user, I can search correct screen with keyword","[MOBILE-SCREEN] As a user, I can search correct screen with keyword",""
"passed","Thu Nov 03 18:27:02 GMT 2022","Thu Nov 03 18:28:52 GMT 2022","109774","","JIT-Mobile-014-JITDEF-status-bar","","JIT-Mobile-014-JITDEF-status-bar","[DEFECT] As a user, I should see screen will be removed in navigation tree after deleting screen","[DEFECT] As a user, I should see screen will be removed in navigation tree after deleting screen",""
"passed","Thu Nov 03 18:34:23 GMT 2022","Thu Nov 03 18:44:01 GMT 2022","578401","","JIT-Mobile-039a-OTP-Check-PreviewCode","","JIT-Mobile-039a-OTP-Check-PreviewCode","[MOBILE-OTP] As a user, I should check the Preview code of OTP component","[MOBILE-OTP] As a user, I should check the Preview code of OTP component",""
"passed","Thu Nov 03 18:46:05 GMT 2022","Thu Nov 03 18:47:41 GMT 2022","95881","","JIT-Web-002a-MOLECULE-Create-new","","JIT-Web-002a-MOLECULE-Create-new","[WEB-MOLECULE] As a user, I can create new molecule with positive and negative cases","[WEB-MOLECULE] As a user, I can create new molecule with positive and negative cases",""
"passed","Thu Nov 03 18:34:25 GMT 2022","Thu Nov 03 18:35:20 GMT 2022","54118","","JIT-Mobile-041a-PREVIEW-NAVIGATION-no-navigation-setup","","JIT-Mobile-041a-PREVIEW-NAVIGATION-no-navigation-setup","[MOBILE-PREVIEW-NAVIGATION] As a user, I could open preview screen with notification should setup the screen navigation","[MOBILE-PREVIEW-NAVIGATION] As a user, I could open preview screen with notification should setup the screen navigation",""
"passed","Thu Nov 03 18:34:05 GMT 2022","Thu Nov 03 18:36:09 GMT 2022","124374","","JIT-Mobile-036a-DATETIMEPICKER-Check-PreviewCode","","JIT-Mobile-036a-DATETIMEPICKER-Check-PreviewCode","[MOBILE-DATETIMEPICKER] As a user, I should check the Preview code of DatetimePicker component","[MOBILE-DATETIMEPICKER] As a user, I should check the Preview code of DatetimePicker component",""
"passed","Thu Nov 03 18:19:05 GMT 2022","Thu Nov 03 18:19:37 GMT 2022","31851","","JIT-Database-001e-TABLE-create-by-context-menu","","JIT-Database-001e-TABLE-create-by-context-menu","[TABLE] As a user, I can create new table by context menu","[TABLE] As a user, I can create new table by context menu",""
"passed","Thu Nov 03 19:01:08 GMT 2022","Thu Nov 03 19:02:40 GMT 2022","92550","","JIT-Database-015m-INDEX-ALL-column-config","","JIT-Database-015m-INDEX-ALL-column-config","[INDEX-ALL] As a user, I config with multiple column and check show multiple on index pop-up","[INDEX-ALL] As a user, I config with multiple column and check show multiple on index pop-up",""
"passed","Thu Nov 03 19:50:53 GMT 2022","Thu Nov 03 19:54:07 GMT 2022","193354","","JIT-Export-010b-Export-RN-TODO","","JIT-Export-010b-Export-RN-TODO","[SMOKE] As a user, I check exprting project TODO with React Native","[SMOKE] As a user, I check exprting project TODO with React Native",""
"passed","Thu Nov 03 19:38:16 GMT 2022","Thu Nov 03 19:39:25 GMT 2022","69249","","JIT-Database-015g-INDEX-FLOAT-column-config","","JIT-Database-015g-INDEX-FLOAT-column-config","[INDEX-FLOAT] As a user, I config index from column setting && check on index popup","[INDEX-FLOAT] As a user, I config index from column setting && check on index popup",""
"passed","Thu Nov 03 18:32:08 GMT 2022","Thu Nov 03 18:33:17 GMT 2022","69964","","JIT-Mobile-031b-DIVIDER-General-info","","JIT-Mobile-031b-DIVIDER-General-info","[MOBILE-DIVIDER] As a user, I should check the general infomation of Divider is correct: Name, Key, unique key, delete component","[MOBILE-DIVIDER] As a user, I should check the general infomation of Divider is correct: Name, Key, unique key, delete component",""
"passed","Thu Nov 03 19:18:02 GMT 2022","Thu Nov 03 19:18:47 GMT 2022","44529","","JIT-Authorization-001-GROUP-add","","JIT-Authorization-001-GROUP-add","[AUTH - GROUP] As a user, I want to create new group authorization","[AUTH - GROUP] As a user, I want to create new group authorization",""
"passed","Thu Nov 03 18:29:45 GMT 2022","Thu Nov 03 18:30:56 GMT 2022","70589","","JIT-Mobile-027b-IMAGE-General-info","","JIT-Mobile-027b-IMAGE-General-info","[MOBILE-IMAGE] As a user, I should check the general infomation of Image is correct: Name, Key, unique key, delete component","[MOBILE-IMAGE] As a user, I should check the general infomation of Image is correct: Name, Key, unique key, delete component",""
"passed","Thu Nov 03 19:27:03 GMT 2022","Thu Nov 03 19:28:00 GMT 2022","57195","","JIT-Dashboard-002a-LISTOF-default-column","","JIT-Dashboard-002a-LISTOF-default-column","[LIST-OF] As a user, I should add default column in dashboard params","[LIST-OF] As a user, I should add default column in dashboard params",""
"failed","Thu Nov 03 19:37:42 GMT 2022","Thu Nov 03 19:38:09 GMT 2022","27520","","JIT-API-002c-GET-list","","JIT-API-002c-GET-list","As a user, I check column display when having relation for GET-list","As a user, I check column display when having relation for GET-list",""
"passed","Thu Nov 03 18:38:59 GMT 2022","Thu Nov 03 18:40:06 GMT 2022","67305","","JIT-Module-005a-FORCE-MOBILE-UPDATE-database","","JIT-Module-005a-FORCE-MOBILE-UPDATE-database","[FORCE-MOBILE-UPDATE] - Check adding and auto-table & columns","[FORCE-MOBILE-UPDATE] - Check adding and auto-table & columns",""
"passed","Thu Nov 03 19:29:29 GMT 2022","Thu Nov 03 19:30:01 GMT 2022","32009","","JIT-Database-011f-COLUMN-ENUM-duplicated","","JIT-Database-011f-COLUMN-ENUM-duplicated","[COLUMN] As a user, I should check counld not add duplicated item","[COLUMN] As a user, I should check counld not add duplicated item",""
"passed","Thu Nov 03 18:32:37 GMT 2022","Thu Nov 03 18:33:48 GMT 2022","70727","","JIT-Mobile-033b-HEADER-General-info","","JIT-Mobile-033b-HEADER-General-info","[MOBILE-HEADER] As a user, I should check the general infomation of Header is correct: Name, Key, unique key, delete component","[MOBILE-HEADER] As a user, I should check the general infomation of Header is correct: Name, Key, unique key, delete component",""
"passed","Thu Nov 03 18:16:46 GMT 2022","Thu Nov 03 18:17:37 GMT 2022","50998","","JIT-Dashboard-005c-UPDATEOF-saving","","JIT-Dashboard-005c-UPDATEOF-saving","[UPDATE-OF] As a user, I should save the selected option when switching between tables","[UPDATE-OF] As a user, I should save the selected option when switching between tables",""
"passed","Thu Nov 03 18:45:40 GMT 2022","Thu Nov 03 18:46:52 GMT 2022","72096","","JIT-Web-001c-PAGE-Delete","","JIT-Web-001c-PAGE-Delete","[PAGE] As a user, I can delete page","[PAGE] As a user, I can delete page",""
"passed","Thu Nov 03 18:43:09 GMT 2022","Thu Nov 03 18:44:01 GMT 2022","51037","","JIT-Module-015a-SCOUT-default","","JIT-Module-015a-SCOUT-default","[SCOUT] As a user, I can add module Scout and remove it","[SCOUT] As a user, I can add module Scout and remove it",""
"passed","Thu Nov 03 18:47:22 GMT 2022","Thu Nov 03 18:50:31 GMT 2022","189031","","JIT-Web-002d-MOLECULE-Duplicate","","JIT-Web-002d-MOLECULE-Duplicate","[WEB-MOLECULE] As a user, I can duplicate molecule with positive and negative cases","[WEB-MOLECULE] As a user, I can duplicate molecule with positive and negative cases",""
"passed","Thu Nov 03 19:01:59 GMT 2022","Thu Nov 03 19:02:31 GMT 2022","31605","","JIT-Overview-001-GENERAL-Check","","JIT-Overview-001-GENERAL-Check","[OVERVIEW-GENERAL] As a user, I should see the overview show the correct info when update configuration","[OVERVIEW-GENERAL] As a user, I should see the overview show the correct info when update configuration",""
"passed","Thu Nov 03 18:31:13 GMT 2022","Thu Nov 03 18:32:31 GMT 2022","77950","","JIT-Mobile-030b-WEBVIEW-General-info","","JIT-Mobile-030b-WEBVIEW-General-info","[MOBILE-WEBVIEW] As a user, I should check the general infomation of Webview is correct: Name, Key, unique key, delete component","[MOBILE-WEBVIEW] As a user, I should check the general infomation of Webview is correct: Name, Key, unique key, delete component",""
"passed","Thu Nov 03 18:22:16 GMT 2022","Thu Nov 03 18:23:19 GMT 2022","62725","","JIT-Database-011d-COLUMN-ENUM-delete-selected-items","","JIT-Database-011d-COLUMN-ENUM-delete-selected-items","[COLUMN] As a user, I should delete 1 selected item and check is will be removed in default dropdown","[COLUMN] As a user, I should delete 1 selected item and check is will be removed in default dropdown",""
"passed","Thu Nov 03 18:14:35 GMT 2022","Thu Nov 03 18:15:36 GMT 2022","60597","","JIT-Dashboard-003a-DETAILOF-default","","JIT-Dashboard-003a-DETAILOF-default","[DEATIL-OF] As a user, I should add default column in dashboard params","[DEATIL-OF] As a user, I should add default column in dashboard params",""
"passed","Thu Nov 03 19:19:37 GMT 2022","Thu Nov 03 19:20:43 GMT 2022","65857","","JIT-Module-007a-APPLE-LOGIN-default-edit","","JIT-Module-007a-APPLE-LOGIN-default-edit","[APPLE-LOGIN], I can add module Apple Login and edit its infos","[APPLE-LOGIN], I can add module Apple Login and edit its infos",""
"passed","Thu Nov 03 19:43:02 GMT 2022","Thu Nov 03 19:44:36 GMT 2022","93783","","JIT-Export-005a-Scenario-RN-login-screen","","JIT-Export-005a-Scenario-RN-login-screen","[RN-Login-screen] As a user, I check export the project type React Native and Nextjs successfully with scenario 1","[RN-Login-screen] As a user, I check export the project type React Native and Nextjs successfully with scenario 1",""
"passed","Thu Nov 03 18:53:38 GMT 2022","Thu Nov 03 18:54:53 GMT 2022","75245","","JIT-API-007a-GROUP-API-CRUD","","JIT-API-007a-GROUP-API-CRUD","[GROUP-API] Create, update and delete group API","[GROUP-API] Create, update and delete group API",""
"passed","Thu Nov 03 19:00:40 GMT 2022","Thu Nov 03 19:01:57 GMT 2022","76753","","JIT-Database-015l-INDEX-ENUM-column-config","","JIT-Database-015l-INDEX-ENUM-column-config","[INDEX-ENUM] As a user, I config index from column setting && check on index popup","[INDEX-ENUM] As a user, I config index from column setting && check on index popup",""
"passed","Thu Nov 03 18:36:29 GMT 2022","Thu Nov 03 18:37:03 GMT 2022","33577","","JIT-Module-000-search","","JIT-Module-000-search","[SEARCH] As a user, I can Search module","[SEARCH] As a user, I can Search module",""
"passed","Thu Nov 03 18:47:36 GMT 2022","Thu Nov 03 18:49:43 GMT 2022","126416","","JIT-Web-003a-PREVIEW-NAVIGATION-no-navigation-setup","","JIT-Web-003a-PREVIEW-NAVIGATION-no-navigation-setup","[WEB-PREVIEW-NAVIGATION] As a user, I could open preview screen with default page","[WEB-PREVIEW-NAVIGATION] As a user, I could open preview screen with default page",""
"passed","Thu Nov 03 18:57:11 GMT 2022","Thu Nov 03 18:59:36 GMT 2022","144029","","JIT-Database-015b-INDEX-CRUD-single","","JIT-Database-015b-INDEX-CRUD-single","[INDEX] As a user, I check add and update multiple index","[INDEX] As a user, I check add and update multiple index",""
"passed","Thu Nov 03 19:33:39 GMT 2022","Thu Nov 03 19:34:12 GMT 2022","33181","","JIT-Mobile-001-SCREEN-Create-new","","JIT-Mobile-001-SCREEN-Create-new","[MOBILE-SCREEN] As a user, I can create new screen with positive and negative cases","[MOBILE-SCREEN] As a user, I can create new screen with positive and negative cases",""
"passed","Thu Nov 03 19:54:12 GMT 2022","Thu Nov 03 20:00:18 GMT 2022","365123","","JIT-Export-010c-Export-NextJS-TODO","","JIT-Export-010c-Export-NextJS-TODO","[SMOKE] As a user, I check exprting project TODO with NextJS","[SMOKE] As a user, I check exprting project TODO with NextJS",""
"passed","Thu Nov 03 18:51:54 GMT 2022","Thu Nov 03 18:53:21 GMT 2022","87251","","JIT-API-002a-GET-list-check-default","","JIT-API-002a-GET-list-check-default","As a user, I check default value in API GET list","As a user, I check default value in API GET list",""
"passed","Thu Nov 03 18:47:54 GMT 2022","Thu Nov 03 18:49:53 GMT 2022","119113","","JIT-Web-004a-ACTION-NAVIGATION-no-param","","JIT-Web-004a-ACTION-NAVIGATION-no-param","[WEB-ACTION-NAVIGATION] As a user, I could add action type navigation without params and check preview code","[WEB-ACTION-NAVIGATION] As a user, I could add action type navigation without params and check preview code",""
"passed","Thu Nov 03 18:56:33 GMT 2022","Thu Nov 03 18:58:47 GMT 2022","133363","","JIT-API-009-Auto-fill","","JIT-API-009-Auto-fill","[AUTO-FILL] As a user, I could add request param by Auto-fill","[AUTO-FILL] As a user, I could add request param by Auto-fill",""
"passed","Thu Nov 03 18:15:21 GMT 2022","Thu Nov 03 18:16:19 GMT 2022","57282","","JIT-Dashboard-004a-CREATEOF-default","","JIT-Dashboard-004a-CREATEOF-default","[CREATE-OF] As a user, I should add default column in dashboard params","[CREATE-OF] As a user, I should add default column in dashboard params",""
"passed","Thu Nov 03 18:22:46 GMT 2022","Thu Nov 03 18:23:42 GMT 2022","55989","","JIT-Database-011e-COLUMN-ENUM-delete-all","","JIT-Database-011e-COLUMN-ENUM-delete-all","[COLUMN] As a user, I should delete all items and check all items are not displayed","[COLUMN] As a user, I should delete all items and check all items are not displayed",""
"passed","Thu Nov 03 18:47:13 GMT 2022","Thu Nov 03 18:48:39 GMT 2022","86020","","JIT-Web-002c-MOLECULE-Delete","","JIT-Web-002c-MOLECULE-Delete","[WEB-MOLECULE] As a user, I can delete molecule","[WEB-MOLECULE] As a user, I can delete molecule",""
"passed","Thu Nov 03 18:23:39 GMT 2022","Thu Nov 03 18:26:19 GMT 2022","160732","","JIT-Database-012e-RELATION-trigger-by-button","","JIT-Database-012e-RELATION-trigger-by-button","[RELATION] check the basic relation","[RELATION] check the basic relation",""
"passed","Thu Nov 03 18:59:44 GMT 2022","Thu Nov 03 19:01:01 GMT 2022","76997","","JIT-Database-015h-INDEX-DATE-column-config","","JIT-Database-015h-INDEX-DATE-column-config","[INDEX-DATE] As a user, I config index from column setting && check on index popup","[INDEX-DATE] As a user, I config index from column setting && check on index popup",""
"passed","Thu Nov 03 18:27:55 GMT 2022","Thu Nov 03 18:29:15 GMT 2022","80026","","JIT-Mobile-015-VIEW-General-info","","JIT-Mobile-015-VIEW-General-info","[MOBILE-VIEW] As a user, I should check the general infomation of View is correct: Name, Key, unique key, delete component","[MOBILE-VIEW] As a user, I should check the general infomation of View is correct: Name, Key, unique key, delete component",""
"passed","Thu Nov 03 18:46:52 GMT 2022","Thu Nov 03 18:49:14 GMT 2022","142263","","JIT-Web-002b-MOLECULE-Update","","JIT-Web-002b-MOLECULE-Update","[WEB-MOLECULE] As a user, I can update molecule with positive and negative cases","[WEB-MOLECULE] As a user, I can update molecule with positive and negative cases",""
"passed","Thu Nov 03 18:44:37 GMT 2022","Thu Nov 03 18:46:41 GMT 2022","123691","","JIT-Module-018a-ADMIN-DASHBOARD-USER-default","","JIT-Module-018a-ADMIN-DASHBOARD-USER-default","[ADMIN-DASHBOARD-USER], I can add module Admin dashboard user and remove it","[ADMIN-DASHBOARD-USER], I can add module Admin dashboard user and remove it",""
"passed","Thu Nov 03 18:15:09 GMT 2022","Thu Nov 03 18:15:59 GMT 2022","49625","","JIT-Dashboard-003e-DETAILOF-delete-column","","JIT-Dashboard-003e-DETAILOF-delete-column","[DEATIL-OF] As a user, I should see the params will be removed when column is deleted","[DEATIL-OF] As a user, I should see the params will be removed when column is deleted",""
"passed","Thu Nov 03 19:28:38 GMT 2022","Thu Nov 03 19:29:23 GMT 2022","44176","","JIT-Dashboard-002b-LISTOF-new-column","","JIT-Dashboard-002b-LISTOF-new-column","[LIST-OF] As a user, I should add new column in dashboard params","[LIST-OF] As a user, I should add new column in dashboard params",""
"passed","Thu Nov 03 18:20:00 GMT 2022","Thu Nov 03 18:22:24 GMT 2022","143872","","JIT-Database-007-COLUMN-type-TEXT","","JIT-Database-007-COLUMN-type-TEXT","[COLUMN] As a user, I should check the validation of TEXT column definition","[COLUMN] As a user, I should check the validation of TEXT column definition",""
"passed","Thu Nov 03 19:44:42 GMT 2022","Thu Nov 03 19:46:08 GMT 2022","86177","","JIT-Export-005b-Scenario-RN-all-default-component","","JIT-Export-005b-Scenario-RN-all-default-component","[RN-Default] As a user, I check export the project type React Native with all default component","[RN-Default] As a user, I check export the project type React Native with all default component",""
"passed","Thu Nov 03 18:23:49 GMT 2022","Thu Nov 03 18:24:36 GMT 2022","47387","","JIT-Database-013-DEFECT-Check-default-value-when-changing-type","","JIT-Database-013-DEFECT-Check-default-value-when-changing-type","[DEFECT] As a user, I should check the default value when changing the type","[DEFECT] As a user, I should check the default value when changing the type",""
"passed","Thu Nov 03 18:18:31 GMT 2022","Thu Nov 03 18:19:02 GMT 2022","30867","","JIT-Database-001c-TABLE-duplicate","","JIT-Database-001c-TABLE-duplicate","[TABLE] As a user, I cannot create table with duplicate name","[TABLE] As a user, I cannot create table with duplicate name",""
"passed","Thu Nov 03 18:55:50 GMT 2022","Thu Nov 03 18:57:07 GMT 2022","77546","","JIT-API-007e-PUT-API-Add-new-endpoint","","JIT-API-007e-PUT-API-Add-new-endpoint","[PUT-API] Create, update and delete new PUT API endpoint","[PUT-API] Create, update and delete new PUT API endpoint",""
"passed","Thu Nov 03 19:18:02 GMT 2022","Thu Nov 03 19:19:26 GMT 2022","83146","","JIT-Dashboard-003b-DETAILOF-new-column","","JIT-Dashboard-003b-DETAILOF-new-column","[DEATIL-OF] As a user, I should add new column in dashboard params","[DEATIL-OF] As a user, I should add new column in dashboard params",""
"failed","Thu Nov 03 19:29:52 GMT 2022","Thu Nov 03 19:30:22 GMT 2022","29882","","JIT-Database-012a-RELATION-basic","","JIT-Database-012a-RELATION-basic","[RELATION] check the basic relation","[RELATION] check the basic relation",""
"passed","Thu Nov 03 18:17:51 GMT 2022","Thu Nov 03 18:18:48 GMT 2022","56565","","JIT-Dashboard-006d-DELETEOF-delete-table","","JIT-Dashboard-006d-DELETEOF-delete-table","[DELETE-OF] As a user, I should see the table is not displayed in dashboard list after removed","[DELETE-OF] As a user, I should see the table is not displayed in dashboard list after removed",""
"broken","Thu Nov 03 19:32:14 GMT 2022","Thu Nov 03 19:33:31 GMT 2022","76760","","JIT-Database-016a-COUNTER-CACHE-Create-by-relation","","JIT-Database-016a-COUNTER-CACHE-Create-by-relation","[COUNTER-CACHE] create new counter cache column by selecting in relation popup","[COUNTER-CACHE] create new counter cache column by selecting in relation popup",""
"passed","Thu Nov 03 18:42:54 GMT 2022","Thu Nov 03 18:44:03 GMT 2022","68559","","JIT-Module-014b-BASIC-AUTH-edit-infos","","JIT-Module-014b-BASIC-AUTH-edit-infos","[BASIC-AUTH] As a user, I can update module Basic Authentication","[BASIC-AUTH] As a user, I can update module Basic Authentication",""
"passed","Thu Nov 03 18:38:15 GMT 2022","Thu Nov 03 18:39:31 GMT 2022","76089","","JIT-Module-002b-DEEPLINK-edit-infos","","JIT-Module-002b-DEEPLINK-edit-infos","As a user, I can update module Deeplink","As a user, I can update module Deeplink",""
"passed","Thu Nov 03 18:53:48 GMT 2022","Thu Nov 03 18:55:43 GMT 2022","114787","","JIT-API-007bb-GET-list-API-Check-datetime-static-value","","JIT-API-007bb-GET-list-API-Check-datetime-static-value","[GET-list-API] Set datetime static value","[GET-list-API] Set datetime static value",""
"passed","Thu Nov 03 18:19:52 GMT 2022","Thu Nov 03 18:22:16 GMT 2022","144905","","JIT-Database-006-COLUMN-type-STRING","","JIT-Database-006-COLUMN-type-STRING","[COLUMN] As a user, I should check the validation of STRING column definition","[COLUMN] As a user, I should check the validation of STRING column definition",""
"passed","Thu Nov 03 18:58:55 GMT 2022","Thu Nov 03 19:00:10 GMT 2022","74696","","JIT-Database-015e-INDEX-TEXT-column-config","","JIT-Database-015e-INDEX-TEXT-column-config","[INDEX-TEXT] As a user, I config index from column setting && check on index popup","[INDEX-TEXT] As a user, I config index from column setting && check on index popup",""
"passed","Thu Nov 03 18:29:56 GMT 2022","Thu Nov 03 18:33:41 GMT 2022","225537","","JIT-Mobile-028a-ICON-Check-PreviewCode","","JIT-Mobile-028a-ICON-Check-PreviewCode","[MOBILE-ICON] As a user, I should check the Preview code of Icon component","[MOBILE-ICON] As a user, I should check the Preview code of Icon component",""
"passed","Thu Nov 03 18:17:17 GMT 2022","Thu Nov 03 18:18:06 GMT 2022","48848","","JIT-Dashboard-006b-DELETEOF-new-column","","JIT-Dashboard-006b-DELETEOF-new-column","[DELETE-OF] As a user, I should add new column in dashboard params","[DELETE-OF] As a user, I should add new column in dashboard params",""
