"Status","Start Time","Stop Time","Duration in ms","Parent Suite","Suite","Sub Suite","Test Class","Test Method","Name","Description"
"passed","Sun Feb 19 19:01:02 GMT 2023","Sun Feb 19 19:03:16 GMT 2023","133746","","JIT-API-002b-GET-list-update-info","","JIT-API-002b-GET-list-update-info","As a user, I update info for GET-list","As a user, I update info for GET-list",""
"passed","Sun Feb 19 18:23:24 GMT 2023","Sun Feb 19 18:34:09 GMT 2023","644680","","JIT-Mobile-009-SEARCH-Components","","JIT-Mobile-009-SEARCH-Components","[MOBILE-SEARCH] As a user, I search component and drag them to preview screen","[MOBILE-SEARCH] As a user, I search component and drag them to preview screen",""
"passed","Sun Feb 19 19:04:56 GMT 2023","Sun Feb 19 19:06:50 GMT 2023","114182","","JIT-API-007ba-GET-list-API-Add-new-endpoint","","JIT-API-007ba-GET-list-API-Add-new-endpoint","[GET-list-API] Create, update and delete new GET API endpoint","[GET-list-API] Create, update and delete new GET API endpoint",""
"passed","Sun Feb 19 18:17:39 GMT 2023","Sun Feb 19 18:22:46 GMT 2023","306221","","JIT-Database-012e-RELATION-trigger-by-button","","JIT-Database-012e-RELATION-trigger-by-button","[RELATION] check the basic relation","[RELATION] check the basic relation",""
"passed","Sun Feb 19 18:53:34 GMT 2023","Sun Feb 19 18:55:13 GMT 2023","99180","","JIT-Web-003a-PREVIEW-NAVIGATION-no-navigation-setup","","JIT-Web-003a-PREVIEW-NAVIGATION-no-navigation-setup","[WEB-PREVIEW-NAVIGATION] As a user, I could open preview screen with default page","[WEB-PREVIEW-NAVIGATION] As a user, I could open preview screen with default page",""
"passed","Sun Feb 19 18:16:23 GMT 2023","Sun Feb 19 18:17:34 GMT 2023","71442","","JIT-Database-011f-COLUMN-ENUM-duplicated","","JIT-Database-011f-COLUMN-ENUM-duplicated","[COLUMN] As a user, I should check counld not add duplicated item","[COLUMN] As a user, I should check counld not add duplicated item",""
"passed","Sun Feb 19 19:06:59 GMT 2023","Sun Feb 19 19:08:39 GMT 2023","100214","","JIT-API-007e-PUT-API-Add-new-endpoint","","JIT-API-007e-PUT-API-Add-new-endpoint","[PUT-API] Create, update and delete new PUT API endpoint","[PUT-API] Create, update and delete new PUT API endpoint",""
"passed","Sun Feb 19 18:15:36 GMT 2023","Sun Feb 19 18:17:03 GMT 2023","86459","","JIT-Database-011d-COLUMN-ENUM-delete-selected-items","","JIT-Database-011d-COLUMN-ENUM-delete-selected-items","[COLUMN] As a user, I should delete 1 selected item and check is will be removed in default dropdown","[COLUMN] As a user, I should delete 1 selected item and check is will be removed in default dropdown",""
"passed","Sun Feb 19 18:17:57 GMT 2023","Sun Feb 19 18:19:25 GMT 2023","88309","","JIT-Database-014-DEFECT-Check-duplicate-table-name","","JIT-Database-014-DEFECT-Check-duplicate-table-name","[DEFECT] As a user, I cannot update to duplicate name","[DEFECT] As a user, I cannot update to duplicate name",""
"passed","Sun Feb 19 18:26:47 GMT 2023","Sun Feb 19 18:30:35 GMT 2023","227824","","JIT-Mobile-022d-TEXT-Check-PADDING-MARGIN","","JIT-Mobile-022d-TEXT-Check-PADDING-MARGIN","[MOBILE-TEXT] As a user, I should check the PADDING & MARGIN infomation of Text is correct: Top, Bottom, Right, Left.","[MOBILE-TEXT] As a user, I should check the PADDING & MARGIN infomation of Text is correct: Top, Bottom, Right, Left.",""
"passed","Sun Feb 19 19:50:53 GMT 2023","Sun Feb 19 19:53:28 GMT 2023","155168","","JIT-Export-004-Scenario_ROR_2","","JIT-Export-004-Scenario_ROR_2","As a user, I check export the project type ROR with key successfully with scenario 2","As a user, I check export the project type ROR with key successfully with scenario 2",""
"passed","Sun Feb 19 18:10:30 GMT 2023","Sun Feb 19 18:11:50 GMT 2023","79838","","JIT-Database-001d-TABLE-update","","JIT-Database-001d-TABLE-update","[TABLE] As a user, I can update the value of the table","[TABLE] As a user, I can update the value of the table",""
"passed","Sun Feb 19 18:27:43 GMT 2023","Sun Feb 19 18:29:24 GMT 2023","101719","","JIT-Mobile-027b-IMAGE-General-info","","JIT-Mobile-027b-IMAGE-General-info","[MOBILE-IMAGE] As a user, I should check the general infomation of Image is correct: Name, Key, unique key, delete component","[MOBILE-IMAGE] As a user, I should check the general infomation of Image is correct: Name, Key, unique key, delete component",""
"passed","Sun Feb 19 18:44:34 GMT 2023","Sun Feb 19 18:45:35 GMT 2023","61438","","JIT-Module-015b-SCOUT-edit-infos","","JIT-Module-015b-SCOUT-edit-infos","[SCOUT] As a user, I can update module Scout","[SCOUT] As a user, I can update module Scout",""
"passed","Sun Feb 19 18:24:32 GMT 2023","Sun Feb 19 18:26:15 GMT 2023","103026","","JIT-Mobile-015-VIEW-General-info","","JIT-Mobile-015-VIEW-General-info","[MOBILE-VIEW] As a user, I should check the general infomation of View is correct: Name, Key, unique key, delete component","[MOBILE-VIEW] As a user, I should check the general infomation of View is correct: Name, Key, unique key, delete component",""
"passed","Sun Feb 19 18:30:49 GMT 2023","Sun Feb 19 18:33:47 GMT 2023","178795","","JIT-Mobile-031a-DIVIDER-Check-PreviewCode","","JIT-Mobile-031a-DIVIDER-Check-PreviewCode","[MOBILE-DIVIDER] As a user, I should check the Preview code of Divider component","[MOBILE-DIVIDER] As a user, I should check the Preview code of Divider component",""
"passed","Sun Feb 19 19:10:09 GMT 2023","Sun Feb 19 19:11:31 GMT 2023","81696","","JIT-Database-015d-INDEX-STRING-column-config","","JIT-Database-015d-INDEX-STRING-column-config","[INDEX-STRING] As a user, I config index from column setting && check on index popup","[INDEX-STRING] As a user, I config index from column setting && check on index popup",""
"passed","Sun Feb 19 19:52:55 GMT 2023","Sun Feb 19 19:58:34 GMT 2023","339154","","JIT-Export-010b-Export-RN-TODO","","JIT-Export-010b-Export-RN-TODO","[SMOKE] As a user, I check exprting project TODO with React Native","[SMOKE] As a user, I check exprting project TODO with React Native",""
"passed","Sun Feb 19 18:50:45 GMT 2023","Sun Feb 19 18:53:12 GMT 2023","147252","","JIT-Web-002a-MOLECULE-Create-new","","JIT-Web-002a-MOLECULE-Create-new","[WEB-MOLECULE] As a user, I can create new molecule with positive and negative cases","[WEB-MOLECULE] As a user, I can create new molecule with positive and negative cases",""
"passed","Sun Feb 19 18:29:02 GMT 2023","Sun Feb 19 18:30:41 GMT 2023","98091","","JIT-Mobile-028b-ICON-General-info","","JIT-Mobile-028b-ICON-General-info","[MOBILE-ICON] As a user, I should check the general infomation of Icon is correct: Name, Key, unique key, delete component","[MOBILE-ICON] As a user, I should check the general infomation of Icon is correct: Name, Key, unique key, delete component",""
"passed","Sun Feb 19 18:37:10 GMT 2023","Sun Feb 19 18:38:09 GMT 2023","59229","","JIT-Module-002a-DEEPLINK-default","","JIT-Module-002a-DEEPLINK-default","As a user, I can add module Deeplink and remove it","As a user, I can add module Deeplink and remove it",""
"passed","Sun Feb 19 18:17:02 GMT 2023","Sun Feb 19 18:18:30 GMT 2023","88341","","JIT-Database-012a-RELATION-basic","","JIT-Database-012a-RELATION-basic","[RELATION] check the basic relation","[RELATION] check the basic relation",""
"failed","Sun Feb 19 20:01:21 GMT 2023","Sun Feb 19 20:05:09 GMT 2023","228419","","JIT-Preview-001a-Preview-DATABASE-COL-STRING-Validation","","JIT-Preview-001a-Preview-DATABASE-COL-STRING-Validation","[PREVIEW-DATABASE-COL-STRING] As a user, I check preview function for validation of String","[PREVIEW-DATABASE-COL-STRING] As a user, I check preview function for validation of String",""
"passed","Sun Feb 19 18:15:10 GMT 2023","Sun Feb 19 18:16:26 GMT 2023","76655","","JIT-Database-011a-COLUMN-ENUM-default","","JIT-Database-011a-COLUMN-ENUM-default","[COLUMN] As a user, I should check the basic validation","[COLUMN] As a user, I should check the basic validation",""
"passed","Sun Feb 19 18:43:40 GMT 2023","Sun Feb 19 18:44:55 GMT 2023","74978","","JIT-Module-013b-AWS-edit-infos","","JIT-Module-013b-AWS-edit-infos","[AWS] As a user, I can update module AWS SES Integration","[AWS] As a user, I can update module AWS SES Integration",""
"passed","Sun Feb 19 19:07:26 GMT 2023","Sun Feb 19 19:10:05 GMT 2023","158809","","JIT-API-009-Auto-fill","","JIT-API-009-Auto-fill","[AUTO-FILL] As a user, I could add request param by Auto-fill","[AUTO-FILL] As a user, I could add request param by Auto-fill",""
"passed","Sun Feb 19 19:04:53 GMT 2023","Sun Feb 19 19:05:32 GMT 2023","38947","","JIT-API-007a-GROUP-API-CRUD","","JIT-API-007a-GROUP-API-CRUD","[GROUP-API] Create, update and delete group API","[GROUP-API] Create, update and delete group API",""
"passed","Sun Feb 19 18:34:59 GMT 2023","Sun Feb 19 18:36:09 GMT 2023","69847","","JIT-Mobile-041a-PREVIEW-NAVIGATION-no-navigation-setup","","JIT-Mobile-041a-PREVIEW-NAVIGATION-no-navigation-setup","[MOBILE-PREVIEW-NAVIGATION] As a user, I could open preview screen with notification should setup the screen navigation","[MOBILE-PREVIEW-NAVIGATION] As a user, I could open preview screen with notification should setup the screen navigation",""
"passed","Sun Feb 19 19:10:18 GMT 2023","Sun Feb 19 19:11:37 GMT 2023","78225","","JIT-Database-015e-INDEX-TEXT-column-config","","JIT-Database-015e-INDEX-TEXT-column-config","[INDEX-TEXT] As a user, I config index from column setting && check on index popup","[INDEX-TEXT] As a user, I config index from column setting && check on index popup",""
"passed","Sun Feb 19 18:56:20 GMT 2023","Sun Feb 19 18:59:14 GMT 2023","174348","","JIT-Web-008a-ADMIN-PAGE-Create-new","","JIT-Web-008a-ADMIN-PAGE-Create-new","[ADMIN-PAGE] As a user, I can create new Admin page","[ADMIN-PAGE] As a user, I can create new Admin page",""
"passed","Sun Feb 19 18:26:23 GMT 2023","Sun Feb 19 18:27:56 GMT 2023","92847","","JIT-Mobile-021-DEFECT.Params.keep-params-after-refresh-page","","JIT-Mobile-021-DEFECT.Params.keep-params-after-refresh-page","[DEFECT] As a user, I should check the params will be kept after refresh page","[DEFECT] As a user, I should check the params will be kept after refresh page",""
"passed","Sun Feb 19 19:43:50 GMT 2023","Sun Feb 19 19:46:06 GMT 2023","136376","","JIT-Mobile-039a-OTP-Check-PreviewCode","","JIT-Mobile-039a-OTP-Check-PreviewCode","[MOBILE-OTP] As a user, I should check the Preview code of OTP component","[MOBILE-OTP] As a user, I should check the Preview code of OTP component",""
"passed","Sun Feb 19 18:22:43 GMT 2023","Sun Feb 19 18:23:56 GMT 2023","73414","","JIT-Mobile-007-MOLECULE-Delete","","JIT-Mobile-007-MOLECULE-Delete","[MOBILE-MOLECULE] As a user, I can delete molecule","[MOBILE-MOLECULE] As a user, I can delete molecule",""
"passed","Sun Feb 19 18:44:56 GMT 2023","Sun Feb 19 18:45:58 GMT 2023","61288","","JIT-Module-016b-SENDGRID-edit-infos","","JIT-Module-016b-SENDGRID-edit-infos","[SENDGRID] As a user, I can update module SendGrid","[SENDGRID] As a user, I can update module SendGrid",""
"passed","Sun Feb 19 18:26:36 GMT 2023","Sun Feb 19 18:34:00 GMT 2023","444030","","JIT-Mobile-022b-TEXT-Check-TEXT","","JIT-Mobile-022b-TEXT-Check-TEXT","[MOBILE-TEXT] As a user, I should check the TEXT infomation of Text is correct: Text content, Font, Size, Font weight, Line Height, Spacing, Color, Italic, Underline","[MOBILE-TEXT] As a user, I should check the TEXT infomation of Text is correct: Text content, Font, Size, Font weight, Line Height, Spacing, Color, Italic, Underline",""
"passed","Sun Feb 19 18:35:07 GMT 2023","Sun Feb 19 18:39:19 GMT 2023","252156","","JIT-Mobile-041b-PREVIEW-NAVIGATION-with-navigation-setup","","JIT-Mobile-041b-PREVIEW-NAVIGATION-with-navigation-setup","[MOBILE-PREVIEW-NAVIGATION] As a user, I could open preview screen with setting the screen navigation","[MOBILE-PREVIEW-NAVIGATION] As a user, I could open preview screen with setting the screen navigation",""
"passed","Sun Feb 19 18:32:57 GMT 2023","Sun Feb 19 18:34:27 GMT 2023","90902","","JIT-Mobile-034b-SCROLLVIEW-General-info","","JIT-Mobile-034b-SCROLLVIEW-General-info","[MOBILE-SCROLLVIEW] As a user, I should check the general infomation of Scroll View is correct: Name, Key, unique key, delete component","[MOBILE-SCROLLVIEW] As a user, I should check the general infomation of Scroll View is correct: Name, Key, unique key, delete component",""
"passed","Sun Feb 19 18:15:37 GMT 2023","Sun Feb 19 18:17:00 GMT 2023","82772","","JIT-Database-011e-COLUMN-ENUM-delete-all","","JIT-Database-011e-COLUMN-ENUM-delete-all","[COLUMN] As a user, I should delete all items and check all items are not displayed","[COLUMN] As a user, I should delete all items and check all items are not displayed",""
"passed","Sun Feb 19 19:13:37 GMT 2023","Sun Feb 19 19:14:44 GMT 2023","67067","","JIT-Database-015k-INDEX-BOOLEAN-column-config","","JIT-Database-015k-INDEX-BOOLEAN-column-config","[INDEX-BOOLEAN] As a user, I config index from column setting && check on index popup","[INDEX-BOOLEAN] As a user, I config index from column setting && check on index popup",""
"passed","Sun Feb 19 18:43:29 GMT 2023","Sun Feb 19 18:44:25 GMT 2023","55212","","JIT-Module-013a-AWS-default","","JIT-Module-013a-AWS-default","[AWS] As a user, I can add module AWS SES Integration and remove it","[AWS] As a user, I can add module AWS SES Integration and remove it",""
"passed","Sun Feb 19 19:53:20 GMT 2023","Sun Feb 19 19:53:51 GMT 2023","31227","","JIT-Export-006-Existing-Scenario-ROR-nokey","","JIT-Export-006-Existing-Scenario-ROR-nokey","As a user, I check export the existing project type ROR no key successfully","As a user, I check export the existing project type ROR no key successfully",""
"passed","Sun Feb 19 18:44:08 GMT 2023","Sun Feb 19 18:45:13 GMT 2023","65271","","JIT-Module-015a-SCOUT-default","","JIT-Module-015a-SCOUT-default","[SCOUT] As a user, I can add module Scout and remove it","[SCOUT] As a user, I can add module Scout and remove it",""
"passed","Sun Feb 19 18:37:08 GMT 2023","Sun Feb 19 18:38:57 GMT 2023","108546","","JIT-Module-001b-CLOUDINARY-edit-infos","","JIT-Module-001b-CLOUDINARY-edit-infos","As a user, I can update module Cloudinary","As a user, I can update module Cloudinary",""
"passed","Sun Feb 19 18:17:33 GMT 2023","Sun Feb 19 18:20:16 GMT 2023","163482","","JIT-Database-012c-RELATION-multiple-1-direction","","JIT-Database-012c-RELATION-multiple-1-direction","[RELATION], I should add multiple relation 1 direction","[RELATION], I should add multiple relation 1 direction",""
"passed","Sun Feb 19 19:05:52 GMT 2023","Sun Feb 19 19:07:28 GMT 2023","96075","","JIT-API-007d-POST-API-Add-new-endpoint","","JIT-API-007d-POST-API-Add-new-endpoint","[GET-POST] Create, update and delete new POST API endpoint","[GET-POST] Create, update and delete new POST API endpoint",""
"passed","Sun Feb 19 18:26:27 GMT 2023","Sun Feb 19 18:28:06 GMT 2023","99470","","JIT-Mobile-022a-TEXT-General-info","","JIT-Mobile-022a-TEXT-General-info","[MOBILE-TEXT] As a user, I should check the general infomation of Text is correct: Name, Key, unique key, delete component","[MOBILE-TEXT] As a user, I should check the general infomation of Text is correct: Name, Key, unique key, delete component",""
"passed","Sun Feb 19 19:11:50 GMT 2023","Sun Feb 19 19:13:19 GMT 2023","89367","","JIT-Database-015f-INDEX-INTEGER-column-config","","JIT-Database-015f-INDEX-INTEGER-column-config","[INDEX-INTEGER] As a user, I config index from column setting && check on index popup","[INDEX-INTEGER] As a user, I config index from column setting && check on index popup",""
"passed","Sun Feb 19 18:43:56 GMT 2023","Sun Feb 19 18:45:26 GMT 2023","89237","","JIT-Module-014b-BASIC-AUTH-edit-infos","","JIT-Module-014b-BASIC-AUTH-edit-infos","[BASIC-AUTH] As a user, I can update module Basic Authentication","[BASIC-AUTH] As a user, I can update module Basic Authentication",""
"passed","Sun Feb 19 18:28:10 GMT 2023","Sun Feb 19 18:30:54 GMT 2023","164447","","JIT-Mobile-028a-ICON-Check-PreviewCode","","JIT-Mobile-028a-ICON-Check-PreviewCode","[MOBILE-ICON] As a user, I should check the Preview code of Icon component","[MOBILE-ICON] As a user, I should check the Preview code of Icon component",""
"passed","Sun Feb 19 18:48:05 GMT 2023","Sun Feb 19 18:53:28 GMT 2023","323006","","JIT-Web-001e-PAGE-Search","","JIT-Web-001e-PAGE-Search","[WEB-PAGE] As a user, I can search correct screen with keyword","[WEB-PAGE] As a user, I can search correct screen with keyword",""
"passed","Sun Feb 19 18:10:30 GMT 2023","Sun Feb 19 18:11:49 GMT 2023","78567","","JIT-Database-003a-COLUMN-empty","","JIT-Database-003a-COLUMN-empty","[COLUMN] As a user, I cannot add empty column definition","[COLUMN] As a user, I cannot add empty column definition",""
"passed","Sun Feb 19 18:12:23 GMT 2023","Sun Feb 19 18:14:44 GMT 2023","141545","","JIT-Database-004-COLUMN-type-INTEGER","","JIT-Database-004-COLUMN-type-INTEGER","[COLUMN] As a user, I should check the validation of INTEGER column definition","[COLUMN] As a user, I should check the validation of INTEGER column definition",""
"passed","Sun Feb 19 18:36:44 GMT 2023","Sun Feb 19 18:37:46 GMT 2023","61959","","JIT-Module-001a-CLOUDINARY-default","","JIT-Module-001a-CLOUDINARY-default","As a user, I can add module Cloudinary and remove it","As a user, I can add module Cloudinary and remove it",""
"passed","Sun Feb 19 18:45:29 GMT 2023","Sun Feb 19 18:46:25 GMT 2023","56151","","JIT-Module-017a-GOOGLE-ANAL-default","","JIT-Module-017a-GOOGLE-ANAL-default","[GOOGLE-ANAL] As a user, I can add module Google Analytics and remove it","[GOOGLE-ANAL] As a user, I can add module Google Analytics and remove it",""
"passed","Sun Feb 19 18:36:25 GMT 2023","Sun Feb 19 18:37:07 GMT 2023","41527","","JIT-Module-000-search","","JIT-Module-000-search","[SEARCH] As a user, I can Search module","[SEARCH] As a user, I can Search module",""
"passed","Sun Feb 19 19:50:19 GMT 2023","Sun Feb 19 19:52:22 GMT 2023","123317","","JIT-Export-002-Scenario-ROR-withkey-1","","JIT-Export-002-Scenario-ROR-withkey-1","As a user, I check export the project type ROR with key successfully with scenario 1","As a user, I check export the project type ROR with key successfully with scenario 1",""
"passed","Sun Feb 19 18:10:30 GMT 2023","Sun Feb 19 18:11:44 GMT 2023","73926","","JIT-Database-002-COLUMN-default","","JIT-Database-002-COLUMN-default","[COLUMN] As a user, I should see the default column definition","[COLUMN] As a user, I should see the default column definition",""
"passed","Sun Feb 19 19:01:02 GMT 2023","Sun Feb 19 19:02:17 GMT 2023","74542","","JIT-API-001-Check-general-info","","JIT-API-001-Check-general-info","As a user, I check general info","As a user, I check general info",""
"passed","Sun Feb 19 18:12:44 GMT 2023","Sun Feb 19 18:14:26 GMT 2023","102922","","JIT-Database-010a-COLUMN-FILE-validation","","JIT-Database-010a-COLUMN-FILE-validation","[COLUMN] As a user, I should check the validation of FILE column definition","[COLUMN] As a user, I should check the validation of FILE column definition",""
"passed","Sun Feb 19 18:17:32 GMT 2023","Sun Feb 19 18:20:17 GMT 2023","164643","","JIT-Database-012d-RELATION-multiple-2-direction","","JIT-Database-012d-RELATION-multiple-2-direction","[RELATION], I should add multiple relation 2 directions","[RELATION], I should add multiple relation 2 directions",""
"passed","Sun Feb 19 19:48:24 GMT 2023","Sun Feb 19 19:50:12 GMT 2023","107856","","JIT-Export-001-Scenario_ROR_1","","JIT-Export-001-Scenario_ROR_1","As a user, I check export the project type ROR no key successfully with scenario 1","As a user, I check export the project type ROR no key successfully with scenario 1",""
"passed","Sun Feb 19 18:12:32 GMT 2023","Sun Feb 19 18:14:44 GMT 2023","132202","","JIT-Database-005-COLUMN-type-FLOAT","","JIT-Database-005-COLUMN-type-FLOAT","[COLUMN] As a user, I should check the validation of FLOAT column definition","[COLUMN] As a user, I should check the validation of FLOAT column definition",""
"passed","Sun Feb 19 18:47:22 GMT 2023","Sun Feb 19 18:52:26 GMT 2023","304459","","JIT-Web-001b-PAGE-Update","","JIT-Web-001b-PAGE-Update","[PAGE] As a user, I can update page with positive and negative cases","[PAGE] As a user, I can update page with positive and negative cases",""
"passed","Sun Feb 19 19:07:51 GMT 2023","Sun Feb 19 19:08:49 GMT 2023","57917","","JIT-API-010a-DEFECT-Check-special-symbol-request-param","","JIT-API-010a-DEFECT-Check-special-symbol-request-param","As a user, I want to validate and prevent the special symbol for request params.","As a user, I want to validate and prevent the special symbol for request params.",""
"passed","Sun Feb 19 18:18:33 GMT 2023","Sun Feb 19 18:20:28 GMT 2023","114489","","JIT-Database-016a-COUNTER-CACHE-Create-by-relation","","JIT-Database-016a-COUNTER-CACHE-Create-by-relation","[COUNTER-CACHE] create new counter cache column by selecting in relation popup","[COUNTER-CACHE] create new counter cache column by selecting in relation popup",""
"passed","Sun Feb 19 18:36:21 GMT 2023","Sun Feb 19 18:38:49 GMT 2023","147677","","JIT-Mobile-045a-LAYER-TREE-Check-edit-and-action","","JIT-Mobile-045a-LAYER-TREE-Check-edit-and-action","[MOBILE-LAYER-TREE] As a user, I could update the name of the node in the layer tree and copy,paste,delete,wrap the node","[MOBILE-LAYER-TREE] As a user, I could update the name of the node in the layer tree and copy,paste,delete,wrap the node",""
"passed","Sun Feb 19 19:08:49 GMT 2023","Sun Feb 19 19:09:55 GMT 2023","66430","","JIT-API-010b-DEFECT-Check-JSON-path","","JIT-API-010b-DEFECT-Check-JSON-path","As a user, I want to check the option in dropdown show correct JSON path.","As a user, I want to check the option in dropdown show correct JSON path.",""
"passed","Sun Feb 19 18:48:08 GMT 2023","Sun Feb 19 18:51:38 GMT 2023","209822","","JIT-Web-001f-PAGE-Export-and-import","","JIT-Web-001f-PAGE-Export-and-import","[PAGE] As a user, I can create new screen by import and export the screen","[PAGE] As a user, I can create new screen by import and export the screen",""
"passed","Sun Feb 19 18:41:23 GMT 2023","Sun Feb 19 18:43:51 GMT 2023","147701","","JIT-Module-010a-LINE-LOGIN-default-edit","","JIT-Module-010a-LINE-LOGIN-default-edit","[LINE-LOGIN], I can add module Line Login and edit its infos","[LINE-LOGIN], I can add module Line Login and edit its infos",""
"passed","Sun Feb 19 18:23:43 GMT 2023","Sun Feb 19 18:25:01 GMT 2023","77653","","JIT-Mobile-011-JITDEF50-disable-add-duplicate-screen-in-stack","","JIT-Mobile-011-JITDEF50-disable-add-duplicate-screen-in-stack","[DEFECT] As a user, I could add duplicate screen in stack","[DEFECT] As a user, I could add duplicate screen in stack",""
"passed","Sun Feb 19 19:03:17 GMT 2023","Sun Feb 19 19:04:42 GMT 2023","84689","","JIT-API-003c-POST-relation","","JIT-API-003c-POST-relation","As a user, I check column display when having relation for API POST","As a user, I check column display when having relation for API POST",""
"passed","Sun Feb 19 19:09:02 GMT 2023","Sun Feb 19 19:11:41 GMT 2023","159656","","JIT-Database-015b-INDEX-CRUD-single","","JIT-Database-015b-INDEX-CRUD-single","[INDEX] As a user, I check add and update multiple index","[INDEX] As a user, I check add and update multiple index",""
"passed","Sun Feb 19 18:47:17 GMT 2023","Sun Feb 19 18:49:14 GMT 2023","116249","","JIT-Team-005-Invite-duplicate-email","","JIT-Team-005-Invite-duplicate-email","[INVITE-DELETE] Invite new email and invite again","[INVITE-DELETE] Invite new email and invite again",""
"passed","Sun Feb 19 18:20:18 GMT 2023","Sun Feb 19 18:22:39 GMT 2023","141545","","JIT-Mobile-001a-SCREEN-Search","","JIT-Mobile-001a-SCREEN-Search","[MOBILE-SCREEN] As a user, I can search correct screen with keyword","[MOBILE-SCREEN] As a user, I can search correct screen with keyword",""
"passed","Sun Feb 19 18:23:59 GMT 2023","Sun Feb 19 18:25:52 GMT 2023","112588","","JIT-Mobile-013-JITDEF-reflect-delete-screen-innavigation-tree","","JIT-Mobile-013-JITDEF-reflect-delete-screen-innavigation-tree","[DEFECT] As a user, I should see screen will be removed in navigation tree after deleting screen","[DEFECT] As a user, I should see screen will be removed in navigation tree after deleting screen",""
"passed","Sun Feb 19 18:33:47 GMT 2023","Sun Feb 19 18:35:19 GMT 2023","91884","","JIT-Mobile-035b-FLATLIST-General-info","","JIT-Mobile-035b-FLATLIST-General-info","[MOBILE-FLATLIST] As a user, I should check the general infomation of FlatList is correct: Name, Key, unique key, delete component","[MOBILE-FLATLIST] As a user, I should check the general infomation of FlatList is correct: Name, Key, unique key, delete component",""
"passed","Sun Feb 19 20:21:11 GMT 2023","Sun Feb 19 20:39:21 GMT 2023","1090548","","JIT-Preview-005-Preview-TOAST-MESSAGE","","JIT-Preview-005-Preview-TOAST-MESSAGE","[PREVIEW-TOAST-MESSAGE] As a user, I check preview function for Toast message action","[PREVIEW-TOAST-MESSAGE] As a user, I check preview function for Toast message action",""
"passed","Sun Feb 19 18:44:38 GMT 2023","Sun Feb 19 18:45:40 GMT 2023","62362","","JIT-Module-016a-SENDGRID-default","","JIT-Module-016a-SENDGRID-default","[SENDGRID] As a user, I can add module SendGrid and remove it","[SENDGRID] As a user, I can add module SendGrid and remove it",""
"passed","Sun Feb 19 18:12:38 GMT 2023","Sun Feb 19 18:16:02 GMT 2023","203998","","JIT-Database-006-COLUMN-type-STRING","","JIT-Database-006-COLUMN-type-STRING","[COLUMN] As a user, I should check the validation of STRING column definition","[COLUMN] As a user, I should check the validation of STRING column definition",""
