"Status","Start Time","Stop Time","Duration in ms","Parent Suite","Suite","Sub Suite","Test Class","Test Method","Name","Description"
"passed","Sun Feb 19 18:46:23 GMT 2023","Sun Feb 19 18:47:14 GMT 2023","51530","","JIT-Module-019b-GOOGLE-ANALYTICS-edit-infos","","JIT-Module-019b-GOOGLE-ANALYTICS-edit-infos","[GOOGLE-ANALYTICS] As a user, I can update module Google Analytics information for each environment","[GOOGLE-ANALYTICS] As a user, I can update module Google Analytics information for each environment",""
"passed","Sun Feb 19 18:38:13 GMT 2023","Sun Feb 19 18:39:59 GMT 2023","106604","","JIT-Module-002b-DEEPLINK-edit-infos","","JIT-Module-002b-DEEPLINK-edit-infos","As a user, I can update module Deeplink","As a user, I can update module Deeplink",""
"passed","Sun Feb 19 18:40:28 GMT 2023","Sun Feb 19 18:42:58 GMT 2023","149257","","JIT-Module-007a-APPLE-LOGIN-default-edit","","JIT-Module-007a-APPLE-LOGIN-default-edit","[APPLE-LOGIN], I can add module Apple Login and edit its infos","[APPLE-LOGIN], I can add module Apple Login and edit its infos",""
"passed","Sun Feb 19 19:02:55 GMT 2023","Sun Feb 19 19:04:58 GMT 2023","122994","","JIT-API-003b-POST-update-info","","JIT-API-003b-POST-update-info","As a user, I update info for API POST","As a user, I update info for API POST",""
"passed","Sun Feb 19 19:05:06 GMT 2023","Sun Feb 19 19:06:41 GMT 2023","94649","","JIT-API-007bb-GET-list-API-Check-datetime-static-value","","JIT-API-007bb-GET-list-API-Check-datetime-static-value","[GET-list-API] Set datetime static value","[GET-list-API] Set datetime static value",""
"passed","Sun Feb 19 18:30:31 GMT 2023","Sun Feb 19 18:32:17 GMT 2023","105667","","JIT-Mobile-030b-WEBVIEW-General-info","","JIT-Mobile-030b-WEBVIEW-General-info","[MOBILE-WEBVIEW] As a user, I should check the general infomation of Webview is correct: Name, Key, unique key, delete component","[MOBILE-WEBVIEW] As a user, I should check the general infomation of Webview is correct: Name, Key, unique key, delete component",""
"passed","Sun Feb 19 18:53:31 GMT 2023","Sun Feb 19 18:55:14 GMT 2023","103475","","JIT-Web-002f-MOLECULE-Navigate-edit-screen","","JIT-Web-002f-MOLECULE-Navigate-edit-screen","[WEB-MOLECULE-EDIT] As a user, I can see the molecule in Page and use Edit button see the content of this molecule","[WEB-MOLECULE-EDIT] As a user, I can see the molecule in Page and use Edit button see the content of this molecule",""
"passed","Sun Feb 19 18:56:14 GMT 2023","Sun Feb 19 19:00:27 GMT 2023","252580","","JIT-Web-007a-ASSET-Upload","","JIT-Web-007a-ASSET-Upload","[ASSET] As a user, I can upload new image and store in Asset Manager and use it in all Image component","[ASSET] As a user, I can upload new image and store in Asset Manager and use it in all Image component",""
"passed","Sun Feb 19 19:51:10 GMT 2023","Sun Feb 19 19:53:13 GMT 2023","123362","","JIT-Export-005b-Scenario-RN-all-default-component","","JIT-Export-005b-Scenario-RN-all-default-component","[RN-Default] As a user, I check export the project type React Native with all default component","[RN-Default] As a user, I check export the project type React Native with all default component",""
"passed","Sun Feb 19 18:10:30 GMT 2023","Sun Feb 19 18:11:50 GMT 2023","79126","","JIT-Database-001e-TABLE-create-by-context-menu","","JIT-Database-001e-TABLE-create-by-context-menu","[TABLE] As a user, I can create new table by context menu","[TABLE] As a user, I can create new table by context menu",""
"passed","Sun Feb 19 18:31:55 GMT 2023","Sun Feb 19 18:33:30 GMT 2023","95359","","JIT-Mobile-032b-CAROUSEL-General-info","","JIT-Mobile-032b-CAROUSEL-General-info","[MOBILE-CAROUSEL] As a user, I should check the general infomation of Carousel is correct: Name, Key, unique key, delete component","[MOBILE-CAROUSEL] As a user, I should check the general infomation of Carousel is correct: Name, Key, unique key, delete component",""
"passed","Sun Feb 19 18:48:16 GMT 2023","Sun Feb 19 18:52:34 GMT 2023","258219","","JIT-Web-001g-PAGE-FIGMA-Import","","JIT-Web-001g-PAGE-FIGMA-Import","[PAGE-FIGMA] As a user, I can import the figma file to the jitera studio","[PAGE-FIGMA] As a user, I can import the figma file to the jitera studio",""
"passed","Sun Feb 19 18:45:51 GMT 2023","Sun Feb 19 18:46:41 GMT 2023","50455","","JIT-Module-017b-GOOGLE-ANAL-edit-infos","","JIT-Module-017b-GOOGLE-ANAL-edit-infos","[GOOGLE-ANAL] As a user, I can update module Google Analytics","[GOOGLE-ANAL] As a user, I can update module Google Analytics",""
"passed","Sun Feb 19 18:31:34 GMT 2023","Sun Feb 19 18:33:13 GMT 2023","99047","","JIT-Mobile-031b-DIVIDER-General-info","","JIT-Mobile-031b-DIVIDER-General-info","[MOBILE-DIVIDER] As a user, I should check the general infomation of Divider is correct: Name, Key, unique key, delete component","[MOBILE-DIVIDER] As a user, I should check the general infomation of Divider is correct: Name, Key, unique key, delete component",""
"passed","Sun Feb 19 19:53:58 GMT 2023","Sun Feb 19 19:54:29 GMT 2023","31382","","JIT-Export-007-Existing-Scenario-ROR-withkey","","JIT-Export-007-Existing-Scenario-ROR-withkey","As a user, I check export the existing project type ROR with key successfully","As a user, I check export the existing project type ROR with key successfully",""
"passed","Sun Feb 19 18:12:43 GMT 2023","Sun Feb 19 18:14:17 GMT 2023","93294","","JIT-Database-008-COLUMN-type-DATE-TIME","","JIT-Database-008-COLUMN-type-DATE-TIME","[COLUMN] As a user, I should check the validation of DATETIME column definition","[COLUMN] As a user, I should check the validation of DATETIME column definition",""
"passed","Sun Feb 19 19:49:04 GMT 2023","Sun Feb 19 19:51:03 GMT 2023","118740","","JIT-Export-005a-Scenario-RN-login-screen","","JIT-Export-005a-Scenario-RN-login-screen","[RN-Login-screen] As a user, I check export the project type React Native and Nextjs successfully with scenario 1","[RN-Login-screen] As a user, I check export the project type React Native and Nextjs successfully with scenario 1",""
"passed","Sun Feb 19 18:39:16 GMT 2023","Sun Feb 19 18:41:40 GMT 2023","144374","","JIT-Module-005b-FORCE-MOBILE-UPDATE-api","","JIT-Module-005b-FORCE-MOBILE-UPDATE-api","[FORCE-MOBILE-UPDATE] - Check api","[FORCE-MOBILE-UPDATE] - Check api",""
"passed","Sun Feb 19 19:13:56 GMT 2023","Sun Feb 19 19:15:41 GMT 2023","104999","","JIT-Database-015m-INDEX-ALL-column-config","","JIT-Database-015m-INDEX-ALL-column-config","[INDEX-ALL] As a user, I config with multiple column and check show multiple on index pop-up","[INDEX-ALL] As a user, I config with multiple column and check show multiple on index pop-up",""
"passed","Sun Feb 19 18:23:50 GMT 2023","Sun Feb 19 18:25:14 GMT 2023","84059","","JIT-Mobile-012-JITDEF-remove-poperty-info-after-deleting-navigation","","JIT-Mobile-012-JITDEF-remove-poperty-info-after-deleting-navigation","[DEFECT] As a user, I should see the property infos need to be removed after the navigation was deleted","[DEFECT] As a user, I should see the property infos need to be removed after the navigation was deleted",""
"passed","Sun Feb 19 19:09:12 GMT 2023","Sun Feb 19 19:11:49 GMT 2023","157016","","JIT-Database-015c-INDEX-CRUD-multiple","","JIT-Database-015c-INDEX-CRUD-multiple","[INDEX] As a user, I check add and update single index","[INDEX] As a user, I check add and update single index",""
"passed","Sun Feb 19 18:20:46 GMT 2023","Sun Feb 19 18:23:25 GMT 2023","158830","","JIT-Mobile-002-SCREEN-Update","","JIT-Mobile-002-SCREEN-Update","[MOBILE-SCREEN] As a user, I can update screen with positive and negative cases","[MOBILE-SCREEN] As a user, I can update screen with positive and negative cases",""
"passed","Sun Feb 19 18:20:01 GMT 2023","Sun Feb 19 18:21:39 GMT 2023","98175","","JIT-Mobile-001-SCREEN-Create-new","","JIT-Mobile-001-SCREEN-Create-new","[MOBILE-SCREEN] As a user, I can create new screen with positive and negative cases","[MOBILE-SCREEN] As a user, I can create new screen with positive and negative cases",""
"passed","Sun Feb 19 18:51:34 GMT 2023","Sun Feb 19 18:55:04 GMT 2023","210419","","JIT-Web-002b-MOLECULE-Update","","JIT-Web-002b-MOLECULE-Update","[WEB-MOLECULE] As a user, I can update molecule with positive and negative cases","[WEB-MOLECULE] As a user, I can update molecule with positive and negative cases",""
"passed","Sun Feb 19 18:41:11 GMT 2023","Sun Feb 19 18:43:38 GMT 2023","147106","","JIT-Module-009a-GOOGLE-LOGIN-default-edit","","JIT-Module-009a-GOOGLE-LOGIN-default-edit","[GOOGLE-LOGIN], I can add module Google Login and edit its infos","[GOOGLE-LOGIN], I can add module Google Login and edit its infos",""
"passed","Sun Feb 19 18:15:16 GMT 2023","Sun Feb 19 18:16:36 GMT 2023","79943","","JIT-Database-011b-COLUMN-ENUM-add-items","","JIT-Database-011b-COLUMN-ENUM-add-items","[COLUMN] As a user, I should add new item and select in default dropdown","[COLUMN] As a user, I should add new item and select in default dropdown",""
"passed","Sun Feb 19 18:17:47 GMT 2023","Sun Feb 19 18:19:05 GMT 2023","78191","","JIT-Database-013-DEFECT-Check-default-value-when-changing-type","","JIT-Database-013-DEFECT-Check-default-value-when-changing-type","[DEFECT] As a user, I should check the default value when changing the type","[DEFECT] As a user, I should check the default value when changing the type",""
"passed","Sun Feb 19 18:40:05 GMT 2023","Sun Feb 19 18:42:05 GMT 2023","119245","","JIT-Module-006b-SMS-edit-infos","","JIT-Module-006b-SMS-edit-infos","[SMS], I can add module SMS login with Twilio and edit its infos","[SMS], I can add module SMS login with Twilio and edit its infos",""
"passed","Sun Feb 19 18:38:52 GMT 2023","Sun Feb 19 18:40:12 GMT 2023","79221","","JIT-Module-004a-EMAIL-LOGIN-default","","JIT-Module-004a-EMAIL-LOGIN-default","[EMAIL-LOGIN] - Check adding and auto-generated API","[EMAIL-LOGIN] - Check adding and auto-generated API",""
"failed","Sun Feb 19 20:01:21 GMT 2023","Sun Feb 19 20:05:12 GMT 2023","231383","","JIT-Preview-001b-Preview-DATABASE-COL-TEXT-Validation","","JIT-Preview-001b-Preview-DATABASE-COL-TEXT-Validation","[PREVIEW-DATABASE-COL-TEXT] As a user, I check preview function for validation of Text","[PREVIEW-DATABASE-COL-TEXT] As a user, I check preview function for validation of Text",""
"passed","Sun Feb 19 18:21:16 GMT 2023","Sun Feb 19 18:22:31 GMT 2023","75020","","JIT-Mobile-003-SCREEN-Delete","","JIT-Mobile-003-SCREEN-Delete","[MOBILE-SCREEN] As a user, I can delete screen","[MOBILE-SCREEN] As a user, I can delete screen",""
"failed","Sun Feb 19 19:42:19 GMT 2023","Sun Feb 19 19:44:06 GMT 2023","107319","","JIT-Web-002e-MOLECULE-Search","","JIT-Web-002e-MOLECULE-Search","[WEB-PAGE] As a user, I can search correct molecule with keyword","[WEB-PAGE] As a user, I can search correct molecule with keyword",""
"passed","Sun Feb 19 19:42:50 GMT 2023","Sun Feb 19 19:43:39 GMT 2023","49860","","JIT-Web-010a-LAYER-TREE-Check-edit-and-action","","JIT-Web-010a-LAYER-TREE-Check-edit-and-action","[LAYER-TREE] As a user, I could update the name of the node in the layer tree and copy,paste,delete,wrap the node","[LAYER-TREE] As a user, I could update the name of the node in the layer tree and copy,paste,delete,wrap the node",""
"passed","Sun Feb 19 18:47:39 GMT 2023","Sun Feb 19 18:50:08 GMT 2023","149466","","JIT-Web-001c-PAGE-Delete","","JIT-Web-001c-PAGE-Delete","[PAGE] As a user, I can delete page","[PAGE] As a user, I can delete page",""
"passed","Sun Feb 19 19:01:02 GMT 2023","Sun Feb 19 19:02:55 GMT 2023","113176","","JIT-API-002a-GET-list-check-default","","JIT-API-002a-GET-list-check-default","As a user, I check default value in API GET list","As a user, I check default value in API GET list",""
"passed","Sun Feb 19 18:46:18 GMT 2023","Sun Feb 19 18:47:11 GMT 2023","52841","","JIT-Module-019a-GOOGLE-ANALYTICS-default","","JIT-Module-019a-GOOGLE-ANALYTICS-default","[GOOGLE-ANALYTICS] As a user, I can add module Google Analytics and remove it","[GOOGLE-ANALYTICS] As a user, I can add module Google Analytics and remove it",""
"passed","Sun Feb 19 18:29:37 GMT 2023","Sun Feb 19 18:31:16 GMT 2023","98637","","JIT-Mobile-029b-TOUCHABLE-General-info","","JIT-Mobile-029b-TOUCHABLE-General-info","[MOBILE-TOUCHABLE] As a user, I should check the general infomation of Touchable is correct: Name, Key, unique key, delete component","[MOBILE-TOUCHABLE] As a user, I should check the general infomation of Touchable is correct: Name, Key, unique key, delete component",""
"passed","Sun Feb 19 18:54:46 GMT 2023","Sun Feb 19 18:58:37 GMT 2023","230706","","JIT-Web-004a-ACTION-NAVIGATION-no-param","","JIT-Web-004a-ACTION-NAVIGATION-no-param","[WEB-ACTION-NAVIGATION] As a user, I could add action type navigation without params and check preview code","[WEB-ACTION-NAVIGATION] As a user, I could add action type navigation without params and check preview code",""
"passed","Sun Feb 19 18:56:18 GMT 2023","Sun Feb 19 19:00:21 GMT 2023","243047","","JIT-Web-007b-ASSET-Rename-and-delete","","JIT-Web-007b-ASSET-Rename-and-delete","[ASSET] As a user, I can rename and delete image asset","[ASSET] As a user, I can rename and delete image asset",""
"passed","Sun Feb 19 18:56:37 GMT 2023","Sun Feb 19 18:58:55 GMT 2023","138230","","JIT-Web-009a-TABLE-Add-new","","JIT-Web-009a-TABLE-Add-new","[TABLE] As a user, I can create new Admin page","[TABLE] As a user, I can create new Admin page",""
"passed","Sun Feb 19 18:10:30 GMT 2023","Sun Feb 19 18:11:33 GMT 2023","62725","","JIT-Database-001b-TABLE-empty","","JIT-Database-001b-TABLE-empty","[TABLE] As a user, I cannot create table with empty name","[TABLE] As a user, I cannot create table with empty name",""
"passed","Sun Feb 19 18:15:18 GMT 2023","Sun Feb 19 18:16:36 GMT 2023","77280","","JIT-Database-011c-COLUMN-ENUM-delete-items","","JIT-Database-011c-COLUMN-ENUM-delete-items","[COLUMN] As a user, I should delete 1 item and check not display in default dropdown","[COLUMN] As a user, I should delete 1 item and check not display in default dropdown",""
"passed","Sun Feb 19 19:44:19 GMT 2023","Sun Feb 19 19:45:01 GMT 2023","41704","","JIT-Database-003b-COLUMN-duplicated","","JIT-Database-003b-COLUMN-duplicated","[COLUMN] As a user, I cannot add duplicated column definition","[COLUMN] As a user, I cannot add duplicated column definition",""
"passed","Sun Feb 19 19:41:29 GMT 2023","Sun Feb 19 19:42:08 GMT 2023","38830","","JIT-Module-014a-BASIC-AUTH-default","","JIT-Module-014a-BASIC-AUTH-default","[BASIC-AUTH] As a user, I can add module Basic Authentication and remove it","[BASIC-AUTH] As a user, I can add module Basic Authentication and remove it",""
"passed","Sun Feb 19 19:07:14 GMT 2023","Sun Feb 19 19:08:28 GMT 2023","74217","","JIT-API-007f-DELETE-API-Add-new-endpoint","","JIT-API-007f-DELETE-API-Add-new-endpoint","[DELETE-API] Create, update and delete new DELETE API endpoint","[DELETE-API] Create, update and delete new DELETE API endpoint",""
"passed","Sun Feb 19 18:40:39 GMT 2023","Sun Feb 19 18:43:11 GMT 2023","152572","","JIT-Module-008a-FB-LOGIN-default-edit","","JIT-Module-008a-FB-LOGIN-default-edit","[FACEBOOK-LOGIN], I can add module Facebook Login and edit its infos","[FACEBOOK-LOGIN], I can add module Facebook Login and edit its infos",""
"passed","Sun Feb 19 18:10:30 GMT 2023","Sun Feb 19 18:11:58 GMT 2023","88464","","JIT-Database-001a-TABLE-new","","JIT-Database-001a-TABLE-new","[TABLE] As a user, I can create new table","[TABLE] As a user, I can create new table",""
"passed","Sun Feb 19 18:24:21 GMT 2023","Sun Feb 19 18:26:36 GMT 2023","135500","","JIT-Mobile-014-JITDEF-status-bar","","JIT-Mobile-014-JITDEF-status-bar","[DEFECT] As a user, I should see screen will be removed in navigation tree after deleting screen","[DEFECT] As a user, I should see screen will be removed in navigation tree after deleting screen",""
"passed","Sun Feb 19 19:13:51 GMT 2023","Sun Feb 19 19:15:20 GMT 2023","88579","","JIT-Database-015l-INDEX-ENUM-column-config","","JIT-Database-015l-INDEX-ENUM-column-config","[INDEX-ENUM] As a user, I config index from column setting && check on index popup","[INDEX-ENUM] As a user, I config index from column setting && check on index popup",""
"passed","Sun Feb 19 18:47:22 GMT 2023","Sun Feb 19 18:51:43 GMT 2023","261723","","JIT-Web-001a-PAGE-Create-new","","JIT-Web-001a-PAGE-Create-new","[PAGE] As a user, I can create new screen with positive and negative cases","[PAGE] As a user, I can create new screen with positive and negative cases",""
"passed","Sun Feb 19 19:05:19 GMT 2023","Sun Feb 19 19:06:53 GMT 2023","94281","","JIT-API-007c-GET-detail-API-Add-new-endpoint","","JIT-API-007c-GET-detail-API-Add-new-endpoint","[GET-detail-API] Create, update and delete new GET API endpoint","[GET-detail-API] Create, update and delete new GET API endpoint",""
"passed","Sun Feb 19 19:41:30 GMT 2023","Sun Feb 19 19:42:35 GMT 2023","65793","","JIT-Module-006a-SMS-default","","JIT-Module-006a-SMS-default","[SMS], I can add module SMS login with Twilio and remove it","[SMS], I can add module SMS login with Twilio and remove it",""
"passed","Sun Feb 19 18:10:30 GMT 2023","Sun Feb 19 18:11:42 GMT 2023","72541","","JIT-Database-001c-TABLE-duplicate","","JIT-Database-001c-TABLE-duplicate","[TABLE] As a user, I cannot create table with duplicate name","[TABLE] As a user, I cannot create table with duplicate name",""
"passed","Sun Feb 19 19:12:13 GMT 2023","Sun Feb 19 19:13:38 GMT 2023","84871","","JIT-Database-015i-INDEX-DATETIME-column-config","","JIT-Database-015i-INDEX-DATETIME-column-config","[INDEX-DATETIME] As a user, I config index from column setting && check on index popup","[INDEX-DATETIME] As a user, I config index from column setting && check on index popup",""
"passed","Sun Feb 19 19:01:12 GMT 2023","Sun Feb 19 19:02:30 GMT 2023","78195","","JIT-API-002c-GET-list","","JIT-API-002c-GET-list","As a user, I check column display when having relation for GET-list","As a user, I check column display when having relation for GET-list",""
"passed","Sun Feb 19 18:34:11 GMT 2023","Sun Feb 19 18:36:06 GMT 2023","115577","","JIT-Mobile-036a-DATETIMEPICKER-Check-PreviewCode","","JIT-Mobile-036a-DATETIMEPICKER-Check-PreviewCode","[MOBILE-DATETIMEPICKER] As a user, I should check the Preview code of DatetimePicker component","[MOBILE-DATETIMEPICKER] As a user, I should check the Preview code of DatetimePicker component",""
"passed","Sun Feb 19 20:05:25 GMT 2023","Sun Feb 19 20:08:32 GMT 2023","187372","","JIT-Preview-001d-Preview-DATABASE-COL-FLOAT-Validation","","JIT-Preview-001d-Preview-DATABASE-COL-FLOAT-Validation","[PREVIEW-DATABASE-COL-FLOAT] As a user, I check preview function for validation of Float","[PREVIEW-DATABASE-COL-FLOAT] As a user, I check preview function for validation of Float",""
"passed","Sun Feb 19 18:35:11 GMT 2023","Sun Feb 19 18:37:19 GMT 2023","128238","","JIT-Mobile-042a-ACTION-NAVIGATION-no-param","","JIT-Mobile-042a-ACTION-NAVIGATION-no-param","[MOBILE-ACTION-NAVIGATION] As a user, I could add action type navigation without params and check preview code","[MOBILE-ACTION-NAVIGATION] As a user, I could add action type navigation without params and check preview code",""
"passed","Sun Feb 19 18:38:55 GMT 2023","Sun Feb 19 18:40:22 GMT 2023","87251","","JIT-Module-005a-FORCE-MOBILE-UPDATE-database","","JIT-Module-005a-FORCE-MOBILE-UPDATE-database","[FORCE-MOBILE-UPDATE] - Check adding and auto-table & columns","[FORCE-MOBILE-UPDATE] - Check adding and auto-table & columns",""
"passed","Sun Feb 19 19:12:06 GMT 2023","Sun Feb 19 19:13:33 GMT 2023","87031","","JIT-Database-015h-INDEX-DATE-column-config","","JIT-Database-015h-INDEX-DATE-column-config","[INDEX-DATE] As a user, I config index from column setting && check on index popup","[INDEX-DATE] As a user, I config index from column setting && check on index popup",""
"passed","Sun Feb 19 19:12:00 GMT 2023","Sun Feb 19 19:13:28 GMT 2023","88227","","JIT-Database-015g-INDEX-FLOAT-column-config","","JIT-Database-015g-INDEX-FLOAT-column-config","[INDEX-FLOAT] As a user, I config index from column setting && check on index popup","[INDEX-FLOAT] As a user, I config index from column setting && check on index popup",""
"passed","Sun Feb 19 18:17:59 GMT 2023","Sun Feb 19 18:19:21 GMT 2023","82796","","JIT-Database-015a-INDEX-Check-duplicate-empty","","JIT-Database-015a-INDEX-Check-duplicate-empty","[INDEX] As a user, I check empty and duplicate index","[INDEX] As a user, I check empty and duplicate index",""
"passed","Sun Feb 19 18:52:53 GMT 2023","Sun Feb 19 18:59:30 GMT 2023","396535","","JIT-Web-002d-MOLECULE-Duplicate","","JIT-Web-002d-MOLECULE-Duplicate","[WEB-MOLECULE] As a user, I can duplicate molecule with positive and negative cases","[WEB-MOLECULE] As a user, I can duplicate molecule with positive and negative cases",""
"passed","Sun Feb 19 20:05:22 GMT 2023","Sun Feb 19 20:08:21 GMT 2023","178613","","JIT-Preview-001c-Preview-DATABASE-COL-INTEGER-Validation","","JIT-Preview-001c-Preview-DATABASE-COL-INTEGER-Validation","[PREVIEW-DATABASE-COL-INTEGER] As a user, I check preview function for validation of Integer","[PREVIEW-DATABASE-COL-INTEGER] As a user, I check preview function for validation of Integer",""
"passed","Sun Feb 19 19:02:38 GMT 2023","Sun Feb 19 19:04:20 GMT 2023","102127","","JIT-API-003a-POST-check-default","","JIT-API-003a-POST-check-default","As a user, I check default value in API POST","As a user, I check default value in API POST",""
"passed","Sun Feb 19 18:12:43 GMT 2023","Sun Feb 19 18:14:25 GMT 2023","101446","","JIT-Database-009-COLUMN-type-BOOLEAN","","JIT-Database-009-COLUMN-type-BOOLEAN","[COLUMN] As a user, I should check the validation of BOOLEAN column definition","[COLUMN] As a user, I should check the validation of BOOLEAN column definition",""
"passed","Sun Feb 19 18:22:17 GMT 2023","Sun Feb 19 18:25:26 GMT 2023","189603","","JIT-Mobile-005b-MOLECULE-Navigate-edit-screen","","JIT-Mobile-005b-MOLECULE-Navigate-edit-screen","[MOBILE-MOLECULE-EDIT] As a user, I can see the molecule in Screen and use Edit button see the content of this molecule","[MOBILE-MOLECULE-EDIT] As a user, I can see the molecule in Screen and use Edit button see the content of this molecule",""
"passed","Sun Feb 19 19:48:33 GMT 2023","Sun Feb 19 19:50:47 GMT 2023","133181","","JIT-Export-003-Scenario_ROR_2","","JIT-Export-003-Scenario_ROR_2","As a user, I check export the project type ROR no key successfully with scenario 2","As a user, I check export the project type ROR no key successfully with scenario 2",""
"passed","Sun Feb 19 18:27:40 GMT 2023","Sun Feb 19 18:29:28 GMT 2023","108303","","JIT-Mobile-026b-BUTTON-General-info","","JIT-Mobile-026b-BUTTON-General-info","[MOBILE-BUTTON] As a user, I should check the general infomation of Button is correct: Name, Key, unique key, delete component","[MOBILE-BUTTON] As a user, I should check the general infomation of Button is correct: Name, Key, unique key, delete component",""
"passed","Sun Feb 19 18:52:51 GMT 2023","Sun Feb 19 18:55:03 GMT 2023","131409","","JIT-Web-002c-MOLECULE-Delete","","JIT-Web-002c-MOLECULE-Delete","[WEB-MOLECULE] As a user, I can delete molecule","[WEB-MOLECULE] As a user, I can delete molecule",""
"passed","Sun Feb 19 18:32:17 GMT 2023","Sun Feb 19 18:33:56 GMT 2023","99618","","JIT-Mobile-033b-HEADER-General-info","","JIT-Mobile-033b-HEADER-General-info","[MOBILE-HEADER] As a user, I should check the general infomation of Header is correct: Name, Key, unique key, delete component","[MOBILE-HEADER] As a user, I should check the general infomation of Header is correct: Name, Key, unique key, delete component",""
"passed","Sun Feb 19 20:08:44 GMT 2023","Sun Feb 19 20:21:00 GMT 2023","735857","","JIT-Preview-004-Preview-BUTTON","","JIT-Preview-004-Preview-BUTTON","[PREVIEW-BUTTON] As a user, I check preview function for Button component","[PREVIEW-BUTTON] As a user, I check preview function for Button component",""
"passed","Sun Feb 19 20:21:36 GMT 2023","Sun Feb 19 20:38:25 GMT 2023","1009526","","JIT-Preview-007-Preview-TABLE","","JIT-Preview-007-Preview-TABLE","[PREVIEW-WEB-TABLE] As a user, I check preview Table","[PREVIEW-WEB-TABLE] As a user, I check preview Table",""
"passed","Sun Feb 19 18:21:30 GMT 2023","Sun Feb 19 18:23:15 GMT 2023","104520","","JIT-Mobile-005-MOLECULE-Create-new","","JIT-Mobile-005-MOLECULE-Create-new","[MOBILE-MOLECULE] As a user, I can create new molecule with positive and negative cases","[MOBILE-MOLECULE] As a user, I can create new molecule with positive and negative cases",""
"passed","Sun Feb 19 18:12:53 GMT 2023","Sun Feb 19 18:15:25 GMT 2023","152036","","JIT-Database-010b-COLUMN-FILE-format-file","","JIT-Database-010b-COLUMN-FILE-format-file","[COLUMN] As a user, I should check the validation of FILE column definition for Format Area","[COLUMN] As a user, I should check the validation of FILE column definition for Format Area",""
"passed","Sun Feb 19 18:12:39 GMT 2023","Sun Feb 19 18:16:44 GMT 2023","245427","","JIT-Database-007-COLUMN-type-TEXT","","JIT-Database-007-COLUMN-type-TEXT","[COLUMN] As a user, I should check the validation of TEXT column definition","[COLUMN] As a user, I should check the validation of TEXT column definition",""
"passed","Sun Feb 19 18:19:36 GMT 2023","Sun Feb 19 18:21:23 GMT 2023","106843","","JIT-Database-016b-COUNTER-CACHE-Create-by-adding-column","","JIT-Database-016b-COUNTER-CACHE-Create-by-adding-column","[COUNTER-CACHE] create new counter cache column by adding column","[COUNTER-CACHE] create new counter cache column by adding column",""
"passed","Sun Feb 19 18:41:32 GMT 2023","Sun Feb 19 18:43:34 GMT 2023","121542","","JIT-Module-011a-GUEST-LOGIN-default-edit","","JIT-Module-011a-GUEST-LOGIN-default-edit","[GUEST-LOGIN], I can add module Guest Login and edit its infos","[GUEST-LOGIN], I can add module Guest Login and edit its infos",""
