"Status","Start Time","Stop Time","Duration in ms","Parent Suite","Suite","Sub Suite","Test Class","Test Method","Name","Description"
"passed","Tue Feb 14 20:11:17 GMT 2023","Tue Feb 14 20:21:56 GMT 2023","639143","","JIT-Preview-007-Preview-TABLE","","JIT-Preview-007-Preview-TABLE","[PREVIEW-WEB-TABLE] As a user, I check preview Table","[PREVIEW-WEB-TABLE] As a user, I check preview Table",""
"passed","Tue Feb 14 18:38:30 GMT 2023","Tue Feb 14 18:39:44 GMT 2023","74861","","JIT-Module-014b-BASIC-AUTH-edit-infos","","JIT-Module-014b-BASIC-AUTH-edit-infos","[BASIC-AUTH] As a user, I can update module Basic Authentication","[BASIC-AUTH] As a user, I can update module Basic Authentication",""
"passed","Tue Feb 14 19:21:44 GMT 2023","Tue Feb 14 19:22:36 GMT 2023","52260","","JIT-Web-001a-PAGE-Create-new","","JIT-Web-001a-PAGE-Create-new","[PAGE] As a user, I can create new screen with positive and negative cases","[PAGE] As a user, I can create new screen with positive and negative cases",""
"passed","Tue Feb 14 18:41:05 GMT 2023","Tue Feb 14 18:42:31 GMT 2023","86083","","JIT-Team-005-Invite-duplicate-email","","JIT-Team-005-Invite-duplicate-email","[INVITE-DELETE] Invite new email and invite again","[INVITE-DELETE] Invite new email and invite again",""
"passed","Tue Feb 14 19:30:49 GMT 2023","Tue Feb 14 19:32:41 GMT 2023","112471","","JIT-Export-002-Scenario-ROR-withkey-1","","JIT-Export-002-Scenario-ROR-withkey-1","As a user, I check export the project type ROR with key successfully with scenario 1","As a user, I check export the project type ROR with key successfully with scenario 1",""
"passed","Tue Feb 14 18:20:27 GMT 2023","Tue Feb 14 18:22:51 GMT 2023","144107","","JIT-Mobile-005b-MOLECULE-Navigate-edit-screen","","JIT-Mobile-005b-MOLECULE-Navigate-edit-screen","[MOBILE-MOLECULE-EDIT] As a user, I can see the molecule in Screen and use Edit button see the content of this molecule","[MOBILE-MOLECULE-EDIT] As a user, I can see the molecule in Screen and use Edit button see the content of this molecule",""
"passed","Tue Feb 14 19:41:25 GMT 2023","Tue Feb 14 19:48:11 GMT 2023","406496","","JIT-Preview-001-Preview-DATABASE-COL-STRING-Validation","","JIT-Preview-001-Preview-DATABASE-COL-STRING-Validation","[PREVIEW-DATABASE-COL-STRING] As a user, I check preview function for validation of String","[PREVIEW-DATABASE-COL-STRING] As a user, I check preview function for validation of String",""
"passed","Tue Feb 14 18:26:38 GMT 2023","Tue Feb 14 18:28:05 GMT 2023","87494","","JIT-Mobile-029b-TOUCHABLE-General-info","","JIT-Mobile-029b-TOUCHABLE-General-info","[MOBILE-TOUCHABLE] As a user, I should check the general infomation of Touchable is correct: Name, Key, unique key, delete component","[MOBILE-TOUCHABLE] As a user, I should check the general infomation of Touchable is correct: Name, Key, unique key, delete component",""
"passed","Tue Feb 14 19:25:56 GMT 2023","Tue Feb 14 19:26:27 GMT 2023","31006","","JIT-Database-003a-COLUMN-empty","","JIT-Database-003a-COLUMN-empty","[COLUMN] As a user, I cannot add empty column definition","[COLUMN] As a user, I cannot add empty column definition",""
"passed","Tue Feb 14 18:14:12 GMT 2023","Tue Feb 14 18:15:29 GMT 2023","76766","","JIT-Database-011b-COLUMN-ENUM-add-items","","JIT-Database-011b-COLUMN-ENUM-add-items","[COLUMN] As a user, I should add new item and select in default dropdown","[COLUMN] As a user, I should add new item and select in default dropdown",""
"passed","Tue Feb 14 19:23:05 GMT 2023","Tue Feb 14 19:24:32 GMT 2023","87705","","JIT-Database-010b-COLUMN-FILE-format-file","","JIT-Database-010b-COLUMN-FILE-format-file","[COLUMN] As a user, I should check the validation of FILE column definition for Format Area","[COLUMN] As a user, I should check the validation of FILE column definition for Format Area",""
"passed","Tue Feb 14 18:32:11 GMT 2023","Tue Feb 14 18:32:49 GMT 2023","37366","","JIT-Module-000-search","","JIT-Module-000-search","[SEARCH] As a user, I can Search module","[SEARCH] As a user, I can Search module",""
"passed","Tue Feb 14 20:00:32 GMT 2023","Tue Feb 14 20:13:15 GMT 2023","762990","","JIT-Preview-005-Preview-TOAST-MESSAGE","","JIT-Preview-005-Preview-TOAST-MESSAGE","[PREVIEW-TOAST-MESSAGE] As a user, I check preview function for Toast message action","[PREVIEW-TOAST-MESSAGE] As a user, I check preview function for Toast message action",""
"passed","Tue Feb 14 19:23:34 GMT 2023","Tue Feb 14 19:24:08 GMT 2023","34530","","JIT-Database-001a-TABLE-new","","JIT-Database-001a-TABLE-new","[TABLE] As a user, I can create new table","[TABLE] As a user, I can create new table",""
"passed","Tue Feb 14 18:44:57 GMT 2023","Tue Feb 14 18:46:36 GMT 2023","99437","","JIT-Web-002c-MOLECULE-Delete","","JIT-Web-002c-MOLECULE-Delete","[WEB-MOLECULE] As a user, I can delete molecule","[WEB-MOLECULE] As a user, I can delete molecule",""
"passed","Tue Feb 14 19:25:56 GMT 2023","Tue Feb 14 19:26:40 GMT 2023","43891","","JIT-Database-003b-COLUMN-duplicated","","JIT-Database-003b-COLUMN-duplicated","[COLUMN] As a user, I cannot add duplicated column definition","[COLUMN] As a user, I cannot add duplicated column definition",""
"passed","Tue Feb 14 18:35:47 GMT 2023","Tue Feb 14 18:37:51 GMT 2023","124035","","JIT-Module-007a-APPLE-LOGIN-default-edit","","JIT-Module-007a-APPLE-LOGIN-default-edit","[APPLE-LOGIN], I can add module Apple Login and edit its infos","[APPLE-LOGIN], I can add module Apple Login and edit its infos",""
"passed","Tue Feb 14 18:58:20 GMT 2023","Tue Feb 14 18:59:39 GMT 2023","78429","","JIT-Database-015e-INDEX-TEXT-column-config","","JIT-Database-015e-INDEX-TEXT-column-config","[INDEX-TEXT] As a user, I config index from column setting && check on index popup","[INDEX-TEXT] As a user, I config index from column setting && check on index popup",""
"passed","Tue Feb 14 18:47:50 GMT 2023","Tue Feb 14 18:51:13 GMT 2023","202856","","JIT-Web-007b-ASSET-Rename-and-delete","","JIT-Web-007b-ASSET-Rename-and-delete","[ASSET] As a user, I can rename and delete image asset","[ASSET] As a user, I can rename and delete image asset",""
"passed","Tue Feb 14 18:48:00 GMT 2023","Tue Feb 14 18:49:52 GMT 2023","111758","","JIT-Web-009a-TABLE-Add-new","","JIT-Web-009a-TABLE-Add-new","[TABLE] As a user, I can create new Admin page","[TABLE] As a user, I can create new Admin page",""
"passed","Tue Feb 14 18:59:11 GMT 2023","Tue Feb 14 19:00:32 GMT 2023","81430","","JIT-Database-015g-INDEX-FLOAT-column-config","","JIT-Database-015g-INDEX-FLOAT-column-config","[INDEX-FLOAT] As a user, I config index from column setting && check on index popup","[INDEX-FLOAT] As a user, I config index from column setting && check on index popup",""
"passed","Tue Feb 14 18:12:38 GMT 2023","Tue Feb 14 18:16:04 GMT 2023","206476","","JIT-Database-006-COLUMN-type-STRING","","JIT-Database-006-COLUMN-type-STRING","[COLUMN] As a user, I should check the validation of STRING column definition","[COLUMN] As a user, I should check the validation of STRING column definition",""
"passed","Tue Feb 14 18:44:00 GMT 2023","Tue Feb 14 18:46:47 GMT 2023","166965","","JIT-Web-002b-MOLECULE-Update","","JIT-Web-002b-MOLECULE-Update","[WEB-MOLECULE] As a user, I can update molecule with positive and negative cases","[WEB-MOLECULE] As a user, I can update molecule with positive and negative cases",""
"passed","Tue Feb 14 18:53:47 GMT 2023","Tue Feb 14 18:54:29 GMT 2023","42338","","JIT-API-007a-GROUP-API-CRUD","","JIT-API-007a-GROUP-API-CRUD","[GROUP-API] Create, update and delete group API","[GROUP-API] Create, update and delete group API",""
"passed","Tue Feb 14 18:21:41 GMT 2023","Tue Feb 14 18:23:00 GMT 2023","78677","","JIT-Mobile-012-JITDEF-remove-poperty-info-after-deleting-navigation","","JIT-Mobile-012-JITDEF-remove-poperty-info-after-deleting-navigation","[DEFECT] As a user, I should see the property infos need to be removed after the navigation was deleted","[DEFECT] As a user, I should see the property infos need to be removed after the navigation was deleted",""
"passed","Tue Feb 14 18:16:51 GMT 2023","Tue Feb 14 18:18:09 GMT 2023","77401","","JIT-Database-015a-INDEX-Check-duplicate-empty","","JIT-Database-015a-INDEX-Check-duplicate-empty","[INDEX] As a user, I check empty and duplicate index","[INDEX] As a user, I check empty and duplicate index",""
"passed","Tue Feb 14 19:29:09 GMT 2023","Tue Feb 14 19:31:20 GMT 2023","130973","","JIT-Export-003-Scenario_ROR_2","","JIT-Export-003-Scenario_ROR_2","As a user, I check export the project type ROR no key successfully with scenario 2","As a user, I check export the project type ROR no key successfully with scenario 2",""
"passed","Tue Feb 14 18:53:48 GMT 2023","Tue Feb 14 18:55:34 GMT 2023","105610","","JIT-API-007ba-GET-list-API-Add-new-endpoint","","JIT-API-007ba-GET-list-API-Add-new-endpoint","[GET-list-API] Create, update and delete new GET API endpoint","[GET-list-API] Create, update and delete new GET API endpoint",""
"passed","Tue Feb 14 18:56:19 GMT 2023","Tue Feb 14 18:58:52 GMT 2023","153862","","JIT-Database-015b-INDEX-CRUD-single","","JIT-Database-015b-INDEX-CRUD-single","[INDEX] As a user, I check add and update multiple index","[INDEX] As a user, I check add and update multiple index",""
"passed","Tue Feb 14 18:16:49 GMT 2023","Tue Feb 14 18:18:02 GMT 2023","73172","","JIT-Database-013-DEFECT-Check-default-value-when-changing-type","","JIT-Database-013-DEFECT-Check-default-value-when-changing-type","[DEFECT] As a user, I should check the default value when changing the type","[DEFECT] As a user, I should check the default value when changing the type",""
"passed","Tue Feb 14 18:55:35 GMT 2023","Tue Feb 14 18:57:03 GMT 2023","88367","","JIT-API-007e-PUT-API-Add-new-endpoint","","JIT-API-007e-PUT-API-Add-new-endpoint","[PUT-API] Create, update and delete new PUT API endpoint","[PUT-API] Create, update and delete new PUT API endpoint",""
"passed","Tue Feb 14 18:26:07 GMT 2023","Tue Feb 14 18:27:33 GMT 2023","86104","","JIT-Mobile-028b-ICON-General-info","","JIT-Mobile-028b-ICON-General-info","[MOBILE-ICON] As a user, I should check the general infomation of Icon is correct: Name, Key, unique key, delete component","[MOBILE-ICON] As a user, I should check the general infomation of Icon is correct: Name, Key, unique key, delete component",""
"passed","Tue Feb 14 18:51:44 GMT 2023","Tue Feb 14 18:52:59 GMT 2023","74338","","JIT-API-002c-GET-list","","JIT-API-002c-GET-list","As a user, I check column display when having relation for GET-list","As a user, I check column display when having relation for GET-list",""
"passed","Tue Feb 14 18:15:48 GMT 2023","Tue Feb 14 18:16:52 GMT 2023","64227","","JIT-Database-011f-COLUMN-ENUM-duplicated","","JIT-Database-011f-COLUMN-ENUM-duplicated","[COLUMN] As a user, I should check counld not add duplicated item","[COLUMN] As a user, I should check counld not add duplicated item",""
"passed","Tue Feb 14 18:33:37 GMT 2023","Tue Feb 14 18:35:10 GMT 2023","93112","","JIT-Module-002b-DEEPLINK-edit-infos","","JIT-Module-002b-DEEPLINK-edit-infos","As a user, I can update module Deeplink","As a user, I can update module Deeplink",""
"passed","Tue Feb 14 18:27:20 GMT 2023","Tue Feb 14 18:30:06 GMT 2023","166149","","JIT-Mobile-031a-DIVIDER-Check-PreviewCode","","JIT-Mobile-031a-DIVIDER-Check-PreviewCode","[MOBILE-DIVIDER] As a user, I should check the Preview code of Divider component","[MOBILE-DIVIDER] As a user, I should check the Preview code of Divider component",""
"passed","Tue Feb 14 19:00:01 GMT 2023","Tue Feb 14 19:01:23 GMT 2023","81660","","JIT-Database-015i-INDEX-DATETIME-column-config","","JIT-Database-015i-INDEX-DATETIME-column-config","[INDEX-DATETIME] As a user, I config index from column setting && check on index popup","[INDEX-DATETIME] As a user, I config index from column setting && check on index popup",""
"passed","Tue Feb 14 18:23:54 GMT 2023","Tue Feb 14 18:25:30 GMT 2023","95786","","JIT-Mobile-022a-TEXT-General-info","","JIT-Mobile-022a-TEXT-General-info","[MOBILE-TEXT] As a user, I should check the general infomation of Text is correct: Name, Key, unique key, delete component","[MOBILE-TEXT] As a user, I should check the general infomation of Text is correct: Name, Key, unique key, delete component",""
"passed","Tue Feb 14 19:24:45 GMT 2023","Tue Feb 14 19:25:13 GMT 2023","28212","","JIT-Database-001d-TABLE-update","","JIT-Database-001d-TABLE-update","[TABLE] As a user, I can update the value of the table","[TABLE] As a user, I can update the value of the table",""
"passed","Tue Feb 14 18:47:40 GMT 2023","Tue Feb 14 18:51:14 GMT 2023","213310","","JIT-Web-007a-ASSET-Upload","","JIT-Web-007a-ASSET-Upload","[ASSET] As a user, I can upload new image and store in Asset Manager and use it in all Image component","[ASSET] As a user, I can upload new image and store in Asset Manager and use it in all Image component",""
"passed","Tue Feb 14 18:34:23 GMT 2023","Tue Feb 14 18:35:34 GMT 2023","71640","","JIT-Module-005a-FORCE-MOBILE-UPDATE-database","","JIT-Module-005a-FORCE-MOBILE-UPDATE-database","[FORCE-MOBILE-UPDATE] - Check adding and auto-table & columns","[FORCE-MOBILE-UPDATE] - Check adding and auto-table & columns",""
"passed","Tue Feb 14 18:24:13 GMT 2023","Tue Feb 14 18:27:26 GMT 2023","193623","","JIT-Mobile-022d-TEXT-Check-PADDING-MARGIN","","JIT-Mobile-022d-TEXT-Check-PADDING-MARGIN","[MOBILE-TEXT] As a user, I should check the PADDING & MARGIN infomation of Text is correct: Top, Bottom, Right, Left.","[MOBILE-TEXT] As a user, I should check the PADDING & MARGIN infomation of Text is correct: Top, Bottom, Right, Left.",""
"passed","Tue Feb 14 18:32:53 GMT 2023","Tue Feb 14 18:34:28 GMT 2023","94405","","JIT-Module-001b-CLOUDINARY-edit-infos","","JIT-Module-001b-CLOUDINARY-edit-infos","As a user, I can update module Cloudinary","As a user, I can update module Cloudinary",""
"passed","Tue Feb 14 18:45:21 GMT 2023","Tue Feb 14 18:48:16 GMT 2023","174793","","JIT-Web-002e-MOLECULE-Search","","JIT-Web-002e-MOLECULE-Search","[WEB-PAGE] As a user, I can search correct molecule with keyword","[WEB-PAGE] As a user, I can search correct molecule with keyword",""
"passed","Tue Feb 14 18:18:44 GMT 2023","Tue Feb 14 18:20:10 GMT 2023","85987","","JIT-Mobile-001-SCREEN-Create-new","","JIT-Mobile-001-SCREEN-Create-new","[MOBILE-SCREEN] As a user, I can create new screen with positive and negative cases","[MOBILE-SCREEN] As a user, I can create new screen with positive and negative cases",""
"passed","Tue Feb 14 18:14:12 GMT 2023","Tue Feb 14 18:15:27 GMT 2023","75765","","JIT-Database-011a-COLUMN-ENUM-default","","JIT-Database-011a-COLUMN-ENUM-default","[COLUMN] As a user, I should check the basic validation","[COLUMN] As a user, I should check the basic validation",""
"passed","Tue Feb 14 19:34:41 GMT 2023","Tue Feb 14 19:35:13 GMT 2023","32254","","JIT-Export-007-Existing-Scenario-ROR-withkey","","JIT-Export-007-Existing-Scenario-ROR-withkey","As a user, I check export the existing project type ROR with key successfully","As a user, I check export the existing project type ROR with key successfully",""
"passed","Tue Feb 14 19:00:46 GMT 2023","Tue Feb 14 19:02:09 GMT 2023","83226","","JIT-Database-015l-INDEX-ENUM-column-config","","JIT-Database-015l-INDEX-ENUM-column-config","[INDEX-ENUM] As a user, I config index from column setting && check on index popup","[INDEX-ENUM] As a user, I config index from column setting && check on index popup",""
"passed","Tue Feb 14 18:38:19 GMT 2023","Tue Feb 14 18:39:14 GMT 2023","55553","","JIT-Module-014a-BASIC-AUTH-default","","JIT-Module-014a-BASIC-AUTH-default","[BASIC-AUTH] As a user, I can add module Basic Authentication and remove it","[BASIC-AUTH] As a user, I can add module Basic Authentication and remove it",""
"passed","Tue Feb 14 18:18:09 GMT 2023","Tue Feb 14 18:19:50 GMT 2023","101111","","JIT-Database-016b-COUNTER-CACHE-Create-by-adding-column","","JIT-Database-016b-COUNTER-CACHE-Create-by-adding-column","[COUNTER-CACHE] create new counter cache column by adding column","[COUNTER-CACHE] create new counter cache column by adding column",""
"passed","Tue Feb 14 18:45:20 GMT 2023","Tue Feb 14 18:50:26 GMT 2023","305467","","JIT-Web-002d-MOLECULE-Duplicate","","JIT-Web-002d-MOLECULE-Duplicate","[WEB-MOLECULE] As a user, I can duplicate molecule with positive and negative cases","[WEB-MOLECULE] As a user, I can duplicate molecule with positive and negative cases",""
"passed","Tue Feb 14 18:40:00 GMT 2023","Tue Feb 14 18:40:45 GMT 2023","44234","","JIT-Module-017b-GOOGLE-ANAL-edit-infos","","JIT-Module-017b-GOOGLE-ANAL-edit-infos","[GOOGLE-ANAL] As a user, I can update module Google Analytics","[GOOGLE-ANAL] As a user, I can update module Google Analytics",""
"passed","Tue Feb 14 19:31:28 GMT 2023","Tue Feb 14 19:33:30 GMT 2023","122220","","JIT-Export-004-Scenario_ROR_2","","JIT-Export-004-Scenario_ROR_2","As a user, I check export the project type ROR with key successfully with scenario 2","As a user, I check export the project type ROR with key successfully with scenario 2",""
"passed","Tue Feb 14 18:53:56 GMT 2023","Tue Feb 14 18:55:21 GMT 2023","84220","","JIT-API-007c-GET-detail-API-Add-new-endpoint","","JIT-API-007c-GET-detail-API-Add-new-endpoint","[GET-detail-API] Create, update and delete new GET API endpoint","[GET-detail-API] Create, update and delete new GET API endpoint",""
"passed","Tue Feb 14 18:19:33 GMT 2023","Tue Feb 14 18:21:05 GMT 2023","91677","","JIT-Mobile-005-MOLECULE-Create-new","","JIT-Mobile-005-MOLECULE-Create-new","[MOBILE-MOLECULE] As a user, I can create new molecule with positive and negative cases","[MOBILE-MOLECULE] As a user, I can create new molecule with positive and negative cases",""
"passed","Tue Feb 14 18:45:56 GMT 2023","Tue Feb 14 18:47:13 GMT 2023","77703","","JIT-Web-003a-PREVIEW-NAVIGATION-no-navigation-setup","","JIT-Web-003a-PREVIEW-NAVIGATION-no-navigation-setup","[WEB-PREVIEW-NAVIGATION] As a user, I could open preview screen with default page","[WEB-PREVIEW-NAVIGATION] As a user, I could open preview screen with default page",""
"passed","Tue Feb 14 19:34:02 GMT 2023","Tue Feb 14 19:34:34 GMT 2023","31944","","JIT-Export-006-Existing-Scenario-ROR-nokey","","JIT-Export-006-Existing-Scenario-ROR-nokey","As a user, I check export the existing project type ROR no key successfully","As a user, I check export the existing project type ROR no key successfully",""
"passed","Tue Feb 14 19:59:51 GMT 2023","Tue Feb 14 20:11:09 GMT 2023","678689","","JIT-Preview-004-Preview-BUTTON","","JIT-Preview-004-Preview-BUTTON","[PREVIEW-BUTTON] As a user, I check preview function for Button component","[PREVIEW-BUTTON] As a user, I check preview function for Button component",""
"passed","Tue Feb 14 18:54:42 GMT 2023","Tue Feb 14 18:56:08 GMT 2023","85303","","JIT-API-007d-POST-API-Add-new-endpoint","","JIT-API-007d-POST-API-Add-new-endpoint","[GET-POST] Create, update and delete new POST API endpoint","[GET-POST] Create, update and delete new POST API endpoint",""
"passed","Tue Feb 14 18:31:20 GMT 2023","Tue Feb 14 18:33:22 GMT 2023","122091","","JIT-Mobile-042a-ACTION-NAVIGATION-no-param","","JIT-Mobile-042a-ACTION-NAVIGATION-no-param","[MOBILE-ACTION-NAVIGATION] As a user, I could add action type navigation without params and check preview code","[MOBILE-ACTION-NAVIGATION] As a user, I could add action type navigation without params and check preview code",""
"passed","Tue Feb 14 18:16:50 GMT 2023","Tue Feb 14 18:18:10 GMT 2023","80632","","JIT-Database-014-DEFECT-Check-duplicate-table-name","","JIT-Database-014-DEFECT-Check-duplicate-table-name","[DEFECT] As a user, I cannot update to duplicate name","[DEFECT] As a user, I cannot update to duplicate name",""
"passed","Tue Feb 14 18:38:07 GMT 2023","Tue Feb 14 18:39:17 GMT 2023","69912","","JIT-Module-013b-AWS-edit-infos","","JIT-Module-013b-AWS-edit-infos","[AWS] As a user, I can update module AWS SES Integration","[AWS] As a user, I can update module AWS SES Integration",""
"passed","Tue Feb 14 18:19:11 GMT 2023","Tue Feb 14 18:20:17 GMT 2023","66574","","JIT-Mobile-003-SCREEN-Delete","","JIT-Mobile-003-SCREEN-Delete","[MOBILE-SCREEN] As a user, I can delete screen","[MOBILE-SCREEN] As a user, I can delete screen",""
"passed","Tue Feb 14 18:57:41 GMT 2023","Tue Feb 14 18:59:00 GMT 2023","79153","","JIT-Database-015d-INDEX-STRING-column-config","","JIT-Database-015d-INDEX-STRING-column-config","[INDEX-STRING] As a user, I config index from column setting && check on index popup","[INDEX-STRING] As a user, I config index from column setting && check on index popup",""
"passed","Tue Feb 14 18:21:54 GMT 2023","Tue Feb 14 18:23:54 GMT 2023","120217","","JIT-Mobile-014-JITDEF-status-bar","","JIT-Mobile-014-JITDEF-status-bar","[DEFECT] As a user, I should see screen will be removed in navigation tree after deleting screen","[DEFECT] As a user, I should see screen will be removed in navigation tree after deleting screen",""
"passed","Tue Feb 14 19:01:27 GMT 2023","Tue Feb 14 19:03:09 GMT 2023","101251","","JIT-Database-015m-INDEX-ALL-column-config","","JIT-Database-015m-INDEX-ALL-column-config","[INDEX-ALL] As a user, I config with multiple column and check show multiple on index pop-up","[INDEX-ALL] As a user, I config with multiple column and check show multiple on index pop-up",""
"passed","Tue Feb 14 18:38:37 GMT 2023","Tue Feb 14 18:39:34 GMT 2023","56858","","JIT-Module-015a-SCOUT-default","","JIT-Module-015a-SCOUT-default","[SCOUT] As a user, I can add module Scout and remove it","[SCOUT] As a user, I can add module Scout and remove it",""
"passed","Tue Feb 14 18:23:54 GMT 2023","Tue Feb 14 18:25:15 GMT 2023","81261","","JIT-Mobile-021-DEFECT.Params.keep-params-after-refresh-page","","JIT-Mobile-021-DEFECT.Params.keep-params-after-refresh-page","[DEFECT] As a user, I should check the params will be kept after refresh page","[DEFECT] As a user, I should check the params will be kept after refresh page",""
"passed","Tue Feb 14 18:38:50 GMT 2023","Tue Feb 14 18:39:45 GMT 2023","55435","","JIT-Module-016a-SENDGRID-default","","JIT-Module-016a-SENDGRID-default","[SENDGRID] As a user, I can add module SendGrid and remove it","[SENDGRID] As a user, I can add module SendGrid and remove it",""
"passed","Tue Feb 14 18:30:29 GMT 2023","Tue Feb 14 18:32:14 GMT 2023","105008","","JIT-Mobile-036a-DATETIMEPICKER-Check-PreviewCode","","JIT-Mobile-036a-DATETIMEPICKER-Check-PreviewCode","[MOBILE-DATETIMEPICKER] As a user, I should check the Preview code of DatetimePicker component","[MOBILE-DATETIMEPICKER] As a user, I should check the Preview code of DatetimePicker component",""
"passed","Tue Feb 14 18:36:09 GMT 2023","Tue Feb 14 18:38:08 GMT 2023","118231","","JIT-Module-009a-GOOGLE-LOGIN-default-edit","","JIT-Module-009a-GOOGLE-LOGIN-default-edit","[GOOGLE-LOGIN], I can add module Google Login and edit its infos","[GOOGLE-LOGIN], I can add module Google Login and edit its infos",""
"passed","Tue Feb 14 18:28:16 GMT 2023","Tue Feb 14 18:29:43 GMT 2023","87124","","JIT-Mobile-031b-DIVIDER-General-info","","JIT-Mobile-031b-DIVIDER-General-info","[MOBILE-DIVIDER] As a user, I should check the general infomation of Divider is correct: Name, Key, unique key, delete component","[MOBILE-DIVIDER] As a user, I should check the general infomation of Divider is correct: Name, Key, unique key, delete component",""
"passed","Tue Feb 14 18:40:20 GMT 2023","Tue Feb 14 18:41:09 GMT 2023","49674","","JIT-Module-019a-GOOGLE-ANALYTICS-default","","JIT-Module-019a-GOOGLE-ANALYTICS-default","[GOOGLE-ANALYTICS] As a user, I can add module Google Analytics and remove it","[GOOGLE-ANALYTICS] As a user, I can add module Google Analytics and remove it",""
