"Status","Start Time","Stop Time","Duration in ms","Parent Suite","Suite","Sub Suite","Test Class","Test Method","Name","Description"
"passed","Fri Jan 13 18:10:23 GMT 2023","Fri Jan 13 18:12:09 GMT 2023","105580","","JIT-Database-001c-TABLE-duplicate","","JIT-Database-001c-TABLE-duplicate","[TABLE] As a user, I cannot create table with duplicate name","[TABLE] As a user, I cannot create table with duplicate name",""
"broken","Fri Jan 13 19:30:09 GMT 2023","Fri Jan 13 19:30:37 GMT 2023","27145","","JIT-Export-006-Existing-Scenario-ROR-nokey","","JIT-Export-006-Existing-Scenario-ROR-nokey","As a user, I check export the existing project type ROR no key successfully","As a user, I check export the existing project type ROR no key successfully",""
"passed","Fri Jan 13 18:27:03 GMT 2023","Fri Jan 13 18:28:13 GMT 2023","69561","","JIT-Mobile-035b-FLATLIST-General-info","","JIT-Mobile-035b-FLATLIST-General-info","[MOBILE-FLATLIST] As a user, I should check the general infomation of FlatList is correct: Name, Key, unique key, delete component","[MOBILE-FLATLIST] As a user, I should check the general infomation of FlatList is correct: Name, Key, unique key, delete component",""
"broken","Fri Jan 13 19:27:27 GMT 2023","Fri Jan 13 19:29:21 GMT 2023","113606","","JIT-Export-004-Scenario_ROR_2","","JIT-Export-004-Scenario_ROR_2","As a user, I check export the project type ROR with key successfully with scenario 2","As a user, I check export the project type ROR with key successfully with scenario 2",""
"passed","Fri Jan 13 18:11:49 GMT 2023","Fri Jan 13 18:14:35 GMT 2023","166902","","JIT-Database-006-COLUMN-type-STRING","","JIT-Database-006-COLUMN-type-STRING","[COLUMN] As a user, I should check the validation of STRING column definition","[COLUMN] As a user, I should check the validation of STRING column definition",""
"passed","Fri Jan 13 18:35:59 GMT 2023","Fri Jan 13 18:36:39 GMT 2023","39493","","JIT-Module-017b-GOOGLE-ANAL-edit-infos","","JIT-Module-017b-GOOGLE-ANAL-edit-infos","[GOOGLE-ANAL] As a user, I can update module Google Analytics","[GOOGLE-ANAL] As a user, I can update module Google Analytics",""
"passed","Fri Jan 13 18:34:48 GMT 2023","Fri Jan 13 18:35:41 GMT 2023","52945","","JIT-Module-015a-SCOUT-default","","JIT-Module-015a-SCOUT-default","[SCOUT] As a user, I can add module Scout and remove it","[SCOUT] As a user, I can add module Scout and remove it",""
"passed","Fri Jan 13 18:26:36 GMT 2023","Fri Jan 13 18:27:45 GMT 2023","69029","","JIT-Mobile-034b-SCROLLVIEW-General-info","","JIT-Mobile-034b-SCROLLVIEW-General-info","[MOBILE-SCROLLVIEW] As a user, I should check the general infomation of Scroll View is correct: Name, Key, unique key, delete component","[MOBILE-SCROLLVIEW] As a user, I should check the general infomation of Scroll View is correct: Name, Key, unique key, delete component",""
"passed","Fri Jan 13 18:24:52 GMT 2023","Fri Jan 13 18:26:11 GMT 2023","78304","","JIT-Mobile-030b-WEBVIEW-General-info","","JIT-Mobile-030b-WEBVIEW-General-info","[MOBILE-WEBVIEW] As a user, I should check the general infomation of Webview is correct: Name, Key, unique key, delete component","[MOBILE-WEBVIEW] As a user, I should check the general infomation of Webview is correct: Name, Key, unique key, delete component",""
"passed","Fri Jan 13 18:23:51 GMT 2023","Fri Jan 13 18:24:58 GMT 2023","67354","","JIT-Mobile-028b-ICON-General-info","","JIT-Mobile-028b-ICON-General-info","[MOBILE-ICON] As a user, I should check the general infomation of Icon is correct: Name, Key, unique key, delete component","[MOBILE-ICON] As a user, I should check the general infomation of Icon is correct: Name, Key, unique key, delete component",""
"passed","Fri Jan 13 18:16:50 GMT 2023","Fri Jan 13 18:18:20 GMT 2023","89495","","JIT-Database-016a-COUNTER-CACHE-Create-by-relation","","JIT-Database-016a-COUNTER-CACHE-Create-by-relation","[COUNTER-CACHE] create new counter cache column by selecting in relation popup","[COUNTER-CACHE] create new counter cache column by selecting in relation popup",""
"passed","Fri Jan 13 18:35:39 GMT 2023","Fri Jan 13 18:36:26 GMT 2023","47013","","JIT-Module-017a-GOOGLE-ANAL-default","","JIT-Module-017a-GOOGLE-ANAL-default","[GOOGLE-ANAL] As a user, I can add module Google Analytics and remove it","[GOOGLE-ANAL] As a user, I can add module Google Analytics and remove it",""
"passed","Fri Jan 13 18:15:54 GMT 2023","Fri Jan 13 18:17:04 GMT 2023","70519","","JIT-Database-014-DEFECT-Check-duplicate-table-name","","JIT-Database-014-DEFECT-Check-duplicate-table-name","[DEFECT] As a user, I cannot update to duplicate name","[DEFECT] As a user, I cannot update to duplicate name",""
"passed","Fri Jan 13 18:35:18 GMT 2023","Fri Jan 13 18:36:04 GMT 2023","46168","","JIT-Module-016a-SENDGRID-default","","JIT-Module-016a-SENDGRID-default","[SENDGRID] As a user, I can add module SendGrid and remove it","[SENDGRID] As a user, I can add module SendGrid and remove it",""
"passed","Fri Jan 13 18:52:38 GMT 2023","Fri Jan 13 18:53:56 GMT 2023","77756","","JIT-Database-015h-INDEX-DATE-column-config","","JIT-Database-015h-INDEX-DATE-column-config","[INDEX-DATE] As a user, I config index from column setting && check on index popup","[INDEX-DATE] As a user, I config index from column setting && check on index popup",""
"passed","Fri Jan 13 18:52:19 GMT 2023","Fri Jan 13 18:53:39 GMT 2023","79340","","JIT-Database-015g-INDEX-FLOAT-column-config","","JIT-Database-015g-INDEX-FLOAT-column-config","[INDEX-FLOAT] As a user, I config index from column setting && check on index popup","[INDEX-FLOAT] As a user, I config index from column setting && check on index popup",""
"passed","Fri Jan 13 18:29:14 GMT 2023","Fri Jan 13 18:30:03 GMT 2023","49552","","JIT-Module-001a-CLOUDINARY-default","","JIT-Module-001a-CLOUDINARY-default","As a user, I can add module Cloudinary and remove it","As a user, I can add module Cloudinary and remove it",""
"passed","Fri Jan 13 18:33:17 GMT 2023","Fri Jan 13 18:34:46 GMT 2023","88866","","JIT-Module-011a-GUEST-LOGIN-default-edit","","JIT-Module-011a-GUEST-LOGIN-default-edit","[GUEST-LOGIN], I can add module Guest Login and edit its infos","[GUEST-LOGIN], I can add module Guest Login and edit its infos",""
"passed","Fri Jan 13 18:17:29 GMT 2023","Fri Jan 13 18:18:39 GMT 2023","70647","","JIT-Mobile-001-SCREEN-Create-new","","JIT-Mobile-001-SCREEN-Create-new","[MOBILE-SCREEN] As a user, I can create new screen with positive and negative cases","[MOBILE-SCREEN] As a user, I can create new screen with positive and negative cases",""
"passed","Fri Jan 13 18:40:38 GMT 2023","Fri Jan 13 18:41:47 GMT 2023","68440","","JIT-Web-003a-PREVIEW-NAVIGATION-no-navigation-setup","","JIT-Web-003a-PREVIEW-NAVIGATION-no-navigation-setup","[WEB-PREVIEW-NAVIGATION] As a user, I could open preview screen with default page","[WEB-PREVIEW-NAVIGATION] As a user, I could open preview screen with default page",""
"passed","Fri Jan 13 18:37:16 GMT 2023","Fri Jan 13 18:39:03 GMT 2023","107173","","JIT-Web-001c-PAGE-Delete","","JIT-Web-001c-PAGE-Delete","[PAGE] As a user, I can delete page","[PAGE] As a user, I can delete page",""
"passed","Fri Jan 13 18:37:59 GMT 2023","Fri Jan 13 18:39:50 GMT 2023","110484","","JIT-Web-002a-MOLECULE-Create-new","","JIT-Web-002a-MOLECULE-Create-new","[WEB-MOLECULE] As a user, I can create new molecule with positive and negative cases","[WEB-MOLECULE] As a user, I can create new molecule with positive and negative cases",""
"broken","Fri Jan 13 19:29:05 GMT 2023","Fri Jan 13 19:33:35 GMT 2023","269522","","JIT-Export-010b-Export-RN-TODO","","JIT-Export-010b-Export-RN-TODO","[SMOKE] As a user, I check exprting project TODO with React Native","[SMOKE] As a user, I check exprting project TODO with React Native",""
"passed","Fri Jan 13 18:12:50 GMT 2023","Fri Jan 13 18:14:49 GMT 2023","118301","","JIT-Database-010b-COLUMN-FILE-format-file","","JIT-Database-010b-COLUMN-FILE-format-file","[COLUMN] As a user, I should check the validation of FILE column definition for Format Area","[COLUMN] As a user, I should check the validation of FILE column definition for Format Area",""
"passed","Fri Jan 13 18:53:48 GMT 2023","Fri Jan 13 18:55:08 GMT 2023","80151","","JIT-Database-015l-INDEX-ENUM-column-config","","JIT-Database-015l-INDEX-ENUM-column-config","[INDEX-ENUM] As a user, I config index from column setting && check on index popup","[INDEX-ENUM] As a user, I config index from column setting && check on index popup",""
"passed","Fri Jan 13 18:28:02 GMT 2023","Fri Jan 13 18:28:56 GMT 2023","54757","","JIT-Mobile-041a-PREVIEW-NAVIGATION-no-navigation-setup","","JIT-Mobile-041a-PREVIEW-NAVIGATION-no-navigation-setup","[MOBILE-PREVIEW-NAVIGATION] As a user, I could open preview screen with notification should setup the screen navigation","[MOBILE-PREVIEW-NAVIGATION] As a user, I could open preview screen with notification should setup the screen navigation",""
"passed","Fri Jan 13 18:15:11 GMT 2023","Fri Jan 13 18:16:13 GMT 2023","61087","","JIT-Database-011f-COLUMN-ENUM-duplicated","","JIT-Database-011f-COLUMN-ENUM-duplicated","[COLUMN] As a user, I should check counld not add duplicated item","[COLUMN] As a user, I should check counld not add duplicated item",""
"passed","Fri Jan 13 18:27:12 GMT 2023","Fri Jan 13 18:28:33 GMT 2023","80956","","JIT-Mobile-036a-DATETIMEPICKER-Check-PreviewCode","","JIT-Mobile-036a-DATETIMEPICKER-Check-PreviewCode","[MOBILE-DATETIMEPICKER] As a user, I should check the Preview code of DatetimePicker component","[MOBILE-DATETIMEPICKER] As a user, I should check the Preview code of DatetimePicker component",""
"passed","Fri Jan 13 18:19:12 GMT 2023","Fri Jan 13 18:21:11 GMT 2023","118725","","JIT-Mobile-005b-MOLECULE-Navigate-edit-screen","","JIT-Mobile-005b-MOLECULE-Navigate-edit-screen","[MOBILE-MOLECULE-EDIT] As a user, I can see the molecule in Screen and use Edit button see the content of this molecule","[MOBILE-MOLECULE-EDIT] As a user, I can see the molecule in Screen and use Edit button see the content of this molecule",""
"passed","Fri Jan 13 18:28:59 GMT 2023","Fri Jan 13 18:29:35 GMT 2023","35617","","JIT-Module-000-search","","JIT-Module-000-search","[SEARCH] As a user, I can Search module","[SEARCH] As a user, I can Search module",""
"broken","Fri Jan 13 19:16:24 GMT 2023","Fri Jan 13 19:18:52 GMT 2023","147590","","JIT-Mobile-043a-ACTION-AUTHENTICATION-PHONE-no-param","","JIT-Mobile-043a-ACTION-AUTHENTICATION-PHONE-no-param","[MOBILE-ACTION-AUTHENTICATION-PHONE] As a user, I could add action type authentication without params and check preview code","[MOBILE-ACTION-AUTHENTICATION-PHONE] As a user, I could add action type authentication without params and check preview code",""
"passed","Fri Jan 13 18:18:20 GMT 2023","Fri Jan 13 18:19:34 GMT 2023","73876","","JIT-Mobile-005-MOLECULE-Create-new","","JIT-Mobile-005-MOLECULE-Create-new","[MOBILE-MOLECULE] As a user, I can create new molecule with positive and negative cases","[MOBILE-MOLECULE] As a user, I can create new molecule with positive and negative cases",""
"passed","Fri Jan 13 18:10:26 GMT 2023","Fri Jan 13 18:11:34 GMT 2023","68558","","JIT-Database-001a-TABLE-new","","JIT-Database-001a-TABLE-new","[TABLE] As a user, I can create new table","[TABLE] As a user, I can create new table",""
"passed","Fri Jan 13 18:37:26 GMT 2023","Fri Jan 13 18:39:33 GMT 2023","126949","","JIT-Web-001f-PAGE-Export-and-import","","JIT-Web-001f-PAGE-Export-and-import","[PAGE] As a user, I can create new screen by import and export the screen","[PAGE] As a user, I can create new screen by import and export the screen",""
"passed","Fri Jan 13 18:26:11 GMT 2023","Fri Jan 13 18:27:22 GMT 2023","71160","","JIT-Mobile-033b-HEADER-General-info","","JIT-Mobile-033b-HEADER-General-info","[MOBILE-HEADER] As a user, I should check the general infomation of Header is correct: Name, Key, unique key, delete component","[MOBILE-HEADER] As a user, I should check the general infomation of Header is correct: Name, Key, unique key, delete component",""
"passed","Fri Jan 13 18:18:00 GMT 2023","Fri Jan 13 18:18:55 GMT 2023","54754","","JIT-Mobile-003-SCREEN-Delete","","JIT-Mobile-003-SCREEN-Delete","[MOBILE-SCREEN] As a user, I can delete screen","[MOBILE-SCREEN] As a user, I can delete screen",""
"passed","Fri Jan 13 18:36:21 GMT 2023","Fri Jan 13 18:37:02 GMT 2023","40485","","JIT-Module-019b-GOOGLE-ANALYTICS-edit-infos","","JIT-Module-019b-GOOGLE-ANALYTICS-edit-infos","[GOOGLE-ANALYTICS] As a user, I can update module Google Analytics information for each environment","[GOOGLE-ANALYTICS] As a user, I can update module Google Analytics information for each environment",""
"passed","Fri Jan 13 18:42:31 GMT 2023","Fri Jan 13 18:44:04 GMT 2023","92311","","JIT-Web-009a-TABLE-Add-new","","JIT-Web-009a-TABLE-Add-new","[TABLE] As a user, I can create new Admin page","[TABLE] As a user, I can create new Admin page",""
"passed","Fri Jan 13 18:14:06 GMT 2023","Fri Jan 13 18:15:14 GMT 2023","68350","","JIT-Database-011c-COLUMN-ENUM-delete-items","","JIT-Database-011c-COLUMN-ENUM-delete-items","[COLUMN] As a user, I should delete 1 item and check not display in default dropdown","[COLUMN] As a user, I should delete 1 item and check not display in default dropdown",""
"broken","Fri Jan 13 19:26:45 GMT 2023","Fri Jan 13 19:28:13 GMT 2023","88212","","JIT-Export-002-Scenario-ROR-withkey-1","","JIT-Export-002-Scenario-ROR-withkey-1","As a user, I check export the project type ROR with key successfully with scenario 1","As a user, I check export the project type ROR with key successfully with scenario 1",""
"passed","Fri Jan 13 18:23:04 GMT 2023","Fri Jan 13 18:25:10 GMT 2023","126245","","JIT-Mobile-028a-ICON-Check-PreviewCode","","JIT-Mobile-028a-ICON-Check-PreviewCode","[MOBILE-ICON] As a user, I should check the Preview code of Icon component","[MOBILE-ICON] As a user, I should check the Preview code of Icon component",""
"passed","Fri Jan 13 18:31:53 GMT 2023","Fri Jan 13 18:33:15 GMT 2023","81433","","JIT-Module-006b-SMS-edit-infos","","JIT-Module-006b-SMS-edit-infos","[SMS], I can add module SMS login with Twilio and edit its infos","[SMS], I can add module SMS login with Twilio and edit its infos",""
"passed","Fri Jan 13 18:31:39 GMT 2023","Fri Jan 13 18:33:08 GMT 2023","88641","","JIT-Module-006a-SMS-default","","JIT-Module-006a-SMS-default","[SMS], I can add module SMS login with Twilio and remove it","[SMS], I can add module SMS login with Twilio and remove it",""
"passed","Fri Jan 13 18:49:38 GMT 2023","Fri Jan 13 18:51:55 GMT 2023","136689","","JIT-API-009-Auto-fill","","JIT-API-009-Auto-fill","[AUTO-FILL] As a user, I could add request param by Auto-fill","[AUTO-FILL] As a user, I could add request param by Auto-fill",""
"passed","Fri Jan 13 19:13:56 GMT 2023","Fri Jan 13 19:15:46 GMT 2023","110328","","JIT-Web-002b-MOLECULE-Update","","JIT-Web-002b-MOLECULE-Update","[WEB-MOLECULE] As a user, I can update molecule with positive and negative cases","[WEB-MOLECULE] As a user, I can update molecule with positive and negative cases",""
"passed","Fri Jan 13 18:21:51 GMT 2023","Fri Jan 13 18:23:43 GMT 2023","111797","","JIT-Mobile-021-DEFECT.Params.keep-params-after-refresh-page","","JIT-Mobile-021-DEFECT.Params.keep-params-after-refresh-page","[DEFECT] As a user, I should check the params will be kept after refresh page","[DEFECT] As a user, I should check the params will be kept after refresh page",""
"passed","Fri Jan 13 18:49:40 GMT 2023","Fri Jan 13 18:52:10 GMT 2023","150025","","JIT-Database-015b-INDEX-CRUD-single","","JIT-Database-015b-INDEX-CRUD-single","[INDEX] As a user, I check add and update multiple index","[INDEX] As a user, I check add and update multiple index",""
"passed","Fri Jan 13 18:25:21 GMT 2023","Fri Jan 13 18:26:33 GMT 2023","71837","","JIT-Mobile-031b-DIVIDER-General-info","","JIT-Mobile-031b-DIVIDER-General-info","[MOBILE-DIVIDER] As a user, I should check the general infomation of Divider is correct: Name, Key, unique key, delete component","[MOBILE-DIVIDER] As a user, I should check the general infomation of Divider is correct: Name, Key, unique key, delete component",""
"passed","Fri Jan 13 18:16:59 GMT 2023","Fri Jan 13 18:18:26 GMT 2023","86659","","JIT-Database-016b-COUNTER-CACHE-Create-by-adding-column","","JIT-Database-016b-COUNTER-CACHE-Create-by-adding-column","[COUNTER-CACHE] create new counter cache column by adding column","[COUNTER-CACHE] create new counter cache column by adding column",""
"broken","Fri Jan 13 19:50:19 GMT 2023","Fri Jan 13 19:51:01 GMT 2023","42016","","JIT-Preview-005-Preview-[TOAST-MESSAGE]","","JIT-Preview-005-Preview-[TOAST-MESSAGE]","[PREVIEW-TOAST-MESSAGE] As a user, I check preview function for Toast message action","[PREVIEW-TOAST-MESSAGE] As a user, I check preview function for Toast message action",""
"passed","Fri Jan 13 18:40:32 GMT 2023","Fri Jan 13 18:42:59 GMT 2023","146767","","JIT-Web-002e-MOLECULE-Search","","JIT-Web-002e-MOLECULE-Search","[WEB-PAGE] As a user, I can search correct molecule with keyword","[WEB-PAGE] As a user, I can search correct molecule with keyword",""
"passed","Fri Jan 13 18:28:56 GMT 2023","Fri Jan 13 18:30:29 GMT 2023","92783","","JIT-Mobile-045a-LAYER-TREE-Check-edit-and-action","","JIT-Mobile-045a-LAYER-TREE-Check-edit-and-action","[MOBILE-LAYER-TREE] As a user, I could update the name of the node in the layer tree and copy,paste,delete,wrap the node","[MOBILE-LAYER-TREE] As a user, I could update the name of the node in the layer tree and copy,paste,delete,wrap the node",""
"broken","Fri Jan 13 19:49:25 GMT 2023","Fri Jan 13 19:50:12 GMT 2023","46222","","JIT-Preview-004-Preview-[BUTTON]","","JIT-Preview-004-Preview-[BUTTON]","[PREVIEW-BUTTON] As a user, I check preview function for Button component","[PREVIEW-BUTTON] As a user, I check preview function for Button component",""
"passed","Fri Jan 13 18:14:26 GMT 2023","Fri Jan 13 18:15:32 GMT 2023","65461","","JIT-Database-011e-COLUMN-ENUM-delete-all","","JIT-Database-011e-COLUMN-ENUM-delete-all","[COLUMN] As a user, I should delete all items and check all items are not displayed","[COLUMN] As a user, I should delete all items and check all items are not displayed",""
"passed","Fri Jan 13 18:11:59 GMT 2023","Fri Jan 13 18:14:38 GMT 2023","158505","","JIT-Database-007-COLUMN-type-TEXT","","JIT-Database-007-COLUMN-type-TEXT","[COLUMN] As a user, I should check the validation of TEXT column definition","[COLUMN] As a user, I should check the validation of TEXT column definition",""
"passed","Fri Jan 13 18:24:33 GMT 2023","Fri Jan 13 18:25:46 GMT 2023","73489","","JIT-Mobile-029b-TOUCHABLE-General-info","","JIT-Mobile-029b-TOUCHABLE-General-info","[MOBILE-TOUCHABLE] As a user, I should check the general infomation of Touchable is correct: Name, Key, unique key, delete component","[MOBILE-TOUCHABLE] As a user, I should check the general infomation of Touchable is correct: Name, Key, unique key, delete component",""
"passed","Fri Jan 13 18:48:27 GMT 2023","Fri Jan 13 18:49:48 GMT 2023","80758","","JIT-API-007e-PUT-API-Add-new-endpoint","","JIT-API-007e-PUT-API-Add-new-endpoint","[PUT-API] Create, update and delete new PUT API endpoint","[PUT-API] Create, update and delete new PUT API endpoint",""
"passed","Fri Jan 13 18:37:00 GMT 2023","Fri Jan 13 18:38:34 GMT 2023","93998","","JIT-Team-005-Invite-duplicate-email","","JIT-Team-005-Invite-duplicate-email","[INVITE-DELETE] Invite new email and invite again","[INVITE-DELETE] Invite new email and invite again",""
"passed","Fri Jan 13 18:45:28 GMT 2023","Fri Jan 13 18:47:19 GMT 2023","111139","","JIT-API-002b-GET-list-update-info","","JIT-API-002b-GET-list-update-info","As a user, I update info for GET-list","As a user, I update info for GET-list",""
"passed","Fri Jan 13 18:12:08 GMT 2023","Fri Jan 13 18:13:12 GMT 2023","64061","","JIT-Database-008-COLUMN-type-DATE-TIME","","JIT-Database-008-COLUMN-type-DATE-TIME","[COLUMN] As a user, I should check the validation of DATETIME column definition","[COLUMN] As a user, I should check the validation of DATETIME column definition",""
"passed","Fri Jan 13 18:20:15 GMT 2023","Fri Jan 13 18:21:18 GMT 2023","62558","","JIT-Mobile-012-JITDEF-remove-poperty-info-after-deleting-navigation","","JIT-Mobile-012-JITDEF-remove-poperty-info-after-deleting-navigation","[DEFECT] As a user, I should see the property infos need to be removed after the navigation was deleted","[DEFECT] As a user, I should see the property infos need to be removed after the navigation was deleted",""
"passed","Fri Jan 13 18:22:15 GMT 2023","Fri Jan 13 18:24:45 GMT 2023","149610","","JIT-Mobile-022d-TEXT-Check-PADDING-MARGIN","","JIT-Mobile-022d-TEXT-Check-PADDING-MARGIN","[MOBILE-TEXT] As a user, I should check the PADDING & MARGIN infomation of Text is correct: Top, Bottom, Right, Left.","[MOBILE-TEXT] As a user, I should check the PADDING & MARGIN infomation of Text is correct: Top, Bottom, Right, Left.",""
"passed","Fri Jan 13 18:47:15 GMT 2023","Fri Jan 13 18:48:48 GMT 2023","92818","","JIT-API-007ba-GET-list-API-Add-new-endpoint","","JIT-API-007ba-GET-list-API-Add-new-endpoint","[GET-list-API] Create, update and delete new GET API endpoint","[GET-list-API] Create, update and delete new GET API endpoint",""
"passed","Fri Jan 13 18:31:34 GMT 2023","Fri Jan 13 18:33:37 GMT 2023","122256","","JIT-Module-005b-FORCE-MOBILE-UPDATE-api","","JIT-Module-005b-FORCE-MOBILE-UPDATE-api","[FORCE-MOBILE-UPDATE] - Check api","[FORCE-MOBILE-UPDATE] - Check api",""
"passed","Fri Jan 13 18:10:23 GMT 2023","Fri Jan 13 18:11:17 GMT 2023","54718","","JIT-Database-002-COLUMN-default","","JIT-Database-002-COLUMN-default","[COLUMN] As a user, I should see the default column definition","[COLUMN] As a user, I should see the default column definition",""
"passed","Fri Jan 13 18:22:32 GMT 2023","Fri Jan 13 18:23:52 GMT 2023","80375","","JIT-Mobile-026b-BUTTON-General-info","","JIT-Mobile-026b-BUTTON-General-info","[MOBILE-BUTTON] As a user, I should check the general infomation of Button is correct: Name, Key, unique key, delete component","[MOBILE-BUTTON] As a user, I should check the general infomation of Button is correct: Name, Key, unique key, delete component",""
"passed","Fri Jan 13 18:10:41 GMT 2023","Fri Jan 13 18:11:28 GMT 2023","47124","","JIT-Database-003a-COLUMN-empty","","JIT-Database-003a-COLUMN-empty","[COLUMN] As a user, I cannot add empty column definition","[COLUMN] As a user, I cannot add empty column definition",""
"broken","Fri Jan 13 19:27:13 GMT 2023","Fri Jan 13 19:30:02 GMT 2023","168873","","JIT-Export-005b-Scenario-RN-all-default-component","","JIT-Export-005b-Scenario-RN-all-default-component","[RN-Default] As a user, I check export the project type React Native with all default component","[RN-Default] As a user, I check export the project type React Native with all default component",""
"passed","Fri Jan 13 18:10:24 GMT 2023","Fri Jan 13 18:11:15 GMT 2023","51024","","JIT-Database-001b-TABLE-empty","","JIT-Database-001b-TABLE-empty","[TABLE] As a user, I cannot create table with empty name","[TABLE] As a user, I cannot create table with empty name",""
"broken","Fri Jan 13 19:30:43 GMT 2023","Fri Jan 13 19:31:07 GMT 2023","23806","","JIT-Export-007-Existing-Scenario-ROR-withkey","","JIT-Export-007-Existing-Scenario-ROR-withkey","As a user, I check export the existing project type ROR with key successfully","As a user, I check export the existing project type ROR with key successfully",""
"passed","Fri Jan 13 18:30:13 GMT 2023","Fri Jan 13 18:30:57 GMT 2023","44449","","JIT-Module-002a-DEEPLINK-default","","JIT-Module-002a-DEEPLINK-default","As a user, I can add module Deeplink and remove it","As a user, I can add module Deeplink and remove it",""
