"Status","Start Time","Stop Time","Duration in ms","Parent Suite","Suite","Sub Suite","Test Class","Test Method","Name","Description"
"passed","Mon Aug 01 06:29:56 GMT 2022","Mon Aug 01 06:32:20 GMT 2022","143802","","JIT-API-008-DEFECT-Check-column-file-type","","JIT-API-008-DEFECT-Check-column-file-type","[DEFECT] As a user, I check column type file not display in request params of GET list Api","[DEFECT] As a user, I check column type file not display in request params of GET list Api",""
"broken","Mon Aug 01 06:55:52 GMT 2022","Mon Aug 01 06:56:57 GMT 2022","65102","","JIT-Mobile-002-SCREEN-Update","","JIT-Mobile-002-SCREEN-Update","[SCREEN] As a user, I can update screen with positive and negative cases","[SCREEN] As a user, I can update screen with positive and negative cases",""
"broken","Mon Aug 01 07:12:36 GMT 2022","Mon Aug 01 07:14:25 GMT 2022","109335","","JIT-Mobile-036a-DATETIMEPICKER-Check-PreviewCode","","JIT-Mobile-036a-DATETIMEPICKER-Check-PreviewCode","[DATETIMEPICKER] As a user, I should check the Preview code of DatetimePicker component","[DATETIMEPICKER] As a user, I should check the Preview code of DatetimePicker component",""
"passed","Mon Aug 01 05:49:11 GMT 2022","Mon Aug 01 05:51:24 GMT 2022","132895","","JIT-Dashboard-002b-LISTOF-new-column","","JIT-Dashboard-002b-LISTOF-new-column","[LIST-OF] As a user, I should add new column in dashboard params","[LIST-OF] As a user, I should add new column in dashboard params",""
"passed","Mon Aug 01 05:55:25 GMT 2022","Mon Aug 01 05:56:11 GMT 2022","46231","","JIT-Database-001c-TABLE-duplicate","","JIT-Database-001c-TABLE-duplicate","[TABLE] As a user, I cannot create table with duplicate name","[TABLE] As a user, I cannot create table with duplicate name",""
"passed","Mon Aug 01 06:28:03 GMT 2022","Mon Aug 01 06:29:03 GMT 2022","59837","","JIT-API-006b-DELETE-update-info","","JIT-API-006b-DELETE-update-info","As a user, I update info for API DELETE","As a user, I update info for API DELETE",""
"broken","Mon Aug 01 06:56:12 GMT 2022","Mon Aug 01 06:58:01 GMT 2022","108419","","JIT-Mobile-003-SCREEN-Delete","","JIT-Mobile-003-SCREEN-Delete","[SCREEN] As a user, I can delete screen","[SCREEN] As a user, I can delete screen",""
"broken","Mon Aug 01 07:07:01 GMT 2022","Mon Aug 01 07:08:06 GMT 2022","64338","","JIT-Mobile-027a-IMAGE-Check-PreviewCode","","JIT-Mobile-027a-IMAGE-Check-PreviewCode","[IMAGE] As a user, I should check Preview code of Image component","[IMAGE] As a user, I should check Preview code of Image component",""
"passed","Mon Aug 01 07:16:03 GMT 2022","Mon Aug 01 07:17:26 GMT 2022","82549","","JIT-Database-015e-INDEX-TEXT-column-config","","JIT-Database-015e-INDEX-TEXT-column-config","[INDEX-TEXT] As a user, I config index from column setting && check on index popup","[INDEX-TEXT] As a user, I config index from column setting && check on index popup",""
"passed","Mon Aug 01 05:56:20 GMT 2022","Mon Aug 01 05:57:13 GMT 2022","52888","","JIT-Database-003a-COLUMN-empty","","JIT-Database-003a-COLUMN-empty","[COLUMN] As a user, I cannot add empty column definition","[COLUMN] As a user, I cannot add empty column definition",""
"passed","Mon Aug 01 05:58:34 GMT 2022","Mon Aug 01 06:00:14 GMT 2022","99180","","JIT-Database-011a-COLUMN-ENUM-default","","JIT-Database-011a-COLUMN-ENUM-default","[COLUMN] As a user, I should check the basic validation","[COLUMN] As a user, I should check the basic validation",""
"broken","Mon Aug 01 07:05:07 GMT 2022","Mon Aug 01 07:06:14 GMT 2022","66689","","JIT-Mobile-022e-TEXT-Check-PreviewCode","","JIT-Mobile-022e-TEXT-Check-PreviewCode","[TEXT] As a user, I should check Preview code of Text component","[TEXT] As a user, I should check Preview code of Text component",""
"passed","Mon Aug 01 06:00:40 GMT 2022","Mon Aug 01 06:01:44 GMT 2022","64153","","JIT-Database-011f-COLUMN-ENUM-duplicated","","JIT-Database-011f-COLUMN-ENUM-duplicated","[COLUMN] As a user, I should check counld not add duplicated item","[COLUMN] As a user, I should check counld not add duplicated item",""
"passed","Mon Aug 01 06:21:05 GMT 2022","Mon Aug 01 06:24:49 GMT 2022","223855","","JIT-SeedData-003a-MULTIPLE-CSV-data-and-search","","JIT-SeedData-003a-MULTIPLE-CSV-data-and-search","[UPLOAD MULTIPLE] As a user, I want to upload multiple CSV files","[UPLOAD MULTIPLE] As a user, I want to upload multiple CSV files",""
"failed","Mon Aug 01 06:53:10 GMT 2022","Mon Aug 01 06:54:32 GMT 2022","82089","","JIT-Database-015a-INDEX-Check-duplicate-empty","","JIT-Database-015a-INDEX-Check-duplicate-empty","[INDEX] As a user, I check empty and duplicate index","[INDEX] As a user, I check empty and duplicate index",""
"passed","Mon Aug 01 06:13:17 GMT 2022","Mon Aug 01 06:13:53 GMT 2022","35551","","JIT-Module-000-search","","JIT-Module-000-search","[SEARCH] As a user, I can Search module","[SEARCH] As a user, I can Search module",""
"broken","Mon Aug 01 07:03:51 GMT 2022","Mon Aug 01 07:04:55 GMT 2022","64007","","JIT-Mobile-016-VIEW-Check-BASIC","","JIT-Mobile-016-VIEW-Check-BASIC","[VIEW] As a user, I should check the BASIC infomation of View is correct: Width, Height, Flex, Color","[VIEW] As a user, I should check the BASIC infomation of View is correct: Width, Height, Flex, Color",""
"passed","Mon Aug 01 07:24:40 GMT 2022","Mon Aug 01 07:27:00 GMT 2022","140372","","JIT-Export-001-Scenario_ROR_1","","JIT-Export-001-Scenario_ROR_1","As a user, I check export the project type ROR no key successfully with scenario 1","As a user, I check export the project type ROR no key successfully with scenario 1",""
"passed","Mon Aug 01 06:13:49 GMT 2022","Mon Aug 01 06:15:26 GMT 2022","97474","","JIT-Module-001b-CLOUDINARY-edit-infos","","JIT-Module-001b-CLOUDINARY-edit-infos","As a user, I can update module Cloudinary","As a user, I can update module Cloudinary",""
"passed","Mon Aug 01 06:19:53 GMT 2022","Mon Aug 01 06:20:58 GMT 2022","64459","","JIT-Module-016b-SENDGRID-edit-infos","","JIT-Module-016b-SENDGRID-edit-infos","[SENDGRID] As a user, I can update module SendGrid","[SENDGRID] As a user, I can update module SendGrid",""
"passed","Mon Aug 01 06:36:32 GMT 2022","Mon Aug 01 06:37:50 GMT 2022","78332","","JIT-Module-006c-SMS-database-api","","JIT-Module-006c-SMS-database-api","[SMS], I check auto-generate column and api","[SMS], I check auto-generate column and api",""
"passed","Mon Aug 01 06:27:32 GMT 2022","Mon Aug 01 06:28:52 GMT 2022","80008","","JIT-API-004c-GET-detail-relation","","JIT-API-004c-GET-detail-relation","As a user, I check column display when having relation for GET-detail","As a user, I check column display when having relation for GET-detail",""
"passed","Mon Aug 01 06:15:23 GMT 2022","Mon Aug 01 06:17:23 GMT 2022","120159","","JIT-Module-005b-FORCE-MOBILE-UPDATE-api","","JIT-Module-005b-FORCE-MOBILE-UPDATE-api","[FORCE-MOBILE-UPDATE] - Check api","[FORCE-MOBILE-UPDATE] - Check api",""
"passed","Mon Aug 01 06:20:45 GMT 2022","Mon Aug 01 06:23:37 GMT 2022","171845","","JIT-SeedData-002a-EDIT-CSV-data","","JIT-SeedData-002a-EDIT-CSV-data","[UPLOAD && EDIT] As a user, I want to mapping the table with seed data and add data manually","[UPLOAD && EDIT] As a user, I want to mapping the table with seed data and add data manually",""
"passed","Mon Aug 01 05:55:26 GMT 2022","Mon Aug 01 05:57:13 GMT 2022","106343","","JIT-Database-001d-TABLE-update","","JIT-Database-001d-TABLE-update","[TABLE] As a user, I can update the value of the table","[TABLE] As a user, I can update the value of the table",""
"failed","Mon Aug 01 07:24:40 GMT 2022","Mon Aug 01 07:26:51 GMT 2022","131112","","JIT-Export-003-Scenario_ROR_2","","JIT-Export-003-Scenario_ROR_2","As a user, I check export the project type ROR no key successfully with scenario 2","As a user, I check export the project type ROR no key successfully with scenario 2",""
"passed","Mon Aug 01 06:18:30 GMT 2022","Mon Aug 01 06:19:47 GMT 2022","77586","","JIT-Module-014b-BASIC-AUTH-edit-infos","","JIT-Module-014b-BASIC-AUTH-edit-infos","[BASIC-AUTH] As a user, I can update module Basic Authentication","[BASIC-AUTH] As a user, I can update module Basic Authentication",""
"passed","Mon Aug 01 05:57:30 GMT 2022","Mon Aug 01 06:00:24 GMT 2022","173515","","JIT-Database-007-COLUMN-type-TEXT","","JIT-Database-007-COLUMN-type-TEXT","[COLUMN] As a user, I should check the validation of TEXT column definition","[COLUMN] As a user, I should check the validation of TEXT column definition",""
"passed","Mon Aug 01 05:51:43 GMT 2022","Mon Aug 01 05:54:01 GMT 2022","137930","","JIT-Dashboard-004a-CREATEOF-default","","JIT-Dashboard-004a-CREATEOF-default","[CREATE-OF] As a user, I should add default column in dashboard params","[CREATE-OF] As a user, I should add default column in dashboard params",""
"passed","Mon Aug 01 05:59:20 GMT 2022","Mon Aug 01 06:00:28 GMT 2022","67782","","JIT-Database-011c-COLUMN-ENUM-delete-items","","JIT-Database-011c-COLUMN-ENUM-delete-items","[COLUMN] As a user, I should delete 1 item and check not display in default dropdown","[COLUMN] As a user, I should delete 1 item and check not display in default dropdown",""
"passed","Mon Aug 01 06:35:48 GMT 2022","Mon Aug 01 06:38:17 GMT 2022","149590","","JIT-Module-004-EMAIL-LOGIN","","JIT-Module-004-EMAIL-LOGIN","[EMAIL-LOGIN] - Check adding and auto-generated API","[EMAIL-LOGIN] - Check adding and auto-generated API",""
"passed","Mon Aug 01 06:16:52 GMT 2022","Mon Aug 01 06:19:06 GMT 2022","134438","","JIT-Module-009a-GOOGLE-LOGIN-default-edit","","JIT-Module-009a-GOOGLE-LOGIN-default-edit","[GOOGLE-LOGIN], I can add module Google Login and edit its infos","[GOOGLE-LOGIN], I can add module Google Login and edit its infos",""
"passed","Mon Aug 01 06:02:07 GMT 2022","Mon Aug 01 06:04:07 GMT 2022","119594","","JIT-Database-014-DEFECT-Check-duplicate-table-name","","JIT-Database-014-DEFECT-Check-duplicate-table-name","[DEFECT] As a user, I cannot update to duplicate name","[DEFECT] As a user, I cannot update to duplicate name",""
"broken","Mon Aug 01 07:06:22 GMT 2022","Mon Aug 01 07:08:11 GMT 2022","109100","","JIT-Mobile-026a-BUTTON-Check-PreviewCode","","JIT-Mobile-026a-BUTTON-Check-PreviewCode","[BUTTON] As a user, I should check Preview code of Button component","[BUTTON] As a user, I should check Preview code of Button component",""
"passed","Mon Aug 01 06:13:50 GMT 2022","Mon Aug 01 06:14:42 GMT 2022","52128","","JIT-Module-002a-DEEPLINK-default","","JIT-Module-002a-DEEPLINK-default","As a user, I can add module Deeplink and remove it","As a user, I can add module Deeplink and remove it",""
"passed","Mon Aug 01 05:49:12 GMT 2022","Mon Aug 01 05:51:22 GMT 2022","129424","","JIT-Dashboard-001-Check-general-info","","JIT-Dashboard-001-Check-general-info","As a user, I check general info and update table name","As a user, I check general info and update table name",""
"passed","Mon Aug 01 05:53:52 GMT 2022","Mon Aug 01 05:55:54 GMT 2022","122091","","JIT-Dashboard-006a-DELETEOF-default","","JIT-Dashboard-006a-DELETEOF-default","[DELETE-OF] As a user, I should add default column in dashboard params","[DELETE-OF] As a user, I should add default column in dashboard params",""
"passed","Mon Aug 01 05:50:59 GMT 2022","Mon Aug 01 05:52:24 GMT 2022","84687","","JIT-Dashboard-003c-DETAILOF-saving","","JIT-Dashboard-003c-DETAILOF-saving","[DEATIL-OF] As a user, I should save the selected option when switching between tables","[DEATIL-OF] As a user, I should save the selected option when switching between tables",""
"passed","Mon Aug 01 06:13:47 GMT 2022","Mon Aug 01 06:14:51 GMT 2022","63773","","JIT-Module-001a-CLOUDINARY-default","","JIT-Module-001a-CLOUDINARY-default","As a user, I can add module Cloudinary and remove it","As a user, I can add module Cloudinary and remove it",""
"passed","Mon Aug 01 06:38:27 GMT 2022","Mon Aug 01 06:39:40 GMT 2022","72435","","JIT-Module-011b-GUEST-LOGIN-databse-api","","JIT-Module-011b-GUEST-LOGIN-databse-api","[GUEST-LOGIN], I check auto-generate column and api","[GUEST-LOGIN], I check auto-generate column and api",""
"passed","Mon Aug 01 05:57:10 GMT 2022","Mon Aug 01 06:00:09 GMT 2022","178894","","JIT-Database-006-COLUMN-type-STRING","","JIT-Database-006-COLUMN-type-STRING","[COLUMN] As a user, I should check the validation of STRING column definition","[COLUMN] As a user, I should check the validation of STRING column definition",""
"broken","Mon Aug 01 06:48:59 GMT 2022","Mon Aug 01 06:50:03 GMT 2022","64424","","JIT-Mobile-037a-FORM-Check-PreviewCode","","JIT-Mobile-037a-FORM-Check-PreviewCode","[FORM] As a user, I should check the Preview code of Form component","[FORM] As a user, I should check the Preview code of Form component",""
"passed","Mon Aug 01 06:38:01 GMT 2022","Mon Aug 01 06:39:22 GMT 2022","81075","","JIT-Module-009b-GOOGLE-LOGIN-databse-api","","JIT-Module-009b-GOOGLE-LOGIN-databse-api","[GOOGLE-LOGIN], I check auto-generate column and api","[GOOGLE-LOGIN], I check auto-generate column and api",""
"broken","Mon Aug 01 07:10:44 GMT 2022","Mon Aug 01 07:12:33 GMT 2022","108457","","JIT-Mobile-032a-CAROUSEL-Check-PreviewCode","","JIT-Mobile-032a-CAROUSEL-Check-PreviewCode","[CAROUSEL] As a user, I should check the Preview code of Carousel component","[CAROUSEL] As a user, I should check the Preview code of Carousel component",""
"passed","Mon Aug 01 06:25:09 GMT 2022","Mon Aug 01 06:26:03 GMT 2022","54616","","JIT-API-001-Check-general-info","","JIT-API-001-Check-general-info","As a user, I check general info","As a user, I check general info",""
"broken","Mon Aug 01 06:57:04 GMT 2022","Mon Aug 01 06:58:08 GMT 2022","63739","","JIT-Mobile-004-SCREEN-duplicate","","JIT-Mobile-004-SCREEN-duplicate","[SCREEN] As a user, I can duplicate screen with positive and negative cases","[SCREEN] As a user, I can duplicate screen with positive and negative cases",""
"passed","Mon Aug 01 05:51:45 GMT 2022","Mon Aug 01 05:53:03 GMT 2022","77887","","JIT-Dashboard-004c-CREATEOF-saving","","JIT-Dashboard-004c-CREATEOF-saving","[CREATE-OF] As a user, I should save the selected option when switching between tables","[CREATE-OF] As a user, I should save the selected option when switching between tables",""
"passed","Mon Aug 01 06:00:55 GMT 2022","Mon Aug 01 06:02:20 GMT 2022","85047","","JIT-Database-012a-RELATION-basic","","JIT-Database-012a-RELATION-basic","[RELATION] check the basic relation","[RELATION] check the basic relation",""
"passed","Mon Aug 01 06:00:29 GMT 2022","Mon Aug 01 06:01:38 GMT 2022","68838","","JIT-Database-011e-COLUMN-ENUM-delete-all","","JIT-Database-011e-COLUMN-ENUM-delete-all","[COLUMN] As a user, I should delete all items and check all items are not displayed","[COLUMN] As a user, I should delete all items and check all items are not displayed",""
"passed","Mon Aug 01 05:59:49 GMT 2022","Mon Aug 01 06:01:40 GMT 2022","110220","","JIT-Database-008-COLUMN-type-DATE-TIME","","JIT-Database-008-COLUMN-type-DATE-TIME","As a user, I should check the validation of DATE column definition","As a user, I should check the validation of DATE column definition",""
"passed","Mon Aug 01 05:57:02 GMT 2022","Mon Aug 01 05:58:56 GMT 2022","113427","","JIT-Database-005-COLUMN-type-FLOAT","","JIT-Database-005-COLUMN-type-FLOAT","[COLUMN] As a user, I should check the validation of FLOAT column definition","[COLUMN] As a user, I should check the validation of FLOAT column definition",""
"broken","Mon Aug 01 07:01:52 GMT 2022","Mon Aug 01 07:03:43 GMT 2022","111014","","JIT-Mobile-013-JITDEF-reflect-delete-screen-innavigation-tree","","JIT-Mobile-013-JITDEF-reflect-delete-screen-innavigation-tree","[DEFECT] As a user, I should see screen will be removed in navigation tree after deleting screen","[DEFECT] As a user, I should see screen will be removed in navigation tree after deleting screen",""
"passed","Mon Aug 01 06:21:28 GMT 2022","Mon Aug 01 06:22:31 GMT 2022","63137","","JIT-Team-004-Invite-and-delete-invitation","","JIT-Team-004-Invite-and-delete-invitation","[INVITE-DELETE] Invite new email and delete invitation","[INVITE-DELETE] Invite new email and delete invitation",""
"passed","Mon Aug 01 05:53:28 GMT 2022","Mon Aug 01 05:54:46 GMT 2022","77843","","JIT-Dashboard-005c-UPDATEOF-saving","","JIT-Dashboard-005c-UPDATEOF-saving","[UPDATE-OF] As a user, I should save the selected option when switching between tables","[UPDATE-OF] As a user, I should save the selected option when switching between tables",""
"passed","Mon Aug 01 07:17:31 GMT 2022","Mon Aug 01 07:18:56 GMT 2022","85202","","JIT-Database-015f-INDEX-INTEGER-column-config","","JIT-Database-015f-INDEX-INTEGER-column-config","[INDEX-INTEGER] As a user, I config index from column setting && check on index popup","[INDEX-INTEGER] As a user, I config index from column setting && check on index popup",""
"passed","Mon Aug 01 06:29:15 GMT 2022","Mon Aug 01 06:30:59 GMT 2022","104402","","JIT-API-007ba-GET-list-API-Add-new-endpoint","","JIT-API-007ba-GET-list-API-Add-new-endpoint","[GET-list-API] Create, update and delete new GET API endpoint","[GET-list-API] Create, update and delete new GET API endpoint",""
"passed","Mon Aug 01 06:19:46 GMT 2022","Mon Aug 01 06:20:43 GMT 2022","57161","","JIT-Module-016a-SENDGRID-default","","JIT-Module-016a-SENDGRID-default","[SENDGRID] As a user, I can add module SendGrid and remove it","[SENDGRID] As a user, I can add module SendGrid and remove it",""
"passed","Mon Aug 01 05:53:01 GMT 2022","Mon Aug 01 05:54:51 GMT 2022","110178","","JIT-Dashboard-005b-UPDATEOF-new-column","","JIT-Dashboard-005b-UPDATEOF-new-column","[UPDATE-OF] As a user, I should add new column in dashboard params","[UPDATE-OF] As a user, I should add new column in dashboard params",""
"broken","Mon Aug 01 07:10:10 GMT 2022","Mon Aug 01 07:11:15 GMT 2022","64851","","JIT-Mobile-031a-DIVIDER-Check-PreviewCode","","JIT-Mobile-031a-DIVIDER-Check-PreviewCode","[DIVIDER] As a user, I should check the Preview code of Divider component","[DIVIDER] As a user, I should check the Preview code of Divider component",""
"passed","Mon Aug 01 06:19:56 GMT 2022","Mon Aug 01 06:20:55 GMT 2022","58986","","JIT-Module-017a-GOOGLE-ANAL-default","","JIT-Module-017a-GOOGLE-ANAL-default","[GOOGLE-ANAL] As a user, I can add module Google Analytics and remove it","[GOOGLE-ANAL] As a user, I can add module Google Analytics and remove it",""
"passed","Mon Aug 01 07:20:31 GMT 2022","Mon Aug 01 07:21:54 GMT 2022","83425","","JIT-Database-015i-INDEX-DATETIME-column-config","","JIT-Database-015i-INDEX-DATETIME-column-config","[INDEX-DATETIME] As a user, I config index from column setting && check on index popup","[INDEX-DATETIME] As a user, I config index from column setting && check on index popup",""
"passed","Mon Aug 01 05:52:41 GMT 2022","Mon Aug 01 05:54:08 GMT 2022","87037","","JIT-Dashboard-005a-UPDATEOF-default","","JIT-Dashboard-005a-UPDATEOF-default","[UPDATE-OF] As a user, I should add default column in dashboard params","[UPDATE-OF] As a user, I should add default column in dashboard params",""
"passed","Mon Aug 01 06:36:38 GMT 2022","Mon Aug 01 06:38:15 GMT 2022","96773","","JIT-Module-008b-FB-LOGIN-databse-api","","JIT-Module-008b-FB-LOGIN-databse-api","[FACEBOOK-LOGIN], I check auto-generate column and api","[FACEBOOK-LOGIN], I check auto-generate column and api",""
"passed","Mon Aug 01 05:51:34 GMT 2022","Mon Aug 01 05:53:30 GMT 2022","115669","","JIT-Dashboard-003e-DETAILOF-delete-column","","JIT-Dashboard-003e-DETAILOF-delete-column","[DEATIL-OF] As a user, I should see the params will be removed when column is deleted","[DEATIL-OF] As a user, I should see the params will be removed when column is deleted",""
"passed","Mon Aug 01 05:55:14 GMT 2022","Mon Aug 01 05:57:02 GMT 2022","107798","","JIT-Database-001a-TABLE-new","","JIT-Database-001a-TABLE-new","[TABLE] As a user, I can create new table","[TABLE] As a user, I can create new table",""
"passed","Mon Aug 01 06:03:04 GMT 2022","Mon Aug 01 06:04:34 GMT 2022","89854","","JIT-Database-016b-COUNTER-CACHE-Create-by-adding-column","","JIT-Database-016b-COUNTER-CACHE-Create-by-adding-column","[COUNTER-CACHE] create new counter cache column by adding column","[COUNTER-CACHE] create new counter cache column by adding column",""
"passed","Mon Aug 01 06:27:52 GMT 2022","Mon Aug 01 06:29:28 GMT 2022","96056","","JIT-API-006a-DELETE-check-default","","JIT-API-006a-DELETE-check-default","As a user, I check default value in API DELETE","As a user, I check default value in API DELETE",""
"passed","Mon Aug 01 06:28:20 GMT 2022","Mon Aug 01 06:29:39 GMT 2022","78926","","JIT-API-006c-DELETE-relation","","JIT-API-006c-DELETE-relation","As a user, I check column display when having relation for API DELETE","As a user, I check column display when having relation for API DELETE",""
"broken","Mon Aug 01 06:58:08 GMT 2022","Mon Aug 01 06:59:14 GMT 2022","65177","","JIT-Mobile-005-MOLECULE-Create-new","","JIT-Mobile-005-MOLECULE-Create-new","[MOLECULE] As a user, I can create new molecule with positive and negative cases","[MOLECULE] As a user, I can create new molecule with positive and negative cases",""
"passed","Mon Aug 01 07:14:34 GMT 2022","Mon Aug 01 07:15:57 GMT 2022","83538","","JIT-Database-015d-INDEX-STRING-column-config","","JIT-Database-015d-INDEX-STRING-column-config","[INDEX-STRING] As a user, I config index from column setting && check on index popup","[INDEX-STRING] As a user, I config index from column setting && check on index popup",""
"broken","Mon Aug 01 06:48:58 GMT 2022","Mon Aug 01 06:51:14 GMT 2022","135186","","JIT-Team-001-Invite-and-signup-new-account","","JIT-Team-001-Invite-and-signup-new-account","[INVITE-SIGNUP] Invite new email and sign-up new account and do common action","[INVITE-SIGNUP] Invite new email and sign-up new account and do common action",""
"passed","Mon Aug 01 05:57:48 GMT 2022","Mon Aug 01 05:59:01 GMT 2022","72937","","JIT-Database-010a-COLUMN-FILE-validation","","JIT-Database-010a-COLUMN-FILE-validation","[COLUMN] As a user, I should check the validation of FILE column definition","[COLUMN] As a user, I should check the validation of FILE column definition",""
"passed","Mon Aug 01 05:54:58 GMT 2022","Mon Aug 01 05:56:47 GMT 2022","109537","","JIT-Dashboard-006e-DELETEOF-delete-column","","JIT-Dashboard-006e-DELETEOF-delete-column","[DELETE-OF] As a user, I should see the params will be removed when column is deleted","[DELETE-OF] As a user, I should see the params will be removed when column is deleted",""
"passed","Mon Aug 01 05:51:16 GMT 2022","Mon Aug 01 05:52:49 GMT 2022","92674","","JIT-Dashboard-003d-DETAILOF-delete-table","","JIT-Dashboard-003d-DETAILOF-delete-table","[DEATIL-OF] As a user, I should see the table is not displayed in dashboard list after removed","[DEATIL-OF] As a user, I should see the table is not displayed in dashboard list after removed",""
"passed","Mon Aug 01 06:14:28 GMT 2022","Mon Aug 01 06:15:53 GMT 2022","84737","","JIT-Module-003-JPBANK-default","","JIT-Module-003-JPBANK-default","[JPBANK] - Check adding and auto-generated API","[JPBANK] - Check adding and auto-generated API",""
"passed","Mon Aug 01 06:00:56 GMT 2022","Mon Aug 01 06:02:12 GMT 2022","76083","","JIT-Database-012b-RELATION-empty-duplicate","","JIT-Database-012b-RELATION-empty-duplicate","[RELATION], I should see the error duplicate when leaving foreign key empty","[RELATION], I should see the error duplicate when leaving foreign key empty",""
"passed","Mon Aug 01 06:26:15 GMT 2022","Mon Aug 01 06:27:53 GMT 2022","98415","","JIT-API-004a-GET-detail-check-default","","JIT-API-004a-GET-detail-check-default","As a user, I check default value in API GET-detail","As a user, I check default value in API GET-detail",""
"broken","Mon Aug 01 07:00:40 GMT 2022","Mon Aug 01 07:01:48 GMT 2022","67771","","JIT-Mobile-012-JITDEF-remove-poperty-info-after-deleting-navigation","","JIT-Mobile-012-JITDEF-remove-poperty-info-after-deleting-navigation","[DEFECT] As a user, I should see the property infos need to be removed after the navigation was deleted","[DEFECT] As a user, I should see the property infos need to be removed after the navigation was deleted",""
"passed","Mon Aug 01 06:53:56 GMT 2022","Mon Aug 01 06:54:49 GMT 2022","53289","","JIT-Database-015b-INDEX-CRUD-single","","JIT-Database-015b-INDEX-CRUD-single","[INDEX] As a user, I check add and update multiple index","[INDEX] As a user, I check add and update multiple index",""
"broken","Mon Aug 01 06:50:10 GMT 2022","Mon Aug 01 06:53:02 GMT 2022","171938","","JIT-Team-002-Invite-existing-account","","JIT-Team-002-Invite-existing-account","[INVITE-EXISTING-ACC] Invite existing email and do common action","[INVITE-EXISTING-ACC] Invite existing email and do common action",""
"broken","Mon Aug 01 06:54:55 GMT 2022","Mon Aug 01 06:56:01 GMT 2022","65745","","JIT-Mobile-001-SCREEN-Create-new","","JIT-Mobile-001-SCREEN-Create-new","[SCREEN] As a user, I can create new screen with positive and negative cases","[SCREEN] As a user, I can create new screen with positive and negative cases",""
"passed","Mon Aug 01 06:20:41 GMT 2022","Mon Aug 01 06:24:39 GMT 2022","237941","","JIT-SeedData-001a-UPLOAD-CSV-data","","JIT-SeedData-001a-UPLOAD-CSV-data","[UPLOAD] As a user, I want to upload data from file CSV","[UPLOAD] As a user, I want to upload data from file CSV",""
"passed","Mon Aug 01 06:29:35 GMT 2022","Mon Aug 01 06:31:50 GMT 2022","135504","","JIT-API-007bb-GET-list-API-Check-datetime-static-value","","JIT-API-007bb-GET-list-API-Check-datetime-static-value","[GET-list-API] Set datetime static value","[GET-list-API] Set datetime static value",""
"passed","Mon Aug 01 06:01:34 GMT 2022","Mon Aug 01 06:03:32 GMT 2022","117672","","JIT-Database-012d-RELATION-multiple-2-direction","","JIT-Database-012d-RELATION-multiple-2-direction","[RELATION], I should add multiple relation 2 directions","[RELATION], I should add multiple relation 2 directions",""
