"Status","Start Time","Stop Time","Duration in ms","Parent Suite","Suite","Sub Suite","Test Class","Test Method","Name","Description"
"passed","Thu Jun 23 06:44:48 GMT 2022","Thu Jun 23 06:46:20 GMT 2022","91158","","JIT-API-003a-POST-check-default","","JIT-API-003a-POST-check-default","As a user, I check default value in API POST","As a user, I check default value in API POST",""
"passed","Thu Jun 23 06:37:39 GMT 2022","Thu Jun 23 06:38:29 GMT 2022","49733","","JIT-Mobile-007-Molecule-delete-molecule","","JIT-Mobile-007-Molecule-delete-molecule","As a user, I can delete molecule","As a user, I can delete molecule",""
"passed","Thu Jun 23 06:43:37 GMT 2022","Thu Jun 23 06:44:21 GMT 2022","44572","","JIT-Module-016b-SENDGRID-edit-infos","","JIT-Module-016b-SENDGRID-edit-infos","[SENDGRID] As a user, I can update module SendGrid","[SENDGRID] As a user, I can update module SendGrid",""
"passed","Thu Jun 23 06:42:39 GMT 2022","Thu Jun 23 06:43:20 GMT 2022","41536","","JIT-Module-014a-BASIC-AUTH-default","","JIT-Module-014a-BASIC-AUTH-default","[BASIC-AUTH] As a user, I can add module Basic Authentication and remove it","[BASIC-AUTH] As a user, I can add module Basic Authentication and remove it",""
"passed","Thu Jun 23 06:31:38 GMT 2022","Thu Jun 23 06:32:15 GMT 2022","37086","","JIT-Database-002-Check-default-column-definition","","JIT-Database-002-Check-default-column-definition","As a user, I should see the default column definition","As a user, I should see the default column definition",""
"passed","Thu Jun 23 06:32:04 GMT 2022","Thu Jun 23 06:34:08 GMT 2022","124433","","JIT-Database-005-Check-validation-column-definition-type-FLOAT","","JIT-Database-005-Check-validation-column-definition-type-FLOAT","As a user, I should check the validation of FLOAT column definition","As a user, I should check the validation of FLOAT column definition",""
"passed","Thu Jun 23 06:32:17 GMT 2022","Thu Jun 23 06:35:10 GMT 2022","172631","","JIT-Database-007-Check-validation-column-definition-type-TEXT","","JIT-Database-007-Check-validation-column-definition-type-TEXT","As a user, I should check the validation of TEXT column definition","As a user, I should check the validation of TEXT column definition",""
"passed","Thu Jun 23 06:29:55 GMT 2022","Thu Jun 23 06:31:03 GMT 2022","68046","","JIT-Dashboard-006b-DELETEOF-new-column","","JIT-Dashboard-006b-DELETEOF-new-column","[DELETE-OF] As a user, I should add new column in dashboard params","[DELETE-OF] As a user, I should add new column in dashboard params",""
"passed","Thu Jun 23 06:28:05 GMT 2022","Thu Jun 23 06:29:16 GMT 2022","70194","","JIT-Dashboard-004c-CREATEOF-saving","","JIT-Dashboard-004c-CREATEOF-saving","[CREATE-OF] As a user, I should save the selected option when switching between tables","[CREATE-OF] As a user, I should save the selected option when switching between tables",""
"broken","Thu Jun 23 06:59:03 GMT 2022","Thu Jun 23 07:00:10 GMT 2022","67449","","JIT-Module-006a-SMS-default","","JIT-Module-006a-SMS-default","[SMS], I can add module SMS login with Twilio and remove it","[SMS], I can add module SMS login with Twilio and remove it",""
"broken","Thu Jun 23 07:12:12 GMT 2022","Thu Jun 23 07:13:19 GMT 2022","67282","","JIT-Module-011b-GUEST-LOGIN-databse-api","","JIT-Module-011b-GUEST-LOGIN-databse-api","[GUEST-LOGIN], I check auto-generate column and api","[GUEST-LOGIN], I check auto-generate column and api",""
"passed","Thu Jun 23 06:37:16 GMT 2022","Thu Jun 23 06:38:23 GMT 2022","66734","","JIT-Mobile-005-Moelcule-create-new-molecule","","JIT-Mobile-005-Moelcule-create-new-molecule","As a user, I can create new molecule with positive and negative cases","As a user, I can create new molecule with positive and negative cases",""
"passed","Thu Jun 23 06:49:33 GMT 2022","Thu Jun 23 06:50:50 GMT 2022","77009","","JIT-API-007e-PUT-API-Add-new-endpoint","","JIT-API-007e-PUT-API-Add-new-endpoint","[PUT-API] Create, update and delete new PUT API endpoint","[PUT-API] Create, update and delete new PUT API endpoint",""
"passed","Thu Jun 23 06:33:46 GMT 2022","Thu Jun 23 06:34:39 GMT 2022","53850","","JIT-Database-008-Check-validation-column-definition-type-DATE-TIME","","JIT-Database-008-Check-validation-column-definition-type-DATE-TIME","As a user, I should check the validation of DATE column definition","As a user, I should check the validation of DATE column definition",""
"passed","Thu Jun 23 06:29:54 GMT 2022","Thu Jun 23 06:31:22 GMT 2022","87840","","JIT-Dashboard-006a-DELETEOF-default","","JIT-Dashboard-006a-DELETEOF-default","[DELETE-OF] As a user, I should add default column in dashboard params","[DELETE-OF] As a user, I should add default column in dashboard params",""
"passed","Thu Jun 23 06:44:44 GMT 2022","Thu Jun 23 06:46:23 GMT 2022","99230","","JIT-API-002a-GET-list-check-default","","JIT-API-002a-GET-list-check-default","As a user, I check default value in API GET list","As a user, I check default value in API GET list",""
"passed","Thu Jun 23 06:39:42 GMT 2022","Thu Jun 23 06:40:42 GMT 2022","60123","","JIT-Module-001a-CLOUDINARY-default","","JIT-Module-001a-CLOUDINARY-default","As a user, I can add module Cloudinary and remove it","As a user, I can add module Cloudinary and remove it",""
"passed","Thu Jun 23 06:50:27 GMT 2022","Thu Jun 23 06:52:05 GMT 2022","97459","","JIT-API-008-DEFECT-Check-column-file-type","","JIT-API-008-DEFECT-Check-column-file-type","[DEFECT] As a user, I check column type file not display in request params of GET list Api","[DEFECT] As a user, I check column type file not display in request params of GET list Api",""
"passed","Thu Jun 23 06:31:23 GMT 2022","Thu Jun 23 06:32:21 GMT 2022","57996","","JIT-Database-001d-TABLE-update","","JIT-Database-001d-TABLE-update","As a user, I can update the value of the table","As a user, I can update the value of the table",""
"passed","Thu Jun 23 06:35:49 GMT 2022","Thu Jun 23 06:36:42 GMT 2022","53081","","JIT-Database-015a-INDEX-Check-duplicate-empty","","JIT-Database-015a-INDEX-Check-duplicate-empty","As a user, I check empty and duplicate index","As a user, I check empty and duplicate index",""
"passed","Thu Jun 23 06:37:31 GMT 2022","Thu Jun 23 06:38:54 GMT 2022","83167","","JIT-Mobile-006-Molecule-update-molecule","","JIT-Mobile-006-Molecule-update-molecule","As a user, I can update molecule with positive and negative cases","As a user, I can update molecule with positive and negative cases",""
"passed","Thu Jun 23 06:50:26 GMT 2022","Thu Jun 23 06:51:38 GMT 2022","72038","","JIT-API-007f-DELETE-API-Add-new-endpoint","","JIT-API-007f-DELETE-API-Add-new-endpoint","[DELETE-API] Create, update and delete new DELETE API endpoint","[DELETE-API] Create, update and delete new DELETE API endpoint",""
"passed","Thu Jun 23 06:32:34 GMT 2022","Thu Jun 23 06:33:27 GMT 2022","53098","","JIT-Database-003-Check-create-empty-and-duplicated-column","","JIT-Database-003-Check-create-empty-and-duplicated-column","As a user, I cannot add duplicated column definition","As a user, I cannot add duplicated column definition",""
"passed","Thu Jun 23 06:36:04 GMT 2022","Thu Jun 23 06:38:38 GMT 2022","154526","","JIT-Database-016a-COUNTER-CACHE-Create-by-relation","","JIT-Database-016a-COUNTER-CACHE-Create-by-relation","[COUNTER-CACHE] create new counter cache column by selecting in relation popup","[COUNTER-CACHE] create new counter cache column by selecting in relation popup",""
"passed","Thu Jun 23 06:42:27 GMT 2022","Thu Jun 23 06:43:04 GMT 2022","36962","","JIT-Module-013a-AWS-default","","JIT-Module-013a-AWS-default","[AWS] As a user, I can add module AWS SES Integration and remove it","[AWS] As a user, I can add module AWS SES Integration and remove it",""
"passed","Thu Jun 23 06:32:09 GMT 2022","Thu Jun 23 06:34:28 GMT 2022","138565","","JIT-Database-006-Check-validation-column-definition-type-STRING","","JIT-Database-006-Check-validation-column-definition-type-STRING","As a user, I should check the validation of STRING column definition","As a user, I should check the validation of STRING column definition",""
"passed","Thu Jun 23 06:29:07 GMT 2022","Thu Jun 23 06:30:17 GMT 2022","70597","","JIT-Dashboard-005a-UPDATEOF-default","","JIT-Dashboard-005a-UPDATEOF-default","[UPDATE-OF] As a user, I should add default column in dashboard params","[UPDATE-OF] As a user, I should add default column in dashboard params",""
"passed","Thu Jun 23 06:30:14 GMT 2022","Thu Jun 23 06:31:18 GMT 2022","63566","","JIT-Dashboard-006c-DELETEOF-saving","","JIT-Dashboard-006c-DELETEOF-saving","[DELETE-OF] As a user, I should save the selected option when switching between tables","[DELETE-OF] As a user, I should save the selected option when switching between tables",""
"passed","Thu Jun 23 06:58:42 GMT 2022","Thu Jun 23 06:58:59 GMT 2022","17019","","JIT-Module-000-search","","JIT-Module-000-search","[SEARCH] As a user, I can Search module","[SEARCH] As a user, I can Search module",""
"passed","Thu Jun 23 06:43:25 GMT 2022","Thu Jun 23 06:44:11 GMT 2022","46467","","JIT-Module-016a-SENDGRID-default","","JIT-Module-016a-SENDGRID-default","[SENDGRID] As a user, I can add module SendGrid and remove it","[SENDGRID] As a user, I can add module SendGrid and remove it",""
"passed","Thu Jun 23 06:25:45 GMT 2022","Thu Jun 23 06:27:26 GMT 2022","100506","","JIT-Dashboard-002b-LISTOF-new-column","","JIT-Dashboard-002b-LISTOF-new-column","[LIST-OF] As a user, I should add new column in dashboard params","[LIST-OF] As a user, I should add new column in dashboard params",""
"broken","Thu Jun 23 07:00:22 GMT 2022","Thu Jun 23 07:01:35 GMT 2022","72028","","JIT-Module-008a-FB-LOGIN-default-edit","","JIT-Module-008a-FB-LOGIN-default-edit","[FACEBOOK-LOGIN], I can add module Facebook Login and edit its infos","[FACEBOOK-LOGIN], I can add module Facebook Login and edit its infos",""
"broken","Thu Jun 23 07:10:49 GMT 2022","Thu Jun 23 07:12:01 GMT 2022","72023","","JIT-Module-010b-LINE-LOGIN-databse-api","","JIT-Module-010b-LINE-LOGIN-databse-api","[LINE-LOGIN], I check auto-generate column and api","[LINE-LOGIN], I check auto-generate column and api",""
"passed","Thu Jun 23 06:25:45 GMT 2022","Thu Jun 23 06:27:41 GMT 2022","115915","","JIT-Dashboard-002c-LISTOF-saving","","JIT-Dashboard-002c-LISTOF-saving","[LIST-OF] As a user, I should save the selected option when switching between tables","[LIST-OF] As a user, I should save the selected option when switching between tables",""
"passed","Thu Jun 23 07:14:40 GMT 2022","Thu Jun 23 07:19:02 GMT 2022","262583","","JIT-Export-003-Scenario_ROR_2","","JIT-Export-003-Scenario_ROR_2","As a user, I check export the project type ROR no key successfully with scenario 2","As a user, I check export the project type ROR no key successfully with scenario 2",""
"passed","Thu Jun 23 06:43:46 GMT 2022","Thu Jun 23 06:44:29 GMT 2022","43219","","JIT-Module-017a-GOOGLE-ANAL-default","","JIT-Module-017a-GOOGLE-ANAL-default","[GOOGLE-ANAL] As a user, I can add module Google Analytics and remove it","[GOOGLE-ANAL] As a user, I can add module Google Analytics and remove it",""
"passed","Thu Jun 23 06:29:42 GMT 2022","Thu Jun 23 06:30:59 GMT 2022","76961","","JIT-Dashboard-005e-UPDATEOF-delete-column","","JIT-Dashboard-005e-UPDATEOF-delete-column","[UPDATE-OF] As a user, I should see the params will be removed when column is deleted","[UPDATE-OF] As a user, I should see the params will be removed when column is deleted",""
"passed","Thu Jun 23 06:36:18 GMT 2022","Thu Jun 23 06:37:30 GMT 2022","71950","","JIT-Mobile-002-Screen-update-screen","","JIT-Mobile-002-Screen-update-screen","As a user, I can update screen with positive and negative cases","As a user, I can update screen with positive and negative cases",""
"passed","Thu Jun 23 07:15:14 GMT 2022","Thu Jun 23 07:15:39 GMT 2022","24440","","JIT-Export-007-Existing-Scenario-ROR-withkey","","JIT-Export-007-Existing-Scenario-ROR-withkey","As a user, I check export the existing project type ROR with key successfully","As a user, I check export the existing project type ROR with key successfully",""
