"Status","Start Time","Stop Time","Duration in ms","Parent Suite","Suite","Sub Suite","Test Class","Test Method","Name","Description"
"passed","Thu Jun 23 06:25:46 GMT 2022","Thu Jun 23 06:27:37 GMT 2022","110359","","JIT-Dashboard-002e-LISTOF-delete-column","","JIT-Dashboard-002e-LISTOF-delete-column","As a user, I should see the params will be removed when column is deleted","As a user, I should see the params will be removed when column is deleted",""
"passed","Thu Jun 23 06:42:29 GMT 2022","Thu Jun 23 06:43:13 GMT 2022","43538","","JIT-Module-013b-AWS-edit-infos","","JIT-Module-013b-AWS-edit-infos","[AWS] As a user, I can update module AWS SES Integration","[AWS] As a user, I can update module AWS SES Integration",""
"passed","Thu Jun 23 06:27:35 GMT 2022","Thu Jun 23 06:28:56 GMT 2022","80995","","JIT-Dashboard-003c-DETAILOF-saving","","JIT-Dashboard-003c-DETAILOF-saving","[DEATIL-OF] As a user, I should save the selected option when switching between tables","[DEATIL-OF] As a user, I should save the selected option when switching between tables",""
"passed","Thu Jun 23 06:31:43 GMT 2022","Thu Jun 23 06:32:34 GMT 2022","51297","","JIT-Database-003-Check-create-empty-and-duplicated-column","","JIT-Database-003-Check-create-empty-and-duplicated-column","As a user, I cannot add empty column definition","As a user, I cannot add empty column definition",""
"passed","Thu Jun 23 06:43:47 GMT 2022","Thu Jun 23 06:44:25 GMT 2022","37420","","JIT-Module-017b-GOOGLE-ANAL-edit-infos","","JIT-Module-017b-GOOGLE-ANAL-edit-infos","[GOOGLE-ANAL] As a user, I can update module Google Analytics","[GOOGLE-ANAL] As a user, I can update module Google Analytics",""
"passed","Thu Jun 23 06:48:19 GMT 2022","Thu Jun 23 06:48:50 GMT 2022","30507","","JIT-API-007a-GROUP-API-CRUD","","JIT-API-007a-GROUP-API-CRUD","[GROUP-API] Create, update and delete group API","[GROUP-API] Create, update and delete group API",""
"broken","Thu Jun 23 07:08:10 GMT 2022","Thu Jun 23 07:09:19 GMT 2022","69555","","JIT-Module-008b-FB-LOGIN-databse-api","","JIT-Module-008b-FB-LOGIN-databse-api","[FACEBOOK-LOGIN], I check auto-generate column and api","[FACEBOOK-LOGIN], I check auto-generate column and api",""
"passed","Thu Jun 23 06:34:59 GMT 2022","Thu Jun 23 06:35:59 GMT 2022","60081","","JIT-Database-011f-COLUMN-ENUM-duplicated","","JIT-Database-011f-COLUMN-ENUM-duplicated","As a user, I should check counld not add duplicated item","As a user, I should check counld not add duplicated item",""
"passed","Thu Jun 23 07:14:40 GMT 2022","Thu Jun 23 07:17:50 GMT 2022","190210","","JIT-Export-001-Scenario_ROR_1","","JIT-Export-001-Scenario_ROR_1","As a user, I check export the project type ROR no key successfully with scenario 1","As a user, I check export the project type ROR no key successfully with scenario 1",""
"passed","Thu Jun 23 06:25:45 GMT 2022","Thu Jun 23 06:27:38 GMT 2022","113124","","JIT-Dashboard-002a-LISTOF-default-column","","JIT-Dashboard-002a-LISTOF-default-column","[LIST-OF] As a user, I should add default column in dashboard params","[LIST-OF] As a user, I should add default column in dashboard params",""
"passed","Thu Jun 23 06:27:58 GMT 2022","Thu Jun 23 06:29:22 GMT 2022","83855","","JIT-Dashboard-004a-CREATEOF-default","","JIT-Dashboard-004a-CREATEOF-default","[CREATE-OF] As a user, I should add default column in dashboard params","[CREATE-OF] As a user, I should add default column in dashboard params",""
"broken","Thu Jun 23 07:05:11 GMT 2022","Thu Jun 23 07:06:19 GMT 2022","67375","","JIT-Module-006c-SMS-database-api","","JIT-Module-006c-SMS-database-api","[SMS], I check auto-generate column and api","[SMS], I check auto-generate column and api",""
"passed","Thu Jun 23 06:43:16 GMT 2022","Thu Jun 23 06:44:09 GMT 2022","52989","","JIT-Module-015a-SCOUT-default","","JIT-Module-015a-SCOUT-default","[SCOUT] As a user, I can add module Scout and remove it","[SCOUT] As a user, I can add module Scout and remove it",""
"passed","Thu Jun 23 06:36:17 GMT 2022","Thu Jun 23 06:37:07 GMT 2022","50808","","JIT-Mobile-001-Screen-create-new-screen","","JIT-Mobile-001-Screen-create-new-screen","As a user, I can create new screen with positive and negative cases","As a user, I can create new screen with positive and negative cases",""
"passed","Thu Jun 23 06:38:09 GMT 2022","Thu Jun 23 06:40:01 GMT 2022","112346","","JIT-Mobile-012-JITDEF-remove-poperty-info-after-deleting-navigation","","JIT-Mobile-012-JITDEF-remove-poperty-info-after-deleting-navigation","As a user, I should see the property infos need to be removed after the navigation was deleted","As a user, I should see the property infos need to be removed after the navigation was deleted",""
"passed","Thu Jun 23 06:29:28 GMT 2022","Thu Jun 23 06:30:54 GMT 2022","85938","","JIT-Dashboard-005d-UPDATEOF-delete-table","","JIT-Dashboard-005d-UPDATEOF-delete-table","[UPDATE-OF] As a user, I should see the table is not displayed in dashboard list after removed","[UPDATE-OF] As a user, I should see the table is not displayed in dashboard list after removed",""
"passed","Thu Jun 23 06:25:46 GMT 2022","Thu Jun 23 06:27:36 GMT 2022","109771","","JIT-Dashboard-002d-LISTOF-delete-table","","JIT-Dashboard-002d-LISTOF-delete-table","[LIST-OF] As a user, I should see the table is not displayed in dashboard list after removed","[LIST-OF] As a user, I should see the table is not displayed in dashboard list after removed",""
"passed","Thu Jun 23 06:46:33 GMT 2022","Thu Jun 23 06:48:14 GMT 2022","100908","","JIT-API-005a-PUT-check-default","","JIT-API-005a-PUT-check-default","As a user, I check default value in API PUT","As a user, I check default value in API PUT",""
"passed","Thu Jun 23 06:33:45 GMT 2022","Thu Jun 23 06:34:49 GMT 2022","64264","","JIT-Database-011a-COLUMN-ENUM-default","","JIT-Database-011a-COLUMN-ENUM-default","As a user, I should check the basic validation","As a user, I should check the basic validation",""
"broken","Thu Jun 23 06:59:22 GMT 2022","Thu Jun 23 07:00:34 GMT 2022","72272","","JIT-Module-007a-APPLE-LOGIN-default-edit","","JIT-Module-007a-APPLE-LOGIN-default-edit","[APPLE-LOGIN], I can add module Apple Login and edit its infos","[APPLE-LOGIN], I can add module Apple Login and edit its infos",""
"passed","Thu Jun 23 06:37:06 GMT 2022","Thu Jun 23 06:39:08 GMT 2022","121757","","JIT-Mobile-004-Screen-duplicate-screen","","JIT-Mobile-004-Screen-duplicate-screen","As a user, I can duplicate screen with positive and negative cases","As a user, I can duplicate screen with positive and negative cases",""
"passed","Thu Jun 23 06:46:32 GMT 2022","Thu Jun 23 06:47:41 GMT 2022","68132","","JIT-API-004c-GET-detail-relation","","JIT-API-004c-GET-detail-relation","As a user, I check column display when having relation for GET-detail","As a user, I check column display when having relation for GET-detail",""
"passed","Thu Jun 23 06:29:17 GMT 2022","Thu Jun 23 06:30:24 GMT 2022","67626","","JIT-Dashboard-005b-UPDATEOF-new-column","","JIT-Dashboard-005b-UPDATEOF-new-column","[UPDATE-OF] As a user, I should add new column in dashboard params","[UPDATE-OF] As a user, I should add new column in dashboard params",""
"broken","Thu Jun 23 07:09:30 GMT 2022","Thu Jun 23 07:10:39 GMT 2022","69279","","JIT-Module-009b-GOOGLE-LOGIN-databse-api","","JIT-Module-009b-GOOGLE-LOGIN-databse-api","[GOOGLE-LOGIN], I check auto-generate column and api","[GOOGLE-LOGIN], I check auto-generate column and api",""
"passed","Thu Jun 23 06:35:30 GMT 2022","Thu Jun 23 06:37:20 GMT 2022","110013","","JIT-Database-012b-RELATION-empty-duplicate","","JIT-Database-012b-RELATION-empty-duplicate","[RELATION], I should see the error duplicate when leaving foreign key empty","[RELATION], I should see the error duplicate when leaving foreign key empty",""
"passed","Thu Jun 23 06:50:57 GMT 2022","Thu Jun 23 06:53:23 GMT 2022","146404","","JIT-API-009-Auto-fill","","JIT-API-009-Auto-fill","[AUTO-FILL] As a user, I could add request param by Auto-fill","[AUTO-FILL] As a user, I could add request param by Auto-fill",""
"passed","Thu Jun 23 06:32:00 GMT 2022","Thu Jun 23 06:33:44 GMT 2022","104550","","JIT-Database-004-Check-validation-column-definition-type-INTEGER","","JIT-Database-004-Check-validation-column-definition-type-INTEGER","As a user, I should check the validation of INTEGER column definition","As a user, I should check the validation of INTEGER column definition",""
"passed","Thu Jun 23 06:49:03 GMT 2022","Thu Jun 23 06:50:17 GMT 2022","73475","","JIT-API-007c-GET-detail-API-Add-new-endpoint","","JIT-API-007c-GET-detail-API-Add-new-endpoint","[GET-detail-API] Create, update and delete new GET API endpoint","[GET-detail-API] Create, update and delete new GET API endpoint",""
"passed","Thu Jun 23 06:36:48 GMT 2022","Thu Jun 23 06:37:37 GMT 2022","48152","","JIT-Mobile-003-Screen-delete-screen","","JIT-Mobile-003-Screen-delete-screen","As a user, I can delete screen","As a user, I can delete screen",""
"broken","Thu Jun 23 07:06:30 GMT 2022","Thu Jun 23 07:07:59 GMT 2022","88468","","JIT-Module-007b-APPLE-LOGIN-databse-api","","JIT-Module-007b-APPLE-LOGIN-databse-api","[APPLE-LOGIN], I check auto-generate column and api","[APPLE-LOGIN], I check auto-generate column and api",""
"broken","Thu Jun 23 06:56:26 GMT 2022","Thu Jun 23 06:57:43 GMT 2022","77657","","JIT-Module-010a-LINE-LOGIN-default-edit","","JIT-Module-010a-LINE-LOGIN-default-edit","[LINE-LOGIN], I can add module Line Login and edit its infos","[LINE-LOGIN], I can add module Line Login and edit its infos",""
"passed","Thu Jun 23 06:28:06 GMT 2022","Thu Jun 23 06:29:29 GMT 2022","83289","","JIT-Dashboard-004d-CREATEOF-delete-table","","JIT-Dashboard-004d-CREATEOF-delete-table","[CREATE-OF] As a user, I should see the table is not displayed in dashboard list after removed","[CREATE-OF] As a user, I should see the table is not displayed in dashboard list after removed",""
"passed","Thu Jun 23 06:32:23 GMT 2022","Thu Jun 23 06:33:46 GMT 2022","82818","","JIT-Database-008-Check-validation-column-definition-type-DATE-TIME","","JIT-Database-008-Check-validation-column-definition-type-DATE-TIME","As a user, I should check the validation of DATETIME column definition","As a user, I should check the validation of DATETIME column definition",""
"passed","Thu Jun 23 06:44:44 GMT 2022","Thu Jun 23 06:45:58 GMT 2022","73902","","JIT-API-002c-GET-list","","JIT-API-002c-GET-list","As a user, I check column display when having relation for GET-list","As a user, I check column display when having relation for GET-list",""
"passed","Thu Jun 23 06:34:44 GMT 2022","Thu Jun 23 06:35:51 GMT 2022","66694","","JIT-Database-011e-COLUMN-ENUM-delete-all","","JIT-Database-011e-COLUMN-ENUM-delete-all","As a user, I should delete all items and check all items are not displayed","As a user, I should delete all items and check all items are not displayed",""
"passed","Thu Jun 23 06:31:17 GMT 2022","Thu Jun 23 06:32:04 GMT 2022","47188","","JIT-Database-001c-TABLE-duplicate","","JIT-Database-001c-TABLE-duplicate","As a user, I cannot create table with duplicate name","As a user, I cannot create table with duplicate name",""
"passed","Thu Jun 23 07:03:08 GMT 2022","Thu Jun 23 07:04:08 GMT 2022","60425","","JIT-API-007b-GET-list-API-Add-new-endpoint","","JIT-API-007b-GET-list-API-Add-new-endpoint","[GET-list-API] Create, update and delete new GET API endpoint","[GET-list-API] Create, update and delete new GET API endpoint",""
"passed","Thu Jun 23 06:48:06 GMT 2022","Thu Jun 23 06:49:24 GMT 2022","77141","","JIT-API-006c-DELETE-relation","","JIT-API-006c-DELETE-relation","As a user, I check column display when having relation for API DELETE","As a user, I check column display when having relation for API DELETE",""
"passed","Thu Jun 23 06:57:57 GMT 2022","Thu Jun 23 06:58:38 GMT 2022","41168","","JIT-Dashboard-004b-CREATEOF-new-column","","JIT-Dashboard-004b-CREATEOF-new-column","[CREATE-OF] As a user, I should add new column in dashboard params","[CREATE-OF] As a user, I should add new column in dashboard params",""
"passed","Thu Jun 23 06:40:15 GMT 2022","Thu Jun 23 06:42:32 GMT 2022","137268","","JIT-Module-005b-FORCE-MOBILE-UPDATE-api","","JIT-Module-005b-FORCE-MOBILE-UPDATE-api","[FORCE-MOBILE-UPDATE] - Check api","[FORCE-MOBILE-UPDATE] - Check api",""
"passed","Thu Jun 23 06:38:46 GMT 2022","Thu Jun 23 06:40:04 GMT 2022","78147","","JIT-Mobile-013-JITDEF-reflect-delete-screen-innavigation-tree","","JIT-Mobile-013-JITDEF-reflect-delete-screen-innavigation-tree","As a user, I should see screen will be removed in navigation tree after deleting screen","As a user, I should see screen will be removed in navigation tree after deleting screen",""
"passed","Thu Jun 23 07:01:47 GMT 2022","Thu Jun 23 07:03:04 GMT 2022","76284","","JIT-API-006a-DELETE-check-default","","JIT-API-006a-DELETE-check-default","As a user, I check default value in API DELETE","As a user, I check default value in API DELETE",""
"passed","Thu Jun 23 07:17:55 GMT 2022","Thu Jun 23 07:19:53 GMT 2022","118260","","JIT-Export-002-Scenario-ROR-withkey-1","","JIT-Export-002-Scenario-ROR-withkey-1","As a user, I check export the project type ROR with key successfully with scenario 1","As a user, I check export the project type ROR with key successfully with scenario 1",""
"passed","Thu Jun 23 06:35:10 GMT 2022","Thu Jun 23 06:36:34 GMT 2022","84676","","JIT-Database-012a-RELATION-basic","","JIT-Database-012a-RELATION-basic","[RELATION] check the basic relation","[RELATION] check the basic relation",""
"passed","Thu Jun 23 06:30:34 GMT 2022","Thu Jun 23 06:31:56 GMT 2022","82368","","JIT-Dashboard-006d-DELETEOF-delete-table","","JIT-Dashboard-006d-DELETEOF-delete-table","[DELETE-OF] As a user, I should see the table is not displayed in dashboard list after removed","[DELETE-OF] As a user, I should see the table is not displayed in dashboard list after removed",""
"passed","Thu Jun 23 07:16:32 GMT 2022","Thu Jun 23 07:17:16 GMT 2022","43920","","JIT-Export-009-Existing-Scenario-ROR-withkey-Jump-team","","JIT-Export-009-Existing-Scenario-ROR-withkey-Jump-team","[JUMP-TEAM] Existing project - With key","[JUMP-TEAM] Existing project - With key",""
"passed","Thu Jun 23 06:35:30 GMT 2022","Thu Jun 23 06:37:16 GMT 2022","105601","","JIT-Database-013-DEFECT-Check-default-value-when-changing-type","","JIT-Database-013-DEFECT-Check-default-value-when-changing-type","As a user, I should check the default value when changing the type","As a user, I should check the default value when changing the type",""
"passed","Thu Jun 23 06:32:42 GMT 2022","Thu Jun 23 06:33:49 GMT 2022","67047","","JIT-Database-010-Check-validation-column-definition-type-FILE","","JIT-Database-010-Check-validation-column-definition-type-FILE","As a user, I should check the validation of FILE column definition","As a user, I should check the validation of FILE column definition",""
"passed","Thu Jun 23 06:31:10 GMT 2022","Thu Jun 23 06:31:44 GMT 2022","33301","","JIT-Database-001b-TABLE-empty","","JIT-Database-001b-TABLE-empty","As a user, I cannot create table with empty name","As a user, I cannot create table with empty name",""
"passed","Thu Jun 23 06:47:38 GMT 2022","Thu Jun 23 06:48:52 GMT 2022","73528","","JIT-API-005c-PUT-relation","","JIT-API-005c-PUT-relation","As a user, I check column display when having relation for API PUT","As a user, I check column display when having relation for API PUT",""
"broken","Thu Jun 23 06:56:25 GMT 2022","Thu Jun 23 06:57:43 GMT 2022","77866","","JIT-Module-009a-GOOGLE-LOGIN-default-edit","","JIT-Module-009a-GOOGLE-LOGIN-default-edit","[GOOGLE-LOGIN], I can add module Google Login and edit its infos","[GOOGLE-LOGIN], I can add module Google Login and edit its infos",""
"passed","Thu Jun 23 06:46:10 GMT 2022","Thu Jun 23 06:47:29 GMT 2022","79053","","JIT-API-003c-POST-relation","","JIT-API-003c-POST-relation","As a user, I check column display when having relation for API POST","As a user, I check column display when having relation for API POST",""
"passed","Thu Jun 23 06:37:59 GMT 2022","Thu Jun 23 06:39:51 GMT 2022","112374","","JIT-Mobile-010-JITDEF14-rename-without-focusing","","JIT-Mobile-010-JITDEF14-rename-without-focusing","As a user, I could rename the screen/molecule without focusing","As a user, I could rename the screen/molecule without focusing",""
"passed","Thu Jun 23 06:28:22 GMT 2022","Thu Jun 23 06:29:24 GMT 2022","62165","","JIT-Dashboard-004e-CREATEOF-delete-column","","JIT-Dashboard-004e-CREATEOF-delete-column","[CREATE-OF] As a user, I should see the params will be removed when column is deleted","[CREATE-OF] As a user, I should see the params will be removed when column is deleted",""
"passed","Thu Jun 23 06:29:17 GMT 2022","Thu Jun 23 06:30:30 GMT 2022","73589","","JIT-Dashboard-005c-UPDATEOF-saving","","JIT-Dashboard-005c-UPDATEOF-saving","[UPDATE-OF] As a user, I should save the selected option when switching between tables","[UPDATE-OF] As a user, I should save the selected option when switching between tables",""
"passed","Thu Jun 23 06:34:07 GMT 2022","Thu Jun 23 06:35:20 GMT 2022","72627","","JIT-Database-011c-COLUMN-ENUM-delete-items","","JIT-Database-011c-COLUMN-ENUM-delete-items","As a user, I should delete 1 item and check not display in default dropdown","As a user, I should delete 1 item and check not display in default dropdown",""
"passed","Thu Jun 23 06:33:49 GMT 2022","Thu Jun 23 06:35:43 GMT 2022","113739","","JIT-Database-010-Check-validation-column-definition-type-FILE","","JIT-Database-010-Check-validation-column-definition-type-FILE","As a user, I should check the validation of FILE column definition for Format Area","As a user, I should check the validation of FILE column definition for Format Area",""
"passed","Thu Jun 23 07:15:43 GMT 2022","Thu Jun 23 07:16:29 GMT 2022","45809","","JIT-Export-006-Existing-Scenario-ROR-nokey","","JIT-Export-006-Existing-Scenario-ROR-nokey","[JUMP-TEAM] Existing project - No key","[JUMP-TEAM] Existing project - No key",""
"passed","Thu Jun 23 06:30:43 GMT 2022","Thu Jun 23 06:31:49 GMT 2022","65492","","JIT-Dashboard-006e-DELETEOF-delete-column","","JIT-Dashboard-006e-DELETEOF-delete-column","[DELETE-OF] As a user, I should see the params will be removed when column is deleted","[DELETE-OF] As a user, I should see the params will be removed when column is deleted",""
"passed","Thu Jun 23 06:25:54 GMT 2022","Thu Jun 23 06:27:26 GMT 2022","91605","","JIT-Dashboard-003b-DETAILOF-new-column","","JIT-Dashboard-003b-DETAILOF-new-column","[DEATIL-OF] As a user, I should add new column in dashboard params","[DEATIL-OF] As a user, I should add new column in dashboard params",""
"passed","Thu Jun 23 06:40:10 GMT 2022","Thu Jun 23 06:41:23 GMT 2022","72763","","JIT-Module-005a-FORCE-MOBILE-UPDATE-database","","JIT-Module-005a-FORCE-MOBILE-UPDATE-database","[FORCE-MOBILE-UPDATE] - Check adding and auto-table & columns","[FORCE-MOBILE-UPDATE] - Check adding and auto-table & columns",""
"passed","Thu Jun 23 06:39:48 GMT 2022","Thu Jun 23 06:41:31 GMT 2022","103257","","JIT-Module-002b-DEEPLINK-edit-infos","","JIT-Module-002b-DEEPLINK-edit-infos","As a user, I can update module Deeplink","As a user, I can update module Deeplink",""
"passed","Thu Jun 23 06:25:46 GMT 2022","Thu Jun 23 06:27:35 GMT 2022","109278","","JIT-Dashboard-003a-DETAILOF-default","","JIT-Dashboard-003a-DETAILOF-default","[DEATIL-OF] As a user, I should add default column in dashboard params","[DEATIL-OF] As a user, I should add default column in dashboard params",""
"passed","Thu Jun 23 06:32:30 GMT 2022","Thu Jun 23 06:33:47 GMT 2022","76336","","JIT-Database-009-Check-validation-column-definition-type-BOOLEAN","","JIT-Database-009-Check-validation-column-definition-type-BOOLEAN","As a user, I should check the validation of BOOLEAN column definition","As a user, I should check the validation of BOOLEAN column definition",""
"passed","Thu Jun 23 06:25:44 GMT 2022","Thu Jun 23 06:28:16 GMT 2022","152138","","JIT-Dashboard-001-Check-general-info","","JIT-Dashboard-001-Check-general-info","As a user, I check general info and update table name","As a user, I check general info and update table name",""
"passed","Thu Jun 23 06:44:43 GMT 2022","Thu Jun 23 06:46:18 GMT 2022","95256","","JIT-API-001-Check-general-info","","JIT-API-001-Check-general-info","As a user, I check general info","As a user, I check general info",""
"passed","Thu Jun 23 06:30:52 GMT 2022","Thu Jun 23 06:31:45 GMT 2022","52720","","JIT-Database-001a-TABLE-new","","JIT-Database-001a-TABLE-new","As a user, I can create new table","As a user, I can create new table",""
"passed","Thu Jun 23 06:39:44 GMT 2022","Thu Jun 23 06:40:47 GMT 2022","62209","","JIT-Module-002a-DEEPLINK-default","","JIT-Module-002a-DEEPLINK-default","As a user, I can add module Deeplink and remove it","As a user, I can add module Deeplink and remove it",""
"passed","Thu Jun 23 06:43:17 GMT 2022","Thu Jun 23 06:44:01 GMT 2022","43780","","JIT-Module-015b-SCOUT-edit-infos","","JIT-Module-015b-SCOUT-edit-infos","[SCOUT] As a user, I can update module Scout","[SCOUT] As a user, I can update module Scout",""
"passed","Thu Jun 23 06:34:25 GMT 2022","Thu Jun 23 06:35:31 GMT 2022","65805","","JIT-Database-011d-COLUMN-ENUM-delete-selected-items","","JIT-Database-011d-COLUMN-ENUM-delete-selected-items","As a user, I should delete 1 selected item and check is will be removed in default dropdown","As a user, I should delete 1 selected item and check is will be removed in default dropdown",""
"passed","Thu Jun 23 06:39:44 GMT 2022","Thu Jun 23 06:41:29 GMT 2022","104291","","JIT-Module-001b-CLOUDINARY-edit-infos","","JIT-Module-001b-CLOUDINARY-edit-infos","As a user, I can update module Cloudinary","As a user, I can update module Cloudinary",""
"passed","Thu Jun 23 06:40:00 GMT 2022","Thu Jun 23 06:41:27 GMT 2022","87283","","JIT-Module-003-JPBANK-default","","JIT-Module-003-JPBANK-default","[JPBANK] - Check adding and auto-generated API","[JPBANK] - Check adding and auto-generated API",""
"passed","Thu Jun 23 06:27:51 GMT 2022","Thu Jun 23 06:29:05 GMT 2022","74371","","JIT-Dashboard-003e-DETAILOF-delete-column","","JIT-Dashboard-003e-DETAILOF-delete-column","[DEATIL-OF] As a user, I should see the params will be removed when column is deleted","[DEATIL-OF] As a user, I should see the params will be removed when column is deleted",""
"passed","Thu Jun 23 06:50:59 GMT 2022","Thu Jun 23 06:53:23 GMT 2022","143306","","JIT-Module-004-EMAIL-LOGIN","","JIT-Module-004-EMAIL-LOGIN","[EMAIL-LOGIN] - Check adding and auto-generated API","[EMAIL-LOGIN] - Check adding and auto-generated API",""
"passed","Thu Jun 23 06:27:35 GMT 2022","Thu Jun 23 06:29:06 GMT 2022","91060","","JIT-Dashboard-003d-DETAILOF-delete-table","","JIT-Dashboard-003d-DETAILOF-delete-table","[DEATIL-OF] As a user, I should see the table is not displayed in dashboard list after removed","[DEATIL-OF] As a user, I should see the table is not displayed in dashboard list after removed",""
"broken","Thu Jun 23 06:57:55 GMT 2022","Thu Jun 23 06:59:07 GMT 2022","72230","","JIT-Module-011a-GUEST-LOGIN-default-edit","","JIT-Module-011a-GUEST-LOGIN-default-edit","[GUEST-LOGIN], I can add module Guest Login and edit its infos","[GUEST-LOGIN], I can add module Guest Login and edit its infos",""
"passed","Thu Jun 23 06:37:59 GMT 2022","Thu Jun 23 06:39:00 GMT 2022","61378","","JIT-Mobile-011-JITDEF50-disable-add-duplicate-screen-in-stack","","JIT-Mobile-011-JITDEF50-disable-add-duplicate-screen-in-stack","As a user, I could add duplicate screen in stack","As a user, I could add duplicate screen in stack",""
"passed","Thu Jun 23 07:14:44 GMT 2022","Thu Jun 23 07:15:11 GMT 2022","26864","","JIT-Export-006-Existing-Scenario-ROR-nokey","","JIT-Export-006-Existing-Scenario-ROR-nokey","As a user, I check export the existing project type ROR no key successfully","As a user, I check export the existing project type ROR no key successfully",""
"passed","Thu Jun 23 06:43:05 GMT 2022","Thu Jun 23 06:43:54 GMT 2022","48816","","JIT-Module-014b-BASIC-AUTH-edit-infos","","JIT-Module-014b-BASIC-AUTH-edit-infos","[BASIC-AUTH] As a user, I can update module Basic Authentication","[BASIC-AUTH] As a user, I can update module Basic Authentication",""
"passed","Thu Jun 23 07:19:07 GMT 2022","Thu Jun 23 07:21:15 GMT 2022","128183","","JIT-Export-004-Scenario_ROR_2","","JIT-Export-004-Scenario_ROR_2","As a user, I check export the project type ROR with key successfully with scenario 2","As a user, I check export the project type ROR with key successfully with scenario 2",""
"passed","Thu Jun 23 06:35:43 GMT 2022","Thu Jun 23 06:36:54 GMT 2022","71703","","JIT-Database-014-DEFECT-Check-duplicate-table-name","","JIT-Database-014-DEFECT-Check-duplicate-table-name","As a user, I cannot update to duplicate name","As a user, I cannot update to duplicate name",""
"passed","Thu Jun 23 07:04:12 GMT 2022","Thu Jun 23 07:05:07 GMT 2022","55243","","JIT-API-007d-POST-API-Add-new-endpoint","","JIT-API-007d-POST-API-Add-new-endpoint","[GET-POST] Create, update and delete new POST API endpoint","[GET-POST] Create, update and delete new POST API endpoint",""
"passed","Thu Jun 23 06:34:04 GMT 2022","Thu Jun 23 06:35:10 GMT 2022","66358","","JIT-Database-011b-COLUMN-ENUM-add-items","","JIT-Database-011b-COLUMN-ENUM-add-items","As a user, I should add new item and select in default dropdown","As a user, I should add new item and select in default dropdown",""
"passed","Thu Jun 23 06:46:24 GMT 2022","Thu Jun 23 06:47:58 GMT 2022","93380","","JIT-API-004a-GET-detail-check-default","","JIT-API-004a-GET-detail-check-default","As a user, I check default value in API GET-detail","As a user, I check default value in API GET-detail",""
