"Status","Start Time","Stop Time","Duration in ms","Parent Suite","Suite","Sub Suite","Test Class","Test Method","Name","Description"
"passed","Tue Nov 22 18:51:06 GMT 2022","Tue Nov 22 18:51:42 GMT 2022","35425","","JIT-API-007a-GROUP-API-CRUD","","JIT-API-007a-GROUP-API-CRUD","[GROUP-API] Create, update and delete group API","[GROUP-API] Create, update and delete group API",""
"passed","Tue Nov 22 18:45:16 GMT 2022","Tue Nov 22 18:49:03 GMT 2022","227530","","JIT-Web-002d-MOLECULE-Duplicate","","JIT-Web-002d-MOLECULE-Duplicate","[WEB-MOLECULE] As a user, I can duplicate molecule with positive and negative cases","[WEB-MOLECULE] As a user, I can duplicate molecule with positive and negative cases",""
"passed","Tue Nov 22 18:19:15 GMT 2022","Tue Nov 22 18:20:20 GMT 2022","65244","","JIT-Database-010a-COLUMN-FILE-validation","","JIT-Database-010a-COLUMN-FILE-validation","[COLUMN] As a user, I should check the validation of FILE column definition","[COLUMN] As a user, I should check the validation of FILE column definition",""
"passed","Tue Nov 22 18:37:31 GMT 2022","Tue Nov 22 18:39:20 GMT 2022","109097","","JIT-Module-007a-APPLE-LOGIN-default-edit","","JIT-Module-007a-APPLE-LOGIN-default-edit","[APPLE-LOGIN], I can add module Apple Login and edit its infos","[APPLE-LOGIN], I can add module Apple Login and edit its infos",""
"passed","Tue Nov 22 18:23:26 GMT 2022","Tue Nov 22 18:24:54 GMT 2022","88209","","JIT-Database-016b-COUNTER-CACHE-Create-by-adding-column","","JIT-Database-016b-COUNTER-CACHE-Create-by-adding-column","[COUNTER-CACHE] create new counter cache column by adding column","[COUNTER-CACHE] create new counter cache column by adding column",""
"passed","Tue Nov 22 18:41:02 GMT 2022","Tue Nov 22 18:41:50 GMT 2022","48673","","JIT-Module-016b-SENDGRID-edit-infos","","JIT-Module-016b-SENDGRID-edit-infos","[SENDGRID] As a user, I can update module SendGrid","[SENDGRID] As a user, I can update module SendGrid",""
"passed","Tue Nov 22 18:16:24 GMT 2022","Tue Nov 22 18:17:27 GMT 2022","62262","","JIT-Dashboard-006e-DELETEOF-delete-column","","JIT-Dashboard-006e-DELETEOF-delete-column","[DELETE-OF] As a user, I should see the params will be removed when column is deleted","[DELETE-OF] As a user, I should see the params will be removed when column is deleted",""
"passed","Tue Nov 22 18:11:55 GMT 2022","Tue Nov 22 18:12:56 GMT 2022","61011","","JIT-Dashboard-003b-DETAILOF-new-column","","JIT-Dashboard-003b-DETAILOF-new-column","[DEATIL-OF] As a user, I should add new column in dashboard params","[DEATIL-OF] As a user, I should add new column in dashboard params",""
"passed","Tue Nov 22 18:26:36 GMT 2022","Tue Nov 22 18:28:02 GMT 2022","85977","","JIT-Mobile-013-JITDEF-reflect-delete-screen-innavigation-tree","","JIT-Mobile-013-JITDEF-reflect-delete-screen-innavigation-tree","[DEFECT] As a user, I should see screen will be removed in navigation tree after deleting screen","[DEFECT] As a user, I should see screen will be removed in navigation tree after deleting screen",""
"passed","Tue Nov 22 18:38:25 GMT 2022","Tue Nov 22 18:40:17 GMT 2022","112044","","JIT-Module-009a-GOOGLE-LOGIN-default-edit","","JIT-Module-009a-GOOGLE-LOGIN-default-edit","[GOOGLE-LOGIN], I can add module Google Login and edit its infos","[GOOGLE-LOGIN], I can add module Google Login and edit its infos",""
"passed","Tue Nov 22 18:20:05 GMT 2022","Tue Nov 22 18:21:09 GMT 2022","64417","","JIT-Database-011b-COLUMN-ENUM-add-items","","JIT-Database-011b-COLUMN-ENUM-add-items","[COLUMN] As a user, I should add new item and select in default dropdown","[COLUMN] As a user, I should add new item and select in default dropdown",""
"passed","Tue Nov 22 18:24:43 GMT 2022","Tue Nov 22 18:25:38 GMT 2022","55041","","JIT-Mobile-003-SCREEN-Delete","","JIT-Mobile-003-SCREEN-Delete","[MOBILE-SCREEN] As a user, I can delete screen","[MOBILE-SCREEN] As a user, I can delete screen",""
"passed","Tue Nov 22 18:27:58 GMT 2022","Tue Nov 22 18:29:04 GMT 2022","66569","","JIT-Mobile-021-DEFECT.Params.keep-params-after-refresh-page","","JIT-Mobile-021-DEFECT.Params.keep-params-after-refresh-page","[DEFECT] As a user, I should check the params will be kept after refresh page","[DEFECT] As a user, I should check the params will be kept after refresh page",""
"passed","Tue Nov 22 18:53:25 GMT 2022","Tue Nov 22 18:55:52 GMT 2022","147131","","JIT-Database-015b-INDEX-CRUD-single","","JIT-Database-015b-INDEX-CRUD-single","[INDEX] As a user, I check add and update multiple index","[INDEX] As a user, I check add and update multiple index",""
"passed","Tue Nov 22 18:54:12 GMT 2022","Tue Nov 22 18:55:29 GMT 2022","76889","","JIT-Database-015d-INDEX-STRING-column-config","","JIT-Database-015d-INDEX-STRING-column-config","[INDEX-STRING] As a user, I config index from column setting && check on index popup","[INDEX-STRING] As a user, I config index from column setting && check on index popup",""
"passed","Tue Nov 22 19:30:13 GMT 2022","Tue Nov 22 19:33:53 GMT 2022","220265","","JIT-Export-010b-Export-RN-TODO","","JIT-Export-010b-Export-RN-TODO","[SMOKE] As a user, I check exprting project TODO with React Native","[SMOKE] As a user, I check exprting project TODO with React Native",""
"passed","Tue Nov 22 18:38:39 GMT 2022","Tue Nov 22 18:40:27 GMT 2022","108838","","JIT-Module-010a-LINE-LOGIN-default-edit","","JIT-Module-010a-LINE-LOGIN-default-edit","[LINE-LOGIN], I can add module Line Login and edit its infos","[LINE-LOGIN], I can add module Line Login and edit its infos",""
"passed","Tue Nov 22 18:15:32 GMT 2022","Tue Nov 22 18:16:35 GMT 2022","63796","","JIT-Dashboard-006c-DELETEOF-saving","","JIT-Dashboard-006c-DELETEOF-saving","[DELETE-OF] As a user, I should save the selected option when switching between tables","[DELETE-OF] As a user, I should save the selected option when switching between tables",""
"passed","Tue Nov 22 18:42:06 GMT 2022","Tue Nov 22 18:42:53 GMT 2022","46825","","JIT-Module-019a-GOOGLE-ANALYTICS-default","","JIT-Module-019a-GOOGLE-ANALYTICS-default","[GOOGLE-ANALYTICS] As a user, I can add module Google Analytics and remove it","[GOOGLE-ANALYTICS] As a user, I can add module Google Analytics and remove it",""
"passed","Tue Nov 22 18:13:03 GMT 2022","Tue Nov 22 18:14:17 GMT 2022","73471","","JIT-Dashboard-003d-DETAILOF-delete-table","","JIT-Dashboard-003d-DETAILOF-delete-table","[DEATIL-OF] As a user, I should see the table is not displayed in dashboard list after removed","[DEATIL-OF] As a user, I should see the table is not displayed in dashboard list after removed",""
"passed","Tue Nov 22 19:25:21 GMT 2022","Tue Nov 22 19:26:49 GMT 2022","88186","","JIT-Export-005b-Scenario-RN-all-default-component","","JIT-Export-005b-Scenario-RN-all-default-component","[RN-Default] As a user, I check export the project type React Native with all default component","[RN-Default] As a user, I check export the project type React Native with all default component",""
"passed","Tue Nov 22 18:18:27 GMT 2022","Tue Nov 22 18:19:39 GMT 2022","71743","","JIT-Database-009-COLUMN-type-BOOLEAN","","JIT-Database-009-COLUMN-type-BOOLEAN","[COLUMN] As a user, I should check the validation of BOOLEAN column definition","[COLUMN] As a user, I should check the validation of BOOLEAN column definition",""
"passed","Tue Nov 22 18:11:47 GMT 2022","Tue Nov 22 18:12:55 GMT 2022","68283","","JIT-Dashboard-003a-DETAILOF-default","","JIT-Dashboard-003a-DETAILOF-default","[DEATIL-OF] As a user, I should add default column in dashboard params","[DEATIL-OF] As a user, I should add default column in dashboard params",""
"passed","Tue Nov 22 18:16:47 GMT 2022","Tue Nov 22 18:17:42 GMT 2022","55647","","JIT-Database-001a-TABLE-new","","JIT-Database-001a-TABLE-new","[TABLE] As a user, I can create new table","[TABLE] As a user, I can create new table",""
"passed","Tue Nov 22 19:27:43 GMT 2022","Tue Nov 22 19:28:24 GMT 2022","41206","","JIT-Export-007-Existing-Scenario-ROR-withkey","","JIT-Export-007-Existing-Scenario-ROR-withkey","As a user, I check export the existing project type ROR with key successfully","As a user, I check export the existing project type ROR with key successfully",""
"passed","Tue Nov 22 18:44:50 GMT 2022","Tue Nov 22 18:46:21 GMT 2022","90907","","JIT-Web-002c-MOLECULE-Delete","","JIT-Web-002c-MOLECULE-Delete","[WEB-MOLECULE] As a user, I can delete molecule","[WEB-MOLECULE] As a user, I can delete molecule",""
"passed","Tue Nov 22 18:14:56 GMT 2022","Tue Nov 22 18:16:05 GMT 2022","69794","","JIT-Dashboard-005c-UPDATEOF-saving","","JIT-Dashboard-005c-UPDATEOF-saving","[UPDATE-OF] As a user, I should save the selected option when switching between tables","[UPDATE-OF] As a user, I should save the selected option when switching between tables",""
"passed","Tue Nov 22 18:37:14 GMT 2022","Tue Nov 22 18:39:08 GMT 2022","114252","","JIT-Module-005b-FORCE-MOBILE-UPDATE-api","","JIT-Module-005b-FORCE-MOBILE-UPDATE-api","[FORCE-MOBILE-UPDATE] - Check api","[FORCE-MOBILE-UPDATE] - Check api",""
"passed","Tue Nov 22 18:18:24 GMT 2022","Tue Nov 22 18:21:04 GMT 2022","159557","","JIT-Database-007-COLUMN-type-TEXT","","JIT-Database-007-COLUMN-type-TEXT","[COLUMN] As a user, I should check the validation of TEXT column definition","[COLUMN] As a user, I should check the validation of TEXT column definition",""
"broken","Tue Nov 22 19:23:57 GMT 2022","Tue Nov 22 19:40:45 GMT 2022","1007923","","JIT-Export-003-Scenario_ROR_2","","JIT-Export-003-Scenario_ROR_2","As a user, I check export the project type ROR no key successfully with scenario 2","As a user, I check export the project type ROR no key successfully with scenario 2",""
"passed","Tue Nov 22 18:49:40 GMT 2022","Tue Nov 22 18:50:30 GMT 2022","49969","","JIT-API-001-Check-general-info","","JIT-API-001-Check-general-info","As a user, I check general info","As a user, I check general info",""
"passed","Tue Nov 22 18:25:49 GMT 2022","Tue Nov 22 18:36:50 GMT 2022","661474","","JIT-Mobile-009-SEARCH-Components","","JIT-Mobile-009-SEARCH-Components","[MOBILE-SEARCH] As a user, I search component and drag them to preview screen","[MOBILE-SEARCH] As a user, I search component and drag them to preview screen",""
"passed","Tue Nov 22 18:41:44 GMT 2022","Tue Nov 22 18:43:40 GMT 2022","115845","","JIT-Module-018c-ADMIN-DASHBOARD-USER-column-infos","","JIT-Module-018c-ADMIN-DASHBOARD-USER-column-infos","[ADMIN-DASHBOARD-USER], I check the column infos from Admin Dashboard User","[ADMIN-DASHBOARD-USER], I check the column infos from Admin Dashboard User",""
"passed","Tue Nov 22 18:28:55 GMT 2022","Tue Nov 22 18:30:13 GMT 2022","78296","","JIT-Mobile-026b-BUTTON-General-info","","JIT-Mobile-026b-BUTTON-General-info","[MOBILE-BUTTON] As a user, I should check the general infomation of Button is correct: Name, Key, unique key, delete component","[MOBILE-BUTTON] As a user, I should check the general infomation of Button is correct: Name, Key, unique key, delete component",""
"passed","Tue Nov 22 18:38:55 GMT 2022","Tue Nov 22 18:40:21 GMT 2022","86613","","JIT-Module-011a-GUEST-LOGIN-default-edit","","JIT-Module-011a-GUEST-LOGIN-default-edit","[GUEST-LOGIN], I can add module Guest Login and edit its infos","[GUEST-LOGIN], I can add module Guest Login and edit its infos",""
"passed","Tue Nov 22 18:37:30 GMT 2022","Tue Nov 22 18:39:04 GMT 2022","93793","","JIT-Module-006a-SMS-default","","JIT-Module-006a-SMS-default","[SMS], I can add module SMS login with Twilio and remove it","[SMS], I can add module SMS login with Twilio and remove it",""
"passed","Tue Nov 22 18:19:29 GMT 2022","Tue Nov 22 18:21:32 GMT 2022","122819","","JIT-Database-010b-COLUMN-FILE-format-file","","JIT-Database-010b-COLUMN-FILE-format-file","[COLUMN] As a user, I should check the validation of FILE column definition for Format Area","[COLUMN] As a user, I should check the validation of FILE column definition for Format Area",""
"passed","Tue Nov 22 18:14:41 GMT 2022","Tue Nov 22 18:15:52 GMT 2022","70790","","JIT-Dashboard-005a-UPDATEOF-default","","JIT-Dashboard-005a-UPDATEOF-default","[UPDATE-OF] As a user, I should add default column in dashboard params","[UPDATE-OF] As a user, I should add default column in dashboard params",""
"passed","Tue Nov 22 18:18:12 GMT 2022","Tue Nov 22 18:20:06 GMT 2022","114098","","JIT-Database-005-COLUMN-type-FLOAT","","JIT-Database-005-COLUMN-type-FLOAT","[COLUMN] As a user, I should check the validation of FLOAT column definition","[COLUMN] As a user, I should check the validation of FLOAT column definition",""
"passed","Tue Nov 22 18:23:15 GMT 2022","Tue Nov 22 18:24:45 GMT 2022","90439","","JIT-Database-016a-COUNTER-CACHE-Create-by-relation","","JIT-Database-016a-COUNTER-CACHE-Create-by-relation","[COUNTER-CACHE] create new counter cache column by selecting in relation popup","[COUNTER-CACHE] create new counter cache column by selecting in relation popup",""
"passed","Tue Nov 22 18:21:38 GMT 2022","Tue Nov 22 18:22:47 GMT 2022","69688","","JIT-Database-012a-RELATION-basic","","JIT-Database-012a-RELATION-basic","[RELATION] check the basic relation","[RELATION] check the basic relation",""
"passed","Tue Nov 22 18:35:08 GMT 2022","Tue Nov 22 18:35:55 GMT 2022","47924","","JIT-Module-001a-CLOUDINARY-default","","JIT-Module-001a-CLOUDINARY-default","As a user, I can add module Cloudinary and remove it","As a user, I can add module Cloudinary and remove it",""
"passed","Tue Nov 22 18:38:12 GMT 2022","Tue Nov 22 18:40:05 GMT 2022","113343","","JIT-Module-008a-FB-LOGIN-default-edit","","JIT-Module-008a-FB-LOGIN-default-edit","[FACEBOOK-LOGIN], I can add module Facebook Login and edit its infos","[FACEBOOK-LOGIN], I can add module Facebook Login and edit its infos",""
"passed","Tue Nov 22 18:40:54 GMT 2022","Tue Nov 22 18:41:37 GMT 2022","43669","","JIT-Module-015b-SCOUT-edit-infos","","JIT-Module-015b-SCOUT-edit-infos","[SCOUT] As a user, I can update module Scout","[SCOUT] As a user, I can update module Scout",""
"passed","Tue Nov 22 18:49:40 GMT 2022","Tue Nov 22 18:50:48 GMT 2022","68292","","JIT-API-002c-GET-list","","JIT-API-002c-GET-list","As a user, I check column display when having relation for GET-list","As a user, I check column display when having relation for GET-list",""
"passed","Tue Nov 22 18:43:43 GMT 2022","Tue Nov 22 18:46:22 GMT 2022","159564","","JIT-Web-001e-PAGE-Search","","JIT-Web-001e-PAGE-Search","[WEB-PAGE] As a user, I can search correct screen with keyword","[WEB-PAGE] As a user, I can search correct screen with keyword",""
"passed","Tue Nov 22 18:12:48 GMT 2022","Tue Nov 22 18:13:51 GMT 2022","63051","","JIT-Dashboard-003c-DETAILOF-saving","","JIT-Dashboard-003c-DETAILOF-saving","[DEATIL-OF] As a user, I should save the selected option when switching between tables","[DEATIL-OF] As a user, I should save the selected option when switching between tables",""
"passed","Tue Nov 22 18:41:31 GMT 2022","Tue Nov 22 18:42:08 GMT 2022","37430","","JIT-Module-017b-GOOGLE-ANAL-edit-infos","","JIT-Module-017b-GOOGLE-ANAL-edit-infos","[GOOGLE-ANAL] As a user, I can update module Google Analytics","[GOOGLE-ANAL] As a user, I can update module Google Analytics",""
"passed","Tue Nov 22 18:11:37 GMT 2022","Tue Nov 22 18:12:53 GMT 2022","76322","","JIT-Dashboard-002d-LISTOF-delete-table","","JIT-Dashboard-002d-LISTOF-delete-table","[LIST-OF] As a user, I should see the table is not displayed in dashboard list after removed","[LIST-OF] As a user, I should see the table is not displayed in dashboard list after removed",""
"passed","Tue Nov 22 18:37:11 GMT 2022","Tue Nov 22 18:38:14 GMT 2022","62456","","JIT-Module-005a-FORCE-MOBILE-UPDATE-database","","JIT-Module-005a-FORCE-MOBILE-UPDATE-database","[FORCE-MOBILE-UPDATE] - Check adding and auto-table & columns","[FORCE-MOBILE-UPDATE] - Check adding and auto-table & columns",""
"passed","Tue Nov 22 18:15:31 GMT 2022","Tue Nov 22 18:16:30 GMT 2022","59484","","JIT-Dashboard-006b-DELETEOF-new-column","","JIT-Dashboard-006b-DELETEOF-new-column","[DELETE-OF] As a user, I should add new column in dashboard params","[DELETE-OF] As a user, I should add new column in dashboard params",""
"passed","Tue Nov 22 18:31:42 GMT 2022","Tue Nov 22 18:32:57 GMT 2022","75163","","JIT-Mobile-032b-CAROUSEL-General-info","","JIT-Mobile-032b-CAROUSEL-General-info","[MOBILE-CAROUSEL] As a user, I should check the general infomation of Carousel is correct: Name, Key, unique key, delete component","[MOBILE-CAROUSEL] As a user, I should check the general infomation of Carousel is correct: Name, Key, unique key, delete component",""
"passed","Tue Nov 22 18:26:49 GMT 2022","Tue Nov 22 18:28:26 GMT 2022","97554","","JIT-Mobile-014-JITDEF-status-bar","","JIT-Mobile-014-JITDEF-status-bar","[DEFECT] As a user, I should see screen will be removed in navigation tree after deleting screen","[DEFECT] As a user, I should see screen will be removed in navigation tree after deleting screen",""
"passed","Tue Nov 22 18:32:32 GMT 2022","Tue Nov 22 18:33:42 GMT 2022","70912","","JIT-Mobile-035b-FLATLIST-General-info","","JIT-Mobile-035b-FLATLIST-General-info","[MOBILE-FLATLIST] As a user, I should check the general infomation of FlatList is correct: Name, Key, unique key, delete component","[MOBILE-FLATLIST] As a user, I should check the general infomation of FlatList is correct: Name, Key, unique key, delete component",""
"passed","Tue Nov 22 18:26:15 GMT 2022","Tue Nov 22 18:27:15 GMT 2022","60247","","JIT-Mobile-011-JITDEF50-disable-add-duplicate-screen-in-stack","","JIT-Mobile-011-JITDEF50-disable-add-duplicate-screen-in-stack","[DEFECT] As a user, I could add duplicate screen in stack","[DEFECT] As a user, I could add duplicate screen in stack",""
"passed","Tue Nov 22 18:16:20 GMT 2022","Tue Nov 22 18:17:37 GMT 2022","77183","","JIT-Dashboard-006d-DELETEOF-delete-table","","JIT-Dashboard-006d-DELETEOF-delete-table","[DELETE-OF] As a user, I should see the table is not displayed in dashboard list after removed","[DELETE-OF] As a user, I should see the table is not displayed in dashboard list after removed",""
"passed","Tue Nov 22 18:20:41 GMT 2022","Tue Nov 22 18:21:48 GMT 2022","66537","","JIT-Database-011c-COLUMN-ENUM-delete-items","","JIT-Database-011c-COLUMN-ENUM-delete-items","[COLUMN] As a user, I should delete 1 item and check not display in default dropdown","[COLUMN] As a user, I should delete 1 item and check not display in default dropdown",""
"passed","Tue Nov 22 18:37:30 GMT 2022","Tue Nov 22 18:38:58 GMT 2022","87242","","JIT-Module-006b-SMS-edit-infos","","JIT-Module-006b-SMS-edit-infos","[SMS], I can add module SMS login with Twilio and edit its infos","[SMS], I can add module SMS login with Twilio and edit its infos",""
"passed","Tue Nov 22 19:16:21 GMT 2022","Tue Nov 22 19:17:55 GMT 2022","94378","","JIT-Dashboard-002e-LISTOF-delete-column","","JIT-Dashboard-002e-LISTOF-delete-column","As a user, I should see the params will be removed when column is deleted","As a user, I should see the params will be removed when column is deleted",""
"passed","Tue Nov 22 18:18:26 GMT 2022","Tue Nov 22 18:19:31 GMT 2022","64894","","JIT-Database-008-COLUMN-type-DATE-TIME","","JIT-Database-008-COLUMN-type-DATE-TIME","[COLUMN] As a user, I should check the validation of DATETIME column definition","[COLUMN] As a user, I should check the validation of DATETIME column definition",""
"passed","Tue Nov 22 18:16:52 GMT 2022","Tue Nov 22 18:17:29 GMT 2022","36778","","JIT-Database-001b-TABLE-empty","","JIT-Database-001b-TABLE-empty","[TABLE] As a user, I cannot create table with empty name","[TABLE] As a user, I cannot create table with empty name",""
"passed","Tue Nov 22 18:49:40 GMT 2022","Tue Nov 22 18:51:24 GMT 2022","104928","","JIT-API-002b-GET-list-update-info","","JIT-API-002b-GET-list-update-info","As a user, I update info for GET-list","As a user, I update info for GET-list",""
"passed","Tue Nov 22 18:57:02 GMT 2022","Tue Nov 22 18:58:20 GMT 2022","78288","","JIT-Database-015i-INDEX-DATETIME-column-config","","JIT-Database-015i-INDEX-DATETIME-column-config","[INDEX-DATETIME] As a user, I config index from column setting && check on index popup","[INDEX-DATETIME] As a user, I config index from column setting && check on index popup",""
"passed","Tue Nov 22 19:23:52 GMT 2022","Tue Nov 22 19:26:18 GMT 2022","145752","","JIT-Export-001-Scenario_ROR_1","","JIT-Export-001-Scenario_ROR_1","As a user, I check export the project type ROR no key successfully with scenario 1","As a user, I check export the project type ROR no key successfully with scenario 1",""
"passed","Tue Nov 22 18:14:47 GMT 2022","Tue Nov 22 18:15:48 GMT 2022","61159","","JIT-Dashboard-005b-UPDATEOF-new-column","","JIT-Dashboard-005b-UPDATEOF-new-column","[UPDATE-OF] As a user, I should add new column in dashboard params","[UPDATE-OF] As a user, I should add new column in dashboard params",""
"passed","Tue Nov 22 18:36:12 GMT 2022","Tue Nov 22 18:37:32 GMT 2022","80360","","JIT-Module-002b-DEEPLINK-edit-infos","","JIT-Module-002b-DEEPLINK-edit-infos","As a user, I can update module Deeplink","As a user, I can update module Deeplink",""
"passed","Tue Nov 22 18:51:07 GMT 2022","Tue Nov 22 18:52:43 GMT 2022","96287","","JIT-API-007ba-GET-list-API-Add-new-endpoint","","JIT-API-007ba-GET-list-API-Add-new-endpoint","[GET-list-API] Create, update and delete new GET API endpoint","[GET-list-API] Create, update and delete new GET API endpoint",""
"passed","Tue Nov 22 18:31:19 GMT 2022","Tue Nov 22 18:32:32 GMT 2022","73147","","JIT-Mobile-031b-DIVIDER-General-info","","JIT-Mobile-031b-DIVIDER-General-info","[MOBILE-DIVIDER] As a user, I should check the general infomation of Divider is correct: Name, Key, unique key, delete component","[MOBILE-DIVIDER] As a user, I should check the general infomation of Divider is correct: Name, Key, unique key, delete component",""
"passed","Tue Nov 22 18:34:08 GMT 2022","Tue Nov 22 18:37:57 GMT 2022","228558","","JIT-Mobile-043a-ACTION-AUTHENTICATION-PHONE-no-param","","JIT-Mobile-043a-ACTION-AUTHENTICATION-PHONE-no-param","[MOBILE-ACTION-AUTHENTICATION-PHONE] As a user, I could add action type authentication without params and check preview code","[MOBILE-ACTION-AUTHENTICATION-PHONE] As a user, I could add action type authentication without params and check preview code",""
"passed","Tue Nov 22 18:24:54 GMT 2022","Tue Nov 22 18:26:10 GMT 2022","76229","","JIT-Mobile-005-MOLECULE-Create-new","","JIT-Mobile-005-MOLECULE-Create-new","[MOBILE-MOLECULE] As a user, I can create new molecule with positive and negative cases","[MOBILE-MOLECULE] As a user, I can create new molecule with positive and negative cases",""
"passed","Tue Nov 22 18:28:24 GMT 2022","Tue Nov 22 18:30:42 GMT 2022","137716","","JIT-Mobile-022d-TEXT-Check-PADDING-MARGIN","","JIT-Mobile-022d-TEXT-Check-PADDING-MARGIN","[MOBILE-TEXT] As a user, I should check the PADDING & MARGIN infomation of Text is correct: Top, Bottom, Right, Left.","[MOBILE-TEXT] As a user, I should check the PADDING & MARGIN infomation of Text is correct: Top, Bottom, Right, Left.",""
"passed","Tue Nov 22 18:39:57 GMT 2022","Tue Nov 22 18:40:43 GMT 2022","45595","","JIT-Module-013a-AWS-default","","JIT-Module-013a-AWS-default","[AWS] As a user, I can add module AWS SES Integration and remove it","[AWS] As a user, I can add module AWS SES Integration and remove it",""
"passed","Tue Nov 22 18:23:59 GMT 2022","Tue Nov 22 18:25:07 GMT 2022","67968","","JIT-Mobile-001-SCREEN-Create-new","","JIT-Mobile-001-SCREEN-Create-new","[MOBILE-SCREEN] As a user, I can create new screen with positive and negative cases","[MOBILE-SCREEN] As a user, I can create new screen with positive and negative cases",""
"passed","Tue Nov 22 18:23:04 GMT 2022","Tue Nov 22 18:24:05 GMT 2022","61497","","JIT-Database-015a-INDEX-Check-duplicate-empty","","JIT-Database-015a-INDEX-Check-duplicate-empty","[INDEX] As a user, I check empty and duplicate index","[INDEX] As a user, I check empty and duplicate index",""
"passed","Tue Nov 22 18:30:13 GMT 2022","Tue Nov 22 18:31:25 GMT 2022","71174","","JIT-Mobile-029b-TOUCHABLE-General-info","","JIT-Mobile-029b-TOUCHABLE-General-info","[MOBILE-TOUCHABLE] As a user, I should check the general infomation of Touchable is correct: Name, Key, unique key, delete component","[MOBILE-TOUCHABLE] As a user, I should check the general infomation of Touchable is correct: Name, Key, unique key, delete component",""
"passed","Tue Nov 22 18:32:48 GMT 2022","Tue Nov 22 18:34:12 GMT 2022","84408","","JIT-Mobile-036a-DATETIMEPICKER-Check-PreviewCode","","JIT-Mobile-036a-DATETIMEPICKER-Check-PreviewCode","[MOBILE-DATETIMEPICKER] As a user, I should check the Preview code of DatetimePicker component","[MOBILE-DATETIMEPICKER] As a user, I should check the Preview code of DatetimePicker component",""
"passed","Tue Nov 22 18:31:59 GMT 2022","Tue Nov 22 18:33:09 GMT 2022","70320","","JIT-Mobile-033b-HEADER-General-info","","JIT-Mobile-033b-HEADER-General-info","[MOBILE-HEADER] As a user, I should check the general infomation of Header is correct: Name, Key, unique key, delete component","[MOBILE-HEADER] As a user, I should check the general infomation of Header is correct: Name, Key, unique key, delete component",""
"passed","Tue Nov 22 18:56:13 GMT 2022","Tue Nov 22 18:57:33 GMT 2022","79694","","JIT-Database-015h-INDEX-DATE-column-config","","JIT-Database-015h-INDEX-DATE-column-config","[INDEX-DATE] As a user, I config index from column setting && check on index popup","[INDEX-DATE] As a user, I config index from column setting && check on index popup",""
"passed","Tue Nov 22 18:43:02 GMT 2022","Tue Nov 22 18:45:33 GMT 2022","151748","","JIT-Web-001b-PAGE-Update","","JIT-Web-001b-PAGE-Update","[PAGE] As a user, I can update page with positive and negative cases","[PAGE] As a user, I can update page with positive and negative cases",""
