"Status","Start Time","Stop Time","Duration in ms","Parent Suite","Suite","Sub Suite","Test Class","Test Method","Name","Description"
"passed","Tue Nov 22 19:46:57 GMT 2022","Tue Nov 22 19:55:30 GMT 2022","513288","","JIT-Preview-001-Preview-[NEW]-NextJS-TODO","","JIT-Preview-001-Preview-[NEW]-NextJS-TODO","[PREVIEW-NEW] As a user, I check preview function for project TODO with NextJS","[PREVIEW-NEW] As a user, I check preview function for project TODO with NextJS",""
"passed","Tue Nov 22 18:40:43 GMT 2022","Tue Nov 22 18:41:33 GMT 2022","49473","","JIT-Module-015a-SCOUT-default","","JIT-Module-015a-SCOUT-default","[SCOUT] As a user, I can add module Scout and remove it","[SCOUT] As a user, I can add module Scout and remove it",""
"passed","Tue Nov 22 18:51:52 GMT 2022","Tue Nov 22 18:53:13 GMT 2022","81113","","JIT-API-007d-POST-API-Add-new-endpoint","","JIT-API-007d-POST-API-Add-new-endpoint","[GET-POST] Create, update and delete new POST API endpoint","[GET-POST] Create, update and delete new POST API endpoint",""
"passed","Tue Nov 22 18:46:52 GMT 2022","Tue Nov 22 18:48:42 GMT 2022","110068","","JIT-Web-003a-PREVIEW-NAVIGATION-no-navigation-setup","","JIT-Web-003a-PREVIEW-NAVIGATION-no-navigation-setup","[WEB-PREVIEW-NAVIGATION] As a user, I could open preview screen with default page","[WEB-PREVIEW-NAVIGATION] As a user, I could open preview screen with default page",""
"passed","Tue Nov 22 19:19:29 GMT 2022","Tue Nov 22 19:21:53 GMT 2022","144487","","JIT-Database-015c-INDEX-CRUD-multiple","","JIT-Database-015c-INDEX-CRUD-multiple","[INDEX] As a user, I check add and update single index","[INDEX] As a user, I check add and update single index",""
"passed","Tue Nov 22 18:11:37 GMT 2022","Tue Nov 22 18:12:46 GMT 2022","68852","","JIT-Dashboard-002b-LISTOF-new-column","","JIT-Dashboard-002b-LISTOF-new-column","[LIST-OF] As a user, I should add new column in dashboard params","[LIST-OF] As a user, I should add new column in dashboard params",""
"passed","Tue Nov 22 18:40:57 GMT 2022","Tue Nov 22 18:41:44 GMT 2022","46940","","JIT-Module-016a-SENDGRID-default","","JIT-Module-016a-SENDGRID-default","[SENDGRID] As a user, I can add module SendGrid and remove it","[SENDGRID] As a user, I can add module SendGrid and remove it",""
"passed","Tue Nov 22 18:33:50 GMT 2022","Tue Nov 22 18:36:54 GMT 2022","183865","","JIT-Mobile-041b-PREVIEW-NAVIGATION-with-navigation-setup","","JIT-Mobile-041b-PREVIEW-NAVIGATION-with-navigation-setup","[MOBILE-PREVIEW-NAVIGATION] As a user, I could open preview screen with setting the screen navigation","[MOBILE-PREVIEW-NAVIGATION] As a user, I could open preview screen with setting the screen navigation",""
"passed","Tue Nov 22 18:17:04 GMT 2022","Tue Nov 22 18:17:49 GMT 2022","44717","","JIT-Database-001d-TABLE-update","","JIT-Database-001d-TABLE-update","[TABLE] As a user, I can update the value of the table","[TABLE] As a user, I can update the value of the table",""
"passed","Tue Nov 22 18:41:19 GMT 2022","Tue Nov 22 18:42:05 GMT 2022","45621","","JIT-Module-017a-GOOGLE-ANAL-default","","JIT-Module-017a-GOOGLE-ANAL-default","[GOOGLE-ANAL] As a user, I can add module Google Analytics and remove it","[GOOGLE-ANAL] As a user, I can add module Google Analytics and remove it",""
"passed","Tue Nov 22 18:51:08 GMT 2022","Tue Nov 22 18:52:28 GMT 2022","80294","","JIT-API-007bb-GET-list-API-Check-datetime-static-value","","JIT-API-007bb-GET-list-API-Check-datetime-static-value","[GET-list-API] Set datetime static value","[GET-list-API] Set datetime static value",""
"passed","Tue Nov 22 18:21:44 GMT 2022","Tue Nov 22 18:23:42 GMT 2022","118527","","JIT-Database-012c-RELATION-multiple-1-direction","","JIT-Database-012c-RELATION-multiple-1-direction","[RELATION], I should add multiple relation 1 direction","[RELATION], I should add multiple relation 1 direction",""
"passed","Tue Nov 22 19:18:04 GMT 2022","Tue Nov 22 19:19:23 GMT 2022","78730","","JIT-API-002a-GET-list-check-default","","JIT-API-002a-GET-list-check-default","As a user, I check default value in API GET list","As a user, I check default value in API GET list",""
"passed","Tue Nov 22 18:22:32 GMT 2022","Tue Nov 22 18:23:35 GMT 2022","63048","","JIT-Database-014-DEFECT-Check-duplicate-table-name","","JIT-Database-014-DEFECT-Check-duplicate-table-name","[DEFECT] As a user, I cannot update to duplicate name","[DEFECT] As a user, I cannot update to duplicate name",""
"passed","Tue Nov 22 18:18:11 GMT 2022","Tue Nov 22 18:20:11 GMT 2022","120706","","JIT-Database-004-COLUMN-type-INTEGER","","JIT-Database-004-COLUMN-type-INTEGER","[COLUMN] As a user, I should check the validation of INTEGER column definition","[COLUMN] As a user, I should check the validation of INTEGER column definition",""
"passed","Tue Nov 22 18:13:24 GMT 2022","Tue Nov 22 18:14:29 GMT 2022","65022","","JIT-Dashboard-003e-DETAILOF-delete-column","","JIT-Dashboard-003e-DETAILOF-delete-column","[DEATIL-OF] As a user, I should see the params will be removed when column is deleted","[DEATIL-OF] As a user, I should see the params will be removed when column is deleted",""
"passed","Tue Nov 22 18:17:08 GMT 2022","Tue Nov 22 18:17:50 GMT 2022","42547","","JIT-Database-001e-TABLE-create-by-context-menu","","JIT-Database-001e-TABLE-create-by-context-menu","[TABLE] As a user, I can create new table by context menu","[TABLE] As a user, I can create new table by context menu",""
"passed","Tue Nov 22 18:28:09 GMT 2022","Tue Nov 22 18:31:04 GMT 2022","175006","","JIT-Mobile-022b-TEXT-Check-TEXT","","JIT-Mobile-022b-TEXT-Check-TEXT","[MOBILE-TEXT] As a user, I should check the TEXT infomation of Text is correct: Text content, Font, Size, Font weight, Line Height, Spacing, Color, Italic, Underline","[MOBILE-TEXT] As a user, I should check the TEXT infomation of Text is correct: Text content, Font, Size, Font weight, Line Height, Spacing, Color, Italic, Underline",""
"passed","Tue Nov 22 18:45:34 GMT 2022","Tue Nov 22 18:47:58 GMT 2022","143519","","JIT-Web-002e-MOLECULE-Search","","JIT-Web-002e-MOLECULE-Search","[WEB-PAGE] As a user, I can search correct molecule with keyword","[WEB-PAGE] As a user, I can search correct molecule with keyword",""
"passed","Tue Nov 22 18:25:36 GMT 2022","Tue Nov 22 18:26:33 GMT 2022","56985","","JIT-Mobile-007-MOLECULE-Delete","","JIT-Mobile-007-MOLECULE-Delete","[MOBILE-MOLECULE] As a user, I can delete molecule","[MOBILE-MOLECULE] As a user, I can delete molecule",""
"passed","Tue Nov 22 18:21:33 GMT 2022","Tue Nov 22 18:22:30 GMT 2022","57477","","JIT-Database-011f-COLUMN-ENUM-duplicated","","JIT-Database-011f-COLUMN-ENUM-duplicated","[COLUMN] As a user, I should check counld not add duplicated item","[COLUMN] As a user, I should check counld not add duplicated item",""
"passed","Tue Nov 22 18:40:05 GMT 2022","Tue Nov 22 18:41:10 GMT 2022","65540","","JIT-Module-014b-BASIC-AUTH-edit-infos","","JIT-Module-014b-BASIC-AUTH-edit-infos","[BASIC-AUTH] As a user, I can update module Basic Authentication","[BASIC-AUTH] As a user, I can update module Basic Authentication",""
"failed","Tue Nov 22 19:24:00 GMT 2022","Tue Nov 22 19:25:12 GMT 2022","71931","","JIT-Export-005a-Scenario-RN-login-screen","","JIT-Export-005a-Scenario-RN-login-screen","[RN-Login-screen] As a user, I check export the project type React Native and Nextjs successfully with scenario 1","[RN-Login-screen] As a user, I check export the project type React Native and Nextjs successfully with scenario 1",""
"passed","Tue Nov 22 18:16:53 GMT 2022","Tue Nov 22 18:17:39 GMT 2022","45909","","JIT-Database-001c-TABLE-duplicate","","JIT-Database-001c-TABLE-duplicate","[TABLE] As a user, I cannot create table with duplicate name","[TABLE] As a user, I cannot create table with duplicate name",""
"passed","Tue Nov 22 18:21:39 GMT 2022","Tue Nov 22 18:22:39 GMT 2022","60497","","JIT-Database-012b-RELATION-empty-duplicate","","JIT-Database-012b-RELATION-empty-duplicate","[RELATION], I should see the error duplicate when leaving foreign key empty","[RELATION], I should see the error duplicate when leaving foreign key empty",""
"passed","Tue Nov 22 18:30:52 GMT 2022","Tue Nov 22 18:32:09 GMT 2022","76901","","JIT-Mobile-030b-WEBVIEW-General-info","","JIT-Mobile-030b-WEBVIEW-General-info","[MOBILE-WEBVIEW] As a user, I should check the general infomation of Webview is correct: Name, Key, unique key, delete component","[MOBILE-WEBVIEW] As a user, I should check the general infomation of Webview is correct: Name, Key, unique key, delete component",""
"passed","Tue Nov 22 18:18:00 GMT 2022","Tue Nov 22 18:19:02 GMT 2022","61935","","JIT-Database-003b-COLUMN-duplicated","","JIT-Database-003b-COLUMN-duplicated","[COLUMN] As a user, I cannot add duplicated column definition","[COLUMN] As a user, I cannot add duplicated column definition",""
"passed","Tue Nov 22 18:15:03 GMT 2022","Tue Nov 22 18:16:20 GMT 2022","77143","","JIT-Dashboard-005d-UPDATEOF-delete-table","","JIT-Dashboard-005d-UPDATEOF-delete-table","[UPDATE-OF] As a user, I should see the table is not displayed in dashboard list after removed","[UPDATE-OF] As a user, I should see the table is not displayed in dashboard list after removed",""
"passed","Tue Nov 22 18:22:27 GMT 2022","Tue Nov 22 18:24:12 GMT 2022","105039","","JIT-Database-012e-RELATION-trigger-by-button","","JIT-Database-012e-RELATION-trigger-by-button","[RELATION] check the basic relation","[RELATION] check the basic relation",""
"passed","Tue Nov 22 18:24:05 GMT 2022","Tue Nov 22 18:25:56 GMT 2022","110287","","JIT-Mobile-001a-SCREEN-Search","","JIT-Mobile-001a-SCREEN-Search","[MOBILE-SCREEN] As a user, I can search correct screen with keyword","[MOBILE-SCREEN] As a user, I can search correct screen with keyword",""
"passed","Tue Nov 22 18:13:42 GMT 2022","Tue Nov 22 18:14:44 GMT 2022","62063","","JIT-Dashboard-004e-CREATEOF-delete-column","","JIT-Dashboard-004e-CREATEOF-delete-column","[CREATE-OF] As a user, I should see the params will be removed when column is deleted","[CREATE-OF] As a user, I should see the params will be removed when column is deleted",""
"passed","Tue Nov 22 18:11:36 GMT 2022","Tue Nov 22 18:12:57 GMT 2022","80447","","JIT-Dashboard-001-Check-general-info","","JIT-Dashboard-001-Check-general-info","As a user, I check general info and update table name","As a user, I check general info and update table name",""
"passed","Tue Nov 22 18:24:13 GMT 2022","Tue Nov 22 18:26:11 GMT 2022","118421","","JIT-Mobile-002-SCREEN-Update","","JIT-Mobile-002-SCREEN-Update","[MOBILE-SCREEN] As a user, I can update screen with positive and negative cases","[MOBILE-SCREEN] As a user, I can update screen with positive and negative cases",""
"passed","Tue Nov 22 19:40:59 GMT 2022","Tue Nov 22 19:43:17 GMT 2022","138480","","JIT-Export-004-Scenario_ROR_2","","JIT-Export-004-Scenario_ROR_2","As a user, I check export the project type ROR with key successfully with scenario 2","As a user, I check export the project type ROR with key successfully with scenario 2",""
"passed","Tue Nov 22 18:47:01 GMT 2022","Tue Nov 22 18:48:45 GMT 2022","104255","","JIT-Web-004a-ACTION-NAVIGATION-no-param","","JIT-Web-004a-ACTION-NAVIGATION-no-param","[WEB-ACTION-NAVIGATION] As a user, I could add action type navigation without params and check preview code","[WEB-ACTION-NAVIGATION] As a user, I could add action type navigation without params and check preview code",""
"passed","Tue Nov 22 18:36:09 GMT 2022","Tue Nov 22 18:36:52 GMT 2022","43494","","JIT-Module-002a-DEEPLINK-default","","JIT-Module-002a-DEEPLINK-default","As a user, I can add module Deeplink and remove it","As a user, I can add module Deeplink and remove it",""
"passed","Tue Nov 22 18:44:28 GMT 2022","Tue Nov 22 18:46:12 GMT 2022","103419","","JIT-Web-002a-MOLECULE-Create-new","","JIT-Web-002a-MOLECULE-Create-new","[WEB-MOLECULE] As a user, I can create new molecule with positive and negative cases","[WEB-MOLECULE] As a user, I can create new molecule with positive and negative cases",""
"passed","Tue Nov 22 18:20:46 GMT 2022","Tue Nov 22 18:21:50 GMT 2022","64256","","JIT-Database-011d-COLUMN-ENUM-delete-selected-items","","JIT-Database-011d-COLUMN-ENUM-delete-selected-items","[COLUMN] As a user, I should delete 1 selected item and check is will be removed in default dropdown","[COLUMN] As a user, I should delete 1 selected item and check is will be removed in default dropdown",""
"passed","Tue Nov 22 18:11:37 GMT 2022","Tue Nov 22 18:12:53 GMT 2022","75553","","JIT-Dashboard-002a-LISTOF-default-column","","JIT-Dashboard-002a-LISTOF-default-column","[LIST-OF] As a user, I should add default column in dashboard params","[LIST-OF] As a user, I should add default column in dashboard params",""
"passed","Tue Nov 22 18:40:02 GMT 2022","Tue Nov 22 18:40:52 GMT 2022","50819","","JIT-Module-014a-BASIC-AUTH-default","","JIT-Module-014a-BASIC-AUTH-default","[BASIC-AUTH] As a user, I can add module Basic Authentication and remove it","[BASIC-AUTH] As a user, I can add module Basic Authentication and remove it",""
"passed","Tue Nov 22 18:26:51 GMT 2022","Tue Nov 22 18:28:11 GMT 2022","80873","","JIT-Mobile-015-VIEW-General-info","","JIT-Mobile-015-VIEW-General-info","[MOBILE-VIEW] As a user, I should check the general infomation of View is correct: Name, Key, unique key, delete component","[MOBILE-VIEW] As a user, I should check the general infomation of View is correct: Name, Key, unique key, delete component",""
"passed","Tue Nov 22 18:29:06 GMT 2022","Tue Nov 22 18:30:14 GMT 2022","68746","","JIT-Mobile-027b-IMAGE-General-info","","JIT-Mobile-027b-IMAGE-General-info","[MOBILE-IMAGE] As a user, I should check the general infomation of Image is correct: Name, Key, unique key, delete component","[MOBILE-IMAGE] As a user, I should check the general infomation of Image is correct: Name, Key, unique key, delete component",""
"passed","Tue Nov 22 18:52:52 GMT 2022","Tue Nov 22 18:53:58 GMT 2022","66199","","JIT-API-007f-DELETE-API-Add-new-endpoint","","JIT-API-007f-DELETE-API-Add-new-endpoint","[DELETE-API] Create, update and delete new DELETE API endpoint","[DELETE-API] Create, update and delete new DELETE API endpoint",""
"passed","Tue Nov 22 18:13:33 GMT 2022","Tue Nov 22 18:14:40 GMT 2022","66832","","JIT-Dashboard-004c-CREATEOF-saving","","JIT-Dashboard-004c-CREATEOF-saving","[CREATE-OF] As a user, I should save the selected option when switching between tables","[CREATE-OF] As a user, I should save the selected option when switching between tables",""
"passed","Tue Nov 22 19:26:24 GMT 2022","Tue Nov 22 19:28:36 GMT 2022","132437","","JIT-Export-002-Scenario-ROR-withkey-1","","JIT-Export-002-Scenario-ROR-withkey-1","As a user, I check export the project type ROR with key successfully with scenario 1","As a user, I check export the project type ROR with key successfully with scenario 1",""
"passed","Tue Nov 22 18:52:38 GMT 2022","Tue Nov 22 18:54:01 GMT 2022","82323","","JIT-API-007e-PUT-API-Add-new-endpoint","","JIT-API-007e-PUT-API-Add-new-endpoint","[PUT-API] Create, update and delete new PUT API endpoint","[PUT-API] Create, update and delete new PUT API endpoint",""
"passed","Tue Nov 22 18:19:53 GMT 2022","Tue Nov 22 18:20:58 GMT 2022","64245","","JIT-Database-011a-COLUMN-ENUM-default","","JIT-Database-011a-COLUMN-ENUM-default","[COLUMN] As a user, I should check the basic validation","[COLUMN] As a user, I should check the basic validation",""
"passed","Tue Nov 22 18:43:24 GMT 2022","Tue Nov 22 18:44:45 GMT 2022","81224","","JIT-Web-001c-PAGE-Delete","","JIT-Web-001c-PAGE-Delete","[PAGE] As a user, I can delete page","[PAGE] As a user, I can delete page",""
"passed","Tue Nov 22 18:13:40 GMT 2022","Tue Nov 22 18:14:54 GMT 2022","73968","","JIT-Dashboard-004d-CREATEOF-delete-table","","JIT-Dashboard-004d-CREATEOF-delete-table","[CREATE-OF] As a user, I should see the table is not displayed in dashboard list after removed","[CREATE-OF] As a user, I should see the table is not displayed in dashboard list after removed",""
"passed","Tue Nov 22 18:29:41 GMT 2022","Tue Nov 22 18:30:52 GMT 2022","71178","","JIT-Mobile-028b-ICON-General-info","","JIT-Mobile-028b-ICON-General-info","[MOBILE-ICON] As a user, I should check the general infomation of Icon is correct: Name, Key, unique key, delete component","[MOBILE-ICON] As a user, I should check the general infomation of Icon is correct: Name, Key, unique key, delete component",""
"passed","Tue Nov 22 18:28:06 GMT 2022","Tue Nov 22 18:29:19 GMT 2022","72378","","JIT-Mobile-022a-TEXT-General-info","","JIT-Mobile-022a-TEXT-General-info","[MOBILE-TEXT] As a user, I should check the general infomation of Text is correct: Name, Key, unique key, delete component","[MOBILE-TEXT] As a user, I should check the general infomation of Text is correct: Name, Key, unique key, delete component",""
"passed","Tue Nov 22 18:33:46 GMT 2022","Tue Nov 22 18:34:39 GMT 2022","52735","","JIT-Mobile-041a-PREVIEW-NAVIGATION-no-navigation-setup","","JIT-Mobile-041a-PREVIEW-NAVIGATION-no-navigation-setup","[MOBILE-PREVIEW-NAVIGATION] As a user, I could open preview screen with notification should setup the screen navigation","[MOBILE-PREVIEW-NAVIGATION] As a user, I could open preview screen with notification should setup the screen navigation",""
"passed","Tue Nov 22 18:46:21 GMT 2022","Tue Nov 22 18:47:41 GMT 2022","80083","","JIT-Web-002f-MOLECULE-Navigate-edit-screen","","JIT-Web-002f-MOLECULE-Navigate-edit-screen","[WEB-MOLECULE-EDIT] As a user, I can see the molecule in Page and use Edit button see the content of this molecule","[WEB-MOLECULE-EDIT] As a user, I can see the molecule in Page and use Edit button see the content of this molecule",""
"passed","Tue Nov 22 18:41:29 GMT 2022","Tue Nov 22 18:43:40 GMT 2022","130822","","JIT-Module-018a-ADMIN-DASHBOARD-USER-default","","JIT-Module-018a-ADMIN-DASHBOARD-USER-default","[ADMIN-DASHBOARD-USER], I can add module Admin dashboard user and remove it","[ADMIN-DASHBOARD-USER], I can add module Admin dashboard user and remove it",""
"passed","Tue Nov 22 18:36:49 GMT 2022","Tue Nov 22 18:37:45 GMT 2022","56234","","JIT-Module-004a-EMAIL-LOGIN-default","","JIT-Module-004a-EMAIL-LOGIN-default","[EMAIL-LOGIN] - Check adding and auto-generated API","[EMAIL-LOGIN] - Check adding and auto-generated API",""
"passed","Tue Nov 22 18:22:02 GMT 2022","Tue Nov 22 18:24:07 GMT 2022","125157","","JIT-Database-012d-RELATION-multiple-2-direction","","JIT-Database-012d-RELATION-multiple-2-direction","[RELATION], I should add multiple relation 2 directions","[RELATION], I should add multiple relation 2 directions",""
"passed","Tue Nov 22 18:57:31 GMT 2022","Tue Nov 22 18:58:52 GMT 2022","81350","","JIT-Database-015l-INDEX-ENUM-column-config","","JIT-Database-015l-INDEX-ENUM-column-config","[INDEX-ENUM] As a user, I config index from column setting && check on index popup","[INDEX-ENUM] As a user, I config index from column setting && check on index popup",""
"passed","Tue Nov 22 18:42:54 GMT 2022","Tue Nov 22 18:44:30 GMT 2022","96027","","JIT-Web-001a-PAGE-Create-new","","JIT-Web-001a-PAGE-Create-new","[PAGE] As a user, I can create new screen with positive and negative cases","[PAGE] As a user, I can create new screen with positive and negative cases",""
"passed","Tue Nov 22 18:26:18 GMT 2022","Tue Nov 22 18:27:20 GMT 2022","61147","","JIT-Mobile-012-JITDEF-remove-poperty-info-after-deleting-navigation","","JIT-Mobile-012-JITDEF-remove-poperty-info-after-deleting-navigation","[DEFECT] As a user, I should see the property infos need to be removed after the navigation was deleted","[DEFECT] As a user, I should see the property infos need to be removed after the navigation was deleted",""
"passed","Tue Nov 22 18:44:40 GMT 2022","Tue Nov 22 18:47:03 GMT 2022","143798","","JIT-Web-002b-MOLECULE-Update","","JIT-Web-002b-MOLECULE-Update","[WEB-MOLECULE] As a user, I can update molecule with positive and negative cases","[WEB-MOLECULE] As a user, I can update molecule with positive and negative cases",""
"passed","Tue Nov 22 18:13:31 GMT 2022","Tue Nov 22 18:14:48 GMT 2022","76721","","JIT-Dashboard-004a-CREATEOF-default","","JIT-Dashboard-004a-CREATEOF-default","[CREATE-OF] As a user, I should add default column in dashboard params","[CREATE-OF] As a user, I should add default column in dashboard params",""
"passed","Tue Nov 22 18:42:54 GMT 2022","Tue Nov 22 18:44:08 GMT 2022","73625","","JIT-Team-005-Invite-duplicate-email","","JIT-Team-005-Invite-duplicate-email","[INVITE-DELETE] Invite new email and invite again","[INVITE-DELETE] Invite new email and invite again",""
"passed","Tue Nov 22 18:31:04 GMT 2022","Tue Nov 22 18:33:16 GMT 2022","131539","","JIT-Mobile-031a-DIVIDER-Check-PreviewCode","","JIT-Mobile-031a-DIVIDER-Check-PreviewCode","[MOBILE-DIVIDER] As a user, I should check the Preview code of Divider component","[MOBILE-DIVIDER] As a user, I should check the Preview code of Divider component",""
"passed","Tue Nov 22 18:15:25 GMT 2022","Tue Nov 22 18:16:33 GMT 2022","68112","","JIT-Dashboard-006a-DELETEOF-default","","JIT-Dashboard-006a-DELETEOF-default","[DELETE-OF] As a user, I should add default column in dashboard params","[DELETE-OF] As a user, I should add default column in dashboard params",""
"passed","Tue Nov 22 18:17:13 GMT 2022","Tue Nov 22 18:17:50 GMT 2022","37656","","JIT-Database-002-COLUMN-default","","JIT-Database-002-COLUMN-default","[COLUMN] As a user, I should see the default column definition","[COLUMN] As a user, I should see the default column definition",""
"passed","Tue Nov 22 18:56:01 GMT 2022","Tue Nov 22 18:57:23 GMT 2022","82076","","JIT-Database-015g-INDEX-FLOAT-column-config","","JIT-Database-015g-INDEX-FLOAT-column-config","[INDEX-FLOAT] As a user, I config index from column setting && check on index popup","[INDEX-FLOAT] As a user, I config index from column setting && check on index popup",""
"passed","Tue Nov 22 19:29:00 GMT 2022","Tue Nov 22 19:30:07 GMT 2022","67075","","JIT-Export-010a-Export-RoR-TODO","","JIT-Export-010a-Export-RoR-TODO","[SMOKE] As a user, I check exprting project TODO with RoR","[SMOKE] As a user, I check exprting project TODO with RoR",""
"passed","Tue Nov 22 18:39:58 GMT 2022","Tue Nov 22 18:40:51 GMT 2022","52890","","JIT-Module-013b-AWS-edit-infos","","JIT-Module-013b-AWS-edit-infos","[AWS] As a user, I can update module AWS SES Integration","[AWS] As a user, I can update module AWS SES Integration",""
"passed","Tue Nov 22 19:33:59 GMT 2022","Tue Nov 22 19:41:58 GMT 2022","478796","","JIT-Export-010c-Export-NextJS-TODO","","JIT-Export-010c-Export-NextJS-TODO","[SMOKE] As a user, I check exprting project TODO with NextJS","[SMOKE] As a user, I check exprting project TODO with NextJS",""
"passed","Tue Nov 22 18:18:16 GMT 2022","Tue Nov 22 18:21:03 GMT 2022","166837","","JIT-Database-006-COLUMN-type-STRING","","JIT-Database-006-COLUMN-type-STRING","[COLUMN] As a user, I should check the validation of STRING column definition","[COLUMN] As a user, I should check the validation of STRING column definition",""
"passed","Tue Nov 22 18:22:30 GMT 2022","Tue Nov 22 18:23:27 GMT 2022","56758","","JIT-Database-013-DEFECT-Check-default-value-when-changing-type","","JIT-Database-013-DEFECT-Check-default-value-when-changing-type","[DEFECT] As a user, I should check the default value when changing the type","[DEFECT] As a user, I should check the default value when changing the type",""
"passed","Tue Nov 22 18:13:31 GMT 2022","Tue Nov 22 18:14:36 GMT 2022","64606","","JIT-Dashboard-004b-CREATEOF-new-column","","JIT-Dashboard-004b-CREATEOF-new-column","[CREATE-OF] As a user, I should add new column in dashboard params","[CREATE-OF] As a user, I should add new column in dashboard params",""
"passed","Tue Nov 22 18:11:37 GMT 2022","Tue Nov 22 18:13:04 GMT 2022","86825","","JIT-Dashboard-002c-LISTOF-saving","","JIT-Dashboard-002c-LISTOF-saving","[LIST-OF] As a user, I should save the selected option when switching between tables","[LIST-OF] As a user, I should save the selected option when switching between tables",""
"passed","Tue Nov 22 18:33:53 GMT 2022","Tue Nov 22 18:35:35 GMT 2022","102063","","JIT-Mobile-042a-ACTION-NAVIGATION-no-param","","JIT-Mobile-042a-ACTION-NAVIGATION-no-param","[MOBILE-ACTION-NAVIGATION] As a user, I could add action type navigation without params and check preview code","[MOBILE-ACTION-NAVIGATION] As a user, I could add action type navigation without params and check preview code",""
"passed","Tue Nov 22 18:47:40 GMT 2022","Tue Nov 22 18:49:10 GMT 2022","90110","","JIT-Web-007a-ASSET-Upload","","JIT-Web-007a-ASSET-Upload","[ASSET] As a user, I can upload new image and store in Asset Manager and use it in all Image component","[ASSET] As a user, I can upload new image and store in Asset Manager and use it in all Image component",""
"passed","Tue Nov 22 18:47:40 GMT 2022","Tue Nov 22 18:49:19 GMT 2022","98878","","JIT-Web-007b-ASSET-Rename-and-delete","","JIT-Web-007b-ASSET-Rename-and-delete","[ASSET] As a user, I can rename and delete image asset","[ASSET] As a user, I can rename and delete image asset",""
"passed","Tue Nov 22 18:42:09 GMT 2022","Tue Nov 22 18:42:52 GMT 2022","42628","","JIT-Module-019b-GOOGLE-ANALYTICS-edit-infos","","JIT-Module-019b-GOOGLE-ANALYTICS-edit-infos","[GOOGLE-ANALYTICS] As a user, I can update module Google Analytics information for each environment","[GOOGLE-ANALYTICS] As a user, I can update module Google Analytics information for each environment",""
"passed","Tue Nov 22 19:15:46 GMT 2022","Tue Nov 22 19:17:55 GMT 2022","128117","","JIT-Mobile-039a-OTP-Check-PreviewCode","","JIT-Mobile-039a-OTP-Check-PreviewCode","[MOBILE-OTP] As a user, I should check the Preview code of OTP component","[MOBILE-OTP] As a user, I should check the Preview code of OTP component",""
