"Status","Start Time","Stop Time","Duration in ms","Parent Suite","Suite","Sub Suite","Test Class","Test Method","Name","Description"
"passed","Fri Jul 08 02:12:51 GMT 2022","Fri Jul 08 02:14:05 GMT 2022","74299","","JIT-Database-015k-INDEX-BOOLEAN-column-config","","JIT-Database-015k-INDEX-BOOLEAN-column-config","[INDEX-BOOLEAN] As a user, I config index from column setting && check on index popup","[INDEX-BOOLEAN] As a user, I config index from column setting && check on index popup",""
"passed","Fri Jul 08 03:03:46 GMT 2022","Fri Jul 08 03:04:53 GMT 2022","67102","","JIT-Export-008-Existing-Scenario-ROR-nokey-Jump-team","","JIT-Export-008-Existing-Scenario-ROR-nokey-Jump-team","[JUMP-TEAM] Existing project - No key","[JUMP-TEAM] Existing project - No key",""
"passed","Fri Jul 08 02:18:13 GMT 2022","Fri Jul 08 02:18:43 GMT 2022","29419","","JIT-Module-000-search","","JIT-Module-000-search","[SEARCH] As a user, I can Search module","[SEARCH] As a user, I can Search module",""
"passed","Fri Jul 08 02:27:43 GMT 2022","Fri Jul 08 02:29:04 GMT 2022","80886","","JIT-API-003a-POST-check-default","","JIT-API-003a-POST-check-default","As a user, I check default value in API POST","As a user, I check default value in API POST",""
"passed","Fri Jul 08 02:08:40 GMT 2022","Fri Jul 08 02:10:28 GMT 2022","108890","","JIT-Database-011a-COLUMN-ENUM-default","","JIT-Database-011a-COLUMN-ENUM-default","As a user, I should check the basic validation","As a user, I should check the basic validation",""
"passed","Fri Jul 08 02:09:50 GMT 2022","Fri Jul 08 02:10:59 GMT 2022","68346","","JIT-Database-012a-RELATION-basic","","JIT-Database-012a-RELATION-basic","[RELATION] check the basic relation","[RELATION] check the basic relation",""
"passed","Fri Jul 08 02:15:46 GMT 2022","Fri Jul 08 02:17:38 GMT 2022","111773","","JIT-Mobile-012-JITDEF-remove-poperty-info-after-deleting-navigation","","JIT-Mobile-012-JITDEF-remove-poperty-info-after-deleting-navigation","As a user, I should see the property infos need to be removed after the navigation was deleted","As a user, I should see the property infos need to be removed after the navigation was deleted",""
"passed","Fri Jul 08 02:21:55 GMT 2022","Fri Jul 08 02:22:47 GMT 2022","51632","","JIT-Module-013a-AWS-default","","JIT-Module-013a-AWS-default","[AWS] As a user, I can add module AWS SES Integration and remove it","[AWS] As a user, I can add module AWS SES Integration and remove it",""
"passed","Fri Jul 08 02:11:30 GMT 2022","Fri Jul 08 02:13:11 GMT 2022","101085","","JIT-Database-015e-INDEX-TEXT-column-config","","JIT-Database-015e-INDEX-TEXT-column-config","[INDEX-TEXT] As a user, I config index from column setting && check on index popup","[INDEX-TEXT] As a user, I config index from column setting && check on index popup",""
"passed","Fri Jul 08 02:12:26 GMT 2022","Fri Jul 08 02:13:59 GMT 2022","93315","","JIT-Database-015i-INDEX-DATETIMETIME-column-config","","JIT-Database-015i-INDEX-DATETIMETIME-column-config","[INDEX-DATETIME] As a user, I config index from column setting && check on index popup","[INDEX-DATETIME] As a user, I config index from column setting && check on index popup",""
"passed","Fri Jul 08 02:03:13 GMT 2022","Fri Jul 08 02:04:22 GMT 2022","69050","","JIT-Dashboard-004d-CREATEOF-delete-table","","JIT-Dashboard-004d-CREATEOF-delete-table","[CREATE-OF] As a user, I should see the table is not displayed in dashboard list after removed","[CREATE-OF] As a user, I should see the table is not displayed in dashboard list after removed",""
"passed","Fri Jul 08 02:14:01 GMT 2022","Fri Jul 08 02:15:17 GMT 2022","76331","","JIT-Mobile-002-Screen-update-screen","","JIT-Mobile-002-Screen-update-screen","As a user, I can update screen with positive and negative cases","As a user, I can update screen with positive and negative cases",""
"passed","Fri Jul 08 02:13:07 GMT 2022","Fri Jul 08 02:14:50 GMT 2022","102762","","JIT-Database-015l-INDEX-ENUM-column-config","","JIT-Database-015l-INDEX-ENUM-column-config","[INDEX-ENUM] As a user, I config index from column setting && check on index popup","[INDEX-ENUM] As a user, I config index from column setting && check on index popup",""
"passed","Fri Jul 08 02:08:49 GMT 2022","Fri Jul 08 02:09:51 GMT 2022","61944","","JIT-Database-011b-COLUMN-ENUM-add-items","","JIT-Database-011b-COLUMN-ENUM-add-items","As a user, I should add new item and select in default dropdown","As a user, I should add new item and select in default dropdown",""
"passed","Fri Jul 08 02:19:50 GMT 2022","Fri Jul 08 02:21:55 GMT 2022","125555","","JIT-Module-005b-FORCE-MOBILE-UPDATE-api","","JIT-Module-005b-FORCE-MOBILE-UPDATE-api","[FORCE-MOBILE-UPDATE] - Check api","[FORCE-MOBILE-UPDATE] - Check api",""
"passed","Fri Jul 08 02:08:47 GMT 2022","Fri Jul 08 02:10:30 GMT 2022","103045","","JIT-Database-010-Check-validation-column-definition-type-FILE","","JIT-Database-010-Check-validation-column-definition-type-FILE","As a user, I should check the validation of FILE column definition for Format Area","As a user, I should check the validation of FILE column definition for Format Area",""
"passed","Fri Jul 08 02:05:08 GMT 2022","Fri Jul 08 02:06:18 GMT 2022","70486","","JIT-Dashboard-006d-DELETEOF-delete-table","","JIT-Dashboard-006d-DELETEOF-delete-table","[DELETE-OF] As a user, I should see the table is not displayed in dashboard list after removed","[DELETE-OF] As a user, I should see the table is not displayed in dashboard list after removed",""
"passed","Fri Jul 08 02:02:28 GMT 2022","Fri Jul 08 02:03:40 GMT 2022","71826","","JIT-Dashboard-003c-DETAILOF-saving","","JIT-Dashboard-003c-DETAILOF-saving","[DEATIL-OF] As a user, I should save the selected option when switching between tables","[DEATIL-OF] As a user, I should save the selected option when switching between tables",""
"passed","Fri Jul 08 02:43:08 GMT 2022","Fri Jul 08 02:43:53 GMT 2022","44975","","JIT-Dashboard-006b-DELETEOF-new-column","","JIT-Dashboard-006b-DELETEOF-new-column","[DELETE-OF] As a user, I should add new column in dashboard params","[DELETE-OF] As a user, I should add new column in dashboard params",""
"passed","Fri Jul 08 02:29:36 GMT 2022","Fri Jul 08 02:30:41 GMT 2022","65302","","JIT-API-004c-GET-detail-relation","","JIT-API-004c-GET-detail-relation","As a user, I check column display when having relation for GET-detail","As a user, I check column display when having relation for GET-detail",""
"passed","Fri Jul 08 02:23:06 GMT 2022","Fri Jul 08 02:24:00 GMT 2022","54544","","JIT-Module-016b-SENDGRID-edit-infos","","JIT-Module-016b-SENDGRID-edit-infos","[SENDGRID] As a user, I can update module SendGrid","[SENDGRID] As a user, I can update module SendGrid",""
"passed","Fri Jul 08 02:13:34 GMT 2022","Fri Jul 08 02:15:09 GMT 2022","94469","","JIT-Database-016b-COUNTER-CACHE-Create-by-adding-column","","JIT-Database-016b-COUNTER-CACHE-Create-by-adding-column","[COUNTER-CACHE] create new counter cache column by adding column","[COUNTER-CACHE] create new counter cache column by adding column",""
"passed","Fri Jul 08 03:02:01 GMT 2022","Fri Jul 08 03:03:40 GMT 2022","98365","","JIT-Export-007-Existing-Scenario-ROR-withkey","","JIT-Export-007-Existing-Scenario-ROR-withkey","As a user, I check export the existing project type ROR with key successfully","As a user, I check export the existing project type ROR with key successfully",""
"passed","Fri Jul 08 02:07:10 GMT 2022","Fri Jul 08 02:08:34 GMT 2022","84230","","JIT-Database-008-Check-validation-column-definition-type-DATE-TIME","","JIT-Database-008-Check-validation-column-definition-type-DATE-TIME","As a user, I should check the validation of DATETIME column definition","As a user, I should check the validation of DATETIME column definition",""
"failed","Fri Jul 08 02:49:58 GMT 2022","Fri Jul 08 02:50:31 GMT 2022","32876","","JIT-API-007f-DELETE-API-Add-new-endpoint","","JIT-API-007f-DELETE-API-Add-new-endpoint","[DELETE-API] Create, update and delete new DELETE API endpoint","[DELETE-API] Create, update and delete new DELETE API endpoint",""
"passed","Fri Jul 08 02:57:41 GMT 2022","Fri Jul 08 02:59:32 GMT 2022","111450","","JIT-Export-002-Scenario-ROR-withkey-1","","JIT-Export-002-Scenario-ROR-withkey-1","As a user, I check export the project type ROR with key successfully with scenario 1","As a user, I check export the project type ROR with key successfully with scenario 1",""
"passed","Fri Jul 08 02:04:02 GMT 2022","Fri Jul 08 02:05:27 GMT 2022","84936","","JIT-Dashboard-005a-UPDATEOF-default","","JIT-Dashboard-005a-UPDATEOF-default","[UPDATE-OF] As a user, I should add default column in dashboard params","[UPDATE-OF] As a user, I should add default column in dashboard params",""
"passed","Fri Jul 08 02:26:48 GMT 2022","Fri Jul 08 02:28:27 GMT 2022","98696","","JIT-API-002a-GET-list-check-default","","JIT-API-002a-GET-list-check-default","As a user, I check default value in API GET list","As a user, I check default value in API GET list",""
"passed","Fri Jul 08 02:11:16 GMT 2022","Fri Jul 08 02:12:59 GMT 2022","102710","","JIT-Database-015d-INDEX-STRING-column-config","","JIT-Database-015d-INDEX-STRING-column-config","[INDEX-STRING] As a user, I config index from column setting && check on index popup","[INDEX-STRING] As a user, I config index from column setting && check on index popup",""
"passed","Fri Jul 08 02:18:31 GMT 2022","Fri Jul 08 02:19:57 GMT 2022","85558","","JIT-Module-002b-DEEPLINK-edit-infos","","JIT-Module-002b-DEEPLINK-edit-infos","As a user, I can update module Deeplink","As a user, I can update module Deeplink",""
"passed","Fri Jul 08 02:58:47 GMT 2022","Fri Jul 08 03:02:39 GMT 2022","231128","","JIT-Export-004-Scenario_ROR_2","","JIT-Export-004-Scenario_ROR_2","As a user, I check export the project type ROR with key successfully with scenario 2","As a user, I check export the project type ROR with key successfully with scenario 2",""
"passed","Fri Jul 08 02:09:37 GMT 2022","Fri Jul 08 02:10:45 GMT 2022","67308","","JIT-Database-011e-COLUMN-ENUM-delete-all","","JIT-Database-011e-COLUMN-ENUM-delete-all","As a user, I should delete all items and check all items are not displayed","As a user, I should delete all items and check all items are not displayed",""
"failed","Fri Jul 08 02:45:56 GMT 2022","Fri Jul 08 02:47:01 GMT 2022","65815","","JIT-API-007a-GROUP-API-CRUD","","JIT-API-007a-GROUP-API-CRUD","[GROUP-API] Create, update and delete group API","[GROUP-API] Create, update and delete group API",""
"passed","Fri Jul 08 02:14:02 GMT 2022","Fri Jul 08 02:14:55 GMT 2022","53500","","JIT-Mobile-001-Screen-create-new-screen","","JIT-Mobile-001-Screen-create-new-screen","As a user, I can create new screen with positive and negative cases","As a user, I can create new screen with positive and negative cases",""
"passed","Fri Jul 08 02:26:48 GMT 2022","Fri Jul 08 02:28:16 GMT 2022","87481","","JIT-API-002b-GET-list-update-info","","JIT-API-002b-GET-list-update-info","As a user, I update info for GET-list","As a user, I update info for GET-list",""
"passed","Fri Jul 08 02:00:56 GMT 2022","Fri Jul 08 02:02:51 GMT 2022","114803","","JIT-Dashboard-002a-LISTOF-default-column","","JIT-Dashboard-002a-LISTOF-default-column","[LIST-OF] As a user, I should add default column in dashboard params","[LIST-OF] As a user, I should add default column in dashboard params",""
"passed","Fri Jul 08 02:05:51 GMT 2022","Fri Jul 08 02:06:40 GMT 2022","49234","","JIT-Database-001a-TABLE-new","","JIT-Database-001a-TABLE-new","As a user, I can create new table","As a user, I can create new table",""
"passed","Fri Jul 08 03:01:21 GMT 2022","Fri Jul 08 03:01:55 GMT 2022","33628","","JIT-Export-006-Existing-Scenario-ROR-nokey","","JIT-Export-006-Existing-Scenario-ROR-nokey","As a user, I check export the existing project type ROR no key successfully","As a user, I check export the existing project type ROR no key successfully",""
"passed","Fri Jul 08 02:02:58 GMT 2022","Fri Jul 08 02:04:06 GMT 2022","68236","","JIT-Dashboard-004c-CREATEOF-saving","","JIT-Dashboard-004c-CREATEOF-saving","[CREATE-OF] As a user, I should save the selected option when switching between tables","[CREATE-OF] As a user, I should save the selected option when switching between tables",""
"passed","Fri Jul 08 02:10:54 GMT 2022","Fri Jul 08 02:11:56 GMT 2022","62841","","JIT-Database-015a-INDEX-Check-duplicate-empty","","JIT-Database-015a-INDEX-Check-duplicate-empty","As a user, I check empty and duplicate index","As a user, I check empty and duplicate index",""
"passed","Fri Jul 08 02:01:03 GMT 2022","Fri Jul 08 02:02:19 GMT 2022","76395","","JIT-Dashboard-003b-DETAILOF-new-column","","JIT-Dashboard-003b-DETAILOF-new-column","[DEATIL-OF] As a user, I should add new column in dashboard params","[DEATIL-OF] As a user, I should add new column in dashboard params",""
"passed","Fri Jul 08 02:04:04 GMT 2022","Fri Jul 08 02:04:59 GMT 2022","54595","","JIT-Dashboard-005b-UPDATEOF-new-column","","JIT-Dashboard-005b-UPDATEOF-new-column","[UPDATE-OF] As a user, I should add new column in dashboard params","[UPDATE-OF] As a user, I should add new column in dashboard params",""
"passed","Fri Jul 08 02:11:50 GMT 2022","Fri Jul 08 02:13:36 GMT 2022","105340","","JIT-Database-015g-INDEX-FLOAT-column-config","","JIT-Database-015g-INDEX-FLOAT-column-config","[INDEX-FLOAT] As a user, I config index from column setting && check on index popup","[INDEX-FLOAT] As a user, I config index from column setting && check on index popup",""
"passed","Fri Jul 08 02:28:12 GMT 2022","Fri Jul 08 02:29:30 GMT 2022","77903","","JIT-API-003b-POST-update-info","","JIT-API-003b-POST-update-info","As a user, I update info for API POST","As a user, I update info for API POST",""
"passed","Fri Jul 08 02:30:12 GMT 2022","Fri Jul 08 02:31:23 GMT 2022","70884","","JIT-API-005c-PUT-relation","","JIT-API-005c-PUT-relation","As a user, I check column display when having relation for API PUT","As a user, I check column display when having relation for API PUT",""
"passed","Fri Jul 08 02:29:45 GMT 2022","Fri Jul 08 02:31:17 GMT 2022","91788","","JIT-API-005a-PUT-check-default","","JIT-API-005a-PUT-check-default","As a user, I check default value in API PUT","As a user, I check default value in API PUT",""
"passed","Fri Jul 08 02:13:21 GMT 2022","Fri Jul 08 02:15:01 GMT 2022","99823","","JIT-Database-016a-COUNTER-CACHE-Create-by-relation","","JIT-Database-016a-COUNTER-CACHE-Create-by-relation","[COUNTER-CACHE] create new counter cache column by selecting in relation popup","[COUNTER-CACHE] create new counter cache column by selecting in relation popup",""
"passed","Fri Jul 08 02:15:24 GMT 2022","Fri Jul 08 02:16:43 GMT 2022","78272","","JIT-Mobile-006-Molecule-update-molecule","","JIT-Mobile-006-Molecule-update-molecule","As a user, I can update molecule with positive and negative cases","As a user, I can update molecule with positive and negative cases",""
"passed","Fri Jul 08 02:00:56 GMT 2022","Fri Jul 08 02:02:29 GMT 2022","93307","","JIT-Dashboard-002e-LISTOF-delete-column","","JIT-Dashboard-002e-LISTOF-delete-column","As a user, I should see the params will be removed when column is deleted","As a user, I should see the params will be removed when column is deleted",""
"passed","Fri Jul 08 02:22:16 GMT 2022","Fri Jul 08 02:23:07 GMT 2022","51653","","JIT-Module-016a-SENDGRID-default","","JIT-Module-016a-SENDGRID-default","[SENDGRID] As a user, I can add module SendGrid and remove it","[SENDGRID] As a user, I can add module SendGrid and remove it",""
"passed","Fri Jul 08 02:55:34 GMT 2022","Fri Jul 08 02:58:42 GMT 2022","188102","","JIT-Export-003-Scenario_ROR_2","","JIT-Export-003-Scenario_ROR_2","As a user, I check export the project type ROR no key successfully with scenario 2","As a user, I check export the project type ROR no key successfully with scenario 2",""
"passed","Fri Jul 08 02:31:29 GMT 2022","Fri Jul 08 02:32:41 GMT 2022","72904","","JIT-API-006c-DELETE-relation","","JIT-API-006c-DELETE-relation","As a user, I check column display when having relation for API DELETE","As a user, I check column display when having relation for API DELETE",""
"passed","Fri Jul 08 02:23:37 GMT 2022","Fri Jul 08 02:24:31 GMT 2022","53519","","JIT-Team-004-Invite-and-delete-invitation","","JIT-Team-004-Invite-and-delete-invitation","[INVITE-DELETE] Invite new email and delete invitation","[INVITE-DELETE] Invite new email and delete invitation",""
"passed","Fri Jul 08 02:18:39 GMT 2022","Fri Jul 08 02:19:53 GMT 2022","73899","","JIT-Module-003-JPBANK-default","","JIT-Module-003-JPBANK-default","[JPBANK] - Check adding and auto-generated API","[JPBANK] - Check adding and auto-generated API",""
"passed","Fri Jul 08 02:03:24 GMT 2022","Fri Jul 08 02:04:18 GMT 2022","54127","","JIT-Dashboard-004e-CREATEOF-delete-column","","JIT-Dashboard-004e-CREATEOF-delete-column","[CREATE-OF] As a user, I should see the params will be removed when column is deleted","[CREATE-OF] As a user, I should see the params will be removed when column is deleted",""
"passed","Fri Jul 08 02:22:00 GMT 2022","Fri Jul 08 02:23:07 GMT 2022","66711","","JIT-Module-014a-BASIC-AUTH-default","","JIT-Module-014a-BASIC-AUTH-default","[BASIC-AUTH] As a user, I can add module Basic Authentication and remove it","[BASIC-AUTH] As a user, I can add module Basic Authentication and remove it",""
"passed","Fri Jul 08 02:50:42 GMT 2022","Fri Jul 08 02:52:07 GMT 2022","84630","","JIT-API-008-DEFECT-Check-column-file-type","","JIT-API-008-DEFECT-Check-column-file-type","[DEFECT] As a user, I check column type file not display in request params of GET list Api","[DEFECT] As a user, I check column type file not display in request params of GET list Api",""
"passed","Fri Jul 08 02:20:19 GMT 2022","Fri Jul 08 02:21:30 GMT 2022","71568","","JIT-Module-008a-FB-LOGIN-default-edit","","JIT-Module-008a-FB-LOGIN-default-edit","[FACEBOOK-LOGIN], I can add module Facebook Login and edit its infos","[FACEBOOK-LOGIN], I can add module Facebook Login and edit its infos",""
"passed","Fri Jul 08 02:08:34 GMT 2022","Fri Jul 08 02:09:32 GMT 2022","57871","","JIT-Database-008-Check-validation-column-definition-type-DATE-TIME","","JIT-Database-008-Check-validation-column-definition-type-DATE-TIME","As a user, I should check the validation of DATE column definition","As a user, I should check the validation of DATE column definition",""
"passed","Fri Jul 08 02:15:46 GMT 2022","Fri Jul 08 02:16:48 GMT 2022","61200","","JIT-Mobile-011-JITDEF50-disable-add-duplicate-screen-in-stack","","JIT-Mobile-011-JITDEF50-disable-add-duplicate-screen-in-stack","As a user, I could add duplicate screen in stack","As a user, I could add duplicate screen in stack",""
"passed","Fri Jul 08 02:26:49 GMT 2022","Fri Jul 08 02:28:03 GMT 2022","74722","","JIT-API-002c-GET-list","","JIT-API-002c-GET-list","As a user, I check column display when having relation for GET-list","As a user, I check column display when having relation for GET-list",""
"passed","Fri Jul 08 02:00:55 GMT 2022","Fri Jul 08 02:02:23 GMT 2022","87087","","JIT-Dashboard-002b-LISTOF-new-column","","JIT-Dashboard-002b-LISTOF-new-column","[LIST-OF] As a user, I should add new column in dashboard params","[LIST-OF] As a user, I should add new column in dashboard params",""
"passed","Fri Jul 08 02:02:30 GMT 2022","Fri Jul 08 02:03:43 GMT 2022","73179","","JIT-Dashboard-003d-DETAILOF-delete-table","","JIT-Dashboard-003d-DETAILOF-delete-table","[DEATIL-OF] As a user, I should see the table is not displayed in dashboard list after removed","[DEATIL-OF] As a user, I should see the table is not displayed in dashboard list after removed",""
"passed","Fri Jul 08 02:15:48 GMT 2022","Fri Jul 08 02:17:05 GMT 2022","76822","","JIT-Mobile-013-JITDEF-reflect-delete-screen-innavigation-tree","","JIT-Mobile-013-JITDEF-reflect-delete-screen-innavigation-tree","As a user, I should see screen will be removed in navigation tree after deleting screen","As a user, I should see screen will be removed in navigation tree after deleting screen",""
"passed","Fri Jul 08 02:06:39 GMT 2022","Fri Jul 08 02:09:11 GMT 2022","152401","","JIT-Database-004-Check-validation-column-definition-type-INTEGER","","JIT-Database-004-Check-validation-column-definition-type-INTEGER","As a user, I should check the validation of INTEGER column definition","As a user, I should check the validation of INTEGER column definition",""
"passed","Fri Jul 08 02:09:38 GMT 2022","Fri Jul 08 02:10:38 GMT 2022","60436","","JIT-Database-011f-COLUMN-ENUM-duplicated","","JIT-Database-011f-COLUMN-ENUM-duplicated","As a user, I should check counld not add duplicated item","As a user, I should check counld not add duplicated item",""
"passed","Fri Jul 08 02:18:21 GMT 2022","Fri Jul 08 02:19:18 GMT 2022","56343","","JIT-Module-001a-CLOUDINARY-default","","JIT-Module-001a-CLOUDINARY-default","As a user, I can add module Cloudinary and remove it","As a user, I can add module Cloudinary and remove it",""
"passed","Fri Jul 08 02:19:52 GMT 2022","Fri Jul 08 02:20:56 GMT 2022","64002","","JIT-Module-006a-SMS-default","","JIT-Module-006a-SMS-default","[SMS], I can add module SMS login with Twilio and remove it","[SMS], I can add module SMS login with Twilio and remove it",""
"passed","Fri Jul 08 02:02:54 GMT 2022","Fri Jul 08 02:04:05 GMT 2022","70862","","JIT-Dashboard-004a-CREATEOF-default","","JIT-Dashboard-004a-CREATEOF-default","[CREATE-OF] As a user, I should add default column in dashboard params","[CREATE-OF] As a user, I should add default column in dashboard params",""
"passed","Fri Jul 08 02:14:22 GMT 2022","Fri Jul 08 02:15:14 GMT 2022","51527","","JIT-Mobile-003-Screen-delete-screen","","JIT-Mobile-003-Screen-delete-screen","As a user, I can delete screen","As a user, I can delete screen",""
"passed","Fri Jul 08 02:44:39 GMT 2022","Fri Jul 08 02:45:51 GMT 2022","72229","","JIT-API-006a-DELETE-check-default","","JIT-API-006a-DELETE-check-default","As a user, I check default value in API DELETE","As a user, I check default value in API DELETE",""
"passed","Fri Jul 08 02:23:08 GMT 2022","Fri Jul 08 02:23:59 GMT 2022","51080","","JIT-Module-017a-GOOGLE-ANAL-default","","JIT-Module-017a-GOOGLE-ANAL-default","[GOOGLE-ANAL] As a user, I can add module Google Analytics and remove it","[GOOGLE-ANAL] As a user, I can add module Google Analytics and remove it",""
"passed","Fri Jul 08 02:08:50 GMT 2022","Fri Jul 08 02:09:56 GMT 2022","65945","","JIT-Database-011c-COLUMN-ENUM-delete-items","","JIT-Database-011c-COLUMN-ENUM-delete-items","As a user, I should delete 1 item and check not display in default dropdown","As a user, I should delete 1 item and check not display in default dropdown",""
"failed","Fri Jul 08 02:48:32 GMT 2022","Fri Jul 08 02:49:05 GMT 2022","32880","","JIT-API-007d-POST-API-Add-new-endpoint","","JIT-API-007d-POST-API-Add-new-endpoint","[GET-POST] Create, update and delete new POST API endpoint","[GET-POST] Create, update and delete new POST API endpoint",""
"passed","Fri Jul 08 02:09:30 GMT 2022","Fri Jul 08 02:10:39 GMT 2022","69005","","JIT-Database-011d-COLUMN-ENUM-delete-selected-items","","JIT-Database-011d-COLUMN-ENUM-delete-selected-items","As a user, I should delete 1 selected item and check is will be removed in default dropdown","As a user, I should delete 1 selected item and check is will be removed in default dropdown",""
"passed","Fri Jul 08 02:10:26 GMT 2022","Fri Jul 08 02:11:20 GMT 2022","54213","","JIT-Database-013-DEFECT-Check-default-value-when-changing-type","","JIT-Database-013-DEFECT-Check-default-value-when-changing-type","As a user, I should check the default value when changing the type","As a user, I should check the default value when changing the type",""
"passed","Fri Jul 08 02:21:26 GMT 2022","Fri Jul 08 02:22:40 GMT 2022","74325","","JIT-Module-011a-GUEST-LOGIN-default-edit","","JIT-Module-011a-GUEST-LOGIN-default-edit","[GUEST-LOGIN], I can add module Guest Login and edit its infos","[GUEST-LOGIN], I can add module Guest Login and edit its infos",""
"passed","Fri Jul 08 02:23:38 GMT 2022","Fri Jul 08 02:24:35 GMT 2022","57593","","JIT-Team-005-Invite-duplicate-email","","JIT-Team-005-Invite-duplicate-email","[INVITE-DELETE] Invite new email and invite again","[INVITE-DELETE] Invite new email and invite again",""
"passed","Fri Jul 08 02:29:12 GMT 2022","Fri Jul 08 02:30:04 GMT 2022","51799","","JIT-API-004b-GET-detail-update-info","","JIT-API-004b-GET-detail-update-info","As a user, I update info for GET-detail","As a user, I update info for GET-detail",""
"passed","Fri Jul 08 02:04:56 GMT 2022","Fri Jul 08 02:05:58 GMT 2022","61463","","JIT-Dashboard-006c-DELETEOF-saving","","JIT-Dashboard-006c-DELETEOF-saving","[DELETE-OF] As a user, I should save the selected option when switching between tables","[DELETE-OF] As a user, I should save the selected option when switching between tables",""
"passed","Fri Jul 08 02:28:22 GMT 2022","Fri Jul 08 02:29:34 GMT 2022","72113","","JIT-API-003c-POST-relation","","JIT-API-003c-POST-relation","As a user, I check column display when having relation for API POST","As a user, I check column display when having relation for API POST",""
"failed","Fri Jul 08 02:49:16 GMT 2022","Fri Jul 08 02:49:47 GMT 2022","31449","","JIT-API-007e-PUT-API-Add-new-endpoint","","JIT-API-007e-PUT-API-Add-new-endpoint","[PUT-API] Create, update and delete new PUT API endpoint","[PUT-API] Create, update and delete new PUT API endpoint",""
"passed","Fri Jul 08 02:05:33 GMT 2022","Fri Jul 08 02:07:24 GMT 2022","111650","","JIT-Dashboard-006e-DELETEOF-delete-column","","JIT-Dashboard-006e-DELETEOF-delete-column","[DELETE-OF] As a user, I should see the params will be removed when column is deleted","[DELETE-OF] As a user, I should see the params will be removed when column is deleted",""
