"Status","Start Time","Stop Time","Duration in ms","Parent Suite","Suite","Sub Suite","Test Class","Test Method","Name","Description"
"passed","Fri Jul 08 02:07:01 GMT 2022","Fri Jul 08 02:09:16 GMT 2022","134858","","JIT-Database-006-Check-validation-column-definition-type-STRING","","JIT-Database-006-Check-validation-column-definition-type-STRING","As a user, I should check the validation of STRING column definition","As a user, I should check the validation of STRING column definition",""
"passed","Fri Jul 08 02:20:41 GMT 2022","Fri Jul 08 02:21:52 GMT 2022","70732","","JIT-Module-010a-LINE-LOGIN-default-edit","","JIT-Module-010a-LINE-LOGIN-default-edit","[LINE-LOGIN], I can add module Line Login and edit its infos","[LINE-LOGIN], I can add module Line Login and edit its infos",""
"passed","Fri Jul 08 02:04:43 GMT 2022","Fri Jul 08 02:05:58 GMT 2022","75761","","JIT-Dashboard-006a-DELETEOF-default","","JIT-Dashboard-006a-DELETEOF-default","[DELETE-OF] As a user, I should add default column in dashboard params","[DELETE-OF] As a user, I should add default column in dashboard params",""
"passed","Fri Jul 08 02:04:25 GMT 2022","Fri Jul 08 02:05:28 GMT 2022","62559","","JIT-Dashboard-005e-UPDATEOF-delete-column","","JIT-Dashboard-005e-UPDATEOF-delete-column","[UPDATE-OF] As a user, I should see the params will be removed when column is deleted","[UPDATE-OF] As a user, I should see the params will be removed when column is deleted",""
"failed","Fri Jul 08 02:47:07 GMT 2022","Fri Jul 08 02:47:38 GMT 2022","30420","","JIT-API-007b-GET-list-API-Add-new-endpoint","","JIT-API-007b-GET-list-API-Add-new-endpoint","[GET-list-API] Create, update and delete new GET API endpoint","[GET-list-API] Create, update and delete new GET API endpoint",""
"passed","Fri Jul 08 02:17:03 GMT 2022","Fri Jul 08 02:21:30 GMT 2022","266604","","JIT-Mobile-016.View.Check-property-area-BASIC","","JIT-Mobile-016.View.Check-property-area-BASIC","As a user, I should check the BASIC infomation of View is correct: Width, Height, Flex, Color","As a user, I should check the BASIC infomation of View is correct: Width, Height, Flex, Color",""
"passed","Fri Jul 08 02:11:11 GMT 2022","Fri Jul 08 02:12:33 GMT 2022","81843","","JIT-Database-015b-INDEX-CRUD-single","","JIT-Database-015b-INDEX-CRUD-single","As a user, I check add and update multiple index","As a user, I check add and update multiple index",""
"passed","Fri Jul 08 02:35:53 GMT 2022","Fri Jul 08 02:37:55 GMT 2022","122607","","JIT-Module-009b-GOOGLE-LOGIN-databse-api","","JIT-Module-009b-GOOGLE-LOGIN-databse-api","[GOOGLE-LOGIN], I check auto-generate column and api","[GOOGLE-LOGIN], I check auto-generate column and api",""
"passed","Fri Jul 08 02:55:39 GMT 2022","Fri Jul 08 02:57:34 GMT 2022","114790","","JIT-Export-001-Scenario_ROR_1","","JIT-Export-001-Scenario_ROR_1","As a user, I check export the project type ROR no key successfully with scenario 1","As a user, I check export the project type ROR no key successfully with scenario 1",""
"passed","Fri Jul 08 02:14:39 GMT 2022","Fri Jul 08 02:15:35 GMT 2022","55741","","JIT-Mobile-005-Moelcule-create-new-molecule","","JIT-Mobile-005-Moelcule-create-new-molecule","As a user, I can create new molecule with positive and negative cases","As a user, I can create new molecule with positive and negative cases",""
"passed","Fri Jul 08 02:05:58 GMT 2022","Fri Jul 08 02:06:42 GMT 2022","43508","","JIT-Database-001c-TABLE-duplicate","","JIT-Database-001c-TABLE-duplicate","As a user, I cannot create table with duplicate name","As a user, I cannot create table with duplicate name",""
"passed","Fri Jul 08 02:04:12 GMT 2022","Fri Jul 08 02:05:19 GMT 2022","66919","","JIT-Dashboard-005c-UPDATEOF-saving","","JIT-Dashboard-005c-UPDATEOF-saving","[UPDATE-OF] As a user, I should save the selected option when switching between tables","[UPDATE-OF] As a user, I should save the selected option when switching between tables",""
"passed","Fri Jul 08 02:11:13 GMT 2022","Fri Jul 08 02:12:40 GMT 2022","87133","","JIT-Database-015c-INDEX-CRUD-multiple","","JIT-Database-015c-INDEX-CRUD-multiple","As a user, I check add and update single index","As a user, I check add and update single index",""
"failed","Fri Jul 08 02:47:49 GMT 2022","Fri Jul 08 02:48:20 GMT 2022","31802","","JIT-API-007c-GET-detail-API-Add-new-endpoint","","JIT-API-007c-GET-detail-API-Add-new-endpoint","[GET-detail-API] Create, update and delete new GET API endpoint","[GET-detail-API] Create, update and delete new GET API endpoint",""
"passed","Fri Jul 08 02:18:31 GMT 2022","Fri Jul 08 02:19:20 GMT 2022","49656","","JIT-Module-002a-DEEPLINK-default","","JIT-Module-002a-DEEPLINK-default","As a user, I can add module Deeplink and remove it","As a user, I can add module Deeplink and remove it",""
"passed","Fri Jul 08 02:30:09 GMT 2022","Fri Jul 08 02:31:18 GMT 2022","69444","","JIT-API-005b-PUT-update-info","","JIT-API-005b-PUT-update-info","As a user, I update info for API PUT","As a user, I update info for API PUT",""
"passed","Fri Jul 08 02:00:56 GMT 2022","Fri Jul 08 02:03:03 GMT 2022","127180","","JIT-Dashboard-001-Check-general-info","","JIT-Dashboard-001-Check-general-info","As a user, I check general info and update table name","As a user, I check general info and update table name",""
"passed","Fri Jul 08 02:43:08 GMT 2022","Fri Jul 08 02:44:32 GMT 2022","83798","","JIT-Database-007-Check-validation-column-definition-type-TEXT","","JIT-Database-007-Check-validation-column-definition-type-TEXT","As a user, I should check the validation of TEXT column definition","As a user, I should check the validation of TEXT column definition",""
"passed","Fri Jul 08 02:26:48 GMT 2022","Fri Jul 08 02:27:36 GMT 2022","47414","","JIT-API-001-Check-general-info","","JIT-API-001-Check-general-info","As a user, I check general info","As a user, I check general info",""
"passed","Fri Jul 08 02:23:37 GMT 2022","Fri Jul 08 02:24:33 GMT 2022","55376","","JIT-Team-003-Invite-and-resend","","JIT-Team-003-Invite-and-resend","[RESEND-INVITE] Invite new email and resend invitation","[RESEND-INVITE] Invite new email and resend invitation",""
"passed","Fri Jul 08 02:04:22 GMT 2022","Fri Jul 08 02:06:18 GMT 2022","115629","","JIT-Dashboard-005d-UPDATEOF-delete-table","","JIT-Dashboard-005d-UPDATEOF-delete-table","[UPDATE-OF] As a user, I should see the table is not displayed in dashboard list after removed","[UPDATE-OF] As a user, I should see the table is not displayed in dashboard list after removed",""
"passed","Fri Jul 08 02:10:21 GMT 2022","Fri Jul 08 02:11:23 GMT 2022","62461","","JIT-Database-012b-RELATION-empty-duplicate","","JIT-Database-012b-RELATION-empty-duplicate","[RELATION], I should see the error duplicate when leaving foreign key empty","[RELATION], I should see the error duplicate when leaving foreign key empty",""
"passed","Fri Jul 08 02:18:23 GMT 2022","Fri Jul 08 02:19:46 GMT 2022","82442","","JIT-Module-001b-CLOUDINARY-edit-infos","","JIT-Module-001b-CLOUDINARY-edit-infos","As a user, I can update module Cloudinary","As a user, I can update module Cloudinary",""
"passed","Fri Jul 08 02:06:41 GMT 2022","Fri Jul 08 02:08:24 GMT 2022","103073","","JIT-Database-005-Check-validation-column-definition-type-FLOAT","","JIT-Database-005-Check-validation-column-definition-type-FLOAT","As a user, I should check the validation of FLOAT column definition","As a user, I should check the validation of FLOAT column definition",""
"passed","Fri Jul 08 02:20:12 GMT 2022","Fri Jul 08 02:21:23 GMT 2022","71291","","JIT-Module-007a-APPLE-LOGIN-default-edit","","JIT-Module-007a-APPLE-LOGIN-default-edit","[APPLE-LOGIN], I can add module Apple Login and edit its infos","[APPLE-LOGIN], I can add module Apple Login and edit its infos",""
"passed","Fri Jul 08 02:23:37 GMT 2022","Fri Jul 08 02:26:32 GMT 2022","174918","","JIT-Team-002-Invite-existing-account","","JIT-Team-002-Invite-existing-account","[INVITE-EXISTING-ACC] Invite existing email and do common action","[INVITE-EXISTING-ACC] Invite existing email and do common action",""
"passed","Fri Jul 08 02:07:29 GMT 2022","Fri Jul 08 02:08:17 GMT 2022","48373","","JIT-Database-003-Check-create-empty-and-duplicated-column","","JIT-Database-003-Check-create-empty-and-duplicated-column","As a user, I cannot add duplicated column definition","As a user, I cannot add duplicated column definition",""
"passed","Fri Jul 08 02:00:56 GMT 2022","Fri Jul 08 02:02:33 GMT 2022","97220","","JIT-Dashboard-002d-LISTOF-delete-table","","JIT-Dashboard-002d-LISTOF-delete-table","[LIST-OF] As a user, I should see the table is not displayed in dashboard list after removed","[LIST-OF] As a user, I should see the table is not displayed in dashboard list after removed",""
"passed","Fri Jul 08 02:20:02 GMT 2022","Fri Jul 08 02:21:21 GMT 2022","79486","","JIT-Module-006b-SMS-edit-infos","","JIT-Module-006b-SMS-edit-infos","[SMS], I can add module SMS login with Twilio and edit its infos","[SMS], I can add module SMS login with Twilio and edit its infos",""
"passed","Fri Jul 08 02:17:31 GMT 2022","Fri Jul 08 02:19:33 GMT 2022","121690","","JIT-Mobile-019.1.ViewPreviewCode","","JIT-Mobile-019.1.ViewPreviewCode","As a user, I should check Preview code of View component","As a user, I should check Preview code of View component",""
"passed","Fri Jul 08 02:05:55 GMT 2022","Fri Jul 08 02:06:21 GMT 2022","25884","","JIT-Database-001b-TABLE-empty","","JIT-Database-001b-TABLE-empty","As a user, I cannot create table with empty name","As a user, I cannot create table with empty name",""
"passed","Fri Jul 08 02:35:55 GMT 2022","Fri Jul 08 02:37:14 GMT 2022","78757","","JIT-Module-010b-LINE-LOGIN-databse-api","","JIT-Module-010b-LINE-LOGIN-databse-api","[LINE-LOGIN], I check auto-generate column and api","[LINE-LOGIN], I check auto-generate column and api",""
"passed","Fri Jul 08 02:22:00 GMT 2022","Fri Jul 08 02:23:07 GMT 2022","66599","","JIT-Module-014b-BASIC-AUTH-edit-infos","","JIT-Module-014b-BASIC-AUTH-edit-infos","[BASIC-AUTH] As a user, I can update module Basic Authentication","[BASIC-AUTH] As a user, I can update module Basic Authentication",""
"passed","Fri Jul 08 02:23:18 GMT 2022","Fri Jul 08 02:24:04 GMT 2022","46059","","JIT-Module-017b-GOOGLE-ANAL-edit-infos","","JIT-Module-017b-GOOGLE-ANAL-edit-infos","[GOOGLE-ANAL] As a user, I can update module Google Analytics","[GOOGLE-ANAL] As a user, I can update module Google Analytics",""
"passed","Fri Jul 08 02:06:12 GMT 2022","Fri Jul 08 02:06:48 GMT 2022","35577","","JIT-Database-002-Check-default-column-definition","","JIT-Database-002-Check-default-column-definition","As a user, I should see the default column definition","As a user, I should see the default column definition",""
"passed","Fri Jul 08 02:20:21 GMT 2022","Fri Jul 08 02:21:36 GMT 2022","75098","","JIT-Module-009a-GOOGLE-LOGIN-default-edit","","JIT-Module-009a-GOOGLE-LOGIN-default-edit","[GOOGLE-LOGIN], I can add module Google Login and edit its infos","[GOOGLE-LOGIN], I can add module Google Login and edit its infos",""
"passed","Fri Jul 08 02:15:44 GMT 2022","Fri Jul 08 02:18:11 GMT 2022","147286","","JIT-Mobile-010-JITDEF14-rename-without-focusing","","JIT-Mobile-010-JITDEF14-rename-without-focusing","As a user, I could rename the screen/molecule without focusing","As a user, I could rename the screen/molecule without focusing",""
"passed","Fri Jul 08 03:05:00 GMT 2022","Fri Jul 08 03:06:09 GMT 2022","68774","","JIT-Export-009-Existing-Scenario-ROR-withkey-Jump-team","","JIT-Export-009-Existing-Scenario-ROR-withkey-Jump-team","[JUMP-TEAM] Existing project - With key","[JUMP-TEAM] Existing project - With key",""
"passed","Fri Jul 08 02:34:11 GMT 2022","Fri Jul 08 02:35:46 GMT 2022","94506","","JIT-Module-007b-APPLE-LOGIN-databse-api","","JIT-Module-007b-APPLE-LOGIN-databse-api","[APPLE-LOGIN], I check auto-generate column and api","[APPLE-LOGIN], I check auto-generate column and api",""
"passed","Fri Jul 08 02:00:57 GMT 2022","Fri Jul 08 02:02:33 GMT 2022","96215","","JIT-Dashboard-003a-DETAILOF-default","","JIT-Dashboard-003a-DETAILOF-default","[DEATIL-OF] As a user, I should add default column in dashboard params","[DEATIL-OF] As a user, I should add default column in dashboard params",""
"passed","Fri Jul 08 02:16:04 GMT 2022","Fri Jul 08 02:18:02 GMT 2022","117948","","JIT-Mobile-014-JITDEF-status-bar","","JIT-Mobile-014-JITDEF-status-bar","As a user, I should see screen will be removed in navigation tree after deleting screen","As a user, I should see screen will be removed in navigation tree after deleting screen",""
"passed","Fri Jul 08 02:35:11 GMT 2022","Fri Jul 08 02:36:47 GMT 2022","96386","","JIT-Module-008b-FB-LOGIN-databse-api","","JIT-Module-008b-FB-LOGIN-databse-api","[FACEBOOK-LOGIN], I check auto-generate column and api","[FACEBOOK-LOGIN], I check auto-generate column and api",""
"passed","Fri Jul 08 02:21:56 GMT 2022","Fri Jul 08 02:22:55 GMT 2022","59131","","JIT-Module-013b-AWS-edit-infos","","JIT-Module-013b-AWS-edit-infos","[AWS] As a user, I can update module AWS SES Integration","[AWS] As a user, I can update module AWS SES Integration",""
"passed","Fri Jul 08 02:07:41 GMT 2022","Fri Jul 08 02:08:47 GMT 2022","65447","","JIT-Database-010-Check-validation-column-definition-type-FILE","","JIT-Database-010-Check-validation-column-definition-type-FILE","As a user, I should check the validation of FILE column definition","As a user, I should check the validation of FILE column definition",""
"passed","Fri Jul 08 02:07:18 GMT 2022","Fri Jul 08 02:08:23 GMT 2022","64675","","JIT-Database-009-Check-validation-column-definition-type-BOOLEAN","","JIT-Database-009-Check-validation-column-definition-type-BOOLEAN","As a user, I should check the validation of BOOLEAN column definition","As a user, I should check the validation of BOOLEAN column definition",""
"passed","Fri Jul 08 02:02:46 GMT 2022","Fri Jul 08 02:04:35 GMT 2022","109165","","JIT-Dashboard-003e-DETAILOF-delete-column","","JIT-Dashboard-003e-DETAILOF-delete-column","[DEATIL-OF] As a user, I should see the params will be removed when column is deleted","[DEATIL-OF] As a user, I should see the params will be removed when column is deleted",""
"passed","Fri Jul 08 02:56:12 GMT 2022","Fri Jul 08 03:01:15 GMT 2022","302118","","JIT-Export-005-Scenario-RN-NJS-login-screen","","JIT-Export-005-Scenario-RN-NJS-login-screen","As a user, I check export the project type React Native and Nextjs successfully with scenario 1","As a user, I check export the project type React Native and Nextjs successfully with scenario 1",""
"passed","Fri Jul 08 02:02:59 GMT 2022","Fri Jul 08 02:03:54 GMT 2022","54595","","JIT-Dashboard-004b-CREATEOF-new-column","","JIT-Dashboard-004b-CREATEOF-new-column","[CREATE-OF] As a user, I should add new column in dashboard params","[CREATE-OF] As a user, I should add new column in dashboard params",""
"passed","Fri Jul 08 02:31:24 GMT 2022","Fri Jul 08 02:32:21 GMT 2022","56830","","JIT-API-006b-DELETE-update-info","","JIT-API-006b-DELETE-update-info","As a user, I update info for API DELETE","As a user, I update info for API DELETE",""
"passed","Fri Jul 08 02:10:49 GMT 2022","Fri Jul 08 02:12:02 GMT 2022","73225","","JIT-Database-014-DEFECT-Check-duplicate-table-name","","JIT-Database-014-DEFECT-Check-duplicate-table-name","As a user, I cannot update to duplicate name","As a user, I cannot update to duplicate name",""
"passed","Fri Jul 08 02:36:54 GMT 2022","Fri Jul 08 02:38:06 GMT 2022","72651","","JIT-Module-011b-GUEST-LOGIN-databse-api","","JIT-Module-011b-GUEST-LOGIN-databse-api","[GUEST-LOGIN], I check auto-generate column and api","[GUEST-LOGIN], I check auto-generate column and api",""
"passed","Fri Jul 08 02:33:21 GMT 2022","Fri Jul 08 02:35:43 GMT 2022","142834","","JIT-API-009-Auto-fill","","JIT-API-009-Auto-fill","[AUTO-FILL] As a user, I could add request param by Auto-fill","[AUTO-FILL] As a user, I could add request param by Auto-fill",""
"passed","Fri Jul 08 02:33:46 GMT 2022","Fri Jul 08 02:35:03 GMT 2022","76408","","JIT-Module-006c-SMS-database-api","","JIT-Module-006c-SMS-database-api","[SMS], I check auto-generate column and api","[SMS], I check auto-generate column and api",""
"passed","Fri Jul 08 02:12:16 GMT 2022","Fri Jul 08 02:13:57 GMT 2022","100276","","JIT-Database-015h-INDEX-DATE-column-config","","JIT-Database-015h-INDEX-DATE-column-config","[INDEX-DATE] As a user, I config index from column setting && check on index popup","[INDEX-DATE] As a user, I config index from column setting && check on index popup",""
"passed","Fri Jul 08 02:52:12 GMT 2022","Fri Jul 08 02:54:18 GMT 2022","126795","","JIT-Module-004-EMAIL-LOGIN","","JIT-Module-004-EMAIL-LOGIN","[EMAIL-LOGIN] - Check adding and auto-generated API","[EMAIL-LOGIN] - Check adding and auto-generated API",""
"passed","Fri Jul 08 02:19:10 GMT 2022","Fri Jul 08 02:20:16 GMT 2022","65527","","JIT-Module-005a-FORCE-MOBILE-UPDATE-database","","JIT-Module-005a-FORCE-MOBILE-UPDATE-database","[FORCE-MOBILE-UPDATE] - Check adding and auto-table & columns","[FORCE-MOBILE-UPDATE] - Check adding and auto-table & columns",""
"passed","Fri Jul 08 02:22:03 GMT 2022","Fri Jul 08 02:23:07 GMT 2022","63873","","JIT-Module-015a-SCOUT-default","","JIT-Module-015a-SCOUT-default","[SCOUT] As a user, I can add module Scout and remove it","[SCOUT] As a user, I can add module Scout and remove it",""
"passed","Fri Jul 08 02:15:32 GMT 2022","Fri Jul 08 02:16:17 GMT 2022","45160","","JIT-Mobile-007-Molecule-delete-molecule","","JIT-Mobile-007-Molecule-delete-molecule","As a user, I can delete molecule","As a user, I can delete molecule",""
"passed","Fri Jul 08 02:22:15 GMT 2022","Fri Jul 08 02:23:07 GMT 2022","52098","","JIT-Module-015b-SCOUT-edit-infos","","JIT-Module-015b-SCOUT-edit-infos","[SCOUT] As a user, I can update module Scout","[SCOUT] As a user, I can update module Scout",""
"passed","Fri Jul 08 02:23:36 GMT 2022","Fri Jul 08 02:25:54 GMT 2022","137935","","JIT-Team-001-Invite-and-signup-new-account","","JIT-Team-001-Invite-and-signup-new-account","[INVITE-SIGNUP] Invite new email and sign-up new account and do common action","[INVITE-SIGNUP] Invite new email and sign-up new account and do common action",""
"passed","Fri Jul 08 02:00:56 GMT 2022","Fri Jul 08 02:02:38 GMT 2022","102354","","JIT-Dashboard-002c-LISTOF-saving","","JIT-Dashboard-002c-LISTOF-saving","[LIST-OF] As a user, I should save the selected option when switching between tables","[LIST-OF] As a user, I should save the selected option when switching between tables",""
"passed","Fri Jul 08 02:16:45 GMT 2022","Fri Jul 08 02:18:00 GMT 2022","74877","","JIT-Mobile-015.View.Check-general-info-and-function-of-View","","JIT-Mobile-015.View.Check-general-info-and-function-of-View","As a user, I should check the general infomation of View is correct: Name, Key, unique key, delete component","As a user, I should check the general infomation of View is correct: Name, Key, unique key, delete component",""
"passed","Fri Jul 08 02:28:34 GMT 2022","Fri Jul 08 02:30:00 GMT 2022","86509","","JIT-API-004a-GET-detail-check-default","","JIT-API-004a-GET-detail-check-default","As a user, I check default value in API GET-detail","As a user, I check default value in API GET-detail",""
"passed","Fri Jul 08 02:06:12 GMT 2022","Fri Jul 08 02:07:04 GMT 2022","51591","","JIT-Database-001d-TABLE-update","","JIT-Database-001d-TABLE-update","As a user, I can update the value of the table","As a user, I can update the value of the table",""
"passed","Fri Jul 08 02:06:38 GMT 2022","Fri Jul 08 02:07:29 GMT 2022","51178","","JIT-Database-003-Check-create-empty-and-duplicated-column","","JIT-Database-003-Check-create-empty-and-duplicated-column","As a user, I cannot add empty column definition","As a user, I cannot add empty column definition",""
"passed","Fri Jul 08 02:14:25 GMT 2022","Fri Jul 08 02:17:14 GMT 2022","168303","","JIT-Mobile-004-Screen-duplicate-screen","","JIT-Mobile-004-Screen-duplicate-screen","As a user, I can duplicate screen with positive and negative cases","As a user, I can duplicate screen with positive and negative cases",""
"passed","Fri Jul 08 02:11:50 GMT 2022","Fri Jul 08 02:13:36 GMT 2022","105820","","JIT-Database-015f-INDEX-INTEGER-column-config","","JIT-Database-015f-INDEX-INTEGER-column-config","[INDEX-INTEGER] As a user, I config index from column setting && check on index popup","[INDEX-INTEGER] As a user, I config index from column setting && check on index popup",""
