"Status","Start Time","Stop Time","Duration in ms","Parent Suite","Suite","Sub Suite","Test Class","Test Method","Name","Description"
"passed","Wed Jul 20 00:49:21 GMT 2022","Wed Jul 20 00:50:36 GMT 2022","74983","","JIT-Module-001b-CLOUDINARY-edit-infos","","JIT-Module-001b-CLOUDINARY-edit-infos","As a user, I can update module Cloudinary","As a user, I can update module Cloudinary",""
"passed","Wed Jul 20 01:13:18 GMT 2022","Wed Jul 20 01:14:03 GMT 2022","45528","","JIT-Team-003-Invite-and-resend","","JIT-Team-003-Invite-and-resend","[RESEND-INVITE] Invite new email and resend invitation","[RESEND-INVITE] Invite new email and resend invitation",""
"passed","Wed Jul 20 00:32:28 GMT 2022","Wed Jul 20 00:33:37 GMT 2022","68591","","JIT-Dashboard-006c-DELETEOF-saving","","JIT-Dashboard-006c-DELETEOF-saving","[DELETE-OF] As a user, I should save the selected option when switching between tables","[DELETE-OF] As a user, I should save the selected option when switching between tables",""
"passed","Wed Jul 20 01:17:07 GMT 2022","Wed Jul 20 01:18:22 GMT 2022","75092","","JIT-API-002b-GET-list-update-info","","JIT-API-002b-GET-list-update-info","As a user, I update info for GET-list","As a user, I update info for GET-list",""
"passed","Wed Jul 20 01:34:17 GMT 2022","Wed Jul 20 01:36:09 GMT 2022","112487","","JIT-Export-006-Existing-Scenario-ROR-nokey","","JIT-Export-006-Existing-Scenario-ROR-nokey","As a user, I check export the existing project type ROR no key successfully","As a user, I check export the existing project type ROR no key successfully",""
"failed","Wed Jul 20 01:23:00 GMT 2022","Wed Jul 20 01:25:03 GMT 2022","123212","","JIT-Database-015h-INDEX-DATE-column-config","","JIT-Database-015h-INDEX-DATE-column-config","[INDEX-DATE] As a user, I config index from column setting && check on index popup","[INDEX-DATE] As a user, I config index from column setting && check on index popup",""
"passed","Wed Jul 20 00:44:45 GMT 2022","Wed Jul 20 00:49:21 GMT 2022","275708","","JIT-Mobile-026a-BUTTON-Check-PreviewCode","","JIT-Mobile-026a-BUTTON-Check-PreviewCode","[BUTTON] As a user, I should check Preview code of Button component","[BUTTON] As a user, I should check Preview code of Button component",""
"passed","Wed Jul 20 00:39:40 GMT 2022","Wed Jul 20 00:40:53 GMT 2022","73249","","JIT-Database-015a-INDEX-Check-duplicate-empty","","JIT-Database-015a-INDEX-Check-duplicate-empty","[INDEX] As a user, I check empty and duplicate index","[INDEX] As a user, I check empty and duplicate index",""
"passed","Wed Jul 20 00:28:17 GMT 2022","Wed Jul 20 00:30:31 GMT 2022","133304","","JIT-Dashboard-002e-LISTOF-delete-column","","JIT-Dashboard-002e-LISTOF-delete-column","As a user, I should see the params will be removed when column is deleted","As a user, I should see the params will be removed when column is deleted",""
"passed","Wed Jul 20 01:31:38 GMT 2022","Wed Jul 20 01:35:00 GMT 2022","201947","","JIT-Export-001-Scenario_ROR_1","","JIT-Export-001-Scenario_ROR_1","As a user, I check export the project type ROR no key successfully with scenario 1","As a user, I check export the project type ROR no key successfully with scenario 1",""
"passed","Wed Jul 20 00:48:46 GMT 2022","Wed Jul 20 00:49:38 GMT 2022","51886","","JIT-Module-001a-CLOUDINARY-default","","JIT-Module-001a-CLOUDINARY-default","As a user, I can add module Cloudinary and remove it","As a user, I can add module Cloudinary and remove it",""
"passed","Wed Jul 20 00:36:58 GMT 2022","Wed Jul 20 00:37:55 GMT 2022","56529","","JIT-Database-011a-COLUMN-ENUM-default","","JIT-Database-011a-COLUMN-ENUM-default","[COLUMN] As a user, I should check the basic validation","[COLUMN] As a user, I should check the basic validation",""
"passed","Wed Jul 20 01:09:41 GMT 2022","Wed Jul 20 01:10:59 GMT 2022","77659","","JIT-Module-010b-LINE-LOGIN-databse-api","","JIT-Module-010b-LINE-LOGIN-databse-api","[LINE-LOGIN], I check auto-generate column and api","[LINE-LOGIN], I check auto-generate column and api",""
"passed","Wed Jul 20 01:02:44 GMT 2022","Wed Jul 20 01:04:13 GMT 2022","88203","","JIT-API-007b-GET-list-API-Add-new-endpoint","","JIT-API-007b-GET-list-API-Add-new-endpoint","[GET-list-API] Create, update and delete new GET API endpoint","[GET-list-API] Create, update and delete new GET API endpoint",""
"passed","Wed Jul 20 00:38:32 GMT 2022","Wed Jul 20 00:39:44 GMT 2022","71164","","JIT-Database-012b-RELATION-empty-duplicate","","JIT-Database-012b-RELATION-empty-duplicate","[RELATION], I should see the error duplicate when leaving foreign key empty","[RELATION], I should see the error duplicate when leaving foreign key empty",""
"passed","Wed Jul 20 00:31:14 GMT 2022","Wed Jul 20 00:32:51 GMT 2022","96682","","JIT-Dashboard-005a-UPDATEOF-default","","JIT-Dashboard-005a-UPDATEOF-default","[UPDATE-OF] As a user, I should add default column in dashboard params","[UPDATE-OF] As a user, I should add default column in dashboard params",""
"passed","Wed Jul 20 01:35:05 GMT 2022","Wed Jul 20 01:38:29 GMT 2022","204135","","JIT-Export-002-Scenario-ROR-withkey-1","","JIT-Export-002-Scenario-ROR-withkey-1","As a user, I check export the project type ROR with key successfully with scenario 1","As a user, I check export the project type ROR with key successfully with scenario 1",""
"passed","Wed Jul 20 00:28:19 GMT 2022","Wed Jul 20 00:29:38 GMT 2022","78332","","JIT-Dashboard-003b-DETAILOF-new-column","","JIT-Dashboard-003b-DETAILOF-new-column","[DEATIL-OF] As a user, I should add new column in dashboard params","[DEATIL-OF] As a user, I should add new column in dashboard params",""
"passed","Wed Jul 20 00:29:49 GMT 2022","Wed Jul 20 00:30:59 GMT 2022","70070","","JIT-Dashboard-003c-DETAILOF-saving","","JIT-Dashboard-003c-DETAILOF-saving","[DEATIL-OF] As a user, I should save the selected option when switching between tables","[DEATIL-OF] As a user, I should save the selected option when switching between tables",""
"passed","Wed Jul 20 00:40:45 GMT 2022","Wed Jul 20 00:42:00 GMT 2022","74839","","JIT-Mobile-002-SCREEN-Update","","JIT-Mobile-002-SCREEN-Update","[SCREEN] As a user, I can update screen with positive and negative cases","[SCREEN] As a user, I can update screen with positive and negative cases",""
"passed","Wed Jul 20 00:30:07 GMT 2022","Wed Jul 20 00:31:18 GMT 2022","70270","","JIT-Dashboard-003e-DETAILOF-delete-column","","JIT-Dashboard-003e-DETAILOF-delete-column","[DEATIL-OF] As a user, I should see the params will be removed when column is deleted","[DEATIL-OF] As a user, I should see the params will be removed when column is deleted",""
"passed","Wed Jul 20 00:28:17 GMT 2022","Wed Jul 20 00:29:43 GMT 2022","85954","","JIT-Dashboard-002b-LISTOF-new-column","","JIT-Dashboard-002b-LISTOF-new-column","[LIST-OF] As a user, I should add new column in dashboard params","[LIST-OF] As a user, I should add new column in dashboard params",""
"passed","Wed Jul 20 00:36:53 GMT 2022","Wed Jul 20 00:37:47 GMT 2022","53831","","JIT-Database-008-COLUMN-type-DATE-TIME","","JIT-Database-008-COLUMN-type-DATE-TIME","As a user, I should check the validation of DATE column definition","As a user, I should check the validation of DATE column definition",""
"passed","Wed Jul 20 00:42:20 GMT 2022","Wed Jul 20 00:44:12 GMT 2022","111578","","JIT-Mobile-010-JITDEF14-rename-without-focusing","","JIT-Mobile-010-JITDEF14-rename-without-focusing","[DEFECT] As a user, I could rename the screen/molecule without focusing","[DEFECT] As a user, I could rename the screen/molecule without focusing",""
"passed","Wed Jul 20 00:55:28 GMT 2022","Wed Jul 20 00:56:10 GMT 2022","41677","","JIT-Team-004-Invite-and-delete-invitation","","JIT-Team-004-Invite-and-delete-invitation","[INVITE-DELETE] Invite new email and delete invitation","[INVITE-DELETE] Invite new email and delete invitation",""
"passed","Wed Jul 20 00:54:01 GMT 2022","Wed Jul 20 00:54:51 GMT 2022","49912","","JIT-Module-015a-SCOUT-default","","JIT-Module-015a-SCOUT-default","[SCOUT] As a user, I can add module Scout and remove it","[SCOUT] As a user, I can add module Scout and remove it",""
"passed","Wed Jul 20 00:51:18 GMT 2022","Wed Jul 20 00:53:18 GMT 2022","120227","","JIT-Module-008a-FB-LOGIN-default-edit","","JIT-Module-008a-FB-LOGIN-default-edit","[FACEBOOK-LOGIN], I can add module Facebook Login and edit its infos","[FACEBOOK-LOGIN], I can add module Facebook Login and edit its infos",""
"passed","Wed Jul 20 00:28:17 GMT 2022","Wed Jul 20 00:29:56 GMT 2022","98698","","JIT-Dashboard-002d-LISTOF-delete-table","","JIT-Dashboard-002d-LISTOF-delete-table","[LIST-OF] As a user, I should see the table is not displayed in dashboard list after removed","[LIST-OF] As a user, I should see the table is not displayed in dashboard list after removed",""
"passed","Wed Jul 20 00:34:39 GMT 2022","Wed Jul 20 00:35:36 GMT 2022","57338","","JIT-Database-003b-COLUMN-duplicated","","JIT-Database-003b-COLUMN-duplicated","[COLUMN] As a user, I cannot add duplicated column definition","[COLUMN] As a user, I cannot add duplicated column definition",""
"passed","Wed Jul 20 01:07:36 GMT 2022","Wed Jul 20 01:10:07 GMT 2022","151086","","JIT-Module-004-EMAIL-LOGIN","","JIT-Module-004-EMAIL-LOGIN","[EMAIL-LOGIN] - Check adding and auto-generated API","[EMAIL-LOGIN] - Check adding and auto-generated API",""
"passed","Wed Jul 20 00:34:09 GMT 2022","Wed Jul 20 00:35:09 GMT 2022","59323","","JIT-Database-001c-TABLE-duplicate","","JIT-Database-001c-TABLE-duplicate","[TABLE] As a user, I cannot create table with duplicate name","[TABLE] As a user, I cannot create table with duplicate name",""
"passed","Wed Jul 20 00:53:40 GMT 2022","Wed Jul 20 00:54:32 GMT 2022","52618","","JIT-Module-014b-BASIC-AUTH-edit-infos","","JIT-Module-014b-BASIC-AUTH-edit-infos","[BASIC-AUTH] As a user, I can update module Basic Authentication","[BASIC-AUTH] As a user, I can update module Basic Authentication",""
"passed","Wed Jul 20 00:38:12 GMT 2022","Wed Jul 20 00:39:33 GMT 2022","81314","","JIT-Database-011e-COLUMN-ENUM-delete-all","","JIT-Database-011e-COLUMN-ENUM-delete-all","[COLUMN] As a user, I should delete all items and check all items are not displayed","[COLUMN] As a user, I should delete all items and check all items are not displayed",""
"passed","Wed Jul 20 01:31:52 GMT 2022","Wed Jul 20 01:39:38 GMT 2022","465540","","JIT-Export-003-Scenario_ROR_2","","JIT-Export-003-Scenario_ROR_2","As a user, I check export the project type ROR no key successfully with scenario 2","As a user, I check export the project type ROR no key successfully with scenario 2",""
"passed","Wed Jul 20 00:37:23 GMT 2022","Wed Jul 20 00:38:24 GMT 2022","60450","","JIT-Database-011c-COLUMN-ENUM-delete-items","","JIT-Database-011c-COLUMN-ENUM-delete-items","[COLUMN] As a user, I should delete 1 item and check not display in default dropdown","[COLUMN] As a user, I should delete 1 item and check not display in default dropdown",""
"passed","Wed Jul 20 00:44:47 GMT 2022","Wed Jul 20 00:47:37 GMT 2022","169772","","JIT-Mobile-027a-IMAGE-Check-PreviewCode","","JIT-Mobile-027a-IMAGE-Check-PreviewCode","[IMAGE] As a user, I should check Preview code of Image component","[IMAGE] As a user, I should check Preview code of Image component",""
"passed","Wed Jul 20 00:44:06 GMT 2022","Wed Jul 20 00:45:59 GMT 2022","113680","","JIT-Mobile-016c-VIEW-Check-PreviewCode","","JIT-Mobile-016c-VIEW-Check-PreviewCode","[VIEW] As a user, I should check Preview code of View component","[VIEW] As a user, I should check Preview code of View component",""
"passed","Wed Jul 20 00:54:54 GMT 2022","Wed Jul 20 00:57:10 GMT 2022","136814","","JIT-Team-001-Invite-and-signup-new-account","","JIT-Team-001-Invite-and-signup-new-account","[INVITE-SIGNUP] Invite new email and sign-up new account and do common action","[INVITE-SIGNUP] Invite new email and sign-up new account and do common action",""
"passed","Wed Jul 20 00:42:33 GMT 2022","Wed Jul 20 00:43:33 GMT 2022","59879","","JIT-Mobile-012-JITDEF-remove-poperty-info-after-deleting-navigation","","JIT-Mobile-012-JITDEF-remove-poperty-info-after-deleting-navigation","[DEFECT] As a user, I should see the property infos need to be removed after the navigation was deleted","[DEFECT] As a user, I should see the property infos need to be removed after the navigation was deleted",""
"passed","Wed Jul 20 01:13:18 GMT 2022","Wed Jul 20 01:15:28 GMT 2022","130134","","JIT-Database-007-COLUMN-type-TEXT","","JIT-Database-007-COLUMN-type-TEXT","[COLUMN] As a user, I should check the validation of TEXT column definition","[COLUMN] As a user, I should check the validation of TEXT column definition",""
"passed","Wed Jul 20 01:00:58 GMT 2022","Wed Jul 20 01:02:25 GMT 2022","86514","","JIT-API-006a-DELETE-check-default","","JIT-API-006a-DELETE-check-default","As a user, I check default value in API DELETE","As a user, I check default value in API DELETE",""
"passed","Wed Jul 20 00:45:44 GMT 2022","Wed Jul 20 00:49:04 GMT 2022","199605","","JIT-Mobile-030a-WEBVIEW-Check-PreviewCode","","JIT-Mobile-030a-WEBVIEW-Check-PreviewCode","[WEBVIEW] As a user, I should check the Preview code of WebView component","[WEBVIEW] As a user, I should check the Preview code of WebView component",""
"passed","Wed Jul 20 00:49:32 GMT 2022","Wed Jul 20 00:50:50 GMT 2022","77636","","JIT-Module-002b-DEEPLINK-edit-infos","","JIT-Module-002b-DEEPLINK-edit-infos","As a user, I can update module Deeplink","As a user, I can update module Deeplink",""
"passed","Wed Jul 20 00:42:19 GMT 2022","Wed Jul 20 00:43:19 GMT 2022","59770","","JIT-Mobile-011-JITDEF50-disable-add-duplicate-screen-in-stack","","JIT-Mobile-011-JITDEF50-disable-add-duplicate-screen-in-stack","[DEFECT] As a user, I could add duplicate screen in stack","[DEFECT] As a user, I could add duplicate screen in stack",""
"passed","Wed Jul 20 00:41:13 GMT 2022","Wed Jul 20 00:44:09 GMT 2022","175210","","JIT-Mobile-004-SCREEN-duplicate","","JIT-Mobile-004-SCREEN-duplicate","[SCREEN] As a user, I can duplicate screen with positive and negative cases","[SCREEN] As a user, I can duplicate screen with positive and negative cases",""
"passed","Wed Jul 20 01:20:03 GMT 2022","Wed Jul 20 01:21:26 GMT 2022","82866","","JIT-Database-015f-INDEX-INTEGER-column-config","","JIT-Database-015f-INDEX-INTEGER-column-config","[INDEX-INTEGER] As a user, I config index from column setting && check on index popup","[INDEX-INTEGER] As a user, I config index from column setting && check on index popup",""
"passed","Wed Jul 20 00:40:33 GMT 2022","Wed Jul 20 00:42:12 GMT 2022","99213","","JIT-Database-016b-COUNTER-CACHE-Create-by-adding-column","","JIT-Database-016b-COUNTER-CACHE-Create-by-adding-column","[COUNTER-CACHE] create new counter cache column by adding column","[COUNTER-CACHE] create new counter cache column by adding column",""
"passed","Wed Jul 20 00:30:41 GMT 2022","Wed Jul 20 00:31:58 GMT 2022","76893","","JIT-Dashboard-004c-CREATEOF-saving","","JIT-Dashboard-004c-CREATEOF-saving","[CREATE-OF] As a user, I should save the selected option when switching between tables","[CREATE-OF] As a user, I should save the selected option when switching between tables",""
"passed","Wed Jul 20 00:40:00 GMT 2022","Wed Jul 20 00:41:12 GMT 2022","72677","","JIT-Database-015b-INDEX-CRUD-single","","JIT-Database-015b-INDEX-CRUD-single","[INDEX] As a user, I check add and update multiple index","[INDEX] As a user, I check add and update multiple index",""
"passed","Wed Jul 20 00:58:09 GMT 2022","Wed Jul 20 00:59:02 GMT 2022","52982","","JIT-API-001-Check-general-info","","JIT-API-001-Check-general-info","As a user, I check general info","As a user, I check general info",""
"passed","Wed Jul 20 01:36:16 GMT 2022","Wed Jul 20 01:37:00 GMT 2022","44776","","JIT-Export-007-Existing-Scenario-ROR-withkey","","JIT-Export-007-Existing-Scenario-ROR-withkey","As a user, I check export the existing project type ROR with key successfully","As a user, I check export the existing project type ROR with key successfully",""
"passed","Wed Jul 20 01:01:40 GMT 2022","Wed Jul 20 01:02:38 GMT 2022","57976","","JIT-API-006b-DELETE-update-info","","JIT-API-006b-DELETE-update-info","As a user, I update info for API DELETE","As a user, I update info for API DELETE",""
"passed","Wed Jul 20 00:40:08 GMT 2022","Wed Jul 20 00:41:32 GMT 2022","83892","","JIT-Database-015c-INDEX-CRUD-multiple","","JIT-Database-015c-INDEX-CRUD-multiple","[INDEX] As a user, I check add and update single index","[INDEX] As a user, I check add and update single index",""
"passed","Wed Jul 20 00:31:54 GMT 2022","Wed Jul 20 00:33:58 GMT 2022","123978","","JIT-Dashboard-005d-UPDATEOF-delete-table","","JIT-Dashboard-005d-UPDATEOF-delete-table","[UPDATE-OF] As a user, I should see the table is not displayed in dashboard list after removed","[UPDATE-OF] As a user, I should see the table is not displayed in dashboard list after removed",""
"passed","Wed Jul 20 00:37:45 GMT 2022","Wed Jul 20 00:38:47 GMT 2022","61365","","JIT-Database-011d-COLUMN-ENUM-delete-selected-items","","JIT-Database-011d-COLUMN-ENUM-delete-selected-items","[COLUMN] As a user, I should delete 1 selected item and check is will be removed in default dropdown","[COLUMN] As a user, I should delete 1 selected item and check is will be removed in default dropdown",""
"passed","Wed Jul 20 00:40:57 GMT 2022","Wed Jul 20 00:41:41 GMT 2022","44814","","JIT-Mobile-003-SCREEN-Delete","","JIT-Mobile-003-SCREEN-Delete","[SCREEN] As a user, I can delete screen","[SCREEN] As a user, I can delete screen",""
"passed","Wed Jul 20 00:33:24 GMT 2022","Wed Jul 20 00:34:37 GMT 2022","72532","","JIT-Dashboard-006e-DELETEOF-delete-column","","JIT-Dashboard-006e-DELETEOF-delete-column","[DELETE-OF] As a user, I should see the params will be removed when column is deleted","[DELETE-OF] As a user, I should see the params will be removed when column is deleted",""
"passed","Wed Jul 20 01:10:18 GMT 2022","Wed Jul 20 01:11:23 GMT 2022","64509","","JIT-Module-011b-GUEST-LOGIN-databse-api","","JIT-Module-011b-GUEST-LOGIN-databse-api","[GUEST-LOGIN], I check auto-generate column and api","[GUEST-LOGIN], I check auto-generate column and api",""
"passed","Wed Jul 20 00:28:17 GMT 2022","Wed Jul 20 00:30:13 GMT 2022","116401","","JIT-Dashboard-002a-LISTOF-default-column","","JIT-Dashboard-002a-LISTOF-default-column","[LIST-OF] As a user, I should add default column in dashboard params","[LIST-OF] As a user, I should add default column in dashboard params",""
"passed","Wed Jul 20 00:31:42 GMT 2022","Wed Jul 20 00:33:45 GMT 2022","123032","","JIT-Dashboard-005c-UPDATEOF-saving","","JIT-Dashboard-005c-UPDATEOF-saving","[UPDATE-OF] As a user, I should save the selected option when switching between tables","[UPDATE-OF] As a user, I should save the selected option when switching between tables",""
"passed","Wed Jul 20 01:15:36 GMT 2022","Wed Jul 20 01:17:01 GMT 2022","85300","","JIT-API-002a-GET-list-check-default","","JIT-API-002a-GET-list-check-default","As a user, I check default value in API GET list","As a user, I check default value in API GET list",""
"passed","Wed Jul 20 00:46:26 GMT 2022","Wed Jul 20 00:48:21 GMT 2022","114357","","JIT-Mobile-031a-DIVIDER-Check-PreviewCode","","JIT-Mobile-031a-DIVIDER-Check-PreviewCode","[DIVIDER] As a user, I should check the Preview code of Divider component","[DIVIDER] As a user, I should check the Preview code of Divider component",""
"passed","Wed Jul 20 00:53:17 GMT 2022","Wed Jul 20 00:54:11 GMT 2022","53865","","JIT-Module-013b-AWS-edit-infos","","JIT-Module-013b-AWS-edit-infos","[AWS] As a user, I can update module AWS SES Integration","[AWS] As a user, I can update module AWS SES Integration",""
"passed","Wed Jul 20 00:30:28 GMT 2022","Wed Jul 20 00:31:35 GMT 2022","66771","","JIT-Dashboard-004b-CREATEOF-new-column","","JIT-Dashboard-004b-CREATEOF-new-column","[CREATE-OF] As a user, I should add new column in dashboard params","[CREATE-OF] As a user, I should add new column in dashboard params",""
"passed","Wed Jul 20 00:34:21 GMT 2022","Wed Jul 20 00:35:56 GMT 2022","95383","","JIT-Database-002-COLUMN-default","","JIT-Database-002-COLUMN-default","[COLUMN] As a user, I should see the default column definition","[COLUMN] As a user, I should see the default column definition",""
"passed","Wed Jul 20 00:54:39 GMT 2022","Wed Jul 20 00:55:37 GMT 2022","58470","","JIT-Module-017a-GOOGLE-ANAL-default","","JIT-Module-017a-GOOGLE-ANAL-default","[GOOGLE-ANAL] As a user, I can add module Google Analytics and remove it","[GOOGLE-ANAL] As a user, I can add module Google Analytics and remove it",""
"passed","Wed Jul 20 00:52:13 GMT 2022","Wed Jul 20 00:54:10 GMT 2022","116829","","JIT-Module-010a-LINE-LOGIN-default-edit","","JIT-Module-010a-LINE-LOGIN-default-edit","[LINE-LOGIN], I can add module Line Login and edit its infos","[LINE-LOGIN], I can add module Line Login and edit its infos",""
"passed","Wed Jul 20 00:37:11 GMT 2022","Wed Jul 20 00:38:09 GMT 2022","58143","","JIT-Database-011b-COLUMN-ENUM-add-items","","JIT-Database-011b-COLUMN-ENUM-add-items","[COLUMN] As a user, I should add new item and select in default dropdown","[COLUMN] As a user, I should add new item and select in default dropdown",""
