"Status","Start Time","Stop Time","Duration in ms","Parent Suite","Suite","Sub Suite","Test Class","Test Method","Name","Description"
"passed","Thu Dec 22 18:25:23 GMT 2022","Thu Dec 22 18:26:46 GMT 2022","83424","","JIT-Mobile-015-VIEW-General-info","","JIT-Mobile-015-VIEW-General-info","[MOBILE-VIEW] As a user, I should check the general infomation of View is correct: Name, Key, unique key, delete component","[MOBILE-VIEW] As a user, I should check the general infomation of View is correct: Name, Key, unique key, delete component",""
"passed","Thu Dec 22 19:41:07 GMT 2022","Thu Dec 22 19:42:09 GMT 2022","62144","","JIT-Module-006a-SMS-default","","JIT-Module-006a-SMS-default","[SMS], I can add module SMS login with Twilio and remove it","[SMS], I can add module SMS login with Twilio and remove it",""
"passed","Thu Dec 22 19:09:18 GMT 2022","Thu Dec 22 19:10:47 GMT 2022","89686","","JIT-Database-015e-INDEX-TEXT-column-config","","JIT-Database-015e-INDEX-TEXT-column-config","[INDEX-TEXT] As a user, I config index from column setting && check on index popup","[INDEX-TEXT] As a user, I config index from column setting && check on index popup",""
"passed","Thu Dec 22 19:03:55 GMT 2022","Thu Dec 22 19:05:59 GMT 2022","124203","","JIT-API-007ba-GET-list-API-Add-new-endpoint","","JIT-API-007ba-GET-list-API-Add-new-endpoint","[GET-list-API] Create, update and delete new GET API endpoint","[GET-list-API] Create, update and delete new GET API endpoint",""
"passed","Thu Dec 22 18:33:50 GMT 2022","Thu Dec 22 18:35:21 GMT 2022","90975","","JIT-Mobile-034b-SCROLLVIEW-General-info","","JIT-Mobile-034b-SCROLLVIEW-General-info","[MOBILE-SCROLLVIEW] As a user, I should check the general infomation of Scroll View is correct: Name, Key, unique key, delete component","[MOBILE-SCROLLVIEW] As a user, I should check the general infomation of Scroll View is correct: Name, Key, unique key, delete component",""
"passed","Thu Dec 22 18:17:59 GMT 2022","Thu Dec 22 18:20:45 GMT 2022","166675","","JIT-Database-012d-RELATION-multiple-2-direction","","JIT-Database-012d-RELATION-multiple-2-direction","[RELATION], I should add multiple relation 2 directions","[RELATION], I should add multiple relation 2 directions",""
"passed","Thu Dec 22 18:11:17 GMT 2022","Thu Dec 22 18:12:20 GMT 2022","63020","","JIT-Database-003b-COLUMN-duplicated","","JIT-Database-003b-COLUMN-duplicated","[COLUMN] As a user, I cannot add duplicated column definition","[COLUMN] As a user, I cannot add duplicated column definition",""
"passed","Thu Dec 22 18:12:28 GMT 2022","Thu Dec 22 18:14:58 GMT 2022","150877","","JIT-Database-004-COLUMN-type-INTEGER","","JIT-Database-004-COLUMN-type-INTEGER","[COLUMN] As a user, I should check the validation of INTEGER column definition","[COLUMN] As a user, I should check the validation of INTEGER column definition",""
"passed","Thu Dec 22 18:35:36 GMT 2022","Thu Dec 22 18:37:57 GMT 2022","140995","","JIT-Mobile-042a-ACTION-NAVIGATION-no-param","","JIT-Mobile-042a-ACTION-NAVIGATION-no-param","[MOBILE-ACTION-NAVIGATION] As a user, I could add action type navigation without params and check preview code","[MOBILE-ACTION-NAVIGATION] As a user, I could add action type navigation without params and check preview code",""
"passed","Thu Dec 22 20:11:53 GMT 2022","Thu Dec 22 20:22:05 GMT 2022","612357","","JIT-Export-010c-Export-NextJS-TODO","","JIT-Export-010c-Export-NextJS-TODO","[SMOKE] As a user, I check exprting project TODO with NextJS","[SMOKE] As a user, I check exprting project TODO with NextJS",""
"passed","Thu Dec 22 20:00:54 GMT 2022","Thu Dec 22 20:01:35 GMT 2022","41903","","JIT-Export-006-Existing-Scenario-ROR-nokey","","JIT-Export-006-Existing-Scenario-ROR-nokey","As a user, I check export the existing project type ROR no key successfully","As a user, I check export the existing project type ROR no key successfully",""
"passed","Thu Dec 22 18:40:24 GMT 2022","Thu Dec 22 18:41:55 GMT 2022","91253","","JIT-Module-006b-SMS-edit-infos","","JIT-Module-006b-SMS-edit-infos","[SMS], I can add module SMS login with Twilio and edit its infos","[SMS], I can add module SMS login with Twilio and edit its infos",""
"passed","Thu Dec 22 18:54:42 GMT 2022","Thu Dec 22 18:58:01 GMT 2022","199394","","JIT-Web-002e-MOLECULE-Search","","JIT-Web-002e-MOLECULE-Search","[WEB-PAGE] As a user, I can search correct molecule with keyword","[WEB-PAGE] As a user, I can search correct molecule with keyword",""
"passed","Thu Dec 22 18:15:38 GMT 2022","Thu Dec 22 18:17:02 GMT 2022","83681","","JIT-Database-011b-COLUMN-ENUM-add-items","","JIT-Database-011b-COLUMN-ENUM-add-items","[COLUMN] As a user, I should add new item and select in default dropdown","[COLUMN] As a user, I should add new item and select in default dropdown",""
"passed","Thu Dec 22 18:20:52 GMT 2022","Thu Dec 22 18:22:39 GMT 2022","106953","","JIT-Mobile-001-SCREEN-Create-new","","JIT-Mobile-001-SCREEN-Create-new","[MOBILE-SCREEN] As a user, I can create new screen with positive and negative cases","[MOBILE-SCREEN] As a user, I can create new screen with positive and negative cases",""
"broken","Thu Dec 22 19:44:39 GMT 2022","Thu Dec 22 19:48:47 GMT 2022","247434","","JIT-Mobile-012-JITDEF-remove-poperty-info-after-deleting-navigation","","JIT-Mobile-012-JITDEF-remove-poperty-info-after-deleting-navigation","[DEFECT] As a user, I should see the property infos need to be removed after the navigation was deleted","[DEFECT] As a user, I should see the property infos need to be removed after the navigation was deleted",""
"passed","Thu Dec 22 18:27:09 GMT 2022","Thu Dec 22 18:28:14 GMT 2022","65414","","JIT-Mobile-021-DEFECT.Params.keep-params-after-refresh-page","","JIT-Mobile-021-DEFECT.Params.keep-params-after-refresh-page","[DEFECT] As a user, I should check the params will be kept after refresh page","[DEFECT] As a user, I should check the params will be kept after refresh page",""
"passed","Thu Dec 22 18:18:42 GMT 2022","Thu Dec 22 18:20:05 GMT 2022","83534","","JIT-Database-015a-INDEX-Check-duplicate-empty","","JIT-Database-015a-INDEX-Check-duplicate-empty","[INDEX] As a user, I check empty and duplicate index","[INDEX] As a user, I check empty and duplicate index",""
"passed","Thu Dec 22 18:30:37 GMT 2022","Thu Dec 22 18:32:12 GMT 2022","95011","","JIT-Mobile-028b-ICON-General-info","","JIT-Mobile-028b-ICON-General-info","[MOBILE-ICON] As a user, I should check the general infomation of Icon is correct: Name, Key, unique key, delete component","[MOBILE-ICON] As a user, I should check the general infomation of Icon is correct: Name, Key, unique key, delete component",""
"passed","Thu Dec 22 18:55:47 GMT 2022","Thu Dec 22 18:59:11 GMT 2022","204475","","JIT-Web-004a-ACTION-NAVIGATION-no-param","","JIT-Web-004a-ACTION-NAVIGATION-no-param","[WEB-ACTION-NAVIGATION] As a user, I could add action type navigation without params and check preview code","[WEB-ACTION-NAVIGATION] As a user, I could add action type navigation without params and check preview code",""
"passed","Thu Dec 22 19:10:35 GMT 2022","Thu Dec 22 19:12:02 GMT 2022","87627","","JIT-Database-015h-INDEX-DATE-column-config","","JIT-Database-015h-INDEX-DATE-column-config","[INDEX-DATE] As a user, I config index from column setting && check on index popup","[INDEX-DATE] As a user, I config index from column setting && check on index popup",""
"passed","Thu Dec 22 18:23:09 GMT 2022","Thu Dec 22 18:26:03 GMT 2022","173751","","JIT-Mobile-005b-MOLECULE-Navigate-edit-screen","","JIT-Mobile-005b-MOLECULE-Navigate-edit-screen","[MOBILE-MOLECULE-EDIT] As a user, I can see the molecule in Screen and use Edit button see the content of this molecule","[MOBILE-MOLECULE-EDIT] As a user, I can see the molecule in Screen and use Edit button see the content of this molecule",""
"passed","Thu Dec 22 18:44:39 GMT 2022","Thu Dec 22 18:46:14 GMT 2022","94620","","JIT-Module-014b-BASIC-AUTH-edit-infos","","JIT-Module-014b-BASIC-AUTH-edit-infos","[BASIC-AUTH] As a user, I can update module Basic Authentication","[BASIC-AUTH] As a user, I can update module Basic Authentication",""
"passed","Thu Dec 22 19:41:06 GMT 2022","Thu Dec 22 19:41:40 GMT 2022","34102","","JIT-Module-013a-AWS-default","","JIT-Module-013a-AWS-default","[AWS] As a user, I can add module AWS SES Integration and remove it","[AWS] As a user, I can add module AWS SES Integration and remove it",""
"passed","Thu Dec 22 19:01:32 GMT 2022","Thu Dec 22 19:02:50 GMT 2022","78433","","JIT-API-002c-GET-list","","JIT-API-002c-GET-list","As a user, I check column display when having relation for GET-list","As a user, I check column display when having relation for GET-list",""
"passed","Thu Dec 22 18:21:08 GMT 2022","Thu Dec 22 18:23:37 GMT 2022","149181","","JIT-Mobile-001a-SCREEN-Search","","JIT-Mobile-001a-SCREEN-Search","[MOBILE-SCREEN] As a user, I can search correct screen with keyword","[MOBILE-SCREEN] As a user, I can search correct screen with keyword",""
"passed","Thu Dec 22 18:11:17 GMT 2022","Thu Dec 22 18:12:04 GMT 2022","47295","","JIT-Database-003a-COLUMN-empty","","JIT-Database-003a-COLUMN-empty","[COLUMN] As a user, I cannot add empty column definition","[COLUMN] As a user, I cannot add empty column definition",""
"passed","Thu Dec 22 18:18:40 GMT 2022","Thu Dec 22 18:20:09 GMT 2022","89106","","JIT-Database-014-DEFECT-Check-duplicate-table-name","","JIT-Database-014-DEFECT-Check-duplicate-table-name","[DEFECT] As a user, I cannot update to duplicate name","[DEFECT] As a user, I cannot update to duplicate name",""
"passed","Thu Dec 22 19:01:21 GMT 2022","Thu Dec 22 19:03:34 GMT 2022","132987","","JIT-API-002b-GET-list-update-info","","JIT-API-002b-GET-list-update-info","As a user, I update info for GET-list","As a user, I update info for GET-list",""
"passed","Thu Dec 22 19:01:20 GMT 2022","Thu Dec 22 19:02:36 GMT 2022","76039","","JIT-API-001-Check-general-info","","JIT-API-001-Check-general-info","As a user, I check general info","As a user, I check general info",""
"passed","Thu Dec 22 18:45:35 GMT 2022","Thu Dec 22 18:46:35 GMT 2022","60217","","JIT-Module-016a-SENDGRID-default","","JIT-Module-016a-SENDGRID-default","[SENDGRID] As a user, I can add module SendGrid and remove it","[SENDGRID] As a user, I can add module SendGrid and remove it",""
"broken","Thu Dec 22 19:52:29 GMT 2022","Thu Dec 22 19:54:15 GMT 2022","106122","","JIT-Mobile-043a-ACTION-AUTHENTICATION-PHONE-no-param","","JIT-Mobile-043a-ACTION-AUTHENTICATION-PHONE-no-param","[MOBILE-ACTION-AUTHENTICATION-PHONE] As a user, I could add action type authentication without params and check preview code","[MOBILE-ACTION-AUTHENTICATION-PHONE] As a user, I could add action type authentication without params and check preview code",""
"passed","Thu Dec 22 18:46:55 GMT 2022","Thu Dec 22 18:47:57 GMT 2022","62422","","JIT-Module-019a-GOOGLE-ANALYTICS-default","","JIT-Module-019a-GOOGLE-ANALYTICS-default","[GOOGLE-ANALYTICS] As a user, I can add module Google Analytics and remove it","[GOOGLE-ANALYTICS] As a user, I can add module Google Analytics and remove it",""
"passed","Thu Dec 22 19:06:04 GMT 2022","Thu Dec 22 19:07:23 GMT 2022","78187","","JIT-API-007f-DELETE-API-Add-new-endpoint","","JIT-API-007f-DELETE-API-Add-new-endpoint","[DELETE-API] Create, update and delete new DELETE API endpoint","[DELETE-API] Create, update and delete new DELETE API endpoint",""
"passed","Thu Dec 22 19:57:06 GMT 2022","Thu Dec 22 19:58:54 GMT 2022","108569","","JIT-Export-005a-Scenario-RN-login-screen","","JIT-Export-005a-Scenario-RN-login-screen","[RN-Login-screen] As a user, I check export the project type React Native and Nextjs successfully with scenario 1","[RN-Login-screen] As a user, I check export the project type React Native and Nextjs successfully with scenario 1",""
"passed","Thu Dec 22 18:43:59 GMT 2022","Thu Dec 22 18:45:21 GMT 2022","81546","","JIT-Module-013b-AWS-edit-infos","","JIT-Module-013b-AWS-edit-infos","[AWS] As a user, I can update module AWS SES Integration","[AWS] As a user, I can update module AWS SES Integration",""
"passed","Thu Dec 22 19:04:01 GMT 2022","Thu Dec 22 19:05:40 GMT 2022","98564","","JIT-API-007c-GET-detail-API-Add-new-endpoint","","JIT-API-007c-GET-detail-API-Add-new-endpoint","[GET-detail-API] Create, update and delete new GET API endpoint","[GET-detail-API] Create, update and delete new GET API endpoint",""
"passed","Thu Dec 22 18:23:44 GMT 2022","Thu Dec 22 18:25:03 GMT 2022","78914","","JIT-Mobile-007-MOLECULE-Delete","","JIT-Mobile-007-MOLECULE-Delete","[MOBILE-MOLECULE] As a user, I can delete molecule","[MOBILE-MOLECULE] As a user, I can delete molecule",""
"passed","Thu Dec 22 18:57:28 GMT 2022","Thu Dec 22 19:00:46 GMT 2022","198229","","JIT-Web-007b-ASSET-Rename-and-delete","","JIT-Web-007b-ASSET-Rename-and-delete","[ASSET] As a user, I can rename and delete image asset","[ASSET] As a user, I can rename and delete image asset",""
"passed","Thu Dec 22 18:46:50 GMT 2022","Thu Dec 22 18:49:30 GMT 2022","160191","","JIT-Module-018c-ADMIN-DASHBOARD-USER-column-infos","","JIT-Module-018c-ADMIN-DASHBOARD-USER-column-infos","[ADMIN-DASHBOARD-USER], I check the column infos from Admin Dashboard User","[ADMIN-DASHBOARD-USER], I check the column infos from Admin Dashboard User",""
"passed","Thu Dec 22 18:54:44 GMT 2022","Thu Dec 22 18:56:21 GMT 2022","96955","","JIT-Web-002f-MOLECULE-Navigate-edit-screen","","JIT-Web-002f-MOLECULE-Navigate-edit-screen","[WEB-MOLECULE-EDIT] As a user, I can see the molecule in Page and use Edit button see the content of this molecule","[WEB-MOLECULE-EDIT] As a user, I can see the molecule in Page and use Edit button see the content of this molecule",""
"passed","Thu Dec 22 18:31:38 GMT 2022","Thu Dec 22 18:34:41 GMT 2022","183805","","JIT-Mobile-031a-DIVIDER-Check-PreviewCode","","JIT-Mobile-031a-DIVIDER-Check-PreviewCode","[MOBILE-DIVIDER] As a user, I should check the Preview code of Divider component","[MOBILE-DIVIDER] As a user, I should check the Preview code of Divider component",""
"passed","Thu Dec 22 18:48:45 GMT 2022","Thu Dec 22 18:50:37 GMT 2022","112334","","JIT-Team-005-Invite-duplicate-email","","JIT-Team-005-Invite-duplicate-email","[INVITE-DELETE] Invite new email and invite again","[INVITE-DELETE] Invite new email and invite again",""
"passed","Thu Dec 22 20:00:28 GMT 2022","Thu Dec 22 20:03:40 GMT 2022","192045","","JIT-Export-004-Scenario_ROR_2","","JIT-Export-004-Scenario_ROR_2","As a user, I check export the project type ROR with key successfully with scenario 2","As a user, I check export the project type ROR with key successfully with scenario 2",""
"passed","Thu Dec 22 18:27:11 GMT 2022","Thu Dec 22 18:28:20 GMT 2022","68290","","JIT-Mobile-022a-TEXT-General-info","","JIT-Mobile-022a-TEXT-General-info","[MOBILE-TEXT] As a user, I should check the general infomation of Text is correct: Name, Key, unique key, delete component","[MOBILE-TEXT] As a user, I should check the general infomation of Text is correct: Name, Key, unique key, delete component",""
"passed","Thu Dec 22 19:42:59 GMT 2022","Thu Dec 22 19:44:31 GMT 2022","91881","","JIT-Module-018a-ADMIN-DASHBOARD-USER-default","","JIT-Module-018a-ADMIN-DASHBOARD-USER-default","[ADMIN-DASHBOARD-USER], I can add module Admin dashboard user and remove it","[ADMIN-DASHBOARD-USER], I can add module Admin dashboard user and remove it",""
"passed","Thu Dec 22 19:09:53 GMT 2022","Thu Dec 22 19:11:22 GMT 2022","88969","","JIT-Database-015g-INDEX-FLOAT-column-config","","JIT-Database-015g-INDEX-FLOAT-column-config","[INDEX-FLOAT] As a user, I config index from column setting && check on index popup","[INDEX-FLOAT] As a user, I config index from column setting && check on index popup",""
"passed","Thu Dec 22 18:31:10 GMT 2022","Thu Dec 22 18:32:53 GMT 2022","102449","","JIT-Mobile-029b-TOUCHABLE-General-info","","JIT-Mobile-029b-TOUCHABLE-General-info","[MOBILE-TOUCHABLE] As a user, I should check the general infomation of Touchable is correct: Name, Key, unique key, delete component","[MOBILE-TOUCHABLE] As a user, I should check the general infomation of Touchable is correct: Name, Key, unique key, delete component",""
"passed","Thu Dec 22 18:42:50 GMT 2022","Thu Dec 22 18:44:48 GMT 2022","118121","","JIT-Module-011a-GUEST-LOGIN-default-edit","","JIT-Module-011a-GUEST-LOGIN-default-edit","[GUEST-LOGIN], I can add module Guest Login and edit its infos","[GUEST-LOGIN], I can add module Guest Login and edit its infos",""
"passed","Thu Dec 22 18:30:28 GMT 2022","Thu Dec 22 18:33:17 GMT 2022","168511","","JIT-Mobile-028a-ICON-Check-PreviewCode","","JIT-Mobile-028a-ICON-Check-PreviewCode","[MOBILE-ICON] As a user, I should check the Preview code of Icon component","[MOBILE-ICON] As a user, I should check the Preview code of Icon component",""
"passed","Thu Dec 22 19:03:55 GMT 2022","Thu Dec 22 19:04:41 GMT 2022","46130","","JIT-API-007a-GROUP-API-CRUD","","JIT-API-007a-GROUP-API-CRUD","[GROUP-API] Create, update and delete group API","[GROUP-API] Create, update and delete group API",""
"passed","Thu Dec 22 18:17:24 GMT 2022","Thu Dec 22 18:18:54 GMT 2022","89131","","JIT-Database-012a-RELATION-basic","","JIT-Database-012a-RELATION-basic","[RELATION] check the basic relation","[RELATION] check the basic relation",""
"passed","Thu Dec 22 18:51:07 GMT 2022","Thu Dec 22 18:53:28 GMT 2022","140836","","JIT-Web-001g-PAGE-[FIGMA]-Import","","JIT-Web-001g-PAGE-[FIGMA]-Import","[PAGE-FIGMA] As a user, I can import the figma file to the jitera studio","[PAGE-FIGMA] As a user, I can import the figma file to the jitera studio",""
"passed","Thu Dec 22 18:45:55 GMT 2022","Thu Dec 22 18:47:04 GMT 2022","68983","","JIT-Module-016b-SENDGRID-edit-infos","","JIT-Module-016b-SENDGRID-edit-infos","[SENDGRID] As a user, I can update module SendGrid","[SENDGRID] As a user, I can update module SendGrid",""
"passed","Thu Dec 22 18:15:10 GMT 2022","Thu Dec 22 18:16:35 GMT 2022","84344","","JIT-Database-011a-COLUMN-ENUM-default","","JIT-Database-011a-COLUMN-ENUM-default","[COLUMN] As a user, I should check the basic validation","[COLUMN] As a user, I should check the basic validation",""
"passed","Thu Dec 22 18:31:13 GMT 2022","Thu Dec 22 18:33:10 GMT 2022","116326","","JIT-Mobile-030b-WEBVIEW-General-info","","JIT-Mobile-030b-WEBVIEW-General-info","[MOBILE-WEBVIEW] As a user, I should check the general infomation of Webview is correct: Name, Key, unique key, delete component","[MOBILE-WEBVIEW] As a user, I should check the general infomation of Webview is correct: Name, Key, unique key, delete component",""
"passed","Thu Dec 22 19:01:21 GMT 2022","Thu Dec 22 19:03:10 GMT 2022","109457","","JIT-API-002a-GET-list-check-default","","JIT-API-002a-GET-list-check-default","As a user, I check default value in API GET list","As a user, I check default value in API GET list",""
"passed","Thu Dec 22 18:34:48 GMT 2022","Thu Dec 22 18:39:21 GMT 2022","273595","","JIT-Mobile-039a-OTP-Check-PreviewCode","","JIT-Mobile-039a-OTP-Check-PreviewCode","[MOBILE-OTP] As a user, I should check the Preview code of OTP component","[MOBILE-OTP] As a user, I should check the Preview code of OTP component",""
"broken","Thu Dec 22 19:43:52 GMT 2022","Thu Dec 22 19:48:00 GMT 2022","247452","","JIT-Mobile-011-JITDEF50-disable-add-duplicate-screen-in-stack","","JIT-Mobile-011-JITDEF50-disable-add-duplicate-screen-in-stack","[DEFECT] As a user, I could add duplicate screen in stack","[DEFECT] As a user, I could add duplicate screen in stack",""
"passed","Thu Dec 22 18:10:58 GMT 2022","Thu Dec 22 18:11:40 GMT 2022","42502","","JIT-Database-001c-TABLE-duplicate","","JIT-Database-001c-TABLE-duplicate","[TABLE] As a user, I cannot create table with duplicate name","[TABLE] As a user, I cannot create table with duplicate name",""
"passed","Thu Dec 22 18:41:34 GMT 2022","Thu Dec 22 18:43:48 GMT 2022","134351","","JIT-Module-009a-GOOGLE-LOGIN-default-edit","","JIT-Module-009a-GOOGLE-LOGIN-default-edit","[GOOGLE-LOGIN], I can add module Google Login and edit its infos","[GOOGLE-LOGIN], I can add module Google Login and edit its infos",""
"passed","Thu Dec 22 18:29:06 GMT 2022","Thu Dec 22 18:30:33 GMT 2022","86802","","JIT-Mobile-026b-BUTTON-General-info","","JIT-Mobile-026b-BUTTON-General-info","[MOBILE-BUTTON] As a user, I should check the general infomation of Button is correct: Name, Key, unique key, delete component","[MOBILE-BUTTON] As a user, I should check the general infomation of Button is correct: Name, Key, unique key, delete component",""
"passed","Thu Dec 22 18:16:09 GMT 2022","Thu Dec 22 18:17:36 GMT 2022","87348","","JIT-Database-011e-COLUMN-ENUM-delete-all","","JIT-Database-011e-COLUMN-ENUM-delete-all","[COLUMN] As a user, I should delete all items and check all items are not displayed","[COLUMN] As a user, I should delete all items and check all items are not displayed",""
"passed","Thu Dec 22 19:56:58 GMT 2022","Thu Dec 22 20:00:21 GMT 2022","202362","","JIT-Export-003-Scenario_ROR_2","","JIT-Export-003-Scenario_ROR_2","As a user, I check export the project type ROR no key successfully with scenario 2","As a user, I check export the project type ROR no key successfully with scenario 2",""
"passed","Thu Dec 22 18:48:45 GMT 2022","Thu Dec 22 18:53:27 GMT 2022","281493","","JIT-Web-001a-PAGE-Create-new","","JIT-Web-001a-PAGE-Create-new","[PAGE] As a user, I can create new screen with positive and negative cases","[PAGE] As a user, I can create new screen with positive and negative cases",""
"passed","Thu Dec 22 20:27:42 GMT 2022","Thu Dec 22 20:40:35 GMT 2022","772654","","JIT-Preview-002-Preview-[EMAIL-LOGIN]","","JIT-Preview-002-Preview-[EMAIL-LOGIN]","[PREVIEW-EMAIL-LOGIN] As a user, I check preview function for Email login module","[PREVIEW-EMAIL-LOGIN] As a user, I check preview function for Email login module",""
"passed","Thu Dec 22 18:11:00 GMT 2022","Thu Dec 22 18:11:43 GMT 2022","43211","","JIT-Database-001e-TABLE-create-by-context-menu","","JIT-Database-001e-TABLE-create-by-context-menu","[TABLE] As a user, I can create new table by context menu","[TABLE] As a user, I can create new table by context menu",""
"passed","Thu Dec 22 19:59:01 GMT 2022","Thu Dec 22 20:00:47 GMT 2022","105829","","JIT-Export-005b-Scenario-RN-all-default-component","","JIT-Export-005b-Scenario-RN-all-default-component","[RN-Default] As a user, I check export the project type React Native with all default component","[RN-Default] As a user, I check export the project type React Native with all default component",""
"passed","Thu Dec 22 18:37:23 GMT 2022","Thu Dec 22 18:38:28 GMT 2022","65092","","JIT-Module-001a-CLOUDINARY-default","","JIT-Module-001a-CLOUDINARY-default","As a user, I can add module Cloudinary and remove it","As a user, I can add module Cloudinary and remove it",""
"passed","Thu Dec 22 18:37:32 GMT 2022","Thu Dec 22 18:38:28 GMT 2022","56079","","JIT-Module-002a-DEEPLINK-default","","JIT-Module-002a-DEEPLINK-default","As a user, I can add module Deeplink and remove it","As a user, I can add module Deeplink and remove it",""
"passed","Thu Dec 22 18:54:40 GMT 2022","Thu Dec 22 19:00:27 GMT 2022","347051","","JIT-Web-002d-MOLECULE-Duplicate","","JIT-Web-002d-MOLECULE-Duplicate","[WEB-MOLECULE] As a user, I can duplicate molecule with positive and negative cases","[WEB-MOLECULE] As a user, I can duplicate molecule with positive and negative cases",""
"passed","Thu Dec 22 18:16:00 GMT 2022","Thu Dec 22 18:17:26 GMT 2022","86457","","JIT-Database-011c-COLUMN-ENUM-delete-items","","JIT-Database-011c-COLUMN-ENUM-delete-items","[COLUMN] As a user, I should delete 1 item and check not display in default dropdown","[COLUMN] As a user, I should delete 1 item and check not display in default dropdown",""
"passed","Thu Dec 22 18:35:14 GMT 2022","Thu Dec 22 18:36:27 GMT 2022","73080","","JIT-Mobile-041a-PREVIEW-NAVIGATION-no-navigation-setup","","JIT-Mobile-041a-PREVIEW-NAVIGATION-no-navigation-setup","[MOBILE-PREVIEW-NAVIGATION] As a user, I could open preview screen with notification should setup the screen navigation","[MOBILE-PREVIEW-NAVIGATION] As a user, I could open preview screen with notification should setup the screen navigation",""
"broken","Thu Dec 22 19:48:10 GMT 2022","Thu Dec 22 19:52:18 GMT 2022","247556","","JIT-Mobile-013-JITDEF-reflect-delete-screen-innavigation-tree","","JIT-Mobile-013-JITDEF-reflect-delete-screen-innavigation-tree","[DEFECT] As a user, I should see screen will be removed in navigation tree after deleting screen","[DEFECT] As a user, I should see screen will be removed in navigation tree after deleting screen",""
"passed","Thu Dec 22 18:22:25 GMT 2022","Thu Dec 22 18:24:12 GMT 2022","106607","","JIT-Mobile-005-MOLECULE-Create-new","","JIT-Mobile-005-MOLECULE-Create-new","[MOBILE-MOLECULE] As a user, I can create new molecule with positive and negative cases","[MOBILE-MOLECULE] As a user, I can create new molecule with positive and negative cases",""
"passed","Thu Dec 22 19:08:00 GMT 2022","Thu Dec 22 19:09:24 GMT 2022","83828","","JIT-Database-015d-INDEX-STRING-column-config","","JIT-Database-015d-INDEX-STRING-column-config","[INDEX-STRING] As a user, I config index from column setting && check on index popup","[INDEX-STRING] As a user, I config index from column setting && check on index popup",""
"passed","Thu Dec 22 18:21:39 GMT 2022","Thu Dec 22 18:22:56 GMT 2022","76625","","JIT-Mobile-003-SCREEN-Delete","","JIT-Mobile-003-SCREEN-Delete","[MOBILE-SCREEN] As a user, I can delete screen","[MOBILE-SCREEN] As a user, I can delete screen",""
"passed","Thu Dec 22 19:05:02 GMT 2022","Thu Dec 22 19:06:37 GMT 2022","95914","","JIT-API-007d-POST-API-Add-new-endpoint","","JIT-API-007d-POST-API-Add-new-endpoint","[GET-POST] Create, update and delete new POST API endpoint","[GET-POST] Create, update and delete new POST API endpoint",""
