"Status","Start Time","Stop Time","Duration in ms","Parent Suite","Suite","Sub Suite","Test Class","Test Method","Name","Description"
"passed","Fri Nov 11 19:01:05 GMT 2022","Fri Nov 11 19:02:13 GMT 2022","67745","","JIT-Module-007a-APPLE-LOGIN-default-edit","","JIT-Module-007a-APPLE-LOGIN-default-edit","[APPLE-LOGIN], I can add module Apple Login and edit its infos","[APPLE-LOGIN], I can add module Apple Login and edit its infos",""
"passed","Fri Nov 11 18:30:08 GMT 2022","Fri Nov 11 18:31:25 GMT 2022","77249","","JIT-Module-002b-DEEPLINK-edit-infos","","JIT-Module-002b-DEEPLINK-edit-infos","As a user, I can update module Deeplink","As a user, I can update module Deeplink",""
"passed","Fri Nov 11 18:12:48 GMT 2022","Fri Nov 11 18:13:58 GMT 2022","70445","","JIT-Dashboard-002a-LISTOF-default-column","","JIT-Dashboard-002a-LISTOF-default-column","[LIST-OF] As a user, I should add default column in dashboard params","[LIST-OF] As a user, I should add default column in dashboard params",""
"passed","Fri Nov 11 19:02:23 GMT 2022","Fri Nov 11 19:03:07 GMT 2022","43539","","JIT-Dashboard-003d-DETAILOF-delete-table","","JIT-Dashboard-003d-DETAILOF-delete-table","[DEATIL-OF] As a user, I should see the table is not displayed in dashboard list after removed","[DEATIL-OF] As a user, I should see the table is not displayed in dashboard list after removed",""
"passed","Fri Nov 11 18:26:40 GMT 2022","Fri Nov 11 18:27:53 GMT 2022","73859","","JIT-Mobile-035b-FLATLIST-General-info","","JIT-Mobile-035b-FLATLIST-General-info","[MOBILE-FLATLIST] As a user, I should check the general infomation of FlatList is correct: Name, Key, unique key, delete component","[MOBILE-FLATLIST] As a user, I should check the general infomation of FlatList is correct: Name, Key, unique key, delete component",""
"passed","Fri Nov 11 18:30:43 GMT 2022","Fri Nov 11 18:32:34 GMT 2022","111329","","JIT-Module-005b-FORCE-MOBILE-UPDATE-api","","JIT-Module-005b-FORCE-MOBILE-UPDATE-api","[FORCE-MOBILE-UPDATE] - Check api","[FORCE-MOBILE-UPDATE] - Check api",""
"passed","Fri Nov 11 18:12:48 GMT 2022","Fri Nov 11 18:14:08 GMT 2022","80108","","JIT-Dashboard-001-Check-general-info","","JIT-Dashboard-001-Check-general-info","As a user, I check general info and update table name","As a user, I check general info and update table name",""
"passed","Fri Nov 11 18:34:04 GMT 2022","Fri Nov 11 18:34:55 GMT 2022","50914","","JIT-Module-015a-SCOUT-default","","JIT-Module-015a-SCOUT-default","[SCOUT] As a user, I can add module Scout and remove it","[SCOUT] As a user, I can add module Scout and remove it",""
"passed","Fri Nov 11 18:33:09 GMT 2022","Fri Nov 11 18:33:59 GMT 2022","50036","","JIT-Module-013b-AWS-edit-infos","","JIT-Module-013b-AWS-edit-infos","[AWS] As a user, I can update module AWS SES Integration","[AWS] As a user, I can update module AWS SES Integration",""
"failed","Fri Nov 11 19:15:00 GMT 2022","Fri Nov 11 19:15:17 GMT 2022","16827","","JIT-Overview-001-GENERAL-Check","","JIT-Overview-001-GENERAL-Check","[OVERVIEW-GENERAL] As a user, I should see the overview show the correct info when update configuration","[OVERVIEW-GENERAL] As a user, I should see the overview show the correct info when update configuration",""
"broken","Fri Nov 11 19:22:14 GMT 2022","Fri Nov 11 19:32:34 GMT 2022","620374","","JIT-Export-006-Existing-Scenario-ROR-nokey","","JIT-Export-006-Existing-Scenario-ROR-nokey","As a user, I check export the existing project type ROR no key successfully","As a user, I check export the existing project type ROR no key successfully",""
"passed","Fri Nov 11 18:16:40 GMT 2022","Fri Nov 11 18:17:28 GMT 2022","48316","","JIT-Dashboard-005e-UPDATEOF-delete-column","","JIT-Dashboard-005e-UPDATEOF-delete-column","[UPDATE-OF] As a user, I should see the params will be removed when column is deleted","[UPDATE-OF] As a user, I should see the params will be removed when column is deleted",""
"passed","Fri Nov 11 18:18:19 GMT 2022","Fri Nov 11 18:21:02 GMT 2022","163061","","JIT-Mobile-001a-SCREEN-Search","","JIT-Mobile-001a-SCREEN-Search","[MOBILE-SCREEN] As a user, I can search correct screen with keyword","[MOBILE-SCREEN] As a user, I can search correct screen with keyword",""
"passed","Fri Nov 11 18:35:21 GMT 2022","Fri Nov 11 18:36:07 GMT 2022","45476","","JIT-Module-019a-GOOGLE-ANALYTICS-default","","JIT-Module-019a-GOOGLE-ANALYTICS-default","[GOOGLE-ANALYTICS] As a user, I can add module Google Analytics and remove it","[GOOGLE-ANALYTICS] As a user, I can add module Google Analytics and remove it",""
"passed","Fri Nov 11 18:15:25 GMT 2022","Fri Nov 11 18:16:36 GMT 2022","70655","","JIT-Dashboard-004d-CREATEOF-delete-table","","JIT-Dashboard-004d-CREATEOF-delete-table","[CREATE-OF] As a user, I should see the table is not displayed in dashboard list after removed","[CREATE-OF] As a user, I should see the table is not displayed in dashboard list after removed",""
"passed","Fri Nov 11 18:12:48 GMT 2022","Fri Nov 11 18:13:57 GMT 2022","69474","","JIT-Authorization-001-GROUP-add","","JIT-Authorization-001-GROUP-add","[AUTH - GROUP] As a user, I want to create new group authorization","[AUTH - GROUP] As a user, I want to create new group authorization",""
"passed","Fri Nov 11 18:42:48 GMT 2022","Fri Nov 11 18:45:15 GMT 2022","147238","","JIT-Database-015c-INDEX-CRUD-multiple","","JIT-Database-015c-INDEX-CRUD-multiple","[INDEX] As a user, I check add and update single index","[INDEX] As a user, I check add and update single index",""
"passed","Fri Nov 11 18:37:16 GMT 2022","Fri Nov 11 18:39:11 GMT 2022","115116","","JIT-Web-002a-MOLECULE-Create-new","","JIT-Web-002a-MOLECULE-Create-new","[WEB-MOLECULE] As a user, I can create new molecule with positive and negative cases","[WEB-MOLECULE] As a user, I can create new molecule with positive and negative cases",""
"passed","Fri Nov 11 18:29:05 GMT 2022","Fri Nov 11 18:29:35 GMT 2022","29345","","JIT-Module-000-search","","JIT-Module-000-search","[SEARCH] As a user, I can Search module","[SEARCH] As a user, I can Search module",""
"passed","Fri Nov 11 19:04:56 GMT 2022","Fri Nov 11 19:06:04 GMT 2022","68696","","JIT-Dashboard-004b-CREATEOF-new-column","","JIT-Dashboard-004b-CREATEOF-new-column","[CREATE-OF] As a user, I should add new column in dashboard params","[CREATE-OF] As a user, I should add new column in dashboard params",""
"passed","Fri Nov 11 18:44:07 GMT 2022","Fri Nov 11 18:45:21 GMT 2022","73851","","JIT-Database-015f-INDEX-INTEGER-column-config","","JIT-Database-015f-INDEX-INTEGER-column-config","[INDEX-INTEGER] As a user, I config index from column setting && check on index popup","[INDEX-INTEGER] As a user, I config index from column setting && check on index popup",""
"passed","Fri Nov 11 18:16:07 GMT 2022","Fri Nov 11 18:16:51 GMT 2022","43856","","JIT-Dashboard-005b-UPDATEOF-new-column","","JIT-Dashboard-005b-UPDATEOF-new-column","[UPDATE-OF] As a user, I should add new column in dashboard params","[UPDATE-OF] As a user, I should add new column in dashboard params",""
"passed","Fri Nov 11 18:24:39 GMT 2022","Fri Nov 11 18:26:01 GMT 2022","81910","","JIT-Mobile-030b-WEBVIEW-General-info","","JIT-Mobile-030b-WEBVIEW-General-info","[MOBILE-WEBVIEW] As a user, I should check the general infomation of Webview is correct: Name, Key, unique key, delete component","[MOBILE-WEBVIEW] As a user, I should check the general infomation of Webview is correct: Name, Key, unique key, delete component",""
"passed","Fri Nov 11 18:34:37 GMT 2022","Fri Nov 11 18:36:35 GMT 2022","118579","","JIT-Module-018a-ADMIN-DASHBOARD-USER-default","","JIT-Module-018a-ADMIN-DASHBOARD-USER-default","[ADMIN-DASHBOARD-USER], I can add module Admin dashboard user and remove it","[ADMIN-DASHBOARD-USER], I can add module Admin dashboard user and remove it",""
"passed","Fri Nov 11 18:37:51 GMT 2022","Fri Nov 11 18:39:21 GMT 2022","90135","","JIT-Web-002f-MOLECULE-Navigate-edit-screen","","JIT-Web-002f-MOLECULE-Navigate-edit-screen","[WEB-MOLECULE-EDIT] As a user, I can see the molecule in Page and use Edit button see the content of this molecule","[WEB-MOLECULE-EDIT] As a user, I can see the molecule in Page and use Edit button see the content of this molecule",""
"passed","Fri Nov 11 18:27:18 GMT 2022","Fri Nov 11 18:30:24 GMT 2022","186103","","JIT-Mobile-041b-PREVIEW-NAVIGATION-with-navigation-setup","","JIT-Mobile-041b-PREVIEW-NAVIGATION-with-navigation-setup","[MOBILE-PREVIEW-NAVIGATION] As a user, I could open preview screen with setting the screen navigation","[MOBILE-PREVIEW-NAVIGATION] As a user, I could open preview screen with setting the screen navigation",""
"passed","Fri Nov 11 18:46:19 GMT 2022","Fri Nov 11 18:47:51 GMT 2022","91442","","JIT-Database-015m-INDEX-ALL-column-config","","JIT-Database-015m-INDEX-ALL-column-config","[INDEX-ALL] As a user, I config with multiple column and check show multiple on index pop-up","[INDEX-ALL] As a user, I config with multiple column and check show multiple on index pop-up",""
"passed","Fri Nov 11 18:33:01 GMT 2022","Fri Nov 11 18:33:47 GMT 2022","46304","","JIT-Module-013a-AWS-default","","JIT-Module-013a-AWS-default","[AWS] As a user, I can add module AWS SES Integration and remove it","[AWS] As a user, I can add module AWS SES Integration and remove it",""
"passed","Fri Nov 11 18:21:48 GMT 2022","Fri Nov 11 18:24:37 GMT 2022","169306","","JIT-Mobile-022b-TEXT-Check-TEXT","","JIT-Mobile-022b-TEXT-Check-TEXT","[MOBILE-TEXT] As a user, I should check the TEXT infomation of Text is correct: Text content, Font, Size, Font weight, Line Height, Spacing, Color, Italic, Underline","[MOBILE-TEXT] As a user, I should check the TEXT infomation of Text is correct: Text content, Font, Size, Font weight, Line Height, Spacing, Color, Italic, Underline",""
"passed","Fri Nov 11 18:42:48 GMT 2022","Fri Nov 11 18:45:13 GMT 2022","144621","","JIT-Database-015b-INDEX-CRUD-single","","JIT-Database-015b-INDEX-CRUD-single","[INDEX] As a user, I check add and update multiple index","[INDEX] As a user, I check add and update multiple index",""
"passed","Fri Nov 11 18:22:42 GMT 2022","Fri Nov 11 18:23:56 GMT 2022","73732","","JIT-Mobile-026b-BUTTON-General-info","","JIT-Mobile-026b-BUTTON-General-info","[MOBILE-BUTTON] As a user, I should check the general infomation of Button is correct: Name, Key, unique key, delete component","[MOBILE-BUTTON] As a user, I should check the general infomation of Button is correct: Name, Key, unique key, delete component",""
"passed","Fri Nov 11 18:23:25 GMT 2022","Fri Nov 11 18:25:56 GMT 2022","150959","","JIT-Mobile-028a-ICON-Check-PreviewCode","","JIT-Mobile-028a-ICON-Check-PreviewCode","[MOBILE-ICON] As a user, I should check the Preview code of Icon component","[MOBILE-ICON] As a user, I should check the Preview code of Icon component",""
"passed","Fri Nov 11 18:32:17 GMT 2022","Fri Nov 11 18:33:45 GMT 2022","88429","","JIT-Module-011a-GUEST-LOGIN-default-edit","","JIT-Module-011a-GUEST-LOGIN-default-edit","[GUEST-LOGIN], I can add module Guest Login and edit its infos","[GUEST-LOGIN], I can add module Guest Login and edit its infos",""
"broken","Fri Nov 11 19:09:51 GMT 2022","Fri Nov 11 19:10:51 GMT 2022","60304","","JIT-Dashboard-006e-DELETEOF-delete-column","","JIT-Dashboard-006e-DELETEOF-delete-column","[DELETE-OF] As a user, I should see the params will be removed when column is deleted","[DELETE-OF] As a user, I should see the params will be removed when column is deleted",""
"broken","Fri Nov 11 19:08:38 GMT 2022","Fri Nov 11 19:09:38 GMT 2022","60549","","JIT-Dashboard-006c-DELETEOF-saving","","JIT-Dashboard-006c-DELETEOF-saving","[DELETE-OF] As a user, I should save the selected option when switching between tables","[DELETE-OF] As a user, I should save the selected option when switching between tables",""
"passed","Fri Nov 11 18:42:48 GMT 2022","Fri Nov 11 18:44:05 GMT 2022","77514","","JIT-Database-015d-INDEX-STRING-column-config","","JIT-Database-015d-INDEX-STRING-column-config","[INDEX-STRING] As a user, I config index from column setting && check on index popup","[INDEX-STRING] As a user, I config index from column setting && check on index popup",""
"passed","Fri Nov 11 18:29:59 GMT 2022","Fri Nov 11 18:30:41 GMT 2022","41768","","JIT-Module-002a-DEEPLINK-default","","JIT-Module-002a-DEEPLINK-default","As a user, I can add module Deeplink and remove it","As a user, I can add module Deeplink and remove it",""
"broken","Fri Nov 11 19:04:21 GMT 2022","Fri Nov 11 19:06:15 GMT 2022","113829","","JIT-Web-004b-ACTION-NAVIGATION-with-param","","JIT-Web-004b-ACTION-NAVIGATION-with-param","[WEB-ACTION-NAVIGATION] As a user, I could add action type navigation with params and check preview code","[WEB-ACTION-NAVIGATION] As a user, I could add action type navigation with params and check preview code",""
"passed","Fri Nov 11 19:11:04 GMT 2022","Fri Nov 11 19:13:16 GMT 2022","131366","","JIT-Mobile-039a-OTP-Check-PreviewCode","","JIT-Mobile-039a-OTP-Check-PreviewCode","[MOBILE-OTP] As a user, I should check the Preview code of OTP component","[MOBILE-OTP] As a user, I should check the Preview code of OTP component",""
"passed","Fri Nov 11 18:34:49 GMT 2022","Fri Nov 11 18:36:34 GMT 2022","105056","","JIT-Module-018c-ADMIN-DASHBOARD-USER-column-infos","","JIT-Module-018c-ADMIN-DASHBOARD-USER-column-infos","[ADMIN-DASHBOARD-USER], I check the column infos from Admin Dashboard User","[ADMIN-DASHBOARD-USER], I check the column infos from Admin Dashboard User",""
"passed","Fri Nov 11 18:25:52 GMT 2022","Fri Nov 11 18:27:00 GMT 2022","68536","","JIT-Mobile-034b-SCROLLVIEW-General-info","","JIT-Mobile-034b-SCROLLVIEW-General-info","[MOBILE-SCROLLVIEW] As a user, I should check the general infomation of Scroll View is correct: Name, Key, unique key, delete component","[MOBILE-SCROLLVIEW] As a user, I should check the general infomation of Scroll View is correct: Name, Key, unique key, delete component",""
"failed","Fri Nov 11 19:15:28 GMT 2022","Fri Nov 11 19:15:53 GMT 2022","25197","","JIT-Database-015l-INDEX-ENUM-column-config","","JIT-Database-015l-INDEX-ENUM-column-config","[INDEX-ENUM] As a user, I config index from column setting && check on index popup","[INDEX-ENUM] As a user, I config index from column setting && check on index popup",""
"passed","Fri Nov 11 18:24:46 GMT 2022","Fri Nov 11 18:26:49 GMT 2022","123447","","JIT-Mobile-031a-DIVIDER-Check-PreviewCode","","JIT-Mobile-031a-DIVIDER-Check-PreviewCode","[MOBILE-DIVIDER] As a user, I should check the Preview code of Divider component","[MOBILE-DIVIDER] As a user, I should check the Preview code of Divider component",""
"passed","Fri Nov 11 18:19:41 GMT 2022","Fri Nov 11 18:20:45 GMT 2022","63862","","JIT-Mobile-012-JITDEF-remove-poperty-info-after-deleting-navigation","","JIT-Mobile-012-JITDEF-remove-poperty-info-after-deleting-navigation","[DEFECT] As a user, I should see the property infos need to be removed after the navigation was deleted","[DEFECT] As a user, I should see the property infos need to be removed after the navigation was deleted",""
"passed","Fri Nov 11 19:01:41 GMT 2022","Fri Nov 11 19:02:18 GMT 2022","36719","","JIT-Dashboard-003c-DETAILOF-saving","","JIT-Dashboard-003c-DETAILOF-saving","[DEATIL-OF] As a user, I should save the selected option when switching between tables","[DEATIL-OF] As a user, I should save the selected option when switching between tables",""
"passed","Fri Nov 11 18:45:34 GMT 2022","Fri Nov 11 18:46:27 GMT 2022","53412","","JIT-Database-015k-INDEX-BOOLEAN-column-config","","JIT-Database-015k-INDEX-BOOLEAN-column-config","[INDEX-BOOLEAN] As a user, I config index from column setting && check on index popup","[INDEX-BOOLEAN] As a user, I config index from column setting && check on index popup",""
"passed","Fri Nov 11 18:15:04 GMT 2022","Fri Nov 11 18:15:45 GMT 2022","40845","","JIT-Dashboard-004c-CREATEOF-saving","","JIT-Dashboard-004c-CREATEOF-saving","[CREATE-OF] As a user, I should save the selected option when switching between tables","[CREATE-OF] As a user, I should save the selected option when switching between tables",""
"passed","Fri Nov 11 18:29:43 GMT 2022","Fri Nov 11 18:30:58 GMT 2022","74779","","JIT-Module-001b-CLOUDINARY-edit-infos","","JIT-Module-001b-CLOUDINARY-edit-infos","As a user, I can update module Cloudinary","As a user, I can update module Cloudinary",""
"passed","Fri Nov 11 18:36:08 GMT 2022","Fri Nov 11 18:37:12 GMT 2022","64269","","JIT-Web-001c-PAGE-Delete","","JIT-Web-001c-PAGE-Delete","[PAGE] As a user, I can delete page","[PAGE] As a user, I can delete page",""
"broken","Fri Nov 11 19:20:03 GMT 2022","Fri Nov 11 19:21:04 GMT 2022","60179","","JIT-Export-002-Scenario-ROR-withkey-1","","JIT-Export-002-Scenario-ROR-withkey-1","As a user, I check export the project type ROR with key successfully with scenario 1","As a user, I check export the project type ROR with key successfully with scenario 1",""
"passed","Fri Nov 11 18:27:43 GMT 2022","Fri Nov 11 18:31:17 GMT 2022","214272","","JIT-Mobile-042b-ACTION-NAVIGATION-with-param","","JIT-Mobile-042b-ACTION-NAVIGATION-with-param","[MOBILE-ACTION-NAVIGATION] As a user, I could add action type navigation with params and check preview code","[MOBILE-ACTION-NAVIGATION] As a user, I could add action type navigation with params and check preview code",""
"passed","Fri Nov 11 18:19:29 GMT 2022","Fri Nov 11 18:30:05 GMT 2022","636584","","JIT-Mobile-009-SEARCH-Components","","JIT-Mobile-009-SEARCH-Components","[MOBILE-SEARCH] As a user, I search component and drag them to preview screen","[MOBILE-SEARCH] As a user, I search component and drag them to preview screen",""
"passed","Fri Nov 11 18:34:24 GMT 2022","Fri Nov 11 18:35:09 GMT 2022","45025","","JIT-Module-017a-GOOGLE-ANAL-default","","JIT-Module-017a-GOOGLE-ANAL-default","[GOOGLE-ANAL] As a user, I can add module Google Analytics and remove it","[GOOGLE-ANAL] As a user, I can add module Google Analytics and remove it",""
"passed","Fri Nov 11 18:12:47 GMT 2022","Fri Nov 11 18:14:01 GMT 2022","73584","","JIT-Dashboard-002d-LISTOF-delete-table","","JIT-Dashboard-002d-LISTOF-delete-table","[LIST-OF] As a user, I should see the table is not displayed in dashboard list after removed","[LIST-OF] As a user, I should see the table is not displayed in dashboard list after removed",""
"passed","Fri Nov 11 19:23:11 GMT 2022","Fri Nov 11 19:26:42 GMT 2022","210281","","JIT-Export-010b-Export-RN-TODO","","JIT-Export-010b-Export-RN-TODO","[SMOKE] As a user, I check exprting project TODO with React Native","[SMOKE] As a user, I check exprting project TODO with React Native",""
