"Status","Start Time","Stop Time","Duration in ms","Parent Suite","Suite","Sub Suite","Test Class","Test Method","Name","Description"
"passed","Fri Nov 11 18:23:24 GMT 2022","Fri Nov 11 18:24:32 GMT 2022","67537","","JIT-Mobile-028b-ICON-General-info","","JIT-Mobile-028b-ICON-General-info","[MOBILE-ICON] As a user, I should check the general infomation of Icon is correct: Name, Key, unique key, delete component","[MOBILE-ICON] As a user, I should check the general infomation of Icon is correct: Name, Key, unique key, delete component",""
"passed","Fri Nov 11 18:29:10 GMT 2022","Fri Nov 11 18:29:56 GMT 2022","46841","","JIT-Module-001a-CLOUDINARY-default","","JIT-Module-001a-CLOUDINARY-default","As a user, I can add module Cloudinary and remove it","As a user, I can add module Cloudinary and remove it",""
"passed","Fri Nov 11 18:39:41 GMT 2022","Fri Nov 11 18:41:15 GMT 2022","94501","","JIT-Web-004a-ACTION-NAVIGATION-no-param","","JIT-Web-004a-ACTION-NAVIGATION-no-param","[WEB-ACTION-NAVIGATION] As a user, I could add action type navigation without params and check preview code","[WEB-ACTION-NAVIGATION] As a user, I could add action type navigation without params and check preview code",""
"passed","Fri Nov 11 18:30:39 GMT 2022","Fri Nov 11 18:31:43 GMT 2022","63697","","JIT-Module-005a-FORCE-MOBILE-UPDATE-database","","JIT-Module-005a-FORCE-MOBILE-UPDATE-database","[FORCE-MOBILE-UPDATE] - Check adding and auto-table & columns","[FORCE-MOBILE-UPDATE] - Check adding and auto-table & columns",""
"passed","Fri Nov 11 18:12:48 GMT 2022","Fri Nov 11 18:14:02 GMT 2022","74204","","JIT-Dashboard-002e-LISTOF-delete-column","","JIT-Dashboard-002e-LISTOF-delete-column","As a user, I should see the params will be removed when column is deleted","As a user, I should see the params will be removed when column is deleted",""
"passed","Fri Nov 11 18:36:00 GMT 2022","Fri Nov 11 18:37:27 GMT 2022","87323","","JIT-Web-001a-PAGE-Create-new","","JIT-Web-001a-PAGE-Create-new","[PAGE] As a user, I can create new screen with positive and negative cases","[PAGE] As a user, I can create new screen with positive and negative cases",""
"passed","Fri Nov 11 18:12:47 GMT 2022","Fri Nov 11 18:14:27 GMT 2022","99592","","JIT-Authorization-002-GROUP-search","","JIT-Authorization-002-GROUP-search","[AUTH - GROUP] As a user, I want to create multiple new group authorization and search","[AUTH - GROUP] As a user, I want to create multiple new group authorization and search",""
"passed","Fri Nov 11 18:45:28 GMT 2022","Fri Nov 11 18:46:44 GMT 2022","76014","","JIT-Database-015i-INDEX-DATETIME-column-config","","JIT-Database-015i-INDEX-DATETIME-column-config","[INDEX-DATETIME] As a user, I config index from column setting && check on index popup","[INDEX-DATETIME] As a user, I config index from column setting && check on index popup",""
"passed","Fri Nov 11 18:25:15 GMT 2022","Fri Nov 11 18:26:29 GMT 2022","73907","","JIT-Mobile-032b-CAROUSEL-General-info","","JIT-Mobile-032b-CAROUSEL-General-info","[MOBILE-CAROUSEL] As a user, I should check the general infomation of Carousel is correct: Name, Key, unique key, delete component","[MOBILE-CAROUSEL] As a user, I should check the general infomation of Carousel is correct: Name, Key, unique key, delete component",""
"broken","Fri Nov 11 19:19:09 GMT 2022","Fri Nov 11 19:20:14 GMT 2022","65038","","JIT-Export-003-Scenario_ROR_2","","JIT-Export-003-Scenario_ROR_2","As a user, I check export the project type ROR no key successfully with scenario 2","As a user, I check export the project type ROR no key successfully with scenario 2",""
"passed","Fri Nov 11 18:22:01 GMT 2022","Fri Nov 11 18:24:09 GMT 2022","127872","","JIT-Mobile-022d-TEXT-Check-PADDING-MARGIN","","JIT-Mobile-022d-TEXT-Check-PADDING-MARGIN","[MOBILE-TEXT] As a user, I should check the PADDING & MARGIN infomation of Text is correct: Top, Bottom, Right, Left.","[MOBILE-TEXT] As a user, I should check the PADDING & MARGIN infomation of Text is correct: Top, Bottom, Right, Left.",""
"passed","Fri Nov 11 19:26:48 GMT 2022","Fri Nov 11 19:33:36 GMT 2022","407660","","JIT-Export-010c-Export-NextJS-TODO","","JIT-Export-010c-Export-NextJS-TODO","[SMOKE] As a user, I check exprting project TODO with NextJS","[SMOKE] As a user, I check exprting project TODO with NextJS",""
"passed","Fri Nov 11 18:25:28 GMT 2022","Fri Nov 11 18:26:41 GMT 2022","72177","","JIT-Mobile-033b-HEADER-General-info","","JIT-Mobile-033b-HEADER-General-info","[MOBILE-HEADER] As a user, I should check the general infomation of Header is correct: Name, Key, unique key, delete component","[MOBILE-HEADER] As a user, I should check the general infomation of Header is correct: Name, Key, unique key, delete component",""
"passed","Fri Nov 11 18:37:53 GMT 2022","Fri Nov 11 18:40:20 GMT 2022","147494","","JIT-Web-002e-MOLECULE-Search","","JIT-Web-002e-MOLECULE-Search","[WEB-PAGE] As a user, I can search correct molecule with keyword","[WEB-PAGE] As a user, I can search correct molecule with keyword",""
"broken","Fri Nov 11 19:03:07 GMT 2022","Fri Nov 11 19:04:09 GMT 2022","62059","","JIT-Dashboard-003e-DETAILOF-delete-column","","JIT-Dashboard-003e-DETAILOF-delete-column","[DEATIL-OF] As a user, I should see the params will be removed when column is deleted","[DEATIL-OF] As a user, I should see the params will be removed when column is deleted",""
"broken","Fri Nov 11 19:18:53 GMT 2022","Fri Nov 11 19:19:54 GMT 2022","61154","","JIT-Export-001-Scenario_ROR_1","","JIT-Export-001-Scenario_ROR_1","As a user, I check export the project type ROR no key successfully with scenario 1","As a user, I check export the project type ROR no key successfully with scenario 1",""
"passed","Fri Nov 11 18:44:13 GMT 2022","Fri Nov 11 18:45:26 GMT 2022","72561","","JIT-Database-015g-INDEX-FLOAT-column-config","","JIT-Database-015g-INDEX-FLOAT-column-config","[INDEX-FLOAT] As a user, I config index from column setting && check on index popup","[INDEX-FLOAT] As a user, I config index from column setting && check on index popup",""
"broken","Fri Nov 11 19:32:41 GMT 2022","Fri Nov 11 19:43:03 GMT 2022","622502","","JIT-Export-007-Existing-Scenario-ROR-withkey","","JIT-Export-007-Existing-Scenario-ROR-withkey","As a user, I check export the existing project type ROR with key successfully","As a user, I check export the existing project type ROR with key successfully",""
"passed","Fri Nov 11 18:14:21 GMT 2022","Fri Nov 11 18:15:28 GMT 2022","66613","","JIT-Dashboard-003a-DETAILOF-default","","JIT-Dashboard-003a-DETAILOF-default","[DEATIL-OF] As a user, I should add default column in dashboard params","[DEATIL-OF] As a user, I should add default column in dashboard params",""
"passed","Fri Nov 11 18:19:03 GMT 2022","Fri Nov 11 18:20:56 GMT 2022","112750","","JIT-Mobile-005b-MOLECULE-Navigate-edit-screen","","JIT-Mobile-005b-MOLECULE-Navigate-edit-screen","[MOBILE-MOLECULE-EDIT] As a user, I can see the molecule in Screen and use Edit button see the content of this molecule","[MOBILE-MOLECULE-EDIT] As a user, I can see the molecule in Screen and use Edit button see the content of this molecule",""
"failed","Fri Nov 11 19:13:25 GMT 2022","Fri Nov 11 19:13:51 GMT 2022","26311","","JIT-Mobile-043a-ACTION-AUTHENTICATION-PHONE-no-param","","JIT-Mobile-043a-ACTION-AUTHENTICATION-PHONE-no-param","[MOBILE-ACTION-AUTHENTICATION-PHONE] As a user, I could add action type authentication without params and check preview code","[MOBILE-ACTION-AUTHENTICATION-PHONE] As a user, I could add action type authentication without params and check preview code",""
"broken","Fri Nov 11 19:10:40 GMT 2022","Fri Nov 11 19:14:45 GMT 2022","245301","","JIT-Dashboard-002c-LISTOF-saving","","JIT-Dashboard-002c-LISTOF-saving","[LIST-OF] As a user, I should save the selected option when switching between tables","[LIST-OF] As a user, I should save the selected option when switching between tables",""
"passed","Fri Nov 11 19:02:29 GMT 2022","Fri Nov 11 19:02:58 GMT 2022","29077","","JIT-Module-016b-SENDGRID-edit-infos","","JIT-Module-016b-SENDGRID-edit-infos","[SENDGRID] As a user, I can update module SendGrid","[SENDGRID] As a user, I can update module SendGrid",""
"passed","Fri Nov 11 18:23:52 GMT 2022","Fri Nov 11 18:25:01 GMT 2022","69206","","JIT-Mobile-029b-TOUCHABLE-General-info","","JIT-Mobile-029b-TOUCHABLE-General-info","[MOBILE-TOUCHABLE] As a user, I should check the general infomation of Touchable is correct: Name, Key, unique key, delete component","[MOBILE-TOUCHABLE] As a user, I should check the general infomation of Touchable is correct: Name, Key, unique key, delete component",""
"passed","Fri Nov 11 18:20:54 GMT 2022","Fri Nov 11 18:22:46 GMT 2022","111863","","JIT-Mobile-014-JITDEF-status-bar","","JIT-Mobile-014-JITDEF-status-bar","[DEFECT] As a user, I should see screen will be removed in navigation tree after deleting screen","[DEFECT] As a user, I should see screen will be removed in navigation tree after deleting screen",""
"passed","Fri Nov 11 18:27:15 GMT 2022","Fri Nov 11 18:28:12 GMT 2022","57472","","JIT-Mobile-041a-PREVIEW-NAVIGATION-no-navigation-setup","","JIT-Mobile-041a-PREVIEW-NAVIGATION-no-navigation-setup","[MOBILE-PREVIEW-NAVIGATION] As a user, I could open preview screen with notification should setup the screen navigation","[MOBILE-PREVIEW-NAVIGATION] As a user, I could open preview screen with notification should setup the screen navigation",""
"passed","Fri Nov 11 19:03:52 GMT 2022","Fri Nov 11 19:04:41 GMT 2022","49642","","JIT-Dashboard-004a-CREATEOF-default","","JIT-Dashboard-004a-CREATEOF-default","[CREATE-OF] As a user, I should add default column in dashboard params","[CREATE-OF] As a user, I should add default column in dashboard params",""
"passed","Fri Nov 11 18:15:38 GMT 2022","Fri Nov 11 18:16:24 GMT 2022","46617","","JIT-Dashboard-004e-CREATEOF-delete-column","","JIT-Dashboard-004e-CREATEOF-delete-column","[CREATE-OF] As a user, I should see the params will be removed when column is deleted","[CREATE-OF] As a user, I should see the params will be removed when column is deleted",""
"passed","Fri Nov 11 18:12:47 GMT 2022","Fri Nov 11 18:14:00 GMT 2022","72820","","JIT-Dashboard-002b-LISTOF-new-column","","JIT-Dashboard-002b-LISTOF-new-column","[LIST-OF] As a user, I should add new column in dashboard params","[LIST-OF] As a user, I should add new column in dashboard params",""
"failed","Fri Nov 11 19:00:25 GMT 2022","Fri Nov 11 19:01:27 GMT 2022","61513","","JIT-Module-006a-SMS-default","","JIT-Module-006a-SMS-default","[SMS], I can add module SMS login with Twilio and remove it","[SMS], I can add module SMS login with Twilio and remove it",""
"passed","Fri Nov 11 18:33:15 GMT 2022","Fri Nov 11 18:34:21 GMT 2022","65554","","JIT-Module-014b-BASIC-AUTH-edit-infos","","JIT-Module-014b-BASIC-AUTH-edit-infos","[BASIC-AUTH] As a user, I can update module Basic Authentication","[BASIC-AUTH] As a user, I can update module Basic Authentication",""
"passed","Fri Nov 11 18:21:03 GMT 2022","Fri Nov 11 18:22:25 GMT 2022","82200","","JIT-Mobile-015-VIEW-General-info","","JIT-Mobile-015-VIEW-General-info","[MOBILE-VIEW] As a user, I should check the general infomation of View is correct: Name, Key, unique key, delete component","[MOBILE-VIEW] As a user, I should check the general infomation of View is correct: Name, Key, unique key, delete component",""
"passed","Fri Nov 11 18:32:01 GMT 2022","Fri Nov 11 18:33:47 GMT 2022","105553","","JIT-Module-009a-GOOGLE-LOGIN-default-edit","","JIT-Module-009a-GOOGLE-LOGIN-default-edit","[GOOGLE-LOGIN], I can add module Google Login and edit its infos","[GOOGLE-LOGIN], I can add module Google Login and edit its infos",""
"passed","Fri Nov 11 18:21:48 GMT 2022","Fri Nov 11 18:23:03 GMT 2022","75555","","JIT-Mobile-022a-TEXT-General-info","","JIT-Mobile-022a-TEXT-General-info","[MOBILE-TEXT] As a user, I should check the general infomation of Text is correct: Name, Key, unique key, delete component","[MOBILE-TEXT] As a user, I should check the general infomation of Text is correct: Name, Key, unique key, delete component",""
"passed","Fri Nov 11 18:38:16 GMT 2022","Fri Nov 11 18:40:30 GMT 2022","133677","","JIT-Web-003a-PREVIEW-NAVIGATION-no-navigation-setup","","JIT-Web-003a-PREVIEW-NAVIGATION-no-navigation-setup","[WEB-PREVIEW-NAVIGATION] As a user, I could open preview screen with default page","[WEB-PREVIEW-NAVIGATION] As a user, I could open preview screen with default page",""
"broken","Fri Nov 11 19:20:24 GMT 2022","Fri Nov 11 19:21:23 GMT 2022","59445","","JIT-Export-004-Scenario_ROR_2","","JIT-Export-004-Scenario_ROR_2","As a user, I check export the project type ROR with key successfully with scenario 2","As a user, I check export the project type ROR with key successfully with scenario 2",""
"passed","Fri Nov 11 18:23:15 GMT 2022","Fri Nov 11 18:24:19 GMT 2022","63687","","JIT-Mobile-027b-IMAGE-General-info","","JIT-Mobile-027b-IMAGE-General-info","[MOBILE-IMAGE] As a user, I should check the general infomation of Image is correct: Name, Key, unique key, delete component","[MOBILE-IMAGE] As a user, I should check the general infomation of Image is correct: Name, Key, unique key, delete component",""
"passed","Fri Nov 11 18:36:49 GMT 2022","Fri Nov 11 18:39:19 GMT 2022","150534","","JIT-Web-001e-PAGE-Search","","JIT-Web-001e-PAGE-Search","[WEB-PAGE] As a user, I can search correct screen with keyword","[WEB-PAGE] As a user, I can search correct screen with keyword",""
"passed","Fri Nov 11 18:16:31 GMT 2022","Fri Nov 11 18:17:22 GMT 2022","50338","","JIT-Dashboard-005d-UPDATEOF-delete-table","","JIT-Dashboard-005d-UPDATEOF-delete-table","[UPDATE-OF] As a user, I should see the table is not displayed in dashboard list after removed","[UPDATE-OF] As a user, I should see the table is not displayed in dashboard list after removed",""
"broken","Fri Nov 11 19:07:26 GMT 2022","Fri Nov 11 19:08:26 GMT 2022","59525","","JIT-Dashboard-006b-DELETEOF-new-column","","JIT-Dashboard-006b-DELETEOF-new-column","[DELETE-OF] As a user, I should add new column in dashboard params","[DELETE-OF] As a user, I should add new column in dashboard params",""
"passed","Fri Nov 11 18:18:27 GMT 2022","Fri Nov 11 18:19:00 GMT 2022","33091","","JIT-Mobile-003-SCREEN-Delete","","JIT-Mobile-003-SCREEN-Delete","[MOBILE-SCREEN] As a user, I can delete screen","[MOBILE-SCREEN] As a user, I can delete screen",""
"passed","Fri Nov 11 19:20:42 GMT 2022","Fri Nov 11 19:22:08 GMT 2022","86316","","JIT-Export-005b-Scenario-RN-all-default-component","","JIT-Export-005b-Scenario-RN-all-default-component","[RN-Default] As a user, I check export the project type React Native with all default component","[RN-Default] As a user, I check export the project type React Native with all default component",""
"passed","Fri Nov 11 18:19:37 GMT 2022","Fri Nov 11 18:20:33 GMT 2022","55895","","JIT-Mobile-011-JITDEF50-disable-add-duplicate-screen-in-stack","","JIT-Mobile-011-JITDEF50-disable-add-duplicate-screen-in-stack","[DEFECT] As a user, I could add duplicate screen in stack","[DEFECT] As a user, I could add duplicate screen in stack",""
"passed","Fri Nov 11 18:31:51 GMT 2022","Fri Nov 11 18:33:36 GMT 2022","105173","","JIT-Module-008a-FB-LOGIN-default-edit","","JIT-Module-008a-FB-LOGIN-default-edit","[FACEBOOK-LOGIN], I can add module Facebook Login and edit its infos","[FACEBOOK-LOGIN], I can add module Facebook Login and edit its infos",""
"failed","Fri Nov 11 19:00:25 GMT 2022","Fri Nov 11 19:00:53 GMT 2022","27405","","JIT-Module-004a-EMAIL-LOGIN-default","","JIT-Module-004a-EMAIL-LOGIN-default","[EMAIL-LOGIN] - Check adding and auto-generated API","[EMAIL-LOGIN] - Check adding and auto-generated API",""
"passed","Fri Nov 11 18:24:57 GMT 2022","Fri Nov 11 18:26:08 GMT 2022","71012","","JIT-Mobile-031b-DIVIDER-General-info","","JIT-Mobile-031b-DIVIDER-General-info","[MOBILE-DIVIDER] As a user, I should check the general infomation of Divider is correct: Name, Key, unique key, delete component","[MOBILE-DIVIDER] As a user, I should check the general infomation of Divider is correct: Name, Key, unique key, delete component",""
"passed","Fri Nov 11 18:40:14 GMT 2022","Fri Nov 11 18:41:49 GMT 2022","95370","","JIT-Web-007a-ASSET-Upload","","JIT-Web-007a-ASSET-Upload","[ASSET] As a user, I can upload new image and store in Asset Manager and use it in all Image component","[ASSET] As a user, I can upload new image and store in Asset Manager and use it in all Image component",""
"passed","Fri Nov 11 18:31:18 GMT 2022","Fri Nov 11 18:32:31 GMT 2022","73516","","JIT-Module-006b-SMS-edit-infos","","JIT-Module-006b-SMS-edit-infos","[SMS], I can add module SMS login with Twilio and edit its infos","[SMS], I can add module SMS login with Twilio and edit its infos",""
"passed","Fri Nov 11 18:37:17 GMT 2022","Fri Nov 11 18:38:51 GMT 2022","93895","","JIT-Web-002c-MOLECULE-Delete","","JIT-Web-002c-MOLECULE-Delete","[WEB-MOLECULE] As a user, I can delete molecule","[WEB-MOLECULE] As a user, I can delete molecule",""
"passed","Fri Nov 11 19:18:56 GMT 2022","Fri Nov 11 19:20:35 GMT 2022","99274","","JIT-Export-005a-Scenario-RN-login-screen","","JIT-Export-005a-Scenario-RN-login-screen","[RN-Login-screen] As a user, I check export the project type React Native and Nextjs successfully with scenario 1","[RN-Login-screen] As a user, I check export the project type React Native and Nextjs successfully with scenario 1",""
"passed","Fri Nov 11 18:19:27 GMT 2022","Fri Nov 11 18:20:22 GMT 2022","54832","","JIT-Mobile-007-MOLECULE-Delete","","JIT-Mobile-007-MOLECULE-Delete","[MOBILE-MOLECULE] As a user, I can delete molecule","[MOBILE-MOLECULE] As a user, I can delete molecule",""
"passed","Fri Nov 11 18:32:03 GMT 2022","Fri Nov 11 18:33:46 GMT 2022","102139","","JIT-Module-010a-LINE-LOGIN-default-edit","","JIT-Module-010a-LINE-LOGIN-default-edit","[LINE-LOGIN], I can add module Line Login and edit its infos","[LINE-LOGIN], I can add module Line Login and edit its infos",""
"passed","Fri Nov 11 18:34:36 GMT 2022","Fri Nov 11 18:35:11 GMT 2022","35548","","JIT-Module-017b-GOOGLE-ANAL-edit-infos","","JIT-Module-017b-GOOGLE-ANAL-edit-infos","[GOOGLE-ANAL] As a user, I can update module Google Analytics","[GOOGLE-ANAL] As a user, I can update module Google Analytics",""
"passed","Fri Nov 11 18:34:22 GMT 2022","Fri Nov 11 18:35:05 GMT 2022","42973","","JIT-Module-015b-SCOUT-edit-infos","","JIT-Module-015b-SCOUT-edit-infos","[SCOUT] As a user, I can update module Scout","[SCOUT] As a user, I can update module Scout",""
"passed","Fri Nov 11 18:40:17 GMT 2022","Fri Nov 11 18:41:56 GMT 2022","99446","","JIT-Web-007b-ASSET-Rename-and-delete","","JIT-Web-007b-ASSET-Rename-and-delete","[ASSET] As a user, I can rename and delete image asset","[ASSET] As a user, I can rename and delete image asset",""
"passed","Fri Nov 11 18:45:22 GMT 2022","Fri Nov 11 18:46:40 GMT 2022","77534","","JIT-Database-015h-INDEX-DATE-column-config","","JIT-Database-015h-INDEX-DATE-column-config","[INDEX-DATE] As a user, I config index from column setting && check on index popup","[INDEX-DATE] As a user, I config index from column setting && check on index popup",""
"passed","Fri Nov 11 18:35:36 GMT 2022","Fri Nov 11 18:36:13 GMT 2022","36712","","JIT-Module-019b-GOOGLE-ANALYTICS-edit-infos","","JIT-Module-019b-GOOGLE-ANALYTICS-edit-infos","[GOOGLE-ANALYTICS] As a user, I can update module Google Analytics information for each environment","[GOOGLE-ANALYTICS] As a user, I can update module Google Analytics information for each environment",""
"passed","Fri Nov 11 18:20:22 GMT 2022","Fri Nov 11 18:21:38 GMT 2022","76521","","JIT-Mobile-013-JITDEF-reflect-delete-screen-innavigation-tree","","JIT-Mobile-013-JITDEF-reflect-delete-screen-innavigation-tree","[DEFECT] As a user, I should see screen will be removed in navigation tree after deleting screen","[DEFECT] As a user, I should see screen will be removed in navigation tree after deleting screen",""
"passed","Fri Nov 11 18:26:45 GMT 2022","Fri Nov 11 18:28:15 GMT 2022","90237","","JIT-Mobile-036a-DATETIMEPICKER-Check-PreviewCode","","JIT-Mobile-036a-DATETIMEPICKER-Check-PreviewCode","[MOBILE-DATETIMEPICKER] As a user, I should check the Preview code of DatetimePicker component","[MOBILE-DATETIMEPICKER] As a user, I should check the Preview code of DatetimePicker component",""
"passed","Fri Nov 11 18:37:19 GMT 2022","Fri Nov 11 18:41:30 GMT 2022","250196","","JIT-Web-002d-MOLECULE-Duplicate","","JIT-Web-002d-MOLECULE-Duplicate","[WEB-MOLECULE] As a user, I can duplicate molecule with positive and negative cases","[WEB-MOLECULE] As a user, I can duplicate molecule with positive and negative cases",""
"passed","Fri Nov 11 19:21:25 GMT 2022","Fri Nov 11 19:23:05 GMT 2022","100387","","JIT-Export-010a-Export-RoR-TODO","","JIT-Export-010a-Export-RoR-TODO","[SMOKE] As a user, I check exprting project TODO with RoR","[SMOKE] As a user, I check exprting project TODO with RoR",""
"broken","Fri Nov 11 19:46:12 GMT 2022","Fri Nov 11 19:47:10 GMT 2022","57883","","JIT-Preview-001-Preview-[NEW]-NextJS-TODO","","JIT-Preview-001-Preview-[NEW]-NextJS-TODO","[PREVIEW-NEW] As a user, I check preview function for project TODO with NextJS","[PREVIEW-NEW] As a user, I check preview function for project TODO with NextJS",""
"passed","Fri Nov 11 18:33:12 GMT 2022","Fri Nov 11 18:34:00 GMT 2022","47677","","JIT-Module-014a-BASIC-AUTH-default","","JIT-Module-014a-BASIC-AUTH-default","[BASIC-AUTH] As a user, I can add module Basic Authentication and remove it","[BASIC-AUTH] As a user, I can add module Basic Authentication and remove it",""
"passed","Fri Nov 11 18:21:40 GMT 2022","Fri Nov 11 18:22:46 GMT 2022","65905","","JIT-Mobile-021-DEFECT.Params.keep-params-after-refresh-page","","JIT-Mobile-021-DEFECT.Params.keep-params-after-refresh-page","[DEFECT] As a user, I should check the params will be kept after refresh page","[DEFECT] As a user, I should check the params will be kept after refresh page",""
"broken","Fri Nov 11 19:06:28 GMT 2022","Fri Nov 11 19:10:28 GMT 2022","240179","","JIT-Dashboard-006a-DELETEOF-default","","JIT-Dashboard-006a-DELETEOF-default","[DELETE-OF] As a user, I should add default column in dashboard params","[DELETE-OF] As a user, I should add default column in dashboard params",""
"passed","Fri Nov 11 18:14:23 GMT 2022","Fri Nov 11 18:15:13 GMT 2022","50139","","JIT-Dashboard-003b-DETAILOF-new-column","","JIT-Dashboard-003b-DETAILOF-new-column","[DEATIL-OF] As a user, I should add new column in dashboard params","[DEATIL-OF] As a user, I should add new column in dashboard params",""
"passed","Fri Nov 11 18:18:41 GMT 2022","Fri Nov 11 18:19:41 GMT 2022","60438","","JIT-Mobile-005-MOLECULE-Create-new","","JIT-Mobile-005-MOLECULE-Create-new","[MOBILE-MOLECULE] As a user, I can create new molecule with positive and negative cases","[MOBILE-MOLECULE] As a user, I can create new molecule with positive and negative cases",""
"passed","Fri Nov 11 18:27:28 GMT 2022","Fri Nov 11 18:29:08 GMT 2022","100269","","JIT-Mobile-042a-ACTION-NAVIGATION-no-param","","JIT-Mobile-042a-ACTION-NAVIGATION-no-param","[MOBILE-ACTION-NAVIGATION] As a user, I could add action type navigation without params and check preview code","[MOBILE-ACTION-NAVIGATION] As a user, I could add action type navigation without params and check preview code",""
"broken","Fri Nov 11 19:06:14 GMT 2022","Fri Nov 11 19:07:15 GMT 2022","61825","","JIT-Dashboard-005c-UPDATEOF-saving","","JIT-Dashboard-005c-UPDATEOF-saving","[UPDATE-OF] As a user, I should save the selected option when switching between tables","[UPDATE-OF] As a user, I should save the selected option when switching between tables",""
"passed","Fri Nov 11 18:17:43 GMT 2022","Fri Nov 11 18:19:00 GMT 2022","76885","","JIT-Mobile-001-SCREEN-Create-new","","JIT-Mobile-001-SCREEN-Create-new","[MOBILE-SCREEN] As a user, I can create new screen with positive and negative cases","[MOBILE-SCREEN] As a user, I can create new screen with positive and negative cases",""
"passed","Fri Nov 11 18:37:15 GMT 2022","Fri Nov 11 18:39:47 GMT 2022","151847","","JIT-Web-002b-MOLECULE-Update","","JIT-Web-002b-MOLECULE-Update","[WEB-MOLECULE] As a user, I can update molecule with positive and negative cases","[WEB-MOLECULE] As a user, I can update molecule with positive and negative cases",""
"passed","Fri Nov 11 18:17:31 GMT 2022","Fri Nov 11 18:18:16 GMT 2022","44477","","JIT-Dashboard-006d-DELETEOF-delete-table","","JIT-Dashboard-006d-DELETEOF-delete-table","[DELETE-OF] As a user, I should see the table is not displayed in dashboard list after removed","[DELETE-OF] As a user, I should see the table is not displayed in dashboard list after removed",""
"passed","Fri Nov 11 18:34:23 GMT 2022","Fri Nov 11 18:35:07 GMT 2022","44713","","JIT-Module-016a-SENDGRID-default","","JIT-Module-016a-SENDGRID-default","[SENDGRID] As a user, I can add module SendGrid and remove it","[SENDGRID] As a user, I can add module SendGrid and remove it",""
"passed","Fri Nov 11 18:42:48 GMT 2022","Fri Nov 11 18:44:01 GMT 2022","73023","","JIT-Database-015e-INDEX-TEXT-column-config","","JIT-Database-015e-INDEX-TEXT-column-config","[INDEX-TEXT] As a user, I config index from column setting && check on index popup","[INDEX-TEXT] As a user, I config index from column setting && check on index popup",""
"passed","Fri Nov 11 18:16:05 GMT 2022","Fri Nov 11 18:17:03 GMT 2022","58216","","JIT-Dashboard-005a-UPDATEOF-default","","JIT-Dashboard-005a-UPDATEOF-default","[UPDATE-OF] As a user, I should add default column in dashboard params","[UPDATE-OF] As a user, I should add default column in dashboard params",""
"passed","Fri Nov 11 18:35:57 GMT 2022","Fri Nov 11 18:37:12 GMT 2022","74874","","JIT-Team-005-Invite-duplicate-email","","JIT-Team-005-Invite-duplicate-email","[INVITE-DELETE] Invite new email and invite again","[INVITE-DELETE] Invite new email and invite again",""
