"Status","Start Time","Stop Time","Duration in ms","Parent Suite","Suite","Sub Suite","Test Class","Test Method","Name","Description"
"passed","Sat Mar 11 19:50:21 GMT 2023","Sat Mar 11 19:51:39 GMT 2023","78648","","JIT-Database-001b-TABLE-empty","","JIT-Database-001b-TABLE-empty","[TABLE] As a user, I cannot create table with empty name","[TABLE] As a user, I cannot create table with empty name",""
"passed","Sat Mar 11 19:18:16 GMT 2023","Sat Mar 11 19:19:13 GMT 2023","57487","","JIT-Module-002b-DEEPLINK-edit-infos","","JIT-Module-002b-DEEPLINK-edit-infos","As a user, I can update module Deeplink","As a user, I can update module Deeplink",""
"passed","Sat Mar 11 18:49:13 GMT 2023","Sat Mar 11 18:50:30 GMT 2023","76416","","JIT-API-005c-PUT-relation","","JIT-API-005c-PUT-relation","As a user, I check column display when having relation for API PUT","As a user, I check column display when having relation for API PUT",""
"passed","Sat Mar 11 18:18:03 GMT 2023","Sat Mar 11 18:19:38 GMT 2023","95023","","JIT-Mobile-005-MOLECULE-Create-new","","JIT-Mobile-005-MOLECULE-Create-new","[MOBILE-MOLECULE] As a user, I can create new molecule with positive and negative cases","[MOBILE-MOLECULE] As a user, I can create new molecule with positive and negative cases",""
"passed","Sat Mar 11 19:27:21 GMT 2023","Sat Mar 11 19:28:03 GMT 2023","42354","","JIT-Module-014b-BASIC-AUTH-edit-infos","","JIT-Module-014b-BASIC-AUTH-edit-infos","[BASIC-AUTH] As a user, I can update module Basic Authentication","[BASIC-AUTH] As a user, I can update module Basic Authentication",""
"passed","Sat Mar 11 18:47:15 GMT 2023","Sat Mar 11 18:48:47 GMT 2023","92129","","JIT-API-004b-GET-detail-update-info","","JIT-API-004b-GET-detail-update-info","As a user, I update info for GET-detail","As a user, I update info for GET-detail",""
"passed","Sat Mar 11 19:20:27 GMT 2023","Sat Mar 11 19:22:31 GMT 2023","123665","","JIT-Module-006a-SMS-default","","JIT-Module-006a-SMS-default","[SMS], I can add module SMS login with Twilio and remove it","[SMS], I can add module SMS login with Twilio and remove it",""
"failed","Sat Mar 11 20:44:38 GMT 2023","Sat Mar 11 20:47:59 GMT 2023","201006","","JIT-Preview-001b-Preview-DATABASE-COL-TEXT-Validation","","JIT-Preview-001b-Preview-DATABASE-COL-TEXT-Validation","[PREVIEW-DATABASE-COL-TEXT] As a user, I check preview function for validation of Text","[PREVIEW-DATABASE-COL-TEXT] As a user, I check preview function for validation of Text",""
"passed","Sat Mar 11 18:16:39 GMT 2023","Sat Mar 11 18:18:20 GMT 2023","101487","","JIT-Database-016b-COUNTER-CACHE-Create-by-adding-column","","JIT-Database-016b-COUNTER-CACHE-Create-by-adding-column","[COUNTER-CACHE] create new counter cache column by adding column","[COUNTER-CACHE] create new counter cache column by adding column",""
"broken","Sat Mar 11 20:29:45 GMT 2023","Sat Mar 11 20:31:27 GMT 2023","101274","","JIT-Export-001-Scenario_ROR_1","","JIT-Export-001-Scenario_ROR_1","As a user, I check export the project type ROR no key successfully with scenario 1","As a user, I check export the project type ROR no key successfully with scenario 1",""
"passed","Sat Mar 11 18:37:17 GMT 2023","Sat Mar 11 18:42:02 GMT 2023","284373","","JIT-Web-002d-MOLECULE-Duplicate","","JIT-Web-002d-MOLECULE-Duplicate","[WEB-MOLECULE] As a user, I can duplicate molecule with positive and negative cases","[WEB-MOLECULE] As a user, I can duplicate molecule with positive and negative cases",""
"passed","Sat Mar 11 18:17:14 GMT 2023","Sat Mar 11 18:19:12 GMT 2023","117704","","JIT-Mobile-001a-SCREEN-Search","","JIT-Mobile-001a-SCREEN-Search","[MOBILE-SCREEN] As a user, I can search correct screen with keyword","[MOBILE-SCREEN] As a user, I can search correct screen with keyword",""
"passed","Sat Mar 11 19:20:00 GMT 2023","Sat Mar 11 19:21:20 GMT 2023","80692","","JIT-Module-005b-FORCE-MOBILE-UPDATE-api","","JIT-Module-005b-FORCE-MOBILE-UPDATE-api","[FORCE-MOBILE-UPDATE] - Check api","[FORCE-MOBILE-UPDATE] - Check api",""
"passed","Sat Mar 11 18:11:42 GMT 2023","Sat Mar 11 18:15:30 GMT 2023","228228","","JIT-Database-007-COLUMN-type-TEXT","","JIT-Database-007-COLUMN-type-TEXT","[COLUMN] As a user, I should check the validation of TEXT column definition","[COLUMN] As a user, I should check the validation of TEXT column definition",""
