"Status","Start Time","Stop Time","Duration in ms","Parent Suite","Suite","Sub Suite","Test Class","Test Method","Name","Description"
"passed","Sat Mar 11 18:29:07 GMT 2023","Sat Mar 11 18:30:16 GMT 2023","68682","","JIT-Module-001a-CLOUDINARY-default","","JIT-Module-001a-CLOUDINARY-default","As a user, I can add module Cloudinary and remove it","As a user, I can add module Cloudinary and remove it",""
"passed","Sat Mar 11 18:55:48 GMT 2023","Sat Mar 11 18:58:37 GMT 2023","169284","","JIT-Database-015b-INDEX-CRUD-single","","JIT-Database-015b-INDEX-CRUD-single","[INDEX] As a user, I check add and update multiple index","[INDEX] As a user, I check add and update multiple index",""
"passed","Sat Mar 11 20:32:37 GMT 2023","Sat Mar 11 20:34:30 GMT 2023","112776","","JIT-Export-005b-Scenario-RN-all-default-component","","JIT-Export-005b-Scenario-RN-all-default-component","[RN-Default] As a user, I check export the project type React Native with all default component","[RN-Default] As a user, I check export the project type React Native with all default component",""
"passed","Sat Mar 11 18:32:31 GMT 2023","Sat Mar 11 18:33:34 GMT 2023","63253","","JIT-Module-013a-AWS-default","","JIT-Module-013a-AWS-default","[AWS] As a user, I can add module AWS SES Integration and remove it","[AWS] As a user, I can add module AWS SES Integration and remove it",""
"passed","Sat Mar 11 18:22:29 GMT 2023","Sat Mar 11 18:24:00 GMT 2023","90710","","JIT-Mobile-026b-BUTTON-General-info","","JIT-Mobile-026b-BUTTON-General-info","[MOBILE-BUTTON] As a user, I should check the general infomation of Button is correct: Name, Key, unique key, delete component","[MOBILE-BUTTON] As a user, I should check the general infomation of Button is correct: Name, Key, unique key, delete component",""
"passed","Sat Mar 11 19:58:25 GMT 2023","Sat Mar 11 20:01:39 GMT 2023","194174","","JIT-Mobile-022b-TEXT-Check-TEXT","","JIT-Mobile-022b-TEXT-Check-TEXT","[MOBILE-TEXT] As a user, I should check the TEXT infomation of Text is correct: Text content, Font, Size, Font weight, Line Height, Spacing, Color, Italic, Underline","[MOBILE-TEXT] As a user, I should check the TEXT infomation of Text is correct: Text content, Font, Size, Font weight, Line Height, Spacing, Color, Italic, Underline",""
"passed","Sat Mar 11 20:11:31 GMT 2023","Sat Mar 11 20:13:44 GMT 2023","133798","","JIT-API-009-Auto-fill","","JIT-API-009-Auto-fill","[AUTO-FILL] As a user, I could add request param by Auto-fill","[AUTO-FILL] As a user, I could add request param by Auto-fill",""
"passed","Sat Mar 11 19:49:29 GMT 2023","Sat Mar 11 19:50:11 GMT 2023","41587","","JIT-Database-013-DEFECT-Check-default-value-when-changing-type","","JIT-Database-013-DEFECT-Check-default-value-when-changing-type","[DEFECT] As a user, I should check the default value when changing the type","[DEFECT] As a user, I should check the default value when changing the type",""
"passed","Sat Mar 11 20:34:37 GMT 2023","Sat Mar 11 20:41:12 GMT 2023","395371","","JIT-Export-010b-Export-RN-TODO","","JIT-Export-010b-Export-RN-TODO","[SMOKE] As a user, I check exprting project TODO with React Native","[SMOKE] As a user, I check exprting project TODO with React Native",""
"passed","Sat Mar 11 18:13:09 GMT 2023","Sat Mar 11 18:15:11 GMT 2023","121728","","JIT-Database-011b-COLUMN-ENUM-add-items","","JIT-Database-011b-COLUMN-ENUM-add-items","[COLUMN] As a user, I should add new item and select in default dropdown","[COLUMN] As a user, I should add new item and select in default dropdown",""
"passed","Sat Mar 11 19:40:58 GMT 2023","Sat Mar 11 19:42:15 GMT 2023","77734","","JIT-Web-002f-MOLECULE-Navigate-edit-screen","","JIT-Web-002f-MOLECULE-Navigate-edit-screen","[WEB-MOLECULE-EDIT] As a user, I can see the molecule in Page and use Edit button see the content of this molecule","[WEB-MOLECULE-EDIT] As a user, I can see the molecule in Page and use Edit button see the content of this molecule",""
"passed","Sat Mar 11 18:36:59 GMT 2023","Sat Mar 11 18:39:27 GMT 2023","147419","","JIT-Web-002c-MOLECULE-Delete","","JIT-Web-002c-MOLECULE-Delete","[WEB-MOLECULE] As a user, I can delete molecule","[WEB-MOLECULE] As a user, I can delete molecule",""
"passed","Sat Mar 11 18:21:16 GMT 2023","Sat Mar 11 18:23:24 GMT 2023","128224","","JIT-Mobile-021-DEFECT.Params.keep-params-after-refresh-page","","JIT-Mobile-021-DEFECT.Params.keep-params-after-refresh-page","[DEFECT] As a user, I should check the params will be kept after refresh page","[DEFECT] As a user, I should check the params will be kept after refresh page",""
"passed","Sat Mar 11 18:27:28 GMT 2023","Sat Mar 11 18:31:16 GMT 2023","228592","","JIT-Mobile-039a-OTP-Check-PreviewCode","","JIT-Mobile-039a-OTP-Check-PreviewCode","[MOBILE-OTP] As a user, I should check the Preview code of OTP component","[MOBILE-OTP] As a user, I should check the Preview code of OTP component",""
"passed","Sat Mar 11 18:40:59 GMT 2023","Sat Mar 11 18:42:47 GMT 2023","108239","","JIT-Web-010a-LAYER-TREE-Check-edit-and-action","","JIT-Web-010a-LAYER-TREE-Check-edit-and-action","[LAYER-TREE] As a user, I could update the name of the node in the layer tree and copy,paste,delete,wrap the node","[LAYER-TREE] As a user, I could update the name of the node in the layer tree and copy,paste,delete,wrap the node",""
"passed","Sat Mar 11 19:00:58 GMT 2023","Sat Mar 11 19:02:43 GMT 2023","104737","","JIT-Database-015m-INDEX-ALL-column-config","","JIT-Database-015m-INDEX-ALL-column-config","[INDEX-ALL] As a user, I config with multiple column and check show multiple on index pop-up","[INDEX-ALL] As a user, I config with multiple column and check show multiple on index pop-up",""
"passed","Sat Mar 11 18:46:44 GMT 2023","Sat Mar 11 18:49:00 GMT 2023","136508","","JIT-API-004a-GET-detail-check-default","","JIT-API-004a-GET-detail-check-default","As a user, I check default value in API GET-detail","As a user, I check default value in API GET-detail",""
"passed","Sat Mar 11 18:32:58 GMT 2023","Sat Mar 11 18:34:17 GMT 2023","78592","","JIT-Module-014a-BASIC-AUTH-default","","JIT-Module-014a-BASIC-AUTH-default","[BASIC-AUTH] As a user, I can add module Basic Authentication and remove it","[BASIC-AUTH] As a user, I can add module Basic Authentication and remove it",""
"passed","Sat Mar 11 18:22:56 GMT 2023","Sat Mar 11 18:24:37 GMT 2023","100446","","JIT-Mobile-028b-ICON-General-info","","JIT-Mobile-028b-ICON-General-info","[MOBILE-ICON] As a user, I should check the general infomation of Icon is correct: Name, Key, unique key, delete component","[MOBILE-ICON] As a user, I should check the general infomation of Icon is correct: Name, Key, unique key, delete component",""
"passed","Sat Mar 11 18:11:21 GMT 2023","Sat Mar 11 18:13:18 GMT 2023","117463","","JIT-Database-004-COLUMN-type-INTEGER","","JIT-Database-004-COLUMN-type-INTEGER","[COLUMN] As a user, I should check the validation of INTEGER column definition","[COLUMN] As a user, I should check the validation of INTEGER column definition",""
"passed","Sat Mar 11 20:52:46 GMT 2023","Sat Mar 11 21:03:53 GMT 2023","666529","","JIT-Preview-004-Preview-BUTTON","","JIT-Preview-004-Preview-BUTTON","[PREVIEW-BUTTON] As a user, I check preview function for Button component","[PREVIEW-BUTTON] As a user, I check preview function for Button component",""
"passed","Sat Mar 11 18:14:09 GMT 2023","Sat Mar 11 18:16:27 GMT 2023","137790","","JIT-Database-012a-RELATION-basic","","JIT-Database-012a-RELATION-basic","[RELATION] check the basic relation","[RELATION] check the basic relation",""
"passed","Sat Mar 11 18:49:34 GMT 2023","Sat Mar 11 18:50:16 GMT 2023","41911","","JIT-API-007a-GROUP-API-CRUD","","JIT-API-007a-GROUP-API-CRUD","[GROUP-API] Create, update and delete group API","[GROUP-API] Create, update and delete group API",""
"passed","Sat Mar 11 18:36:58 GMT 2023","Sat Mar 11 18:40:45 GMT 2023","227273","","JIT-Web-002b-MOLECULE-Update","","JIT-Web-002b-MOLECULE-Update","[WEB-MOLECULE] As a user, I can update molecule with positive and negative cases","[WEB-MOLECULE] As a user, I can update molecule with positive and negative cases",""
"passed","Sat Mar 11 19:43:33 GMT 2023","Sat Mar 11 19:44:28 GMT 2023","54850","","JIT-Database-010a-COLUMN-FILE-validation","","JIT-Database-010a-COLUMN-FILE-validation","[COLUMN] As a user, I should check the validation of FILE column definition","[COLUMN] As a user, I should check the validation of FILE column definition",""
"passed","Sat Mar 11 19:52:45 GMT 2023","Sat Mar 11 19:53:49 GMT 2023","63824","","JIT-Mobile-002-SCREEN-Update","","JIT-Mobile-002-SCREEN-Update","[MOBILE-SCREEN] As a user, I can update screen with positive and negative cases","[MOBILE-SCREEN] As a user, I can update screen with positive and negative cases",""
"passed","Sat Mar 11 19:46:03 GMT 2023","Sat Mar 11 19:47:37 GMT 2023","94044","","JIT-Database-010b-COLUMN-FILE-format-file","","JIT-Database-010b-COLUMN-FILE-format-file","[COLUMN] As a user, I should check the validation of FILE column definition for Format Area","[COLUMN] As a user, I should check the validation of FILE column definition for Format Area",""
"passed","Sat Mar 11 18:24:56 GMT 2023","Sat Mar 11 18:26:32 GMT 2023","96373","","JIT-Mobile-031b-DIVIDER-General-info","","JIT-Mobile-031b-DIVIDER-General-info","[MOBILE-DIVIDER] As a user, I should check the general infomation of Divider is correct: Name, Key, unique key, delete component","[MOBILE-DIVIDER] As a user, I should check the general infomation of Divider is correct: Name, Key, unique key, delete component",""
"passed","Sat Mar 11 19:41:43 GMT 2023","Sat Mar 11 19:43:24 GMT 2023","100752","","JIT-Web-002g-MOLECULE-CRUD-category","","JIT-Web-002g-MOLECULE-CRUD-category","[WEB-MOLECULE-EDIT] As a user, I can see the molecule in Page and use Edit button see the content of this molecule","[WEB-MOLECULE-EDIT] As a user, I can see the molecule in Page and use Edit button see the content of this molecule",""
"passed","Sat Mar 11 20:31:35 GMT 2023","Sat Mar 11 20:34:04 GMT 2023","149210","","JIT-Export-002-Scenario-ROR-withkey-1","","JIT-Export-002-Scenario-ROR-withkey-1","As a user, I check export the project type ROR with key successfully with scenario 1","As a user, I check export the project type ROR with key successfully with scenario 1",""
"passed","Sat Mar 11 18:41:17 GMT 2023","Sat Mar 11 18:42:19 GMT 2023","61768","","JIT-Web-011a-SETTING-PROJECT-VARIABLE","","JIT-Web-011a-SETTING-PROJECT-VARIABLE","[SETTING-PROJECT-VARIABLE] As a user, I can CRUD the Project Variable","[SETTING-PROJECT-VARIABLE] As a user, I can CRUD the Project Variable",""
"passed","Sat Mar 11 20:07:44 GMT 2023","Sat Mar 11 20:09:14 GMT 2023","90389","","JIT-API-007ba-GET-list-API-Add-new-endpoint","","JIT-API-007ba-GET-list-API-Add-new-endpoint","[GET-list-API] Create, update and delete new GET API endpoint","[GET-list-API] Create, update and delete new GET API endpoint",""
"passed","Sat Mar 11 19:42:23 GMT 2023","Sat Mar 11 19:43:43 GMT 2023","80029","","JIT-Web-003a-PREVIEW-NAVIGATION-no-navigation-setup","","JIT-Web-003a-PREVIEW-NAVIGATION-no-navigation-setup","[WEB-PREVIEW-NAVIGATION] As a user, I could open preview screen with default page","[WEB-PREVIEW-NAVIGATION] As a user, I could open preview screen with default page",""
"passed","Sat Mar 11 18:44:04 GMT 2023","Sat Mar 11 18:46:29 GMT 2023","145412","","JIT-API-002a-GET-list-check-default","","JIT-API-002a-GET-list-check-default","As a user, I check default value in API GET list","As a user, I check default value in API GET list",""
"passed","Sat Mar 11 18:49:03 GMT 2023","Sat Mar 11 18:51:38 GMT 2023","154372","","JIT-API-005b-PUT-update-info","","JIT-API-005b-PUT-update-info","As a user, I update info for API PUT","As a user, I update info for API PUT",""
"passed","Sat Mar 11 18:33:50 GMT 2023","Sat Mar 11 18:34:53 GMT 2023","63201","","JIT-Module-017a-GOOGLE-ANAL-default","","JIT-Module-017a-GOOGLE-ANAL-default","[GOOGLE-ANAL] As a user, I can add module Google Analytics and remove it","[GOOGLE-ANAL] As a user, I can add module Google Analytics and remove it",""
"passed","Sat Mar 11 20:21:13 GMT 2023","Sat Mar 11 20:23:03 GMT 2023","109599","","JIT-API-002c-GET-list","","JIT-API-002c-GET-list","As a user, I check column display when having relation for GET-list","As a user, I check column display when having relation for GET-list",""
"passed","Sat Mar 11 18:20:05 GMT 2023","Sat Mar 11 18:21:58 GMT 2023","112661","","JIT-Mobile-014-JITDEF-status-bar","","JIT-Mobile-014-JITDEF-status-bar","[DEFECT] As a user, I should see screen will be removed in navigation tree after deleting screen","[DEFECT] As a user, I should see screen will be removed in navigation tree after deleting screen",""
"passed","Sat Mar 11 19:50:21 GMT 2023","Sat Mar 11 19:52:06 GMT 2023","105131","","JIT-Database-014-DEFECT-Check-duplicate-table-name","","JIT-Database-014-DEFECT-Check-duplicate-table-name","[DEFECT] As a user, I cannot update to duplicate name","[DEFECT] As a user, I cannot update to duplicate name",""
"passed","Sat Mar 11 19:29:02 GMT 2023","Sat Mar 11 19:29:46 GMT 2023","44037","","JIT-Module-016a-SENDGRID-default","","JIT-Module-016a-SENDGRID-default","[SENDGRID] As a user, I can add module SendGrid and remove it","[SENDGRID] As a user, I can add module SendGrid and remove it",""
"passed","Sat Mar 11 20:09:22 GMT 2023","Sat Mar 11 20:11:23 GMT 2023","121968","","JIT-API-007e-PUT-API-Add-new-endpoint","","JIT-API-007e-PUT-API-Add-new-endpoint","[PUT-API] Create, update and delete new PUT API endpoint","[PUT-API] Create, update and delete new PUT API endpoint",""
"passed","Sat Mar 11 19:25:05 GMT 2023","Sat Mar 11 19:27:13 GMT 2023","128396","","JIT-Module-010a-LINE-LOGIN-default-edit","","JIT-Module-010a-LINE-LOGIN-default-edit","[LINE-LOGIN], I can add module Line Login and edit its infos","[LINE-LOGIN], I can add module Line Login and edit its infos",""
"passed","Sat Mar 11 18:33:50 GMT 2023","Sat Mar 11 18:34:59 GMT 2023","69603","","JIT-Module-016b-SENDGRID-edit-infos","","JIT-Module-016b-SENDGRID-edit-infos","[SENDGRID] As a user, I can update module SendGrid","[SENDGRID] As a user, I can update module SendGrid",""
"passed","Sat Mar 11 19:00:41 GMT 2023","Sat Mar 11 19:02:11 GMT 2023","90375","","JIT-Database-015l-INDEX-ENUM-column-config","","JIT-Database-015l-INDEX-ENUM-column-config","[INDEX-ENUM] As a user, I config index from column setting && check on index popup","[INDEX-ENUM] As a user, I config index from column setting && check on index popup",""
"passed","Sat Mar 11 19:44:40 GMT 2023","Sat Mar 11 19:45:54 GMT 2023","74423","","JIT-Web-008a-ADMIN-PAGE-Create-new","","JIT-Web-008a-ADMIN-PAGE-Create-new","[ADMIN-PAGE] As a user, I can create new Admin page","[ADMIN-PAGE] As a user, I can create new Admin page",""
"passed","Sat Mar 11 18:26:20 GMT 2023","Sat Mar 11 18:28:36 GMT 2023","135860","","JIT-Mobile-034b-SCROLLVIEW-General-info","","JIT-Mobile-034b-SCROLLVIEW-General-info","[MOBILE-SCROLLVIEW] As a user, I should check the general infomation of Scroll View is correct: Name, Key, unique key, delete component","[MOBILE-SCROLLVIEW] As a user, I should check the general infomation of Scroll View is correct: Name, Key, unique key, delete component",""
"passed","Sat Mar 11 18:40:03 GMT 2023","Sat Mar 11 18:43:39 GMT 2023","216024","","JIT-Web-007a-ASSET-Upload","","JIT-Web-007a-ASSET-Upload","[ASSET] As a user, I can upload new image and store in Asset Manager and use it in all Image component","[ASSET] As a user, I can upload new image and store in Asset Manager and use it in all Image component",""
"passed","Sat Mar 11 19:58:29 GMT 2023","Sat Mar 11 19:59:50 GMT 2023","81176","","JIT-Database-002-COLUMN-default","","JIT-Database-002-COLUMN-default","[COLUMN] As a user, I should see the default column definition","[COLUMN] As a user, I should see the default column definition",""
"failed","Sat Mar 11 20:02:25 GMT 2023","Sat Mar 11 20:03:57 GMT 2023","91968","","JIT-Mobile-041b-PREVIEW-NAVIGATION-with-navigation-setup","","JIT-Mobile-041b-PREVIEW-NAVIGATION-with-navigation-setup","[MOBILE-PREVIEW-NAVIGATION] As a user, I could open preview screen with setting the screen navigation","[MOBILE-PREVIEW-NAVIGATION] As a user, I could open preview screen with setting the screen navigation",""
"passed","Sat Mar 11 21:02:24 GMT 2023","Sat Mar 11 21:16:42 GMT 2023","858541","","JIT-Preview-005-Preview-TOAST-MESSAGE","","JIT-Preview-005-Preview-TOAST-MESSAGE","[PREVIEW-TOAST-MESSAGE] As a user, I check preview function for Toast message action","[PREVIEW-TOAST-MESSAGE] As a user, I check preview function for Toast message action",""
"passed","Sat Mar 11 18:51:53 GMT 2023","Sat Mar 11 18:54:20 GMT 2023","147574","","JIT-API-007c-GET-detail-API-Add-new-endpoint","","JIT-API-007c-GET-detail-API-Add-new-endpoint","[GET-detail-API] Create, update and delete new GET API endpoint","[GET-detail-API] Create, update and delete new GET API endpoint",""
"passed","Sat Mar 11 18:54:35 GMT 2023","Sat Mar 11 18:56:39 GMT 2023","124541","","JIT-API-010b-DEFECT-Check-JSON-path","","JIT-API-010b-DEFECT-Check-JSON-path","As a user, I want to check the option in dropdown show correct JSON path.","As a user, I want to check the option in dropdown show correct JSON path.",""
"passed","Sat Mar 11 19:29:07 GMT 2023","Sat Mar 11 19:30:46 GMT 2023","98746","","JIT-Database-008-COLUMN-type-DATE-TIME","","JIT-Database-008-COLUMN-type-DATE-TIME","[COLUMN] As a user, I should check the validation of DATETIME column definition","[COLUMN] As a user, I should check the validation of DATETIME column definition",""
"passed","Sat Mar 11 18:28:58 GMT 2023","Sat Mar 11 18:29:42 GMT 2023","43623","","JIT-Module-000-search","","JIT-Module-000-search","[SEARCH] As a user, I can Search module","[SEARCH] As a user, I can Search module",""
"passed","Sat Mar 11 18:58:50 GMT 2023","Sat Mar 11 19:00:30 GMT 2023","100016","","JIT-Database-015h-INDEX-DATE-column-config","","JIT-Database-015h-INDEX-DATE-column-config","[INDEX-DATE] As a user, I config index from column setting && check on index popup","[INDEX-DATE] As a user, I config index from column setting && check on index popup",""
"passed","Sat Mar 11 20:30:20 GMT 2023","Sat Mar 11 20:32:30 GMT 2023","129573","","JIT-Export-005a-Scenario-RN-login-screen","","JIT-Export-005a-Scenario-RN-login-screen","[RN-Login-screen] As a user, I check export the project type React Native and Nextjs successfully with scenario 1","[RN-Login-screen] As a user, I check export the project type React Native and Nextjs successfully with scenario 1",""
"passed","Sat Mar 11 18:29:24 GMT 2023","Sat Mar 11 18:30:49 GMT 2023","84846","","JIT-Module-001b-CLOUDINARY-edit-infos","","JIT-Module-001b-CLOUDINARY-edit-infos","As a user, I can update module Cloudinary","As a user, I can update module Cloudinary",""
"passed","Sat Mar 11 18:45:10 GMT 2023","Sat Mar 11 18:47:20 GMT 2023","130649","","JIT-API-003c-POST-relation","","JIT-API-003c-POST-relation","As a user, I check column display when having relation for API POST","As a user, I check column display when having relation for API POST",""
"passed","Sat Mar 11 18:23:19 GMT 2023","Sat Mar 11 18:24:51 GMT 2023","92611","","JIT-Mobile-029b-TOUCHABLE-General-info","","JIT-Mobile-029b-TOUCHABLE-General-info","[MOBILE-TOUCHABLE] As a user, I should check the general infomation of Touchable is correct: Name, Key, unique key, delete component","[MOBILE-TOUCHABLE] As a user, I should check the general infomation of Touchable is correct: Name, Key, unique key, delete component",""
"passed","Sat Mar 11 20:32:44 GMT 2023","Sat Mar 11 20:34:55 GMT 2023","131373","","JIT-Export-004-Scenario_ROR_2","","JIT-Export-004-Scenario_ROR_2","As a user, I check export the project type ROR with key successfully with scenario 2","As a user, I check export the project type ROR with key successfully with scenario 2",""
"passed","Sat Mar 11 19:47:48 GMT 2023","Sat Mar 11 19:48:55 GMT 2023","67030","","JIT-Database-012c-RELATION-multiple-1-direction","","JIT-Database-012c-RELATION-multiple-1-direction","[RELATION], I should add multiple relation 1 direction","[RELATION], I should add multiple relation 1 direction",""
"passed","Sat Mar 11 18:34:25 GMT 2023","Sat Mar 11 18:35:21 GMT 2023","56148","","JIT-Module-019a-GOOGLE-ANALYTICS-default","","JIT-Module-019a-GOOGLE-ANALYTICS-default","[GOOGLE-ANALYTICS] As a user, I can add module Google Analytics and remove it","[GOOGLE-ANALYTICS] As a user, I can add module Google Analytics and remove it",""
"passed","Sat Mar 11 19:19:21 GMT 2023","Sat Mar 11 19:20:18 GMT 2023","57084","","JIT-Module-005a-FORCE-MOBILE-UPDATE-database","","JIT-Module-005a-FORCE-MOBILE-UPDATE-database","[FORCE-MOBILE-UPDATE] - Check adding and auto-table & columns","[FORCE-MOBILE-UPDATE] - Check adding and auto-table & columns",""
"passed","Sat Mar 11 18:26:42 GMT 2023","Sat Mar 11 18:28:04 GMT 2023","81555","","JIT-Mobile-035b-FLATLIST-General-info","","JIT-Mobile-035b-FLATLIST-General-info","[MOBILE-FLATLIST] As a user, I should check the general infomation of FlatList is correct: Name, Key, unique key, delete component","[MOBILE-FLATLIST] As a user, I should check the general infomation of FlatList is correct: Name, Key, unique key, delete component",""
"passed","Sat Mar 11 19:21:28 GMT 2023","Sat Mar 11 19:23:32 GMT 2023","123783","","JIT-Database-005-COLUMN-type-FLOAT","","JIT-Database-005-COLUMN-type-FLOAT","[COLUMN] As a user, I should check the validation of FLOAT column definition","[COLUMN] As a user, I should check the validation of FLOAT column definition",""
"passed","Sat Mar 11 19:19:04 GMT 2023","Sat Mar 11 19:19:51 GMT 2023","46897","","JIT-Module-004a-EMAIL-LOGIN-default","","JIT-Module-004a-EMAIL-LOGIN-default","[EMAIL-LOGIN] - Check adding and auto-generated API","[EMAIL-LOGIN] - Check adding and auto-generated API",""
"passed","Sat Mar 11 18:27:50 GMT 2023","Sat Mar 11 18:28:48 GMT 2023","58772","","JIT-Mobile-041a-PREVIEW-NAVIGATION-no-navigation-setup","","JIT-Mobile-041a-PREVIEW-NAVIGATION-no-navigation-setup","[MOBILE-PREVIEW-NAVIGATION] As a user, I could open preview screen with notification should setup the screen navigation","[MOBILE-PREVIEW-NAVIGATION] As a user, I could open preview screen with notification should setup the screen navigation",""
"broken","Sat Mar 11 20:34:37 GMT 2023","Sat Mar 11 20:35:12 GMT 2023","35397","","JIT-Export-006-Existing-Scenario-ROR-nokey","","JIT-Export-006-Existing-Scenario-ROR-nokey","As a user, I check export the existing project type ROR no key successfully","As a user, I check export the existing project type ROR no key successfully",""
"passed","Sat Mar 11 18:34:09 GMT 2023","Sat Mar 11 18:34:59 GMT 2023","50292","","JIT-Module-017b-GOOGLE-ANAL-edit-infos","","JIT-Module-017b-GOOGLE-ANAL-edit-infos","[GOOGLE-ANAL] As a user, I can update module Google Analytics","[GOOGLE-ANAL] As a user, I can update module Google Analytics",""
"passed","Sat Mar 11 18:58:45 GMT 2023","Sat Mar 11 19:01:01 GMT 2023","135985","","JIT-Database-015g-INDEX-FLOAT-column-config","","JIT-Database-015g-INDEX-FLOAT-column-config","[INDEX-FLOAT] As a user, I config index from column setting && check on index popup","[INDEX-FLOAT] As a user, I config index from column setting && check on index popup",""
"passed","Sat Mar 11 19:46:58 GMT 2023","Sat Mar 11 19:47:39 GMT 2023","40614","","JIT-Database-001a-TABLE-new","","JIT-Database-001a-TABLE-new","[TABLE] As a user, I can create new table","[TABLE] As a user, I can create new table",""
"passed","Sat Mar 11 18:47:31 GMT 2023","Sat Mar 11 18:49:23 GMT 2023","112721","","JIT-API-005a-PUT-check-default","","JIT-API-005a-PUT-check-default","As a user, I check default value in API PUT","As a user, I check default value in API PUT",""
"passed","Sat Mar 11 18:34:34 GMT 2023","Sat Mar 11 18:35:28 GMT 2023","53169","","JIT-Module-019b-GOOGLE-ANALYTICS-edit-infos","","JIT-Module-019b-GOOGLE-ANALYTICS-edit-infos","[GOOGLE-ANALYTICS] As a user, I can update module Google Analytics information for each environment","[GOOGLE-ANALYTICS] As a user, I can update module Google Analytics information for each environment",""
"passed","Sat Mar 11 19:55:31 GMT 2023","Sat Mar 11 19:56:49 GMT 2023","78255","","JIT-Database-001d-TABLE-update","","JIT-Database-001d-TABLE-update","[TABLE] As a user, I can update the value of the table","[TABLE] As a user, I can update the value of the table",""
"passed","Sat Mar 11 18:13:12 GMT 2023","Sat Mar 11 18:15:19 GMT 2023","126370","","JIT-Database-011c-COLUMN-ENUM-delete-items","","JIT-Database-011c-COLUMN-ENUM-delete-items","[COLUMN] As a user, I should delete 1 item and check not display in default dropdown","[COLUMN] As a user, I should delete 1 item and check not display in default dropdown",""
"passed","Sat Mar 11 19:53:39 GMT 2023","Sat Mar 11 19:54:56 GMT 2023","77183","","JIT-Database-001c-TABLE-duplicate","","JIT-Database-001c-TABLE-duplicate","[TABLE] As a user, I cannot create table with duplicate name","[TABLE] As a user, I cannot create table with duplicate name",""
"passed","Sat Mar 11 19:23:40 GMT 2023","Sat Mar 11 19:24:57 GMT 2023","76993","","JIT-Module-008a-FB-LOGIN-default-edit","","JIT-Module-008a-FB-LOGIN-default-edit","[FACEBOOK-LOGIN], I can add module Facebook Login and edit its infos","[FACEBOOK-LOGIN], I can add module Facebook Login and edit its infos",""
"passed","Sat Mar 11 18:54:34 GMT 2023","Sat Mar 11 18:55:36 GMT 2023","62376","","JIT-API-010a-DEFECT-Check-special-symbol-request-param","","JIT-API-010a-DEFECT-Check-special-symbol-request-param","As a user, I want to validate and prevent the special symbol for request params.","As a user, I want to validate and prevent the special symbol for request params.",""
