"Status","Start Time","Stop Time","Duration in ms","Parent Suite","Suite","Sub Suite","Test Class","Test Method","Name","Description"
"passed","Sat Mar 11 18:22:42 GMT 2023","Sat Mar 11 18:24:09 GMT 2023","87027","","JIT-Mobile-027b-IMAGE-General-info","","JIT-Mobile-027b-IMAGE-General-info","[MOBILE-IMAGE] As a user, I should check the general infomation of Image is correct: Name, Key, unique key, delete component","[MOBILE-IMAGE] As a user, I should check the general infomation of Image is correct: Name, Key, unique key, delete component",""
"failed","Sat Mar 11 20:48:11 GMT 2023","Sat Mar 11 20:51:14 GMT 2023","182912","","JIT-Preview-001c-Preview-DATABASE-COL-INTEGER-Validation","","JIT-Preview-001c-Preview-DATABASE-COL-INTEGER-Validation","[PREVIEW-DATABASE-COL-INTEGER] As a user, I check preview function for validation of Integer","[PREVIEW-DATABASE-COL-INTEGER] As a user, I check preview function for validation of Integer",""
"passed","Sat Mar 11 18:55:43 GMT 2023","Sat Mar 11 18:57:25 GMT 2023","101851","","JIT-API-011-UPDATE-toggle-on-API","","JIT-API-011-UPDATE-toggle-on-API","As a user, I want to see the confirmation when deleting table/column, adding column, update table/column when the API is toggled on","As a user, I want to see the confirmation when deleting table/column, adding column, update table/column when the API is toggled on",""
"passed","Sat Mar 11 19:35:08 GMT 2023","Sat Mar 11 19:36:11 GMT 2023","63265","","JIT-Web-001b-PAGE-Update","","JIT-Web-001b-PAGE-Update","[PAGE] As a user, I can update page with positive and negative cases","[PAGE] As a user, I can update page with positive and negative cases",""
"passed","Sat Mar 11 19:57:36 GMT 2023","Sat Mar 11 19:58:19 GMT 2023","42841","","JIT-Mobile-022a-TEXT-General-info","","JIT-Mobile-022a-TEXT-General-info","[MOBILE-TEXT] As a user, I should check the general infomation of Text is correct: Name, Key, unique key, delete component","[MOBILE-TEXT] As a user, I should check the general infomation of Text is correct: Name, Key, unique key, delete component",""
"passed","Sat Mar 11 19:43:50 GMT 2023","Sat Mar 11 19:45:42 GMT 2023","112055","","JIT-Web-007b-ASSET-Rename-and-delete","","JIT-Web-007b-ASSET-Rename-and-delete","[ASSET] As a user, I can rename and delete image asset","[ASSET] As a user, I can rename and delete image asset",""
"passed","Sat Mar 11 20:17:15 GMT 2023","Sat Mar 11 20:18:55 GMT 2023","100560","","JIT-API-002b-GET-list-update-info","","JIT-API-002b-GET-list-update-info","As a user, I update info for GET-list","As a user, I update info for GET-list",""
"passed","Sat Mar 11 18:30:57 GMT 2023","Sat Mar 11 18:33:33 GMT 2023","155790","","JIT-Module-006b-SMS-edit-infos","","JIT-Module-006b-SMS-edit-infos","[SMS], I can add module SMS login with Twilio and edit its infos","[SMS], I can add module SMS login with Twilio and edit its infos",""
"passed","Sat Mar 11 19:45:52 GMT 2023","Sat Mar 11 19:46:50 GMT 2023","58026","","JIT-Web-009a-TABLE-Add-new","","JIT-Web-009a-TABLE-Add-new","[TABLE] As a user, I can create new Admin page","[TABLE] As a user, I can create new Admin page",""
"passed","Sat Mar 11 20:19:02 GMT 2023","Sat Mar 11 20:21:06 GMT 2023","123929","","JIT-Database-015f-INDEX-INTEGER-column-config","","JIT-Database-015f-INDEX-INTEGER-column-config","[INDEX-INTEGER] As a user, I config index from column setting && check on index popup","[INDEX-INTEGER] As a user, I config index from column setting && check on index popup",""
"passed","Sat Mar 11 18:35:27 GMT 2023","Sat Mar 11 18:37:00 GMT 2023","92206","","JIT-Team-005-Invite-duplicate-email","","JIT-Team-005-Invite-duplicate-email","[INVITE-DELETE] Invite new email and invite again","[INVITE-DELETE] Invite new email and invite again",""
"passed","Sat Mar 11 18:20:20 GMT 2023","Sat Mar 11 18:21:58 GMT 2023","97645","","JIT-Mobile-015-VIEW-General-info","","JIT-Mobile-015-VIEW-General-info","[MOBILE-VIEW] As a user, I should check the general infomation of View is correct: Name, Key, unique key, delete component","[MOBILE-VIEW] As a user, I should check the general infomation of View is correct: Name, Key, unique key, delete component",""
"passed","Sat Mar 11 19:49:03 GMT 2023","Sat Mar 11 19:50:11 GMT 2023","68178","","JIT-Database-012d-RELATION-multiple-2-direction","","JIT-Database-012d-RELATION-multiple-2-direction","[RELATION], I should add multiple relation 2 directions","[RELATION], I should add multiple relation 2 directions",""
"passed","Sat Mar 11 18:36:48 GMT 2023","Sat Mar 11 18:38:44 GMT 2023","116195","","JIT-Web-002a-MOLECULE-Create-new","","JIT-Web-002a-MOLECULE-Create-new","[WEB-MOLECULE] As a user, I can create new molecule with positive and negative cases","[WEB-MOLECULE] As a user, I can create new molecule with positive and negative cases",""
"passed","Sat Mar 11 18:25:29 GMT 2023","Sat Mar 11 18:26:51 GMT 2023","82237","","JIT-Mobile-032b-CAROUSEL-General-info","","JIT-Mobile-032b-CAROUSEL-General-info","[MOBILE-CAROUSEL] As a user, I should check the general infomation of Carousel is correct: Name, Key, unique key, delete component","[MOBILE-CAROUSEL] As a user, I should check the general infomation of Carousel is correct: Name, Key, unique key, delete component",""
"passed","Sat Mar 11 18:24:33 GMT 2023","Sat Mar 11 18:26:18 GMT 2023","104706","","JIT-Mobile-030b-WEBVIEW-General-info","","JIT-Mobile-030b-WEBVIEW-General-info","[MOBILE-WEBVIEW] As a user, I should check the general infomation of Webview is correct: Name, Key, unique key, delete component","[MOBILE-WEBVIEW] As a user, I should check the general infomation of Webview is correct: Name, Key, unique key, delete component",""
"broken","Sat Mar 11 20:35:19 GMT 2023","Sat Mar 11 20:35:52 GMT 2023","32393","","JIT-Export-007-Existing-Scenario-ROR-withkey","","JIT-Export-007-Existing-Scenario-ROR-withkey","As a user, I check export the existing project type ROR with key successfully","As a user, I check export the existing project type ROR with key successfully",""
"failed","Sat Mar 11 20:44:38 GMT 2023","Sat Mar 11 20:48:38 GMT 2023","239640","","JIT-Preview-001a-Preview-DATABASE-COL-STRING-Validation","","JIT-Preview-001a-Preview-DATABASE-COL-STRING-Validation","[PREVIEW-DATABASE-COL-STRING] As a user, I check preview function for validation of String","[PREVIEW-DATABASE-COL-STRING] As a user, I check preview function for validation of String",""
"passed","Sat Mar 11 18:25:53 GMT 2023","Sat Mar 11 18:27:16 GMT 2023","83307","","JIT-Mobile-033b-HEADER-General-info","","JIT-Mobile-033b-HEADER-General-info","[MOBILE-HEADER] As a user, I should check the general infomation of Header is correct: Name, Key, unique key, delete component","[MOBILE-HEADER] As a user, I should check the general infomation of Header is correct: Name, Key, unique key, delete component",""
"passed","Sat Mar 11 18:59:46 GMT 2023","Sat Mar 11 19:00:59 GMT 2023","72934","","JIT-Database-015k-INDEX-BOOLEAN-column-config","","JIT-Database-015k-INDEX-BOOLEAN-column-config","[INDEX-BOOLEAN] As a user, I config index from column setting && check on index popup","[INDEX-BOOLEAN] As a user, I config index from column setting && check on index popup",""
"passed","Sat Mar 11 18:16:53 GMT 2023","Sat Mar 11 18:18:13 GMT 2023","80088","","JIT-Mobile-001-SCREEN-Create-new","","JIT-Mobile-001-SCREEN-Create-new","[MOBILE-SCREEN] As a user, I can create new screen with positive and negative cases","[MOBILE-SCREEN] As a user, I can create new screen with positive and negative cases",""
"passed","Sat Mar 11 18:19:19 GMT 2023","Sat Mar 11 18:27:09 GMT 2023","470425","","JIT-Mobile-009-SEARCH-Components","","JIT-Mobile-009-SEARCH-Components","[MOBILE-SEARCH] As a user, I search component and drag them to preview screen","[MOBILE-SEARCH] As a user, I search component and drag them to preview screen",""
"passed","Sat Mar 11 21:16:55 GMT 2023","Sat Mar 11 21:27:54 GMT 2023","659283","","JIT-Preview-008-Preview-TEXT-HTML-TAG","","JIT-Preview-008-Preview-TEXT-HTML-TAG","[PREVIEW-WEB-TEXT-HTML-TAG] As a user, I check preview HTML tag of Text component","[PREVIEW-WEB-TEXT-HTML-TAG] As a user, I check preview HTML tag of Text component",""
"passed","Sat Mar 11 18:13:40 GMT 2023","Sat Mar 11 18:14:52 GMT 2023","72088","","JIT-Database-011d-COLUMN-ENUM-delete-selected-items","","JIT-Database-011d-COLUMN-ENUM-delete-selected-items","[COLUMN] As a user, I should delete 1 selected item and check is will be removed in default dropdown","[COLUMN] As a user, I should delete 1 selected item and check is will be removed in default dropdown",""
"passed","Sat Mar 11 18:52:03 GMT 2023","Sat Mar 11 18:53:38 GMT 2023","94781","","JIT-API-007d-POST-API-Add-new-endpoint","","JIT-API-007d-POST-API-Add-new-endpoint","[GET-POST] Create, update and delete new POST API endpoint","[GET-POST] Create, update and delete new POST API endpoint",""
"passed","Sat Mar 11 20:51:29 GMT 2023","Sat Mar 11 21:02:13 GMT 2023","644007","","JIT-Preview-003-Preview-REACT-NATIVE","","JIT-Preview-003-Preview-REACT-NATIVE","[PREVIEW-REACT-NATIVE] As a user, I check preview function for React Native","[PREVIEW-REACT-NATIVE] As a user, I check preview function for React Native",""
"passed","Sat Mar 11 19:28:25 GMT 2023","Sat Mar 11 19:28:58 GMT 2023","33596","","JIT-Module-015b-SCOUT-edit-infos","","JIT-Module-015b-SCOUT-edit-infos","[SCOUT] As a user, I can update module Scout","[SCOUT] As a user, I can update module Scout",""
"passed","Sat Mar 11 19:47:46 GMT 2023","Sat Mar 11 19:49:21 GMT 2023","94699","","JIT-Database-011f-COLUMN-ENUM-duplicated","","JIT-Database-011f-COLUMN-ENUM-duplicated","[COLUMN] As a user, I should check counld not add duplicated item","[COLUMN] As a user, I should check counld not add duplicated item",""
"passed","Sat Mar 11 19:22:39 GMT 2023","Sat Mar 11 19:24:02 GMT 2023","82853","","JIT-Module-007a-APPLE-LOGIN-default-edit","","JIT-Module-007a-APPLE-LOGIN-default-edit","[APPLE-LOGIN], I can add module Apple Login and edit its infos","[APPLE-LOGIN], I can add module Apple Login and edit its infos",""
"passed","Sat Mar 11 20:13:52 GMT 2023","Sat Mar 11 20:17:08 GMT 2023","196093","","JIT-Database-015c-INDEX-CRUD-multiple","","JIT-Database-015c-INDEX-CRUD-multiple","[INDEX] As a user, I check add and update single index","[INDEX] As a user, I check add and update single index",""
"passed","Sat Mar 11 18:50:41 GMT 2023","Sat Mar 11 18:52:09 GMT 2023","87389","","JIT-API-007bb-GET-list-API-Check-datetime-static-value","","JIT-API-007bb-GET-list-API-Check-datetime-static-value","[GET-list-API] Set datetime static value","[GET-list-API] Set datetime static value",""
"passed","Sat Mar 11 18:22:51 GMT 2023","Sat Mar 11 18:25:34 GMT 2023","163466","","JIT-Mobile-028a-ICON-Check-PreviewCode","","JIT-Mobile-028a-ICON-Check-PreviewCode","[MOBILE-ICON] As a user, I should check the Preview code of Icon component","[MOBILE-ICON] As a user, I should check the Preview code of Icon component",""
"broken","Sat Mar 11 19:30:53 GMT 2023","Sat Mar 11 19:35:00 GMT 2023","246581","","JIT-Web-001a-PAGE-Create-new","","JIT-Web-001a-PAGE-Create-new","[PAGE] As a user, I can create new screen with positive and negative cases","[PAGE] As a user, I can create new screen with positive and negative cases",""
"passed","Sat Mar 11 19:26:16 GMT 2023","Sat Mar 11 19:28:17 GMT 2023","120661","","JIT-Module-011a-GUEST-LOGIN-default-edit","","JIT-Module-011a-GUEST-LOGIN-default-edit","[GUEST-LOGIN], I can add module Guest Login and edit its infos","[GUEST-LOGIN], I can add module Guest Login and edit its infos",""
"passed","Sat Mar 11 19:56:41 GMT 2023","Sat Mar 11 19:57:29 GMT 2023","47722","","JIT-Mobile-013-JITDEF-reflect-delete-screen-innavigation-tree","","JIT-Mobile-013-JITDEF-reflect-delete-screen-innavigation-tree","[DEFECT] As a user, I should see screen will be removed in navigation tree after deleting screen","[DEFECT] As a user, I should see screen will be removed in navigation tree after deleting screen",""
"passed","Sat Mar 11 18:39:25 GMT 2023","Sat Mar 11 18:42:58 GMT 2023","213472","","JIT-Web-004a-ACTION-NAVIGATION-no-param","","JIT-Web-004a-ACTION-NAVIGATION-no-param","[WEB-ACTION-NAVIGATION] As a user, I could add action type navigation without params and check preview code","[WEB-ACTION-NAVIGATION] As a user, I could add action type navigation without params and check preview code",""
"passed","Sat Mar 11 18:13:41 GMT 2023","Sat Mar 11 18:15:40 GMT 2023","119090","","JIT-Database-011e-COLUMN-ENUM-delete-all","","JIT-Database-011e-COLUMN-ENUM-delete-all","[COLUMN] As a user, I should delete all items and check all items are not displayed","[COLUMN] As a user, I should delete all items and check all items are not displayed",""
"passed","Sat Mar 11 18:45:04 GMT 2023","Sat Mar 11 18:47:03 GMT 2023","118462","","JIT-API-003b-POST-update-info","","JIT-API-003b-POST-update-info","As a user, I update info for API POST","As a user, I update info for API POST",""
"passed","Sat Mar 11 18:56:52 GMT 2023","Sat Mar 11 18:58:23 GMT 2023","90794","","JIT-Database-015d-INDEX-STRING-column-config","","JIT-Database-015d-INDEX-STRING-column-config","[INDEX-STRING] As a user, I config index from column setting && check on index popup","[INDEX-STRING] As a user, I config index from column setting && check on index popup",""
"passed","Sat Mar 11 18:28:50 GMT 2023","Sat Mar 11 18:30:20 GMT 2023","89890","","JIT-Mobile-045a-LAYER-TREE-Check-edit-and-action","","JIT-Mobile-045a-LAYER-TREE-Check-edit-and-action","[MOBILE-LAYER-TREE] As a user, I could update the name of the node in the layer tree and copy,paste,delete,wrap the node","[MOBILE-LAYER-TREE] As a user, I could update the name of the node in the layer tree and copy,paste,delete,wrap the node",""
"passed","Sat Mar 11 21:16:47 GMT 2023","Sat Mar 11 21:28:50 GMT 2023","723709","","JIT-Preview-007-Preview-TABLE","","JIT-Preview-007-Preview-TABLE","[PREVIEW-WEB-TABLE] As a user, I check preview Table","[PREVIEW-WEB-TABLE] As a user, I check preview Table",""
"passed","Sat Mar 11 19:36:19 GMT 2023","Sat Mar 11 19:37:00 GMT 2023","41066","","JIT-Web-001c-PAGE-Delete","","JIT-Web-001c-PAGE-Delete","[PAGE] As a user, I can delete page","[PAGE] As a user, I can delete page",""
"passed","Sat Mar 11 20:00:40 GMT 2023","Sat Mar 11 20:02:18 GMT 2023","97298","","JIT-Mobile-036a-DATETIMEPICKER-Check-PreviewCode","","JIT-Mobile-036a-DATETIMEPICKER-Check-PreviewCode","[MOBILE-DATETIMEPICKER] As a user, I should check the Preview code of DatetimePicker component","[MOBILE-DATETIMEPICKER] As a user, I should check the Preview code of DatetimePicker component",""
"passed","Sat Mar 11 21:04:04 GMT 2023","Sat Mar 11 21:16:36 GMT 2023","752124","","JIT-Preview-006-Preview-FORM-VALIDATION","","JIT-Preview-006-Preview-FORM-VALIDATION","[PREVIEW-WEB-FORM-VALIDATION] As a user, I check preview Form Validation","[PREVIEW-WEB-FORM-VALIDATION] As a user, I check preview Form Validation",""
"passed","Sat Mar 11 18:12:47 GMT 2023","Sat Mar 11 18:14:00 GMT 2023","73389","","JIT-Database-011a-COLUMN-ENUM-default","","JIT-Database-011a-COLUMN-ENUM-default","[COLUMN] As a user, I should check the basic validation","[COLUMN] As a user, I should check the basic validation",""
"passed","Sat Mar 11 18:44:55 GMT 2023","Sat Mar 11 18:47:17 GMT 2023","141940","","JIT-API-003a-POST-check-default","","JIT-API-003a-POST-check-default","As a user, I check default value in API POST","As a user, I check default value in API POST",""
"passed","Sat Mar 11 18:17:40 GMT 2023","Sat Mar 11 18:18:50 GMT 2023","70045","","JIT-Mobile-003-SCREEN-Delete","","JIT-Mobile-003-SCREEN-Delete","[MOBILE-SCREEN] As a user, I can delete screen","[MOBILE-SCREEN] As a user, I can delete screen",""
"failed","Sat Mar 11 20:48:50 GMT 2023","Sat Mar 11 20:52:35 GMT 2023","224112","","JIT-Preview-001d-Preview-DATABASE-COL-FLOAT-Validation","","JIT-Preview-001d-Preview-DATABASE-COL-FLOAT-Validation","[PREVIEW-DATABASE-COL-FLOAT] As a user, I check preview function for validation of Float","[PREVIEW-DATABASE-COL-FLOAT] As a user, I check preview function for validation of Float",""
"passed","Sat Mar 11 19:38:59 GMT 2023","Sat Mar 11 19:40:48 GMT 2023","108631","","JIT-Web-001f-PAGE-Export-and-import","","JIT-Web-001f-PAGE-Export-and-import","[PAGE] As a user, I can create new screen by import and export the screen","[PAGE] As a user, I can create new screen by import and export the screen",""
"passed","Sat Mar 11 19:18:16 GMT 2023","Sat Mar 11 19:18:55 GMT 2023","38625","","JIT-Module-002a-DEEPLINK-default","","JIT-Module-002a-DEEPLINK-default","As a user, I can add module Deeplink and remove it","As a user, I can add module Deeplink and remove it",""
"passed","Sat Mar 11 18:53:53 GMT 2023","Sat Mar 11 18:55:31 GMT 2023","98204","","JIT-API-008-DEFECT-Check-column-file-type","","JIT-API-008-DEFECT-Check-column-file-type","[DEFECT] As a user, I check column type file not display in request params of GET list Api","[DEFECT] As a user, I check column type file not display in request params of GET list Api",""
"passed","Sat Mar 11 20:29:31 GMT 2023","Sat Mar 11 20:32:37 GMT 2023","186185","","JIT-Export-003-Scenario_ROR_2","","JIT-Export-003-Scenario_ROR_2","As a user, I check export the project type ROR no key successfully with scenario 2","As a user, I check export the project type ROR no key successfully with scenario 2",""
"passed","Sat Mar 11 19:59:58 GMT 2023","Sat Mar 11 20:00:33 GMT 2023","34163","","JIT-Database-003a-COLUMN-empty","","JIT-Database-003a-COLUMN-empty","[COLUMN] As a user, I cannot add empty column definition","[COLUMN] As a user, I cannot add empty column definition",""
"passed","Sat Mar 11 19:52:15 GMT 2023","Sat Mar 11 19:53:30 GMT 2023","74906","","JIT-Database-016a-COUNTER-CACHE-Create-by-relation","","JIT-Database-016a-COUNTER-CACHE-Create-by-relation","[COUNTER-CACHE] create new counter cache column by selecting in relation popup","[COUNTER-CACHE] create new counter cache column by selecting in relation popup",""
"passed","Sat Mar 11 18:24:49 GMT 2023","Sat Mar 11 18:27:33 GMT 2023","164366","","JIT-Mobile-031a-DIVIDER-Check-PreviewCode","","JIT-Mobile-031a-DIVIDER-Check-PreviewCode","[MOBILE-DIVIDER] As a user, I should check the Preview code of Divider component","[MOBILE-DIVIDER] As a user, I should check the Preview code of Divider component",""
"passed","Sat Mar 11 20:05:57 GMT 2023","Sat Mar 11 20:07:37 GMT 2023","99294","","JIT-API-001-Check-general-info","","JIT-API-001-Check-general-info","As a user, I check general info","As a user, I check general info",""
"passed","Sat Mar 11 19:40:26 GMT 2023","Sat Mar 11 19:41:36 GMT 2023","69331","","JIT-Web-001g-PAGE-FIGMA-Import","","JIT-Web-001g-PAGE-FIGMA-Import","[PAGE-FIGMA] As a user, I can import the figma file to the jitera studio","[PAGE-FIGMA] As a user, I can import the figma file to the jitera studio",""
"passed","Sat Mar 11 18:37:21 GMT 2023","Sat Mar 11 18:40:56 GMT 2023","215565","","JIT-Web-002e-MOLECULE-Search","","JIT-Web-002e-MOLECULE-Search","[WEB-PAGE] As a user, I can search correct molecule with keyword","[WEB-PAGE] As a user, I can search correct molecule with keyword",""
"passed","Sat Mar 11 18:18:25 GMT 2023","Sat Mar 11 18:20:27 GMT 2023","122198","","JIT-Mobile-005b-MOLECULE-Navigate-edit-screen","","JIT-Mobile-005b-MOLECULE-Navigate-edit-screen","[MOBILE-MOLECULE-EDIT] As a user, I can see the molecule in Screen and use Edit button see the content of this molecule","[MOBILE-MOLECULE-EDIT] As a user, I can see the molecule in Screen and use Edit button see the content of this molecule",""
"passed","Sat Mar 11 19:24:11 GMT 2023","Sat Mar 11 19:26:08 GMT 2023","116291","","JIT-Module-009a-GOOGLE-LOGIN-default-edit","","JIT-Module-009a-GOOGLE-LOGIN-default-edit","[GOOGLE-LOGIN], I can add module Google Login and edit its infos","[GOOGLE-LOGIN], I can add module Google Login and edit its infos",""
"passed","Sat Mar 11 18:47:29 GMT 2023","Sat Mar 11 18:49:19 GMT 2023","110001","","JIT-API-004c-GET-detail-relation","","JIT-API-004c-GET-detail-relation","As a user, I check column display when having relation for GET-detail","As a user, I check column display when having relation for GET-detail",""
"passed","Sat Mar 11 18:11:37 GMT 2023","Sat Mar 11 18:15:08 GMT 2023","210662","","JIT-Database-006-COLUMN-type-STRING","","JIT-Database-006-COLUMN-type-STRING","[COLUMN] As a user, I should check the validation of STRING column definition","[COLUMN] As a user, I should check the validation of STRING column definition",""
"passed","Sat Mar 11 19:39:17 GMT 2023","Sat Mar 11 19:40:18 GMT 2023","61092","","JIT-Database-009-COLUMN-type-BOOLEAN","","JIT-Database-009-COLUMN-type-BOOLEAN","[COLUMN] As a user, I should check the validation of BOOLEAN column definition","[COLUMN] As a user, I should check the validation of BOOLEAN column definition",""
"passed","Sat Mar 11 18:59:13 GMT 2023","Sat Mar 11 19:00:48 GMT 2023","95035","","JIT-Database-015i-INDEX-DATETIME-column-config","","JIT-Database-015i-INDEX-DATETIME-column-config","[INDEX-DATETIME] As a user, I config index from column setting && check on index popup","[INDEX-DATETIME] As a user, I config index from column setting && check on index popup",""
"passed","Sat Mar 11 18:32:42 GMT 2023","Sat Mar 11 18:33:56 GMT 2023","73693","","JIT-Module-013b-AWS-edit-infos","","JIT-Module-013b-AWS-edit-infos","[AWS] As a user, I can update module AWS SES Integration","[AWS] As a user, I can update module AWS SES Integration",""
"passed","Sat Mar 11 19:56:57 GMT 2023","Sat Mar 11 19:58:16 GMT 2023","79160","","JIT-Database-001e-TABLE-create-by-context-menu","","JIT-Database-001e-TABLE-create-by-context-menu","[TABLE] As a user, I can create new table by context menu","[TABLE] As a user, I can create new table by context menu",""
"passed","Sat Mar 11 18:15:44 GMT 2023","Sat Mar 11 18:19:20 GMT 2023","215776","","JIT-Database-012e-RELATION-trigger-by-button","","JIT-Database-012e-RELATION-trigger-by-button","[RELATION] check the basic relation","[RELATION] check the basic relation",""
"passed","Sat Mar 11 18:49:29 GMT 2023","Sat Mar 11 18:51:48 GMT 2023","138628","","JIT-API-006a-DELETE-check-default","","JIT-API-006a-DELETE-check-default","As a user, I check default value in API DELETE","As a user, I check default value in API DELETE",""
"passed","Sat Mar 11 20:01:47 GMT 2023","Sat Mar 11 20:03:20 GMT 2023","93474","","JIT-Database-003b-COLUMN-duplicated","","JIT-Database-003b-COLUMN-duplicated","[COLUMN] As a user, I cannot add duplicated column definition","[COLUMN] As a user, I cannot add duplicated column definition",""
"passed","Sat Mar 11 19:37:07 GMT 2023","Sat Mar 11 19:39:10 GMT 2023","122207","","JIT-Web-001e-PAGE-Search","","JIT-Web-001e-PAGE-Search","[WEB-PAGE] As a user, I can search correct screen with keyword","[WEB-PAGE] As a user, I can search correct screen with keyword",""
"passed","Sat Mar 11 19:55:05 GMT 2023","Sat Mar 11 19:56:33 GMT 2023","87215","","JIT-Mobile-012-JITDEF-remove-poperty-info-after-deleting-navigation","","JIT-Mobile-012-JITDEF-remove-poperty-info-after-deleting-navigation","[DEFECT] As a user, I should see the property infos need to be removed after the navigation was deleted","[DEFECT] As a user, I should see the property infos need to be removed after the navigation was deleted",""
"passed","Sat Mar 11 18:53:02 GMT 2023","Sat Mar 11 18:54:21 GMT 2023","79118","","JIT-API-007f-DELETE-API-Add-new-endpoint","","JIT-API-007f-DELETE-API-Add-new-endpoint","[DELETE-API] Create, update and delete new DELETE API endpoint","[DELETE-API] Create, update and delete new DELETE API endpoint",""
"passed","Sat Mar 11 19:51:48 GMT 2023","Sat Mar 11 19:52:36 GMT 2023","48556","","JIT-Database-015a-INDEX-Check-duplicate-empty","","JIT-Database-015a-INDEX-Check-duplicate-empty","[INDEX] As a user, I check empty and duplicate index","[INDEX] As a user, I check empty and duplicate index",""
"passed","Sat Mar 11 19:53:57 GMT 2023","Sat Mar 11 19:55:23 GMT 2023","86359","","JIT-Mobile-011-JITDEF50-disable-add-duplicate-screen-in-stack","","JIT-Mobile-011-JITDEF50-disable-add-duplicate-screen-in-stack","[DEFECT] As a user, I could add duplicate screen in stack","[DEFECT] As a user, I could add duplicate screen in stack",""
"passed","Sat Mar 11 18:19:02 GMT 2023","Sat Mar 11 18:20:13 GMT 2023","70890","","JIT-Mobile-007-MOLECULE-Delete","","JIT-Mobile-007-MOLECULE-Delete","[MOBILE-MOLECULE] As a user, I can delete molecule","[MOBILE-MOLECULE] As a user, I can delete molecule",""
"passed","Sat Mar 11 18:57:33 GMT 2023","Sat Mar 11 18:59:04 GMT 2023","90523","","JIT-Database-015e-INDEX-TEXT-column-config","","JIT-Database-015e-INDEX-TEXT-column-config","[INDEX-TEXT] As a user, I config index from column setting && check on index popup","[INDEX-TEXT] As a user, I config index from column setting && check on index popup",""
"broken","Sat Mar 11 20:03:29 GMT 2023","Sat Mar 11 20:05:46 GMT 2023","136841","","JIT-Mobile-042a-ACTION-NAVIGATION-no-param","","JIT-Mobile-042a-ACTION-NAVIGATION-no-param","[MOBILE-ACTION-NAVIGATION] As a user, I could add action type navigation without params and check preview code","[MOBILE-ACTION-NAVIGATION] As a user, I could add action type navigation without params and check preview code",""
"passed","Sat Mar 11 18:22:24 GMT 2023","Sat Mar 11 18:25:17 GMT 2023","172856","","JIT-Mobile-022d-TEXT-Check-PADDING-MARGIN","","JIT-Mobile-022d-TEXT-Check-PADDING-MARGIN","[MOBILE-TEXT] As a user, I should check the PADDING & MARGIN infomation of Text is correct: Top, Bottom, Right, Left.","[MOBILE-TEXT] As a user, I should check the PADDING & MARGIN infomation of Text is correct: Top, Bottom, Right, Left.",""
"passed","Sat Mar 11 19:28:12 GMT 2023","Sat Mar 11 19:28:53 GMT 2023","41111","","JIT-Module-015a-SCOUT-default","","JIT-Module-015a-SCOUT-default","[SCOUT] As a user, I can add module Scout and remove it","[SCOUT] As a user, I can add module Scout and remove it",""
