"Status","Start Time","Stop Time","Duration in ms","Parent Suite","Suite","Sub Suite","Test Class","Test Method","Name","Description"
"passed","Tue Jun 21 01:58:41 GMT 2022","Tue Jun 21 01:59:35 GMT 2022","54515","","JIT-Database-001c-TABLE-duplicate","","JIT-Database-001c-TABLE-duplicate","As a user, I cannot create table with duplicate name","As a user, I cannot create table with duplicate name",""
"passed","Tue Jun 21 02:15:21 GMT 2022","Tue Jun 21 02:16:28 GMT 2022","66397","","JIT-API-004c-GET-detail-relation","","JIT-API-004c-GET-detail-relation","As a user, I check column display when having relation for GET-detail","As a user, I check column display when having relation for GET-detail",""
"passed","Tue Jun 21 02:06:35 GMT 2022","Tue Jun 21 02:08:37 GMT 2022","121944","","JIT-Mobile-010-JITDEF14-rename-without-focusing","","JIT-Mobile-010-JITDEF14-rename-without-focusing","As a user, I could rename the screen/molecule without focusing","As a user, I could rename the screen/molecule without focusing",""
"passed","Tue Jun 21 01:55:27 GMT 2022","Tue Jun 21 01:56:39 GMT 2022","72466","","JIT-Dashboard-004e-CREATEOF-delete-column","","JIT-Dashboard-004e-CREATEOF-delete-column","[CREATE-OF] As a user, I should see the params will be removed when column is deleted","[CREATE-OF] As a user, I should see the params will be removed when column is deleted",""
"passed","Tue Jun 21 01:52:56 GMT 2022","Tue Jun 21 01:54:42 GMT 2022","105870","","JIT-Dashboard-003a-DETAILOF-default","","JIT-Dashboard-003a-DETAILOF-default","[DEATIL-OF] As a user, I should add default column in dashboard params","[DEATIL-OF] As a user, I should add default column in dashboard params",""
"passed","Tue Jun 21 02:08:53 GMT 2022","Tue Jun 21 02:10:48 GMT 2022","114097","","JIT-Module-002b-DEEPLINK-edit-infos","","JIT-Module-002b-DEEPLINK-edit-infos","As a user, I can update module Deeplink","As a user, I can update module Deeplink",""
"passed","Tue Jun 21 02:23:05 GMT 2022","Tue Jun 21 02:24:22 GMT 2022","77290","","JIT-Module-011b-GUEST-LOGIN-databse-api","","JIT-Module-011b-GUEST-LOGIN-databse-api","[GUEST-LOGIN], I check auto-generate column and api","[GUEST-LOGIN], I check auto-generate column and api",""
"passed","Tue Jun 21 01:59:23 GMT 2022","Tue Jun 21 02:00:08 GMT 2022","44683","","JIT-Database-002-Check-default-column-definition","","JIT-Database-002-Check-default-column-definition","As a user, I should see the default column definition","As a user, I should see the default column definition",""
"passed","Tue Jun 21 02:12:23 GMT 2022","Tue Jun 21 02:13:12 GMT 2022","48502","","JIT-Module-014b-BASIC-AUTH-edit-infos","","JIT-Module-014b-BASIC-AUTH-edit-infos","[BASIC-AUTH] As a user, I can update module Basic Authentication","[BASIC-AUTH] As a user, I can update module Basic Authentication",""
"passed","Tue Jun 21 02:12:05 GMT 2022","Tue Jun 21 02:13:02 GMT 2022","56699","","JIT-Module-013b-AWS-edit-infos","","JIT-Module-013b-AWS-edit-infos","[AWS] As a user, I can update module AWS SES Integration","[AWS] As a user, I can update module AWS SES Integration",""
"passed","Tue Jun 21 02:22:11 GMT 2022","Tue Jun 21 02:23:42 GMT 2022","91452","","JIT-Module-009b-GOOGLE-LOGIN-databse-api","","JIT-Module-009b-GOOGLE-LOGIN-databse-api","[GOOGLE-LOGIN], I check auto-generate column and api","[GOOGLE-LOGIN], I check auto-generate column and api",""
"passed","Tue Jun 21 02:03:03 GMT 2022","Tue Jun 21 02:04:07 GMT 2022","63589","","JIT-Database-011f-COLUMN-ENUM-duplicated","","JIT-Database-011f-COLUMN-ENUM-duplicated","As a user, I should check counld not add duplicated item","As a user, I should check counld not add duplicated item",""
"passed","Tue Jun 21 01:59:05 GMT 2022","Tue Jun 21 01:59:52 GMT 2022","47022","","JIT-Database-001d-TABLE-update","","JIT-Database-001d-TABLE-update","As a user, I can update the value of the table","As a user, I can update the value of the table",""
"passed","Tue Jun 21 02:18:12 GMT 2022","Tue Jun 21 02:19:24 GMT 2022","71146","","JIT-API-007e-PUT-API-Add-new-endpoint","","JIT-API-007e-PUT-API-Add-new-endpoint","[PUT-API] Create, update and delete new PUT API endpoint","[PUT-API] Create, update and delete new PUT API endpoint",""
"passed","Tue Jun 21 02:01:10 GMT 2022","Tue Jun 21 02:02:07 GMT 2022","57446","","JIT-Database-003-Check-create-empty-and-duplicated-column","","JIT-Database-003-Check-create-empty-and-duplicated-column","As a user, I cannot add duplicated column definition","As a user, I cannot add duplicated column definition",""
"passed","Tue Jun 21 02:04:47 GMT 2022","Tue Jun 21 02:05:43 GMT 2022","55699","","JIT-Mobile-001-Screen-create-new-screen","","JIT-Mobile-001-Screen-create-new-screen","As a user, I can create new screen with positive and negative cases","As a user, I can create new screen with positive and negative cases",""
"passed","Tue Jun 21 02:14:32 GMT 2022","Tue Jun 21 02:15:47 GMT 2022","75444","","JIT-API-003c-POST-relation","","JIT-API-003c-POST-relation","As a user, I check column display when having relation for API POST","As a user, I check column display when having relation for API POST",""
"passed","Tue Jun 21 02:03:36 GMT 2022","Tue Jun 21 02:05:45 GMT 2022","128860","","JIT-Database-012b-RELATION-empty-duplicate","","JIT-Database-012b-RELATION-empty-duplicate","[RELATION], I should see the error duplicate when leaving foreign key empty","[RELATION], I should see the error duplicate when leaving foreign key empty",""
"passed","Tue Jun 21 02:28:20 GMT 2022","Tue Jun 21 02:30:35 GMT 2022","134382","","JIT-Export-003-Scenario_ROR_2","","JIT-Export-003-Scenario_ROR_2","As a user, I check export the project type ROR no key successfully with scenario 2","As a user, I check export the project type ROR no key successfully with scenario 2",""
"passed","Tue Jun 21 02:01:47 GMT 2022","Tue Jun 21 02:03:59 GMT 2022","131826","","JIT-Database-010-Check-validation-column-definition-type-FILE","","JIT-Database-010-Check-validation-column-definition-type-FILE","As a user, I should check the validation of FILE column definition for Format Area","As a user, I should check the validation of FILE column definition for Format Area",""
"passed","Tue Jun 21 01:52:55 GMT 2022","Tue Jun 21 01:54:32 GMT 2022","97675","","JIT-Dashboard-002b-LISTOF-new-column","","JIT-Dashboard-002b-LISTOF-new-column","[LIST-OF] As a user, I should add new column in dashboard params","[LIST-OF] As a user, I should add new column in dashboard params",""
"passed","Tue Jun 21 02:11:05 GMT 2022","Tue Jun 21 02:12:28 GMT 2022","82968","","JIT-Module-009a-GOOGLE-LOGIN-default-edit","","JIT-Module-009a-GOOGLE-LOGIN-default-edit","[GOOGLE-LOGIN], I can add module Google Login and edit its infos","[GOOGLE-LOGIN], I can add module Google Login and edit its infos",""
"passed","Tue Jun 21 02:01:49 GMT 2022","Tue Jun 21 02:02:55 GMT 2022","66061","","JIT-Database-008-Check-validation-column-definition-type-DATE-TIME","","JIT-Database-008-Check-validation-column-definition-type-DATE-TIME","As a user, I should check the validation of DATE column definition","As a user, I should check the validation of DATE column definition",""
"passed","Tue Jun 21 01:58:06 GMT 2022","Tue Jun 21 01:59:34 GMT 2022","87550","","JIT-Dashboard-006d-DELETEOF-delete-table","","JIT-Dashboard-006d-DELETEOF-delete-table","[DELETE-OF] As a user, I should see the table is not displayed in dashboard list after removed","[DELETE-OF] As a user, I should see the table is not displayed in dashboard list after removed",""
"passed","Tue Jun 21 02:17:21 GMT 2022","Tue Jun 21 02:18:38 GMT 2022","77003","","JIT-API-007b-GET-list-API-Add-new-endpoint","","JIT-API-007b-GET-list-API-Add-new-endpoint","[GET-list-API] Create, update and delete new GET API endpoint","[GET-list-API] Create, update and delete new GET API endpoint",""
"passed","Tue Jun 21 02:04:36 GMT 2022","Tue Jun 21 02:06:23 GMT 2022","106880","","JIT-Database-016a-COUNTER-CACHE-Create-by-relation","","JIT-Database-016a-COUNTER-CACHE-Create-by-relation","[COUNTER-CACHE] create new counter cache column by selecting in relation popup","[COUNTER-CACHE] create new counter cache column by selecting in relation popup",""
"passed","Tue Jun 21 01:52:54 GMT 2022","Tue Jun 21 01:54:43 GMT 2022","108015","","JIT-Dashboard-002e-LISTOF-delete-column","","JIT-Dashboard-002e-LISTOF-delete-column","As a user, I should see the params will be removed when column is deleted","As a user, I should see the params will be removed when column is deleted",""
"passed","Tue Jun 21 02:00:05 GMT 2022","Tue Jun 21 02:02:41 GMT 2022","155215","","JIT-Database-007-Check-validation-column-definition-type-TEXT","","JIT-Database-007-Check-validation-column-definition-type-TEXT","As a user, I should check the validation of TEXT column definition","As a user, I should check the validation of TEXT column definition",""
"passed","Tue Jun 21 02:16:45 GMT 2022","Tue Jun 21 02:17:53 GMT 2022","67893","","JIT-API-006c-DELETE-relation","","JIT-API-006c-DELETE-relation","As a user, I check column display when having relation for API DELETE","As a user, I check column display when having relation for API DELETE",""
"passed","Tue Jun 21 01:56:29 GMT 2022","Tue Jun 21 01:57:57 GMT 2022","87534","","JIT-Dashboard-005a-UPDATEOF-default","","JIT-Dashboard-005a-UPDATEOF-default","[UPDATE-OF] As a user, I should add default column in dashboard params","[UPDATE-OF] As a user, I should add default column in dashboard params",""
"passed","Tue Jun 21 02:21:43 GMT 2022","Tue Jun 21 02:24:11 GMT 2022","148250","","JIT-Module-008b-FB-LOGIN-databse-api","","JIT-Module-008b-FB-LOGIN-databse-api","[FACEBOOK-LOGIN], I check auto-generate column and api","[FACEBOOK-LOGIN], I check auto-generate column and api",""
"passed","Tue Jun 21 01:52:54 GMT 2022","Tue Jun 21 01:54:51 GMT 2022","117078","","JIT-Dashboard-002a-LISTOF-default-column","","JIT-Dashboard-002a-LISTOF-default-column","[LIST-OF] As a user, I should add default column in dashboard params","[LIST-OF] As a user, I should add default column in dashboard params",""
"passed","Tue Jun 21 01:52:55 GMT 2022","Tue Jun 21 01:54:50 GMT 2022","114229","","JIT-Dashboard-002c-LISTOF-saving","","JIT-Dashboard-002c-LISTOF-saving","[LIST-OF] As a user, I should save the selected option when switching between tables","[LIST-OF] As a user, I should save the selected option when switching between tables",""
"passed","Tue Jun 21 02:09:07 GMT 2022","Tue Jun 21 02:10:34 GMT 2022","87099","","JIT-Module-005a-FORCE-MOBILE-UPDATE-database","","JIT-Module-005a-FORCE-MOBILE-UPDATE-database","[FORCE-MOBILE-UPDATE] - Check adding and auto-table & columns","[FORCE-MOBILE-UPDATE] - Check adding and auto-table & columns",""
"passed","Tue Jun 21 02:05:09 GMT 2022","Tue Jun 21 02:06:15 GMT 2022","65614","","JIT-Mobile-003-Screen-delete-screen","","JIT-Mobile-003-Screen-delete-screen","As a user, I can delete screen","As a user, I can delete screen",""
