"Status","Start Time","Stop Time","Duration in ms","Parent Suite","Suite","Sub Suite","Test Class","Test Method","Name","Description"
"passed","Tue Jun 21 02:09:56 GMT 2022","Tue Jun 21 02:11:07 GMT 2022","70535","","JIT-Module-006a-SMS-default","","JIT-Module-006a-SMS-default","[SMS], I can add module SMS login with Twilio and remove it","[SMS], I can add module SMS login with Twilio and remove it",""
"passed","Tue Jun 21 01:55:27 GMT 2022","Tue Jun 21 01:56:52 GMT 2022","84789","","JIT-Dashboard-004d-CREATEOF-delete-table","","JIT-Dashboard-004d-CREATEOF-delete-table","[CREATE-OF] As a user, I should see the table is not displayed in dashboard list after removed","[CREATE-OF] As a user, I should see the table is not displayed in dashboard list after removed",""
"passed","Tue Jun 21 01:59:52 GMT 2022","Tue Jun 21 02:02:09 GMT 2022","137084","","JIT-Database-005-Check-validation-column-definition-type-FLOAT","","JIT-Database-005-Check-validation-column-definition-type-FLOAT","As a user, I should check the validation of FLOAT column definition","As a user, I should check the validation of FLOAT column definition",""
"passed","Tue Jun 21 01:59:39 GMT 2022","Tue Jun 21 02:01:10 GMT 2022","90808","","JIT-Database-003-Check-create-empty-and-duplicated-column","","JIT-Database-003-Check-create-empty-and-duplicated-column","As a user, I cannot add empty column definition","As a user, I cannot add empty column definition",""
"passed","Tue Jun 21 02:17:18 GMT 2022","Tue Jun 21 02:17:51 GMT 2022","32849","","JIT-API-007a-GROUP-API-CRUD","","JIT-API-007a-GROUP-API-CRUD","[GROUP-API] Create, update and delete group API","[GROUP-API] Create, update and delete group API",""
"passed","Tue Jun 21 02:30:39 GMT 2022","Tue Jun 21 02:32:48 GMT 2022","128750","","JIT-Export-004-Scenario_ROR_2","","JIT-Export-004-Scenario_ROR_2","As a user, I check export the project type ROR with key successfully with scenario 2","As a user, I check export the project type ROR with key successfully with scenario 2",""
"passed","Tue Jun 21 02:28:18 GMT 2022","Tue Jun 21 02:28:41 GMT 2022","22571","","JIT-Export-006-Existing-Scenario-ROR-nokey","","JIT-Export-006-Existing-Scenario-ROR-nokey","As a user, I check export the existing project type ROR no key successfully","As a user, I check export the existing project type ROR no key successfully",""
"passed","Tue Jun 21 02:19:36 GMT 2022","Tue Jun 21 02:21:57 GMT 2022","141633","","JIT-Module-004-EMAIL-LOGIN","","JIT-Module-004-EMAIL-LOGIN","[EMAIL-LOGIN] - Check adding and auto-generated API","[EMAIL-LOGIN] - Check adding and auto-generated API",""
"passed","Tue Jun 21 02:11:58 GMT 2022","Tue Jun 21 02:12:44 GMT 2022","46399","","JIT-Module-013a-AWS-default","","JIT-Module-013a-AWS-default","[AWS] As a user, I can add module AWS SES Integration and remove it","[AWS] As a user, I can add module AWS SES Integration and remove it",""
"passed","Tue Jun 21 01:59:44 GMT 2022","Tue Jun 21 02:01:42 GMT 2022","118456","","JIT-Database-004-Check-validation-column-definition-type-INTEGER","","JIT-Database-004-Check-validation-column-definition-type-INTEGER","As a user, I should check the validation of INTEGER column definition","As a user, I should check the validation of INTEGER column definition",""
"passed","Tue Jun 21 02:26:28 GMT 2022","Tue Jun 21 02:27:04 GMT 2022","35751","","JIT-Module-001a-CLOUDINARY-default","","JIT-Module-001a-CLOUDINARY-default","As a user, I can add module Cloudinary and remove it","As a user, I can add module Cloudinary and remove it",""
"passed","Tue Jun 21 02:00:28 GMT 2022","Tue Jun 21 02:01:47 GMT 2022","79538","","JIT-Database-010-Check-validation-column-definition-type-FILE","","JIT-Database-010-Check-validation-column-definition-type-FILE","As a user, I should check the validation of FILE column definition","As a user, I should check the validation of FILE column definition",""
"passed","Tue Jun 21 02:02:08 GMT 2022","Tue Jun 21 02:03:12 GMT 2022","63832","","JIT-Database-011b-COLUMN-ENUM-add-items","","JIT-Database-011b-COLUMN-ENUM-add-items","As a user, I should add new item and select in default dropdown","As a user, I should add new item and select in default dropdown",""
"passed","Tue Jun 21 02:13:30 GMT 2022","Tue Jun 21 02:14:19 GMT 2022","48756","","JIT-API-001-Check-general-info","","JIT-API-001-Check-general-info","As a user, I check general info","As a user, I check general info",""
"passed","Tue Jun 21 02:29:53 GMT 2022","Tue Jun 21 02:31:43 GMT 2022","110256","","JIT-Export-009-Existing-Scenario-ROR-withkey-Jump-team","","JIT-Export-009-Existing-Scenario-ROR-withkey-Jump-team","[JUMP-TEAM] Existing project - With key","[JUMP-TEAM] Existing project - With key",""
"passed","Tue Jun 21 02:06:41 GMT 2022","Tue Jun 21 02:07:50 GMT 2022","68453","","JIT-Mobile-011-JITDEF50-disable-add-duplicate-screen-in-stack","","JIT-Mobile-011-JITDEF50-disable-add-duplicate-screen-in-stack","As a user, I could add duplicate screen in stack","As a user, I could add duplicate screen in stack",""
"passed","Tue Jun 21 02:18:04 GMT 2022","Tue Jun 21 02:19:16 GMT 2022","71475","","JIT-API-007d-POST-API-Add-new-endpoint","","JIT-API-007d-POST-API-Add-new-endpoint","[GET-POST] Create, update and delete new POST API endpoint","[GET-POST] Create, update and delete new POST API endpoint",""
"passed","Tue Jun 21 02:03:41 GMT 2022","Tue Jun 21 02:04:39 GMT 2022","57772","","JIT-Database-013-DEFECT-Check-default-value-when-changing-type","","JIT-Database-013-DEFECT-Check-default-value-when-changing-type","As a user, I should check the default value when changing the type","As a user, I should check the default value when changing the type",""
"passed","Tue Jun 21 02:04:26 GMT 2022","Tue Jun 21 02:05:43 GMT 2022","76670","","JIT-Database-015a-INDEX-Check-duplicate-empty","","JIT-Database-015a-INDEX-Check-duplicate-empty","As a user, I check empty and duplicate index","As a user, I check empty and duplicate index",""
"passed","Tue Jun 21 02:15:05 GMT 2022","Tue Jun 21 02:16:31 GMT 2022","86056","","JIT-API-004a-GET-detail-check-default","","JIT-API-004a-GET-detail-check-default","As a user, I check default value in API GET-detail","As a user, I check default value in API GET-detail",""
"passed","Tue Jun 21 02:28:45 GMT 2022","Tue Jun 21 02:29:07 GMT 2022","22085","","JIT-Export-007-Existing-Scenario-ROR-withkey","","JIT-Export-007-Existing-Scenario-ROR-withkey","As a user, I check export the existing project type ROR with key successfully","As a user, I check export the existing project type ROR with key successfully",""
"passed","Tue Jun 21 02:01:59 GMT 2022","Tue Jun 21 02:03:04 GMT 2022","65212","","JIT-Database-011a-COLUMN-ENUM-default","","JIT-Database-011a-COLUMN-ENUM-default","As a user, I should check the basic validation","As a user, I should check the basic validation",""
"passed","Tue Jun 21 02:15:59 GMT 2022","Tue Jun 21 02:17:10 GMT 2022","71340","","JIT-API-005c-PUT-relation","","JIT-API-005c-PUT-relation","As a user, I check column display when having relation for API PUT","As a user, I check column display when having relation for API PUT",""
"passed","Tue Jun 21 01:53:08 GMT 2022","Tue Jun 21 01:54:34 GMT 2022","86264","","JIT-Dashboard-003b-DETAILOF-new-column","","JIT-Dashboard-003b-DETAILOF-new-column","[DEATIL-OF] As a user, I should add new column in dashboard params","[DEATIL-OF] As a user, I should add new column in dashboard params",""
"passed","Tue Jun 21 02:19:26 GMT 2022","Tue Jun 21 02:21:59 GMT 2022","152928","","JIT-API-009-Auto-fill","","JIT-API-009-Auto-fill","[AUTO-FILL] As a user, I could add request param by Auto-fill","[AUTO-FILL] As a user, I could add request param by Auto-fill",""
"passed","Tue Jun 21 02:12:41 GMT 2022","Tue Jun 21 02:13:12 GMT 2022","31259","","JIT-Module-015b-SCOUT-edit-infos","","JIT-Module-015b-SCOUT-edit-infos","[SCOUT] As a user, I can update module Scout","[SCOUT] As a user, I can update module Scout",""
"passed","Tue Jun 21 02:26:29 GMT 2022","Tue Jun 21 02:26:49 GMT 2022","20878","","JIT-Module-000-search","","JIT-Module-000-search","[SEARCH] As a user, I can Search module","[SEARCH] As a user, I can Search module",""
"passed","Tue Jun 21 02:02:39 GMT 2022","Tue Jun 21 02:04:02 GMT 2022","83594","","JIT-Database-011d-COLUMN-ENUM-delete-selected-items","","JIT-Database-011d-COLUMN-ENUM-delete-selected-items","As a user, I should delete 1 selected item and check is will be removed in default dropdown","As a user, I should delete 1 selected item and check is will be removed in default dropdown",""
"passed","Tue Jun 21 01:57:53 GMT 2022","Tue Jun 21 01:59:04 GMT 2022","70518","","JIT-Dashboard-006b-DELETEOF-new-column","","JIT-Dashboard-006b-DELETEOF-new-column","[DELETE-OF] As a user, I should add new column in dashboard params","[DELETE-OF] As a user, I should add new column in dashboard params",""
"passed","Tue Jun 21 02:12:19 GMT 2022","Tue Jun 21 02:13:08 GMT 2022","49140","","JIT-Module-014a-BASIC-AUTH-default","","JIT-Module-014a-BASIC-AUTH-default","[BASIC-AUTH] As a user, I can add module Basic Authentication and remove it","[BASIC-AUTH] As a user, I can add module Basic Authentication and remove it",""
"passed","Tue Jun 21 02:06:21 GMT 2022","Tue Jun 21 02:07:26 GMT 2022","64629","","JIT-Mobile-007-Molecule-delete-molecule","","JIT-Mobile-007-Molecule-delete-molecule","As a user, I can delete molecule","As a user, I can delete molecule",""
"passed","Tue Jun 21 02:31:19 GMT 2022","Tue Jun 21 02:33:09 GMT 2022","110358","","JIT-Export-002-Scenario-ROR-withkey-1","","JIT-Export-002-Scenario-ROR-withkey-1","As a user, I check export the project type ROR with key successfully with scenario 1","As a user, I check export the project type ROR with key successfully with scenario 1",""
"passed","Tue Jun 21 02:18:51 GMT 2022","Tue Jun 21 02:20:03 GMT 2022","72205","","JIT-API-007f-DELETE-API-Add-new-endpoint","","JIT-API-007f-DELETE-API-Add-new-endpoint","[DELETE-API] Create, update and delete new DELETE API endpoint","[DELETE-API] Create, update and delete new DELETE API endpoint",""
"passed","Tue Jun 21 02:06:53 GMT 2022","Tue Jun 21 02:08:01 GMT 2022","68593","","JIT-Mobile-012-JITDEF-remove-poperty-info-after-deleting-navigation","","JIT-Mobile-012-JITDEF-remove-poperty-info-after-deleting-navigation","As a user, I should see the property infos need to be removed after the navigation was deleted","As a user, I should see the property infos need to be removed after the navigation was deleted",""
"passed","Tue Jun 21 02:22:12 GMT 2022","Tue Jun 21 02:23:41 GMT 2022","89171","","JIT-Module-010b-LINE-LOGIN-databse-api","","JIT-Module-010b-LINE-LOGIN-databse-api","[LINE-LOGIN], I check auto-generate column and api","[LINE-LOGIN], I check auto-generate column and api",""
"passed","Tue Jun 21 01:52:55 GMT 2022","Tue Jun 21 01:54:44 GMT 2022","109107","","JIT-Dashboard-002d-LISTOF-delete-table","","JIT-Dashboard-002d-LISTOF-delete-table","[LIST-OF] As a user, I should see the table is not displayed in dashboard list after removed","[LIST-OF] As a user, I should see the table is not displayed in dashboard list after removed",""
"passed","Tue Jun 21 01:58:21 GMT 2022","Tue Jun 21 01:59:34 GMT 2022","73304","","JIT-Dashboard-006e-DELETEOF-delete-column","","JIT-Dashboard-006e-DELETEOF-delete-column","[DELETE-OF] As a user, I should see the params will be removed when column is deleted","[DELETE-OF] As a user, I should see the params will be removed when column is deleted",""
"passed","Tue Jun 21 02:02:38 GMT 2022","Tue Jun 21 02:04:03 GMT 2022","84936","","JIT-Database-011c-COLUMN-ENUM-delete-items","","JIT-Database-011c-COLUMN-ENUM-delete-items","As a user, I should delete 1 item and check not display in default dropdown","As a user, I should delete 1 item and check not display in default dropdown",""
"passed","Tue Jun 21 02:15:28 GMT 2022","Tue Jun 21 02:17:08 GMT 2022","99781","","JIT-API-005a-PUT-check-default","","JIT-API-005a-PUT-check-default","As a user, I check default value in API PUT","As a user, I check default value in API PUT",""
"passed","Tue Jun 21 02:13:32 GMT 2022","Tue Jun 21 02:14:52 GMT 2022","80134","","JIT-API-002c-GET-list","","JIT-API-002c-GET-list","As a user, I check column display when having relation for GET-list","As a user, I check column display when having relation for GET-list",""
"passed","Tue Jun 21 01:57:25 GMT 2022","Tue Jun 21 01:58:43 GMT 2022","77965","","JIT-Dashboard-006a-DELETEOF-default","","JIT-Dashboard-006a-DELETEOF-default","[DELETE-OF] As a user, I should add default column in dashboard params","[DELETE-OF] As a user, I should add default column in dashboard params",""
"passed","Tue Jun 21 02:06:13 GMT 2022","Tue Jun 21 02:07:26 GMT 2022","72606","","JIT-Mobile-005-Moelcule-create-new-molecule","","JIT-Mobile-005-Moelcule-create-new-molecule","As a user, I can create new molecule with positive and negative cases","As a user, I can create new molecule with positive and negative cases",""
"passed","Tue Jun 21 02:00:21 GMT 2022","Tue Jun 21 02:01:35 GMT 2022","74189","","JIT-Database-009-Check-validation-column-definition-type-BOOLEAN","","JIT-Database-009-Check-validation-column-definition-type-BOOLEAN","As a user, I should check the validation of BOOLEAN column definition","As a user, I should check the validation of BOOLEAN column definition",""
"passed","Tue Jun 21 02:05:14 GMT 2022","Tue Jun 21 02:08:01 GMT 2022","167242","","JIT-Mobile-004-Screen-duplicate-screen","","JIT-Mobile-004-Screen-duplicate-screen","As a user, I can duplicate screen with positive and negative cases","As a user, I can duplicate screen with positive and negative cases",""
"passed","Tue Jun 21 01:55:13 GMT 2022","Tue Jun 21 01:57:40 GMT 2022","146716","","JIT-Dashboard-004a-CREATEOF-default","","JIT-Dashboard-004a-CREATEOF-default","[CREATE-OF] As a user, I should add default column in dashboard params","[CREATE-OF] As a user, I should add default column in dashboard params",""
"passed","Tue Jun 21 02:03:23 GMT 2022","Tue Jun 21 02:04:44 GMT 2022","80514","","JIT-Database-012a-RELATION-basic","","JIT-Database-012a-RELATION-basic","[RELATION] check the basic relation","[RELATION] check the basic relation",""
"passed","Tue Jun 21 02:08:55 GMT 2022","Tue Jun 21 02:10:33 GMT 2022","98240","","JIT-Module-003-JPBANK-default","","JIT-Module-003-JPBANK-default","[JPBANK] - Check adding and auto-generated API","[JPBANK] - Check adding and auto-generated API",""
"passed","Tue Jun 21 02:21:16 GMT 2022","Tue Jun 21 02:22:57 GMT 2022","101661","","JIT-Module-007b-APPLE-LOGIN-databse-api","","JIT-Module-007b-APPLE-LOGIN-databse-api","[APPLE-LOGIN], I check auto-generate column and api","[APPLE-LOGIN], I check auto-generate column and api",""
"passed","Tue Jun 21 01:58:41 GMT 2022","Tue Jun 21 01:59:22 GMT 2022","41117","","JIT-Database-001b-TABLE-empty","","JIT-Database-001b-TABLE-empty","As a user, I cannot create table with empty name","As a user, I cannot create table with empty name",""
"passed","Tue Jun 21 02:20:15 GMT 2022","Tue Jun 21 02:21:34 GMT 2022","79249","","JIT-Module-006c-SMS-database-api","","JIT-Module-006c-SMS-database-api","[SMS], I check auto-generate column and api","[SMS], I check auto-generate column and api",""
"passed","Tue Jun 21 01:56:28 GMT 2022","Tue Jun 21 01:57:37 GMT 2022","68305","","JIT-Dashboard-005b-UPDATEOF-new-column","","JIT-Dashboard-005b-UPDATEOF-new-column","[UPDATE-OF] As a user, I should add new column in dashboard params","[UPDATE-OF] As a user, I should add new column in dashboard params",""
"passed","Tue Jun 21 02:06:19 GMT 2022","Tue Jun 21 02:08:04 GMT 2022","104683","","JIT-Mobile-006-Molecule-update-molecule","","JIT-Mobile-006-Molecule-update-molecule","As a user, I can update molecule with positive and negative cases","As a user, I can update molecule with positive and negative cases",""
"passed","Tue Jun 21 02:08:48 GMT 2022","Tue Jun 21 02:10:43 GMT 2022","115318","","JIT-Module-001b-CLOUDINARY-edit-infos","","JIT-Module-001b-CLOUDINARY-edit-infos","As a user, I can update module Cloudinary","As a user, I can update module Cloudinary",""
"passed","Tue Jun 21 01:54:44 GMT 2022","Tue Jun 21 01:56:05 GMT 2022","80813","","JIT-Dashboard-003c-DETAILOF-saving","","JIT-Dashboard-003c-DETAILOF-saving","[DEATIL-OF] As a user, I should save the selected option when switching between tables","[DEATIL-OF] As a user, I should save the selected option when switching between tables",""
"passed","Tue Jun 21 01:54:52 GMT 2022","Tue Jun 21 01:56:09 GMT 2022","76633","","JIT-Dashboard-003e-DETAILOF-delete-column","","JIT-Dashboard-003e-DETAILOF-delete-column","[DEATIL-OF] As a user, I should see the params will be removed when column is deleted","[DEATIL-OF] As a user, I should see the params will be removed when column is deleted",""
"passed","Tue Jun 21 02:04:51 GMT 2022","Tue Jun 21 02:06:08 GMT 2022","77048","","JIT-Mobile-002-Screen-update-screen","","JIT-Mobile-002-Screen-update-screen","As a user, I can update screen with positive and negative cases","As a user, I can update screen with positive and negative cases",""
"passed","Tue Jun 21 02:04:15 GMT 2022","Tue Jun 21 02:05:40 GMT 2022","84634","","JIT-Database-014-DEFECT-Check-duplicate-table-name","","JIT-Database-014-DEFECT-Check-duplicate-table-name","As a user, I cannot update to duplicate name","As a user, I cannot update to duplicate name",""
"passed","Tue Jun 21 02:03:03 GMT 2022","Tue Jun 21 02:04:12 GMT 2022","69191","","JIT-Database-011e-COLUMN-ENUM-delete-all","","JIT-Database-011e-COLUMN-ENUM-delete-all","As a user, I should delete all items and check all items are not displayed","As a user, I should delete all items and check all items are not displayed",""
"passed","Tue Jun 21 02:10:32 GMT 2022","Tue Jun 21 02:11:53 GMT 2022","81160","","JIT-Module-008a-FB-LOGIN-default-edit","","JIT-Module-008a-FB-LOGIN-default-edit","[FACEBOOK-LOGIN], I can add module Facebook Login and edit its infos","[FACEBOOK-LOGIN], I can add module Facebook Login and edit its infos",""
"passed","Tue Jun 21 01:54:49 GMT 2022","Tue Jun 21 01:56:22 GMT 2022","92891","","JIT-Dashboard-003d-DETAILOF-delete-table","","JIT-Dashboard-003d-DETAILOF-delete-table","[DEATIL-OF] As a user, I should see the table is not displayed in dashboard list after removed","[DEATIL-OF] As a user, I should see the table is not displayed in dashboard list after removed",""
"passed","Tue Jun 21 02:28:10 GMT 2022","Tue Jun 21 02:31:14 GMT 2022","184393","","JIT-Export-001-Scenario_ROR_1","","JIT-Export-001-Scenario_ROR_1","As a user, I check export the project type ROR no key successfully with scenario 1","As a user, I check export the project type ROR no key successfully with scenario 1",""
"passed","Tue Jun 21 02:07:06 GMT 2022","Tue Jun 21 02:08:35 GMT 2022","89085","","JIT-Mobile-013-JITDEF-reflect-delete-screen-innavigation-tree","","JIT-Mobile-013-JITDEF-reflect-delete-screen-innavigation-tree","As a user, I should see screen will be removed in navigation tree after deleting screen","As a user, I should see screen will be removed in navigation tree after deleting screen",""
"passed","Tue Jun 21 02:18:02 GMT 2022","Tue Jun 21 02:19:16 GMT 2022","74118","","JIT-API-007c-GET-detail-API-Add-new-endpoint","","JIT-API-007c-GET-detail-API-Add-new-endpoint","[GET-detail-API] Create, update and delete new GET API endpoint","[GET-detail-API] Create, update and delete new GET API endpoint",""
"passed","Tue Jun 21 01:56:43 GMT 2022","Tue Jun 21 01:57:57 GMT 2022","74182","","JIT-Dashboard-005c-UPDATEOF-saving","","JIT-Dashboard-005c-UPDATEOF-saving","[UPDATE-OF] As a user, I should save the selected option when switching between tables","[UPDATE-OF] As a user, I should save the selected option when switching between tables",""
"passed","Tue Jun 21 02:11:07 GMT 2022","Tue Jun 21 02:12:31 GMT 2022","84291","","JIT-Module-010a-LINE-LOGIN-default-edit","","JIT-Module-010a-LINE-LOGIN-default-edit","[LINE-LOGIN], I can add module Line Login and edit its infos","[LINE-LOGIN], I can add module Line Login and edit its infos",""
"passed","Tue Jun 21 01:58:01 GMT 2022","Tue Jun 21 01:59:15 GMT 2022","74502","","JIT-Dashboard-006c-DELETEOF-saving","","JIT-Dashboard-006c-DELETEOF-saving","[DELETE-OF] As a user, I should save the selected option when switching between tables","[DELETE-OF] As a user, I should save the selected option when switching between tables",""
"passed","Tue Jun 21 01:57:01 GMT 2022","Tue Jun 21 01:58:10 GMT 2022","68883","","JIT-Dashboard-005e-UPDATEOF-delete-column","","JIT-Dashboard-005e-UPDATEOF-delete-column","[UPDATE-OF] As a user, I should see the params will be removed when column is deleted","[UPDATE-OF] As a user, I should see the params will be removed when column is deleted",""
"passed","Tue Jun 21 02:11:15 GMT 2022","Tue Jun 21 02:12:32 GMT 2022","77200","","JIT-Module-011a-GUEST-LOGIN-default-edit","","JIT-Module-011a-GUEST-LOGIN-default-edit","[GUEST-LOGIN], I can add module Guest Login and edit its infos","[GUEST-LOGIN], I can add module Guest Login and edit its infos",""
"passed","Tue Jun 21 01:55:27 GMT 2022","Tue Jun 21 01:57:45 GMT 2022","137335","","JIT-Dashboard-004c-CREATEOF-saving","","JIT-Dashboard-004c-CREATEOF-saving","[CREATE-OF] As a user, I should save the selected option when switching between tables","[CREATE-OF] As a user, I should save the selected option when switching between tables",""
"passed","Tue Jun 21 02:19:27 GMT 2022","Tue Jun 21 02:21:04 GMT 2022","97750","","JIT-API-008-DEFECT-Check-column-file-type","","JIT-API-008-DEFECT-Check-column-file-type","[DEFECT] As a user, I check column type file not display in request params of GET list Api","[DEFECT] As a user, I check column type file not display in request params of GET list Api",""
"passed","Tue Jun 21 02:00:07 GMT 2022","Tue Jun 21 02:01:49 GMT 2022","101852","","JIT-Database-008-Check-validation-column-definition-type-DATE-TIME","","JIT-Database-008-Check-validation-column-definition-type-DATE-TIME","As a user, I should check the validation of DATETIME column definition","As a user, I should check the validation of DATETIME column definition",""
"passed","Tue Jun 21 01:56:44 GMT 2022","Tue Jun 21 01:58:10 GMT 2022","86330","","JIT-Dashboard-005d-UPDATEOF-delete-table","","JIT-Dashboard-005d-UPDATEOF-delete-table","[UPDATE-OF] As a user, I should see the table is not displayed in dashboard list after removed","[UPDATE-OF] As a user, I should see the table is not displayed in dashboard list after removed",""
"passed","Tue Jun 21 02:10:32 GMT 2022","Tue Jun 21 02:11:54 GMT 2022","82330","","JIT-Module-007a-APPLE-LOGIN-default-edit","","JIT-Module-007a-APPLE-LOGIN-default-edit","[APPLE-LOGIN], I can add module Apple Login and edit its infos","[APPLE-LOGIN], I can add module Apple Login and edit its infos",""
"passed","Tue Jun 21 02:13:38 GMT 2022","Tue Jun 21 02:15:10 GMT 2022","92598","","JIT-API-003a-POST-check-default","","JIT-API-003a-POST-check-default","As a user, I check default value in API POST","As a user, I check default value in API POST",""
"passed","Tue Jun 21 01:55:16 GMT 2022","Tue Jun 21 01:56:24 GMT 2022","68751","","JIT-Dashboard-004b-CREATEOF-new-column","","JIT-Dashboard-004b-CREATEOF-new-column","[CREATE-OF] As a user, I should add new column in dashboard params","[CREATE-OF] As a user, I should add new column in dashboard params",""
"passed","Tue Jun 21 02:13:32 GMT 2022","Tue Jun 21 02:15:17 GMT 2022","105750","","JIT-API-002a-GET-list-check-default","","JIT-API-002a-GET-list-check-default","As a user, I check default value in API GET list","As a user, I check default value in API GET list",""
"passed","Tue Jun 21 01:52:54 GMT 2022","Tue Jun 21 01:54:33 GMT 2022","99307","","JIT-Dashboard-001-Check-general-info","","JIT-Dashboard-001-Check-general-info","As a user, I check general info and update table name","As a user, I check general info and update table name",""
"passed","Tue Jun 21 02:09:08 GMT 2022","Tue Jun 21 02:11:47 GMT 2022","159100","","JIT-Module-005b-FORCE-MOBILE-UPDATE-api","","JIT-Module-005b-FORCE-MOBILE-UPDATE-api","[FORCE-MOBILE-UPDATE] - Check api","[FORCE-MOBILE-UPDATE] - Check api",""
"passed","Tue Jun 21 02:08:53 GMT 2022","Tue Jun 21 02:09:57 GMT 2022","64289","","JIT-Module-002a-DEEPLINK-default","","JIT-Module-002a-DEEPLINK-default","As a user, I can add module Deeplink and remove it","As a user, I can add module Deeplink and remove it",""
"passed","Tue Jun 21 02:12:23 GMT 2022","Tue Jun 21 02:13:13 GMT 2022","49853","","JIT-Module-015a-SCOUT-default","","JIT-Module-015a-SCOUT-default","[SCOUT] As a user, I can add module Scout and remove it","[SCOUT] As a user, I can add module Scout and remove it",""
"passed","Tue Jun 21 02:00:04 GMT 2022","Tue Jun 21 02:02:41 GMT 2022","157136","","JIT-Database-006-Check-validation-column-definition-type-STRING","","JIT-Database-006-Check-validation-column-definition-type-STRING","As a user, I should check the validation of STRING column definition","As a user, I should check the validation of STRING column definition",""
"passed","Tue Jun 21 01:58:35 GMT 2022","Tue Jun 21 01:59:19 GMT 2022","44178","","JIT-Database-001a-TABLE-new","","JIT-Database-001a-TABLE-new","As a user, I can create new table","As a user, I can create new table",""
"passed","Tue Jun 21 02:29:12 GMT 2022","Tue Jun 21 02:29:48 GMT 2022","36259","","JIT-Export-006-Existing-Scenario-ROR-nokey","","JIT-Export-006-Existing-Scenario-ROR-nokey","[JUMP-TEAM] Existing project - No key","[JUMP-TEAM] Existing project - No key",""
"passed","Tue Jun 21 02:16:37 GMT 2022","Tue Jun 21 02:18:00 GMT 2022","82814","","JIT-API-006a-DELETE-check-default","","JIT-API-006a-DELETE-check-default","As a user, I check default value in API DELETE","As a user, I check default value in API DELETE",""
