"Status","Start Time","Stop Time","Duration in ms","Parent Suite","Suite","Sub Suite","Test Class","Test Method","Name","Description"
"passed","Sat Aug 20 18:10:44 GMT 2022","Sat Aug 20 18:11:59 GMT 2022","75059","","JIT-Dashboard-003b-DETAILOF-new-column","","JIT-Dashboard-003b-DETAILOF-new-column","[DEATIL-OF] As a user, I should add new column in dashboard params","[DEATIL-OF] As a user, I should add new column in dashboard params",""
"passed","Sat Aug 20 18:31:23 GMT 2022","Sat Aug 20 18:33:55 GMT 2022","152095","","JIT-Module-010a-LINE-LOGIN-default-edit","","JIT-Module-010a-LINE-LOGIN-default-edit","[LINE-LOGIN], I can add module Line Login and edit its infos","[LINE-LOGIN], I can add module Line Login and edit its infos",""
"passed","Sat Aug 20 18:18:19 GMT 2022","Sat Aug 20 18:19:32 GMT 2022","72730","","JIT-Database-009-COLUMN-type-BOOLEAN","","JIT-Database-009-COLUMN-type-BOOLEAN","[COLUMN] As a user, I should check the validation of BOOLEAN column definition","[COLUMN] As a user, I should check the validation of BOOLEAN column definition",""
"passed","Sat Aug 20 18:29:33 GMT 2022","Sat Aug 20 18:30:45 GMT 2022","72446","","JIT-Module-005a-FORCE-MOBILE-UPDATE-database","","JIT-Module-005a-FORCE-MOBILE-UPDATE-database","[FORCE-MOBILE-UPDATE] - Check adding and auto-table & columns","[FORCE-MOBILE-UPDATE] - Check adding and auto-table & columns",""
"passed","Sat Aug 20 18:49:51 GMT 2022","Sat Aug 20 18:51:13 GMT 2022","82164","","JIT-Database-015g-INDEX-FLOAT-column-config","","JIT-Database-015g-INDEX-FLOAT-column-config","[INDEX-FLOAT] As a user, I config index from column setting && check on index popup","[INDEX-FLOAT] As a user, I config index from column setting && check on index popup",""
"passed","Sat Aug 20 18:16:08 GMT 2022","Sat Aug 20 18:16:47 GMT 2022","39222","","JIT-Database-001c-TABLE-duplicate","","JIT-Database-001c-TABLE-duplicate","[TABLE] As a user, I cannot create table with duplicate name","[TABLE] As a user, I cannot create table with duplicate name",""
"passed","Sat Aug 20 18:59:35 GMT 2022","Sat Aug 20 19:01:44 GMT 2022","129540","","JIT-Team-001-Invite-and-signup-new-account","","JIT-Team-001-Invite-and-signup-new-account","[INVITE-SIGNUP] Invite new email and sign-up new account and do common action","[INVITE-SIGNUP] Invite new email and sign-up new account and do common action",""
"passed","Sat Aug 20 18:52:11 GMT 2022","Sat Aug 20 18:54:37 GMT 2022","145648","","JIT-Database-015m-INDEX-ALL-column-config","","JIT-Database-015m-INDEX-ALL-column-config","[INDEX-ALL] As a user, I config with multiple column and check show multiple on index pop-up","[INDEX-ALL] As a user, I config with multiple column and check show multiple on index pop-up",""
"passed","Sat Aug 20 18:21:27 GMT 2022","Sat Aug 20 18:23:02 GMT 2022","95670","","JIT-Database-012e-RELATION-trigger-by-button","","JIT-Database-012e-RELATION-trigger-by-button","[RELATION] check the basic relation","[RELATION] check the basic relation",""
"passed","Sat Aug 20 18:32:16 GMT 2022","Sat Aug 20 18:33:12 GMT 2022","55259","","JIT-Module-013b-AWS-edit-infos","","JIT-Module-013b-AWS-edit-infos","[AWS] As a user, I can update module AWS SES Integration","[AWS] As a user, I can update module AWS SES Integration",""
"passed","Sat Aug 20 18:21:49 GMT 2022","Sat Aug 20 18:23:26 GMT 2022","96600","","JIT-Database-013-DEFECT-Check-default-value-when-changing-type","","JIT-Database-013-DEFECT-Check-default-value-when-changing-type","[DEFECT] As a user, I should check the default value when changing the type","[DEFECT] As a user, I should check the default value when changing the type",""
"passed","Sat Aug 20 18:55:37 GMT 2022","Sat Aug 20 18:57:44 GMT 2022","126609","","JIT-Module-011b-GUEST-LOGIN-databse-api","","JIT-Module-011b-GUEST-LOGIN-databse-api","[GUEST-LOGIN], I check auto-generate column and api","[GUEST-LOGIN], I check auto-generate column and api",""
"passed","Sat Aug 20 18:51:04 GMT 2022","Sat Aug 20 18:52:04 GMT 2022","59506","","JIT-Database-015k-INDEX-BOOLEAN-column-config","","JIT-Database-015k-INDEX-BOOLEAN-column-config","[INDEX-BOOLEAN] As a user, I config index from column setting && check on index popup","[INDEX-BOOLEAN] As a user, I config index from column setting && check on index popup",""
"passed","Sat Aug 20 19:12:10 GMT 2022","Sat Aug 20 19:14:13 GMT 2022","122964","","JIT-API-003a-POST-check-default","","JIT-API-003a-POST-check-default","As a user, I check default value in API POST","As a user, I check default value in API POST",""
"passed","Sat Aug 20 18:33:15 GMT 2022","Sat Aug 20 18:34:05 GMT 2022","50301","","JIT-Module-015a-SCOUT-default","","JIT-Module-015a-SCOUT-default","[SCOUT] As a user, I can add module Scout and remove it","[SCOUT] As a user, I can add module Scout and remove it",""
"passed","Sat Aug 20 19:04:42 GMT 2022","Sat Aug 20 19:06:08 GMT 2022","86166","","JIT-API-002a-GET-list-check-default","","JIT-API-002a-GET-list-check-default","As a user, I check default value in API GET list","As a user, I check default value in API GET list",""
"passed","Sat Aug 20 18:16:51 GMT 2022","Sat Aug 20 18:18:33 GMT 2022","102257","","JIT-Database-003b-COLUMN-duplicated","","JIT-Database-003b-COLUMN-duplicated","[COLUMN] As a user, I cannot add duplicated column definition","[COLUMN] As a user, I cannot add duplicated column definition",""
"passed","Sat Aug 20 18:45:37 GMT 2022","Sat Aug 20 18:48:42 GMT 2022","185312","","JIT-API-009-Auto-fill","","JIT-API-009-Auto-fill","[AUTO-FILL] As a user, I could add request param by Auto-fill","[AUTO-FILL] As a user, I could add request param by Auto-fill",""
"passed","Sat Aug 20 18:13:22 GMT 2022","Sat Aug 20 18:15:12 GMT 2022","109830","","JIT-Dashboard-004e-CREATEOF-delete-column","","JIT-Dashboard-004e-CREATEOF-delete-column","[CREATE-OF] As a user, I should see the params will be removed when column is deleted","[CREATE-OF] As a user, I should see the params will be removed when column is deleted",""
"passed","Sat Aug 20 18:20:33 GMT 2022","Sat Aug 20 18:22:18 GMT 2022","105526","","JIT-Database-012b-RELATION-empty-duplicate","","JIT-Database-012b-RELATION-empty-duplicate","[RELATION], I should see the error duplicate when leaving foreign key empty","[RELATION], I should see the error duplicate when leaving foreign key empty",""
"passed","Sat Aug 20 18:37:10 GMT 2022","Sat Aug 20 18:37:47 GMT 2022","37362","","JIT-Web-002c-MOLECULE-Delete","","JIT-Web-002c-MOLECULE-Delete","[WEB-MOLECULE] As a user, I can delete molecule","[WEB-MOLECULE] As a user, I can delete molecule",""
"passed","Sat Aug 20 18:24:55 GMT 2022","Sat Aug 20 18:26:57 GMT 2022","122649","","JIT-Mobile-010-JITDEF14-rename-without-focusing","","JIT-Mobile-010-JITDEF14-rename-without-focusing","[DEFECT] As a user, I could rename the screen/molecule without focusing","[DEFECT] As a user, I could rename the screen/molecule without focusing",""
"passed","Sat Aug 20 18:10:45 GMT 2022","Sat Aug 20 18:13:14 GMT 2022","149253","","JIT-Dashboard-002c-LISTOF-saving","","JIT-Dashboard-002c-LISTOF-saving","[LIST-OF] As a user, I should save the selected option when switching between tables","[LIST-OF] As a user, I should save the selected option when switching between tables",""
"passed","Sat Aug 20 19:14:18 GMT 2022","Sat Aug 20 19:15:41 GMT 2022","83060","","JIT-API-004a-GET-detail-check-default","","JIT-API-004a-GET-detail-check-default","As a user, I check default value in API GET-detail","As a user, I check default value in API GET-detail",""
"passed","Sat Aug 20 18:52:15 GMT 2022","Sat Aug 20 18:55:29 GMT 2022","194112","","JIT-Module-004-EMAIL-LOGIN","","JIT-Module-004-EMAIL-LOGIN","[EMAIL-LOGIN] - Check adding and auto-generated API","[EMAIL-LOGIN] - Check adding and auto-generated API",""
"passed","Sat Aug 20 19:03:22 GMT 2022","Sat Aug 20 19:04:34 GMT 2022","71656","","JIT-Mobile-028a-ICON-Check-PreviewCode","","JIT-Mobile-028a-ICON-Check-PreviewCode","[ICON] As a user, I should check the Preview code of Icon component","[ICON] As a user, I should check the Preview code of Icon component",""
"passed","Sat Aug 20 18:10:45 GMT 2022","Sat Aug 20 18:12:03 GMT 2022","78193","","JIT-Dashboard-002e-LISTOF-delete-column","","JIT-Dashboard-002e-LISTOF-delete-column","As a user, I should see the params will be removed when column is deleted","As a user, I should see the params will be removed when column is deleted",""
"passed","Sat Aug 20 18:27:09 GMT 2022","Sat Aug 20 18:29:13 GMT 2022","123748","","JIT-Mobile-031a-DIVIDER-Check-PreviewCode","","JIT-Mobile-031a-DIVIDER-Check-PreviewCode","[DIVIDER] As a user, I should check the Preview code of Divider component","[DIVIDER] As a user, I should check the Preview code of Divider component",""
"passed","Sat Aug 20 18:21:53 GMT 2022","Sat Aug 20 18:23:38 GMT 2022","105051","","JIT-Database-014-DEFECT-Check-duplicate-table-name","","JIT-Database-014-DEFECT-Check-duplicate-table-name","[DEFECT] As a user, I cannot update to duplicate name","[DEFECT] As a user, I cannot update to duplicate name",""
"passed","Sat Aug 20 19:21:46 GMT 2022","Sat Aug 20 19:24:12 GMT 2022","145708","","JIT-Export-002-Scenario-ROR-withkey-1","","JIT-Export-002-Scenario-ROR-withkey-1","As a user, I check export the project type ROR with key successfully with scenario 1","As a user, I check export the project type ROR with key successfully with scenario 1",""
"passed","Sat Aug 20 18:10:44 GMT 2022","Sat Aug 20 18:12:36 GMT 2022","111975","","JIT-Dashboard-001-Check-general-info","","JIT-Dashboard-001-Check-general-info","As a user, I check general info and update table name","As a user, I check general info and update table name",""
"passed","Sat Aug 20 19:02:43 GMT 2022","Sat Aug 20 19:04:03 GMT 2022","80136","","JIT-Mobile-001-SCREEN-Create-new","","JIT-Mobile-001-SCREEN-Create-new","[MOBILE-SCREEN] As a user, I can create new screen with positive and negative cases","[MOBILE-SCREEN] As a user, I can create new screen with positive and negative cases",""
"passed","Sat Aug 20 18:16:51 GMT 2022","Sat Aug 20 18:19:26 GMT 2022","155490","","JIT-Database-004-COLUMN-type-INTEGER","","JIT-Database-004-COLUMN-type-INTEGER","[COLUMN] As a user, I should check the validation of INTEGER column definition","[COLUMN] As a user, I should check the validation of INTEGER column definition",""
"passed","Sat Aug 20 18:15:59 GMT 2022","Sat Aug 20 18:16:29 GMT 2022","29374","","JIT-Database-001b-TABLE-empty","","JIT-Database-001b-TABLE-empty","[TABLE] As a user, I cannot create table with empty name","[TABLE] As a user, I cannot create table with empty name",""
"passed","Sat Aug 20 18:45:37 GMT 2022","Sat Aug 20 18:47:08 GMT 2022","91520","","JIT-API-008-DEFECT-Check-column-file-type","","JIT-API-008-DEFECT-Check-column-file-type","[DEFECT] As a user, I check column type file not display in request params of GET list Api","[DEFECT] As a user, I check column type file not display in request params of GET list Api",""
"passed","Sat Aug 20 18:29:00 GMT 2022","Sat Aug 20 18:29:44 GMT 2022","44229","","JIT-Module-002a-DEEPLINK-default","","JIT-Module-002a-DEEPLINK-default","As a user, I can add module Deeplink and remove it","As a user, I can add module Deeplink and remove it",""
"passed","Sat Aug 20 19:21:27 GMT 2022","Sat Aug 20 19:24:20 GMT 2022","173361","","JIT-Export-004-Scenario_ROR_2","","JIT-Export-004-Scenario_ROR_2","As a user, I check export the project type ROR with key successfully with scenario 2","As a user, I check export the project type ROR with key successfully with scenario 2",""
"passed","Sat Aug 20 19:02:40 GMT 2022","Sat Aug 20 19:03:16 GMT 2022","36069","","JIT-Team-004-Invite-and-delete-invitation","","JIT-Team-004-Invite-and-delete-invitation","[INVITE-DELETE] Invite new email and delete invitation","[INVITE-DELETE] Invite new email and delete invitation",""
"passed","Sat Aug 20 18:15:42 GMT 2022","Sat Aug 20 18:16:28 GMT 2022","45701","","JIT-Database-001a-TABLE-new","","JIT-Database-001a-TABLE-new","[TABLE] As a user, I can create new table","[TABLE] As a user, I can create new table",""
"passed","Sat Aug 20 18:59:34 GMT 2022","Sat Aug 20 19:02:35 GMT 2022","181033","","JIT-Mobile-039a-OTP-Check-PreviewCode","","JIT-Mobile-039a-OTP-Check-PreviewCode","[OTP] As a user, I should check the Preview code of OTP component","[OTP] As a user, I should check the Preview code of OTP component",""
"passed","Sat Aug 20 18:54:44 GMT 2022","Sat Aug 20 18:56:14 GMT 2022","90070","","JIT-Module-009b-GOOGLE-LOGIN-databse-api","","JIT-Module-009b-GOOGLE-LOGIN-databse-api","[GOOGLE-LOGIN], I check auto-generate column and api","[GOOGLE-LOGIN], I check auto-generate column and api",""
"passed","Sat Aug 20 18:36:19 GMT 2022","Sat Aug 20 18:37:16 GMT 2022","57464","","JIT-Web-001c-PAGE-Delete","","JIT-Web-001c-PAGE-Delete","[PAGE] As a user, I can delete page","[PAGE] As a user, I can delete page",""
"passed","Sat Aug 20 18:19:47 GMT 2022","Sat Aug 20 18:21:30 GMT 2022","102882","","JIT-Database-011d-COLUMN-ENUM-delete-selected-items","","JIT-Database-011d-COLUMN-ENUM-delete-selected-items","[COLUMN] As a user, I should delete 1 selected item and check is will be removed in default dropdown","[COLUMN] As a user, I should delete 1 selected item and check is will be removed in default dropdown",""
"passed","Sat Aug 20 19:07:39 GMT 2022","Sat Aug 20 19:09:30 GMT 2022","111454","","JIT-API-006c-DELETE-relation","","JIT-API-006c-DELETE-relation","As a user, I check column display when having relation for API DELETE","As a user, I check column display when having relation for API DELETE",""
"passed","Sat Aug 20 19:15:47 GMT 2022","Sat Aug 20 19:16:49 GMT 2022","62733","","JIT-API-004c-GET-detail-relation","","JIT-API-004c-GET-detail-relation","As a user, I check column display when having relation for GET-detail","As a user, I check column display when having relation for GET-detail",""
"passed","Sat Aug 20 18:23:18 GMT 2022","Sat Aug 20 18:25:13 GMT 2022","115122","","JIT-Mobile-001a-SCREEN-Search","","JIT-Mobile-001a-SCREEN-Search","[MOBILE-SCREEN] As a user, I can search correct screen with keyword","[MOBILE-SCREEN] As a user, I can search correct screen with keyword",""
"passed","Sat Aug 20 18:22:29 GMT 2022","Sat Aug 20 18:23:46 GMT 2022","77081","","JIT-Database-016b-COUNTER-CACHE-Create-by-adding-column","","JIT-Database-016b-COUNTER-CACHE-Create-by-adding-column","[COUNTER-CACHE] create new counter cache column by adding column","[COUNTER-CACHE] create new counter cache column by adding column",""
"passed","Sat Aug 20 18:35:01 GMT 2022","Sat Aug 20 18:37:07 GMT 2022","126727","","JIT-Web-001a-PAGE-Create-new","","JIT-Web-001a-PAGE-Create-new","[PAGE] As a user, I can create new screen with positive and negative cases","[PAGE] As a user, I can create new screen with positive and negative cases",""
"passed","Sat Aug 20 19:06:13 GMT 2022","Sat Aug 20 19:07:33 GMT 2022","79932","","JIT-API-006a-DELETE-check-default","","JIT-API-006a-DELETE-check-default","As a user, I check default value in API DELETE","As a user, I check default value in API DELETE",""
"passed","Sat Aug 20 18:14:22 GMT 2022","Sat Aug 20 18:16:15 GMT 2022","112968","","JIT-Dashboard-005d-UPDATEOF-delete-table","","JIT-Dashboard-005d-UPDATEOF-delete-table","[UPDATE-OF] As a user, I should see the table is not displayed in dashboard list after removed","[UPDATE-OF] As a user, I should see the table is not displayed in dashboard list after removed",""
"passed","Sat Aug 20 18:55:20 GMT 2022","Sat Aug 20 18:56:48 GMT 2022","88256","","JIT-Module-010b-LINE-LOGIN-databse-api","","JIT-Module-010b-LINE-LOGIN-databse-api","[LINE-LOGIN], I check auto-generate column and api","[LINE-LOGIN], I check auto-generate column and api",""
"passed","Sat Aug 20 18:33:38 GMT 2022","Sat Aug 20 18:34:33 GMT 2022","54389","","JIT-Module-016a-SENDGRID-default","","JIT-Module-016a-SENDGRID-default","[SENDGRID] As a user, I can add module SendGrid and remove it","[SENDGRID] As a user, I can add module SendGrid and remove it",""
"passed","Sat Aug 20 18:48:49 GMT 2022","Sat Aug 20 18:50:56 GMT 2022","126862","","JIT-Database-015e-INDEX-TEXT-column-config","","JIT-Database-015e-INDEX-TEXT-column-config","[INDEX-TEXT] As a user, I config index from column setting && check on index popup","[INDEX-TEXT] As a user, I config index from column setting && check on index popup",""
"passed","Sat Aug 20 18:36:42 GMT 2022","Sat Aug 20 18:37:53 GMT 2022","70941","","JIT-Web-002b-MOLECULE-Update","","JIT-Web-002b-MOLECULE-Update","[WEB-MOLECULE] As a user, I can update molecule with positive and negative cases","[WEB-MOLECULE] As a user, I can update molecule with positive and negative cases",""
"passed","Sat Aug 20 18:17:09 GMT 2022","Sat Aug 20 18:19:36 GMT 2022","147147","","JIT-Database-006-COLUMN-type-STRING","","JIT-Database-006-COLUMN-type-STRING","[COLUMN] As a user, I should check the validation of STRING column definition","[COLUMN] As a user, I should check the validation of STRING column definition",""
"passed","Sat Aug 20 18:14:46 GMT 2022","Sat Aug 20 18:16:27 GMT 2022","100912","","JIT-Dashboard-005e-UPDATEOF-delete-column","","JIT-Dashboard-005e-UPDATEOF-delete-column","[UPDATE-OF] As a user, I should see the params will be removed when column is deleted","[UPDATE-OF] As a user, I should see the params will be removed when column is deleted",""
"passed","Sat Aug 20 18:12:22 GMT 2022","Sat Aug 20 18:14:28 GMT 2022","126169","","JIT-Dashboard-003d-DETAILOF-delete-table","","JIT-Dashboard-003d-DETAILOF-delete-table","[DEATIL-OF] As a user, I should see the table is not displayed in dashboard list after removed","[DEATIL-OF] As a user, I should see the table is not displayed in dashboard list after removed",""
"passed","Sat Aug 20 18:12:06 GMT 2022","Sat Aug 20 18:13:12 GMT 2022","65575","","JIT-Dashboard-003c-DETAILOF-saving","","JIT-Dashboard-003c-DETAILOF-saving","[DEATIL-OF] As a user, I should save the selected option when switching between tables","[DEATIL-OF] As a user, I should save the selected option when switching between tables",""
"passed","Sat Aug 20 18:48:27 GMT 2022","Sat Aug 20 18:49:52 GMT 2022","84964","","JIT-Database-015d-INDEX-STRING-column-config","","JIT-Database-015d-INDEX-STRING-column-config","[INDEX-STRING] As a user, I config index from column setting && check on index popup","[INDEX-STRING] As a user, I config index from column setting && check on index popup",""
"passed","Sat Aug 20 18:54:01 GMT 2022","Sat Aug 20 18:57:23 GMT 2022","202349","","JIT-Module-008b-FB-LOGIN-databse-api","","JIT-Module-008b-FB-LOGIN-databse-api","[FACEBOOK-LOGIN], I check auto-generate column and api","[FACEBOOK-LOGIN], I check auto-generate column and api",""
"passed","Sat Aug 20 18:17:21 GMT 2022","Sat Aug 20 18:19:43 GMT 2022","142429","","JIT-Database-007-COLUMN-type-TEXT","","JIT-Database-007-COLUMN-type-TEXT","[COLUMN] As a user, I should check the validation of TEXT column definition","[COLUMN] As a user, I should check the validation of TEXT column definition",""
"passed","Sat Aug 20 18:24:35 GMT 2022","Sat Aug 20 18:25:41 GMT 2022","66378","","JIT-Mobile-006-MOLECULE-Update","","JIT-Mobile-006-MOLECULE-Update","[MOBILE-MOLECULE] As a user, I can update molecule with positive and negative cases","[MOBILE-MOLECULE] As a user, I can update molecule with positive and negative cases",""
"passed","Sat Aug 20 19:19:33 GMT 2022","Sat Aug 20 19:21:14 GMT 2022","100747","","JIT-Export-005b-Scenario-RN-all-default-component","","JIT-Export-005b-Scenario-RN-all-default-component","[RN-Default] As a user, I check export the project type React Native with all default component","[RN-Default] As a user, I check export the project type React Native with all default component",""
"passed","Sat Aug 20 18:18:59 GMT 2022","Sat Aug 20 18:20:36 GMT 2022","97305","","JIT-Database-011a-COLUMN-ENUM-default","","JIT-Database-011a-COLUMN-ENUM-default","[COLUMN] As a user, I should check the basic validation","[COLUMN] As a user, I should check the basic validation",""
"passed","Sat Aug 20 18:27:25 GMT 2022","Sat Aug 20 18:28:48 GMT 2022","83520","","JIT-Mobile-036a-DATETIMEPICKER-Check-PreviewCode","","JIT-Mobile-036a-DATETIMEPICKER-Check-PreviewCode","[DATETIMEPICKER] As a user, I should check the Preview code of DatetimePicker component","[DATETIMEPICKER] As a user, I should check the Preview code of DatetimePicker component",""
"passed","Sat Aug 20 18:15:21 GMT 2022","Sat Aug 20 18:17:10 GMT 2022","109037","","JIT-Dashboard-006e-DELETEOF-delete-column","","JIT-Dashboard-006e-DELETEOF-delete-column","[DELETE-OF] As a user, I should see the params will be removed when column is deleted","[DELETE-OF] As a user, I should see the params will be removed when column is deleted",""
"passed","Sat Aug 20 18:29:18 GMT 2022","Sat Aug 20 18:30:36 GMT 2022","77898","","JIT-Module-002b-DEEPLINK-edit-infos","","JIT-Module-002b-DEEPLINK-edit-infos","As a user, I can update module Deeplink","As a user, I can update module Deeplink",""
"passed","Sat Aug 20 19:18:05 GMT 2022","Sat Aug 20 19:19:28 GMT 2022","82722","","JIT-Export-005a-Scenario-RN-login-screen","","JIT-Export-005a-Scenario-RN-login-screen","[RN-Login-screen] As a user, I check export the project type React Native and Nextjs successfully with scenario 1","[RN-Login-screen] As a user, I check export the project type React Native and Nextjs successfully with scenario 1",""
"passed","Sat Aug 20 18:52:47 GMT 2022","Sat Aug 20 18:55:11 GMT 2022","144115","","JIT-Module-007b-APPLE-LOGIN-databse-api","","JIT-Module-007b-APPLE-LOGIN-databse-api","[APPLE-LOGIN], I check auto-generate column and api","[APPLE-LOGIN], I check auto-generate column and api",""
"passed","Sat Aug 20 18:33:45 GMT 2022","Sat Aug 20 18:34:31 GMT 2022","46260","","JIT-Module-017a-GOOGLE-ANAL-default","","JIT-Module-017a-GOOGLE-ANAL-default","[GOOGLE-ANAL] As a user, I can add module Google Analytics and remove it","[GOOGLE-ANAL] As a user, I can add module Google Analytics and remove it",""
"passed","Sat Aug 20 19:09:36 GMT 2022","Sat Aug 20 19:12:04 GMT 2022","148253","","JIT-Database-015c-INDEX-CRUD-multiple","","JIT-Database-015c-INDEX-CRUD-multiple","[INDEX] As a user, I check add and update single index","[INDEX] As a user, I check add and update single index",""
"passed","Sat Aug 20 18:45:48 GMT 2022","Sat Aug 20 18:48:21 GMT 2022","152406","","JIT-Database-015b-INDEX-CRUD-single","","JIT-Database-015b-INDEX-CRUD-single","[INDEX] As a user, I check add and update multiple index","[INDEX] As a user, I check add and update multiple index",""
"passed","Sat Aug 20 18:32:16 GMT 2022","Sat Aug 20 18:33:06 GMT 2022","49598","","JIT-Module-013a-AWS-default","","JIT-Module-013a-AWS-default","[AWS] As a user, I can add module AWS SES Integration and remove it","[AWS] As a user, I can add module AWS SES Integration and remove it",""
"passed","Sat Aug 20 18:13:50 GMT 2022","Sat Aug 20 18:14:52 GMT 2022","62261","","JIT-Dashboard-005c-UPDATEOF-saving","","JIT-Dashboard-005c-UPDATEOF-saving","[UPDATE-OF] As a user, I should save the selected option when switching between tables","[UPDATE-OF] As a user, I should save the selected option when switching between tables",""
"passed","Sat Aug 20 18:25:40 GMT 2022","Sat Aug 20 18:26:52 GMT 2022","71831","","JIT-Mobile-014-JITDEF-status-bar","","JIT-Mobile-014-JITDEF-status-bar","[DEFECT] As a user, I should see screen will be removed in navigation tree after deleting screen","[DEFECT] As a user, I should see screen will be removed in navigation tree after deleting screen",""
"passed","Sat Aug 20 18:29:17 GMT 2022","Sat Aug 20 18:30:31 GMT 2022","73955","","JIT-Module-003-JPBANK-default","","JIT-Module-003-JPBANK-default","[JPBANK] - Check adding and auto-generated API","[JPBANK] - Check adding and auto-generated API",""
"passed","Sat Aug 20 18:18:35 GMT 2022","Sat Aug 20 18:19:44 GMT 2022","68989","","JIT-Database-010a-COLUMN-FILE-validation","","JIT-Database-010a-COLUMN-FILE-validation","[COLUMN] As a user, I should check the validation of FILE column definition","[COLUMN] As a user, I should check the validation of FILE column definition",""
"passed","Sat Aug 20 18:34:01 GMT 2022","Sat Aug 20 18:34:40 GMT 2022","38683","","JIT-Module-017b-GOOGLE-ANAL-edit-infos","","JIT-Module-017b-GOOGLE-ANAL-edit-infos","[GOOGLE-ANAL] As a user, I can update module Google Analytics","[GOOGLE-ANAL] As a user, I can update module Google Analytics",""
"passed","Sat Aug 20 18:24:53 GMT 2022","Sat Aug 20 18:29:00 GMT 2022","246833","","JIT-Mobile-009-SEARCH-Components","","JIT-Mobile-009-SEARCH-Components","[SEARCH] As a user, I search component and drag them to preview screen","[SEARCH] As a user, I search component and drag them to preview screen",""
"passed","Sat Aug 20 18:33:31 GMT 2022","Sat Aug 20 18:34:16 GMT 2022","44886","","JIT-Module-015b-SCOUT-edit-infos","","JIT-Module-015b-SCOUT-edit-infos","[SCOUT] As a user, I can update module Scout","[SCOUT] As a user, I can update module Scout",""
"passed","Sat Aug 20 18:30:16 GMT 2022","Sat Aug 20 18:31:47 GMT 2022","90852","","JIT-Module-006a-SMS-default","","JIT-Module-006a-SMS-default","[SMS], I can add module SMS login with Twilio and remove it","[SMS], I can add module SMS login with Twilio and remove it",""
"passed","Sat Aug 20 18:12:42 GMT 2022","Sat Aug 20 18:13:36 GMT 2022","53776","","JIT-Dashboard-004b-CREATEOF-new-column","","JIT-Dashboard-004b-CREATEOF-new-column","[CREATE-OF] As a user, I should add new column in dashboard params","[CREATE-OF] As a user, I should add new column in dashboard params",""
"passed","Sat Aug 20 18:23:54 GMT 2022","Sat Aug 20 18:26:17 GMT 2022","143071","","JIT-Mobile-004-SCREEN-duplicate","","JIT-Mobile-004-SCREEN-duplicate","[MOBILE-SCREEN] As a user, I can duplicate screen with positive and negative cases","[MOBILE-SCREEN] As a user, I can duplicate screen with positive and negative cases",""
