"Status","Start Time","Stop Time","Duration in ms","Parent Suite","Suite","Sub Suite","Test Class","Test Method","Name","Description"
"passed","Sat Aug 20 18:29:43 GMT 2022","Sat Aug 20 18:31:26 GMT 2022","103359","","JIT-Module-005b-FORCE-MOBILE-UPDATE-api","","JIT-Module-005b-FORCE-MOBILE-UPDATE-api","[FORCE-MOBILE-UPDATE] - Check api","[FORCE-MOBILE-UPDATE] - Check api",""
"passed","Sat Aug 20 19:22:19 GMT 2022","Sat Aug 20 19:23:08 GMT 2022","49780","","JIT-Export-007-Existing-Scenario-ROR-withkey","","JIT-Export-007-Existing-Scenario-ROR-withkey","As a user, I check export the existing project type ROR with key successfully","As a user, I check export the existing project type ROR with key successfully",""
"passed","Sat Aug 20 18:38:42 GMT 2022","Sat Aug 20 18:40:35 GMT 2022","112893","","JIT-API-002c-GET-list","","JIT-API-002c-GET-list","As a user, I check column display when having relation for GET-list","As a user, I check column display when having relation for GET-list",""
"passed","Sat Aug 20 18:23:23 GMT 2022","Sat Aug 20 18:24:27 GMT 2022","64426","","JIT-Mobile-002-SCREEN-Update","","JIT-Mobile-002-SCREEN-Update","[MOBILE-SCREEN] As a user, I can update screen with positive and negative cases","[MOBILE-SCREEN] As a user, I can update screen with positive and negative cases",""
"passed","Sat Aug 20 18:22:08 GMT 2022","Sat Aug 20 18:24:16 GMT 2022","127464","","JIT-Database-016a-COUNTER-CACHE-Create-by-relation","","JIT-Database-016a-COUNTER-CACHE-Create-by-relation","[COUNTER-CACHE] create new counter cache column by selecting in relation popup","[COUNTER-CACHE] create new counter cache column by selecting in relation popup",""
"passed","Sat Aug 20 18:51:21 GMT 2022","Sat Aug 20 18:52:41 GMT 2022","80272","","JIT-Database-015l-INDEX-ENUM-column-config","","JIT-Database-015l-INDEX-ENUM-column-config","[INDEX-ENUM] As a user, I config index from column setting && check on index popup","[INDEX-ENUM] As a user, I config index from column setting && check on index popup",""
"passed","Sat Aug 20 18:52:26 GMT 2022","Sat Aug 20 18:53:53 GMT 2022","86659","","JIT-Module-006c-SMS-database-api","","JIT-Module-006c-SMS-database-api","[SMS], I check auto-generate column and api","[SMS], I check auto-generate column and api",""
"passed","Sat Aug 20 19:01:51 GMT 2022","Sat Aug 20 19:02:33 GMT 2022","42347","","JIT-Team-003-Invite-and-resend","","JIT-Team-003-Invite-and-resend","[RESEND-INVITE] Invite new email and resend invitation","[RESEND-INVITE] Invite new email and resend invitation",""
"passed","Sat Aug 20 18:26:15 GMT 2022","Sat Aug 20 18:30:57 GMT 2022","281529","","JIT-Mobile-022b-TEXT-Check-TEXT","","JIT-Mobile-022b-TEXT-Check-TEXT","[TEXT] As a user, I should check the TEXT infomation of Text is correct: Text content, Font, Size, Font weight, Line Height, Spacing, Color, Italic, Underline","[TEXT] As a user, I should check the TEXT infomation of Text is correct: Text content, Font, Size, Font weight, Line Height, Spacing, Color, Italic, Underline",""
"passed","Sat Aug 20 18:24:06 GMT 2022","Sat Aug 20 18:25:40 GMT 2022","93296","","JIT-Mobile-005-MOLECULE-Create-new","","JIT-Mobile-005-MOLECULE-Create-new","[MOBILE-MOLECULE] As a user, I can create new molecule with positive and negative cases","[MOBILE-MOLECULE] As a user, I can create new molecule with positive and negative cases",""
"passed","Sat Aug 20 18:14:54 GMT 2022","Sat Aug 20 18:16:59 GMT 2022","125375","","JIT-Dashboard-006a-DELETEOF-default","","JIT-Dashboard-006a-DELETEOF-default","[DELETE-OF] As a user, I should add default column in dashboard params","[DELETE-OF] As a user, I should add default column in dashboard params",""
"passed","Sat Aug 20 18:20:45 GMT 2022","Sat Aug 20 18:22:22 GMT 2022","96578","","JIT-Database-012c-RELATION-multiple-1-direction","","JIT-Database-012c-RELATION-multiple-1-direction","[RELATION], I should add multiple relation 1 direction","[RELATION], I should add multiple relation 1 direction",""
"passed","Sat Aug 20 18:34:57 GMT 2022","Sat Aug 20 18:37:47 GMT 2022","170531","","JIT-Team-002-Invite-existing-account","","JIT-Team-002-Invite-existing-account","[INVITE-EXISTING-ACC] Invite existing email and do common action","[INVITE-EXISTING-ACC] Invite existing email and do common action",""
"passed","Sat Aug 20 18:26:06 GMT 2022","Sat Aug 20 18:27:00 GMT 2022","53851","","JIT-Mobile-021-DEFECT.Params.keep-params-after-refresh-page","","JIT-Mobile-021-DEFECT.Params.keep-params-after-refresh-page","[DEFECT] As a user, I should check the params will be kept after refresh page","[DEFECT] As a user, I should check the params will be kept after refresh page",""
"passed","Sat Aug 20 18:28:42 GMT 2022","Sat Aug 20 18:29:57 GMT 2022","74627","","JIT-Module-001b-CLOUDINARY-edit-infos","","JIT-Module-001b-CLOUDINARY-edit-infos","As a user, I can update module Cloudinary","As a user, I can update module Cloudinary",""
"passed","Sat Aug 20 18:13:31 GMT 2022","Sat Aug 20 18:15:23 GMT 2022","111715","","JIT-Dashboard-005a-UPDATEOF-default","","JIT-Dashboard-005a-UPDATEOF-default","[UPDATE-OF] As a user, I should add default column in dashboard params","[UPDATE-OF] As a user, I should add default column in dashboard params",""
"passed","Sat Aug 20 18:33:06 GMT 2022","Sat Aug 20 18:34:08 GMT 2022","62548","","JIT-Module-014b-BASIC-AUTH-edit-infos","","JIT-Module-014b-BASIC-AUTH-edit-infos","[BASIC-AUTH] As a user, I can update module Basic Authentication","[BASIC-AUTH] As a user, I can update module Basic Authentication",""
"passed","Sat Aug 20 18:30:57 GMT 2022","Sat Aug 20 18:32:39 GMT 2022","102568","","JIT-Module-007a-APPLE-LOGIN-default-edit","","JIT-Module-007a-APPLE-LOGIN-default-edit","[APPLE-LOGIN], I can add module Apple Login and edit its infos","[APPLE-LOGIN], I can add module Apple Login and edit its infos",""
"passed","Sat Aug 20 18:10:45 GMT 2022","Sat Aug 20 18:12:19 GMT 2022","93989","","JIT-Dashboard-002a-LISTOF-default-column","","JIT-Dashboard-002a-LISTOF-default-column","[LIST-OF] As a user, I should add default column in dashboard params","[LIST-OF] As a user, I should add default column in dashboard params",""
"passed","Sat Aug 20 18:19:38 GMT 2022","Sat Aug 20 18:21:18 GMT 2022","100325","","JIT-Database-011c-COLUMN-ENUM-delete-items","","JIT-Database-011c-COLUMN-ENUM-delete-items","[COLUMN] As a user, I should delete 1 item and check not display in default dropdown","[COLUMN] As a user, I should delete 1 item and check not display in default dropdown",""
"passed","Sat Aug 20 18:19:51 GMT 2022","Sat Aug 20 18:21:31 GMT 2022","99156","","JIT-Database-011e-COLUMN-ENUM-delete-all","","JIT-Database-011e-COLUMN-ENUM-delete-all","[COLUMN] As a user, I should delete all items and check all items are not displayed","[COLUMN] As a user, I should delete all items and check all items are not displayed",""
"passed","Sat Aug 20 18:15:07 GMT 2022","Sat Aug 20 18:16:16 GMT 2022","68771","","JIT-Dashboard-006d-DELETEOF-delete-table","","JIT-Dashboard-006d-DELETEOF-delete-table","[DELETE-OF] As a user, I should see the table is not displayed in dashboard list after removed","[DELETE-OF] As a user, I should see the table is not displayed in dashboard list after removed",""
"passed","Sat Aug 20 18:49:26 GMT 2022","Sat Aug 20 18:50:51 GMT 2022","84953","","JIT-Database-015f-INDEX-INTEGER-column-config","","JIT-Database-015f-INDEX-INTEGER-column-config","[INDEX-INTEGER] As a user, I config index from column setting && check on index popup","[INDEX-INTEGER] As a user, I config index from column setting && check on index popup",""
"passed","Sat Aug 20 18:14:55 GMT 2022","Sat Aug 20 18:15:50 GMT 2022","54950","","JIT-Dashboard-006b-DELETEOF-new-column","","JIT-Dashboard-006b-DELETEOF-new-column","[DELETE-OF] As a user, I should add new column in dashboard params","[DELETE-OF] As a user, I should add new column in dashboard params",""
"passed","Sat Aug 20 18:19:28 GMT 2022","Sat Aug 20 18:20:26 GMT 2022","57352","","JIT-Database-011b-COLUMN-ENUM-add-items","","JIT-Database-011b-COLUMN-ENUM-add-items","[COLUMN] As a user, I should add new item and select in default dropdown","[COLUMN] As a user, I should add new item and select in default dropdown",""
"passed","Sat Aug 20 18:50:57 GMT 2022","Sat Aug 20 18:52:20 GMT 2022","83371","","JIT-Database-015i-INDEX-DATETIME-column-config","","JIT-Database-015i-INDEX-DATETIME-column-config","[INDEX-DATETIME] As a user, I config index from column setting && check on index popup","[INDEX-DATETIME] As a user, I config index from column setting && check on index popup",""
"passed","Sat Aug 20 18:34:16 GMT 2022","Sat Aug 20 18:37:28 GMT 2022","191366","","JIT-Module-018a-ADMIN-DASHBOARD-USER-default","","JIT-Module-018a-ADMIN-DASHBOARD-USER-default","[ADMIN-DASHBOARD-USER], I can add module Admin dashboard user and remove it","[ADMIN-DASHBOARD-USER], I can add module Admin dashboard user and remove it",""
"passed","Sat Aug 20 18:27:46 GMT 2022","Sat Aug 20 18:28:32 GMT 2022","45733","","JIT-Module-001a-CLOUDINARY-default","","JIT-Module-001a-CLOUDINARY-default","As a user, I can add module Cloudinary and remove it","As a user, I can add module Cloudinary and remove it",""
"passed","Sat Aug 20 18:16:32 GMT 2022","Sat Aug 20 18:17:56 GMT 2022","84150","","JIT-Database-002-COLUMN-default","","JIT-Database-002-COLUMN-default","[COLUMN] As a user, I should see the default column definition","[COLUMN] As a user, I should see the default column definition",""
"passed","Sat Aug 20 18:18:09 GMT 2022","Sat Aug 20 18:19:15 GMT 2022","66401","","JIT-Database-008-COLUMN-type-DATE-TIME","","JIT-Database-008-COLUMN-type-DATE-TIME","[COLUMN] As a user, I should check the validation of DATETIME column definition","[COLUMN] As a user, I should check the validation of DATETIME column definition",""
"passed","Sat Aug 20 18:13:36 GMT 2022","Sat Aug 20 18:14:27 GMT 2022","51343","","JIT-Dashboard-005b-UPDATEOF-new-column","","JIT-Dashboard-005b-UPDATEOF-new-column","[UPDATE-OF] As a user, I should add new column in dashboard params","[UPDATE-OF] As a user, I should add new column in dashboard params",""
"passed","Sat Aug 20 19:21:19 GMT 2022","Sat Aug 20 19:22:13 GMT 2022","54553","","JIT-Export-006-Existing-Scenario-ROR-nokey","","JIT-Export-006-Existing-Scenario-ROR-nokey","As a user, I check export the existing project type ROR no key successfully","As a user, I check export the existing project type ROR no key successfully",""
"passed","Sat Aug 20 18:12:57 GMT 2022","Sat Aug 20 18:14:33 GMT 2022","96124","","JIT-Dashboard-004c-CREATEOF-saving","","JIT-Dashboard-004c-CREATEOF-saving","[CREATE-OF] As a user, I should save the selected option when switching between tables","[CREATE-OF] As a user, I should save the selected option when switching between tables",""
"passed","Sat Aug 20 18:10:45 GMT 2022","Sat Aug 20 18:12:49 GMT 2022","123451","","JIT-Dashboard-002b-LISTOF-new-column","","JIT-Dashboard-002b-LISTOF-new-column","[LIST-OF] As a user, I should add new column in dashboard params","[LIST-OF] As a user, I should add new column in dashboard params",""
"passed","Sat Aug 20 18:41:33 GMT 2022","Sat Aug 20 18:43:10 GMT 2022","96600","","JIT-API-005a-PUT-check-default","","JIT-API-005a-PUT-check-default","As a user, I check default value in API PUT","As a user, I check default value in API PUT",""
"passed","Sat Aug 20 18:20:04 GMT 2022","Sat Aug 20 18:22:00 GMT 2022","116240","","JIT-Database-012a-RELATION-basic","","JIT-Database-012a-RELATION-basic","[RELATION] check the basic relation","[RELATION] check the basic relation",""
"passed","Sat Aug 20 18:44:46 GMT 2022","Sat Aug 20 18:45:17 GMT 2022","30789","","JIT-API-007a-GROUP-API-CRUD","","JIT-API-007a-GROUP-API-CRUD","[GROUP-API] Create, update and delete group API","[GROUP-API] Create, update and delete group API",""
"passed","Sat Aug 20 19:18:19 GMT 2022","Sat Aug 20 19:21:39 GMT 2022","200200","","JIT-Export-001-Scenario_ROR_1","","JIT-Export-001-Scenario_ROR_1","As a user, I check export the project type ROR no key successfully with scenario 1","As a user, I check export the project type ROR no key successfully with scenario 1",""
"passed","Sat Aug 20 18:12:24 GMT 2022","Sat Aug 20 18:13:24 GMT 2022","60263","","JIT-Dashboard-003e-DETAILOF-delete-column","","JIT-Dashboard-003e-DETAILOF-delete-column","[DEATIL-OF] As a user, I should see the params will be removed when column is deleted","[DEATIL-OF] As a user, I should see the params will be removed when column is deleted",""
"passed","Sat Aug 20 18:16:51 GMT 2022","Sat Aug 20 18:18:21 GMT 2022","90004","","JIT-Database-003a-COLUMN-empty","","JIT-Database-003a-COLUMN-empty","[COLUMN] As a user, I cannot add empty column definition","[COLUMN] As a user, I cannot add empty column definition",""
"passed","Sat Aug 20 19:18:29 GMT 2022","Sat Aug 20 19:21:20 GMT 2022","171298","","JIT-Export-003-Scenario_ROR_2","","JIT-Export-003-Scenario_ROR_2","As a user, I check export the project type ROR no key successfully with scenario 2","As a user, I check export the project type ROR no key successfully with scenario 2",""
"passed","Sat Aug 20 18:50:00 GMT 2022","Sat Aug 20 18:52:07 GMT 2022","126487","","JIT-Database-015h-INDEX-DATE-column-config","","JIT-Database-015h-INDEX-DATE-column-config","[INDEX-DATE] As a user, I config index from column setting && check on index popup","[INDEX-DATE] As a user, I config index from column setting && check on index popup",""
"passed","Sat Aug 20 18:14:59 GMT 2022","Sat Aug 20 18:15:56 GMT 2022","56911","","JIT-Dashboard-006c-DELETEOF-saving","","JIT-Dashboard-006c-DELETEOF-saving","[DELETE-OF] As a user, I should save the selected option when switching between tables","[DELETE-OF] As a user, I should save the selected option when switching between tables",""
"passed","Sat Aug 20 18:12:41 GMT 2022","Sat Aug 20 18:14:38 GMT 2022","116534","","JIT-Dashboard-004a-CREATEOF-default","","JIT-Dashboard-004a-CREATEOF-default","[CREATE-OF] As a user, I should add default column in dashboard params","[CREATE-OF] As a user, I should add default column in dashboard params",""
"passed","Sat Aug 20 18:10:45 GMT 2022","Sat Aug 20 18:12:04 GMT 2022","78813","","JIT-Dashboard-003a-DETAILOF-default","","JIT-Dashboard-003a-DETAILOF-default","[DEATIL-OF] As a user, I should add default column in dashboard params","[DEATIL-OF] As a user, I should add default column in dashboard params",""
"passed","Sat Aug 20 18:16:32 GMT 2022","Sat Aug 20 18:18:05 GMT 2022","93103","","JIT-Database-001d-TABLE-update","","JIT-Database-001d-TABLE-update","[TABLE] As a user, I can update the value of the table","[TABLE] As a user, I can update the value of the table",""
"passed","Sat Aug 20 18:21:52 GMT 2022","Sat Aug 20 18:23:28 GMT 2022","96684","","JIT-Database-015a-INDEX-Check-duplicate-empty","","JIT-Database-015a-INDEX-Check-duplicate-empty","[INDEX] As a user, I check empty and duplicate index","[INDEX] As a user, I check empty and duplicate index",""
"passed","Sat Aug 20 18:39:31 GMT 2022","Sat Aug 20 18:41:27 GMT 2022","115224","","JIT-API-003c-POST-relation","","JIT-API-003c-POST-relation","As a user, I check column display when having relation for API POST","As a user, I check column display when having relation for API POST",""
"passed","Sat Aug 20 18:36:20 GMT 2022","Sat Aug 20 18:37:47 GMT 2022","86854","","JIT-Web-001e-PAGE-Search","","JIT-Web-001e-PAGE-Search","[WEB-PAGE] As a user, I can search correct screen with keyword","[WEB-PAGE] As a user, I can search correct screen with keyword",""
"passed","Sat Aug 20 18:13:02 GMT 2022","Sat Aug 20 18:14:12 GMT 2022","69498","","JIT-Dashboard-004d-CREATEOF-delete-table","","JIT-Dashboard-004d-CREATEOF-delete-table","[CREATE-OF] As a user, I should see the table is not displayed in dashboard list after removed","[CREATE-OF] As a user, I should see the table is not displayed in dashboard list after removed",""
"passed","Sat Aug 20 18:37:36 GMT 2022","Sat Aug 20 18:38:24 GMT 2022","47703","","JIT-Web-002e-MOLECULE-Search","","JIT-Web-002e-MOLECULE-Search","[WEB-PAGE] As a user, I can search correct molecule with keyword","[WEB-PAGE] As a user, I can search correct molecule with keyword",""
"passed","Sat Aug 20 18:38:42 GMT 2022","Sat Aug 20 18:39:24 GMT 2022","42474","","JIT-API-001-Check-general-info","","JIT-API-001-Check-general-info","As a user, I check general info","As a user, I check general info",""
"passed","Sat Aug 20 18:42:21 GMT 2022","Sat Aug 20 18:43:31 GMT 2022","70916","","JIT-API-005c-PUT-relation","","JIT-API-005c-PUT-relation","As a user, I check column display when having relation for API PUT","As a user, I check column display when having relation for API PUT",""
"passed","Sat Aug 20 18:31:47 GMT 2022","Sat Aug 20 18:33:17 GMT 2022","89521","","JIT-Module-011a-GUEST-LOGIN-default-edit","","JIT-Module-011a-GUEST-LOGIN-default-edit","[GUEST-LOGIN], I can add module Guest Login and edit its infos","[GUEST-LOGIN], I can add module Guest Login and edit its infos",""
"passed","Sat Aug 20 18:24:39 GMT 2022","Sat Aug 20 18:25:20 GMT 2022","41180","","JIT-Mobile-007-MOLECULE-Delete","","JIT-Mobile-007-MOLECULE-Delete","[MOBILE-MOLECULE] As a user, I can delete molecule","[MOBILE-MOLECULE] As a user, I can delete molecule",""
"passed","Sat Aug 20 18:20:03 GMT 2022","Sat Aug 20 18:20:51 GMT 2022","47424","","JIT-Database-011f-COLUMN-ENUM-duplicated","","JIT-Database-011f-COLUMN-ENUM-duplicated","[COLUMN] As a user, I should check counld not add duplicated item","[COLUMN] As a user, I should check counld not add duplicated item",""
"passed","Sat Aug 20 18:27:37 GMT 2022","Sat Aug 20 18:28:07 GMT 2022","29766","","JIT-Module-000-search","","JIT-Module-000-search","[SEARCH] As a user, I can Search module","[SEARCH] As a user, I can Search module",""
"passed","Sat Aug 20 18:24:04 GMT 2022","Sat Aug 20 18:25:12 GMT 2022","67905","","JIT-Mobile-004a-MOLECULE-Search","","JIT-Mobile-004a-MOLECULE-Search","[MOBILE-MOLECULE] As a user, I can search correct molecule with keyword","[MOBILE-MOLECULE] As a user, I can search correct molecule with keyword",""
"passed","Sat Aug 20 18:31:13 GMT 2022","Sat Aug 20 18:32:51 GMT 2022","97514","","JIT-Module-009a-GOOGLE-LOGIN-default-edit","","JIT-Module-009a-GOOGLE-LOGIN-default-edit","[GOOGLE-LOGIN], I can add module Google Login and edit its infos","[GOOGLE-LOGIN], I can add module Google Login and edit its infos",""
"passed","Sat Aug 20 18:10:45 GMT 2022","Sat Aug 20 18:12:09 GMT 2022","84112","","JIT-Dashboard-002d-LISTOF-delete-table","","JIT-Dashboard-002d-LISTOF-delete-table","[LIST-OF] As a user, I should see the table is not displayed in dashboard list after removed","[LIST-OF] As a user, I should see the table is not displayed in dashboard list after removed",""
"passed","Sat Aug 20 18:21:04 GMT 2022","Sat Aug 20 18:23:08 GMT 2022","124032","","JIT-Database-012d-RELATION-multiple-2-direction","","JIT-Database-012d-RELATION-multiple-2-direction","[RELATION], I should add multiple relation 2 directions","[RELATION], I should add multiple relation 2 directions",""
"passed","Sat Aug 20 18:31:06 GMT 2022","Sat Aug 20 18:33:36 GMT 2022","150574","","JIT-Module-008a-FB-LOGIN-default-edit","","JIT-Module-008a-FB-LOGIN-default-edit","[FACEBOOK-LOGIN], I can add module Facebook Login and edit its infos","[FACEBOOK-LOGIN], I can add module Facebook Login and edit its infos",""
"passed","Sat Aug 20 18:30:29 GMT 2022","Sat Aug 20 18:31:49 GMT 2022","80787","","JIT-Module-006b-SMS-edit-infos","","JIT-Module-006b-SMS-edit-infos","[SMS], I can add module SMS login with Twilio and edit its infos","[SMS], I can add module SMS login with Twilio and edit its infos",""
"passed","Sat Aug 20 18:36:30 GMT 2022","Sat Aug 20 18:37:31 GMT 2022","61623","","JIT-Web-002a-MOLECULE-Create-new","","JIT-Web-002a-MOLECULE-Create-new","[WEB-MOLECULE] As a user, I can create new molecule with positive and negative cases","[WEB-MOLECULE] As a user, I can create new molecule with positive and negative cases",""
"passed","Sat Aug 20 18:35:00 GMT 2022","Sat Aug 20 18:36:16 GMT 2022","76421","","JIT-Team-005-Invite-duplicate-email","","JIT-Team-005-Invite-duplicate-email","[INVITE-DELETE] Invite new email and invite again","[INVITE-DELETE] Invite new email and invite again",""
"passed","Sat Aug 20 18:35:08 GMT 2022","Sat Aug 20 18:36:36 GMT 2022","88140","","JIT-Web-001b-PAGE-Update","","JIT-Web-001b-PAGE-Update","[PAGE] As a user, I can update page with positive and negative cases","[PAGE] As a user, I can update page with positive and negative cases",""
"passed","Sat Aug 20 18:56:20 GMT 2022","Sat Aug 20 18:57:34 GMT 2022","74061","","JIT-Module-018c-ADMIN-DASHBOARD-USER-database-api","","JIT-Module-018c-ADMIN-DASHBOARD-USER-database-api","[ADMIN-DASHBOARD-USER], I check auto-generate column and api","[ADMIN-DASHBOARD-USER], I check auto-generate column and api",""
"passed","Sat Aug 20 18:23:46 GMT 2022","Sat Aug 20 18:24:21 GMT 2022","34947","","JIT-Mobile-003-SCREEN-Delete","","JIT-Mobile-003-SCREEN-Delete","[MOBILE-SCREEN] As a user, I can delete screen","[MOBILE-SCREEN] As a user, I can delete screen",""
"passed","Sat Aug 20 18:17:02 GMT 2022","Sat Aug 20 18:18:27 GMT 2022","84904","","JIT-Database-005-COLUMN-type-FLOAT","","JIT-Database-005-COLUMN-type-FLOAT","[COLUMN] As a user, I should check the validation of FLOAT column definition","[COLUMN] As a user, I should check the validation of FLOAT column definition",""
"passed","Sat Aug 20 18:32:17 GMT 2022","Sat Aug 20 18:33:11 GMT 2022","53708","","JIT-Module-014a-BASIC-AUTH-default","","JIT-Module-014a-BASIC-AUTH-default","[BASIC-AUTH] As a user, I can add module Basic Authentication and remove it","[BASIC-AUTH] As a user, I can add module Basic Authentication and remove it",""
"passed","Sat Aug 20 18:33:39 GMT 2022","Sat Aug 20 18:34:33 GMT 2022","53281","","JIT-Module-016b-SENDGRID-edit-infos","","JIT-Module-016b-SENDGRID-edit-infos","[SENDGRID] As a user, I can update module SendGrid","[SENDGRID] As a user, I can update module SendGrid",""
"passed","Sat Aug 20 18:18:51 GMT 2022","Sat Aug 20 18:21:29 GMT 2022","157124","","JIT-Database-010b-COLUMN-FILE-format-file","","JIT-Database-010b-COLUMN-FILE-format-file","[COLUMN] As a user, I should check the validation of FILE column definition for Format Area","[COLUMN] As a user, I should check the validation of FILE column definition for Format Area",""
"passed","Sat Aug 20 18:25:41 GMT 2022","Sat Aug 20 18:26:43 GMT 2022","61989","","JIT-Mobile-015-VIEW-General-info","","JIT-Mobile-015-VIEW-General-info","[VIEW] As a user, I should check the general infomation of View is correct: Name, Key, unique key, delete component","[VIEW] As a user, I should check the general infomation of View is correct: Name, Key, unique key, delete component",""
