"Status","Start Time","Stop Time","Duration in ms","Parent Suite","Suite","Sub Suite","Test Class","Test Method","Name","Description"
"passed","Tue Jun 28 18:50:52 GMT 2022","Tue Jun 28 18:51:51 GMT 2022","58621","","JIT-Module-002a-DEEPLINK-default","","JIT-Module-002a-DEEPLINK-default","As a user, I can add module Deeplink and remove it","As a user, I can add module Deeplink and remove it",""
"passed","Tue Jun 28 19:19:51 GMT 2022","Tue Jun 28 19:20:35 GMT 2022","43607","","JIT-Dashboard-005b-UPDATEOF-new-column","","JIT-Dashboard-005b-UPDATEOF-new-column","[UPDATE-OF] As a user, I should add new column in dashboard params","[UPDATE-OF] As a user, I should add new column in dashboard params",""
"passed","Tue Jun 28 19:08:00 GMT 2022","Tue Jun 28 19:09:32 GMT 2022","92332","","JIT-API-006a-DELETE-check-default","","JIT-API-006a-DELETE-check-default","As a user, I check default value in API DELETE","As a user, I check default value in API DELETE",""
"passed","Tue Jun 28 18:49:55 GMT 2022","Tue Jun 28 18:52:53 GMT 2022","178059","","JIT-Mobile-019.1.ViewPreviewCode","","JIT-Mobile-019.1.ViewPreviewCode","As a user, I should check Preview code of View component","As a user, I should check Preview code of View component",""
"passed","Tue Jun 28 19:01:10 GMT 2022","Tue Jun 28 19:02:39 GMT 2022","88928","","JIT-API-002c-GET-list","","JIT-API-002c-GET-list","As a user, I check column display when having relation for GET-list","As a user, I check column display when having relation for GET-list",""
"passed","Tue Jun 28 18:33:09 GMT 2022","Tue Jun 28 18:34:32 GMT 2022","82423","","JIT-Dashboard-004b-CREATEOF-new-column","","JIT-Dashboard-004b-CREATEOF-new-column","[CREATE-OF] As a user, I should add new column in dashboard params","[CREATE-OF] As a user, I should add new column in dashboard params",""
"passed","Tue Jun 28 18:39:17 GMT 2022","Tue Jun 28 18:42:18 GMT 2022","180656","","JIT-Database-006-Check-validation-column-definition-type-STRING","","JIT-Database-006-Check-validation-column-definition-type-STRING","As a user, I should check the validation of STRING column definition","As a user, I should check the validation of STRING column definition",""
"passed","Tue Jun 28 18:35:08 GMT 2022","Tue Jun 28 18:36:54 GMT 2022","105894","","JIT-Dashboard-005d-UPDATEOF-delete-table","","JIT-Dashboard-005d-UPDATEOF-delete-table","[UPDATE-OF] As a user, I should see the table is not displayed in dashboard list after removed","[UPDATE-OF] As a user, I should see the table is not displayed in dashboard list after removed",""
"passed","Tue Jun 28 19:32:26 GMT 2022","Tue Jun 28 19:33:00 GMT 2022","33975","","JIT-Export-007-Existing-Scenario-ROR-withkey","","JIT-Export-007-Existing-Scenario-ROR-withkey","As a user, I check export the existing project type ROR with key successfully","As a user, I check export the existing project type ROR with key successfully",""
"passed","Tue Jun 28 18:35:33 GMT 2022","Tue Jun 28 18:37:08 GMT 2022","95469","","JIT-Dashboard-006a-DELETEOF-default","","JIT-Dashboard-006a-DELETEOF-default","[DELETE-OF] As a user, I should add default column in dashboard params","[DELETE-OF] As a user, I should add default column in dashboard params",""
"passed","Tue Jun 28 18:45:19 GMT 2022","Tue Jun 28 18:46:32 GMT 2022","72256","","JIT-Mobile-001-Screen-create-new-screen","","JIT-Mobile-001-Screen-create-new-screen","As a user, I can create new screen with positive and negative cases","As a user, I can create new screen with positive and negative cases",""
"passed","Tue Jun 28 19:04:27 GMT 2022","Tue Jun 28 19:05:59 GMT 2022","91035","","JIT-API-004a-GET-detail-check-default","","JIT-API-004a-GET-detail-check-default","As a user, I check default value in API GET-detail","As a user, I check default value in API GET-detail",""
"passed","Tue Jun 28 18:55:14 GMT 2022","Tue Jun 28 18:56:35 GMT 2022","80864","","JIT-Module-013b-AWS-edit-infos","","JIT-Module-013b-AWS-edit-infos","[AWS] As a user, I can update module AWS SES Integration","[AWS] As a user, I can update module AWS SES Integration",""
"passed","Tue Jun 28 18:37:28 GMT 2022","Tue Jun 28 18:38:10 GMT 2022","41628","","JIT-Database-001b-TABLE-empty","","JIT-Database-001b-TABLE-empty","As a user, I cannot create table with empty name","As a user, I cannot create table with empty name",""
"passed","Tue Jun 28 18:39:34 GMT 2022","Tue Jun 28 18:41:10 GMT 2022","96299","","JIT-Database-010-Check-validation-column-definition-type-FILE","","JIT-Database-010-Check-validation-column-definition-type-FILE","As a user, I should check the validation of FILE column definition","As a user, I should check the validation of FILE column definition",""
"passed","Tue Jun 28 18:44:10 GMT 2022","Tue Jun 28 18:45:23 GMT 2022","72544","","JIT-Database-015a-INDEX-Check-duplicate-empty","","JIT-Database-015a-INDEX-Check-duplicate-empty","As a user, I check empty and duplicate index","As a user, I check empty and duplicate index",""
"passed","Tue Jun 28 18:44:43 GMT 2022","Tue Jun 28 18:46:14 GMT 2022","91587","","JIT-Database-015c-INDEX-CRUD-multiple","","JIT-Database-015c-INDEX-CRUD-multiple","As a user, I check add and update single index","As a user, I check add and update single index",""
"passed","Tue Jun 28 18:52:22 GMT 2022","Tue Jun 28 18:53:47 GMT 2022","84647","","JIT-Module-005a-FORCE-MOBILE-UPDATE-database","","JIT-Module-005a-FORCE-MOBILE-UPDATE-database","[FORCE-MOBILE-UPDATE] - Check adding and auto-table & columns","[FORCE-MOBILE-UPDATE] - Check adding and auto-table & columns",""
"passed","Tue Jun 28 18:45:46 GMT 2022","Tue Jun 28 18:46:51 GMT 2022","64533","","JIT-Mobile-003-Screen-delete-screen","","JIT-Mobile-003-Screen-delete-screen","As a user, I can delete screen","As a user, I can delete screen",""
"passed","Tue Jun 28 19:06:11 GMT 2022","Tue Jun 28 19:07:16 GMT 2022","64680","","JIT-API-004c-GET-detail-relation","","JIT-API-004c-GET-detail-relation","As a user, I check column display when having relation for GET-detail","As a user, I check column display when having relation for GET-detail",""
"passed","Tue Jun 28 18:50:55 GMT 2022","Tue Jun 28 18:52:58 GMT 2022","122478","","JIT-Module-002b-DEEPLINK-edit-infos","","JIT-Module-002b-DEEPLINK-edit-infos","As a user, I can update module Deeplink","As a user, I can update module Deeplink",""
"passed","Tue Jun 28 18:42:11 GMT 2022","Tue Jun 28 18:43:32 GMT 2022","81162","","JIT-Database-011d-COLUMN-ENUM-delete-selected-items","","JIT-Database-011d-COLUMN-ENUM-delete-selected-items","As a user, I should delete 1 selected item and check is will be removed in default dropdown","As a user, I should delete 1 selected item and check is will be removed in default dropdown",""
"passed","Tue Jun 28 18:57:53 GMT 2022","Tue Jun 28 18:58:59 GMT 2022","65739","","JIT-Team-005-Invite-duplicate-email","","JIT-Team-005-Invite-duplicate-email","[INVITE-DELETE] Invite new email and invite again","[INVITE-DELETE] Invite new email and invite again",""
"passed","Tue Jun 28 18:47:42 GMT 2022","Tue Jun 28 18:50:08 GMT 2022","145840","","JIT-Mobile-010-JITDEF14-rename-without-focusing","","JIT-Mobile-010-JITDEF14-rename-without-focusing","As a user, I could rename the screen/molecule without focusing","As a user, I could rename the screen/molecule without focusing",""
"passed","Tue Jun 28 18:42:48 GMT 2022","Tue Jun 28 18:44:01 GMT 2022","73020","","JIT-Database-011f-COLUMN-ENUM-duplicated","","JIT-Database-011f-COLUMN-ENUM-duplicated","As a user, I should check counld not add duplicated item","As a user, I should check counld not add duplicated item",""
"passed","Tue Jun 28 18:33:11 GMT 2022","Tue Jun 28 18:34:37 GMT 2022","86565","","JIT-Dashboard-004c-CREATEOF-saving","","JIT-Dashboard-004c-CREATEOF-saving","[CREATE-OF] As a user, I should save the selected option when switching between tables","[CREATE-OF] As a user, I should save the selected option when switching between tables",""
"passed","Tue Jun 28 19:16:09 GMT 2022","Tue Jun 28 19:17:29 GMT 2022","80001","","JIT-Module-011b-GUEST-LOGIN-databse-api","","JIT-Module-011b-GUEST-LOGIN-databse-api","[GUEST-LOGIN], I check auto-generate column and api","[GUEST-LOGIN], I check auto-generate column and api",""
"broken","Tue Jun 28 19:23:36 GMT 2022","Tue Jun 28 19:24:53 GMT 2022","76959","","JIT-API-007c-GET-detail-API-Add-new-endpoint","","JIT-API-007c-GET-detail-API-Add-new-endpoint","[GET-detail-API] Create, update and delete new GET API endpoint","[GET-detail-API] Create, update and delete new GET API endpoint",""
"passed","Tue Jun 28 18:33:34 GMT 2022","Tue Jun 28 18:34:51 GMT 2022","77113","","JIT-Dashboard-004e-CREATEOF-delete-column","","JIT-Dashboard-004e-CREATEOF-delete-column","[CREATE-OF] As a user, I should see the params will be removed when column is deleted","[CREATE-OF] As a user, I should see the params will be removed when column is deleted",""
"passed","Tue Jun 28 18:44:54 GMT 2022","Tue Jun 28 18:46:49 GMT 2022","114360","","JIT-Database-016a-COUNTER-CACHE-Create-by-relation","","JIT-Database-016a-COUNTER-CACHE-Create-by-relation","[COUNTER-CACHE] create new counter cache column by selecting in relation popup","[COUNTER-CACHE] create new counter cache column by selecting in relation popup",""
"passed","Tue Jun 28 18:55:16 GMT 2022","Tue Jun 28 18:56:27 GMT 2022","71709","","JIT-Module-014a-BASIC-AUTH-default","","JIT-Module-014a-BASIC-AUTH-default","[BASIC-AUTH] As a user, I can add module Basic Authentication and remove it","[BASIC-AUTH] As a user, I can add module Basic Authentication and remove it",""
"passed","Tue Jun 28 18:30:13 GMT 2022","Tue Jun 28 18:32:48 GMT 2022","154669","","JIT-Dashboard-001-Check-general-info","","JIT-Dashboard-001-Check-general-info","As a user, I check general info and update table name","As a user, I check general info and update table name",""
"passed","Tue Jun 28 18:52:37 GMT 2022","Tue Jun 28 18:55:24 GMT 2022","166870","","JIT-Module-005b-FORCE-MOBILE-UPDATE-api","","JIT-Module-005b-FORCE-MOBILE-UPDATE-api","[FORCE-MOBILE-UPDATE] - Check api","[FORCE-MOBILE-UPDATE] - Check api",""
"passed","Tue Jun 28 18:30:13 GMT 2022","Tue Jun 28 18:32:16 GMT 2022","123600","","JIT-Dashboard-002e-LISTOF-delete-column","","JIT-Dashboard-002e-LISTOF-delete-column","As a user, I should see the params will be removed when column is deleted","As a user, I should see the params will be removed when column is deleted",""
"passed","Tue Jun 28 18:41:54 GMT 2022","Tue Jun 28 18:43:24 GMT 2022","89607","","JIT-Database-011c-COLUMN-ENUM-delete-items","","JIT-Database-011c-COLUMN-ENUM-delete-items","As a user, I should delete 1 item and check not display in default dropdown","As a user, I should delete 1 item and check not display in default dropdown",""
"passed","Tue Jun 28 18:53:46 GMT 2022","Tue Jun 28 18:55:19 GMT 2022","92890","","JIT-Module-010a-LINE-LOGIN-default-edit","","JIT-Module-010a-LINE-LOGIN-default-edit","[LINE-LOGIN], I can add module Line Login and edit its infos","[LINE-LOGIN], I can add module Line Login and edit its infos",""
"passed","Tue Jun 28 18:50:49 GMT 2022","Tue Jun 28 18:52:36 GMT 2022","107314","","JIT-Module-001b-CLOUDINARY-edit-infos","","JIT-Module-001b-CLOUDINARY-edit-infos","As a user, I can update module Cloudinary","As a user, I can update module Cloudinary",""
"broken","Tue Jun 28 19:25:03 GMT 2022","Tue Jun 28 19:26:23 GMT 2022","79882","","JIT-API-007d-POST-API-Add-new-endpoint","","JIT-API-007d-POST-API-Add-new-endpoint","[GET-POST] Create, update and delete new POST API endpoint","[GET-POST] Create, update and delete new POST API endpoint",""
"passed","Tue Jun 28 18:43:11 GMT 2022","Tue Jun 28 18:44:15 GMT 2022","64041","","JIT-Database-012b-RELATION-empty-duplicate","","JIT-Database-012b-RELATION-empty-duplicate","[RELATION], I should see the error duplicate when leaving foreign key empty","[RELATION], I should see the error duplicate when leaving foreign key empty",""
"passed","Tue Jun 28 19:11:59 GMT 2022","Tue Jun 28 19:13:37 GMT 2022","98025","","JIT-API-008-DEFECT-Check-column-file-type","","JIT-API-008-DEFECT-Check-column-file-type","[DEFECT] As a user, I check column type file not display in request params of GET list Api","[DEFECT] As a user, I check column type file not display in request params of GET list Api",""
"passed","Tue Jun 28 19:01:10 GMT 2022","Tue Jun 28 19:02:08 GMT 2022","57263","","JIT-API-001-Check-general-info","","JIT-API-001-Check-general-info","As a user, I check general info","As a user, I check general info",""
"passed","Tue Jun 28 19:13:42 GMT 2022","Tue Jun 28 19:15:15 GMT 2022","93205","","JIT-Module-006c-SMS-database-api","","JIT-Module-006c-SMS-database-api","[SMS], I check auto-generate column and api","[SMS], I check auto-generate column and api",""
"passed","Tue Jun 28 18:41:10 GMT 2022","Tue Jun 28 18:43:24 GMT 2022","133809","","JIT-Database-010-Check-validation-column-definition-type-FILE","","JIT-Database-010-Check-validation-column-definition-type-FILE","As a user, I should check the validation of FILE column definition for Format Area","As a user, I should check the validation of FILE column definition for Format Area",""
"passed","Tue Jun 28 19:31:45 GMT 2022","Tue Jun 28 19:32:21 GMT 2022","36261","","JIT-Export-006-Existing-Scenario-ROR-nokey","","JIT-Export-006-Existing-Scenario-ROR-nokey","As a user, I check export the existing project type ROR no key successfully","As a user, I check export the existing project type ROR no key successfully",""
"passed","Tue Jun 28 18:39:30 GMT 2022","Tue Jun 28 18:41:02 GMT 2022","91478","","JIT-Database-009-Check-validation-column-definition-type-BOOLEAN","","JIT-Database-009-Check-validation-column-definition-type-BOOLEAN","As a user, I should check the validation of BOOLEAN column definition","As a user, I should check the validation of BOOLEAN column definition",""
"passed","Tue Jun 28 19:12:05 GMT 2022","Tue Jun 28 19:14:47 GMT 2022","161989","","JIT-API-009-Auto-fill","","JIT-API-009-Auto-fill","[AUTO-FILL] As a user, I could add request param by Auto-fill","[AUTO-FILL] As a user, I could add request param by Auto-fill",""
"passed","Tue Jun 28 18:57:20 GMT 2022","Tue Jun 28 18:58:09 GMT 2022","49128","","JIT-Module-017b-GOOGLE-ANAL-edit-infos","","JIT-Module-017b-GOOGLE-ANAL-edit-infos","[GOOGLE-ANAL] As a user, I can update module Google Analytics","[GOOGLE-ANAL] As a user, I can update module Google Analytics",""
"passed","Tue Jun 28 18:46:13 GMT 2022","Tue Jun 28 18:49:16 GMT 2022","183214","","JIT-Mobile-004-Screen-duplicate-screen","","JIT-Mobile-004-Screen-duplicate-screen","As a user, I can duplicate screen with positive and negative cases","As a user, I can duplicate screen with positive and negative cases",""
"passed","Tue Jun 28 18:52:35 GMT 2022","Tue Jun 28 18:54:07 GMT 2022","91969","","JIT-Module-006a-SMS-default","","JIT-Module-006a-SMS-default","[SMS], I can add module SMS login with Twilio and remove it","[SMS], I can add module SMS login with Twilio and remove it",""
"passed","Tue Jun 28 19:06:33 GMT 2022","Tue Jun 28 19:08:18 GMT 2022","105004","","JIT-API-005a-PUT-check-default","","JIT-API-005a-PUT-check-default","As a user, I check default value in API PUT","As a user, I check default value in API PUT",""
"passed","Tue Jun 28 18:43:59 GMT 2022","Tue Jun 28 18:45:04 GMT 2022","64491","","JIT-Database-013-DEFECT-Check-default-value-when-changing-type","","JIT-Database-013-DEFECT-Check-default-value-when-changing-type","As a user, I should check the default value when changing the type","As a user, I should check the default value when changing the type",""
"passed","Tue Jun 28 18:52:57 GMT 2022","Tue Jun 28 18:54:26 GMT 2022","88951","","JIT-Module-007a-APPLE-LOGIN-default-edit","","JIT-Module-007a-APPLE-LOGIN-default-edit","[APPLE-LOGIN], I can add module Apple Login and edit its infos","[APPLE-LOGIN], I can add module Apple Login and edit its infos",""
"passed","Tue Jun 28 18:35:36 GMT 2022","Tue Jun 28 18:37:01 GMT 2022","85167","","JIT-Dashboard-006c-DELETEOF-saving","","JIT-Dashboard-006c-DELETEOF-saving","[DELETE-OF] As a user, I should save the selected option when switching between tables","[DELETE-OF] As a user, I should save the selected option when switching between tables",""
