"Status","Start Time","Stop Time","Duration in ms","Parent Suite","Suite","Sub Suite","Test Class","Test Method","Name","Description"
"passed","Tue Jun 28 18:47:46 GMT 2022","Tue Jun 28 18:49:08 GMT 2022","82032","","JIT-Mobile-012-JITDEF-remove-poperty-info-after-deleting-navigation","","JIT-Mobile-012-JITDEF-remove-poperty-info-after-deleting-navigation","As a user, I should see the property infos need to be removed after the navigation was deleted","As a user, I should see the property infos need to be removed after the navigation was deleted",""
"passed","Tue Jun 28 18:50:41 GMT 2022","Tue Jun 28 18:51:43 GMT 2022","62063","","JIT-Module-001a-CLOUDINARY-default","","JIT-Module-001a-CLOUDINARY-default","As a user, I can add module Cloudinary and remove it","As a user, I can add module Cloudinary and remove it",""
"passed","Tue Jun 28 18:50:42 GMT 2022","Tue Jun 28 18:51:25 GMT 2022","43141","","JIT-Module-000-search","","JIT-Module-000-search","[SEARCH] As a user, I can Search module","[SEARCH] As a user, I can Search module",""
"passed","Tue Jun 28 18:30:13 GMT 2022","Tue Jun 28 18:32:25 GMT 2022","131845","","JIT-Dashboard-002c-LISTOF-saving","","JIT-Dashboard-002c-LISTOF-saving","[LIST-OF] As a user, I should save the selected option when switching between tables","[LIST-OF] As a user, I should save the selected option when switching between tables",""
"passed","Tue Jun 28 18:57:41 GMT 2022","Tue Jun 28 18:58:55 GMT 2022","73914","","JIT-Team-003-Invite-and-resend","","JIT-Team-003-Invite-and-resend","[RESEND-INVITE] Invite new email and resend invitation","[RESEND-INVITE] Invite new email and resend invitation",""
"passed","Tue Jun 28 19:07:30 GMT 2022","Tue Jun 28 19:08:41 GMT 2022","71427","","JIT-API-005c-PUT-relation","","JIT-API-005c-PUT-relation","As a user, I check column display when having relation for API PUT","As a user, I check column display when having relation for API PUT",""
"passed","Tue Jun 28 19:14:56 GMT 2022","Tue Jun 28 19:16:55 GMT 2022","119445","","JIT-Module-008b-FB-LOGIN-databse-api","","JIT-Module-008b-FB-LOGIN-databse-api","[FACEBOOK-LOGIN], I check auto-generate column and api","[FACEBOOK-LOGIN], I check auto-generate column and api",""
"passed","Tue Jun 28 18:30:13 GMT 2022","Tue Jun 28 18:32:19 GMT 2022","126371","","JIT-Dashboard-002d-LISTOF-delete-table","","JIT-Dashboard-002d-LISTOF-delete-table","[LIST-OF] As a user, I should see the table is not displayed in dashboard list after removed","[LIST-OF] As a user, I should see the table is not displayed in dashboard list after removed",""
"passed","Tue Jun 28 18:39:17 GMT 2022","Tue Jun 28 18:42:05 GMT 2022","167872","","JIT-Database-007-Check-validation-column-definition-type-TEXT","","JIT-Database-007-Check-validation-column-definition-type-TEXT","As a user, I should check the validation of TEXT column definition","As a user, I should check the validation of TEXT column definition",""
"passed","Tue Jun 28 18:56:05 GMT 2022","Tue Jun 28 18:57:03 GMT 2022","57602","","JIT-Module-015b-SCOUT-edit-infos","","JIT-Module-015b-SCOUT-edit-infos","[SCOUT] As a user, I can update module Scout","[SCOUT] As a user, I can update module Scout",""
"passed","Tue Jun 28 18:40:53 GMT 2022","Tue Jun 28 18:42:02 GMT 2022","69587","","JIT-Database-011a-COLUMN-ENUM-default","","JIT-Database-011a-COLUMN-ENUM-default","As a user, I should check the basic validation","As a user, I should check the basic validation",""
"passed","Tue Jun 28 19:08:42 GMT 2022","Tue Jun 28 19:09:58 GMT 2022","76161","","JIT-API-006c-DELETE-relation","","JIT-API-006c-DELETE-relation","As a user, I check column display when having relation for API DELETE","As a user, I check column display when having relation for API DELETE",""
"passed","Tue Jun 28 18:37:38 GMT 2022","Tue Jun 28 18:38:45 GMT 2022","66570","","JIT-Database-001d-TABLE-update","","JIT-Database-001d-TABLE-update","As a user, I can update the value of the table","As a user, I can update the value of the table",""
"passed","Tue Jun 28 18:38:01 GMT 2022","Tue Jun 28 18:38:54 GMT 2022","52339","","JIT-Database-003-Check-create-empty-and-duplicated-column","","JIT-Database-003-Check-create-empty-and-duplicated-column","As a user, I cannot add empty column definition","As a user, I cannot add empty column definition",""
"passed","Tue Jun 28 18:33:13 GMT 2022","Tue Jun 28 18:34:46 GMT 2022","93893","","JIT-Dashboard-004d-CREATEOF-delete-table","","JIT-Dashboard-004d-CREATEOF-delete-table","[CREATE-OF] As a user, I should see the table is not displayed in dashboard list after removed","[CREATE-OF] As a user, I should see the table is not displayed in dashboard list after removed",""
"passed","Tue Jun 28 19:34:08 GMT 2022","Tue Jun 28 19:36:06 GMT 2022","117995","","JIT-Export-009-Existing-Scenario-ROR-withkey-Jump-team","","JIT-Export-009-Existing-Scenario-ROR-withkey-Jump-team","[JUMP-TEAM] Existing project - With key","[JUMP-TEAM] Existing project - With key",""
"passed","Tue Jun 28 18:50:56 GMT 2022","Tue Jun 28 18:52:37 GMT 2022","101204","","JIT-Module-003-JPBANK-default","","JIT-Module-003-JPBANK-default","[JPBANK] - Check adding and auto-generated API","[JPBANK] - Check adding and auto-generated API",""
"passed","Tue Jun 28 18:37:33 GMT 2022","Tue Jun 28 18:38:32 GMT 2022","59082","","JIT-Database-001c-TABLE-duplicate","","JIT-Database-001c-TABLE-duplicate","As a user, I cannot create table with duplicate name","As a user, I cannot create table with duplicate name",""
"passed","Tue Jun 28 18:42:47 GMT 2022","Tue Jun 28 18:44:09 GMT 2022","82042","","JIT-Database-011e-COLUMN-ENUM-delete-all","","JIT-Database-011e-COLUMN-ENUM-delete-all","As a user, I should delete all items and check all items are not displayed","As a user, I should delete all items and check all items are not displayed",""
"passed","Tue Jun 28 18:57:25 GMT 2022","Tue Jun 28 18:59:52 GMT 2022","146346","","JIT-Team-001-Invite-and-signup-new-account","","JIT-Team-001-Invite-and-signup-new-account","[INVITE-SIGNUP] Invite new email and sign-up new account and do common action","[INVITE-SIGNUP] Invite new email and sign-up new account and do common action",""
"passed","Tue Jun 28 19:02:21 GMT 2022","Tue Jun 28 19:03:49 GMT 2022","88212","","JIT-API-003a-POST-check-default","","JIT-API-003a-POST-check-default","As a user, I check default value in API POST","As a user, I check default value in API POST",""
"passed","Tue Jun 28 18:55:51 GMT 2022","Tue Jun 28 18:56:58 GMT 2022","66919","","JIT-Module-015a-SCOUT-default","","JIT-Module-015a-SCOUT-default","[SCOUT] As a user, I can add module Scout and remove it","[SCOUT] As a user, I can add module Scout and remove it",""
"passed","Tue Jun 28 19:20:41 GMT 2022","Tue Jun 28 19:21:55 GMT 2022","74531","","JIT-API-002a-GET-list-check-default","","JIT-API-002a-GET-list-check-default","As a user, I check default value in API GET list","As a user, I check default value in API GET list",""
"passed","Tue Jun 28 19:33:05 GMT 2022","Tue Jun 28 19:34:03 GMT 2022","57955","","JIT-Export-006-Existing-Scenario-ROR-nokey","","JIT-Export-006-Existing-Scenario-ROR-nokey","[JUMP-TEAM] Existing project - No key","[JUMP-TEAM] Existing project - No key",""
"passed","Tue Jun 28 18:55:43 GMT 2022","Tue Jun 28 18:56:54 GMT 2022","71146","","JIT-Module-014b-BASIC-AUTH-edit-infos","","JIT-Module-014b-BASIC-AUTH-edit-infos","[BASIC-AUTH] As a user, I can update module Basic Authentication","[BASIC-AUTH] As a user, I can update module Basic Authentication",""
"passed","Tue Jun 28 18:45:22 GMT 2022","Tue Jun 28 18:47:10 GMT 2022","107235","","JIT-Mobile-002-Screen-update-screen","","JIT-Mobile-002-Screen-update-screen","As a user, I can update screen with positive and negative cases","As a user, I can update screen with positive and negative cases",""
"passed","Tue Jun 28 18:37:56 GMT 2022","Tue Jun 28 18:38:42 GMT 2022","46640","","JIT-Database-002-Check-default-column-definition","","JIT-Database-002-Check-default-column-definition","As a user, I should see the default column definition","As a user, I should see the default column definition",""
"passed","Tue Jun 28 18:32:41 GMT 2022","Tue Jun 28 18:34:23 GMT 2022","102381","","JIT-Dashboard-003d-DETAILOF-delete-table","","JIT-Dashboard-003d-DETAILOF-delete-table","[DEATIL-OF] As a user, I should see the table is not displayed in dashboard list after removed","[DEATIL-OF] As a user, I should see the table is not displayed in dashboard list after removed",""
"passed","Tue Jun 28 19:15:31 GMT 2022","Tue Jun 28 19:17:08 GMT 2022","96913","","JIT-Module-010b-LINE-LOGIN-databse-api","","JIT-Module-010b-LINE-LOGIN-databse-api","[LINE-LOGIN], I check auto-generate column and api","[LINE-LOGIN], I check auto-generate column and api",""
"passed","Tue Jun 28 18:32:52 GMT 2022","Tue Jun 28 18:34:23 GMT 2022","91283","","JIT-Dashboard-003e-DETAILOF-delete-column","","JIT-Dashboard-003e-DETAILOF-delete-column","[DEATIL-OF] As a user, I should see the params will be removed when column is deleted","[DEATIL-OF] As a user, I should see the params will be removed when column is deleted",""
"passed","Tue Jun 28 19:02:51 GMT 2022","Tue Jun 28 19:04:15 GMT 2022","84753","","JIT-API-003b-POST-update-info","","JIT-API-003b-POST-update-info","As a user, I update info for API POST","As a user, I update info for API POST",""
"passed","Tue Jun 28 18:30:13 GMT 2022","Tue Jun 28 18:32:29 GMT 2022","135987","","JIT-Dashboard-002a-LISTOF-default-column","","JIT-Dashboard-002a-LISTOF-default-column","[LIST-OF] As a user, I should add default column in dashboard params","[LIST-OF] As a user, I should add default column in dashboard params",""
"passed","Tue Jun 28 18:47:45 GMT 2022","Tue Jun 28 18:49:06 GMT 2022","80235","","JIT-Mobile-011-JITDEF50-disable-add-duplicate-screen-in-stack","","JIT-Mobile-011-JITDEF50-disable-add-duplicate-screen-in-stack","As a user, I could add duplicate screen in stack","As a user, I could add duplicate screen in stack",""
"passed","Tue Jun 28 18:33:03 GMT 2022","Tue Jun 28 18:34:28 GMT 2022","85169","","JIT-Dashboard-004a-CREATEOF-default","","JIT-Dashboard-004a-CREATEOF-default","[CREATE-OF] As a user, I should add default column in dashboard params","[CREATE-OF] As a user, I should add default column in dashboard params",""
"passed","Tue Jun 28 18:34:58 GMT 2022","Tue Jun 28 18:36:26 GMT 2022","88253","","JIT-Dashboard-005a-UPDATEOF-default","","JIT-Dashboard-005a-UPDATEOF-default","[UPDATE-OF] As a user, I should add default column in dashboard params","[UPDATE-OF] As a user, I should add default column in dashboard params",""
"passed","Tue Jun 28 19:15:05 GMT 2022","Tue Jun 28 19:16:44 GMT 2022","99312","","JIT-Module-009b-GOOGLE-LOGIN-databse-api","","JIT-Module-009b-GOOGLE-LOGIN-databse-api","[GOOGLE-LOGIN], I check auto-generate column and api","[GOOGLE-LOGIN], I check auto-generate column and api",""
"broken","Tue Jun 28 19:27:42 GMT 2022","Tue Jun 28 19:28:58 GMT 2022","75618","","JIT-API-007e-PUT-API-Add-new-endpoint","","JIT-API-007e-PUT-API-Add-new-endpoint","[PUT-API] Create, update and delete new PUT API endpoint","[PUT-API] Create, update and delete new PUT API endpoint",""
"passed","Tue Jun 28 18:53:48 GMT 2022","Tue Jun 28 18:55:16 GMT 2022","87803","","JIT-Module-011a-GUEST-LOGIN-default-edit","","JIT-Module-011a-GUEST-LOGIN-default-edit","[GUEST-LOGIN], I can add module Guest Login and edit its infos","[GUEST-LOGIN], I can add module Guest Login and edit its infos",""
"passed","Tue Jun 28 18:43:06 GMT 2022","Tue Jun 28 18:44:19 GMT 2022","72829","","JIT-Database-012a-RELATION-basic","","JIT-Database-012a-RELATION-basic","[RELATION] check the basic relation","[RELATION] check the basic relation",""
"passed","Tue Jun 28 18:35:06 GMT 2022","Tue Jun 28 18:36:45 GMT 2022","98755","","JIT-Dashboard-005c-UPDATEOF-saving","","JIT-Dashboard-005c-UPDATEOF-saving","[UPDATE-OF] As a user, I should save the selected option when switching between tables","[UPDATE-OF] As a user, I should save the selected option when switching between tables",""
"passed","Tue Jun 28 19:07:14 GMT 2022","Tue Jun 28 19:08:30 GMT 2022","75785","","JIT-API-005b-PUT-update-info","","JIT-API-005b-PUT-update-info","As a user, I update info for API PUT","As a user, I update info for API PUT",""
"passed","Tue Jun 28 18:57:40 GMT 2022","Tue Jun 28 19:00:46 GMT 2022","186753","","JIT-Team-002-Invite-existing-account","","JIT-Team-002-Invite-existing-account","[INVITE-EXISTING-ACC] Invite existing email and do common action","[INVITE-EXISTING-ACC] Invite existing email and do common action",""
"passed","Tue Jun 28 18:41:52 GMT 2022","Tue Jun 28 18:43:15 GMT 2022","83400","","JIT-Database-011b-COLUMN-ENUM-add-items","","JIT-Database-011b-COLUMN-ENUM-add-items","As a user, I should add new item and select in default dropdown","As a user, I should add new item and select in default dropdown",""
"passed","Tue Jun 28 18:56:07 GMT 2022","Tue Jun 28 18:57:12 GMT 2022","65658","","JIT-Module-016a-SENDGRID-default","","JIT-Module-016a-SENDGRID-default","[SENDGRID] As a user, I can add module SendGrid and remove it","[SENDGRID] As a user, I can add module SendGrid and remove it",""
"passed","Tue Jun 28 18:41:21 GMT 2022","Tue Jun 28 18:42:23 GMT 2022","61770","","JIT-Database-008-Check-validation-column-definition-type-DATE-TIME","","JIT-Database-008-Check-validation-column-definition-type-DATE-TIME","As a user, I should check the validation of DATE column definition","As a user, I should check the validation of DATE column definition",""
"passed","Tue Jun 28 19:19:51 GMT 2022","Tue Jun 28 19:20:28 GMT 2022","37275","","JIT-Module-013a-AWS-default","","JIT-Module-013a-AWS-default","[AWS] As a user, I can add module AWS SES Integration and remove it","[AWS] As a user, I can add module AWS SES Integration and remove it",""
"passed","Tue Jun 28 19:05:24 GMT 2022","Tue Jun 28 19:06:21 GMT 2022","56794","","JIT-API-004b-GET-detail-update-info","","JIT-API-004b-GET-detail-update-info","As a user, I update info for GET-detail","As a user, I update info for GET-detail",""
"passed","Tue Jun 28 18:49:13 GMT 2022","Tue Jun 28 18:51:43 GMT 2022","149624","","JIT-Mobile-016.View.Check-property-area-BASIC","","JIT-Mobile-016.View.Check-property-area-BASIC","As a user, I should check the BASIC infomation of View is correct: Width, Height, Flex, Color","As a user, I should check the BASIC infomation of View is correct: Width, Height, Flex, Color",""
"passed","Tue Jun 28 18:38:54 GMT 2022","Tue Jun 28 18:39:56 GMT 2022","62345","","JIT-Database-003-Check-create-empty-and-duplicated-column","","JIT-Database-003-Check-create-empty-and-duplicated-column","As a user, I cannot add duplicated column definition","As a user, I cannot add duplicated column definition",""
"passed","Tue Jun 28 19:13:53 GMT 2022","Tue Jun 28 19:15:50 GMT 2022","116990","","JIT-Module-007b-APPLE-LOGIN-databse-api","","JIT-Module-007b-APPLE-LOGIN-databse-api","[APPLE-LOGIN], I check auto-generate column and api","[APPLE-LOGIN], I check auto-generate column and api",""
"passed","Tue Jun 28 19:33:39 GMT 2022","Tue Jun 28 19:35:40 GMT 2022","120186","","JIT-Export-002-Scenario-ROR-withkey-1","","JIT-Export-002-Scenario-ROR-withkey-1","As a user, I check export the project type ROR with key successfully with scenario 1","As a user, I check export the project type ROR with key successfully with scenario 1",""
"passed","Tue Jun 28 18:38:53 GMT 2022","Tue Jun 28 18:41:25 GMT 2022","151837","","JIT-Database-005-Check-validation-column-definition-type-FLOAT","","JIT-Database-005-Check-validation-column-definition-type-FLOAT","As a user, I should check the validation of FLOAT column definition","As a user, I should check the validation of FLOAT column definition",""
"passed","Tue Jun 28 18:56:13 GMT 2022","Tue Jun 28 18:57:21 GMT 2022","68486","","JIT-Module-016b-SENDGRID-edit-infos","","JIT-Module-016b-SENDGRID-edit-infos","[SENDGRID] As a user, I can update module SendGrid","[SENDGRID] As a user, I can update module SendGrid",""
"passed","Tue Jun 28 18:38:45 GMT 2022","Tue Jun 28 18:41:06 GMT 2022","140776","","JIT-Database-004-Check-validation-column-definition-type-INTEGER","","JIT-Database-004-Check-validation-column-definition-type-INTEGER","As a user, I should check the validation of INTEGER column definition","As a user, I should check the validation of INTEGER column definition",""
"passed","Tue Jun 28 19:26:34 GMT 2022","Tue Jun 28 19:27:38 GMT 2022","64364","","JIT-API-002b-GET-list-update-info","","JIT-API-002b-GET-list-update-info","As a user, I update info for GET-list","As a user, I update info for GET-list",""
"passed","Tue Jun 28 18:36:56 GMT 2022","Tue Jun 28 18:38:33 GMT 2022","96324","","JIT-Dashboard-006d-DELETEOF-delete-table","","JIT-Dashboard-006d-DELETEOF-delete-table","[DELETE-OF] As a user, I should see the table is not displayed in dashboard list after removed","[DELETE-OF] As a user, I should see the table is not displayed in dashboard list after removed",""
"passed","Tue Jun 28 18:57:46 GMT 2022","Tue Jun 28 18:58:48 GMT 2022","62677","","JIT-Team-004-Invite-and-delete-invitation","","JIT-Team-004-Invite-and-delete-invitation","[INVITE-DELETE] Invite new email and delete invitation","[INVITE-DELETE] Invite new email and delete invitation",""
"passed","Tue Jun 28 18:35:34 GMT 2022","Tue Jun 28 18:36:42 GMT 2022","68185","","JIT-Dashboard-006b-DELETEOF-new-column","","JIT-Dashboard-006b-DELETEOF-new-column","[DELETE-OF] As a user, I should add new column in dashboard params","[DELETE-OF] As a user, I should add new column in dashboard params",""
"passed","Tue Jun 28 19:08:56 GMT 2022","Tue Jun 28 19:09:33 GMT 2022","36982","","JIT-API-007a-GROUP-API-CRUD","","JIT-API-007a-GROUP-API-CRUD","[GROUP-API] Create, update and delete group API","[GROUP-API] Create, update and delete group API",""
"passed","Tue Jun 28 18:30:17 GMT 2022","Tue Jun 28 18:32:10 GMT 2022","112975","","JIT-Dashboard-003b-DETAILOF-new-column","","JIT-Dashboard-003b-DETAILOF-new-column","[DEATIL-OF] As a user, I should add new column in dashboard params","[DEATIL-OF] As a user, I should add new column in dashboard params",""
"passed","Tue Jun 28 18:44:10 GMT 2022","Tue Jun 28 18:45:27 GMT 2022","77038","","JIT-Database-014-DEFECT-Check-duplicate-table-name","","JIT-Database-014-DEFECT-Check-duplicate-table-name","As a user, I cannot update to duplicate name","As a user, I cannot update to duplicate name",""
"passed","Tue Jun 28 19:31:34 GMT 2022","Tue Jun 28 19:33:34 GMT 2022","120242","","JIT-Export-001-Scenario_ROR_1","","JIT-Export-001-Scenario_ROR_1","As a user, I check export the project type ROR no key successfully with scenario 1","As a user, I check export the project type ROR no key successfully with scenario 1",""
"passed","Tue Jun 28 18:36:57 GMT 2022","Tue Jun 28 18:38:18 GMT 2022","80200","","JIT-Dashboard-006e-DELETEOF-delete-column","","JIT-Dashboard-006e-DELETEOF-delete-column","[DELETE-OF] As a user, I should see the params will be removed when column is deleted","[DELETE-OF] As a user, I should see the params will be removed when column is deleted",""
"passed","Tue Jun 28 18:30:13 GMT 2022","Tue Jun 28 18:32:11 GMT 2022","117899","","JIT-Dashboard-002b-LISTOF-new-column","","JIT-Dashboard-002b-LISTOF-new-column","[LIST-OF] As a user, I should add new column in dashboard params","[LIST-OF] As a user, I should add new column in dashboard params",""
"passed","Tue Jun 28 19:08:32 GMT 2022","Tue Jun 28 19:09:34 GMT 2022","62367","","JIT-API-006b-DELETE-update-info","","JIT-API-006b-DELETE-update-info","As a user, I update info for API DELETE","As a user, I update info for API DELETE",""
"passed","Tue Jun 28 19:31:36 GMT 2022","Tue Jun 28 19:34:44 GMT 2022","188513","","JIT-Export-003-Scenario_ROR_2","","JIT-Export-003-Scenario_ROR_2","As a user, I check export the project type ROR no key successfully with scenario 2","As a user, I check export the project type ROR no key successfully with scenario 2",""
"passed","Tue Jun 28 18:48:05 GMT 2022","Tue Jun 28 18:49:52 GMT 2022","106169","","JIT-Mobile-013-JITDEF-reflect-delete-screen-innavigation-tree","","JIT-Mobile-013-JITDEF-reflect-delete-screen-innavigation-tree","As a user, I should see screen will be removed in navigation tree after deleting screen","As a user, I should see screen will be removed in navigation tree after deleting screen",""
"passed","Tue Jun 28 18:46:18 GMT 2022","Tue Jun 28 18:47:37 GMT 2022","79161","","JIT-Mobile-005-Moelcule-create-new-molecule","","JIT-Mobile-005-Moelcule-create-new-molecule","As a user, I can create new molecule with positive and negative cases","As a user, I can create new molecule with positive and negative cases",""
"passed","Tue Jun 28 18:53:27 GMT 2022","Tue Jun 28 18:55:05 GMT 2022","98178","","JIT-Module-009a-GOOGLE-LOGIN-default-edit","","JIT-Module-009a-GOOGLE-LOGIN-default-edit","[GOOGLE-LOGIN], I can add module Google Login and edit its infos","[GOOGLE-LOGIN], I can add module Google Login and edit its infos",""
"passed","Tue Jun 28 18:32:39 GMT 2022","Tue Jun 28 18:34:27 GMT 2022","107654","","JIT-Dashboard-003c-DETAILOF-saving","","JIT-Dashboard-003c-DETAILOF-saving","[DEATIL-OF] As a user, I should save the selected option when switching between tables","[DEATIL-OF] As a user, I should save the selected option when switching between tables",""
"passed","Tue Jun 28 18:44:16 GMT 2022","Tue Jun 28 18:45:47 GMT 2022","91434","","JIT-Database-015b-INDEX-CRUD-single","","JIT-Database-015b-INDEX-CRUD-single","As a user, I check add and update multiple index","As a user, I check add and update multiple index",""
"broken","Tue Jun 28 19:22:00 GMT 2022","Tue Jun 28 19:23:25 GMT 2022","85492","","JIT-API-007b-GET-list-API-Add-new-endpoint","","JIT-API-007b-GET-list-API-Add-new-endpoint","[GET-list-API] Create, update and delete new GET API endpoint","[GET-list-API] Create, update and delete new GET API endpoint",""
"passed","Tue Jun 28 18:57:04 GMT 2022","Tue Jun 28 18:58:00 GMT 2022","55891","","JIT-Module-017a-GOOGLE-ANAL-default","","JIT-Module-017a-GOOGLE-ANAL-default","[GOOGLE-ANAL] As a user, I can add module Google Analytics and remove it","[GOOGLE-ANAL] As a user, I can add module Google Analytics and remove it",""
"passed","Tue Jun 28 18:48:53 GMT 2022","Tue Jun 28 18:50:06 GMT 2022","73445","","JIT-Mobile-015.View.Check-general-info-and-function-of-View","","JIT-Mobile-015.View.Check-general-info-and-function-of-View","As a user, I should check the general infomation of View is correct: Name, Key, unique key, delete component","As a user, I should check the general infomation of View is correct: Name, Key, unique key, delete component",""
"passed","Tue Jun 28 19:34:49 GMT 2022","Tue Jun 28 19:36:55 GMT 2022","125614","","JIT-Export-004-Scenario_ROR_2","","JIT-Export-004-Scenario_ROR_2","As a user, I check export the project type ROR with key successfully with scenario 2","As a user, I check export the project type ROR with key successfully with scenario 2",""
"passed","Tue Jun 28 18:53:28 GMT 2022","Tue Jun 28 18:55:09 GMT 2022","100239","","JIT-Module-008a-FB-LOGIN-default-edit","","JIT-Module-008a-FB-LOGIN-default-edit","[FACEBOOK-LOGIN], I can add module Facebook Login and edit its infos","[FACEBOOK-LOGIN], I can add module Facebook Login and edit its infos",""
"passed","Tue Jun 28 18:35:13 GMT 2022","Tue Jun 28 18:36:50 GMT 2022","97176","","JIT-Dashboard-005e-UPDATEOF-delete-column","","JIT-Dashboard-005e-UPDATEOF-delete-column","[UPDATE-OF] As a user, I should see the params will be removed when column is deleted","[UPDATE-OF] As a user, I should see the params will be removed when column is deleted",""
"passed","Tue Jun 28 18:46:41 GMT 2022","Tue Jun 28 18:48:35 GMT 2022","113690","","JIT-Mobile-006-Molecule-update-molecule","","JIT-Mobile-006-Molecule-update-molecule","As a user, I can update molecule with positive and negative cases","As a user, I can update molecule with positive and negative cases",""
"passed","Tue Jun 28 19:04:02 GMT 2022","Tue Jun 28 19:05:13 GMT 2022","71429","","JIT-API-003c-POST-relation","","JIT-API-003c-POST-relation","As a user, I check column display when having relation for API POST","As a user, I check column display when having relation for API POST",""
"passed","Tue Jun 28 18:47:07 GMT 2022","Tue Jun 28 18:48:11 GMT 2022","64255","","JIT-Mobile-007-Molecule-delete-molecule","","JIT-Mobile-007-Molecule-delete-molecule","As a user, I can delete molecule","As a user, I can delete molecule",""
"passed","Tue Jun 28 19:12:15 GMT 2022","Tue Jun 28 19:14:40 GMT 2022","144702","","JIT-Module-004-EMAIL-LOGIN","","JIT-Module-004-EMAIL-LOGIN","[EMAIL-LOGIN] - Check adding and auto-generated API","[EMAIL-LOGIN] - Check adding and auto-generated API",""
"broken","Tue Jun 28 19:29:09 GMT 2022","Tue Jun 28 19:30:22 GMT 2022","73384","","JIT-API-007f-DELETE-API-Add-new-endpoint","","JIT-API-007f-DELETE-API-Add-new-endpoint","[DELETE-API] Create, update and delete new DELETE API endpoint","[DELETE-API] Create, update and delete new DELETE API endpoint",""
"passed","Tue Jun 28 18:30:12 GMT 2022","Tue Jun 28 18:32:13 GMT 2022","120565","","JIT-Dashboard-003a-DETAILOF-default","","JIT-Dashboard-003a-DETAILOF-default","[DEATIL-OF] As a user, I should add default column in dashboard params","[DEATIL-OF] As a user, I should add default column in dashboard params",""
"passed","Tue Jun 28 18:37:21 GMT 2022","Tue Jun 28 18:38:33 GMT 2022","72180","","JIT-Database-001a-TABLE-new","","JIT-Database-001a-TABLE-new","As a user, I can create new table","As a user, I can create new table",""
"passed","Tue Jun 28 18:39:19 GMT 2022","Tue Jun 28 18:41:21 GMT 2022","121974","","JIT-Database-008-Check-validation-column-definition-type-DATE-TIME","","JIT-Database-008-Check-validation-column-definition-type-DATE-TIME","As a user, I should check the validation of DATETIME column definition","As a user, I should check the validation of DATETIME column definition",""
