"Status","Start Time","Stop Time","Duration in ms","Parent Suite","Suite","Sub Suite","Test Class","Test Method","Name","Description"
"passed","Fri Jan 06 18:22:04 GMT 2023","Fri Jan 06 18:24:55 GMT 2023","171495","","JIT-Mobile-005b-MOLECULE-Navigate-edit-screen","","JIT-Mobile-005b-MOLECULE-Navigate-edit-screen","[MOBILE-MOLECULE-EDIT] As a user, I can see the molecule in Screen and use Edit button see the content of this molecule","[MOBILE-MOLECULE-EDIT] As a user, I can see the molecule in Screen and use Edit button see the content of this molecule",""
"passed","Fri Jan 06 18:24:15 GMT 2023","Fri Jan 06 18:25:56 GMT 2023","101007","","JIT-Mobile-015-VIEW-General-info","","JIT-Mobile-015-VIEW-General-info","[MOBILE-VIEW] As a user, I should check the general infomation of View is correct: Name, Key, unique key, delete component","[MOBILE-VIEW] As a user, I should check the general infomation of View is correct: Name, Key, unique key, delete component",""
"passed","Fri Jan 06 18:36:29 GMT 2023","Fri Jan 06 18:37:33 GMT 2023","63937","","JIT-Module-001a-CLOUDINARY-default","","JIT-Module-001a-CLOUDINARY-default","As a user, I can add module Cloudinary and remove it","As a user, I can add module Cloudinary and remove it",""
"passed","Fri Jan 06 19:40:05 GMT 2023","Fri Jan 06 19:42:00 GMT 2023","115281","","JIT-Export-005b-Scenario-RN-all-default-component","","JIT-Export-005b-Scenario-RN-all-default-component","[RN-Default] As a user, I check export the project type React Native with all default component","[RN-Default] As a user, I check export the project type React Native with all default component",""
"passed","Fri Jan 06 18:27:14 GMT 2023","Fri Jan 06 18:28:49 GMT 2023","95696","","JIT-Mobile-027b-IMAGE-General-info","","JIT-Mobile-027b-IMAGE-General-info","[MOBILE-IMAGE] As a user, I should check the general infomation of Image is correct: Name, Key, unique key, delete component","[MOBILE-IMAGE] As a user, I should check the general infomation of Image is correct: Name, Key, unique key, delete component",""
"passed","Fri Jan 06 18:26:31 GMT 2023","Fri Jan 06 18:30:11 GMT 2023","220122","","JIT-Mobile-022d-TEXT-Check-PADDING-MARGIN","","JIT-Mobile-022d-TEXT-Check-PADDING-MARGIN","[MOBILE-TEXT] As a user, I should check the PADDING & MARGIN infomation of Text is correct: Top, Bottom, Right, Left.","[MOBILE-TEXT] As a user, I should check the PADDING & MARGIN infomation of Text is correct: Top, Bottom, Right, Left.",""
"passed","Fri Jan 06 18:16:55 GMT 2023","Fri Jan 06 18:19:30 GMT 2023","154188","","JIT-Database-012c-RELATION-multiple-1-direction","","JIT-Database-012c-RELATION-multiple-1-direction","[RELATION], I should add multiple relation 1 direction","[RELATION], I should add multiple relation 1 direction",""
"passed","Fri Jan 06 18:20:29 GMT 2023","Fri Jan 06 18:23:05 GMT 2023","156126","","JIT-Mobile-002-SCREEN-Update","","JIT-Mobile-002-SCREEN-Update","[MOBILE-SCREEN] As a user, I can update screen with positive and negative cases","[MOBILE-SCREEN] As a user, I can update screen with positive and negative cases",""
"passed","Fri Jan 06 18:39:17 GMT 2023","Fri Jan 06 18:41:11 GMT 2023","114444","","JIT-Module-006a-SMS-default","","JIT-Module-006a-SMS-default","[SMS], I can add module SMS login with Twilio and remove it","[SMS], I can add module SMS login with Twilio and remove it",""
"passed","Fri Jan 06 18:24:07 GMT 2023","Fri Jan 06 18:26:14 GMT 2023","127230","","JIT-Mobile-014-JITDEF-status-bar","","JIT-Mobile-014-JITDEF-status-bar","[DEFECT] As a user, I should see screen will be removed in navigation tree after deleting screen","[DEFECT] As a user, I should see screen will be removed in navigation tree after deleting screen",""
"passed","Fri Jan 06 18:12:48 GMT 2023","Fri Jan 06 18:15:57 GMT 2023","188189","","JIT-Database-006-COLUMN-type-STRING","","JIT-Database-006-COLUMN-type-STRING","[COLUMN] As a user, I should check the validation of STRING column definition","[COLUMN] As a user, I should check the validation of STRING column definition",""
"passed","Fri Jan 06 18:31:35 GMT 2023","Fri Jan 06 18:33:05 GMT 2023","89528","","JIT-Mobile-032b-CAROUSEL-General-info","","JIT-Mobile-032b-CAROUSEL-General-info","[MOBILE-CAROUSEL] As a user, I should check the general infomation of Carousel is correct: Name, Key, unique key, delete component","[MOBILE-CAROUSEL] As a user, I should check the general infomation of Carousel is correct: Name, Key, unique key, delete component",""
"passed","Fri Jan 06 19:43:15 GMT 2023","Fri Jan 06 19:44:09 GMT 2023","54577","","JIT-Export-007-Existing-Scenario-ROR-withkey","","JIT-Export-007-Existing-Scenario-ROR-withkey","As a user, I check export the existing project type ROR with key successfully","As a user, I check export the existing project type ROR with key successfully",""
"passed","Fri Jan 06 19:38:09 GMT 2023","Fri Jan 06 19:39:58 GMT 2023","109402","","JIT-Export-005a-Scenario-RN-login-screen","","JIT-Export-005a-Scenario-RN-login-screen","[RN-Login-screen] As a user, I check export the project type React Native and Nextjs successfully with scenario 1","[RN-Login-screen] As a user, I check export the project type React Native and Nextjs successfully with scenario 1",""
"passed","Fri Jan 06 18:34:41 GMT 2023","Fri Jan 06 18:36:56 GMT 2023","135666","","JIT-Mobile-042a-ACTION-NAVIGATION-no-param","","JIT-Mobile-042a-ACTION-NAVIGATION-no-param","[MOBILE-ACTION-NAVIGATION] As a user, I could add action type navigation without params and check preview code","[MOBILE-ACTION-NAVIGATION] As a user, I could add action type navigation without params and check preview code",""
"passed","Fri Jan 06 18:43:56 GMT 2023","Fri Jan 06 18:44:50 GMT 2023","54000","","JIT-Module-015b-SCOUT-edit-infos","","JIT-Module-015b-SCOUT-edit-infos","[SCOUT] As a user, I can update module Scout","[SCOUT] As a user, I can update module Scout",""
"passed","Fri Jan 06 18:44:47 GMT 2023","Fri Jan 06 18:45:42 GMT 2023","55160","","JIT-Module-017a-GOOGLE-ANAL-default","","JIT-Module-017a-GOOGLE-ANAL-default","[GOOGLE-ANAL] As a user, I can add module Google Analytics and remove it","[GOOGLE-ANAL] As a user, I can add module Google Analytics and remove it",""
"passed","Fri Jan 06 18:20:21 GMT 2023","Fri Jan 06 18:22:02 GMT 2023","100195","","JIT-Mobile-001-SCREEN-Create-new","","JIT-Mobile-001-SCREEN-Create-new","[MOBILE-SCREEN] As a user, I can create new screen with positive and negative cases","[MOBILE-SCREEN] As a user, I can create new screen with positive and negative cases",""
"passed","Fri Jan 06 19:04:16 GMT 2023","Fri Jan 06 19:06:54 GMT 2023","158242","","JIT-Database-015b-INDEX-CRUD-single","","JIT-Database-015b-INDEX-CRUD-single","[INDEX] As a user, I check add and update multiple index","[INDEX] As a user, I check add and update multiple index",""
"passed","Fri Jan 06 18:43:02 GMT 2023","Fri Jan 06 18:44:09 GMT 2023","67423","","JIT-Module-015a-SCOUT-default","","JIT-Module-015a-SCOUT-default","[SCOUT] As a user, I can add module Scout and remove it","[SCOUT] As a user, I can add module Scout and remove it",""
"passed","Fri Jan 06 18:47:18 GMT 2023","Fri Jan 06 18:52:27 GMT 2023","309411","","JIT-Web-001e-PAGE-Search","","JIT-Web-001e-PAGE-Search","[WEB-PAGE] As a user, I can search correct screen with keyword","[WEB-PAGE] As a user, I can search correct screen with keyword",""
"passed","Fri Jan 06 18:26:05 GMT 2023","Fri Jan 06 18:28:23 GMT 2023","137570","","JIT-Mobile-022a-TEXT-General-info","","JIT-Mobile-022a-TEXT-General-info","[MOBILE-TEXT] As a user, I should check the general infomation of Text is correct: Name, Key, unique key, delete component","[MOBILE-TEXT] As a user, I should check the general infomation of Text is correct: Name, Key, unique key, delete component",""
"passed","Fri Jan 06 18:36:38 GMT 2023","Fri Jan 06 18:38:24 GMT 2023","105470","","JIT-Module-001b-CLOUDINARY-edit-infos","","JIT-Module-001b-CLOUDINARY-edit-infos","As a user, I can update module Cloudinary","As a user, I can update module Cloudinary",""
"broken","Fri Jan 06 19:58:03 GMT 2023","Fri Jan 06 20:13:17 GMT 2023","913854","","JIT-Export-010c-Export-NextJS-TODO","","JIT-Export-010c-Export-NextJS-TODO","[SMOKE] As a user, I check exprting project TODO with NextJS","[SMOKE] As a user, I check exprting project TODO with NextJS",""
"passed","Fri Jan 06 20:22:19 GMT 2023","Fri Jan 06 20:33:29 GMT 2023","670676","","JIT-Preview-001-Preview-[NEW]-NextJS-TODO","","JIT-Preview-001-Preview-[NEW]-NextJS-TODO","[PREVIEW-NEW] As a user, I check preview function for project TODO with NextJS","[PREVIEW-NEW] As a user, I check preview function for project TODO with NextJS",""
"passed","Fri Jan 06 19:04:59 GMT 2023","Fri Jan 06 19:07:38 GMT 2023","158322","","JIT-Database-015c-INDEX-CRUD-multiple","","JIT-Database-015c-INDEX-CRUD-multiple","[INDEX] As a user, I check add and update single index","[INDEX] As a user, I check add and update single index",""
"passed","Fri Jan 06 19:45:54 GMT 2023","Fri Jan 06 19:57:53 GMT 2023","718534","","JIT-Export-010b-Export-RN-TODO","","JIT-Export-010b-Export-RN-TODO","[SMOKE] As a user, I check exprting project TODO with React Native","[SMOKE] As a user, I check exprting project TODO with React Native",""
"passed","Fri Jan 06 19:31:37 GMT 2023","Fri Jan 06 19:33:39 GMT 2023","121559","","JIT-Mobile-043a-ACTION-AUTHENTICATION-PHONE-no-param","","JIT-Mobile-043a-ACTION-AUTHENTICATION-PHONE-no-param","[MOBILE-ACTION-AUTHENTICATION-PHONE] As a user, I could add action type authentication without params and check preview code","[MOBILE-ACTION-AUTHENTICATION-PHONE] As a user, I could add action type authentication without params and check preview code",""
"passed","Fri Jan 06 18:51:39 GMT 2023","Fri Jan 06 18:58:03 GMT 2023","383204","","JIT-Web-002d-MOLECULE-Duplicate","","JIT-Web-002d-MOLECULE-Duplicate","[WEB-MOLECULE] As a user, I can duplicate molecule with positive and negative cases","[WEB-MOLECULE] As a user, I can duplicate molecule with positive and negative cases",""
"passed","Fri Jan 06 18:10:41 GMT 2023","Fri Jan 06 18:12:09 GMT 2023","87877","","JIT-Database-001a-TABLE-new","","JIT-Database-001a-TABLE-new","[TABLE] As a user, I can create new table","[TABLE] As a user, I can create new table",""
"passed","Fri Jan 06 18:45:03 GMT 2023","Fri Jan 06 18:45:56 GMT 2023","52435","","JIT-Module-017b-GOOGLE-ANAL-edit-infos","","JIT-Module-017b-GOOGLE-ANAL-edit-infos","[GOOGLE-ANAL] As a user, I can update module Google Analytics","[GOOGLE-ANAL] As a user, I can update module Google Analytics",""
"passed","Fri Jan 06 18:54:52 GMT 2023","Fri Jan 06 18:57:18 GMT 2023","145847","","JIT-Web-009a-TABLE-Add-new","","JIT-Web-009a-TABLE-Add-new","[TABLE] As a user, I can create new Admin page","[TABLE] As a user, I can create new Admin page",""
"passed","Fri Jan 06 18:36:09 GMT 2023","Fri Jan 06 18:36:51 GMT 2023","41720","","JIT-Module-000-search","","JIT-Module-000-search","[SEARCH] As a user, I can Search module","[SEARCH] As a user, I can Search module",""
"passed","Fri Jan 06 18:29:44 GMT 2023","Fri Jan 06 18:31:33 GMT 2023","108813","","JIT-Mobile-030b-WEBVIEW-General-info","","JIT-Mobile-030b-WEBVIEW-General-info","[MOBILE-WEBVIEW] As a user, I should check the general infomation of Webview is correct: Name, Key, unique key, delete component","[MOBILE-WEBVIEW] As a user, I should check the general infomation of Webview is correct: Name, Key, unique key, delete component",""
"passed","Fri Jan 06 18:39:24 GMT 2023","Fri Jan 06 18:41:22 GMT 2023","117705","","JIT-Module-006b-SMS-edit-infos","","JIT-Module-006b-SMS-edit-infos","[SMS], I can add module SMS login with Twilio and edit its infos","[SMS], I can add module SMS login with Twilio and edit its infos",""
"passed","Fri Jan 06 19:01:19 GMT 2023","Fri Jan 06 19:02:02 GMT 2023","43600","","JIT-API-007a-GROUP-API-CRUD","","JIT-API-007a-GROUP-API-CRUD","[GROUP-API] Create, update and delete group API","[GROUP-API] Create, update and delete group API",""
"passed","Fri Jan 06 18:23:47 GMT 2023","Fri Jan 06 18:25:10 GMT 2023","82894","","JIT-Mobile-012-JITDEF-remove-poperty-info-after-deleting-navigation","","JIT-Mobile-012-JITDEF-remove-poperty-info-after-deleting-navigation","[DEFECT] As a user, I should see the property infos need to be removed after the navigation was deleted","[DEFECT] As a user, I should see the property infos need to be removed after the navigation was deleted",""
"passed","Fri Jan 06 19:30:47 GMT 2023","Fri Jan 06 19:31:27 GMT 2023","39197","","JIT-Mobile-021-DEFECT.Params.keep-params-after-refresh-page","","JIT-Mobile-021-DEFECT.Params.keep-params-after-refresh-page","[DEFECT] As a user, I should check the params will be kept after refresh page","[DEFECT] As a user, I should check the params will be kept after refresh page",""
"passed","Fri Jan 06 18:32:02 GMT 2023","Fri Jan 06 18:33:53 GMT 2023","110997","","JIT-Mobile-033b-HEADER-General-info","","JIT-Mobile-033b-HEADER-General-info","[MOBILE-HEADER] As a user, I should check the general infomation of Header is correct: Name, Key, unique key, delete component","[MOBILE-HEADER] As a user, I should check the general infomation of Header is correct: Name, Key, unique key, delete component",""
"passed","Fri Jan 06 19:33:59 GMT 2023","Fri Jan 06 19:35:11 GMT 2023","72168","","JIT-API-007bb-GET-list-API-Check-datetime-static-value","","JIT-API-007bb-GET-list-API-Check-datetime-static-value","[GET-list-API] Set datetime static value","[GET-list-API] Set datetime static value",""
"passed","Fri Jan 06 18:29:13 GMT 2023","Fri Jan 06 18:30:43 GMT 2023","89792","","JIT-Mobile-028b-ICON-General-info","","JIT-Mobile-028b-ICON-General-info","[MOBILE-ICON] As a user, I should check the general infomation of Icon is correct: Name, Key, unique key, delete component","[MOBILE-ICON] As a user, I should check the general infomation of Icon is correct: Name, Key, unique key, delete component",""
"passed","Fri Jan 06 18:32:52 GMT 2023","Fri Jan 06 18:34:21 GMT 2023","89328","","JIT-Mobile-035b-FLATLIST-General-info","","JIT-Mobile-035b-FLATLIST-General-info","[MOBILE-FLATLIST] As a user, I should check the general infomation of FlatList is correct: Name, Key, unique key, delete component","[MOBILE-FLATLIST] As a user, I should check the general infomation of FlatList is correct: Name, Key, unique key, delete component",""
"passed","Fri Jan 06 20:22:19 GMT 2023","Fri Jan 06 20:37:28 GMT 2023","909070","","JIT-Preview-002-Preview-[EMAIL-LOGIN]","","JIT-Preview-002-Preview-[EMAIL-LOGIN]","[PREVIEW-EMAIL-LOGIN] As a user, I check preview function for Email login module","[PREVIEW-EMAIL-LOGIN] As a user, I check preview function for Email login module",""
"passed","Fri Jan 06 18:21:27 GMT 2023","Fri Jan 06 18:23:15 GMT 2023","108187","","JIT-Mobile-005-MOLECULE-Create-new","","JIT-Mobile-005-MOLECULE-Create-new","[MOBILE-MOLECULE] As a user, I can create new molecule with positive and negative cases","[MOBILE-MOLECULE] As a user, I can create new molecule with positive and negative cases",""
"passed","Fri Jan 06 18:53:09 GMT 2023","Fri Jan 06 18:56:57 GMT 2023","228846","","JIT-Web-004a-ACTION-NAVIGATION-no-param","","JIT-Web-004a-ACTION-NAVIGATION-no-param","[WEB-ACTION-NAVIGATION] As a user, I could add action type navigation without params and check preview code","[WEB-ACTION-NAVIGATION] As a user, I could add action type navigation without params and check preview code",""
"passed","Fri Jan 06 18:42:52 GMT 2023","Fri Jan 06 18:43:52 GMT 2023","60486","","JIT-Module-013a-AWS-default","","JIT-Module-013a-AWS-default","[AWS] As a user, I can add module AWS SES Integration and remove it","[AWS] As a user, I can add module AWS SES Integration and remove it",""
"passed","Fri Jan 06 18:26:59 GMT 2023","Fri Jan 06 18:28:41 GMT 2023","102374","","JIT-Mobile-026b-BUTTON-General-info","","JIT-Mobile-026b-BUTTON-General-info","[MOBILE-BUTTON] As a user, I should check the general infomation of Button is correct: Name, Key, unique key, delete component","[MOBILE-BUTTON] As a user, I should check the general infomation of Button is correct: Name, Key, unique key, delete component",""
"passed","Fri Jan 06 18:15:32 GMT 2023","Fri Jan 06 18:17:02 GMT 2023","89730","","JIT-Database-011d-COLUMN-ENUM-delete-selected-items","","JIT-Database-011d-COLUMN-ENUM-delete-selected-items","[COLUMN] As a user, I should delete 1 selected item and check is will be removed in default dropdown","[COLUMN] As a user, I should delete 1 selected item and check is will be removed in default dropdown",""
"passed","Fri Jan 06 19:07:52 GMT 2023","Fri Jan 06 19:09:23 GMT 2023","90231","","JIT-Database-015h-INDEX-DATE-column-config","","JIT-Database-015h-INDEX-DATE-column-config","[INDEX-DATE] As a user, I config index from column setting && check on index popup","[INDEX-DATE] As a user, I config index from column setting && check on index popup",""
"passed","Fri Jan 06 19:03:41 GMT 2023","Fri Jan 06 19:06:15 GMT 2023","154083","","JIT-API-009-Auto-fill","","JIT-API-009-Auto-fill","[AUTO-FILL] As a user, I could add request param by Auto-fill","[AUTO-FILL] As a user, I could add request param by Auto-fill",""
"passed","Fri Jan 06 18:39:31 GMT 2023","Fri Jan 06 18:41:59 GMT 2023","147440","","JIT-Module-008a-FB-LOGIN-default-edit","","JIT-Module-008a-FB-LOGIN-default-edit","[FACEBOOK-LOGIN], I can add module Facebook Login and edit its infos","[FACEBOOK-LOGIN], I can add module Facebook Login and edit its infos",""
"passed","Fri Jan 06 18:15:49 GMT 2023","Fri Jan 06 18:17:10 GMT 2023","80764","","JIT-Database-011e-COLUMN-ENUM-delete-all","","JIT-Database-011e-COLUMN-ENUM-delete-all","[COLUMN] As a user, I should delete all items and check all items are not displayed","[COLUMN] As a user, I should delete all items and check all items are not displayed",""
"passed","Fri Jan 06 18:12:31 GMT 2023","Fri Jan 06 18:15:46 GMT 2023","195035","","JIT-Database-004-COLUMN-type-INTEGER","","JIT-Database-004-COLUMN-type-INTEGER","[COLUMN] As a user, I should check the validation of INTEGER column definition","[COLUMN] As a user, I should check the validation of INTEGER column definition",""
"passed","Fri Jan 06 18:35:56 GMT 2023","Fri Jan 06 18:37:58 GMT 2023","121398","","JIT-Mobile-045a-LAYER-TREE-Check-edit-and-action","","JIT-Mobile-045a-LAYER-TREE-Check-edit-and-action","[MOBILE-LAYER-TREE] As a user, I could update the name of the node in the layer tree and copy,paste,delete,wrap the node","[MOBILE-LAYER-TREE] As a user, I could update the name of the node in the layer tree and copy,paste,delete,wrap the node",""
"passed","Fri Jan 06 19:08:43 GMT 2023","Fri Jan 06 19:09:53 GMT 2023","70073","","JIT-Database-015k-INDEX-BOOLEAN-column-config","","JIT-Database-015k-INDEX-BOOLEAN-column-config","[INDEX-BOOLEAN] As a user, I config index from column setting && check on index popup","[INDEX-BOOLEAN] As a user, I config index from column setting && check on index popup",""
"passed","Fri Jan 06 18:37:22 GMT 2023","Fri Jan 06 18:38:22 GMT 2023","60130","","JIT-Module-002a-DEEPLINK-default","","JIT-Module-002a-DEEPLINK-default","As a user, I can add module Deeplink and remove it","As a user, I can add module Deeplink and remove it",""
"passed","Fri Jan 06 18:19:06 GMT 2023","Fri Jan 06 18:20:55 GMT 2023","109734","","JIT-Database-016b-COUNTER-CACHE-Create-by-adding-column","","JIT-Database-016b-COUNTER-CACHE-Create-by-adding-column","[COUNTER-CACHE] create new counter cache column by adding column","[COUNTER-CACHE] create new counter cache column by adding column",""
"passed","Fri Jan 06 18:58:53 GMT 2023","Fri Jan 06 19:00:03 GMT 2023","69769","","JIT-API-001-Check-general-info","","JIT-API-001-Check-general-info","As a user, I check general info","As a user, I check general info",""
"passed","Fri Jan 06 18:18:12 GMT 2023","Fri Jan 06 18:19:33 GMT 2023","80804","","JIT-Database-015a-INDEX-Check-duplicate-empty","","JIT-Database-015a-INDEX-Check-duplicate-empty","[INDEX] As a user, I check empty and duplicate index","[INDEX] As a user, I check empty and duplicate index",""
"passed","Fri Jan 06 19:01:20 GMT 2023","Fri Jan 06 19:03:16 GMT 2023","115873","","JIT-API-007ba-GET-list-API-Add-new-endpoint","","JIT-API-007ba-GET-list-API-Add-new-endpoint","[GET-list-API] Create, update and delete new GET API endpoint","[GET-list-API] Create, update and delete new GET API endpoint",""
"passed","Fri Jan 06 18:46:16 GMT 2023","Fri Jan 06 18:47:56 GMT 2023","100537","","JIT-Team-005-Invite-duplicate-email","","JIT-Team-005-Invite-duplicate-email","[INVITE-DELETE] Invite new email and invite again","[INVITE-DELETE] Invite new email and invite again",""
"passed","Fri Jan 06 18:34:18 GMT 2023","Fri Jan 06 18:38:28 GMT 2023","249401","","JIT-Mobile-041b-PREVIEW-NAVIGATION-with-navigation-setup","","JIT-Mobile-041b-PREVIEW-NAVIGATION-with-navigation-setup","[MOBILE-PREVIEW-NAVIGATION] As a user, I could open preview screen with setting the screen navigation","[MOBILE-PREVIEW-NAVIGATION] As a user, I could open preview screen with setting the screen navigation",""
"passed","Fri Jan 06 18:31:15 GMT 2023","Fri Jan 06 18:32:45 GMT 2023","89589","","JIT-Mobile-031b-DIVIDER-General-info","","JIT-Mobile-031b-DIVIDER-General-info","[MOBILE-DIVIDER] As a user, I should check the general infomation of Divider is correct: Name, Key, unique key, delete component","[MOBILE-DIVIDER] As a user, I should check the general infomation of Divider is correct: Name, Key, unique key, delete component",""
"passed","Fri Jan 06 19:08:08 GMT 2023","Fri Jan 06 19:09:36 GMT 2023","88096","","JIT-Database-015i-INDEX-DATETIME-column-config","","JIT-Database-015i-INDEX-DATETIME-column-config","[INDEX-DATETIME] As a user, I config index from column setting && check on index popup","[INDEX-DATETIME] As a user, I config index from column setting && check on index popup",""
"passed","Fri Jan 06 19:08:53 GMT 2023","Fri Jan 06 19:10:23 GMT 2023","89271","","JIT-Database-015l-INDEX-ENUM-column-config","","JIT-Database-015l-INDEX-ENUM-column-config","[INDEX-ENUM] As a user, I config index from column setting && check on index popup","[INDEX-ENUM] As a user, I config index from column setting && check on index popup",""
"passed","Fri Jan 06 18:12:54 GMT 2023","Fri Jan 06 18:14:26 GMT 2023","92040","","JIT-Database-008-COLUMN-type-DATE-TIME","","JIT-Database-008-COLUMN-type-DATE-TIME","[COLUMN] As a user, I should check the validation of DATETIME column definition","[COLUMN] As a user, I should check the validation of DATETIME column definition",""
"passed","Fri Jan 06 18:18:03 GMT 2023","Fri Jan 06 18:19:29 GMT 2023","85938","","JIT-Database-014-DEFECT-Check-duplicate-table-name","","JIT-Database-014-DEFECT-Check-duplicate-table-name","[DEFECT] As a user, I cannot update to duplicate name","[DEFECT] As a user, I cannot update to duplicate name",""
"passed","Fri Jan 06 18:54:40 GMT 2023","Fri Jan 06 18:58:21 GMT 2023","220948","","JIT-Web-007b-ASSET-Rename-and-delete","","JIT-Web-007b-ASSET-Rename-and-delete","[ASSET] As a user, I can rename and delete image asset","[ASSET] As a user, I can rename and delete image asset",""
"passed","Fri Jan 06 19:42:07 GMT 2023","Fri Jan 06 19:43:08 GMT 2023","61423","","JIT-Export-006-Existing-Scenario-ROR-nokey","","JIT-Export-006-Existing-Scenario-ROR-nokey","As a user, I check export the existing project type ROR no key successfully","As a user, I check export the existing project type ROR no key successfully",""
"passed","Fri Jan 06 19:38:16 GMT 2023","Fri Jan 06 19:41:01 GMT 2023","164736","","JIT-Export-001-Scenario_ROR_1","","JIT-Export-001-Scenario_ROR_1","As a user, I check export the project type ROR no key successfully with scenario 1","As a user, I check export the project type ROR no key successfully with scenario 1",""
"passed","Fri Jan 06 19:41:10 GMT 2023","Fri Jan 06 19:44:01 GMT 2023","170958","","JIT-Export-004-Scenario_ROR_2","","JIT-Export-004-Scenario_ROR_2","As a user, I check export the project type ROR with key successfully with scenario 2","As a user, I check export the project type ROR with key successfully with scenario 2",""
