"Status","Start Time","Stop Time","Duration in ms","Parent Suite","Suite","Sub Suite","Test Class","Test Method","Name","Description"
"passed","Fri Jan 06 18:10:40 GMT 2023","Fri Jan 06 18:12:01 GMT 2023","80407","","JIT-Database-001e-TABLE-create-by-context-menu","","JIT-Database-001e-TABLE-create-by-context-menu","[TABLE] As a user, I can create new table by context menu","[TABLE] As a user, I can create new table by context menu",""
"passed","Fri Jan 06 18:27:38 GMT 2023","Fri Jan 06 18:30:11 GMT 2023","153743","","JIT-Mobile-028a-ICON-Check-PreviewCode","","JIT-Mobile-028a-ICON-Check-PreviewCode","[MOBILE-ICON] As a user, I should check the Preview code of Icon component","[MOBILE-ICON] As a user, I should check the Preview code of Icon component",""
"passed","Fri Jan 06 18:17:01 GMT 2023","Fri Jan 06 18:19:35 GMT 2023","153639","","JIT-Database-012d-RELATION-multiple-2-direction","","JIT-Database-012d-RELATION-multiple-2-direction","[RELATION], I should add multiple relation 2 directions","[RELATION], I should add multiple relation 2 directions",""
"passed","Fri Jan 06 19:29:03 GMT 2023","Fri Jan 06 19:31:15 GMT 2023","131873","","JIT-Database-007-COLUMN-type-TEXT","","JIT-Database-007-COLUMN-type-TEXT","[COLUMN] As a user, I should check the validation of TEXT column definition","[COLUMN] As a user, I should check the validation of TEXT column definition",""
"passed","Fri Jan 06 18:46:34 GMT 2023","Fri Jan 06 18:48:58 GMT 2023","143541","","JIT-Web-001c-PAGE-Delete","","JIT-Web-001c-PAGE-Delete","[PAGE] As a user, I can delete page","[PAGE] As a user, I can delete page",""
"passed","Fri Jan 06 18:16:39 GMT 2023","Fri Jan 06 18:18:08 GMT 2023","89050","","JIT-Database-012a-RELATION-basic","","JIT-Database-012a-RELATION-basic","[RELATION] check the basic relation","[RELATION] check the basic relation",""
"passed","Fri Jan 06 18:51:58 GMT 2023","Fri Jan 06 18:55:24 GMT 2023","205722","","JIT-Web-002e-MOLECULE-Search","","JIT-Web-002e-MOLECULE-Search","[WEB-PAGE] As a user, I can search correct molecule with keyword","[WEB-PAGE] As a user, I can search correct molecule with keyword",""
"passed","Fri Jan 06 18:42:57 GMT 2023","Fri Jan 06 18:44:11 GMT 2023","74075","","JIT-Module-014a-BASIC-AUTH-default","","JIT-Module-014a-BASIC-AUTH-default","[BASIC-AUTH] As a user, I can add module Basic Authentication and remove it","[BASIC-AUTH] As a user, I can add module Basic Authentication and remove it",""
"passed","Fri Jan 06 18:40:49 GMT 2023","Fri Jan 06 18:43:12 GMT 2023","143542","","JIT-Module-010a-LINE-LOGIN-default-edit","","JIT-Module-010a-LINE-LOGIN-default-edit","[LINE-LOGIN], I can add module Line Login and edit its infos","[LINE-LOGIN], I can add module Line Login and edit its infos",""
"passed","Fri Jan 06 18:46:27 GMT 2023","Fri Jan 06 18:50:58 GMT 2023","270359","","JIT-Web-001a-PAGE-Create-new","","JIT-Web-001a-PAGE-Create-new","[PAGE] As a user, I can create new screen with positive and negative cases","[PAGE] As a user, I can create new screen with positive and negative cases",""
"passed","Fri Jan 06 18:17:32 GMT 2023","Fri Jan 06 18:22:20 GMT 2023","287780","","JIT-Database-012e-RELATION-trigger-by-button","","JIT-Database-012e-RELATION-trigger-by-button","[RELATION] check the basic relation","[RELATION] check the basic relation",""
"passed","Fri Jan 06 18:12:55 GMT 2023","Fri Jan 06 18:14:33 GMT 2023","98182","","JIT-Database-009-COLUMN-type-BOOLEAN","","JIT-Database-009-COLUMN-type-BOOLEAN","[COLUMN] As a user, I should check the validation of BOOLEAN column definition","[COLUMN] As a user, I should check the validation of BOOLEAN column definition",""
"passed","Fri Jan 06 18:39:26 GMT 2023","Fri Jan 06 18:41:54 GMT 2023","147542","","JIT-Module-007a-APPLE-LOGIN-default-edit","","JIT-Module-007a-APPLE-LOGIN-default-edit","[APPLE-LOGIN], I can add module Apple Login and edit its infos","[APPLE-LOGIN], I can add module Apple Login and edit its infos",""
"passed","Fri Jan 06 18:10:43 GMT 2023","Fri Jan 06 18:12:05 GMT 2023","82050","","JIT-Database-001c-TABLE-duplicate","","JIT-Database-001c-TABLE-duplicate","[TABLE] As a user, I cannot create table with duplicate name","[TABLE] As a user, I cannot create table with duplicate name",""
"passed","Fri Jan 06 18:20:25 GMT 2023","Fri Jan 06 18:22:47 GMT 2023","142215","","JIT-Mobile-001a-SCREEN-Search","","JIT-Mobile-001a-SCREEN-Search","[MOBILE-SCREEN] As a user, I can search correct screen with keyword","[MOBILE-SCREEN] As a user, I can search correct screen with keyword",""
"passed","Fri Jan 06 18:32:28 GMT 2023","Fri Jan 06 18:33:57 GMT 2023","89424","","JIT-Mobile-034b-SCROLLVIEW-General-info","","JIT-Mobile-034b-SCROLLVIEW-General-info","[MOBILE-SCROLLVIEW] As a user, I should check the general infomation of Scroll View is correct: Name, Key, unique key, delete component","[MOBILE-SCROLLVIEW] As a user, I should check the general infomation of Scroll View is correct: Name, Key, unique key, delete component",""
"passed","Fri Jan 06 18:15:22 GMT 2023","Fri Jan 06 18:16:40 GMT 2023","78135","","JIT-Database-011b-COLUMN-ENUM-add-items","","JIT-Database-011b-COLUMN-ENUM-add-items","[COLUMN] As a user, I should add new item and select in default dropdown","[COLUMN] As a user, I should add new item and select in default dropdown",""
"passed","Fri Jan 06 18:41:11 GMT 2023","Fri Jan 06 18:43:00 GMT 2023","109072","","JIT-Module-011a-GUEST-LOGIN-default-edit","","JIT-Module-011a-GUEST-LOGIN-default-edit","[GUEST-LOGIN], I can add module Guest Login and edit its infos","[GUEST-LOGIN], I can add module Guest Login and edit its infos",""
"passed","Fri Jan 06 20:33:36 GMT 2023","Fri Jan 06 20:44:06 GMT 2023","630003","","JIT-Preview-003-Preview-[REACT-NATIVE]","","JIT-Preview-003-Preview-[REACT-NATIVE]","[PREVIEW-REACT-NATIVE] As a user, I check preview function for React Native","[PREVIEW-REACT-NATIVE] As a user, I check preview function for React Native",""
"passed","Fri Jan 06 18:37:55 GMT 2023","Fri Jan 06 18:39:44 GMT 2023","108754","","JIT-Module-002b-DEEPLINK-edit-infos","","JIT-Module-002b-DEEPLINK-edit-infos","As a user, I can update module Deeplink","As a user, I can update module Deeplink",""
"passed","Fri Jan 06 19:09:36 GMT 2023","Fri Jan 06 19:11:24 GMT 2023","107257","","JIT-Database-015m-INDEX-ALL-column-config","","JIT-Database-015m-INDEX-ALL-column-config","[INDEX-ALL] As a user, I config with multiple column and check show multiple on index pop-up","[INDEX-ALL] As a user, I config with multiple column and check show multiple on index pop-up",""
"passed","Fri Jan 06 19:03:22 GMT 2023","Fri Jan 06 19:04:43 GMT 2023","81650","","JIT-API-007f-DELETE-API-Add-new-endpoint","","JIT-API-007f-DELETE-API-Add-new-endpoint","[DELETE-API] Create, update and delete new DELETE API endpoint","[DELETE-API] Create, update and delete new DELETE API endpoint",""
"passed","Fri Jan 06 18:54:51 GMT 2023","Fri Jan 06 18:57:40 GMT 2023","169260","","JIT-Web-008a-ADMIN-PAGE-Create-new","","JIT-Web-008a-ADMIN-PAGE-Create-new","[ADMIN-PAGE] As a user, I can create new Admin page","[ADMIN-PAGE] As a user, I can create new Admin page",""
"passed","Fri Jan 06 19:38:13 GMT 2023","Fri Jan 06 19:41:02 GMT 2023","168616","","JIT-Export-003-Scenario_ROR_2","","JIT-Export-003-Scenario_ROR_2","As a user, I check export the project type ROR no key successfully with scenario 2","As a user, I check export the project type ROR no key successfully with scenario 2",""
"passed","Fri Jan 06 18:26:13 GMT 2023","Fri Jan 06 18:33:18 GMT 2023","425178","","JIT-Mobile-022b-TEXT-Check-TEXT","","JIT-Mobile-022b-TEXT-Check-TEXT","[MOBILE-TEXT] As a user, I should check the TEXT infomation of Text is correct: Text content, Font, Size, Font weight, Line Height, Spacing, Color, Italic, Underline","[MOBILE-TEXT] As a user, I should check the TEXT infomation of Text is correct: Text content, Font, Size, Font weight, Line Height, Spacing, Color, Italic, Underline",""
"passed","Fri Jan 06 18:58:53 GMT 2023","Fri Jan 06 19:00:46 GMT 2023","113502","","JIT-API-002a-GET-list-check-default","","JIT-API-002a-GET-list-check-default","As a user, I check default value in API GET list","As a user, I check default value in API GET list",""
"passed","Fri Jan 06 19:44:37 GMT 2023","Fri Jan 06 19:45:45 GMT 2023","67589","","JIT-Export-010a-Export-RoR-TODO","","JIT-Export-010a-Export-RoR-TODO","[SMOKE] As a user, I check exprting project TODO with RoR","[SMOKE] As a user, I check exprting project TODO with RoR",""
"passed","Fri Jan 06 18:11:04 GMT 2023","Fri Jan 06 18:12:18 GMT 2023","74099","","JIT-Database-003b-COLUMN-duplicated","","JIT-Database-003b-COLUMN-duplicated","[COLUMN] As a user, I cannot add duplicated column definition","[COLUMN] As a user, I cannot add duplicated column definition",""
"passed","Fri Jan 06 18:23:08 GMT 2023","Fri Jan 06 18:32:55 GMT 2023","587287","","JIT-Mobile-009-SEARCH-Components","","JIT-Mobile-009-SEARCH-Components","[MOBILE-SEARCH] As a user, I search component and drag them to preview screen","[MOBILE-SEARCH] As a user, I search component and drag them to preview screen",""
"passed","Fri Jan 06 18:14:22 GMT 2023","Fri Jan 06 18:15:39 GMT 2023","76857","","JIT-Database-011a-COLUMN-ENUM-default","","JIT-Database-011a-COLUMN-ENUM-default","[COLUMN] As a user, I should check the basic validation","[COLUMN] As a user, I should check the basic validation",""
"passed","Fri Jan 06 19:01:33 GMT 2023","Fri Jan 06 19:03:02 GMT 2023","88136","","JIT-API-007c-GET-detail-API-Add-new-endpoint","","JIT-API-007c-GET-detail-API-Add-new-endpoint","[GET-detail-API] Create, update and delete new GET API endpoint","[GET-detail-API] Create, update and delete new GET API endpoint",""
"passed","Fri Jan 06 18:10:40 GMT 2023","Fri Jan 06 18:11:51 GMT 2023","71306","","JIT-Database-002-COLUMN-default","","JIT-Database-002-COLUMN-default","[COLUMN] As a user, I should see the default column definition","[COLUMN] As a user, I should see the default column definition",""
"passed","Fri Jan 06 18:23:31 GMT 2023","Fri Jan 06 18:24:44 GMT 2023","72953","","JIT-Mobile-011-JITDEF50-disable-add-duplicate-screen-in-stack","","JIT-Mobile-011-JITDEF50-disable-add-duplicate-screen-in-stack","[DEFECT] As a user, I could add duplicate screen in stack","[DEFECT] As a user, I could add duplicate screen in stack",""
"passed","Fri Jan 06 19:06:55 GMT 2023","Fri Jan 06 19:08:27 GMT 2023","91502","","JIT-Database-015f-INDEX-INTEGER-column-config","","JIT-Database-015f-INDEX-INTEGER-column-config","[INDEX-INTEGER] As a user, I config index from column setting && check on index popup","[INDEX-INTEGER] As a user, I config index from column setting && check on index popup",""
"passed","Fri Jan 06 18:30:07 GMT 2023","Fri Jan 06 18:32:55 GMT 2023","168004","","JIT-Mobile-031a-DIVIDER-Check-PreviewCode","","JIT-Mobile-031a-DIVIDER-Check-PreviewCode","[MOBILE-DIVIDER] As a user, I should check the Preview code of Divider component","[MOBILE-DIVIDER] As a user, I should check the Preview code of Divider component",""
"passed","Fri Jan 06 18:11:04 GMT 2023","Fri Jan 06 18:12:06 GMT 2023","61615","","JIT-Database-003a-COLUMN-empty","","JIT-Database-003a-COLUMN-empty","[COLUMN] As a user, I cannot add empty column definition","[COLUMN] As a user, I cannot add empty column definition",""
"passed","Fri Jan 06 20:37:35 GMT 2023","Fri Jan 06 20:48:30 GMT 2023","655766","","JIT-Preview-004-Preview-[BUTTON]","","JIT-Preview-004-Preview-[BUTTON]","[PREVIEW-BUTTON] As a user, I check preview function for Button component","[PREVIEW-BUTTON] As a user, I check preview function for Button component",""
"passed","Fri Jan 06 18:59:01 GMT 2023","Fri Jan 06 19:00:22 GMT 2023","80511","","JIT-API-002c-GET-list","","JIT-API-002c-GET-list","As a user, I check column display when having relation for GET-list","As a user, I check column display when having relation for GET-list",""
"passed","Fri Jan 06 18:33:43 GMT 2023","Fri Jan 06 18:35:43 GMT 2023","119720","","JIT-Mobile-036a-DATETIMEPICKER-Check-PreviewCode","","JIT-Mobile-036a-DATETIMEPICKER-Check-PreviewCode","[MOBILE-DATETIMEPICKER] As a user, I should check the Preview code of DatetimePicker component","[MOBILE-DATETIMEPICKER] As a user, I should check the Preview code of DatetimePicker component",""
"passed","Fri Jan 06 18:13:13 GMT 2023","Fri Jan 06 18:15:43 GMT 2023","150188","","JIT-Database-010b-COLUMN-FILE-format-file","","JIT-Database-010b-COLUMN-FILE-format-file","[COLUMN] As a user, I should check the validation of FILE column definition for Format Area","[COLUMN] As a user, I should check the validation of FILE column definition for Format Area",""
"passed","Fri Jan 06 19:29:51 GMT 2023","Fri Jan 06 19:30:37 GMT 2023","45704","","JIT-Web-010a-LAYER-TREE-Check-edit-and-action","","JIT-Web-010a-LAYER-TREE-Check-edit-and-action","[LAYER-TREE] As a user, I could update the name of the node in the layer tree and copy,paste,delete,wrap the node","[LAYER-TREE] As a user, I could update the name of the node in the layer tree and copy,paste,delete,wrap the node",""
"passed","Fri Jan 06 18:12:37 GMT 2023","Fri Jan 06 18:14:57 GMT 2023","139275","","JIT-Database-005-COLUMN-type-FLOAT","","JIT-Database-005-COLUMN-type-FLOAT","[COLUMN] As a user, I should check the validation of FLOAT column definition","[COLUMN] As a user, I should check the validation of FLOAT column definition",""
"passed","Fri Jan 06 18:13:00 GMT 2023","Fri Jan 06 18:14:33 GMT 2023","93271","","JIT-Database-010a-COLUMN-FILE-validation","","JIT-Database-010a-COLUMN-FILE-validation","[COLUMN] As a user, I should check the validation of FILE column definition","[COLUMN] As a user, I should check the validation of FILE column definition",""
"passed","Fri Jan 06 18:16:31 GMT 2023","Fri Jan 06 18:17:44 GMT 2023","73393","","JIT-Database-011f-COLUMN-ENUM-duplicated","","JIT-Database-011f-COLUMN-ENUM-duplicated","[COLUMN] As a user, I should check counld not add duplicated item","[COLUMN] As a user, I should check counld not add duplicated item",""
"passed","Fri Jan 06 19:03:21 GMT 2023","Fri Jan 06 19:05:01 GMT 2023","99143","","JIT-API-007e-PUT-API-Add-new-endpoint","","JIT-API-007e-PUT-API-Add-new-endpoint","[PUT-API] Create, update and delete new PUT API endpoint","[PUT-API] Create, update and delete new PUT API endpoint",""
"passed","Fri Jan 06 18:22:28 GMT 2023","Fri Jan 06 18:23:37 GMT 2023","68241","","JIT-Mobile-007-MOLECULE-Delete","","JIT-Mobile-007-MOLECULE-Delete","[MOBILE-MOLECULE] As a user, I can delete molecule","[MOBILE-MOLECULE] As a user, I can delete molecule",""
"passed","Fri Jan 06 18:58:53 GMT 2023","Fri Jan 06 19:01:14 GMT 2023","140286","","JIT-API-002b-GET-list-update-info","","JIT-API-002b-GET-list-update-info","As a user, I update info for GET-list","As a user, I update info for GET-list",""
"passed","Fri Jan 06 18:45:28 GMT 2023","Fri Jan 06 18:46:24 GMT 2023","55502","","JIT-Module-019b-GOOGLE-ANALYTICS-edit-infos","","JIT-Module-019b-GOOGLE-ANALYTICS-edit-infos","[GOOGLE-ANALYTICS] As a user, I can update module Google Analytics information for each environment","[GOOGLE-ANALYTICS] As a user, I can update module Google Analytics information for each environment",""
"passed","Fri Jan 06 18:18:02 GMT 2023","Fri Jan 06 18:20:04 GMT 2023","122088","","JIT-Database-013-DEFECT-Check-default-value-when-changing-type","","JIT-Database-013-DEFECT-Check-default-value-when-changing-type","[DEFECT] As a user, I should check the default value when changing the type","[DEFECT] As a user, I should check the default value when changing the type",""
"passed","Fri Jan 06 18:18:43 GMT 2023","Fri Jan 06 18:20:28 GMT 2023","104661","","JIT-Database-016a-COUNTER-CACHE-Create-by-relation","","JIT-Database-016a-COUNTER-CACHE-Create-by-relation","[COUNTER-CACHE] create new counter cache column by selecting in relation popup","[COUNTER-CACHE] create new counter cache column by selecting in relation popup",""
"passed","Fri Jan 06 18:38:25 GMT 2023","Fri Jan 06 18:39:43 GMT 2023","78050","","JIT-Module-004a-EMAIL-LOGIN-default","","JIT-Module-004a-EMAIL-LOGIN-default","[EMAIL-LOGIN] - Check adding and auto-generated API","[EMAIL-LOGIN] - Check adding and auto-generated API",""
"passed","Fri Jan 06 19:07:08 GMT 2023","Fri Jan 06 19:08:35 GMT 2023","87080","","JIT-Database-015g-INDEX-FLOAT-column-config","","JIT-Database-015g-INDEX-FLOAT-column-config","[INDEX-FLOAT] As a user, I config index from column setting && check on index popup","[INDEX-FLOAT] As a user, I config index from column setting && check on index popup",""
"passed","Fri Jan 06 18:20:52 GMT 2023","Fri Jan 06 18:22:04 GMT 2023","72172","","JIT-Mobile-003-SCREEN-Delete","","JIT-Mobile-003-SCREEN-Delete","[MOBILE-SCREEN] As a user, I can delete screen","[MOBILE-SCREEN] As a user, I can delete screen",""
"passed","Fri Jan 06 18:50:23 GMT 2023","Fri Jan 06 18:52:32 GMT 2023","129078","","JIT-Web-002c-MOLECULE-Delete","","JIT-Web-002c-MOLECULE-Delete","[WEB-MOLECULE] As a user, I can delete molecule","[WEB-MOLECULE] As a user, I can delete molecule",""
"passed","Fri Jan 06 18:34:17 GMT 2023","Fri Jan 06 18:35:32 GMT 2023","74699","","JIT-Mobile-041a-PREVIEW-NAVIGATION-no-navigation-setup","","JIT-Mobile-041a-PREVIEW-NAVIGATION-no-navigation-setup","[MOBILE-PREVIEW-NAVIGATION] As a user, I could open preview screen with notification should setup the screen navigation","[MOBILE-PREVIEW-NAVIGATION] As a user, I could open preview screen with notification should setup the screen navigation",""
"passed","Fri Jan 06 19:41:11 GMT 2023","Fri Jan 06 19:43:56 GMT 2023","164699","","JIT-Export-002-Scenario-ROR-withkey-1","","JIT-Export-002-Scenario-ROR-withkey-1","As a user, I check export the project type ROR with key successfully with scenario 1","As a user, I check export the project type ROR with key successfully with scenario 1",""
"passed","Fri Jan 06 18:15:31 GMT 2023","Fri Jan 06 18:17:02 GMT 2023","90518","","JIT-Database-011c-COLUMN-ENUM-delete-items","","JIT-Database-011c-COLUMN-ENUM-delete-items","[COLUMN] As a user, I should delete 1 item and check not display in default dropdown","[COLUMN] As a user, I should delete 1 item and check not display in default dropdown",""
"passed","Fri Jan 06 18:52:22 GMT 2023","Fri Jan 06 18:53:54 GMT 2023","92407","","JIT-Web-003a-PREVIEW-NAVIGATION-no-navigation-setup","","JIT-Web-003a-PREVIEW-NAVIGATION-no-navigation-setup","[WEB-PREVIEW-NAVIGATION] As a user, I could open preview screen with default page","[WEB-PREVIEW-NAVIGATION] As a user, I could open preview screen with default page",""
"passed","Fri Jan 06 18:49:25 GMT 2023","Fri Jan 06 18:53:17 GMT 2023","231294","","JIT-Web-002b-MOLECULE-Update","","JIT-Web-002b-MOLECULE-Update","[WEB-MOLECULE] As a user, I can update molecule with positive and negative cases","[WEB-MOLECULE] As a user, I can update molecule with positive and negative cases",""
"passed","Fri Jan 06 18:23:50 GMT 2023","Fri Jan 06 18:25:38 GMT 2023","108462","","JIT-Mobile-013-JITDEF-reflect-delete-screen-innavigation-tree","","JIT-Mobile-013-JITDEF-reflect-delete-screen-innavigation-tree","[DEFECT] As a user, I should see screen will be removed in navigation tree after deleting screen","[DEFECT] As a user, I should see screen will be removed in navigation tree after deleting screen",""
"passed","Fri Jan 06 19:06:26 GMT 2023","Fri Jan 06 19:07:53 GMT 2023","87049","","JIT-Database-015e-INDEX-TEXT-column-config","","JIT-Database-015e-INDEX-TEXT-column-config","[INDEX-TEXT] As a user, I config index from column setting && check on index popup","[INDEX-TEXT] As a user, I config index from column setting && check on index popup",""
"passed","Fri Jan 06 18:10:40 GMT 2023","Fri Jan 06 18:11:43 GMT 2023","62360","","JIT-Database-001b-TABLE-empty","","JIT-Database-001b-TABLE-empty","[TABLE] As a user, I cannot create table with empty name","[TABLE] As a user, I cannot create table with empty name",""
"passed","Fri Jan 06 18:10:41 GMT 2023","Fri Jan 06 18:12:04 GMT 2023","82910","","JIT-Database-001d-TABLE-update","","JIT-Database-001d-TABLE-update","[TABLE] As a user, I can update the value of the table","[TABLE] As a user, I can update the value of the table",""
"passed","Fri Jan 06 18:48:08 GMT 2023","Fri Jan 06 18:50:42 GMT 2023","154442","","JIT-Web-002a-MOLECULE-Create-new","","JIT-Web-002a-MOLECULE-Create-new","[WEB-MOLECULE] As a user, I can create new molecule with positive and negative cases","[WEB-MOLECULE] As a user, I can create new molecule with positive and negative cases",""
"passed","Fri Jan 06 18:40:47 GMT 2023","Fri Jan 06 18:43:11 GMT 2023","143911","","JIT-Module-009a-GOOGLE-LOGIN-default-edit","","JIT-Module-009a-GOOGLE-LOGIN-default-edit","[GOOGLE-LOGIN], I can add module Google Login and edit its infos","[GOOGLE-LOGIN], I can add module Google Login and edit its infos",""
"passed","Fri Jan 06 19:29:03 GMT 2023","Fri Jan 06 19:29:41 GMT 2023","38754","","JIT-Module-016a-SENDGRID-default","","JIT-Module-016a-SENDGRID-default","[SENDGRID] As a user, I can add module SendGrid and remove it","[SENDGRID] As a user, I can add module SendGrid and remove it",""
"passed","Fri Jan 06 18:54:34 GMT 2023","Fri Jan 06 18:58:13 GMT 2023","218654","","JIT-Web-007a-ASSET-Upload","","JIT-Web-007a-ASSET-Upload","[ASSET] As a user, I can upload new image and store in Asset Manager and use it in all Image component","[ASSET] As a user, I can upload new image and store in Asset Manager and use it in all Image component",""
"passed","Fri Jan 06 18:38:55 GMT 2023","Fri Jan 06 18:41:36 GMT 2023","161017","","JIT-Module-005b-FORCE-MOBILE-UPDATE-api","","JIT-Module-005b-FORCE-MOBILE-UPDATE-api","[FORCE-MOBILE-UPDATE] - Check api","[FORCE-MOBILE-UPDATE] - Check api",""
"passed","Fri Jan 06 18:45:28 GMT 2023","Fri Jan 06 18:46:28 GMT 2023","60301","","JIT-Module-019a-GOOGLE-ANALYTICS-default","","JIT-Module-019a-GOOGLE-ANALYTICS-default","[GOOGLE-ANALYTICS] As a user, I can add module Google Analytics and remove it","[GOOGLE-ANALYTICS] As a user, I can add module Google Analytics and remove it",""
"passed","Fri Jan 06 18:42:52 GMT 2023","Fri Jan 06 18:44:12 GMT 2023","79981","","JIT-Module-013b-AWS-edit-infos","","JIT-Module-013b-AWS-edit-infos","[AWS] As a user, I can update module AWS SES Integration","[AWS] As a user, I can update module AWS SES Integration",""
"passed","Fri Jan 06 18:52:09 GMT 2023","Fri Jan 06 18:53:45 GMT 2023","96299","","JIT-Web-002f-MOLECULE-Navigate-edit-screen","","JIT-Web-002f-MOLECULE-Navigate-edit-screen","[WEB-MOLECULE-EDIT] As a user, I can see the molecule in Page and use Edit button see the content of this molecule","[WEB-MOLECULE-EDIT] As a user, I can see the molecule in Page and use Edit button see the content of this molecule",""
"passed","Fri Jan 06 18:29:37 GMT 2023","Fri Jan 06 18:31:06 GMT 2023","88927","","JIT-Mobile-029b-TOUCHABLE-General-info","","JIT-Mobile-029b-TOUCHABLE-General-info","[MOBILE-TOUCHABLE] As a user, I should check the general infomation of Touchable is correct: Name, Key, unique key, delete component","[MOBILE-TOUCHABLE] As a user, I should check the general infomation of Touchable is correct: Name, Key, unique key, delete component",""
"passed","Fri Jan 06 19:02:21 GMT 2023","Fri Jan 06 19:03:56 GMT 2023","94546","","JIT-API-007d-POST-API-Add-new-endpoint","","JIT-API-007d-POST-API-Add-new-endpoint","[GET-POST] Create, update and delete new POST API endpoint","[GET-POST] Create, update and delete new POST API endpoint",""
"passed","Fri Jan 06 18:44:09 GMT 2023","Fri Jan 06 18:45:11 GMT 2023","62323","","JIT-Module-016b-SENDGRID-edit-infos","","JIT-Module-016b-SENDGRID-edit-infos","[SENDGRID] As a user, I can update module SendGrid","[SENDGRID] As a user, I can update module SendGrid",""
"passed","Fri Jan 06 19:31:26 GMT 2023","Fri Jan 06 19:33:44 GMT 2023","138334","","JIT-Mobile-039a-OTP-Check-PreviewCode","","JIT-Mobile-039a-OTP-Check-PreviewCode","[MOBILE-OTP] As a user, I should check the Preview code of OTP component","[MOBILE-OTP] As a user, I should check the Preview code of OTP component",""
"passed","Fri Jan 06 18:38:31 GMT 2023","Fri Jan 06 18:39:56 GMT 2023","84775","","JIT-Module-005a-FORCE-MOBILE-UPDATE-database","","JIT-Module-005a-FORCE-MOBILE-UPDATE-database","[FORCE-MOBILE-UPDATE] - Check adding and auto-table & columns","[FORCE-MOBILE-UPDATE] - Check adding and auto-table & columns",""
"passed","Fri Jan 06 20:44:13 GMT 2023","Fri Jan 06 20:55:44 GMT 2023","691133","","JIT-Preview-005-Preview-[TOAST-MESSAGE]","","JIT-Preview-005-Preview-[TOAST-MESSAGE]","[PREVIEW-TOAST-MESSAGE] As a user, I check preview function for Toast message action","[PREVIEW-TOAST-MESSAGE] As a user, I check preview function for Toast message action",""
"passed","Fri Jan 06 18:42:59 GMT 2023","Fri Jan 06 18:44:35 GMT 2023","95545","","JIT-Module-014b-BASIC-AUTH-edit-infos","","JIT-Module-014b-BASIC-AUTH-edit-infos","[BASIC-AUTH] As a user, I can update module Basic Authentication","[BASIC-AUTH] As a user, I can update module Basic Authentication",""
"passed","Fri Jan 06 18:47:25 GMT 2023","Fri Jan 06 18:50:22 GMT 2023","177617","","JIT-Web-001f-PAGE-Export-and-import","","JIT-Web-001f-PAGE-Export-and-import","[PAGE] As a user, I can create new screen by import and export the screen","[PAGE] As a user, I can create new screen by import and export the screen",""
"passed","Fri Jan 06 18:46:34 GMT 2023","Fri Jan 06 18:51:11 GMT 2023","277361","","JIT-Web-001b-PAGE-Update","","JIT-Web-001b-PAGE-Update","[PAGE] As a user, I can update page with positive and negative cases","[PAGE] As a user, I can update page with positive and negative cases",""
"passed","Fri Jan 06 19:05:18 GMT 2023","Fri Jan 06 19:06:42 GMT 2023","83864","","JIT-Database-015d-INDEX-STRING-column-config","","JIT-Database-015d-INDEX-STRING-column-config","[INDEX-STRING] As a user, I config index from column setting && check on index popup","[INDEX-STRING] As a user, I config index from column setting && check on index popup",""
