"Status","Start Time","Stop Time","Duration in ms","Parent Suite","Suite","Sub Suite","Test Class","Test Method","Name","Description"
"broken","Thu May 04 17:20:12 UTC 2023","Thu May 04 17:21:02 UTC 2023","49988","","JIT-Web-001f-PAGE-Export-and-import","","JIT-Web-001f-PAGE-Export-and-import","[PAGE] As a user, I can create new screen by import and export the screen","[PAGE] As a user, I can create new screen by import and export the screen",""
"broken","Thu May 04 16:54:05 UTC 2023","Thu May 04 16:55:00 UTC 2023","55802","","JIT-Database-004-COLUMN-type-INTEGER","","JIT-Database-004-COLUMN-type-INTEGER","[COLUMN] As a user, I should check the validation of INTEGER column definition","[COLUMN] As a user, I should check the validation of INTEGER column definition",""
"broken","Thu May 04 19:19:34 UTC 2023","Thu May 04 19:20:24 UTC 2023","49651","","JIT-Preview-003-Preview-REACT-NATIVE","","JIT-Preview-003-Preview-REACT-NATIVE","[PREVIEW-REACT-NATIVE] As a user, I check preview function for React Native","[PREVIEW-REACT-NATIVE] As a user, I check preview function for React Native",""
"broken","Thu May 04 18:33:43 UTC 2023","Thu May 04 18:34:34 UTC 2023","50475","","JIT-Mobile-035b-FLATLIST-General-info","","JIT-Mobile-035b-FLATLIST-General-info","[MOBILE-FLATLIST] As a user, I should check the general infomation of FlatList is correct: Name, Key, unique key, delete component","[MOBILE-FLATLIST] As a user, I should check the general infomation of FlatList is correct: Name, Key, unique key, delete component",""
"broken","Thu May 04 17:01:10 UTC 2023","Thu May 04 17:01:59 UTC 2023","49660","","JIT-Module-006b-SMS-edit-infos","","JIT-Module-006b-SMS-edit-infos","[SMS], I can add module SMS login with Twilio and edit its infos","[SMS], I can add module SMS login with Twilio and edit its infos",""
"broken","Thu May 04 17:58:04 UTC 2023","Thu May 04 17:58:54 UTC 2023","49715","","JIT-Database-012d-RELATION-multiple-2-direction","","JIT-Database-012d-RELATION-multiple-2-direction","[RELATION], I should add multiple relation 2 directions","[RELATION], I should add multiple relation 2 directions",""
"broken","Thu May 04 17:44:10 UTC 2023","Thu May 04 17:45:00 UTC 2023","49753","","JIT-Web-011c-SETTING-PROJECT-VARIABLE-CSS-Check-update-PV","","JIT-Web-011c-SETTING-PROJECT-VARIABLE-CSS-Check-update-PV","[SETTING-PROJECT-VARIABLE-CSS] As a user, I update the PV name & value, check reflection on edtior","[SETTING-PROJECT-VARIABLE-CSS] As a user, I update the PV name & value, check reflection on edtior",""
"broken","Thu May 04 19:14:04 UTC 2023","Thu May 04 19:14:53 UTC 2023","49735","","JIT-API-003c-POST-relation","","JIT-API-003c-POST-relation","As a user, I check column display when having relation for API POST","As a user, I check column display when having relation for API POST",""
"broken","Thu May 04 17:32:11 UTC 2023","Thu May 04 17:33:01 UTC 2023","49812","","JIT-Database-010a-COLUMN-FILE-validation","","JIT-Database-010a-COLUMN-FILE-validation","[COLUMN] As a user, I should check the validation of FILE column definition","[COLUMN] As a user, I should check the validation of FILE column definition",""
"broken","Thu May 04 19:05:11 UTC 2023","Thu May 04 19:06:01 UTC 2023","50255","","JIT-Database-015g-INDEX-FLOAT-column-config","","JIT-Database-015g-INDEX-FLOAT-column-config","[INDEX-FLOAT] As a user, I config index from column setting && check on index popup","[INDEX-FLOAT] As a user, I config index from column setting && check on index popup",""
"broken","Thu May 04 17:02:09 UTC 2023","Thu May 04 17:02:59 UTC 2023","49643","","JIT-Database-005-COLUMN-type-FLOAT","","JIT-Database-005-COLUMN-type-FLOAT","[COLUMN] As a user, I should check the validation of FLOAT column definition","[COLUMN] As a user, I should check the validation of FLOAT column definition",""
"broken","Thu May 04 17:12:11 UTC 2023","Thu May 04 17:13:01 UTC 2023","50618","","JIT-Module-019b-GOOGLE-ANALYTICS-edit-infos","","JIT-Module-019b-GOOGLE-ANALYTICS-edit-infos","[GOOGLE-ANALYTICS] As a user, I can update module Google Analytics information for each environment","[GOOGLE-ANALYTICS] As a user, I can update module Google Analytics information for each environment",""
"broken","Thu May 04 18:16:54 UTC 2023","Thu May 04 18:17:44 UTC 2023","49566","","JIT-Mobile-013-JITDEF-reflect-delete-screen-innavigation-tree","","JIT-Mobile-013-JITDEF-reflect-delete-screen-innavigation-tree","[DEFECT] As a user, I should see screen will be removed in navigation tree after deleting screen","[DEFECT] As a user, I should see screen will be removed in navigation tree after deleting screen",""
"broken","Thu May 04 18:26:48 UTC 2023","Thu May 04 18:27:38 UTC 2023","49825","","JIT-Mobile-029b-TOUCHABLE-General-info","","JIT-Mobile-029b-TOUCHABLE-General-info","[MOBILE-TOUCHABLE] As a user, I should check the general infomation of Touchable is correct: Name, Key, unique key, delete component","[MOBILE-TOUCHABLE] As a user, I should check the general infomation of Touchable is correct: Name, Key, unique key, delete component",""
"broken","Thu May 04 18:57:22 UTC 2023","Thu May 04 18:58:11 UTC 2023","49577","","JIT-API-010b-DEFECT-Check-JSON-path","","JIT-API-010b-DEFECT-Check-JSON-path","As a user, I want to check the option in dropdown show correct JSON path.","As a user, I want to check the option in dropdown show correct JSON path.",""
"broken","Thu May 04 18:40:43 UTC 2023","Thu May 04 18:41:33 UTC 2023","49700","","JIT-API-001-Check-general-info","","JIT-API-001-Check-general-info","As a user, I check general info","As a user, I check general info",""
"broken","Thu May 04 18:51:29 UTC 2023","Thu May 04 18:52:19 UTC 2023","49639","","JIT-API-002a-GET-list-check-default","","JIT-API-002a-GET-list-check-default","As a user, I check default value in API GET list","As a user, I check default value in API GET list",""
"broken","Thu May 04 18:44:38 UTC 2023","Thu May 04 18:45:28 UTC 2023","49711","","JIT-API-005c-PUT-relation","","JIT-API-005c-PUT-relation","As a user, I check column display when having relation for API PUT","As a user, I check column display when having relation for API PUT",""
"broken","Thu May 04 17:35:11 UTC 2023","Thu May 04 17:36:01 UTC 2023","49751","","JIT-Web-004a-ACTION-NAVIGATION-no-param","","JIT-Web-004a-ACTION-NAVIGATION-no-param","[WEB-ACTION-NAVIGATION] As a user, I could add action type navigation without params and check preview code","[WEB-ACTION-NAVIGATION] As a user, I could add action type navigation without params and check preview code",""
"broken","Thu May 04 18:29:46 UTC 2023","Thu May 04 18:30:36 UTC 2023","50285","","JIT-Mobile-032b-CAROUSEL-General-info","","JIT-Mobile-032b-CAROUSEL-General-info","[MOBILE-CAROUSEL] As a user, I should check the general infomation of Carousel is correct: Name, Key, unique key, delete component","[MOBILE-CAROUSEL] As a user, I should check the general infomation of Carousel is correct: Name, Key, unique key, delete component",""
"broken","Thu May 04 18:35:43 UTC 2023","Thu May 04 18:36:32 UTC 2023","49825","","JIT-Mobile-041a-PREVIEW-NAVIGATION-no-navigation-setup","","JIT-Mobile-041a-PREVIEW-NAVIGATION-no-navigation-setup","[MOBILE-PREVIEW-NAVIGATION] As a user, I could open preview screen with notification should setup the screen navigation","[MOBILE-PREVIEW-NAVIGATION] As a user, I could open preview screen with notification should setup the screen navigation",""
"broken","Thu May 04 16:56:10 UTC 2023","Thu May 04 16:57:00 UTC 2023","49631","","JIT-Module-002b-DEEPLINK-edit-infos","","JIT-Module-002b-DEEPLINK-edit-infos","As a user, I can update module Deeplink","As a user, I can update module Deeplink",""
"broken","Thu May 04 18:42:40 UTC 2023","Thu May 04 18:43:30 UTC 2023","49809","","JIT-API-005a-PUT-check-default","","JIT-API-005a-PUT-check-default","As a user, I check default value in API PUT","As a user, I check default value in API PUT",""
"broken","Thu May 04 17:43:10 UTC 2023","Thu May 04 17:44:00 UTC 2023","50187","","JIT-Web-011b-SETTING-PROJECT-VARIABLE-CSS-Check","","JIT-Web-011b-SETTING-PROJECT-VARIABLE-CSS-Check","[SETTING-PROJECT-VARIABLE-CSS] As a user, I can set value for the CSS field of the component","[SETTING-PROJECT-VARIABLE-CSS] As a user, I can set value for the CSS field of the component",""
"broken","Thu May 04 17:26:12 UTC 2023","Thu May 04 17:27:02 UTC 2023","49869","","JIT-Web-002a-MOLECULE-Create-new","","JIT-Web-002a-MOLECULE-Create-new","[WEB-MOLECULE] As a user, I can create new molecule with positive and negative cases","[WEB-MOLECULE] As a user, I can create new molecule with positive and negative cases",""
"broken","Thu May 04 16:55:10 UTC 2023","Thu May 04 16:56:00 UTC 2023","50105","","JIT-Module-002a-DEEPLINK-default","","JIT-Module-002a-DEEPLINK-default","As a user, I can add module Deeplink and remove it","As a user, I can add module Deeplink and remove it",""
"broken","Thu May 04 18:39:40 UTC 2023","Thu May 04 18:40:29 UTC 2023","49652","","JIT-Module-000-search","","JIT-Module-000-search","[SEARCH] As a user, I can Search module","[SEARCH] As a user, I can Search module",""
"broken","Thu May 04 17:25:12 UTC 2023","Thu May 04 17:26:02 UTC 2023","49897","","JIT-Web-001h02-PAGE-DEFECT-Expand-Collapse-folder","","JIT-Web-001h02-PAGE-DEFECT-Expand-Collapse-folder","[PAGE - DEFECT] As a user, I can check DEFECT expand and collapse folder","[PAGE - DEFECT] As a user, I can check DEFECT expand and collapse folder",""
"broken","Thu May 04 18:10:58 UTC 2023","Thu May 04 18:11:48 UTC 2023","49984","","JIT-Mobile-005-MOLECULE-Create-new","","JIT-Mobile-005-MOLECULE-Create-new","[MOBILE-MOLECULE] As a user, I can create new molecule with positive and negative cases","[MOBILE-MOLECULE] As a user, I can create new molecule with positive and negative cases",""
"broken","Thu May 04 17:49:08 UTC 2023","Thu May 04 17:49:58 UTC 2023","49780","","JIT-Web-011g-SETTING-PROJECT-VARIABLE-CSS-DEFECT-Check-view-code","","JIT-Web-011g-SETTING-PROJECT-VARIABLE-CSS-DEFECT-Check-view-code","[SETTING-PROJECT-VARIABLE-VIEWCODE] As a user, I check View Code function with PV","[SETTING-PROJECT-VARIABLE-VIEWCODE] As a user, I check View Code function with PV",""
"broken","Thu May 04 18:49:32 UTC 2023","Thu May 04 18:50:21 UTC 2023","49658","","JIT-API-007c-GET-detail-API-Add-new-endpoint","","JIT-API-007c-GET-detail-API-Add-new-endpoint","[GET-detail-API] Create, update and delete new GET API endpoint","[GET-detail-API] Create, update and delete new GET API endpoint",""
"broken","Thu May 04 18:41:42 UTC 2023","Thu May 04 18:42:31 UTC 2023","49485","","JIT-API-004c-GET-detail-relation","","JIT-API-004c-GET-detail-relation","As a user, I check column display when having relation for GET-detail","As a user, I check column display when having relation for GET-detail",""
"broken","Thu May 04 18:52:28 UTC 2023","Thu May 04 18:53:18 UTC 2023","49630","","JIT-API-007e-PUT-API-Add-new-endpoint","","JIT-API-007e-PUT-API-Add-new-endpoint","[PUT-API] Create, update and delete new PUT API endpoint","[PUT-API] Create, update and delete new PUT API endpoint",""
"broken","Thu May 04 17:48:09 UTC 2023","Thu May 04 17:48:58 UTC 2023","49731","","JIT-Web-011f-SETTING-PROJECT-VARIABLE-CSS-DEFECT-Check-icon-image","","JIT-Web-011f-SETTING-PROJECT-VARIABLE-CSS-DEFECT-Check-icon-image","[SETTING-PROJECT-VARIABLE-CSS-DEFECT] As a user, I check icon and image can apply to PV without error","[SETTING-PROJECT-VARIABLE-CSS-DEFECT] As a user, I check icon and image can apply to PV without error",""
"broken","Thu May 04 18:24:49 UTC 2023","Thu May 04 18:25:39 UTC 2023","49848","","JIT-Database-002-COLUMN-default","","JIT-Database-002-COLUMN-default","[COLUMN] As a user, I should see the default column definition","[COLUMN] As a user, I should see the default column definition",""
"broken","Thu May 04 18:06:01 UTC 2023","Thu May 04 18:06:51 UTC 2023","49917","","JIT-Mobile-001-SCREEN-Create-new","","JIT-Mobile-001-SCREEN-Create-new","[MOBILE-SCREEN] As a user, I can create new screen with positive and negative cases","[MOBILE-SCREEN] As a user, I can create new screen with positive and negative cases",""
"broken","Thu May 04 17:33:11 UTC 2023","Thu May 04 17:34:01 UTC 2023","49991","","JIT-Web-002g-MOLECULE-CRUD-category","","JIT-Web-002g-MOLECULE-CRUD-category","[WEB-MOLECULE-EDIT] As a user, I can see the molecule in Page and use Edit button see the content of this molecule","[WEB-MOLECULE-EDIT] As a user, I can see the molecule in Page and use Edit button see the content of this molecule",""
"broken","Thu May 04 18:38:40 UTC 2023","Thu May 04 18:39:30 UTC 2023","49642","","JIT-Mobile-045a-LAYER-TREE-Check-edit-and-action","","JIT-Mobile-045a-LAYER-TREE-Check-edit-and-action","[MOBILE-LAYER-TREE] As a user, I could update the name of the node in the layer tree and copy,paste,delete,wrap the node","[MOBILE-LAYER-TREE] As a user, I could update the name of the node in the layer tree and copy,paste,delete,wrap the node",""
"broken","Thu May 04 18:32:44 UTC 2023","Thu May 04 18:33:34 UTC 2023","49551","","JIT-Mobile-034b-SCROLLVIEW-General-info","","JIT-Mobile-034b-SCROLLVIEW-General-info","[MOBILE-SCROLLVIEW] As a user, I should check the general infomation of Scroll View is correct: Name, Key, unique key, delete component","[MOBILE-SCROLLVIEW] As a user, I should check the general infomation of Scroll View is correct: Name, Key, unique key, delete component",""
"broken","Thu May 04 18:02:03 UTC 2023","Thu May 04 18:02:52 UTC 2023","49626","","JIT-Database-014-DEFECT-Check-duplicate-table-name","","JIT-Database-014-DEFECT-Check-duplicate-table-name","[DEFECT] As a user, I cannot update to duplicate name","[DEFECT] As a user, I cannot update to duplicate name",""
"broken","Thu May 04 17:29:11 UTC 2023","Thu May 04 17:30:01 UTC 2023","49896","","JIT-Web-002d-MOLECULE-Duplicate","","JIT-Web-002d-MOLECULE-Duplicate","[WEB-MOLECULE] As a user, I can duplicate molecule with positive and negative cases","[WEB-MOLECULE] As a user, I can duplicate molecule with positive and negative cases",""
"broken","Thu May 04 18:04:01 UTC 2023","Thu May 04 18:04:51 UTC 2023","49748","","JIT-Database-016a-COUNTER-CACHE-Create-by-relation","","JIT-Database-016a-COUNTER-CACHE-Create-by-relation","[COUNTER-CACHE] create new counter cache column by selecting in relation popup","[COUNTER-CACHE] create new counter cache column by selecting in relation popup",""
"broken","Thu May 04 17:18:12 UTC 2023","Thu May 04 17:19:02 UTC 2023","50039","","JIT-Web-001c-PAGE-Delete","","JIT-Web-001c-PAGE-Delete","[PAGE] As a user, I can delete page","[PAGE] As a user, I can delete page",""
"broken","Thu May 04 18:48:33 UTC 2023","Thu May 04 18:49:23 UTC 2023","49557","","JIT-API-007bb-GET-list-API-Check-datetime-static-value","","JIT-API-007bb-GET-list-API-Check-datetime-static-value","[GET-list-API] Set datetime static value","[GET-list-API] Set datetime static value",""
"broken","Thu May 04 17:09:10 UTC 2023","Thu May 04 17:10:00 UTC 2023","50217","","JIT-Module-017b-GOOGLE-ANAL-edit-infos","","JIT-Module-017b-GOOGLE-ANAL-edit-infos","[GOOGLE-ANAL] As a user, I can update module Google Analytics","[GOOGLE-ANAL] As a user, I can update module Google Analytics",""
"broken","Thu May 04 18:18:53 UTC 2023","Thu May 04 18:19:43 UTC 2023","49842","","JIT-Mobile-015-VIEW-General-info","","JIT-Mobile-015-VIEW-General-info","[MOBILE-VIEW] As a user, I should check the general infomation of View is correct: Name, Key, unique key, delete component","[MOBILE-VIEW] As a user, I should check the general infomation of View is correct: Name, Key, unique key, delete component",""
"broken","Thu May 04 18:09:58 UTC 2023","Thu May 04 18:10:48 UTC 2023","49766","","JIT-Database-001c-TABLE-duplicate","","JIT-Database-001c-TABLE-duplicate","[TABLE] As a user, I cannot create table with duplicate name","[TABLE] As a user, I cannot create table with duplicate name",""
"broken","Thu May 04 18:23:50 UTC 2023","Thu May 04 18:24:39 UTC 2023","49512","","JIT-Mobile-027b-IMAGE-General-info","","JIT-Mobile-027b-IMAGE-General-info","[MOBILE-IMAGE] As a user, I should check the general infomation of Image is correct: Name, Key, unique key, delete component","[MOBILE-IMAGE] As a user, I should check the general infomation of Image is correct: Name, Key, unique key, delete component",""
"broken","Thu May 04 18:27:47 UTC 2023","Thu May 04 18:28:37 UTC 2023","49493","","JIT-Mobile-030b-WEBVIEW-General-info","","JIT-Mobile-030b-WEBVIEW-General-info","[MOBILE-WEBVIEW] As a user, I should check the general infomation of Webview is correct: Name, Key, unique key, delete component","[MOBILE-WEBVIEW] As a user, I should check the general infomation of Webview is correct: Name, Key, unique key, delete component",""
"broken","Thu May 04 17:00:10 UTC 2023","Thu May 04 17:01:00 UTC 2023","49733","","JIT-Module-006a-SMS-default","","JIT-Module-006a-SMS-default","[SMS], I can add module SMS login with Twilio and remove it","[SMS], I can add module SMS login with Twilio and remove it",""
"broken","Thu May 04 17:59:04 UTC 2023","Thu May 04 17:59:54 UTC 2023","49795","","JIT-Database-012e-RELATION-trigger-by-button","","JIT-Database-012e-RELATION-trigger-by-button","[RELATION] check the basic relation","[RELATION] check the basic relation",""
"broken","Thu May 04 18:22:51 UTC 2023","Thu May 04 18:23:40 UTC 2023","49603","","JIT-Mobile-026b-BUTTON-General-info","","JIT-Mobile-026b-BUTTON-General-info","[MOBILE-BUTTON] As a user, I should check the general infomation of Button is correct: Name, Key, unique key, delete component","[MOBILE-BUTTON] As a user, I should check the general infomation of Button is correct: Name, Key, unique key, delete component",""
"broken","Thu May 04 17:46:10 UTC 2023","Thu May 04 17:47:00 UTC 2023","49608","","JIT-Web-011e-SETTING-PROJECT-VARIABLE-CSS-Check-remove-variable","","JIT-Web-011e-SETTING-PROJECT-VARIABLE-CSS-Check-remove-variable","[SETTING-PROJECT-VARIABLE-CSS] As a user, I remove the PV,  should show the previous value of this field","[SETTING-PROJECT-VARIABLE-CSS] As a user, I remove the PV,  should show the previous value of this field",""
"broken","Thu May 04 17:57:05 UTC 2023","Thu May 04 17:57:55 UTC 2023","49819","","JIT-Database-012c-RELATION-multiple-1-direction","","JIT-Database-012c-RELATION-multiple-1-direction","[RELATION], I should add multiple relation 1 direction","[RELATION], I should add multiple relation 1 direction",""
"broken","Thu May 04 18:54:26 UTC 2023","Thu May 04 18:55:15 UTC 2023","49910","","JIT-API-008-DEFECT-Check-column-file-type","","JIT-API-008-DEFECT-Check-column-file-type","[DEFECT] As a user, I check column type file not display in request params of GET list Api","[DEFECT] As a user, I check column type file not display in request params of GET list Api",""
"broken","Thu May 04 18:59:19 UTC 2023","Thu May 04 19:00:08 UTC 2023","49645","","JIT-Database-015b-INDEX-CRUD-single","","JIT-Database-015b-INDEX-CRUD-single","[INDEX] As a user, I check add and update multiple index","[INDEX] As a user, I check add and update multiple index",""
"broken","Thu May 04 17:04:09 UTC 2023","Thu May 04 17:04:59 UTC 2023","50083","","JIT-Module-014a-BASIC-AUTH-default","","JIT-Module-014a-BASIC-AUTH-default","[BASIC-AUTH] As a user, I can add module Basic Authentication and remove it","[BASIC-AUTH] As a user, I can add module Basic Authentication and remove it",""
"broken","Thu May 04 18:56:23 UTC 2023","Thu May 04 18:57:13 UTC 2023","49812","","JIT-API-010a-DEFECT-Check-special-symbol-request-param","","JIT-API-010a-DEFECT-Check-special-symbol-request-param","As a user, I want to validate and prevent the special symbol for request params.","As a user, I want to validate and prevent the special symbol for request params.",""
"broken","Thu May 04 18:46:35 UTC 2023","Thu May 04 18:47:25 UTC 2023","49478","","JIT-API-007a-GROUP-API-CRUD","","JIT-API-007a-GROUP-API-CRUD","[GROUP-API] Create, update and delete group API","[GROUP-API] Create, update and delete group API",""
"broken","Thu May 04 19:04:12 UTC 2023","Thu May 04 19:05:02 UTC 2023","49669","","JIT-Database-015f-INDEX-INTEGER-column-config","","JIT-Database-015f-INDEX-INTEGER-column-config","[INDEX-INTEGER] As a user, I config index from column setting && check on index popup","[INDEX-INTEGER] As a user, I config index from column setting && check on index popup",""
"broken","Thu May 04 18:13:56 UTC 2023","Thu May 04 18:14:46 UTC 2023","49934","","JIT-Mobile-011-JITDEF50-disable-add-duplicate-screen-in-stack","","JIT-Mobile-011-JITDEF50-disable-add-duplicate-screen-in-stack","[DEFECT] As a user, I could add duplicate screen in stack","[DEFECT] As a user, I could add duplicate screen in stack",""
"broken","Thu May 04 18:15:55 UTC 2023","Thu May 04 18:16:45 UTC 2023","49635","","JIT-Database-001d-TABLE-update","","JIT-Database-001d-TABLE-update","[TABLE] As a user, I can update the value of the table","[TABLE] As a user, I can update the value of the table",""
"broken","Thu May 04 17:36:11 UTC 2023","Thu May 04 17:37:00 UTC 2023","49575","","JIT-Database-010b-COLUMN-FILE-format-file","","JIT-Database-010b-COLUMN-FILE-format-file","[COLUMN] As a user, I should check the validation of FILE column definition for Format Area","[COLUMN] As a user, I should check the validation of FILE column definition for Format Area",""
"broken","Thu May 04 19:06:11 UTC 2023","Thu May 04 19:07:02 UTC 2023","50746","","JIT-Database-015h-INDEX-DATE-column-config","","JIT-Database-015h-INDEX-DATE-column-config","[INDEX-DATE] As a user, I config index from column setting && check on index popup","[INDEX-DATE] As a user, I config index from column setting && check on index popup",""
