"Status","Start Time","Stop Time","Duration in ms","Parent Suite","Suite","Sub Suite","Test Class","Test Method","Name","Description"
"passed","Sun Jun 18 18:14:36 UTC 2023","Sun Jun 18 18:15:58 UTC 2023","81313","","JIT-Database-015f-INDEX-INTEGER-column-config","","JIT-Database-015f-INDEX-INTEGER-column-config","[INDEX-INTEGER] As a user, I config index from column setting && check on index popup","[INDEX-INTEGER] As a user, I config index from column setting && check on index popup",""
"passed","Sun Jun 18 16:16:24 UTC 2023","Sun Jun 18 16:17:45 UTC 2023","80973","","JIT-Database-017b-COLUMN-INT-FLOAT-Validation-message","","JIT-Database-017b-COLUMN-INT-FLOAT-Validation-message","[COLUMN-INTEGER-VALIDATION] As a user, I validation locale message for INTEGER column type","[COLUMN-INTEGER-VALIDATION] As a user, I validation locale message for INTEGER column type",""
"passed","Sun Jun 18 16:25:41 UTC 2023","Sun Jun 18 16:26:49 UTC 2023","68755","","JIT-Mobile-029b-TOUCHABLE-General-info","","JIT-Mobile-029b-TOUCHABLE-General-info","[MOBILE-TOUCHABLE] As a user, I should check the general infomation of Touchable is correct: Name, Key, unique key, delete component","[MOBILE-TOUCHABLE] As a user, I should check the general infomation of Touchable is correct: Name, Key, unique key, delete component",""
"passed","Sun Jun 18 17:37:56 UTC 2023","Sun Jun 18 17:39:39 UTC 2023","102708","","JIT-Web-007a-ASSET-Upload","","JIT-Web-007a-ASSET-Upload","[ASSET] As a user, I can upload new image and store in Asset Manager and use it in all Image component","[ASSET] As a user, I can upload new image and store in Asset Manager and use it in all Image component",""
"passed","Sun Jun 18 17:58:05 UTC 2023","Sun Jun 18 17:58:39 UTC 2023","33527","","JIT-Database-001c-TABLE-duplicate","","JIT-Database-001c-TABLE-duplicate","[TABLE] As a user, I cannot create table with duplicate name","[TABLE] As a user, I cannot create table with duplicate name",""
"passed","Sun Jun 18 16:24:42 UTC 2023","Sun Jun 18 16:25:43 UTC 2023","60282","","JIT-Mobile-027b-IMAGE-General-info","","JIT-Mobile-027b-IMAGE-General-info","[MOBILE-IMAGE] As a user, I should check the general infomation of Image is correct: Name, Key, unique key, delete component","[MOBILE-IMAGE] As a user, I should check the general infomation of Image is correct: Name, Key, unique key, delete component",""
"passed","Sun Jun 18 17:55:26 UTC 2023","Sun Jun 18 17:56:14 UTC 2023","48242","","JIT-Database-014-DEFECT-Check-duplicate-table-name","","JIT-Database-014-DEFECT-Check-duplicate-table-name","[DEFECT] As a user, I cannot update to duplicate name","[DEFECT] As a user, I cannot update to duplicate name",""
"passed","Sun Jun 18 18:05:13 UTC 2023","Sun Jun 18 18:06:09 UTC 2023","55718","","JIT-API-001-Check-general-info","","JIT-API-001-Check-general-info","As a user, I check general info","As a user, I check general info",""
"passed","Sun Jun 18 18:09:17 UTC 2023","Sun Jun 18 18:10:36 UTC 2023","78982","","JIT-API-007c-GET-detail-API-Add-new-endpoint","","JIT-API-007c-GET-detail-API-Add-new-endpoint","[GET-detail-API] Create, update and delete new GET API endpoint","[GET-detail-API] Create, update and delete new GET API endpoint",""
"passed","Sun Jun 18 16:43:46 UTC 2023","Sun Jun 18 16:47:00 UTC 2023","194284","","JIT-Web-002d-MOLECULE-Duplicate","","JIT-Web-002d-MOLECULE-Duplicate","[WEB-MOLECULE] As a user, I can duplicate molecule with positive and negative cases","[WEB-MOLECULE] As a user, I can duplicate molecule with positive and negative cases",""
"passed","Sun Jun 18 17:57:11 UTC 2023","Sun Jun 18 17:57:58 UTC 2023","46600","","JIT-Database-017c-COLUMN-DATE-DATETIME-Validation-message","","JIT-Database-017c-COLUMN-DATE-DATETIME-Validation-message","[COLUMN-DATETIME-VALIDATION] As a user, I validation locale message for DATETIME column type","[COLUMN-DATETIME-VALIDATION] As a user, I validation locale message for DATETIME column type",""
"passed","Sun Jun 18 17:08:34 UTC 2023","Sun Jun 18 17:10:32 UTC 2023","118265","","JIT-API-011-UPDATE-toggle-on-API","","JIT-API-011-UPDATE-toggle-on-API","As a user, I want to see the confirmation when deleting table/column, adding column, update table/column when the API is toggled on","As a user, I want to see the confirmation when deleting table/column, adding column, update table/column when the API is toggled on",""
"passed","Sun Jun 18 16:29:58 UTC 2023","Sun Jun 18 16:30:35 UTC 2023","37001","","JIT-Module-000-search","","JIT-Module-000-search","[SEARCH] As a user, I can Search module","[SEARCH] As a user, I can Search module",""
"passed","Sun Jun 18 16:47:07 UTC 2023","Sun Jun 18 16:49:03 UTC 2023","116427","","JIT-Web-004a-ACTION-NAVIGATION-no-param","","JIT-Web-004a-ACTION-NAVIGATION-no-param","[WEB-ACTION-NAVIGATION] As a user, I could add action type navigation without params and check preview code","[WEB-ACTION-NAVIGATION] As a user, I could add action type navigation without params and check preview code",""
"passed","Sun Jun 18 16:32:33 UTC 2023","Sun Jun 18 16:34:16 UTC 2023","103187","","JIT-Module-006a-SMS-default","","JIT-Module-006a-SMS-default","[SMS], I can add module SMS login with Twilio and remove it","[SMS], I can add module SMS login with Twilio and remove it",""
"passed","Sun Jun 18 17:31:46 UTC 2023","Sun Jun 18 17:32:24 UTC 2023","37155","","JIT-Module-002a-DEEPLINK-default","","JIT-Module-002a-DEEPLINK-default","As a user, I can add module Deeplink and remove it","As a user, I can add module Deeplink and remove it",""
"passed","Sun Jun 18 17:56:22 UTC 2023","Sun Jun 18 17:57:11 UTC 2023","49479","","JIT-Database-017c-COLUMN-DATE-DATETIME-Validation-message","","JIT-Database-017c-COLUMN-DATE-DATETIME-Validation-message","[COLUMN-DATE-VALIDATION] As a user, I validation locale message for DATE column type","[COLUMN-DATE-VALIDATION] As a user, I validation locale message for DATE column type",""
"passed","Sun Jun 18 16:29:43 UTC 2023","Sun Jun 18 16:31:24 UTC 2023","100720","","JIT-Mobile-045a-LAYER-TREE-Check-edit-and-action","","JIT-Mobile-045a-LAYER-TREE-Check-edit-and-action","[MOBILE-LAYER-TREE] As a user, I could update the name of the node in the layer tree and copy,paste,delete,wrap the node","[MOBILE-LAYER-TREE] As a user, I could update the name of the node in the layer tree and copy,paste,delete,wrap the node",""
"passed","Sun Jun 18 16:27:39 UTC 2023","Sun Jun 18 16:28:41 UTC 2023","62128","","JIT-Mobile-034b-SCROLLVIEW-General-info","","JIT-Mobile-034b-SCROLLVIEW-General-info","[MOBILE-SCROLLVIEW] As a user, I should check the general infomation of Scroll View is correct: Name, Key, unique key, delete component","[MOBILE-SCROLLVIEW] As a user, I should check the general infomation of Scroll View is correct: Name, Key, unique key, delete component",""
"passed","Sun Jun 18 16:35:55 UTC 2023","Sun Jun 18 16:36:36 UTC 2023","41258","","JIT-Module-017b-GOOGLE-ANAL-edit-infos","","JIT-Module-017b-GOOGLE-ANAL-edit-infos","[GOOGLE-ANAL] As a user, I can update module Google Analytics","[GOOGLE-ANAL] As a user, I can update module Google Analytics",""
"passed","Sun Jun 18 16:46:25 UTC 2023","Sun Jun 18 16:49:05 UTC 2023","159929","","JIT-Web-002h-MOLECULE-New-with-cate","","JIT-Web-002h-MOLECULE-New-with-cate","[WEB-MOLECULE-CATE] As a user, I can create new molecule","[WEB-MOLECULE-CATE] As a user, I can create new molecule",""
"passed","Sun Jun 18 16:27:18 UTC 2023","Sun Jun 18 16:28:22 UTC 2023","63765","","JIT-Mobile-033b-HEADER-General-info","","JIT-Mobile-033b-HEADER-General-info","[MOBILE-HEADER] As a user, I should check the general infomation of Header is correct: Name, Key, unique key, delete component","[MOBILE-HEADER] As a user, I should check the general infomation of Header is correct: Name, Key, unique key, delete component",""
"passed","Sun Jun 18 17:35:41 UTC 2023","Sun Jun 18 17:36:32 UTC 2023","50468","","JIT-Web-001a-PAGE-Create-new","","JIT-Web-001a-PAGE-Create-new","[PAGE] As a user, I can create new screen with positive and negative cases","[PAGE] As a user, I can create new screen with positive and negative cases",""
"passed","Sun Jun 18 16:51:58 UTC 2023","Sun Jun 18 16:53:28 UTC 2023","89899","","JIT-Web-011e-SETTING-PROJECT-VARIABLE-CSS-Check-remove-variable","","JIT-Web-011e-SETTING-PROJECT-VARIABLE-CSS-Check-remove-variable","[SETTING-PROJECT-VARIABLE-CSS] As a user, I remove the PV,  should show the previous value of this field","[SETTING-PROJECT-VARIABLE-CSS] As a user, I remove the PV,  should show the previous value of this field",""
"passed","Sun Jun 18 16:41:28 UTC 2023","Sun Jun 18 16:44:21 UTC 2023","173271","","JIT-Web-001h02-PAGE-DEFECT-Expand-Collapse-folder","","JIT-Web-001h02-PAGE-DEFECT-Expand-Collapse-folder","[PAGE - DEFECT] As a user, I can check DEFECT expand and collapse folder","[PAGE - DEFECT] As a user, I can check DEFECT expand and collapse folder",""
"passed","Sun Jun 18 16:11:07 UTC 2023","Sun Jun 18 16:12:19 UTC 2023","72138","","JIT-Database-011d-COLUMN-ENUM-delete-selected-items","","JIT-Database-011d-COLUMN-ENUM-delete-selected-items","[COLUMN] As a user, I should delete 1 selected item and check is will be removed in default dropdown","[COLUMN] As a user, I should delete 1 selected item and check is will be removed in default dropdown",""
"passed","Sun Jun 18 16:09:59 UTC 2023","Sun Jun 18 16:11:02 UTC 2023","62837","","JIT-Database-011b-COLUMN-ENUM-add-items","","JIT-Database-011b-COLUMN-ENUM-add-items","[COLUMN] As a user, I should add new item and select in default dropdown","[COLUMN] As a user, I should add new item and select in default dropdown",""
"passed","Sun Jun 18 17:39:46 UTC 2023","Sun Jun 18 17:43:20 UTC 2023","213590","","JIT-Web-011b-SETTING-PROJECT-VARIABLE-CSS-Check","","JIT-Web-011b-SETTING-PROJECT-VARIABLE-CSS-Check","[SETTING-PROJECT-VARIABLE-CSS] As a user, I can set value for the CSS field of the component","[SETTING-PROJECT-VARIABLE-CSS] As a user, I can set value for the CSS field of the component",""
"passed","Sun Jun 18 16:49:29 UTC 2023","Sun Jun 18 16:51:22 UTC 2023","113319","","JIT-Web-010a-LAYER-TREE-Check-edit-and-action","","JIT-Web-010a-LAYER-TREE-Check-edit-and-action","[LAYER-TREE] As a user, I could update the name of the node in the layer tree and copy,paste,delete,wrap the node","[LAYER-TREE] As a user, I could update the name of the node in the layer tree and copy,paste,delete,wrap the node",""
"passed","Sun Jun 18 16:17:23 UTC 2023","Sun Jun 18 16:18:30 UTC 2023","66340","","JIT-Database-017a-COLUMN-TEXT-STRING-Validation-message","","JIT-Database-017a-COLUMN-TEXT-STRING-Validation-message","[COLUMN-TEXT-VALIDATION] As a user, I validation locale message for TEXT column type","[COLUMN-TEXT-VALIDATION] As a user, I validation locale message for TEXT column type",""
"passed","Sun Jun 18 16:26:13 UTC 2023","Sun Jun 18 16:27:18 UTC 2023","65629","","JIT-Mobile-031b-DIVIDER-General-info","","JIT-Mobile-031b-DIVIDER-General-info","[MOBILE-DIVIDER] As a user, I should check the general infomation of Divider is correct: Name, Key, unique key, delete component","[MOBILE-DIVIDER] As a user, I should check the general infomation of Divider is correct: Name, Key, unique key, delete component",""
"passed","Sun Jun 18 17:07:25 UTC 2023","Sun Jun 18 17:08:41 UTC 2023","75431","","JIT-API-010b-DEFECT-Check-JSON-path","","JIT-API-010b-DEFECT-Check-JSON-path","As a user, I want to check the option in dropdown show correct JSON path.","As a user, I want to check the option in dropdown show correct JSON path.",""
"passed","Sun Jun 18 16:34:48 UTC 2023","Sun Jun 18 16:35:39 UTC 2023","50945","","JIT-Module-015b-SCOUT-edit-infos","","JIT-Module-015b-SCOUT-edit-infos","[SCOUT] As a user, I can update module Scout","[SCOUT] As a user, I can update module Scout",""
"passed","Sun Jun 18 16:11:41 UTC 2023","Sun Jun 18 16:12:36 UTC 2023","55352","","JIT-Database-011f-COLUMN-ENUM-duplicated","","JIT-Database-011f-COLUMN-ENUM-duplicated","[COLUMN] As a user, I should check counld not add duplicated item","[COLUMN] As a user, I should check counld not add duplicated item",""
"passed","Sun Jun 18 17:08:58 UTC 2023","Sun Jun 18 17:12:02 UTC 2023","183580","","JIT-Database-015c-INDEX-CRUD-multiple","","JIT-Database-015c-INDEX-CRUD-multiple","[INDEX] As a user, I check add and update single index","[INDEX] As a user, I check add and update single index",""
"passed","Sun Jun 18 16:24:28 UTC 2023","Sun Jun 18 16:25:38 UTC 2023","69940","","JIT-Mobile-026b-BUTTON-General-info","","JIT-Mobile-026b-BUTTON-General-info","[MOBILE-BUTTON] As a user, I should check the general infomation of Button is correct: Name, Key, unique key, delete component","[MOBILE-BUTTON] As a user, I should check the general infomation of Button is correct: Name, Key, unique key, delete component",""
"passed","Sun Jun 18 17:03:00 UTC 2023","Sun Jun 18 17:03:45 UTC 2023","45337","","JIT-API-007a-GROUP-API-CRUD","","JIT-API-007a-GROUP-API-CRUD","[GROUP-API] Create, update and delete group API","[GROUP-API] Create, update and delete group API",""
"passed","Sun Jun 18 16:13:43 UTC 2023","Sun Jun 18 16:14:42 UTC 2023","59413","","JIT-Database-013-DEFECT-Check-default-value-when-changing-type","","JIT-Database-013-DEFECT-Check-default-value-when-changing-type","[DEFECT] As a user, I should check the default value when changing the type","[DEFECT] As a user, I should check the default value when changing the type",""
"passed","Sun Jun 18 16:48:25 UTC 2023","Sun Jun 18 16:50:57 UTC 2023","151852","","JIT-Web-008a-ADMIN-PAGE-Create-new","","JIT-Web-008a-ADMIN-PAGE-Create-new","[ADMIN-PAGE] As a user, I can create new Admin page","[ADMIN-PAGE] As a user, I can create new Admin page",""
"passed","Sun Jun 18 17:12:13 UTC 2023","Sun Jun 18 17:14:09 UTC 2023","116565","","JIT-Database-015h-INDEX-DATE-column-config","","JIT-Database-015h-INDEX-DATE-column-config","[INDEX-DATE] As a user, I config index from column setting && check on index popup","[INDEX-DATE] As a user, I config index from column setting && check on index popup",""
"passed","Sun Jun 18 16:41:32 UTC 2023","Sun Jun 18 16:42:59 UTC 2023","86734","","JIT-Web-002a-MOLECULE-Create-new","","JIT-Web-002a-MOLECULE-Create-new","[WEB-MOLECULE] As a user, I can create new molecule with positive and negative cases","[WEB-MOLECULE] As a user, I can create new molecule with positive and negative cases",""
"passed","Sun Jun 18 16:59:49 UTC 2023","Sun Jun 18 17:01:35 UTC 2023","105574","","JIT-API-003c-POST-relation","","JIT-API-003c-POST-relation","As a user, I check column display when having relation for API POST","As a user, I check column display when having relation for API POST",""
"passed","Sun Jun 18 16:05:40 UTC 2023","Sun Jun 18 16:07:37 UTC 2023","116154","","JIT-Database-004-COLUMN-type-INTEGER","","JIT-Database-004-COLUMN-type-INTEGER","[COLUMN] As a user, I should check the validation of INTEGER column definition","[COLUMN] As a user, I should check the validation of INTEGER column definition",""
"passed","Sun Jun 18 16:15:03 UTC 2023","Sun Jun 18 16:16:34 UTC 2023","91136","","JIT-Database-016a-COUNTER-CACHE-Create-by-relation","","JIT-Database-016a-COUNTER-CACHE-Create-by-relation","[COUNTER-CACHE] create new counter cache column by selecting in relation popup","[COUNTER-CACHE] create new counter cache column by selecting in relation popup",""
"passed","Sun Jun 18 16:39:47 UTC 2023","Sun Jun 18 16:43:28 UTC 2023","220467","","JIT-Web-001h-PAGE-Create-multiple-level-slug","","JIT-Web-001h-PAGE-Create-multiple-level-slug","[PAGE] As a user, I can create new screen with multiple level slug","[PAGE] As a user, I can create new screen with multiple level slug",""
"passed","Sun Jun 18 17:33:19 UTC 2023","Sun Jun 18 17:33:56 UTC 2023","37572","","JIT-Module-014b-BASIC-AUTH-edit-infos","","JIT-Module-014b-BASIC-AUTH-edit-infos","[BASIC-AUTH] As a user, I can update module Basic Authentication","[BASIC-AUTH] As a user, I can update module Basic Authentication",""
"passed","Sun Jun 18 17:01:17 UTC 2023","Sun Jun 18 17:02:41 UTC 2023","84487","","JIT-API-004c-GET-detail-relation","","JIT-API-004c-GET-detail-relation","As a user, I check column display when having relation for GET-detail","As a user, I check column display when having relation for GET-detail",""
"passed","Sun Jun 18 18:27:33 UTC 2023","Sun Jun 18 18:34:59 UTC 2023","446529","","JIT-Preview-005-Preview-TOAST-MESSAGE","","JIT-Preview-005-Preview-TOAST-MESSAGE","[PREVIEW-TOAST-MESSAGE] As a user, I check preview function for Toast message action","[PREVIEW-TOAST-MESSAGE] As a user, I check preview function for Toast message action",""
"passed","Sun Jun 18 18:00:02 UTC 2023","Sun Jun 18 18:00:56 UTC 2023","53578","","JIT-Mobile-005b-MOLECULE-Navigate-edit-screen","","JIT-Mobile-005b-MOLECULE-Navigate-edit-screen","[MOBILE-MOLECULE-EDIT] As a user, I can see the molecule in Screen and use Edit button see the content of this molecule","[MOBILE-MOLECULE-EDIT] As a user, I can see the molecule in Screen and use Edit button see the content of this molecule",""
"passed","Sun Jun 18 16:32:49 UTC 2023","Sun Jun 18 16:34:05 UTC 2023","76240","","JIT-Module-006b-SMS-edit-infos","","JIT-Module-006b-SMS-edit-infos","[SMS], I can add module SMS login with Twilio and edit its infos","[SMS], I can add module SMS login with Twilio and edit its infos",""
"failed","Sun Jun 18 18:59:18 UTC 2023","Sun Jun 18 19:09:27 UTC 2023","609220","","JIT-Preview-009-Preview-FORM-DEFAULT-VALUE","","JIT-Preview-009-Preview-FORM-DEFAULT-VALUE","[PREVIEW-WEB-FORM-DEFAULT-VALUE] As a user, I check preview Form Default Value","[PREVIEW-WEB-FORM-DEFAULT-VALUE] As a user, I check preview Form Default Value",""
"passed","Sun Jun 18 16:09:27 UTC 2023","Sun Jun 18 16:11:27 UTC 2023","119230","","JIT-Database-010b-COLUMN-FILE-format-file","","JIT-Database-010b-COLUMN-FILE-format-file","[COLUMN] As a user, I should check the validation of FILE column definition for Format Area","[COLUMN] As a user, I should check the validation of FILE column definition for Format Area",""
"passed","Sun Jun 18 17:36:39 UTC 2023","Sun Jun 18 17:37:49 UTC 2023","69337","","JIT-Web-001b-PAGE-Update","","JIT-Web-001b-PAGE-Update","[PAGE] As a user, I can update page with positive and negative cases","[PAGE] As a user, I can update page with positive and negative cases",""
"passed","Sun Jun 18 16:42:46 UTC 2023","Sun Jun 18 16:44:35 UTC 2023","109202","","JIT-Web-002b-MOLECULE-Update","","JIT-Web-002b-MOLECULE-Update","[WEB-MOLECULE] As a user, I can update molecule with positive and negative cases","[WEB-MOLECULE] As a user, I can update molecule with positive and negative cases",""
"passed","Sun Jun 18 16:39:33 UTC 2023","Sun Jun 18 16:41:07 UTC 2023","93309","","JIT-Web-001g-PAGE-FIGMA-Import","","JIT-Web-001g-PAGE-FIGMA-Import","[PAGE-FIGMA] As a user, I can import the figma file to the jitera studio","[PAGE-FIGMA] As a user, I can import the figma file to the jitera studio",""
"passed","Sun Jun 18 16:56:05 UTC 2023","Sun Jun 18 16:57:55 UTC 2023","109895","","JIT-Web-012d-LOCALIZATION-UPDATE-page-sync-key","","JIT-Web-012d-LOCALIZATION-UPDATE-page-sync-key","[LOCALIZATION-UPDATE] As a user, I rename Page, auto-sync key of Text, Input and Textarea","[LOCALIZATION-UPDATE] As a user, I rename Page, auto-sync key of Text, Input and Textarea",""
"passed","Sun Jun 18 16:40:53 UTC 2023","Sun Jun 18 16:42:19 UTC 2023","85938","","JIT-Web-001h01-PAGE-DEFECT-Create-page-slug-contains-another-page","","JIT-Web-001h01-PAGE-DEFECT-Create-page-slug-contains-another-page","[PAGE - DEFECT] As a user, I can check DEFECT if create new page with slug contains existing page","[PAGE - DEFECT] As a user, I can check DEFECT if create new page with slug contains existing page",""
"passed","Sun Jun 18 18:16:05 UTC 2023","Sun Jun 18 18:17:29 UTC 2023","83563","","JIT-Database-015i-INDEX-DATETIME-column-config","","JIT-Database-015i-INDEX-DATETIME-column-config","[INDEX-DATETIME] As a user, I config index from column setting && check on index popup","[INDEX-DATETIME] As a user, I config index from column setting && check on index popup",""
"passed","Sun Jun 18 18:02:49 UTC 2023","Sun Jun 18 18:03:24 UTC 2023","35047","","JIT-Database-001e-TABLE-create-by-context-menu","","JIT-Database-001e-TABLE-create-by-context-menu","[TABLE] As a user, I can create new table by context menu","[TABLE] As a user, I can create new table by context menu",""
"passed","Sun Jun 18 17:05:28 UTC 2023","Sun Jun 18 17:07:02 UTC 2023","93572","","JIT-API-007f-DELETE-API-Add-new-endpoint","","JIT-API-007f-DELETE-API-Add-new-endpoint","[DELETE-API] Create, update and delete new DELETE API endpoint","[DELETE-API] Create, update and delete new DELETE API endpoint",""
"passed","Sun Jun 18 16:58:57 UTC 2023","Sun Jun 18 17:00:46 UTC 2023","108760","","JIT-API-002c-GET-list","","JIT-API-002c-GET-list","As a user, I check column display when having relation for GET-list","As a user, I check column display when having relation for GET-list",""
"passed","Sun Jun 18 16:10:44 UTC 2023","Sun Jun 18 16:11:49 UTC 2023","65683","","JIT-Database-011c-COLUMN-ENUM-delete-items","","JIT-Database-011c-COLUMN-ENUM-delete-items","[COLUMN] As a user, I should delete 1 item and check not display in default dropdown","[COLUMN] As a user, I should delete 1 item and check not display in default dropdown",""
"passed","Sun Jun 18 16:14:51 UTC 2023","Sun Jun 18 16:15:51 UTC 2023","59674","","JIT-Database-015a-INDEX-Check-duplicate-empty","","JIT-Database-015a-INDEX-Check-duplicate-empty","[INDEX] As a user, I check empty and duplicate index","[INDEX] As a user, I check empty and duplicate index",""
"passed","Sun Jun 18 16:21:27 UTC 2023","Sun Jun 18 16:23:44 UTC 2023","136332","","JIT-Mobile-012-JITDEF-remove-poperty-info-after-deleting-navigation","","JIT-Mobile-012-JITDEF-remove-poperty-info-after-deleting-navigation","[DEFECT] As a user, I should see the property infos need to be removed after the navigation was deleted","[DEFECT] As a user, I should see the property infos need to be removed after the navigation was deleted",""
"passed","Sun Jun 18 16:15:07 UTC 2023","Sun Jun 18 16:16:39 UTC 2023","91611","","JIT-Database-016b-COUNTER-CACHE-Create-by-adding-column","","JIT-Database-016b-COUNTER-CACHE-Create-by-adding-column","[COUNTER-CACHE] create new counter cache column by adding column","[COUNTER-CACHE] create new counter cache column by adding column",""
"passed","Sun Jun 18 16:44:59 UTC 2023","Sun Jun 18 16:46:31 UTC 2023","92677","","JIT-Web-002g-MOLECULE-CRUD-category","","JIT-Web-002g-MOLECULE-CRUD-category","[WEB-MOLECULE-EDIT] As a user, I can see the molecule in Page and use Edit button see the content of this molecule","[WEB-MOLECULE-EDIT] As a user, I can see the molecule in Page and use Edit button see the content of this molecule",""
"passed","Sun Jun 18 17:43:27 UTC 2023","Sun Jun 18 17:52:34 UTC 2023","546937","","JIT-Web-011g-SETTING-PROJECT-VARIABLE-CSS-DEFECT-Check-view-code","","JIT-Web-011g-SETTING-PROJECT-VARIABLE-CSS-DEFECT-Check-view-code","[SETTING-PROJECT-VARIABLE-VIEWCODE] As a user, I check View Code function with PV","[SETTING-PROJECT-VARIABLE-VIEWCODE] As a user, I check View Code function with PV",""
"passed","Sun Jun 18 17:32:31 UTC 2023","Sun Jun 18 17:33:11 UTC 2023","40366","","JIT-Module-014a-BASIC-AUTH-default","","JIT-Module-014a-BASIC-AUTH-default","[BASIC-AUTH] As a user, I can add module Basic Authentication and remove it","[BASIC-AUTH] As a user, I can add module Basic Authentication and remove it",""
"passed","Sun Jun 18 16:06:24 UTC 2023","Sun Jun 18 16:08:08 UTC 2023","103951","","JIT-Database-005-COLUMN-type-FLOAT","","JIT-Database-005-COLUMN-type-FLOAT","[COLUMN] As a user, I should check the validation of FLOAT column definition","[COLUMN] As a user, I should check the validation of FLOAT column definition",""
"passed","Sun Jun 18 18:43:03 UTC 2023","Sun Jun 18 18:52:28 UTC 2023","565086","","JIT-Preview-007-Preview-TABLE","","JIT-Preview-007-Preview-TABLE","[PREVIEW-WEB-TABLE] As a user, I check preview Table","[PREVIEW-WEB-TABLE] As a user, I check preview Table",""
"passed","Sun Jun 18 17:58:46 UTC 2023","Sun Jun 18 17:59:55 UTC 2023","68446","","JIT-Mobile-001a-SCREEN-Search","","JIT-Mobile-001a-SCREEN-Search","[MOBILE-SCREEN] As a user, I can search correct screen with keyword","[MOBILE-SCREEN] As a user, I can search correct screen with keyword",""
"passed","Sun Jun 18 16:18:15 UTC 2023","Sun Jun 18 16:19:10 UTC 2023","55412","","JIT-Database-017e-COLUMN-ENUM-Validation-message","","JIT-Database-017e-COLUMN-ENUM-Validation-message","[COLUMN-ENUM-VALIDATION] As a user, I validation locale message for ENUM column type","[COLUMN-ENUM-VALIDATION] As a user, I validation locale message for ENUM column type",""
"passed","Sun Jun 18 18:18:45 UTC 2023","Sun Jun 18 18:20:11 UTC 2023","85958","","JIT-API-003a-POST-check-default","","JIT-API-003a-POST-check-default","As a user, I check default value in API POST","As a user, I check default value in API POST",""
"passed","Sun Jun 18 16:31:42 UTC 2023","Sun Jun 18 16:32:40 UTC 2023","57829","","JIT-Module-004a-EMAIL-LOGIN-default","","JIT-Module-004a-EMAIL-LOGIN-default","[EMAIL-LOGIN] - Check adding and auto-generated API","[EMAIL-LOGIN] - Check adding and auto-generated API",""
"passed","Sun Jun 18 16:43:14 UTC 2023","Sun Jun 18 16:44:16 UTC 2023","62732","","JIT-Web-002c-MOLECULE-Delete","","JIT-Web-002c-MOLECULE-Delete","[WEB-MOLECULE] As a user, I can delete molecule","[WEB-MOLECULE] As a user, I can delete molecule",""
"passed","Sun Jun 18 16:32:25 UTC 2023","Sun Jun 18 16:34:16 UTC 2023","110932","","JIT-Module-005b-FORCE-MOBILE-UPDATE-api","","JIT-Module-005b-FORCE-MOBILE-UPDATE-api","[FORCE-MOBILE-UPDATE] - Check api","[FORCE-MOBILE-UPDATE] - Check api",""
