"Status","Start Time","Stop Time","Duration in ms","Parent Suite","Suite","Sub Suite","Test Class","Test Method","Name","Description"
"passed","Sun Jun 18 16:19:47 UTC 2023","Sun Jun 18 16:21:00 UTC 2023","73468","","JIT-Mobile-005-MOLECULE-Create-new","","JIT-Mobile-005-MOLECULE-Create-new","[MOBILE-MOLECULE] As a user, I can create new molecule with positive and negative cases","[MOBILE-MOLECULE] As a user, I can create new molecule with positive and negative cases",""
"passed","Sun Jun 18 16:21:28 UTC 2023","Sun Jun 18 16:22:54 UTC 2023","86684","","JIT-Mobile-011-JITDEF50-disable-add-duplicate-screen-in-stack","","JIT-Mobile-011-JITDEF50-disable-add-duplicate-screen-in-stack","[DEFECT] As a user, I could add duplicate screen in stack","[DEFECT] As a user, I could add duplicate screen in stack",""
"passed","Sun Jun 18 16:17:00 UTC 2023","Sun Jun 18 16:17:58 UTC 2023","57930","","JIT-Database-017d-COLUMN-FILE-Validation-message","","JIT-Database-017d-COLUMN-FILE-Validation-message","[COLUMN-FILE-VALIDATION] As a user, I validation locale message for FILE column type","[COLUMN-FILE-VALIDATION] As a user, I validation locale message for FILE column type",""
"passed","Sun Jun 18 16:44:48 UTC 2023","Sun Jun 18 16:46:05 UTC 2023","77240","","JIT-Web-002f-MOLECULE-Navigate-edit-screen","","JIT-Web-002f-MOLECULE-Navigate-edit-screen","[WEB-MOLECULE-EDIT] As a user, I can see the molecule in Page and use Edit button see the content of this molecule","[WEB-MOLECULE-EDIT] As a user, I can see the molecule in Page and use Edit button see the content of this molecule",""
"passed","Sun Jun 18 16:12:03 UTC 2023","Sun Jun 18 16:13:23 UTC 2023","79134","","JIT-Database-012a-RELATION-basic","","JIT-Database-012a-RELATION-basic","[RELATION] check the basic relation","[RELATION] check the basic relation",""
"passed","Sun Jun 18 18:52:35 UTC 2023","Sun Jun 18 18:59:11 UTC 2023","395764","","JIT-Preview-008-Preview-TEXT-HTML-TAG","","JIT-Preview-008-Preview-TEXT-HTML-TAG","[PREVIEW-WEB-TEXT-HTML-TAG] As a user, I check preview HTML tag of Text component","[PREVIEW-WEB-TEXT-HTML-TAG] As a user, I check preview HTML tag of Text component",""
"passed","Sun Jun 18 16:18:45 UTC 2023","Sun Jun 18 16:19:49 UTC 2023","63736","","JIT-Mobile-001-SCREEN-Create-new","","JIT-Mobile-001-SCREEN-Create-new","[MOBILE-SCREEN] As a user, I can create new screen with positive and negative cases","[MOBILE-SCREEN] As a user, I can create new screen with positive and negative cases",""
"passed","Sun Jun 18 18:07:37 UTC 2023","Sun Jun 18 18:09:09 UTC 2023","92616","","JIT-API-007ba-GET-list-API-Add-new-endpoint","","JIT-API-007ba-GET-list-API-Add-new-endpoint","[GET-list-API] Create, update and delete new GET API endpoint","[GET-list-API] Create, update and delete new GET API endpoint",""
"passed","Sun Jun 18 16:12:56 UTC 2023","Sun Jun 18 16:14:44 UTC 2023","107781","","JIT-Database-012e-RELATION-trigger-by-button","","JIT-Database-012e-RELATION-trigger-by-button","[RELATION] check the basic relation","[RELATION] check the basic relation",""
"passed","Sun Jun 18 16:28:46 UTC 2023","Sun Jun 18 16:32:04 UTC 2023","198536","","JIT-Mobile-041b-PREVIEW-NAVIGATION-with-navigation-setup","","JIT-Mobile-041b-PREVIEW-NAVIGATION-with-navigation-setup","[MOBILE-PREVIEW-NAVIGATION] As a user, I could open preview screen with setting the screen navigation","[MOBILE-PREVIEW-NAVIGATION] As a user, I could open preview screen with setting the screen navigation",""
"passed","Sun Jun 18 19:09:35 UTC 2023","Sun Jun 18 19:16:05 UTC 2023","389745","","JIT-Preview-010-Preview-LOCALIZATION","","JIT-Preview-010-Preview-LOCALIZATION","[PREVIEW-WEB-LOCALIZATION] As a user, I check preview Localization","[PREVIEW-WEB-LOCALIZATION] As a user, I check preview Localization",""
"passed","Sun Jun 18 18:10:43 UTC 2023","Sun Jun 18 18:12:58 UTC 2023","134698","","JIT-API-009-Auto-fill","","JIT-API-009-Auto-fill","[AUTO-FILL] As a user, I could add request param by Auto-fill","[AUTO-FILL] As a user, I could add request param by Auto-fill",""
"passed","Sun Jun 18 17:05:00 UTC 2023","Sun Jun 18 17:06:58 UTC 2023","117423","","JIT-API-007e-PUT-API-Add-new-endpoint","","JIT-API-007e-PUT-API-Add-new-endpoint","[PUT-API] Create, update and delete new PUT API endpoint","[PUT-API] Create, update and delete new PUT API endpoint",""
"passed","Sun Jun 18 16:36:03 UTC 2023","Sun Jun 18 16:36:54 UTC 2023","50394","","JIT-Module-019a-GOOGLE-ANALYTICS-default","","JIT-Module-019a-GOOGLE-ANALYTICS-default","[GOOGLE-ANALYTICS] As a user, I can add module Google Analytics and remove it","[GOOGLE-ANALYTICS] As a user, I can add module Google Analytics and remove it",""
"passed","Sun Jun 18 16:24:57 UTC 2023","Sun Jun 18 16:26:14 UTC 2023","76858","","JIT-Mobile-028b-ICON-General-info","","JIT-Mobile-028b-ICON-General-info","[MOBILE-ICON] As a user, I should check the general infomation of Icon is correct: Name, Key, unique key, delete component","[MOBILE-ICON] As a user, I should check the general infomation of Icon is correct: Name, Key, unique key, delete component",""
"passed","Sun Jun 18 16:09:11 UTC 2023","Sun Jun 18 16:10:25 UTC 2023","74020","","JIT-Database-010a-COLUMN-FILE-validation","","JIT-Database-010a-COLUMN-FILE-validation","[COLUMN] As a user, I should check the validation of FILE column definition","[COLUMN] As a user, I should check the validation of FILE column definition",""
"passed","Sun Jun 18 16:27:48 UTC 2023","Sun Jun 18 16:28:50 UTC 2023","61963","","JIT-Mobile-035b-FLATLIST-General-info","","JIT-Mobile-035b-FLATLIST-General-info","[MOBILE-FLATLIST] As a user, I should check the general infomation of FlatList is correct: Name, Key, unique key, delete component","[MOBILE-FLATLIST] As a user, I should check the general infomation of FlatList is correct: Name, Key, unique key, delete component",""
"passed","Sun Jun 18 17:12:01 UTC 2023","Sun Jun 18 17:13:52 UTC 2023","111365","","JIT-Database-015g-INDEX-FLOAT-column-config","","JIT-Database-015g-INDEX-FLOAT-column-config","[INDEX-FLOAT] As a user, I config index from column setting && check on index popup","[INDEX-FLOAT] As a user, I config index from column setting && check on index popup",""
"passed","Sun Jun 18 17:02:47 UTC 2023","Sun Jun 18 17:04:43 UTC 2023","115530","","JIT-API-006a-DELETE-check-default","","JIT-API-006a-DELETE-check-default","As a user, I check default value in API DELETE","As a user, I check default value in API DELETE",""
"passed","Sun Jun 18 16:09:46 UTC 2023","Sun Jun 18 16:10:54 UTC 2023","67746","","JIT-Database-011a-COLUMN-ENUM-default","","JIT-Database-011a-COLUMN-ENUM-default","[COLUMN] As a user, I should check the basic validation","[COLUMN] As a user, I should check the basic validation",""
"passed","Sun Jun 18 16:52:18 UTC 2023","Sun Jun 18 16:55:02 UTC 2023","163306","","JIT-Web-011f-SETTING-PROJECT-VARIABLE-CSS-DEFECT-Check-icon-image","","JIT-Web-011f-SETTING-PROJECT-VARIABLE-CSS-DEFECT-Check-icon-image","[SETTING-PROJECT-VARIABLE-CSS-DEFECT] As a user, I check icon and image can apply to PV without error","[SETTING-PROJECT-VARIABLE-CSS-DEFECT] As a user, I check icon and image can apply to PV without error",""
"passed","Sun Jun 18 18:06:16 UTC 2023","Sun Jun 18 18:07:29 UTC 2023","73024","","JIT-API-005c-PUT-relation","","JIT-API-005c-PUT-relation","As a user, I check column display when having relation for API PUT","As a user, I check column display when having relation for API PUT",""
"passed","Sun Jun 18 18:13:05 UTC 2023","Sun Jun 18 18:14:29 UTC 2023","83578","","JIT-Database-015e-INDEX-TEXT-column-config","","JIT-Database-015e-INDEX-TEXT-column-config","[INDEX-TEXT] As a user, I config index from column setting && check on index popup","[INDEX-TEXT] As a user, I config index from column setting && check on index popup",""
"passed","Sun Jun 18 16:12:46 UTC 2023","Sun Jun 18 16:14:31 UTC 2023","105538","","JIT-Database-012d-RELATION-multiple-2-direction","","JIT-Database-012d-RELATION-multiple-2-direction","[RELATION], I should add multiple relation 2 directions","[RELATION], I should add multiple relation 2 directions",""
"passed","Sun Jun 18 18:35:06 UTC 2023","Sun Jun 18 18:42:55 UTC 2023","468891","","JIT-Preview-006-Preview-FORM-VALIDATION","","JIT-Preview-006-Preview-FORM-VALIDATION","[PREVIEW-WEB-FORM-VALIDATION] As a user, I check preview Form Validation","[PREVIEW-WEB-FORM-VALIDATION] As a user, I check preview Form Validation",""
"passed","Sun Jun 18 17:13:43 UTC 2023","Sun Jun 18 17:15:43 UTC 2023","119911","","JIT-Database-015m-INDEX-ALL-column-config","","JIT-Database-015m-INDEX-ALL-column-config","[INDEX-ALL] As a user, I config with multiple column and check show multiple on index pop-up","[INDEX-ALL] As a user, I config with multiple column and check show multiple on index pop-up",""
"passed","Sun Jun 18 16:38:20 UTC 2023","Sun Jun 18 16:39:25 UTC 2023","64922","","JIT-Web-001c-PAGE-Delete","","JIT-Web-001c-PAGE-Delete","[PAGE] As a user, I can delete page","[PAGE] As a user, I can delete page",""
"passed","Sun Jun 18 16:37:09 UTC 2023","Sun Jun 18 16:38:16 UTC 2023","67055","","JIT-Team-005-Invite-duplicate-email","","JIT-Team-005-Invite-duplicate-email","[INVITE-DELETE] Invite new email and invite again","[INVITE-DELETE] Invite new email and invite again",""
"passed","Sun Jun 18 16:28:43 UTC 2023","Sun Jun 18 16:29:37 UTC 2023","53714","","JIT-Mobile-041a-PREVIEW-NAVIGATION-no-navigation-setup","","JIT-Mobile-041a-PREVIEW-NAVIGATION-no-navigation-setup","[MOBILE-PREVIEW-NAVIGATION] As a user, I could open preview screen with notification should setup the screen navigation","[MOBILE-PREVIEW-NAVIGATION] As a user, I could open preview screen with notification should setup the screen navigation",""
"passed","Sun Jun 18 16:07:49 UTC 2023","Sun Jun 18 16:08:53 UTC 2023","64144","","JIT-Database-008-COLUMN-type-DATE-TIME","","JIT-Database-008-COLUMN-type-DATE-TIME","[COLUMN] As a user, I should check the validation of DATETIME column definition","[COLUMN] As a user, I should check the validation of DATETIME column definition",""
"passed","Sun Jun 18 16:26:00 UTC 2023","Sun Jun 18 16:27:09 UTC 2023","69110","","JIT-Mobile-030b-WEBVIEW-General-info","","JIT-Mobile-030b-WEBVIEW-General-info","[MOBILE-WEBVIEW] As a user, I should check the general infomation of Webview is correct: Name, Key, unique key, delete component","[MOBILE-WEBVIEW] As a user, I should check the general infomation of Webview is correct: Name, Key, unique key, delete component",""
"passed","Sun Jun 18 16:06:51 UTC 2023","Sun Jun 18 16:09:28 UTC 2023","157381","","JIT-Database-007-COLUMN-type-TEXT","","JIT-Database-007-COLUMN-type-TEXT","[COLUMN] As a user, I should check the validation of TEXT column definition","[COLUMN] As a user, I should check the validation of TEXT column definition",""
"passed","Sun Jun 18 16:47:40 UTC 2023","Sun Jun 18 16:49:59 UTC 2023","138389","","JIT-Web-007b-ASSET-Rename-and-delete","","JIT-Web-007b-ASSET-Rename-and-delete","[ASSET] As a user, I can rename and delete image asset","[ASSET] As a user, I can rename and delete image asset",""
"passed","Sun Jun 18 16:51:22 UTC 2023","Sun Jun 18 16:55:22 UTC 2023","239587","","JIT-Web-011c-SETTING-PROJECT-VARIABLE-CSS-Check-update-PV","","JIT-Web-011c-SETTING-PROJECT-VARIABLE-CSS-Check-update-PV","[SETTING-PROJECT-VARIABLE-CSS] As a user, I update the PV name & value, check reflection on edtior","[SETTING-PROJECT-VARIABLE-CSS] As a user, I update the PV name & value, check reflection on edtior",""
"passed","Sun Jun 18 17:01:20 UTC 2023","Sun Jun 18 17:03:31 UTC 2023","131545","","JIT-API-005a-PUT-check-default","","JIT-API-005a-PUT-check-default","As a user, I check default value in API PUT","As a user, I check default value in API PUT",""
"passed","Sun Jun 18 16:38:35 UTC 2023","Sun Jun 18 16:41:08 UTC 2023","153129","","JIT-Web-001e-PAGE-Search","","JIT-Web-001e-PAGE-Search","[WEB-PAGE] As a user, I can search correct screen with keyword","[WEB-PAGE] As a user, I can search correct screen with keyword",""
"passed","Sun Jun 18 16:55:25 UTC 2023","Sun Jun 18 16:57:21 UTC 2023","116653","","JIT-Web-012a-LOCALIZATION-CRUD","","JIT-Web-012a-LOCALIZATION-CRUD","[LOCALIZATION-CRUD] As a user, I want to CRUD 1 localization","[LOCALIZATION-CRUD] As a user, I want to CRUD 1 localization",""
"passed","Sun Jun 18 17:04:29 UTC 2023","Sun Jun 18 17:06:21 UTC 2023","111963","","JIT-API-007d-POST-API-Add-new-endpoint","","JIT-API-007d-POST-API-Add-new-endpoint","[GET-POST] Create, update and delete new POST API endpoint","[GET-POST] Create, update and delete new POST API endpoint",""
"passed","Sun Jun 18 16:20:49 UTC 2023","Sun Jun 18 16:21:55 UTC 2023","65819","","JIT-Mobile-007-MOLECULE-Delete","","JIT-Mobile-007-MOLECULE-Delete","[MOBILE-MOLECULE] As a user, I can delete molecule","[MOBILE-MOLECULE] As a user, I can delete molecule",""
"passed","Sun Jun 18 16:19:16 UTC 2023","Sun Jun 18 16:20:49 UTC 2023","93293","","JIT-Mobile-002-SCREEN-Update","","JIT-Mobile-002-SCREEN-Update","[MOBILE-SCREEN] As a user, I can update screen with positive and negative cases","[MOBILE-SCREEN] As a user, I can update screen with positive and negative cases",""
"passed","Sun Jun 18 16:19:28 UTC 2023","Sun Jun 18 16:20:20 UTC 2023","52123","","JIT-Mobile-003-SCREEN-Delete","","JIT-Mobile-003-SCREEN-Delete","[MOBILE-SCREEN] As a user, I can delete screen","[MOBILE-SCREEN] As a user, I can delete screen",""
"passed","Sun Jun 18 16:22:05 UTC 2023","Sun Jun 18 16:23:44 UTC 2023","98995","","JIT-Mobile-013-JITDEF-reflect-delete-screen-innavigation-tree","","JIT-Mobile-013-JITDEF-reflect-delete-screen-innavigation-tree","[DEFECT] As a user, I should see screen will be removed in navigation tree after deleting screen","[DEFECT] As a user, I should see screen will be removed in navigation tree after deleting screen",""
"passed","Sun Jun 18 16:11:21 UTC 2023","Sun Jun 18 16:12:21 UTC 2023","60777","","JIT-Database-011e-COLUMN-ENUM-delete-all","","JIT-Database-011e-COLUMN-ENUM-delete-all","[COLUMN] As a user, I should delete all items and check all items are not displayed","[COLUMN] As a user, I should delete all items and check all items are not displayed",""
"passed","Sun Jun 18 16:55:42 UTC 2023","Sun Jun 18 16:57:37 UTC 2023","114892","","JIT-Web-012c-LOCALIZATION-Remove-Use-Unused","","JIT-Web-012c-LOCALIZATION-Remove-Use-Unused","[LOCALIZATION-REMOVE] As a user, I can remove, check Used or Unused key","[LOCALIZATION-REMOVE] As a user, I can remove, check Used or Unused key",""
"passed","Sun Jun 18 17:06:40 UTC 2023","Sun Jun 18 17:08:16 UTC 2023","96784","","JIT-API-008-DEFECT-Check-column-file-type","","JIT-API-008-DEFECT-Check-column-file-type","[DEFECT] As a user, I check column type file not display in request params of GET list Api","[DEFECT] As a user, I check column type file not display in request params of GET list Api",""
"passed","Sun Jun 18 17:54:50 UTC 2023","Sun Jun 18 17:55:19 UTC 2023","28885","","JIT-Database-001b-TABLE-empty","","JIT-Database-001b-TABLE-empty","[TABLE] As a user, I cannot create table with empty name","[TABLE] As a user, I cannot create table with empty name",""
"passed","Sun Jun 18 16:31:47 UTC 2023","Sun Jun 18 16:33:08 UTC 2023","80669","","JIT-Module-005a-FORCE-MOBILE-UPDATE-database","","JIT-Module-005a-FORCE-MOBILE-UPDATE-database","[FORCE-MOBILE-UPDATE] - Check adding and auto-table & columns","[FORCE-MOBILE-UPDATE] - Check adding and auto-table & columns",""
"passed","Sun Jun 18 17:34:04 UTC 2023","Sun Jun 18 17:34:49 UTC 2023","45636","","JIT-Module-015a-SCOUT-default","","JIT-Module-015a-SCOUT-default","[SCOUT] As a user, I can add module Scout and remove it","[SCOUT] As a user, I can add module Scout and remove it",""
"passed","Sun Jun 18 16:12:39 UTC 2023","Sun Jun 18 16:14:16 UTC 2023","97092","","JIT-Database-012c-RELATION-multiple-1-direction","","JIT-Database-012c-RELATION-multiple-1-direction","[RELATION], I should add multiple relation 1 direction","[RELATION], I should add multiple relation 1 direction",""
"passed","Sun Jun 18 16:08:23 UTC 2023","Sun Jun 18 16:09:43 UTC 2023","80006","","JIT-Database-009-COLUMN-type-BOOLEAN","","JIT-Database-009-COLUMN-type-BOOLEAN","[COLUMN] As a user, I should check the validation of BOOLEAN column definition","[COLUMN] As a user, I should check the validation of BOOLEAN column definition",""
"passed","Sun Jun 18 16:16:05 UTC 2023","Sun Jun 18 16:17:23 UTC 2023","78148","","JIT-Database-017a-COLUMN-TEXT-STRING-Validation-message","","JIT-Database-017a-COLUMN-TEXT-STRING-Validation-message","[COLUMN-STRING-VALIDATION] As a user, I validation locale message for STRING column type","[COLUMN-STRING-VALIDATION] As a user, I validation locale message for STRING column type",""
"passed","Sun Jun 18 16:23:06 UTC 2023","Sun Jun 18 16:24:17 UTC 2023","70871","","JIT-Mobile-015-VIEW-General-info","","JIT-Mobile-015-VIEW-General-info","[MOBILE-VIEW] As a user, I should check the general infomation of View is correct: Name, Key, unique key, delete component","[MOBILE-VIEW] As a user, I should check the general infomation of View is correct: Name, Key, unique key, delete component",""
"passed","Sun Jun 18 17:52:42 UTC 2023","Sun Jun 18 17:53:55 UTC 2023","73074","","JIT-Web-012b-LOCALIZATION-Generate-code","","JIT-Web-012b-LOCALIZATION-Generate-code","[LOCALIZATION-CODE] As a user, I can view code, export Nextjs web and Quick Preview to see localization content of each language","[LOCALIZATION-CODE] As a user, I can view code, export Nextjs web and Quick Preview to see localization content of each language",""
"passed","Sun Jun 18 16:58:46 UTC 2023","Sun Jun 18 17:00:54 UTC 2023","128315","","JIT-API-002a-GET-list-check-default","","JIT-API-002a-GET-list-check-default","As a user, I check default value in API GET list","As a user, I check default value in API GET list",""
"passed","Sun Jun 18 18:03:32 UTC 2023","Sun Jun 18 18:04:16 UTC 2023","43804","","JIT-Mobile-021-DEFECT.Params.keep-params-after-refresh-page","","JIT-Mobile-021-DEFECT.Params.keep-params-after-refresh-page","[DEFECT] As a user, I should check the params will be kept after refresh page","[DEFECT] As a user, I should check the params will be kept after refresh page",""
"passed","Sun Jun 18 16:05:22 UTC 2023","Sun Jun 18 16:06:22 UTC 2023","59912","","JIT-Database-002-COLUMN-default","","JIT-Database-002-COLUMN-default","[COLUMN] As a user, I should see the default column definition","[COLUMN] As a user, I should see the default column definition",""
"passed","Sun Jun 18 16:26:36 UTC 2023","Sun Jun 18 16:27:41 UTC 2023","65107","","JIT-Mobile-032b-CAROUSEL-General-info","","JIT-Mobile-032b-CAROUSEL-General-info","[MOBILE-CAROUSEL] As a user, I should check the general infomation of Carousel is correct: Name, Key, unique key, delete component","[MOBILE-CAROUSEL] As a user, I should check the general infomation of Carousel is correct: Name, Key, unique key, delete component",""
"passed","Sun Jun 18 16:36:08 UTC 2023","Sun Jun 18 16:36:51 UTC 2023","43320","","JIT-Module-019b-GOOGLE-ANALYTICS-edit-infos","","JIT-Module-019b-GOOGLE-ANALYTICS-edit-infos","[GOOGLE-ANALYTICS] As a user, I can update module Google Analytics information for each environment","[GOOGLE-ANALYTICS] As a user, I can update module Google Analytics information for each environment",""
"passed","Sun Jun 18 18:04:23 UTC 2023","Sun Jun 18 18:05:02 UTC 2023","39168","","JIT-Database-003a-COLUMN-empty","","JIT-Database-003a-COLUMN-empty","[COLUMN] As a user, I cannot add empty column definition","[COLUMN] As a user, I cannot add empty column definition",""
"passed","Sun Jun 18 17:09:49 UTC 2023","Sun Jun 18 17:11:37 UTC 2023","107394","","JIT-Database-015d-INDEX-STRING-column-config","","JIT-Database-015d-INDEX-STRING-column-config","[INDEX-STRING] As a user, I config index from column setting && check on index popup","[INDEX-STRING] As a user, I config index from column setting && check on index popup",""
"passed","Sun Jun 18 16:51:35 UTC 2023","Sun Jun 18 16:55:19 UTC 2023","223750","","JIT-Web-011d-SETTING-PROJECT-VARIABLE-CSS-Check-deleting-PV","","JIT-Web-011d-SETTING-PROJECT-VARIABLE-CSS-Check-deleting-PV","[SETTING-PROJECT-VARIABLE-CSS] As a user, I delete the PV,  should show the static value of the deleted PV","[SETTING-PROJECT-VARIABLE-CSS] As a user, I delete the PV,  should show the static value of the deleted PV",""
"passed","Sun Jun 18 16:24:07 UTC 2023","Sun Jun 18 16:25:10 UTC 2023","62373","","JIT-Mobile-022a-TEXT-General-info","","JIT-Mobile-022a-TEXT-General-info","[MOBILE-TEXT] As a user, I should check the general infomation of Text is correct: Name, Key, unique key, delete component","[MOBILE-TEXT] As a user, I should check the general infomation of Text is correct: Name, Key, unique key, delete component",""
"passed","Sun Jun 18 16:06:39 UTC 2023","Sun Jun 18 16:09:15 UTC 2023","155415","","JIT-Database-006-COLUMN-type-STRING","","JIT-Database-006-COLUMN-type-STRING","[COLUMN] As a user, I should check the validation of STRING column definition","[COLUMN] As a user, I should check the validation of STRING column definition",""
"passed","Sun Jun 18 16:49:27 UTC 2023","Sun Jun 18 16:51:04 UTC 2023","97335","","JIT-Web-009a-TABLE-Add-new","","JIT-Web-009a-TABLE-Add-new","[TABLE] As a user, I can create new Admin page","[TABLE] As a user, I can create new Admin page",""
"passed","Sun Jun 18 17:54:02 UTC 2023","Sun Jun 18 17:54:42 UTC 2023","39953","","JIT-Database-001a-TABLE-new","","JIT-Database-001a-TABLE-new","[TABLE] As a user, I can create new table","[TABLE] As a user, I can create new table",""
"passed","Sun Jun 18 16:50:20 UTC 2023","Sun Jun 18 16:52:04 UTC 2023","103844","","JIT-Web-011a-SETTING-PROJECT-VARIABLE","","JIT-Web-011a-SETTING-PROJECT-VARIABLE","[SETTING-PROJECT-VARIABLE] As a user, I can CRUD the Project Variable","[SETTING-PROJECT-VARIABLE] As a user, I can CRUD the Project Variable",""
"passed","Sun Jun 18 17:03:48 UTC 2023","Sun Jun 18 17:06:27 UTC 2023","158555","","JIT-API-007bb-GET-list-API-Check-datetime-static-value","","JIT-API-007bb-GET-list-API-Check-datetime-static-value","[GET-list-API] Set datetime static value","[GET-list-API] Set datetime static value",""
"passed","Sun Jun 18 16:56:27 UTC 2023","Sun Jun 18 16:58:19 UTC 2023","111955","","JIT-Web-012e-LOCALIZATION-REUSE-UPDATE-value-locale","","JIT-Web-012e-LOCALIZATION-REUSE-UPDATE-value-locale","[LOCALIZATION-REUSE-UPDATE] As a user, I can reuse this locale value for other component and reflect when updating","[LOCALIZATION-REUSE-UPDATE] As a user, I can reuse this locale value for other component and reflect when updating",""
"passed","Sun Jun 18 18:01:49 UTC 2023","Sun Jun 18 18:02:42 UTC 2023","53265","","JIT-Mobile-014-JITDEF-status-bar","","JIT-Mobile-014-JITDEF-status-bar","[DEFECT] As a user, I should see screen will be removed in navigation tree after deleting screen","[DEFECT] As a user, I should see screen will be removed in navigation tree after deleting screen",""
"passed","Sun Jun 18 17:01:03 UTC 2023","Sun Jun 18 17:02:52 UTC 2023","109068","","JIT-API-004a-GET-detail-check-default","","JIT-API-004a-GET-detail-check-default","As a user, I check default value in API GET-detail","As a user, I check default value in API GET-detail",""
"passed","Sun Jun 18 16:31:09 UTC 2023","Sun Jun 18 16:32:09 UTC 2023","59867","","JIT-Module-002b-DEEPLINK-edit-infos","","JIT-Module-002b-DEEPLINK-edit-infos","As a user, I can update module Deeplink","As a user, I can update module Deeplink",""
"passed","Sun Jun 18 17:08:46 UTC 2023","Sun Jun 18 17:11:44 UTC 2023","178062","","JIT-Database-015b-INDEX-CRUD-single","","JIT-Database-015b-INDEX-CRUD-single","[INDEX] As a user, I check add and update multiple index","[INDEX] As a user, I check add and update multiple index",""
"passed","Sun Jun 18 16:29:00 UTC 2023","Sun Jun 18 16:30:26 UTC 2023","85975","","JIT-Mobile-042a-ACTION-NAVIGATION-no-param","","JIT-Mobile-042a-ACTION-NAVIGATION-no-param","[MOBILE-ACTION-NAVIGATION] As a user, I could add action type navigation without params and check preview code","[MOBILE-ACTION-NAVIGATION] As a user, I could add action type navigation without params and check preview code",""
"passed","Sun Jun 18 17:34:57 UTC 2023","Sun Jun 18 17:35:34 UTC 2023","37166","","JIT-Module-017a-GOOGLE-ANAL-default","","JIT-Module-017a-GOOGLE-ANAL-default","[GOOGLE-ANAL] As a user, I can add module Google Analytics and remove it","[GOOGLE-ANAL] As a user, I can add module Google Analytics and remove it",""
"passed","Sun Jun 18 17:07:14 UTC 2023","Sun Jun 18 17:08:26 UTC 2023","72259","","JIT-API-010a-DEFECT-Check-special-symbol-request-param","","JIT-API-010a-DEFECT-Check-special-symbol-request-param","As a user, I want to validate and prevent the special symbol for request params.","As a user, I want to validate and prevent the special symbol for request params.",""
"passed","Sun Jun 18 17:13:43 UTC 2023","Sun Jun 18 17:15:25 UTC 2023","101848","","JIT-Database-015l-INDEX-ENUM-column-config","","JIT-Database-015l-INDEX-ENUM-column-config","[INDEX-ENUM] As a user, I config index from column setting && check on index popup","[INDEX-ENUM] As a user, I config index from column setting && check on index popup",""
"passed","Sun Jun 18 18:01:03 UTC 2023","Sun Jun 18 18:01:41 UTC 2023","37868","","JIT-Database-001d-TABLE-update","","JIT-Database-001d-TABLE-update","[TABLE] As a user, I can update the value of the table","[TABLE] As a user, I can update the value of the table",""
"passed","Sun Jun 18 18:17:36 UTC 2023","Sun Jun 18 18:18:38 UTC 2023","61855","","JIT-Database-015k-INDEX-BOOLEAN-column-config","","JIT-Database-015k-INDEX-BOOLEAN-column-config","[INDEX-BOOLEAN] As a user, I config index from column setting && check on index popup","[INDEX-BOOLEAN] As a user, I config index from column setting && check on index popup",""
