"Status","Start Time","Stop Time","Duration in ms","Parent Suite","Suite","Sub Suite","Test Class","Test Method","Name","Description"
"passed","Mon Feb 27 07:37:41 UTC 2023","Mon Feb 27 07:55:53 UTC 2023","1091964","","JIT-Preview-007-Preview-TABLE","","JIT-Preview-007-Preview-TABLE","[PREVIEW-WEB-TABLE] As a user, I check preview Table","[PREVIEW-WEB-TABLE] As a user, I check preview Table",""
"passed","Mon Feb 27 07:37:41 UTC 2023","Mon Feb 27 07:38:48 UTC 2023","66594","","JIT-Web-004a-ACTION-NAVIGATION-no-param","","JIT-Web-004a-ACTION-NAVIGATION-no-param","[WEB-ACTION-NAVIGATION] As a user, I could add action type navigation without params and check preview code","[WEB-ACTION-NAVIGATION] As a user, I could add action type navigation without params and check preview code",""
"passed","Mon Feb 27 07:22:08 UTC 2023","Mon Feb 27 07:23:20 UTC 2023","71593","","JIT-Mobile-042a-ACTION-NAVIGATION-no-param","","JIT-Mobile-042a-ACTION-NAVIGATION-no-param","[MOBILE-ACTION-NAVIGATION] As a user, I could add action type navigation without params and check preview code","[MOBILE-ACTION-NAVIGATION] As a user, I could add action type navigation without params and check preview code",""
"passed","Mon Feb 27 07:22:09 UTC 2023","Mon Feb 27 07:35:33 UTC 2023","804552","","JIT-Preview-005-Preview-TOAST-MESSAGE","","JIT-Preview-005-Preview-TOAST-MESSAGE","[PREVIEW-TOAST-MESSAGE] As a user, I check preview function for Toast message action","[PREVIEW-TOAST-MESSAGE] As a user, I check preview function for Toast message action",""
"passed","Mon Feb 27 07:22:09 UTC 2023","Mon Feb 27 07:34:41 UTC 2023","752529","","JIT-Preview-004-Preview-BUTTON","","JIT-Preview-004-Preview-BUTTON","[PREVIEW-BUTTON] As a user, I check preview function for Button component","[PREVIEW-BUTTON] As a user, I check preview function for Button component",""
