"Status","Start Time","Stop Time","Duration in ms","Parent Suite","Suite","Sub Suite","Test Class","Test Method","Name","Description"
"passed","Thu Apr 20 16:08:41 UTC 2023","Thu Apr 20 16:09:47 UTC 2023","65800","","JIT-Database-011a-COLUMN-ENUM-default","","JIT-Database-011a-COLUMN-ENUM-default","[COLUMN] As a user, I should check the basic validation","[COLUMN] As a user, I should check the basic validation",""
"passed","Thu Apr 20 17:34:45 UTC 2023","Thu Apr 20 17:35:22 UTC 2023","36521","","JIT-Database-001a-TABLE-new","","JIT-Database-001a-TABLE-new","[TABLE] As a user, I can create new table","[TABLE] As a user, I can create new table",""
"passed","Thu Apr 20 16:26:19 UTC 2023","Thu Apr 20 16:27:47 UTC 2023","87953","","JIT-Module-006a-SMS-default","","JIT-Module-006a-SMS-default","[SMS], I can add module SMS login with Twilio and remove it","[SMS], I can add module SMS login with Twilio and remove it",""
"passed","Thu Apr 20 16:41:45 UTC 2023","Thu Apr 20 16:42:46 UTC 2023","60699","","JIT-Web-009a-TABLE-Add-new","","JIT-Web-009a-TABLE-Add-new","[TABLE] As a user, I can create new Admin page","[TABLE] As a user, I can create new Admin page",""
"passed","Thu Apr 20 16:04:49 UTC 2023","Thu Apr 20 16:05:48 UTC 2023","59152","","JIT-Database-003b-COLUMN-duplicated","","JIT-Database-003b-COLUMN-duplicated","[COLUMN] As a user, I cannot add duplicated column definition","[COLUMN] As a user, I cannot add duplicated column definition",""
"passed","Thu Apr 20 16:59:08 UTC 2023","Thu Apr 20 17:00:37 UTC 2023","88995","","JIT-Database-015i-INDEX-DATETIME-column-config","","JIT-Database-015i-INDEX-DATETIME-column-config","[INDEX-DATETIME] As a user, I config index from column setting && check on index popup","[INDEX-DATETIME] As a user, I config index from column setting && check on index popup",""
"passed","Thu Apr 20 16:50:06 UTC 2023","Thu Apr 20 16:50:46 UTC 2023","40218","","JIT-API-007a-GROUP-API-CRUD","","JIT-API-007a-GROUP-API-CRUD","[GROUP-API] Create, update and delete group API","[GROUP-API] Create, update and delete group API",""
"passed","Thu Apr 20 17:17:17 UTC 2023","Thu Apr 20 17:17:53 UTC 2023","35525","","JIT-Module-014b-BASIC-AUTH-edit-infos","","JIT-Module-014b-BASIC-AUTH-edit-infos","[BASIC-AUTH] As a user, I can update module Basic Authentication","[BASIC-AUTH] As a user, I can update module Basic Authentication",""
"passed","Thu Apr 20 16:31:57 UTC 2023","Thu Apr 20 16:33:44 UTC 2023","107260","","JIT-Web-001f-PAGE-Export-and-import","","JIT-Web-001f-PAGE-Export-and-import","[PAGE] As a user, I can create new screen by import and export the screen","[PAGE] As a user, I can create new screen by import and export the screen",""
"passed","Thu Apr 20 16:57:26 UTC 2023","Thu Apr 20 16:58:51 UTC 2023","84883","","JIT-Database-015e-INDEX-TEXT-column-config","","JIT-Database-015e-INDEX-TEXT-column-config","[INDEX-TEXT] As a user, I config index from column setting && check on index popup","[INDEX-TEXT] As a user, I config index from column setting && check on index popup",""
"passed","Thu Apr 20 16:58:14 UTC 2023","Thu Apr 20 16:59:46 UTC 2023","91513","","JIT-Database-015f-INDEX-INTEGER-column-config","","JIT-Database-015f-INDEX-INTEGER-column-config","[INDEX-INTEGER] As a user, I config index from column setting && check on index popup","[INDEX-INTEGER] As a user, I config index from column setting && check on index popup",""
"passed","Thu Apr 20 16:06:59 UTC 2023","Thu Apr 20 16:07:51 UTC 2023","52330","","JIT-Database-008-COLUMN-type-DATE-TIME","","JIT-Database-008-COLUMN-type-DATE-TIME","[COLUMN] As a user, I should check the validation of DATETIME column definition","[COLUMN] As a user, I should check the validation of DATETIME column definition",""
"passed","Thu Apr 20 16:11:24 UTC 2023","Thu Apr 20 16:12:35 UTC 2023","71148","","JIT-Database-012d-RELATION-multiple-2-direction","","JIT-Database-012d-RELATION-multiple-2-direction","[RELATION], I should add multiple relation 2 directions","[RELATION], I should add multiple relation 2 directions",""
"passed","Thu Apr 20 16:16:18 UTC 2023","Thu Apr 20 16:17:11 UTC 2023","53670","","JIT-Mobile-007-MOLECULE-Delete","","JIT-Mobile-007-MOLECULE-Delete","[MOBILE-MOLECULE] As a user, I can delete molecule","[MOBILE-MOLECULE] As a user, I can delete molecule",""
"passed","Thu Apr 20 16:32:51 UTC 2023","Thu Apr 20 16:34:18 UTC 2023","86552","","JIT-Web-001g-PAGE-FIGMA-Import","","JIT-Web-001g-PAGE-FIGMA-Import","[PAGE-FIGMA] As a user, I can import the figma file to the jitera studio","[PAGE-FIGMA] As a user, I can import the figma file to the jitera studio",""
"passed","Thu Apr 20 16:15:17 UTC 2023","Thu Apr 20 16:16:18 UTC 2023","61057","","JIT-Mobile-005-MOLECULE-Create-new","","JIT-Mobile-005-MOLECULE-Create-new","[MOBILE-MOLECULE] As a user, I can create new molecule with positive and negative cases","[MOBILE-MOLECULE] As a user, I can create new molecule with positive and negative cases",""
"passed","Thu Apr 20 16:30:35 UTC 2023","Thu Apr 20 16:31:35 UTC 2023","59695","","JIT-Team-005-Invite-duplicate-email","","JIT-Team-005-Invite-duplicate-email","[INVITE-DELETE] Invite new email and invite again","[INVITE-DELETE] Invite new email and invite again",""
"passed","Thu Apr 20 16:58:59 UTC 2023","Thu Apr 20 17:00:32 UTC 2023","93378","","JIT-Database-015h-INDEX-DATE-column-config","","JIT-Database-015h-INDEX-DATE-column-config","[INDEX-DATE] As a user, I config index from column setting && check on index popup","[INDEX-DATE] As a user, I config index from column setting && check on index popup",""
"passed","Thu Apr 20 16:06:03 UTC 2023","Thu Apr 20 16:08:23 UTC 2023","140011","","JIT-Database-007-COLUMN-type-TEXT","","JIT-Database-007-COLUMN-type-TEXT","[COLUMN] As a user, I should check the validation of TEXT column definition","[COLUMN] As a user, I should check the validation of TEXT column definition",""
"passed","Thu Apr 20 17:00:15 UTC 2023","Thu Apr 20 17:01:47 UTC 2023","92194","","JIT-Database-015l-INDEX-ENUM-column-config","","JIT-Database-015l-INDEX-ENUM-column-config","[INDEX-ENUM] As a user, I config index from column setting && check on index popup","[INDEX-ENUM] As a user, I config index from column setting && check on index popup",""
"passed","Thu Apr 20 16:33:01 UTC 2023","Thu Apr 20 16:35:31 UTC 2023","150220","","JIT-Web-001h-PAGE-Create-multiple-level-slug","","JIT-Web-001h-PAGE-Create-multiple-level-slug","[PAGE] As a user, I can create new screen with multiple level slug","[PAGE] As a user, I can create new screen with multiple level slug",""
"passed","Thu Apr 20 16:26:22 UTC 2023","Thu Apr 20 16:27:34 UTC 2023","72365","","JIT-Module-006b-SMS-edit-infos","","JIT-Module-006b-SMS-edit-infos","[SMS], I can add module SMS login with Twilio and edit its infos","[SMS], I can add module SMS login with Twilio and edit its infos",""
"passed","Thu Apr 20 16:17:30 UTC 2023","Thu Apr 20 16:18:43 UTC 2023","72578","","JIT-Mobile-013-JITDEF-reflect-delete-screen-innavigation-tree","","JIT-Mobile-013-JITDEF-reflect-delete-screen-innavigation-tree","[DEFECT] As a user, I should see screen will be removed in navigation tree after deleting screen","[DEFECT] As a user, I should see screen will be removed in navigation tree after deleting screen",""
"passed","Thu Apr 20 16:29:17 UTC 2023","Thu Apr 20 16:29:59 UTC 2023","42539","","JIT-Module-017b-GOOGLE-ANAL-edit-infos","","JIT-Module-017b-GOOGLE-ANAL-edit-infos","[GOOGLE-ANAL] As a user, I can update module Google Analytics","[GOOGLE-ANAL] As a user, I can update module Google Analytics",""
"passed","Thu Apr 20 16:34:28 UTC 2023","Thu Apr 20 16:35:36 UTC 2023","67586","","JIT-Web-002a-MOLECULE-Create-new","","JIT-Web-002a-MOLECULE-Create-new","[WEB-MOLECULE] As a user, I can create new molecule with positive and negative cases","[WEB-MOLECULE] As a user, I can create new molecule with positive and negative cases",""
"passed","Thu Apr 20 16:56:40 UTC 2023","Thu Apr 20 16:58:06 UTC 2023","86205","","JIT-Database-015d-INDEX-STRING-column-config","","JIT-Database-015d-INDEX-STRING-column-config","[INDEX-STRING] As a user, I config index from column setting && check on index popup","[INDEX-STRING] As a user, I config index from column setting && check on index popup",""
"passed","Thu Apr 20 16:48:55 UTC 2023","Thu Apr 20 16:50:23 UTC 2023","87749","","JIT-API-005c-PUT-relation","","JIT-API-005c-PUT-relation","As a user, I check column display when having relation for API PUT","As a user, I check column display when having relation for API PUT",""
"passed","Thu Apr 20 16:45:54 UTC 2023","Thu Apr 20 16:47:30 UTC 2023","95460","","JIT-API-003c-POST-relation","","JIT-API-003c-POST-relation","As a user, I check column display when having relation for API POST","As a user, I check column display when having relation for API POST",""
"passed","Thu Apr 20 16:20:34 UTC 2023","Thu Apr 20 16:21:27 UTC 2023","53062","","JIT-Mobile-030b-WEBVIEW-General-info","","JIT-Mobile-030b-WEBVIEW-General-info","[MOBILE-WEBVIEW] As a user, I should check the general infomation of Webview is correct: Name, Key, unique key, delete component","[MOBILE-WEBVIEW] As a user, I should check the general infomation of Webview is correct: Name, Key, unique key, delete component",""
"passed","Thu Apr 20 16:11:24 UTC 2023","Thu Apr 20 16:12:28 UTC 2023","64527","","JIT-Database-012c-RELATION-multiple-1-direction","","JIT-Database-012c-RELATION-multiple-1-direction","[RELATION], I should add multiple relation 1 direction","[RELATION], I should add multiple relation 1 direction",""
"passed","Thu Apr 20 16:31:46 UTC 2023","Thu Apr 20 16:32:42 UTC 2023","56255","","JIT-Web-001c-PAGE-Delete","","JIT-Web-001c-PAGE-Delete","[PAGE] As a user, I can delete page","[PAGE] As a user, I can delete page",""
"passed","Thu Apr 20 16:44:05 UTC 2023","Thu Apr 20 16:45:41 UTC 2023","96186","","JIT-API-002c-GET-list","","JIT-API-002c-GET-list","As a user, I check column display when having relation for GET-list","As a user, I check column display when having relation for GET-list",""
"passed","Thu Apr 20 16:37:28 UTC 2023","Thu Apr 20 16:38:43 UTC 2023","75158","","JIT-Web-002g-MOLECULE-CRUD-category","","JIT-Web-002g-MOLECULE-CRUD-category","[WEB-MOLECULE-EDIT] As a user, I can see the molecule in Page and use Edit button see the content of this molecule","[WEB-MOLECULE-EDIT] As a user, I can see the molecule in Page and use Edit button see the content of this molecule",""
"passed","Thu Apr 20 17:46:16 UTC 2023","Thu Apr 20 17:47:38 UTC 2023","82893","","JIT-API-003a-POST-check-default","","JIT-API-003a-POST-check-default","As a user, I check default value in API POST","As a user, I check default value in API POST",""
"passed","Thu Apr 20 16:50:36 UTC 2023","Thu Apr 20 16:52:31 UTC 2023","114764","","JIT-API-007ba-GET-list-API-Add-new-endpoint","","JIT-API-007ba-GET-list-API-Add-new-endpoint","[GET-list-API] Create, update and delete new GET API endpoint","[GET-list-API] Create, update and delete new GET API endpoint",""
"passed","Thu Apr 20 16:24:01 UTC 2023","Thu Apr 20 16:24:32 UTC 2023","30346","","JIT-Module-000-search","","JIT-Module-000-search","[SEARCH] As a user, I can Search module","[SEARCH] As a user, I can Search module",""
"passed","Thu Apr 20 17:38:26 UTC 2023","Thu Apr 20 17:38:56 UTC 2023","30234","","JIT-Database-003a-COLUMN-empty","","JIT-Database-003a-COLUMN-empty","[COLUMN] As a user, I cannot add empty column definition","[COLUMN] As a user, I cannot add empty column definition",""
"passed","Thu Apr 20 16:15:57 UTC 2023","Thu Apr 20 16:17:13 UTC 2023","75336","","JIT-Mobile-005b-MOLECULE-Navigate-edit-screen","","JIT-Mobile-005b-MOLECULE-Navigate-edit-screen","[MOBILE-MOLECULE-EDIT] As a user, I can see the molecule in Screen and use Edit button see the content of this molecule","[MOBILE-MOLECULE-EDIT] As a user, I can see the molecule in Screen and use Edit button see the content of this molecule",""
"passed","Thu Apr 20 16:08:05 UTC 2023","Thu Apr 20 16:09:16 UTC 2023","71179","","JIT-Database-010a-COLUMN-FILE-validation","","JIT-Database-010a-COLUMN-FILE-validation","[COLUMN] As a user, I should check the validation of FILE column definition","[COLUMN] As a user, I should check the validation of FILE column definition",""
"passed","Thu Apr 20 17:18:45 UTC 2023","Thu Apr 20 17:19:12 UTC 2023","26905","","JIT-Module-015b-SCOUT-edit-infos","","JIT-Module-015b-SCOUT-edit-infos","[SCOUT] As a user, I can update module Scout","[SCOUT] As a user, I can update module Scout",""
"passed","Thu Apr 20 16:34:18 UTC 2023","Thu Apr 20 16:35:45 UTC 2023","86760","","JIT-Web-001h02-PAGE-DEFECT-Expand-Collapse-folder","","JIT-Web-001h02-PAGE-DEFECT-Expand-Collapse-folder","[PAGE - DEFECT] As a user, I can check DEFECT expand and collapse folder","[PAGE - DEFECT] As a user, I can check DEFECT expand and collapse folder",""
"passed","Thu Apr 20 16:12:53 UTC 2023","Thu Apr 20 16:13:45 UTC 2023","52375","","JIT-Database-015a-INDEX-Check-duplicate-empty","","JIT-Database-015a-INDEX-Check-duplicate-empty","[INDEX] As a user, I check empty and duplicate index","[INDEX] As a user, I check empty and duplicate index",""
"passed","Thu Apr 20 16:19:00 UTC 2023","Thu Apr 20 16:19:58 UTC 2023","57443","","JIT-Mobile-022a-TEXT-General-info","","JIT-Mobile-022a-TEXT-General-info","[MOBILE-TEXT] As a user, I should check the general infomation of Text is correct: Name, Key, unique key, delete component","[MOBILE-TEXT] As a user, I should check the general infomation of Text is correct: Name, Key, unique key, delete component",""
"passed","Thu Apr 20 16:11:40 UTC 2023","Thu Apr 20 16:13:13 UTC 2023","92523","","JIT-Database-012e-RELATION-trigger-by-button","","JIT-Database-012e-RELATION-trigger-by-button","[RELATION] check the basic relation","[RELATION] check the basic relation",""
"passed","Thu Apr 20 16:21:45 UTC 2023","Thu Apr 20 16:22:36 UTC 2023","50992","","JIT-Mobile-033b-HEADER-General-info","","JIT-Mobile-033b-HEADER-General-info","[MOBILE-HEADER] As a user, I should check the general infomation of Header is correct: Name, Key, unique key, delete component","[MOBILE-HEADER] As a user, I should check the general infomation of Header is correct: Name, Key, unique key, delete component",""
"passed","Thu Apr 20 16:51:00 UTC 2023","Thu Apr 20 16:52:34 UTC 2023","94783","","JIT-API-007c-GET-detail-API-Add-new-endpoint","","JIT-API-007c-GET-detail-API-Add-new-endpoint","[GET-detail-API] Create, update and delete new GET API endpoint","[GET-detail-API] Create, update and delete new GET API endpoint",""
"passed","Thu Apr 20 17:42:08 UTC 2023","Thu Apr 20 17:44:19 UTC 2023","131527","","JIT-API-009-Auto-fill","","JIT-API-009-Auto-fill","[AUTO-FILL] As a user, I could add request param by Auto-fill","[AUTO-FILL] As a user, I could add request param by Auto-fill",""
"passed","Thu Apr 20 17:37:52 UTC 2023","Thu Apr 20 17:38:18 UTC 2023","26319","","JIT-Database-002-COLUMN-default","","JIT-Database-002-COLUMN-default","[COLUMN] As a user, I should see the default column definition","[COLUMN] As a user, I should see the default column definition",""
"passed","Thu Apr 20 16:21:56 UTC 2023","Thu Apr 20 16:22:48 UTC 2023","52590","","JIT-Mobile-034b-SCROLLVIEW-General-info","","JIT-Mobile-034b-SCROLLVIEW-General-info","[MOBILE-SCROLLVIEW] As a user, I should check the general infomation of Scroll View is correct: Name, Key, unique key, delete component","[MOBILE-SCROLLVIEW] As a user, I should check the general infomation of Scroll View is correct: Name, Key, unique key, delete component",""
"passed","Thu Apr 20 16:08:49 UTC 2023","Thu Apr 20 16:09:49 UTC 2023","59523","","JIT-Database-011b-COLUMN-ENUM-add-items","","JIT-Database-011b-COLUMN-ENUM-add-items","[COLUMN] As a user, I should add new item and select in default dropdown","[COLUMN] As a user, I should add new item and select in default dropdown",""
"passed","Thu Apr 20 16:23:08 UTC 2023","Thu Apr 20 16:25:31 UTC 2023","143322","","JIT-Mobile-041b-PREVIEW-NAVIGATION-with-navigation-setup","","JIT-Mobile-041b-PREVIEW-NAVIGATION-with-navigation-setup","[MOBILE-PREVIEW-NAVIGATION] As a user, I could open preview screen with setting the screen navigation","[MOBILE-PREVIEW-NAVIGATION] As a user, I could open preview screen with setting the screen navigation",""
"passed","Thu Apr 20 16:05:50 UTC 2023","Thu Apr 20 16:08:21 UTC 2023","150547","","JIT-Database-006-COLUMN-type-STRING","","JIT-Database-006-COLUMN-type-STRING","[COLUMN] As a user, I should check the validation of STRING column definition","[COLUMN] As a user, I should check the validation of STRING column definition",""
"passed","Thu Apr 20 16:47:47 UTC 2023","Thu Apr 20 16:49:53 UTC 2023","125624","","JIT-API-005a-PUT-check-default","","JIT-API-005a-PUT-check-default","As a user, I check default value in API PUT","As a user, I check default value in API PUT",""
"broken","Thu Apr 20 17:31:46 UTC 2023","Thu Apr 20 17:33:50 UTC 2023","123702","","JIT-Web-007b-ASSET-Rename-and-delete","","JIT-Web-007b-ASSET-Rename-and-delete","[ASSET] As a user, I can rename and delete image asset","[ASSET] As a user, I can rename and delete image asset",""
"passed","Thu Apr 20 16:48:30 UTC 2023","Thu Apr 20 16:50:33 UTC 2023","123200","","JIT-API-005b-PUT-update-info","","JIT-API-005b-PUT-update-info","As a user, I update info for API PUT","As a user, I update info for API PUT",""
"passed","Thu Apr 20 16:25:01 UTC 2023","Thu Apr 20 16:26:08 UTC 2023","66137","","JIT-Module-002b-DEEPLINK-edit-infos","","JIT-Module-002b-DEEPLINK-edit-infos","As a user, I can update module Deeplink","As a user, I can update module Deeplink",""
"passed","Thu Apr 20 16:25:15 UTC 2023","Thu Apr 20 16:26:09 UTC 2023","54374","","JIT-Module-004a-EMAIL-LOGIN-default","","JIT-Module-004a-EMAIL-LOGIN-default","[EMAIL-LOGIN] - Check adding and auto-generated API","[EMAIL-LOGIN] - Check adding and auto-generated API",""
"failed","Thu Apr 20 17:35:29 UTC 2023","Thu Apr 20 17:36:28 UTC 2023","58559","","JIT-Mobile-002-SCREEN-Update","","JIT-Mobile-002-SCREEN-Update","[MOBILE-SCREEN] As a user, I can update screen with positive and negative cases","[MOBILE-SCREEN] As a user, I can update screen with positive and negative cases",""
"passed","Thu Apr 20 17:00:46 UTC 2023","Thu Apr 20 17:02:27 UTC 2023","100967","","JIT-Database-015m-INDEX-ALL-column-config","","JIT-Database-015m-INDEX-ALL-column-config","[INDEX-ALL] As a user, I config with multiple column and check show multiple on index pop-up","[INDEX-ALL] As a user, I config with multiple column and check show multiple on index pop-up",""
"passed","Thu Apr 20 16:10:04 UTC 2023","Thu Apr 20 16:11:02 UTC 2023","58580","","JIT-Database-011d-COLUMN-ENUM-delete-selected-items","","JIT-Database-011d-COLUMN-ENUM-delete-selected-items","[COLUMN] As a user, I should delete 1 selected item and check is will be removed in default dropdown","[COLUMN] As a user, I should delete 1 selected item and check is will be removed in default dropdown",""
"passed","Thu Apr 20 16:03:39 UTC 2023","Thu Apr 20 16:04:19 UTC 2023","39601","","JIT-Database-001b-TABLE-empty","","JIT-Database-001b-TABLE-empty","[TABLE] As a user, I cannot create table with empty name","[TABLE] As a user, I cannot create table with empty name",""
"passed","Thu Apr 20 16:12:47 UTC 2023","Thu Apr 20 16:13:42 UTC 2023","55371","","JIT-Database-014-DEFECT-Check-duplicate-table-name","","JIT-Database-014-DEFECT-Check-duplicate-table-name","[DEFECT] As a user, I cannot update to duplicate name","[DEFECT] As a user, I cannot update to duplicate name",""
"passed","Thu Apr 20 17:37:14 UTC 2023","Thu Apr 20 17:37:45 UTC 2023","30925","","JIT-Database-001d-TABLE-update","","JIT-Database-001d-TABLE-update","[TABLE] As a user, I can update the value of the table","[TABLE] As a user, I can update the value of the table",""
"passed","Thu Apr 20 16:13:12 UTC 2023","Thu Apr 20 16:14:35 UTC 2023","82444","","JIT-Database-016a-COUNTER-CACHE-Create-by-relation","","JIT-Database-016a-COUNTER-CACHE-Create-by-relation","[COUNTER-CACHE] create new counter cache column by selecting in relation popup","[COUNTER-CACHE] create new counter cache column by selecting in relation popup",""
"passed","Thu Apr 20 16:52:46 UTC 2023","Thu Apr 20 16:54:02 UTC 2023","76005","","JIT-API-007f-DELETE-API-Add-new-endpoint","","JIT-API-007f-DELETE-API-Add-new-endpoint","[DELETE-API] Create, update and delete new DELETE API endpoint","[DELETE-API] Create, update and delete new DELETE API endpoint",""
"passed","Thu Apr 20 16:40:34 UTC 2023","Thu Apr 20 16:42:19 UTC 2023","104364","","JIT-Web-008a-ADMIN-PAGE-Create-new","","JIT-Web-008a-ADMIN-PAGE-Create-new","[ADMIN-PAGE] As a user, I can create new Admin page","[ADMIN-PAGE] As a user, I can create new Admin page",""
"passed","Thu Apr 20 16:23:36 UTC 2023","Thu Apr 20 16:24:47 UTC 2023","71292","","JIT-Mobile-045a-LAYER-TREE-Check-edit-and-action","","JIT-Mobile-045a-LAYER-TREE-Check-edit-and-action","[MOBILE-LAYER-TREE] As a user, I could update the name of the node in the layer tree and copy,paste,delete,wrap the node","[MOBILE-LAYER-TREE] As a user, I could update the name of the node in the layer tree and copy,paste,delete,wrap the node",""
"passed","Thu Apr 20 16:52:57 UTC 2023","Thu Apr 20 16:54:19 UTC 2023","82002","","JIT-API-008-DEFECT-Check-column-file-type","","JIT-API-008-DEFECT-Check-column-file-type","[DEFECT] As a user, I check column type file not display in request params of GET list Api","[DEFECT] As a user, I check column type file not display in request params of GET list Api",""
"passed","Thu Apr 20 16:38:16 UTC 2023","Thu Apr 20 16:40:19 UTC 2023","122893","","JIT-Web-002h-MOLECULE-New-with-cate","","JIT-Web-002h-MOLECULE-New-with-cate","[WEB-MOLECULE-CATE] As a user, I can create new molecule","[WEB-MOLECULE-CATE] As a user, I can create new molecule",""
"passed","Thu Apr 20 16:24:59 UTC 2023","Thu Apr 20 16:25:39 UTC 2023","40631","","JIT-Module-002a-DEEPLINK-default","","JIT-Module-002a-DEEPLINK-default","As a user, I can add module Deeplink and remove it","As a user, I can add module Deeplink and remove it",""
"passed","Thu Apr 20 16:59:57 UTC 2023","Thu Apr 20 17:01:07 UTC 2023","70342","","JIT-Database-015k-INDEX-BOOLEAN-column-config","","JIT-Database-015k-INDEX-BOOLEAN-column-config","[INDEX-BOOLEAN] As a user, I config index from column setting && check on index popup","[INDEX-BOOLEAN] As a user, I config index from column setting && check on index popup",""
"passed","Thu Apr 20 16:58:35 UTC 2023","Thu Apr 20 17:00:06 UTC 2023","90536","","JIT-Database-015g-INDEX-FLOAT-column-config","","JIT-Database-015g-INDEX-FLOAT-column-config","[INDEX-FLOAT] As a user, I config index from column setting && check on index popup","[INDEX-FLOAT] As a user, I config index from column setting && check on index popup",""
"passed","Thu Apr 20 16:52:42 UTC 2023","Thu Apr 20 16:54:17 UTC 2023","94805","","JIT-API-007e-PUT-API-Add-new-endpoint","","JIT-API-007e-PUT-API-Add-new-endpoint","[PUT-API] Create, update and delete new PUT API endpoint","[PUT-API] Create, update and delete new PUT API endpoint",""
"passed","Thu Apr 20 16:14:04 UTC 2023","Thu Apr 20 16:15:32 UTC 2023","87885","","JIT-Mobile-001a-SCREEN-Search","","JIT-Mobile-001a-SCREEN-Search","[MOBILE-SCREEN] As a user, I can search correct screen with keyword","[MOBILE-SCREEN] As a user, I can search correct screen with keyword",""
"passed","Thu Apr 20 16:54:28 UTC 2023","Thu Apr 20 16:55:23 UTC 2023","55525","","JIT-API-010a-DEFECT-Check-special-symbol-request-param","","JIT-API-010a-DEFECT-Check-special-symbol-request-param","As a user, I want to validate and prevent the special symbol for request params.","As a user, I want to validate and prevent the special symbol for request params.",""
"passed","Thu Apr 20 16:31:55 UTC 2023","Thu Apr 20 16:33:58 UTC 2023","123073","","JIT-Web-001e-PAGE-Search","","JIT-Web-001e-PAGE-Search","[WEB-PAGE] As a user, I can search correct screen with keyword","[WEB-PAGE] As a user, I can search correct screen with keyword",""
"passed","Thu Apr 20 16:47:45 UTC 2023","Thu Apr 20 16:49:05 UTC 2023","80352","","JIT-API-004c-GET-detail-relation","","JIT-API-004c-GET-detail-relation","As a user, I check column display when having relation for GET-detail","As a user, I check column display when having relation for GET-detail",""
"passed","Thu Apr 20 16:23:03 UTC 2023","Thu Apr 20 16:23:44 UTC 2023","40526","","JIT-Mobile-041a-PREVIEW-NAVIGATION-no-navigation-setup","","JIT-Mobile-041a-PREVIEW-NAVIGATION-no-navigation-setup","[MOBILE-PREVIEW-NAVIGATION] As a user, I could open preview screen with notification should setup the screen navigation","[MOBILE-PREVIEW-NAVIGATION] As a user, I could open preview screen with notification should setup the screen navigation",""
"passed","Thu Apr 20 16:05:11 UTC 2023","Thu Apr 20 16:06:48 UTC 2023","97044","","JIT-Database-004-COLUMN-type-INTEGER","","JIT-Database-004-COLUMN-type-INTEGER","[COLUMN] As a user, I should check the validation of INTEGER column definition","[COLUMN] As a user, I should check the validation of INTEGER column definition",""
"passed","Thu Apr 20 16:29:30 UTC 2023","Thu Apr 20 16:30:11 UTC 2023","41321","","JIT-Module-019b-GOOGLE-ANALYTICS-edit-infos","","JIT-Module-019b-GOOGLE-ANALYTICS-edit-infos","[GOOGLE-ANALYTICS] As a user, I can update module Google Analytics information for each environment","[GOOGLE-ANALYTICS] As a user, I can update module Google Analytics information for each environment",""
"passed","Thu Apr 20 16:19:17 UTC 2023","Thu Apr 20 16:20:11 UTC 2023","53696","","JIT-Mobile-026b-BUTTON-General-info","","JIT-Mobile-026b-BUTTON-General-info","[MOBILE-BUTTON] As a user, I should check the general infomation of Button is correct: Name, Key, unique key, delete component","[MOBILE-BUTTON] As a user, I should check the general infomation of Button is correct: Name, Key, unique key, delete component",""
