"Status","Start Time","Stop Time","Duration in ms","Parent Suite","Suite","Sub Suite","Test Class","Test Method","Name","Description"
"passed","Wed Apr 26 16:49:39 UTC 2023","Wed Apr 26 16:51:14 UTC 2023","94939","","JIT-Web-011a-SETTING-PROJECT-VARIABLE","","JIT-Web-011a-SETTING-PROJECT-VARIABLE","[SETTING-PROJECT-VARIABLE] As a user, I can CRUD the Project Variable","[SETTING-PROJECT-VARIABLE] As a user, I can CRUD the Project Variable",""
"passed","Wed Apr 26 16:41:37 UTC 2023","Wed Apr 26 16:43:43 UTC 2023","125897","","JIT-Web-002b-MOLECULE-Update","","JIT-Web-002b-MOLECULE-Update","[WEB-MOLECULE] As a user, I can update molecule with positive and negative cases","[WEB-MOLECULE] As a user, I can update molecule with positive and negative cases",""
"passed","Wed Apr 26 16:37:12 UTC 2023","Wed Apr 26 16:39:48 UTC 2023","155928","","JIT-Web-001e-PAGE-Search","","JIT-Web-001e-PAGE-Search","[WEB-PAGE] As a user, I can search correct screen with keyword","[WEB-PAGE] As a user, I can search correct screen with keyword",""
"passed","Wed Apr 26 16:42:16 UTC 2023","Wed Apr 26 16:44:30 UTC 2023","134473","","JIT-Web-002e-MOLECULE-Search","","JIT-Web-002e-MOLECULE-Search","[WEB-PAGE] As a user, I can search correct molecule with keyword","[WEB-PAGE] As a user, I can search correct molecule with keyword",""
"passed","Wed Apr 26 16:14:23 UTC 2023","Wed Apr 26 16:15:29 UTC 2023","66383","","JIT-Database-014-DEFECT-Check-duplicate-table-name","","JIT-Database-014-DEFECT-Check-duplicate-table-name","[DEFECT] As a user, I cannot update to duplicate name","[DEFECT] As a user, I cannot update to duplicate name",""
"passed","Wed Apr 26 17:06:46 UTC 2023","Wed Apr 26 17:08:24 UTC 2023","97775","","JIT-API-007f-DELETE-API-Add-new-endpoint","","JIT-API-007f-DELETE-API-Add-new-endpoint","[DELETE-API] Create, update and delete new DELETE API endpoint","[DELETE-API] Create, update and delete new DELETE API endpoint",""
"passed","Wed Apr 26 17:09:46 UTC 2023","Wed Apr 26 17:12:32 UTC 2023","165556","","JIT-Database-015b-INDEX-CRUD-single","","JIT-Database-015b-INDEX-CRUD-single","[INDEX] As a user, I check add and update multiple index","[INDEX] As a user, I check add and update multiple index",""
"passed","Wed Apr 26 16:32:52 UTC 2023","Wed Apr 26 16:33:53 UTC 2023","60957","","JIT-Module-015a-SCOUT-default","","JIT-Module-015a-SCOUT-default","[SCOUT] As a user, I can add module Scout and remove it","[SCOUT] As a user, I can add module Scout and remove it",""
"passed","Wed Apr 26 16:13:51 UTC 2023","Wed Apr 26 16:14:49 UTC 2023","58217","","JIT-Database-013-DEFECT-Check-default-value-when-changing-type","","JIT-Database-013-DEFECT-Check-default-value-when-changing-type","[DEFECT] As a user, I should check the default value when changing the type","[DEFECT] As a user, I should check the default value when changing the type",""
"passed","Wed Apr 26 17:09:01 UTC 2023","Wed Apr 26 17:11:13 UTC 2023","131535","","JIT-API-011-UPDATE-toggle-on-API","","JIT-API-011-UPDATE-toggle-on-API","As a user, I want to see the confirmation when deleting table/column, adding column, update table/column when the API is toggled on","As a user, I want to see the confirmation when deleting table/column, adding column, update table/column when the API is toggled on",""
"passed","Wed Apr 26 17:13:08 UTC 2023","Wed Apr 26 17:14:43 UTC 2023","95439","","JIT-Database-015h-INDEX-DATE-column-config","","JIT-Database-015h-INDEX-DATE-column-config","[INDEX-DATE] As a user, I config index from column setting && check on index popup","[INDEX-DATE] As a user, I config index from column setting && check on index popup",""
"passed","Wed Apr 26 16:04:21 UTC 2023","Wed Apr 26 16:05:17 UTC 2023","55789","","JIT-Database-001c-TABLE-duplicate","","JIT-Database-001c-TABLE-duplicate","[TABLE] As a user, I cannot create table with duplicate name","[TABLE] As a user, I cannot create table with duplicate name",""
"passed","Wed Apr 26 16:25:42 UTC 2023","Wed Apr 26 16:26:39 UTC 2023","56578","","JIT-Mobile-034b-SCROLLVIEW-General-info","","JIT-Mobile-034b-SCROLLVIEW-General-info","[MOBILE-SCROLLVIEW] As a user, I should check the general infomation of Scroll View is correct: Name, Key, unique key, delete component","[MOBILE-SCROLLVIEW] As a user, I should check the general infomation of Scroll View is correct: Name, Key, unique key, delete component",""
"passed","Wed Apr 26 16:05:55 UTC 2023","Wed Apr 26 16:07:02 UTC 2023","66449","","JIT-Database-003b-COLUMN-duplicated","","JIT-Database-003b-COLUMN-duplicated","[COLUMN] As a user, I cannot add duplicated column definition","[COLUMN] As a user, I cannot add duplicated column definition",""
"passed","Wed Apr 26 16:10:20 UTC 2023","Wed Apr 26 16:11:20 UTC 2023","60308","","JIT-Database-011b-COLUMN-ENUM-add-items","","JIT-Database-011b-COLUMN-ENUM-add-items","[COLUMN] As a user, I should add new item and select in default dropdown","[COLUMN] As a user, I should add new item and select in default dropdown",""
"passed","Wed Apr 26 16:59:07 UTC 2023","Wed Apr 26 17:01:06 UTC 2023","119095","","JIT-API-004a-GET-detail-check-default","","JIT-API-004a-GET-detail-check-default","As a user, I check default value in API GET-detail","As a user, I check default value in API GET-detail",""
"passed","Wed Apr 26 16:12:15 UTC 2023","Wed Apr 26 16:13:09 UTC 2023","53731","","JIT-Database-011f-COLUMN-ENUM-duplicated","","JIT-Database-011f-COLUMN-ENUM-duplicated","[COLUMN] As a user, I should check counld not add duplicated item","[COLUMN] As a user, I should check counld not add duplicated item",""
"passed","Wed Apr 26 16:28:13 UTC 2023","Wed Apr 26 16:28:43 UTC 2023","30545","","JIT-Module-000-search","","JIT-Module-000-search","[SEARCH] As a user, I can Search module","[SEARCH] As a user, I can Search module",""
"passed","Wed Apr 26 16:51:39 UTC 2023","Wed Apr 26 16:53:07 UTC 2023","87663","","JIT-Web-011e-SETTING-PROJECT-VARIABLE-CSS-Check-remove-variable","","JIT-Web-011e-SETTING-PROJECT-VARIABLE-CSS-Check-remove-variable","[SETTING-PROJECT-VARIABLE-CSS] As a user, I remove the PV,  should show the previous value of this field","[SETTING-PROJECT-VARIABLE-CSS] As a user, I remove the PV,  should show the previous value of this field",""
"passed","Wed Apr 26 16:07:13 UTC 2023","Wed Apr 26 16:09:42 UTC 2023","149431","","JIT-Database-007-COLUMN-type-TEXT","","JIT-Database-007-COLUMN-type-TEXT","[COLUMN] As a user, I should check the validation of TEXT column definition","[COLUMN] As a user, I should check the validation of TEXT column definition",""
"passed","Wed Apr 26 16:15:12 UTC 2023","Wed Apr 26 16:16:36 UTC 2023","84098","","JIT-Database-016a-COUNTER-CACHE-Create-by-relation","","JIT-Database-016a-COUNTER-CACHE-Create-by-relation","[COUNTER-CACHE] create new counter cache column by selecting in relation popup","[COUNTER-CACHE] create new counter cache column by selecting in relation popup",""
"passed","Wed Apr 26 17:00:37 UTC 2023","Wed Apr 26 17:02:50 UTC 2023","132993","","JIT-API-005a-PUT-check-default","","JIT-API-005a-PUT-check-default","As a user, I check default value in API PUT","As a user, I check default value in API PUT",""
"passed","Wed Apr 26 16:34:02 UTC 2023","Wed Apr 26 16:34:48 UTC 2023","45050","","JIT-Module-017b-GOOGLE-ANAL-edit-infos","","JIT-Module-017b-GOOGLE-ANAL-edit-infos","[GOOGLE-ANAL] As a user, I can update module Google Analytics","[GOOGLE-ANAL] As a user, I can update module Google Analytics",""
"passed","Wed Apr 26 17:11:25 UTC 2023","Wed Apr 26 17:12:54 UTC 2023","89271","","JIT-Database-015e-INDEX-TEXT-column-config","","JIT-Database-015e-INDEX-TEXT-column-config","[INDEX-TEXT] As a user, I config index from column setting && check on index popup","[INDEX-TEXT] As a user, I config index from column setting && check on index popup",""
"passed","Wed Apr 26 16:25:55 UTC 2023","Wed Apr 26 16:26:55 UTC 2023","60729","","JIT-Mobile-035b-FLATLIST-General-info","","JIT-Mobile-035b-FLATLIST-General-info","[MOBILE-FLATLIST] As a user, I should check the general infomation of FlatList is correct: Name, Key, unique key, delete component","[MOBILE-FLATLIST] As a user, I should check the general infomation of FlatList is correct: Name, Key, unique key, delete component",""
"passed","Wed Apr 26 16:59:48 UTC 2023","Wed Apr 26 17:01:42 UTC 2023","113700","","JIT-API-004b-GET-detail-update-info","","JIT-API-004b-GET-detail-update-info","As a user, I update info for GET-detail","As a user, I update info for GET-detail",""
"passed","Wed Apr 26 16:20:18 UTC 2023","Wed Apr 26 16:21:30 UTC 2023","71595","","JIT-Mobile-014-JITDEF-status-bar","","JIT-Mobile-014-JITDEF-status-bar","[DEFECT] As a user, I should see screen will be removed in navigation tree after deleting screen","[DEFECT] As a user, I should see screen will be removed in navigation tree after deleting screen",""
"passed","Wed Apr 26 16:58:32 UTC 2023","Wed Apr 26 17:00:18 UTC 2023","105568","","JIT-API-003c-POST-relation","","JIT-API-003c-POST-relation","As a user, I check column display when having relation for API POST","As a user, I check column display when having relation for API POST",""
"passed","Wed Apr 26 17:40:41 UTC 2023","Wed Apr 26 17:41:30 UTC 2023","48900","","JIT-Mobile-005b-MOLECULE-Navigate-edit-screen","","JIT-Mobile-005b-MOLECULE-Navigate-edit-screen","[MOBILE-MOLECULE-EDIT] As a user, I can see the molecule in Screen and use Edit button see the content of this molecule","[MOBILE-MOLECULE-EDIT] As a user, I can see the molecule in Screen and use Edit button see the content of this molecule",""
"passed","Wed Apr 26 16:24:05 UTC 2023","Wed Apr 26 16:25:09 UTC 2023","64105","","JIT-Mobile-030b-WEBVIEW-General-info","","JIT-Mobile-030b-WEBVIEW-General-info","[MOBILE-WEBVIEW] As a user, I should check the general infomation of Webview is correct: Name, Key, unique key, delete component","[MOBILE-WEBVIEW] As a user, I should check the general infomation of Webview is correct: Name, Key, unique key, delete component",""
"passed","Wed Apr 26 16:41:55 UTC 2023","Wed Apr 26 16:45:25 UTC 2023","210001","","JIT-Web-002d-MOLECULE-Duplicate","","JIT-Web-002d-MOLECULE-Duplicate","[WEB-MOLECULE] As a user, I can duplicate molecule with positive and negative cases","[WEB-MOLECULE] As a user, I can duplicate molecule with positive and negative cases",""
"passed","Wed Apr 26 16:27:54 UTC 2023","Wed Apr 26 16:29:17 UTC 2023","82889","","JIT-Mobile-045a-LAYER-TREE-Check-edit-and-action","","JIT-Mobile-045a-LAYER-TREE-Check-edit-and-action","[MOBILE-LAYER-TREE] As a user, I could update the name of the node in the layer tree and copy,paste,delete,wrap the node","[MOBILE-LAYER-TREE] As a user, I could update the name of the node in the layer tree and copy,paste,delete,wrap the node",""
"passed","Wed Apr 26 16:05:40 UTC 2023","Wed Apr 26 16:06:17 UTC 2023","36871","","JIT-Database-002-COLUMN-default","","JIT-Database-002-COLUMN-default","[COLUMN] As a user, I should see the default column definition","[COLUMN] As a user, I should see the default column definition",""
"passed","Wed Apr 26 16:20:44 UTC 2023","Wed Apr 26 16:21:49 UTC 2023","65631","","JIT-Mobile-015-VIEW-General-info","","JIT-Mobile-015-VIEW-General-info","[MOBILE-VIEW] As a user, I should check the general infomation of View is correct: Name, Key, unique key, delete component","[MOBILE-VIEW] As a user, I should check the general infomation of View is correct: Name, Key, unique key, delete component",""
"passed","Wed Apr 26 16:43:22 UTC 2023","Wed Apr 26 16:44:18 UTC 2023","56083","","JIT-Web-002f-MOLECULE-Navigate-edit-screen","","JIT-Web-002f-MOLECULE-Navigate-edit-screen","[WEB-MOLECULE-EDIT] As a user, I can see the molecule in Page and use Edit button see the content of this molecule","[WEB-MOLECULE-EDIT] As a user, I can see the molecule in Page and use Edit button see the content of this molecule",""
"passed","Wed Apr 26 16:44:12 UTC 2023","Wed Apr 26 16:45:34 UTC 2023","81569","","JIT-Web-002g-MOLECULE-CRUD-category","","JIT-Web-002g-MOLECULE-CRUD-category","[WEB-MOLECULE-EDIT] As a user, I can see the molecule in Page and use Edit button see the content of this molecule","[WEB-MOLECULE-EDIT] As a user, I can see the molecule in Page and use Edit button see the content of this molecule",""
"passed","Wed Apr 26 16:09:59 UTC 2023","Wed Apr 26 16:11:56 UTC 2023","116717","","JIT-Database-010b-COLUMN-FILE-format-file","","JIT-Database-010b-COLUMN-FILE-format-file","[COLUMN] As a user, I should check the validation of FILE column definition for Format Area","[COLUMN] As a user, I should check the validation of FILE column definition for Format Area",""
"passed","Wed Apr 26 16:17:16 UTC 2023","Wed Apr 26 16:18:14 UTC 2023","57609","","JIT-Mobile-003-SCREEN-Delete","","JIT-Mobile-003-SCREEN-Delete","[MOBILE-SCREEN] As a user, I can delete screen","[MOBILE-SCREEN] As a user, I can delete screen",""
"passed","Wed Apr 26 16:49:39 UTC 2023","Wed Apr 26 16:54:23 UTC 2023","283871","","JIT-Web-011b-SETTING-PROJECT-VARIABLE-CSS-Check","","JIT-Web-011b-SETTING-PROJECT-VARIABLE-CSS-Check","[SETTING-PROJECT-VARIABLE-CSS] As a user, I can set value for the CSS field of the component","[SETTING-PROJECT-VARIABLE-CSS] As a user, I can set value for the CSS field of the component",""
"passed","Wed Apr 26 17:06:55 UTC 2023","Wed Apr 26 17:08:38 UTC 2023","103234","","JIT-API-008-DEFECT-Check-column-file-type","","JIT-API-008-DEFECT-Check-column-file-type","[DEFECT] As a user, I check column type file not display in request params of GET list Api","[DEFECT] As a user, I check column type file not display in request params of GET list Api",""
"passed","Wed Apr 26 16:13:00 UTC 2023","Wed Apr 26 16:14:13 UTC 2023","72530","","JIT-Database-012d-RELATION-multiple-2-direction","","JIT-Database-012d-RELATION-multiple-2-direction","[RELATION], I should add multiple relation 2 directions","[RELATION], I should add multiple relation 2 directions",""
"passed","Wed Apr 26 16:22:27 UTC 2023","Wed Apr 26 16:23:33 UTC 2023","65683","","JIT-Mobile-026b-BUTTON-General-info","","JIT-Mobile-026b-BUTTON-General-info","[MOBILE-BUTTON] As a user, I should check the general infomation of Button is correct: Name, Key, unique key, delete component","[MOBILE-BUTTON] As a user, I should check the general infomation of Button is correct: Name, Key, unique key, delete component",""
"passed","Wed Apr 26 16:49:19 UTC 2023","Wed Apr 26 16:50:21 UTC 2023","61490","","JIT-Web-010a-LAYER-TREE-Check-edit-and-action","","JIT-Web-010a-LAYER-TREE-Check-edit-and-action","[LAYER-TREE] As a user, I could update the name of the node in the layer tree and copy,paste,delete,wrap the node","[LAYER-TREE] As a user, I could update the name of the node in the layer tree and copy,paste,delete,wrap the node",""
"passed","Wed Apr 26 16:34:23 UTC 2023","Wed Apr 26 16:35:04 UTC 2023","41677","","JIT-Module-019b-GOOGLE-ANALYTICS-edit-infos","","JIT-Module-019b-GOOGLE-ANALYTICS-edit-infos","[GOOGLE-ANALYTICS] As a user, I can update module Google Analytics information for each environment","[GOOGLE-ANALYTICS] As a user, I can update module Google Analytics information for each environment",""
"passed","Wed Apr 26 16:29:54 UTC 2023","Wed Apr 26 16:31:08 UTC 2023","73694","","JIT-Module-005a-FORCE-MOBILE-UPDATE-database","","JIT-Module-005a-FORCE-MOBILE-UPDATE-database","[FORCE-MOBILE-UPDATE] - Check adding and auto-table & columns","[FORCE-MOBILE-UPDATE] - Check adding and auto-table & columns",""
"passed","Wed Apr 26 17:34:38 UTC 2023","Wed Apr 26 17:35:36 UTC 2023","57617","","JIT-Web-001a-PAGE-Create-new","","JIT-Web-001a-PAGE-Create-new","[PAGE] As a user, I can create new screen with positive and negative cases","[PAGE] As a user, I can create new screen with positive and negative cases",""
"passed","Wed Apr 26 16:15:50 UTC 2023","Wed Apr 26 16:16:55 UTC 2023","64578","","JIT-Mobile-001-SCREEN-Create-new","","JIT-Mobile-001-SCREEN-Create-new","[MOBILE-SCREEN] As a user, I can create new screen with positive and negative cases","[MOBILE-SCREEN] As a user, I can create new screen with positive and negative cases",""
"passed","Wed Apr 26 16:27:10 UTC 2023","Wed Apr 26 16:29:38 UTC 2023","147936","","JIT-Mobile-041b-PREVIEW-NAVIGATION-with-navigation-setup","","JIT-Mobile-041b-PREVIEW-NAVIGATION-with-navigation-setup","[MOBILE-PREVIEW-NAVIGATION] As a user, I could open preview screen with setting the screen navigation","[MOBILE-PREVIEW-NAVIGATION] As a user, I could open preview screen with setting the screen navigation",""
"passed","Wed Apr 26 16:14:37 UTC 2023","Wed Apr 26 16:15:35 UTC 2023","58600","","JIT-Database-015a-INDEX-Check-duplicate-empty","","JIT-Database-015a-INDEX-Check-duplicate-empty","[INDEX] As a user, I check empty and duplicate index","[INDEX] As a user, I check empty and duplicate index",""
"passed","Wed Apr 26 16:22:08 UTC 2023","Wed Apr 26 16:23:08 UTC 2023","59756","","JIT-Mobile-022a-TEXT-General-info","","JIT-Mobile-022a-TEXT-General-info","[MOBILE-TEXT] As a user, I should check the general infomation of Text is correct: Name, Key, unique key, delete component","[MOBILE-TEXT] As a user, I should check the general infomation of Text is correct: Name, Key, unique key, delete component",""
"passed","Wed Apr 26 16:39:45 UTC 2023","Wed Apr 26 16:41:06 UTC 2023","81244","","JIT-Web-001h01-PAGE-DEFECT-Create-page-slug-contains-another-page","","JIT-Web-001h01-PAGE-DEFECT-Create-page-slug-contains-another-page","[PAGE - DEFECT] As a user, I can check DEFECT if create new page with slug contains existing page","[PAGE - DEFECT] As a user, I can check DEFECT if create new page with slug contains existing page",""
"passed","Wed Apr 26 16:05:46 UTC 2023","Wed Apr 26 16:06:31 UTC 2023","44918","","JIT-Database-003a-COLUMN-empty","","JIT-Database-003a-COLUMN-empty","[COLUMN] As a user, I cannot add empty column definition","[COLUMN] As a user, I cannot add empty column definition",""
"passed","Wed Apr 26 16:45:57 UTC 2023","Wed Apr 26 16:47:34 UTC 2023","96619","","JIT-Web-004a-ACTION-NAVIGATION-no-param","","JIT-Web-004a-ACTION-NAVIGATION-no-param","[WEB-ACTION-NAVIGATION] As a user, I could add action type navigation without params and check preview code","[WEB-ACTION-NAVIGATION] As a user, I could add action type navigation without params and check preview code",""
"passed","Wed Apr 26 16:22:01 UTC 2023","Wed Apr 26 16:23:02 UTC 2023","60582","","JIT-Mobile-021-DEFECT.Params.keep-params-after-refresh-page","","JIT-Mobile-021-DEFECT.Params.keep-params-after-refresh-page","[DEFECT] As a user, I should check the params will be kept after refresh page","[DEFECT] As a user, I should check the params will be kept after refresh page",""
"passed","Wed Apr 26 16:06:55 UTC 2023","Wed Apr 26 16:09:27 UTC 2023","152632","","JIT-Database-006-COLUMN-type-STRING","","JIT-Database-006-COLUMN-type-STRING","[COLUMN] As a user, I should check the validation of STRING column definition","[COLUMN] As a user, I should check the validation of STRING column definition",""
"passed","Wed Apr 26 17:06:30 UTC 2023","Wed Apr 26 17:08:31 UTC 2023","120834","","JIT-API-007e-PUT-API-Add-new-endpoint","","JIT-API-007e-PUT-API-Add-new-endpoint","[PUT-API] Create, update and delete new PUT API endpoint","[PUT-API] Create, update and delete new PUT API endpoint",""
"passed","Wed Apr 26 17:35:43 UTC 2023","Wed Apr 26 17:36:50 UTC 2023","66943","","JIT-Web-001b-PAGE-Update","","JIT-Web-001b-PAGE-Update","[PAGE] As a user, I can update page with positive and negative cases","[PAGE] As a user, I can update page with positive and negative cases",""
"passed","Wed Apr 26 16:51:24 UTC 2023","Wed Apr 26 16:55:03 UTC 2023","218451","","JIT-Web-011d-SETTING-PROJECT-VARIABLE-CSS-Check-deleting-PV","","JIT-Web-011d-SETTING-PROJECT-VARIABLE-CSS-Check-deleting-PV","[SETTING-PROJECT-VARIABLE-CSS] As a user, I delete the PV,  should show the static value of the deleted PV","[SETTING-PROJECT-VARIABLE-CSS] As a user, I delete the PV,  should show the static value of the deleted PV",""
"passed","Wed Apr 26 16:17:29 UTC 2023","Wed Apr 26 16:18:42 UTC 2023","72829","","JIT-Mobile-005-MOLECULE-Create-new","","JIT-Mobile-005-MOLECULE-Create-new","[MOBILE-MOLECULE] As a user, I can create new molecule with positive and negative cases","[MOBILE-MOLECULE] As a user, I can create new molecule with positive and negative cases",""
"passed","Wed Apr 26 17:44:17 UTC 2023","Wed Apr 26 17:46:29 UTC 2023","132847","","JIT-API-009-Auto-fill","","JIT-API-009-Auto-fill","[AUTO-FILL] As a user, I could add request param by Auto-fill","[AUTO-FILL] As a user, I could add request param by Auto-fill",""
"passed","Wed Apr 26 16:35:36 UTC 2023","Wed Apr 26 16:36:41 UTC 2023","65081","","JIT-Team-005-Invite-duplicate-email","","JIT-Team-005-Invite-duplicate-email","[INVITE-DELETE] Invite new email and invite again","[INVITE-DELETE] Invite new email and invite again",""
"passed","Wed Apr 26 16:46:41 UTC 2023","Wed Apr 26 16:49:23 UTC 2023","161995","","JIT-Web-007a-ASSET-Upload","","JIT-Web-007a-ASSET-Upload","[ASSET] As a user, I can upload new image and store in Asset Manager and use it in all Image component","[ASSET] As a user, I can upload new image and store in Asset Manager and use it in all Image component",""
