"Status","Start Time","Stop Time","Duration in ms","Parent Suite","Suite","Sub Suite","Test Class","Test Method","Name","Description"
"passed","Wed Apr 26 16:17:13 UTC 2023","Wed Apr 26 16:18:48 UTC 2023","95624","","JIT-Mobile-002-SCREEN-Update","","JIT-Mobile-002-SCREEN-Update","[MOBILE-SCREEN] As a user, I can update screen with positive and negative cases","[MOBILE-SCREEN] As a user, I can update screen with positive and negative cases",""
"passed","Wed Apr 26 16:44:40 UTC 2023","Wed Apr 26 16:47:13 UTC 2023","152927","","JIT-Web-002h-MOLECULE-New-with-cate","","JIT-Web-002h-MOLECULE-New-with-cate","[WEB-MOLECULE-CATE] As a user, I can create new molecule","[WEB-MOLECULE-CATE] As a user, I can create new molecule",""
"passed","Wed Apr 26 16:57:32 UTC 2023","Wed Apr 26 16:59:57 UTC 2023","144911","","JIT-API-003b-POST-update-info","","JIT-API-003b-POST-update-info","As a user, I update info for API POST","As a user, I update info for API POST",""
"passed","Wed Apr 26 16:27:14 UTC 2023","Wed Apr 26 16:28:47 UTC 2023","93427","","JIT-Mobile-042a-ACTION-NAVIGATION-no-param","","JIT-Mobile-042a-ACTION-NAVIGATION-no-param","[MOBILE-ACTION-NAVIGATION] As a user, I could add action type navigation without params and check preview code","[MOBILE-ACTION-NAVIGATION] As a user, I could add action type navigation without params and check preview code",""
"passed","Wed Apr 26 16:38:14 UTC 2023","Wed Apr 26 16:39:51 UTC 2023","97014","","JIT-Web-001g-PAGE-FIGMA-Import","","JIT-Web-001g-PAGE-FIGMA-Import","[PAGE-FIGMA] As a user, I can import the figma file to the jitera studio","[PAGE-FIGMA] As a user, I can import the figma file to the jitera studio",""
"passed","Wed Apr 26 16:22:45 UTC 2023","Wed Apr 26 16:23:49 UTC 2023","64117","","JIT-Mobile-027b-IMAGE-General-info","","JIT-Mobile-027b-IMAGE-General-info","[MOBILE-IMAGE] As a user, I should check the general infomation of Image is correct: Name, Key, unique key, delete component","[MOBILE-IMAGE] As a user, I should check the general infomation of Image is correct: Name, Key, unique key, delete component",""
"passed","Wed Apr 26 16:46:48 UTC 2023","Wed Apr 26 16:49:23 UTC 2023","155318","","JIT-Web-007b-ASSET-Rename-and-delete","","JIT-Web-007b-ASSET-Rename-and-delete","[ASSET] As a user, I can rename and delete image asset","[ASSET] As a user, I can rename and delete image asset",""
"passed","Wed Apr 26 16:56:26 UTC 2023","Wed Apr 26 16:58:13 UTC 2023","106416","","JIT-API-002c-GET-list","","JIT-API-002c-GET-list","As a user, I check column display when having relation for GET-list","As a user, I check column display when having relation for GET-list",""
"passed","Wed Apr 26 17:10:15 UTC 2023","Wed Apr 26 17:13:01 UTC 2023","166155","","JIT-Database-015c-INDEX-CRUD-multiple","","JIT-Database-015c-INDEX-CRUD-multiple","[INDEX] As a user, I check add and update single index","[INDEX] As a user, I check add and update single index",""
"passed","Wed Apr 26 16:40:04 UTC 2023","Wed Apr 26 16:41:55 UTC 2023","110690","","JIT-Web-001h02-PAGE-DEFECT-Expand-Collapse-folder","","JIT-Web-001h02-PAGE-DEFECT-Expand-Collapse-folder","[PAGE - DEFECT] As a user, I can check DEFECT expand and collapse folder","[PAGE - DEFECT] As a user, I can check DEFECT expand and collapse folder",""
"passed","Wed Apr 26 16:30:29 UTC 2023","Wed Apr 26 16:32:12 UTC 2023","103225","","JIT-Module-005b-FORCE-MOBILE-UPDATE-api","","JIT-Module-005b-FORCE-MOBILE-UPDATE-api","[FORCE-MOBILE-UPDATE] - Check api","[FORCE-MOBILE-UPDATE] - Check api",""
"passed","Wed Apr 26 17:03:11 UTC 2023","Wed Apr 26 17:03:56 UTC 2023","45109","","JIT-API-007a-GROUP-API-CRUD","","JIT-API-007a-GROUP-API-CRUD","[GROUP-API] Create, update and delete group API","[GROUP-API] Create, update and delete group API",""
"passed","Wed Apr 26 17:46:37 UTC 2023","Wed Apr 26 17:47:53 UTC 2023","76482","","JIT-Database-015i-INDEX-DATETIME-column-config","","JIT-Database-015i-INDEX-DATETIME-column-config","[INDEX-DATETIME] As a user, I config index from column setting && check on index popup","[INDEX-DATETIME] As a user, I config index from column setting && check on index popup",""
"passed","Wed Apr 26 16:23:36 UTC 2023","Wed Apr 26 16:24:44 UTC 2023","68431","","JIT-Mobile-028b-ICON-General-info","","JIT-Mobile-028b-ICON-General-info","[MOBILE-ICON] As a user, I should check the general infomation of Icon is correct: Name, Key, unique key, delete component","[MOBILE-ICON] As a user, I should check the general infomation of Icon is correct: Name, Key, unique key, delete component",""
"passed","Wed Apr 26 17:00:12 UTC 2023","Wed Apr 26 17:01:38 UTC 2023","86097","","JIT-API-004c-GET-detail-relation","","JIT-API-004c-GET-detail-relation","As a user, I check column display when having relation for GET-detail","As a user, I check column display when having relation for GET-detail",""
"passed","Wed Apr 26 17:12:17 UTC 2023","Wed Apr 26 17:13:52 UTC 2023","95337","","JIT-Database-015f-INDEX-INTEGER-column-config","","JIT-Database-015f-INDEX-INTEGER-column-config","[INDEX-INTEGER] As a user, I config index from column setting && check on index popup","[INDEX-INTEGER] As a user, I config index from column setting && check on index popup",""
"passed","Wed Apr 26 16:09:45 UTC 2023","Wed Apr 26 16:10:48 UTC 2023","63272","","JIT-Database-010a-COLUMN-FILE-validation","","JIT-Database-010a-COLUMN-FILE-validation","[COLUMN] As a user, I should check the validation of FILE column definition","[COLUMN] As a user, I should check the validation of FILE column definition",""
"passed","Wed Apr 26 16:50:33 UTC 2023","Wed Apr 26 16:54:24 UTC 2023","230557","","JIT-Web-011c-SETTING-PROJECT-VARIABLE-CSS-Check-update-PV","","JIT-Web-011c-SETTING-PROJECT-VARIABLE-CSS-Check-update-PV","[SETTING-PROJECT-VARIABLE-CSS] As a user, I update the PV name & value, check reflection on edtior","[SETTING-PROJECT-VARIABLE-CSS] As a user, I update the PV name & value, check reflection on edtior",""
"passed","Wed Apr 26 17:41:41 UTC 2023","Wed Apr 26 17:42:38 UTC 2023","56526","","JIT-API-001-Check-general-info","","JIT-API-001-Check-general-info","As a user, I check general info","As a user, I check general info",""
"failed","Wed Apr 26 17:36:57 UTC 2023","Wed Apr 26 17:37:36 UTC 2023","38807","","JIT-Web-003a-PREVIEW-NAVIGATION-no-navigation-setup","","JIT-Web-003a-PREVIEW-NAVIGATION-no-navigation-setup","[WEB-PREVIEW-NAVIGATION] As a user, I could open preview screen with default page","[WEB-PREVIEW-NAVIGATION] As a user, I could open preview screen with default page",""
"passed","Wed Apr 26 16:36:58 UTC 2023","Wed Apr 26 16:38:09 UTC 2023","70957","","JIT-Web-001c-PAGE-Delete","","JIT-Web-001c-PAGE-Delete","[PAGE] As a user, I can delete page","[PAGE] As a user, I can delete page",""
"passed","Wed Apr 26 17:08:42 UTC 2023","Wed Apr 26 17:09:55 UTC 2023","72354","","JIT-API-010a-DEFECT-Check-special-symbol-request-param","","JIT-API-010a-DEFECT-Check-special-symbol-request-param","As a user, I want to validate and prevent the special symbol for request params.","As a user, I want to validate and prevent the special symbol for request params.",""
"passed","Wed Apr 26 16:04:20 UTC 2023","Wed Apr 26 16:05:32 UTC 2023","71443","","JIT-Database-001a-TABLE-new","","JIT-Database-001a-TABLE-new","[TABLE] As a user, I can create new table","[TABLE] As a user, I can create new table",""
"passed","Wed Apr 26 17:33:17 UTC 2023","Wed Apr 26 17:33:56 UTC 2023","38743","","JIT-Module-014b-BASIC-AUTH-edit-infos","","JIT-Module-014b-BASIC-AUTH-edit-infos","[BASIC-AUTH] As a user, I can update module Basic Authentication","[BASIC-AUTH] As a user, I can update module Basic Authentication",""
"passed","Wed Apr 26 17:04:26 UTC 2023","Wed Apr 26 17:06:38 UTC 2023","132316","","JIT-API-007d-POST-API-Add-new-endpoint","","JIT-API-007d-POST-API-Add-new-endpoint","[GET-POST] Create, update and delete new POST API endpoint","[GET-POST] Create, update and delete new POST API endpoint",""
"passed","Wed Apr 26 16:13:28 UTC 2023","Wed Apr 26 16:15:04 UTC 2023","96521","","JIT-Database-012e-RELATION-trigger-by-button","","JIT-Database-012e-RELATION-trigger-by-button","[RELATION] check the basic relation","[RELATION] check the basic relation",""
"passed","Wed Apr 26 16:25:15 UTC 2023","Wed Apr 26 16:26:14 UTC 2023","59549","","JIT-Mobile-032b-CAROUSEL-General-info","","JIT-Mobile-032b-CAROUSEL-General-info","[MOBILE-CAROUSEL] As a user, I should check the general infomation of Carousel is correct: Name, Key, unique key, delete component","[MOBILE-CAROUSEL] As a user, I should check the general infomation of Carousel is correct: Name, Key, unique key, delete component",""
"passed","Wed Apr 26 16:06:39 UTC 2023","Wed Apr 26 16:08:26 UTC 2023","107234","","JIT-Database-005-COLUMN-type-FLOAT","","JIT-Database-005-COLUMN-type-FLOAT","[COLUMN] As a user, I should check the validation of FLOAT column definition","[COLUMN] As a user, I should check the validation of FLOAT column definition",""
"passed","Wed Apr 26 17:34:03 UTC 2023","Wed Apr 26 17:34:31 UTC 2023","27780","","JIT-Module-015b-SCOUT-edit-infos","","JIT-Module-015b-SCOUT-edit-infos","[SCOUT] As a user, I can update module Scout","[SCOUT] As a user, I can update module Scout",""
"passed","Wed Apr 26 16:04:20 UTC 2023","Wed Apr 26 16:05:22 UTC 2023","61955","","JIT-Database-001d-TABLE-update","","JIT-Database-001d-TABLE-update","[TABLE] As a user, I can update the value of the table","[TABLE] As a user, I can update the value of the table",""
"passed","Wed Apr 26 16:56:14 UTC 2023","Wed Apr 26 16:58:47 UTC 2023","153221","","JIT-API-002b-GET-list-update-info","","JIT-API-002b-GET-list-update-info","As a user, I update info for GET-list","As a user, I update info for GET-list",""
"passed","Wed Apr 26 17:14:46 UTC 2023","Wed Apr 26 17:16:24 UTC 2023","97860","","JIT-Database-015l-INDEX-ENUM-column-config","","JIT-Database-015l-INDEX-ENUM-column-config","[INDEX-ENUM] As a user, I config index from column setting && check on index popup","[INDEX-ENUM] As a user, I config index from column setting && check on index popup",""
"passed","Wed Apr 26 17:03:54 UTC 2023","Wed Apr 26 17:06:08 UTC 2023","133553","","JIT-API-007ba-GET-list-API-Add-new-endpoint","","JIT-API-007ba-GET-list-API-Add-new-endpoint","[GET-list-API] Create, update and delete new GET API endpoint","[GET-list-API] Create, update and delete new GET API endpoint",""
"passed","Wed Apr 26 16:12:27 UTC 2023","Wed Apr 26 16:13:38 UTC 2023","70518","","JIT-Database-012a-RELATION-basic","","JIT-Database-012a-RELATION-basic","[RELATION] check the basic relation","[RELATION] check the basic relation",""
"passed","Wed Apr 26 16:57:32 UTC 2023","Wed Apr 26 16:59:28 UTC 2023","116623","","JIT-API-003a-POST-check-default","","JIT-API-003a-POST-check-default","As a user, I check default value in API POST","As a user, I check default value in API POST",""
"passed","Wed Apr 26 17:04:19 UTC 2023","Wed Apr 26 17:06:31 UTC 2023","132193","","JIT-API-007bb-GET-list-API-Check-datetime-static-value","","JIT-API-007bb-GET-list-API-Check-datetime-static-value","[GET-list-API] Set datetime static value","[GET-list-API] Set datetime static value",""
"passed","Wed Apr 26 16:11:03 UTC 2023","Wed Apr 26 16:12:05 UTC 2023","62029","","JIT-Database-011c-COLUMN-ENUM-delete-items","","JIT-Database-011c-COLUMN-ENUM-delete-items","[COLUMN] As a user, I should delete 1 item and check not display in default dropdown","[COLUMN] As a user, I should delete 1 item and check not display in default dropdown",""
"passed","Wed Apr 26 16:19:28 UTC 2023","Wed Apr 26 16:21:24 UTC 2023","116649","","JIT-Mobile-012-JITDEF-remove-poperty-info-after-deleting-navigation","","JIT-Mobile-012-JITDEF-remove-poperty-info-after-deleting-navigation","[DEFECT] As a user, I should see the property infos need to be removed after the navigation was deleted","[DEFECT] As a user, I should see the property infos need to be removed after the navigation was deleted",""
"passed","Wed Apr 26 16:24:22 UTC 2023","Wed Apr 26 16:25:22 UTC 2023","59029","","JIT-Mobile-031b-DIVIDER-General-info","","JIT-Mobile-031b-DIVIDER-General-info","[MOBILE-DIVIDER] As a user, I should check the general infomation of Divider is correct: Name, Key, unique key, delete component","[MOBILE-DIVIDER] As a user, I should check the general infomation of Divider is correct: Name, Key, unique key, delete component",""
"passed","Wed Apr 26 16:34:03 UTC 2023","Wed Apr 26 16:34:49 UTC 2023","46674","","JIT-Module-017a-GOOGLE-ANAL-default","","JIT-Module-017a-GOOGLE-ANAL-default","[GOOGLE-ANAL] As a user, I can add module Google Analytics and remove it","[GOOGLE-ANAL] As a user, I can add module Google Analytics and remove it",""
"passed","Wed Apr 26 16:34:20 UTC 2023","Wed Apr 26 16:35:10 UTC 2023","49486","","JIT-Module-019a-GOOGLE-ANALYTICS-default","","JIT-Module-019a-GOOGLE-ANALYTICS-default","[GOOGLE-ANALYTICS] As a user, I can add module Google Analytics and remove it","[GOOGLE-ANALYTICS] As a user, I can add module Google Analytics and remove it",""
"passed","Wed Apr 26 16:37:12 UTC 2023","Wed Apr 26 16:39:13 UTC 2023","121353","","JIT-Web-001f-PAGE-Export-and-import","","JIT-Web-001f-PAGE-Export-and-import","[PAGE] As a user, I can create new screen by import and export the screen","[PAGE] As a user, I can create new screen by import and export the screen",""
"passed","Wed Apr 26 16:30:53 UTC 2023","Wed Apr 26 16:32:13 UTC 2023","80429","","JIT-Module-006b-SMS-edit-infos","","JIT-Module-006b-SMS-edit-infos","[SMS], I can add module SMS login with Twilio and edit its infos","[SMS], I can add module SMS login with Twilio and edit its infos",""
"passed","Wed Apr 26 16:12:47 UTC 2023","Wed Apr 26 16:14:05 UTC 2023","78630","","JIT-Database-012c-RELATION-multiple-1-direction","","JIT-Database-012c-RELATION-multiple-1-direction","[RELATION], I should add multiple relation 1 direction","[RELATION], I should add multiple relation 1 direction",""
"passed","Wed Apr 26 16:11:23 UTC 2023","Wed Apr 26 16:12:23 UTC 2023","59833","","JIT-Database-011d-COLUMN-ENUM-delete-selected-items","","JIT-Database-011d-COLUMN-ENUM-delete-selected-items","[COLUMN] As a user, I should delete 1 selected item and check is will be removed in default dropdown","[COLUMN] As a user, I should delete 1 selected item and check is will be removed in default dropdown",""
"broken","Wed Apr 26 17:39:12 UTC 2023","Wed Apr 26 17:40:05 UTC 2023","52723","","JIT-Web-009a-TABLE-Add-new","","JIT-Web-009a-TABLE-Add-new","[TABLE] As a user, I can create new Admin page","[TABLE] As a user, I can create new Admin page",""
"passed","Wed Apr 26 17:01:57 UTC 2023","Wed Apr 26 17:03:35 UTC 2023","97402","","JIT-API-005c-PUT-relation","","JIT-API-005c-PUT-relation","As a user, I check column display when having relation for API PUT","As a user, I check column display when having relation for API PUT",""
"passed","Wed Apr 26 16:08:54 UTC 2023","Wed Apr 26 16:10:03 UTC 2023","69664","","JIT-Database-009-COLUMN-type-BOOLEAN","","JIT-Database-009-COLUMN-type-BOOLEAN","[COLUMN] As a user, I should check the validation of BOOLEAN column definition","[COLUMN] As a user, I should check the validation of BOOLEAN column definition",""
"passed","Wed Apr 26 16:11:40 UTC 2023","Wed Apr 26 16:12:37 UTC 2023","56745","","JIT-Database-011e-COLUMN-ENUM-delete-all","","JIT-Database-011e-COLUMN-ENUM-delete-all","[COLUMN] As a user, I should delete all items and check all items are not displayed","[COLUMN] As a user, I should delete all items and check all items are not displayed",""
"passed","Wed Apr 26 16:23:48 UTC 2023","Wed Apr 26 16:24:47 UTC 2023","58799","","JIT-Mobile-029b-TOUCHABLE-General-info","","JIT-Mobile-029b-TOUCHABLE-General-info","[MOBILE-TOUCHABLE] As a user, I should check the general infomation of Touchable is correct: Name, Key, unique key, delete component","[MOBILE-TOUCHABLE] As a user, I should check the general infomation of Touchable is correct: Name, Key, unique key, delete component",""
"passed","Wed Apr 26 17:02:02 UTC 2023","Wed Apr 26 17:04:01 UTC 2023","119067","","JIT-API-006a-DELETE-check-default","","JIT-API-006a-DELETE-check-default","As a user, I check default value in API DELETE","As a user, I check default value in API DELETE",""
"passed","Wed Apr 26 16:29:23 UTC 2023","Wed Apr 26 16:30:07 UTC 2023","43673","","JIT-Module-002a-DEEPLINK-default","","JIT-Module-002a-DEEPLINK-default","As a user, I can add module Deeplink and remove it","As a user, I can add module Deeplink and remove it",""
"passed","Wed Apr 26 16:18:49 UTC 2023","Wed Apr 26 16:19:44 UTC 2023","54840","","JIT-Mobile-007-MOLECULE-Delete","","JIT-Mobile-007-MOLECULE-Delete","[MOBILE-MOLECULE] As a user, I can delete molecule","[MOBILE-MOLECULE] As a user, I can delete molecule",""
"passed","Wed Apr 26 16:15:59 UTC 2023","Wed Apr 26 16:17:39 UTC 2023","99447","","JIT-Mobile-001a-SCREEN-Search","","JIT-Mobile-001a-SCREEN-Search","[MOBILE-SCREEN] As a user, I can search correct screen with keyword","[MOBILE-SCREEN] As a user, I can search correct screen with keyword",""
"passed","Wed Apr 26 16:38:31 UTC 2023","Wed Apr 26 16:41:15 UTC 2023","163108","","JIT-Web-001h-PAGE-Create-multiple-level-slug","","JIT-Web-001h-PAGE-Create-multiple-level-slug","[PAGE] As a user, I can create new screen with multiple level slug","[PAGE] As a user, I can create new screen with multiple level slug",""
"passed","Wed Apr 26 17:10:33 UTC 2023","Wed Apr 26 17:12:07 UTC 2023","93572","","JIT-Database-015d-INDEX-STRING-column-config","","JIT-Database-015d-INDEX-STRING-column-config","[INDEX-STRING] As a user, I config index from column setting && check on index popup","[INDEX-STRING] As a user, I config index from column setting && check on index popup",""
"passed","Wed Apr 26 16:32:45 UTC 2023","Wed Apr 26 16:33:41 UTC 2023","55173","","JIT-Module-014a-BASIC-AUTH-default","","JIT-Module-014a-BASIC-AUTH-default","[BASIC-AUTH] As a user, I can add module Basic Authentication and remove it","[BASIC-AUTH] As a user, I can add module Basic Authentication and remove it",""
"passed","Wed Apr 26 16:29:28 UTC 2023","Wed Apr 26 16:30:34 UTC 2023","65671","","JIT-Module-002b-DEEPLINK-edit-infos","","JIT-Module-002b-DEEPLINK-edit-infos","As a user, I can update module Deeplink","As a user, I can update module Deeplink",""
"passed","Wed Apr 26 16:25:29 UTC 2023","Wed Apr 26 16:26:28 UTC 2023","59134","","JIT-Mobile-033b-HEADER-General-info","","JIT-Mobile-033b-HEADER-General-info","[MOBILE-HEADER] As a user, I should check the general infomation of Header is correct: Name, Key, unique key, delete component","[MOBILE-HEADER] As a user, I should check the general infomation of Header is correct: Name, Key, unique key, delete component",""
"passed","Wed Apr 26 16:41:44 UTC 2023","Wed Apr 26 16:42:49 UTC 2023","64696","","JIT-Web-002c-MOLECULE-Delete","","JIT-Web-002c-MOLECULE-Delete","[WEB-MOLECULE] As a user, I can delete molecule","[WEB-MOLECULE] As a user, I can delete molecule",""
"passed","Wed Apr 26 17:40:13 UTC 2023","Wed Apr 26 17:40:34 UTC 2023","21491","","JIT-Database-001b-TABLE-empty","","JIT-Database-001b-TABLE-empty","[TABLE] As a user, I cannot create table with empty name","[TABLE] As a user, I cannot create table with empty name",""
"passed","Wed Apr 26 16:10:02 UTC 2023","Wed Apr 26 16:11:07 UTC 2023","64920","","JIT-Database-011a-COLUMN-ENUM-default","","JIT-Database-011a-COLUMN-ENUM-default","[COLUMN] As a user, I should check the basic validation","[COLUMN] As a user, I should check the basic validation",""
"passed","Wed Apr 26 16:29:46 UTC 2023","Wed Apr 26 16:30:37 UTC 2023","50986","","JIT-Module-004a-EMAIL-LOGIN-default","","JIT-Module-004a-EMAIL-LOGIN-default","[EMAIL-LOGIN] - Check adding and auto-generated API","[EMAIL-LOGIN] - Check adding and auto-generated API",""
"passed","Wed Apr 26 16:40:07 UTC 2023","Wed Apr 26 16:41:37 UTC 2023","90589","","JIT-Web-002a-MOLECULE-Create-new","","JIT-Web-002a-MOLECULE-Create-new","[WEB-MOLECULE] As a user, I can create new molecule with positive and negative cases","[WEB-MOLECULE] As a user, I can create new molecule with positive and negative cases",""
"passed","Wed Apr 26 17:14:10 UTC 2023","Wed Apr 26 17:15:24 UTC 2023","73944","","JIT-Database-015k-INDEX-BOOLEAN-column-config","","JIT-Database-015k-INDEX-BOOLEAN-column-config","[INDEX-BOOLEAN] As a user, I config index from column setting && check on index popup","[INDEX-BOOLEAN] As a user, I config index from column setting && check on index popup",""
"passed","Wed Apr 26 17:01:28 UTC 2023","Wed Apr 26 17:03:56 UTC 2023","147583","","JIT-API-005b-PUT-update-info","","JIT-API-005b-PUT-update-info","As a user, I update info for API PUT","As a user, I update info for API PUT",""
"passed","Wed Apr 26 16:53:24 UTC 2023","Wed Apr 26 16:55:43 UTC 2023","138929","","JIT-Web-011f-SETTING-PROJECT-VARIABLE-CSS-DEFECT-Check-icon-image","","JIT-Web-011f-SETTING-PROJECT-VARIABLE-CSS-DEFECT-Check-icon-image","[SETTING-PROJECT-VARIABLE-CSS-DEFECT] As a user, I check icon and image can apply to PV without error","[SETTING-PROJECT-VARIABLE-CSS-DEFECT] As a user, I check icon and image can apply to PV without error",""
"passed","Wed Apr 26 16:27:04 UTC 2023","Wed Apr 26 16:27:46 UTC 2023","42847","","JIT-Mobile-041a-PREVIEW-NAVIGATION-no-navigation-setup","","JIT-Mobile-041a-PREVIEW-NAVIGATION-no-navigation-setup","[MOBILE-PREVIEW-NAVIGATION] As a user, I could open preview screen with notification should setup the screen navigation","[MOBILE-PREVIEW-NAVIGATION] As a user, I could open preview screen with notification should setup the screen navigation",""
"passed","Wed Apr 26 17:04:18 UTC 2023","Wed Apr 26 17:06:25 UTC 2023","127379","","JIT-API-007c-GET-detail-API-Add-new-endpoint","","JIT-API-007c-GET-detail-API-Add-new-endpoint","[GET-detail-API] Create, update and delete new GET API endpoint","[GET-detail-API] Create, update and delete new GET API endpoint",""
"passed","Wed Apr 26 17:08:55 UTC 2023","Wed Apr 26 17:10:13 UTC 2023","77989","","JIT-API-010b-DEFECT-Check-JSON-path","","JIT-API-010b-DEFECT-Check-JSON-path","As a user, I want to check the option in dropdown show correct JSON path.","As a user, I want to check the option in dropdown show correct JSON path.",""
"passed","Wed Apr 26 17:14:51 UTC 2023","Wed Apr 26 17:16:46 UTC 2023","115129","","JIT-Database-015m-INDEX-ALL-column-config","","JIT-Database-015m-INDEX-ALL-column-config","[INDEX-ALL] As a user, I config with multiple column and check show multiple on index pop-up","[INDEX-ALL] As a user, I config with multiple column and check show multiple on index pop-up",""
"passed","Wed Apr 26 17:12:45 UTC 2023","Wed Apr 26 17:14:25 UTC 2023","100068","","JIT-Database-015g-INDEX-FLOAT-column-config","","JIT-Database-015g-INDEX-FLOAT-column-config","[INDEX-FLOAT] As a user, I config index from column setting && check on index popup","[INDEX-FLOAT] As a user, I config index from column setting && check on index popup",""
"passed","Wed Apr 26 16:08:42 UTC 2023","Wed Apr 26 16:09:39 UTC 2023","56927","","JIT-Database-008-COLUMN-type-DATE-TIME","","JIT-Database-008-COLUMN-type-DATE-TIME","[COLUMN] As a user, I should check the validation of DATETIME column definition","[COLUMN] As a user, I should check the validation of DATETIME column definition",""
"passed","Wed Apr 26 16:19:57 UTC 2023","Wed Apr 26 16:21:20 UTC 2023","83335","","JIT-Mobile-013-JITDEF-reflect-delete-screen-innavigation-tree","","JIT-Mobile-013-JITDEF-reflect-delete-screen-innavigation-tree","[DEFECT] As a user, I should see screen will be removed in navigation tree after deleting screen","[DEFECT] As a user, I should see screen will be removed in navigation tree after deleting screen",""
"passed","Wed Apr 26 17:42:45 UTC 2023","Wed Apr 26 17:44:09 UTC 2023","84323","","JIT-API-002a-GET-list-check-default","","JIT-API-002a-GET-list-check-default","As a user, I check default value in API GET list","As a user, I check default value in API GET list",""
"passed","Wed Apr 26 16:06:39 UTC 2023","Wed Apr 26 16:08:35 UTC 2023","115665","","JIT-Database-004-COLUMN-type-INTEGER","","JIT-Database-004-COLUMN-type-INTEGER","[COLUMN] As a user, I should check the validation of INTEGER column definition","[COLUMN] As a user, I should check the validation of INTEGER column definition",""
"passed","Wed Apr 26 16:05:30 UTC 2023","Wed Apr 26 16:06:17 UTC 2023","46203","","JIT-Database-001e-TABLE-create-by-context-menu","","JIT-Database-001e-TABLE-create-by-context-menu","[TABLE] As a user, I can create new table by context menu","[TABLE] As a user, I can create new table by context menu",""
"passed","Wed Apr 26 16:19:22 UTC 2023","Wed Apr 26 16:20:24 UTC 2023","61637","","JIT-Mobile-011-JITDEF50-disable-add-duplicate-screen-in-stack","","JIT-Mobile-011-JITDEF50-disable-add-duplicate-screen-in-stack","[DEFECT] As a user, I could add duplicate screen in stack","[DEFECT] As a user, I could add duplicate screen in stack",""
"passed","Wed Apr 26 16:15:24 UTC 2023","Wed Apr 26 16:16:47 UTC 2023","83078","","JIT-Database-016b-COUNTER-CACHE-Create-by-adding-column","","JIT-Database-016b-COUNTER-CACHE-Create-by-adding-column","[COUNTER-CACHE] create new counter cache column by adding column","[COUNTER-CACHE] create new counter cache column by adding column",""
"passed","Wed Apr 26 17:37:44 UTC 2023","Wed Apr 26 17:39:05 UTC 2023","80662","","JIT-Web-008a-ADMIN-PAGE-Create-new","","JIT-Web-008a-ADMIN-PAGE-Create-new","[ADMIN-PAGE] As a user, I can create new Admin page","[ADMIN-PAGE] As a user, I can create new Admin page",""
"passed","Wed Apr 26 16:30:51 UTC 2023","Wed Apr 26 16:32:29 UTC 2023","98246","","JIT-Module-006a-SMS-default","","JIT-Module-006a-SMS-default","[SMS], I can add module SMS login with Twilio and remove it","[SMS], I can add module SMS login with Twilio and remove it",""
