"Status","Start Time","Stop Time","Duration in ms","Parent Suite","Suite","Sub Suite","Test Class","Test Method","Name","Description"
"passed","Thu Apr 20 16:25:57 UTC 2023","Thu Apr 20 16:27:31 UTC 2023","93291","","JIT-Module-005b-FORCE-MOBILE-UPDATE-api","","JIT-Module-005b-FORCE-MOBILE-UPDATE-api","[FORCE-MOBILE-UPDATE] - Check api","[FORCE-MOBILE-UPDATE] - Check api",""
"passed","Thu Apr 20 17:39:07 UTC 2023","Thu Apr 20 17:40:26 UTC 2023","78862","","JIT-API-007bb-GET-list-API-Check-datetime-static-value","","JIT-API-007bb-GET-list-API-Check-datetime-static-value","[GET-list-API] Set datetime static value","[GET-list-API] Set datetime static value",""
"passed","Thu Apr 20 16:16:52 UTC 2023","Thu Apr 20 16:17:55 UTC 2023","62894","","JIT-Mobile-012-JITDEF-remove-poperty-info-after-deleting-navigation","","JIT-Mobile-012-JITDEF-remove-poperty-info-after-deleting-navigation","[DEFECT] As a user, I should see the property infos need to be removed after the navigation was deleted","[DEFECT] As a user, I should see the property infos need to be removed after the navigation was deleted",""
"passed","Thu Apr 20 16:20:24 UTC 2023","Thu Apr 20 16:21:16 UTC 2023","52585","","JIT-Mobile-029b-TOUCHABLE-General-info","","JIT-Mobile-029b-TOUCHABLE-General-info","[MOBILE-TOUCHABLE] As a user, I should check the general infomation of Touchable is correct: Name, Key, unique key, delete component","[MOBILE-TOUCHABLE] As a user, I should check the general infomation of Touchable is correct: Name, Key, unique key, delete component",""
"passed","Thu Apr 20 16:34:04 UTC 2023","Thu Apr 20 16:35:12 UTC 2023","67454","","JIT-Web-001h01-PAGE-DEFECT-Create-page-slug-contains-another-page","","JIT-Web-001h01-PAGE-DEFECT-Create-page-slug-contains-another-page","[PAGE - DEFECT] As a user, I can check DEFECT if create new page with slug contains existing page","[PAGE - DEFECT] As a user, I can check DEFECT if create new page with slug contains existing page",""
"passed","Thu Apr 20 16:17:34 UTC 2023","Thu Apr 20 16:18:45 UTC 2023","70731","","JIT-Mobile-014-JITDEF-status-bar","","JIT-Mobile-014-JITDEF-status-bar","[DEFECT] As a user, I should see screen will be removed in navigation tree after deleting screen","[DEFECT] As a user, I should see screen will be removed in navigation tree after deleting screen",""
"passed","Thu Apr 20 16:10:46 UTC 2023","Thu Apr 20 16:11:57 UTC 2023","71249","","JIT-Database-012a-RELATION-basic","","JIT-Database-012a-RELATION-basic","[RELATION] check the basic relation","[RELATION] check the basic relation",""
"passed","Thu Apr 20 16:15:05 UTC 2023","Thu Apr 20 16:15:55 UTC 2023","50185","","JIT-Mobile-003-SCREEN-Delete","","JIT-Mobile-003-SCREEN-Delete","[MOBILE-SCREEN] As a user, I can delete screen","[MOBILE-SCREEN] As a user, I can delete screen",""
"passed","Thu Apr 20 16:55:47 UTC 2023","Thu Apr 20 16:58:25 UTC 2023","157515","","JIT-Database-015b-INDEX-CRUD-single","","JIT-Database-015b-INDEX-CRUD-single","[INDEX] As a user, I check add and update multiple index","[INDEX] As a user, I check add and update multiple index",""
"passed","Thu Apr 20 16:35:50 UTC 2023","Thu Apr 20 16:36:54 UTC 2023","64111","","JIT-Web-002c-MOLECULE-Delete","","JIT-Web-002c-MOLECULE-Delete","[WEB-MOLECULE] As a user, I can delete molecule","[WEB-MOLECULE] As a user, I can delete molecule",""
"passed","Thu Apr 20 16:42:46 UTC 2023","Thu Apr 20 16:43:33 UTC 2023","47547","","JIT-Web-011a-SETTING-PROJECT-VARIABLE","","JIT-Web-011a-SETTING-PROJECT-VARIABLE","[SETTING-PROJECT-VARIABLE] As a user, I can CRUD the Project Variable","[SETTING-PROJECT-VARIABLE] As a user, I can CRUD the Project Variable",""
"passed","Thu Apr 20 17:18:00 UTC 2023","Thu Apr 20 17:18:37 UTC 2023","37086","","JIT-Module-015a-SCOUT-default","","JIT-Module-015a-SCOUT-default","[SCOUT] As a user, I can add module Scout and remove it","[SCOUT] As a user, I can add module Scout and remove it",""
"failed","Thu Apr 20 17:30:34 UTC 2023","Thu Apr 20 17:31:38 UTC 2023","64660","","JIT-Web-007a-ASSET-Upload","","JIT-Web-007a-ASSET-Upload","[ASSET] As a user, I can upload new image and store in Asset Manager and use it in all Image component","[ASSET] As a user, I can upload new image and store in Asset Manager and use it in all Image component",""
"passed","Thu Apr 20 16:30:46 UTC 2023","Thu Apr 20 16:32:32 UTC 2023","106014","","JIT-Web-001b-PAGE-Update","","JIT-Web-001b-PAGE-Update","[PAGE] As a user, I can update page with positive and negative cases","[PAGE] As a user, I can update page with positive and negative cases",""
"passed","Thu Apr 20 16:19:23 UTC 2023","Thu Apr 20 16:20:18 UTC 2023","54480","","JIT-Mobile-027b-IMAGE-General-info","","JIT-Mobile-027b-IMAGE-General-info","[MOBILE-IMAGE] As a user, I should check the general infomation of Image is correct: Name, Key, unique key, delete component","[MOBILE-IMAGE] As a user, I should check the general infomation of Image is correct: Name, Key, unique key, delete component",""
"passed","Thu Apr 20 16:13:27 UTC 2023","Thu Apr 20 16:14:44 UTC 2023","77015","","JIT-Database-016b-COUNTER-CACHE-Create-by-adding-column","","JIT-Database-016b-COUNTER-CACHE-Create-by-adding-column","[COUNTER-CACHE] create new counter cache column by adding column","[COUNTER-CACHE] create new counter cache column by adding column",""
"passed","Thu Apr 20 16:51:11 UTC 2023","Thu Apr 20 16:52:47 UTC 2023","96137","","JIT-API-007d-POST-API-Add-new-endpoint","","JIT-API-007d-POST-API-Add-new-endpoint","[GET-POST] Create, update and delete new POST API endpoint","[GET-POST] Create, update and delete new POST API endpoint",""
"passed","Thu Apr 20 16:09:30 UTC 2023","Thu Apr 20 16:10:26 UTC 2023","55963","","JIT-Database-011c-COLUMN-ENUM-delete-items","","JIT-Database-011c-COLUMN-ENUM-delete-items","[COLUMN] As a user, I should delete 1 item and check not display in default dropdown","[COLUMN] As a user, I should delete 1 item and check not display in default dropdown",""
"passed","Thu Apr 20 17:36:36 UTC 2023","Thu Apr 20 17:37:06 UTC 2023","30633","","JIT-Database-001c-TABLE-duplicate","","JIT-Database-001c-TABLE-duplicate","[TABLE] As a user, I cannot create table with duplicate name","[TABLE] As a user, I cannot create table with duplicate name",""
"passed","Thu Apr 20 16:17:50 UTC 2023","Thu Apr 20 16:18:48 UTC 2023","58877","","JIT-Mobile-015-VIEW-General-info","","JIT-Mobile-015-VIEW-General-info","[MOBILE-VIEW] As a user, I should check the general infomation of View is correct: Name, Key, unique key, delete component","[MOBILE-VIEW] As a user, I should check the general infomation of View is correct: Name, Key, unique key, delete component",""
"passed","Thu Apr 20 16:25:47 UTC 2023","Thu Apr 20 16:27:03 UTC 2023","76335","","JIT-Module-005a-FORCE-MOBILE-UPDATE-database","","JIT-Module-005a-FORCE-MOBILE-UPDATE-database","[FORCE-MOBILE-UPDATE] - Check adding and auto-table & columns","[FORCE-MOBILE-UPDATE] - Check adding and auto-table & columns",""
"passed","Thu Apr 20 16:12:10 UTC 2023","Thu Apr 20 16:13:02 UTC 2023","51935","","JIT-Database-013-DEFECT-Check-default-value-when-changing-type","","JIT-Database-013-DEFECT-Check-default-value-when-changing-type","[DEFECT] As a user, I should check the default value when changing the type","[DEFECT] As a user, I should check the default value when changing the type",""
"passed","Thu Apr 20 16:23:08 UTC 2023","Thu Apr 20 16:24:34 UTC 2023","85513","","JIT-Mobile-042a-ACTION-NAVIGATION-no-param","","JIT-Mobile-042a-ACTION-NAVIGATION-no-param","[MOBILE-ACTION-NAVIGATION] As a user, I could add action type navigation without params and check preview code","[MOBILE-ACTION-NAVIGATION] As a user, I could add action type navigation without params and check preview code",""
"passed","Thu Apr 20 16:22:01 UTC 2023","Thu Apr 20 16:22:59 UTC 2023","57148","","JIT-Mobile-035b-FLATLIST-General-info","","JIT-Mobile-035b-FLATLIST-General-info","[MOBILE-FLATLIST] As a user, I should check the general infomation of FlatList is correct: Name, Key, unique key, delete component","[MOBILE-FLATLIST] As a user, I should check the general infomation of FlatList is correct: Name, Key, unique key, delete component",""
"passed","Thu Apr 20 16:20:40 UTC 2023","Thu Apr 20 16:21:38 UTC 2023","57422","","JIT-Mobile-031b-DIVIDER-General-info","","JIT-Mobile-031b-DIVIDER-General-info","[MOBILE-DIVIDER] As a user, I should check the general infomation of Divider is correct: Name, Key, unique key, delete component","[MOBILE-DIVIDER] As a user, I should check the general infomation of Divider is correct: Name, Key, unique key, delete component",""
"passed","Thu Apr 20 16:10:05 UTC 2023","Thu Apr 20 16:11:06 UTC 2023","60658","","JIT-Database-011e-COLUMN-ENUM-delete-all","","JIT-Database-011e-COLUMN-ENUM-delete-all","[COLUMN] As a user, I should delete all items and check all items are not displayed","[COLUMN] As a user, I should delete all items and check all items are not displayed",""
"passed","Thu Apr 20 16:55:34 UTC 2023","Thu Apr 20 16:57:17 UTC 2023","102836","","JIT-API-011-UPDATE-toggle-on-API","","JIT-API-011-UPDATE-toggle-on-API","As a user, I want to see the confirmation when deleting table/column, adding column, update table/column when the API is toggled on","As a user, I want to see the confirmation when deleting table/column, adding column, update table/column when the API is toggled on",""
"passed","Thu Apr 20 17:40:34 UTC 2023","Thu Apr 20 17:42:00 UTC 2023","86695","","JIT-API-002a-GET-list-check-default","","JIT-API-002a-GET-list-check-default","As a user, I check default value in API GET list","As a user, I check default value in API GET list",""
"passed","Thu Apr 20 16:28:05 UTC 2023","Thu Apr 20 16:28:57 UTC 2023","52493","","JIT-Module-014a-BASIC-AUTH-default","","JIT-Module-014a-BASIC-AUTH-default","[BASIC-AUTH] As a user, I can add module Basic Authentication and remove it","[BASIC-AUTH] As a user, I can add module Basic Authentication and remove it",""
"passed","Thu Apr 20 16:43:57 UTC 2023","Thu Apr 20 16:45:13 UTC 2023","76285","","JIT-API-001-Check-general-info","","JIT-API-001-Check-general-info","As a user, I check general info","As a user, I check general info",""
"failed","Thu Apr 20 17:33:58 UTC 2023","Thu Apr 20 17:34:37 UTC 2023","38780","","JIT-Web-010a-LAYER-TREE-Check-edit-and-action","","JIT-Web-010a-LAYER-TREE-Check-edit-and-action","[LAYER-TREE] As a user, I could update the name of the node in the layer tree and copy,paste,delete,wrap the node","[LAYER-TREE] As a user, I could update the name of the node in the layer tree and copy,paste,delete,wrap the node",""
"broken","Thu Apr 20 17:27:20 UTC 2023","Thu Apr 20 17:30:25 UTC 2023","185308","","JIT-Web-004a-ACTION-NAVIGATION-no-param","","JIT-Web-004a-ACTION-NAVIGATION-no-param","[WEB-ACTION-NAVIGATION] As a user, I could add action type navigation without params and check preview code","[WEB-ACTION-NAVIGATION] As a user, I could add action type navigation without params and check preview code",""
"passed","Thu Apr 20 16:16:45 UTC 2023","Thu Apr 20 16:17:39 UTC 2023","53781","","JIT-Mobile-011-JITDEF50-disable-add-duplicate-screen-in-stack","","JIT-Mobile-011-JITDEF50-disable-add-duplicate-screen-in-stack","[DEFECT] As a user, I could add duplicate screen in stack","[DEFECT] As a user, I could add duplicate screen in stack",""
"passed","Thu Apr 20 17:44:26 UTC 2023","Thu Apr 20 17:46:08 UTC 2023","101736","","JIT-API-002b-GET-list-update-info","","JIT-API-002b-GET-list-update-info","As a user, I update info for GET-list","As a user, I update info for GET-list",""
"passed","Thu Apr 20 16:21:34 UTC 2023","Thu Apr 20 16:22:20 UTC 2023","46144","","JIT-Mobile-032b-CAROUSEL-General-info","","JIT-Mobile-032b-CAROUSEL-General-info","[MOBILE-CAROUSEL] As a user, I should check the general infomation of Carousel is correct: Name, Key, unique key, delete component","[MOBILE-CAROUSEL] As a user, I should check the general infomation of Carousel is correct: Name, Key, unique key, delete component",""
"passed","Thu Apr 20 16:04:26 UTC 2023","Thu Apr 20 16:05:04 UTC 2023","37735","","JIT-Database-001e-TABLE-create-by-context-menu","","JIT-Database-001e-TABLE-create-by-context-menu","[TABLE] As a user, I can create new table by context menu","[TABLE] As a user, I can create new table by context menu",""
"passed","Thu Apr 20 16:07:25 UTC 2023","Thu Apr 20 16:08:29 UTC 2023","64217","","JIT-Database-009-COLUMN-type-BOOLEAN","","JIT-Database-009-COLUMN-type-BOOLEAN","[COLUMN] As a user, I should check the validation of BOOLEAN column definition","[COLUMN] As a user, I should check the validation of BOOLEAN column definition",""
"passed","Thu Apr 20 16:49:15 UTC 2023","Thu Apr 20 16:50:55 UTC 2023","100682","","JIT-API-006a-DELETE-check-default","","JIT-API-006a-DELETE-check-default","As a user, I check default value in API DELETE","As a user, I check default value in API DELETE",""
"passed","Thu Apr 20 16:29:29 UTC 2023","Thu Apr 20 16:30:18 UTC 2023","48549","","JIT-Module-019a-GOOGLE-ANALYTICS-default","","JIT-Module-019a-GOOGLE-ANALYTICS-default","[GOOGLE-ANALYTICS] As a user, I can add module Google Analytics and remove it","[GOOGLE-ANALYTICS] As a user, I can add module Google Analytics and remove it",""
"broken","Thu Apr 20 17:20:20 UTC 2023","Thu Apr 20 17:25:07 UTC 2023","287560","","JIT-Web-001a-PAGE-Create-new","","JIT-Web-001a-PAGE-Create-new","[PAGE] As a user, I can create new screen with positive and negative cases","[PAGE] As a user, I can create new screen with positive and negative cases",""
"passed","Thu Apr 20 16:35:51 UTC 2023","Thu Apr 20 16:38:58 UTC 2023","187466","","JIT-Web-002d-MOLECULE-Duplicate","","JIT-Web-002d-MOLECULE-Duplicate","[WEB-MOLECULE] As a user, I can duplicate molecule with positive and negative cases","[WEB-MOLECULE] As a user, I can duplicate molecule with positive and negative cases",""
"passed","Thu Apr 20 16:10:42 UTC 2023","Thu Apr 20 16:11:30 UTC 2023","48114","","JIT-Database-011f-COLUMN-ENUM-duplicated","","JIT-Database-011f-COLUMN-ENUM-duplicated","[COLUMN] As a user, I should check counld not add duplicated item","[COLUMN] As a user, I should check counld not add duplicated item",""
"passed","Thu Apr 20 16:37:12 UTC 2023","Thu Apr 20 16:38:00 UTC 2023","47360","","JIT-Web-002f-MOLECULE-Navigate-edit-screen","","JIT-Web-002f-MOLECULE-Navigate-edit-screen","[WEB-MOLECULE-EDIT] As a user, I can see the molecule in Page and use Edit button see the content of this molecule","[WEB-MOLECULE-EDIT] As a user, I can see the molecule in Page and use Edit button see the content of this molecule",""
"passed","Thu Apr 20 16:08:40 UTC 2023","Thu Apr 20 16:10:28 UTC 2023","108636","","JIT-Database-010b-COLUMN-FILE-format-file","","JIT-Database-010b-COLUMN-FILE-format-file","[COLUMN] As a user, I should check the validation of FILE column definition for Format Area","[COLUMN] As a user, I should check the validation of FILE column definition for Format Area",""
"passed","Thu Apr 20 16:13:58 UTC 2023","Thu Apr 20 16:14:51 UTC 2023","53285","","JIT-Mobile-001-SCREEN-Create-new","","JIT-Mobile-001-SCREEN-Create-new","[MOBILE-SCREEN] As a user, I can create new screen with positive and negative cases","[MOBILE-SCREEN] As a user, I can create new screen with positive and negative cases",""
"passed","Thu Apr 20 16:54:31 UTC 2023","Thu Apr 20 16:55:37 UTC 2023","66303","","JIT-API-010b-DEFECT-Check-JSON-path","","JIT-API-010b-DEFECT-Check-JSON-path","As a user, I want to check the option in dropdown show correct JSON path.","As a user, I want to check the option in dropdown show correct JSON path.",""
"failed","Thu Apr 20 17:25:16 UTC 2023","Thu Apr 20 17:26:19 UTC 2023","63629","","JIT-Web-002b-MOLECULE-Update","","JIT-Web-002b-MOLECULE-Update","[WEB-MOLECULE] As a user, I can update molecule with positive and negative cases","[WEB-MOLECULE] As a user, I can update molecule with positive and negative cases",""
"failed","Thu Apr 20 17:26:28 UTC 2023","Thu Apr 20 17:27:12 UTC 2023","43963","","JIT-Web-003a-PREVIEW-NAVIGATION-no-navigation-setup","","JIT-Web-003a-PREVIEW-NAVIGATION-no-navigation-setup","[WEB-PREVIEW-NAVIGATION] As a user, I could open preview screen with default page","[WEB-PREVIEW-NAVIGATION] As a user, I could open preview screen with default page",""
"passed","Thu Apr 20 16:56:05 UTC 2023","Thu Apr 20 16:58:46 UTC 2023","160751","","JIT-Database-015c-INDEX-CRUD-multiple","","JIT-Database-015c-INDEX-CRUD-multiple","[INDEX] As a user, I check add and update single index","[INDEX] As a user, I check add and update single index",""
"passed","Thu Apr 20 16:29:14 UTC 2023","Thu Apr 20 16:29:57 UTC 2023","42994","","JIT-Module-017a-GOOGLE-ANAL-default","","JIT-Module-017a-GOOGLE-ANAL-default","[GOOGLE-ANAL] As a user, I can add module Google Analytics and remove it","[GOOGLE-ANAL] As a user, I can add module Google Analytics and remove it",""
"passed","Thu Apr 20 16:46:26 UTC 2023","Thu Apr 20 16:48:13 UTC 2023","107247","","JIT-API-004a-GET-detail-check-default","","JIT-API-004a-GET-detail-check-default","As a user, I check default value in API GET-detail","As a user, I check default value in API GET-detail",""
"passed","Thu Apr 20 17:15:57 UTC 2023","Thu Apr 20 17:17:10 UTC 2023","73114","","JIT-Database-005-COLUMN-type-FLOAT","","JIT-Database-005-COLUMN-type-FLOAT","[COLUMN] As a user, I should check the validation of FLOAT column definition","[COLUMN] As a user, I should check the validation of FLOAT column definition",""
"passed","Thu Apr 20 16:20:16 UTC 2023","Thu Apr 20 16:21:15 UTC 2023","58970","","JIT-Mobile-028b-ICON-General-info","","JIT-Mobile-028b-ICON-General-info","[MOBILE-ICON] As a user, I should check the general infomation of Icon is correct: Name, Key, unique key, delete component","[MOBILE-ICON] As a user, I should check the general infomation of Icon is correct: Name, Key, unique key, delete component",""
"passed","Thu Apr 20 16:36:02 UTC 2023","Thu Apr 20 16:37:58 UTC 2023","115862","","JIT-Web-002e-MOLECULE-Search","","JIT-Web-002e-MOLECULE-Search","[WEB-PAGE] As a user, I can search correct molecule with keyword","[WEB-PAGE] As a user, I can search correct molecule with keyword",""
"passed","Thu Apr 20 16:18:58 UTC 2023","Thu Apr 20 16:19:50 UTC 2023","52360","","JIT-Mobile-021-DEFECT.Params.keep-params-after-refresh-page","","JIT-Mobile-021-DEFECT.Params.keep-params-after-refresh-page","[DEFECT] As a user, I should check the params will be kept after refresh page","[DEFECT] As a user, I should check the params will be kept after refresh page",""
"passed","Thu Apr 20 16:45:25 UTC 2023","Thu Apr 20 16:47:34 UTC 2023","128193","","JIT-API-003b-POST-update-info","","JIT-API-003b-POST-update-info","As a user, I update info for API POST","As a user, I update info for API POST",""
"passed","Thu Apr 20 16:46:58 UTC 2023","Thu Apr 20 16:48:43 UTC 2023","105677","","JIT-API-004b-GET-detail-update-info","","JIT-API-004b-GET-detail-update-info","As a user, I update info for GET-detail","As a user, I update info for GET-detail",""
