"Status","Start Time","Stop Time","Duration in ms","Parent Suite","Suite","Sub Suite","Test Class","Test Method","Name","Description"
"broken","Thu May 04 16:58:09 UTC 2023","Thu May 04 16:59:00 UTC 2023","50424","","JIT-Module-005a-FORCE-MOBILE-UPDATE-database","","JIT-Module-005a-FORCE-MOBILE-UPDATE-database","[FORCE-MOBILE-UPDATE] - Check adding and auto-table & columns","[FORCE-MOBILE-UPDATE] - Check adding and auto-table & columns",""
"broken","Thu May 04 19:10:07 UTC 2023","Thu May 04 19:10:57 UTC 2023","49861","","JIT-Database-015m-INDEX-ALL-column-config","","JIT-Database-015m-INDEX-ALL-column-config","[INDEX-ALL] As a user, I config with multiple column and check show multiple on index pop-up","[INDEX-ALL] As a user, I config with multiple column and check show multiple on index pop-up",""
"broken","Thu May 04 17:24:12 UTC 2023","Thu May 04 17:25:02 UTC 2023","49820","","JIT-Web-001h01-PAGE-DEFECT-Create-page-slug-contains-another-page","","JIT-Web-001h01-PAGE-DEFECT-Create-page-slug-contains-another-page","[PAGE - DEFECT] As a user, I can check DEFECT if create new page with slug contains existing page","[PAGE - DEFECT] As a user, I can check DEFECT if create new page with slug contains existing page",""
"broken","Thu May 04 19:03:14 UTC 2023","Thu May 04 19:04:03 UTC 2023","49536","","JIT-Database-015e-INDEX-TEXT-column-config","","JIT-Database-015e-INDEX-TEXT-column-config","[INDEX-TEXT] As a user, I config index from column setting && check on index popup","[INDEX-TEXT] As a user, I config index from column setting && check on index popup",""
"broken","Thu May 04 17:03:09 UTC 2023","Thu May 04 17:03:58 UTC 2023","49757","","JIT-Database-006-COLUMN-type-STRING","","JIT-Database-006-COLUMN-type-STRING","[COLUMN] As a user, I should check the validation of STRING column definition","[COLUMN] As a user, I should check the validation of STRING column definition",""
"broken","Thu May 04 16:57:10 UTC 2023","Thu May 04 16:58:00 UTC 2023","49799","","JIT-Module-004a-EMAIL-LOGIN-default","","JIT-Module-004a-EMAIL-LOGIN-default","[EMAIL-LOGIN] - Check adding and auto-generated API","[EMAIL-LOGIN] - Check adding and auto-generated API",""
"broken","Thu May 04 17:56:05 UTC 2023","Thu May 04 17:56:55 UTC 2023","49558","","JIT-Database-012a-RELATION-basic","","JIT-Database-012a-RELATION-basic","[RELATION] check the basic relation","[RELATION] check the basic relation",""
"broken","Thu May 04 17:23:12 UTC 2023","Thu May 04 17:24:02 UTC 2023","49697","","JIT-Web-001h-PAGE-Create-multiple-level-slug","","JIT-Web-001h-PAGE-Create-multiple-level-slug","[PAGE] As a user, I can create new screen with multiple level slug","[PAGE] As a user, I can create new screen with multiple level slug",""
"broken","Thu May 04 18:20:52 UTC 2023","Thu May 04 18:21:42 UTC 2023","50137","","JIT-Database-001e-TABLE-create-by-context-menu","","JIT-Database-001e-TABLE-create-by-context-menu","[TABLE] As a user, I can create new table by context menu","[TABLE] As a user, I can create new table by context menu",""
"broken","Thu May 04 17:34:11 UTC 2023","Thu May 04 17:35:01 UTC 2023","49886","","JIT-Web-002h-MOLECULE-New-with-cate","","JIT-Web-002h-MOLECULE-New-with-cate","[WEB-MOLECULE-CATE] As a user, I can create new molecule","[WEB-MOLECULE-CATE] As a user, I can create new molecule",""
"broken","Thu May 04 18:17:54 UTC 2023","Thu May 04 18:18:43 UTC 2023","49694","","JIT-Mobile-014-JITDEF-status-bar","","JIT-Mobile-014-JITDEF-status-bar","[DEFECT] As a user, I should see screen will be removed in navigation tree after deleting screen","[DEFECT] As a user, I should see screen will be removed in navigation tree after deleting screen",""
"broken","Thu May 04 19:11:06 UTC 2023","Thu May 04 19:11:57 UTC 2023","50872","","JIT-API-002c-GET-list","","JIT-API-002c-GET-list","As a user, I check column display when having relation for GET-list","As a user, I check column display when having relation for GET-list",""
"broken","Thu May 04 17:07:10 UTC 2023","Thu May 04 17:07:59 UTC 2023","49667","","JIT-Module-015b-SCOUT-edit-infos","","JIT-Module-015b-SCOUT-edit-infos","[SCOUT] As a user, I can update module Scout","[SCOUT] As a user, I can update module Scout",""
"broken","Thu May 04 17:41:10 UTC 2023","Thu May 04 17:41:59 UTC 2023","49792","","JIT-Web-010a-LAYER-TREE-Check-edit-and-action","","JIT-Web-010a-LAYER-TREE-Check-edit-and-action","[LAYER-TREE] As a user, I could update the name of the node in the layer tree and copy,paste,delete,wrap the node","[LAYER-TREE] As a user, I could update the name of the node in the layer tree and copy,paste,delete,wrap the node",""
"broken","Thu May 04 19:12:06 UTC 2023","Thu May 04 19:12:56 UTC 2023","50148","","JIT-API-003a-POST-check-default","","JIT-API-003a-POST-check-default","As a user, I check default value in API POST","As a user, I check default value in API POST",""
"broken","Thu May 04 17:53:07 UTC 2023","Thu May 04 17:53:57 UTC 2023","49626","","JIT-Database-011d-COLUMN-ENUM-delete-selected-items","","JIT-Database-011d-COLUMN-ENUM-delete-selected-items","[COLUMN] As a user, I should delete 1 selected item and check is will be removed in default dropdown","[COLUMN] As a user, I should delete 1 selected item and check is will be removed in default dropdown",""
"broken","Thu May 04 18:05:01 UTC 2023","Thu May 04 18:05:51 UTC 2023","49871","","JIT-Database-016b-COUNTER-CACHE-Create-by-adding-column","","JIT-Database-016b-COUNTER-CACHE-Create-by-adding-column","[COUNTER-CACHE] create new counter cache column by adding column","[COUNTER-CACHE] create new counter cache column by adding column",""
"broken","Thu May 04 18:45:37 UTC 2023","Thu May 04 18:46:27 UTC 2023","49760","","JIT-API-006a-DELETE-check-default","","JIT-API-006a-DELETE-check-default","As a user, I check default value in API DELETE","As a user, I check default value in API DELETE",""
"broken","Thu May 04 18:01:03 UTC 2023","Thu May 04 18:01:53 UTC 2023","49751","","JIT-Database-001b-TABLE-empty","","JIT-Database-001b-TABLE-empty","[TABLE] As a user, I cannot create table with empty name","[TABLE] As a user, I cannot create table with empty name",""
"broken","Thu May 04 19:07:11 UTC 2023","Thu May 04 19:08:00 UTC 2023","49777","","JIT-Database-015i-INDEX-DATETIME-column-config","","JIT-Database-015i-INDEX-DATETIME-column-config","[INDEX-DATETIME] As a user, I config index from column setting && check on index popup","[INDEX-DATETIME] As a user, I config index from column setting && check on index popup",""
"broken","Thu May 04 17:11:10 UTC 2023","Thu May 04 17:12:00 UTC 2023","50293","","JIT-Module-019a-GOOGLE-ANALYTICS-default","","JIT-Module-019a-GOOGLE-ANALYTICS-default","[GOOGLE-ANALYTICS] As a user, I can add module Google Analytics and remove it","[GOOGLE-ANALYTICS] As a user, I can add module Google Analytics and remove it",""
"broken","Thu May 04 16:59:10 UTC 2023","Thu May 04 17:00:00 UTC 2023","50089","","JIT-Module-005b-FORCE-MOBILE-UPDATE-api","","JIT-Module-005b-FORCE-MOBILE-UPDATE-api","[FORCE-MOBILE-UPDATE] - Check api","[FORCE-MOBILE-UPDATE] - Check api",""
"broken","Thu May 04 19:01:16 UTC 2023","Thu May 04 19:02:06 UTC 2023","49631","","JIT-Database-015d-INDEX-STRING-column-config","","JIT-Database-015d-INDEX-STRING-column-config","[INDEX-STRING] As a user, I config index from column setting && check on index popup","[INDEX-STRING] As a user, I config index from column setting && check on index popup",""
"broken","Thu May 04 17:30:11 UTC 2023","Thu May 04 17:31:01 UTC 2023","49953","","JIT-Web-002e-MOLECULE-Search","","JIT-Web-002e-MOLECULE-Search","[WEB-PAGE] As a user, I can search correct molecule with keyword","[WEB-PAGE] As a user, I can search correct molecule with keyword",""
"broken","Thu May 04 18:00:03 UTC 2023","Thu May 04 18:00:53 UTC 2023","50002","","JIT-Database-013-DEFECT-Check-default-value-when-changing-type","","JIT-Database-013-DEFECT-Check-default-value-when-changing-type","[DEFECT] As a user, I should check the default value when changing the type","[DEFECT] As a user, I should check the default value when changing the type",""
"broken","Thu May 04 17:40:10 UTC 2023","Thu May 04 17:41:00 UTC 2023","49879","","JIT-Web-009a-TABLE-Add-new","","JIT-Web-009a-TABLE-Add-new","[TABLE] As a user, I can create new Admin page","[TABLE] As a user, I can create new Admin page",""
"broken","Thu May 04 18:28:46 UTC 2023","Thu May 04 18:29:36 UTC 2023","49798","","JIT-Mobile-031b-DIVIDER-General-info","","JIT-Mobile-031b-DIVIDER-General-info","[MOBILE-DIVIDER] As a user, I should check the general infomation of Divider is correct: Name, Key, unique key, delete component","[MOBILE-DIVIDER] As a user, I should check the general infomation of Divider is correct: Name, Key, unique key, delete component",""
"broken","Thu May 04 17:52:07 UTC 2023","Thu May 04 17:52:57 UTC 2023","50024","","JIT-Database-011c-COLUMN-ENUM-delete-items","","JIT-Database-011c-COLUMN-ENUM-delete-items","[COLUMN] As a user, I should delete 1 item and check not display in default dropdown","[COLUMN] As a user, I should delete 1 item and check not display in default dropdown",""
"broken","Thu May 04 17:08:09 UTC 2023","Thu May 04 17:09:00 UTC 2023","50271","","JIT-Module-017a-GOOGLE-ANAL-default","","JIT-Module-017a-GOOGLE-ANAL-default","[GOOGLE-ANAL] As a user, I can add module Google Analytics and remove it","[GOOGLE-ANAL] As a user, I can add module Google Analytics and remove it",""
"broken","Thu May 04 17:39:10 UTC 2023","Thu May 04 17:40:00 UTC 2023","49753","","JIT-Web-008a-ADMIN-PAGE-Create-new","","JIT-Web-008a-ADMIN-PAGE-Create-new","[ADMIN-PAGE] As a user, I can create new Admin page","[ADMIN-PAGE] As a user, I can create new Admin page",""
"broken","Thu May 04 18:25:49 UTC 2023","Thu May 04 18:26:38 UTC 2023","49539","","JIT-Mobile-028b-ICON-General-info","","JIT-Mobile-028b-ICON-General-info","[MOBILE-ICON] As a user, I should check the general infomation of Icon is correct: Name, Key, unique key, delete component","[MOBILE-ICON] As a user, I should check the general infomation of Icon is correct: Name, Key, unique key, delete component",""
"broken","Thu May 04 17:06:10 UTC 2023","Thu May 04 17:06:59 UTC 2023","49652","","JIT-Module-015a-SCOUT-default","","JIT-Module-015a-SCOUT-default","[SCOUT] As a user, I can add module Scout and remove it","[SCOUT] As a user, I can add module Scout and remove it",""
"broken","Thu May 04 17:51:08 UTC 2023","Thu May 04 17:51:57 UTC 2023","49588","","JIT-Database-001a-TABLE-new","","JIT-Database-001a-TABLE-new","[TABLE] As a user, I can create new table","[TABLE] As a user, I can create new table",""
"broken","Thu May 04 17:50:08 UTC 2023","Thu May 04 17:50:58 UTC 2023","49818","","JIT-Database-011b-COLUMN-ENUM-add-items","","JIT-Database-011b-COLUMN-ENUM-add-items","[COLUMN] As a user, I should add new item and select in default dropdown","[COLUMN] As a user, I should add new item and select in default dropdown",""
"broken","Thu May 04 19:20:37 UTC 2023","Thu May 04 19:21:27 UTC 2023","49295","","JIT-Preview-006-Preview-FORM-VALIDATION","","JIT-Preview-006-Preview-FORM-VALIDATION","[PREVIEW-WEB-FORM-VALIDATION] As a user, I check preview Form Validation","[PREVIEW-WEB-FORM-VALIDATION] As a user, I check preview Form Validation",""
"broken","Thu May 04 17:31:11 UTC 2023","Thu May 04 17:32:01 UTC 2023","49654","","JIT-Web-002f-MOLECULE-Navigate-edit-screen","","JIT-Web-002f-MOLECULE-Navigate-edit-screen","[WEB-MOLECULE-EDIT] As a user, I can see the molecule in Page and use Edit button see the content of this molecule","[WEB-MOLECULE-EDIT] As a user, I can see the molecule in Page and use Edit button see the content of this molecule",""
"broken","Thu May 04 18:07:00 UTC 2023","Thu May 04 18:07:50 UTC 2023","49650","","JIT-Mobile-001a-SCREEN-Search","","JIT-Mobile-001a-SCREEN-Search","[MOBILE-SCREEN] As a user, I can search correct screen with keyword","[MOBILE-SCREEN] As a user, I can search correct screen with keyword",""
"broken","Thu May 04 18:37:41 UTC 2023","Thu May 04 18:38:31 UTC 2023","49579","","JIT-Mobile-042a-ACTION-NAVIGATION-no-param","","JIT-Mobile-042a-ACTION-NAVIGATION-no-param","[MOBILE-ACTION-NAVIGATION] As a user, I could add action type navigation without params and check preview code","[MOBILE-ACTION-NAVIGATION] As a user, I could add action type navigation without params and check preview code",""
"broken","Thu May 04 18:21:51 UTC 2023","Thu May 04 18:22:41 UTC 2023","49752","","JIT-Mobile-022a-TEXT-General-info","","JIT-Mobile-022a-TEXT-General-info","[MOBILE-TEXT] As a user, I should check the general infomation of Text is correct: Name, Key, unique key, delete component","[MOBILE-TEXT] As a user, I should check the general infomation of Text is correct: Name, Key, unique key, delete component",""
"broken","Thu May 04 18:43:39 UTC 2023","Thu May 04 18:44:29 UTC 2023","49627","","JIT-API-005b-PUT-update-info","","JIT-API-005b-PUT-update-info","As a user, I update info for API PUT","As a user, I update info for API PUT",""
"broken","Thu May 04 19:02:15 UTC 2023","Thu May 04 19:03:05 UTC 2023","49629","","JIT-API-002b-GET-list-update-info","","JIT-API-002b-GET-list-update-info","As a user, I update info for GET-list","As a user, I update info for GET-list",""
"broken","Thu May 04 18:47:34 UTC 2023","Thu May 04 18:48:24 UTC 2023","49858","","JIT-API-007ba-GET-list-API-Add-new-endpoint","","JIT-API-007ba-GET-list-API-Add-new-endpoint","[GET-list-API] Create, update and delete new GET API endpoint","[GET-list-API] Create, update and delete new GET API endpoint",""
"broken","Thu May 04 19:00:17 UTC 2023","Thu May 04 19:01:07 UTC 2023","49770","","JIT-Database-015c-INDEX-CRUD-multiple","","JIT-Database-015c-INDEX-CRUD-multiple","[INDEX] As a user, I check add and update single index","[INDEX] As a user, I check add and update single index",""
"broken","Thu May 04 18:55:25 UTC 2023","Thu May 04 18:56:14 UTC 2023","49511","","JIT-API-009-Auto-fill","","JIT-API-009-Auto-fill","[AUTO-FILL] As a user, I could add request param by Auto-fill","[AUTO-FILL] As a user, I could add request param by Auto-fill",""
"broken","Thu May 04 18:08:00 UTC 2023","Thu May 04 18:08:49 UTC 2023","49582","","JIT-Mobile-002-SCREEN-Update","","JIT-Mobile-002-SCREEN-Update","[MOBILE-SCREEN] As a user, I can update screen with positive and negative cases","[MOBILE-SCREEN] As a user, I can update screen with positive and negative cases",""
"broken","Thu May 04 17:17:12 UTC 2023","Thu May 04 17:18:02 UTC 2023","49906","","JIT-Web-001b-PAGE-Update","","JIT-Web-001b-PAGE-Update","[PAGE] As a user, I can update page with positive and negative cases","[PAGE] As a user, I can update page with positive and negative cases",""
"broken","Thu May 04 18:11:57 UTC 2023","Thu May 04 18:12:47 UTC 2023","49716","","JIT-Mobile-005b-MOLECULE-Navigate-edit-screen","","JIT-Mobile-005b-MOLECULE-Navigate-edit-screen","[MOBILE-MOLECULE-EDIT] As a user, I can see the molecule in Screen and use Edit button see the content of this molecule","[MOBILE-MOLECULE-EDIT] As a user, I can see the molecule in Screen and use Edit button see the content of this molecule",""
"broken","Thu May 04 19:09:08 UTC 2023","Thu May 04 19:09:58 UTC 2023","49694","","JIT-Database-015l-INDEX-ENUM-column-config","","JIT-Database-015l-INDEX-ENUM-column-config","[INDEX-ENUM] As a user, I config index from column setting && check on index popup","[INDEX-ENUM] As a user, I config index from column setting && check on index popup",""
"broken","Thu May 04 17:45:10 UTC 2023","Thu May 04 17:46:00 UTC 2023","49685","","JIT-Web-011d-SETTING-PROJECT-VARIABLE-CSS-Check-deleting-PV","","JIT-Web-011d-SETTING-PROJECT-VARIABLE-CSS-Check-deleting-PV","[SETTING-PROJECT-VARIABLE-CSS] As a user, I delete the PV,  should show the static value of the deleted PV","[SETTING-PROJECT-VARIABLE-CSS] As a user, I delete the PV,  should show the static value of the deleted PV",""
"broken","Thu May 04 17:22:12 UTC 2023","Thu May 04 17:23:02 UTC 2023","49769","","JIT-Web-001g-PAGE-FIGMA-Import","","JIT-Web-001g-PAGE-FIGMA-Import","[PAGE-FIGMA] As a user, I can import the figma file to the jitera studio","[PAGE-FIGMA] As a user, I can import the figma file to the jitera studio",""
"broken","Thu May 04 18:50:30 UTC 2023","Thu May 04 18:51:20 UTC 2023","49703","","JIT-API-007d-POST-API-Add-new-endpoint","","JIT-API-007d-POST-API-Add-new-endpoint","[GET-POST] Create, update and delete new POST API endpoint","[GET-POST] Create, update and delete new POST API endpoint",""
"broken","Thu May 04 17:28:12 UTC 2023","Thu May 04 17:29:01 UTC 2023","49733","","JIT-Web-002c-MOLECULE-Delete","","JIT-Web-002c-MOLECULE-Delete","[WEB-MOLECULE] As a user, I can delete molecule","[WEB-MOLECULE] As a user, I can delete molecule",""
"broken","Thu May 04 18:12:57 UTC 2023","Thu May 04 18:13:47 UTC 2023","49750","","JIT-Mobile-007-MOLECULE-Delete","","JIT-Mobile-007-MOLECULE-Delete","[MOBILE-MOLECULE] As a user, I can delete molecule","[MOBILE-MOLECULE] As a user, I can delete molecule",""
"broken","Thu May 04 18:31:45 UTC 2023","Thu May 04 18:32:35 UTC 2023","49984","","JIT-Mobile-033b-HEADER-General-info","","JIT-Mobile-033b-HEADER-General-info","[MOBILE-HEADER] As a user, I should check the general infomation of Header is correct: Name, Key, unique key, delete component","[MOBILE-HEADER] As a user, I should check the general infomation of Header is correct: Name, Key, unique key, delete component",""
"broken","Thu May 04 17:27:12 UTC 2023","Thu May 04 17:28:02 UTC 2023","49765","","JIT-Web-002b-MOLECULE-Update","","JIT-Web-002b-MOLECULE-Update","[WEB-MOLECULE] As a user, I can update molecule with positive and negative cases","[WEB-MOLECULE] As a user, I can update molecule with positive and negative cases",""
"broken","Thu May 04 17:38:10 UTC 2023","Thu May 04 17:39:00 UTC 2023","49827","","JIT-Web-007b-ASSET-Rename-and-delete","","JIT-Web-007b-ASSET-Rename-and-delete","[ASSET] As a user, I can rename and delete image asset","[ASSET] As a user, I can rename and delete image asset",""
"broken","Thu May 04 19:08:09 UTC 2023","Thu May 04 19:08:59 UTC 2023","49714","","JIT-Database-015k-INDEX-BOOLEAN-column-config","","JIT-Database-015k-INDEX-BOOLEAN-column-config","[INDEX-BOOLEAN] As a user, I config index from column setting && check on index popup","[INDEX-BOOLEAN] As a user, I config index from column setting && check on index popup",""
"broken","Thu May 04 17:42:10 UTC 2023","Thu May 04 17:43:00 UTC 2023","49975","","JIT-Web-011a-SETTING-PROJECT-VARIABLE","","JIT-Web-011a-SETTING-PROJECT-VARIABLE","[SETTING-PROJECT-VARIABLE] As a user, I can CRUD the Project Variable","[SETTING-PROJECT-VARIABLE] As a user, I can CRUD the Project Variable",""
"broken","Thu May 04 17:05:09 UTC 2023","Thu May 04 17:06:00 UTC 2023","50578","","JIT-Module-014b-BASIC-AUTH-edit-infos","","JIT-Module-014b-BASIC-AUTH-edit-infos","[BASIC-AUTH] As a user, I can update module Basic Authentication","[BASIC-AUTH] As a user, I can update module Basic Authentication",""
"broken","Thu May 04 19:15:02 UTC 2023","Thu May 04 19:15:52 UTC 2023","49679","","JIT-API-004a-GET-detail-check-default","","JIT-API-004a-GET-detail-check-default","As a user, I check default value in API GET-detail","As a user, I check default value in API GET-detail",""
"broken","Thu May 04 17:55:06 UTC 2023","Thu May 04 17:55:56 UTC 2023","50023","","JIT-Database-011f-COLUMN-ENUM-duplicated","","JIT-Database-011f-COLUMN-ENUM-duplicated","[COLUMN] As a user, I should check counld not add duplicated item","[COLUMN] As a user, I should check counld not add duplicated item",""
"broken","Thu May 04 18:36:42 UTC 2023","Thu May 04 18:37:32 UTC 2023","49546","","JIT-Mobile-041b-PREVIEW-NAVIGATION-with-navigation-setup","","JIT-Mobile-041b-PREVIEW-NAVIGATION-with-navigation-setup","[MOBILE-PREVIEW-NAVIGATION] As a user, I could open preview screen with setting the screen navigation","[MOBILE-PREVIEW-NAVIGATION] As a user, I could open preview screen with setting the screen navigation",""
"broken","Thu May 04 18:03:02 UTC 2023","Thu May 04 18:03:52 UTC 2023","49639","","JIT-Database-015a-INDEX-Check-duplicate-empty","","JIT-Database-015a-INDEX-Check-duplicate-empty","[INDEX] As a user, I check empty and duplicate index","[INDEX] As a user, I check empty and duplicate index",""
"broken","Thu May 04 18:53:27 UTC 2023","Thu May 04 18:54:16 UTC 2023","49693","","JIT-API-007f-DELETE-API-Add-new-endpoint","","JIT-API-007f-DELETE-API-Add-new-endpoint","[DELETE-API] Create, update and delete new DELETE API endpoint","[DELETE-API] Create, update and delete new DELETE API endpoint",""
"broken","Thu May 04 18:34:43 UTC 2023","Thu May 04 18:35:33 UTC 2023","49567","","JIT-Database-003b-COLUMN-duplicated","","JIT-Database-003b-COLUMN-duplicated","[COLUMN] As a user, I cannot add duplicated column definition","[COLUMN] As a user, I cannot add duplicated column definition",""
"broken","Thu May 04 17:14:11 UTC 2023","Thu May 04 17:15:01 UTC 2023","49660","","JIT-Team-005-Invite-duplicate-email","","JIT-Team-005-Invite-duplicate-email","[INVITE-DELETE] Invite new email and invite again","[INVITE-DELETE] Invite new email and invite again",""
"broken","Thu May 04 17:37:10 UTC 2023","Thu May 04 17:38:00 UTC 2023","49675","","JIT-Web-007a-ASSET-Upload","","JIT-Web-007a-ASSET-Upload","[ASSET] As a user, I can upload new image and store in Asset Manager and use it in all Image component","[ASSET] As a user, I can upload new image and store in Asset Manager and use it in all Image component",""
"broken","Thu May 04 17:21:12 UTC 2023","Thu May 04 17:22:02 UTC 2023","49930","","JIT-Database-009-COLUMN-type-BOOLEAN","","JIT-Database-009-COLUMN-type-BOOLEAN","[COLUMN] As a user, I should check the validation of BOOLEAN column definition","[COLUMN] As a user, I should check the validation of BOOLEAN column definition",""
"broken","Thu May 04 17:13:11 UTC 2023","Thu May 04 17:14:01 UTC 2023","49899","","JIT-Database-008-COLUMN-type-DATE-TIME","","JIT-Database-008-COLUMN-type-DATE-TIME","[COLUMN] As a user, I should check the validation of DATETIME column definition","[COLUMN] As a user, I should check the validation of DATETIME column definition",""
"broken","Thu May 04 19:16:01 UTC 2023","Thu May 04 19:16:51 UTC 2023","49897","","JIT-API-004b-GET-detail-update-info","","JIT-API-004b-GET-detail-update-info","As a user, I update info for GET-detail","As a user, I update info for GET-detail",""
"broken","Thu May 04 18:19:52 UTC 2023","Thu May 04 18:20:42 UTC 2023","49672","","JIT-Mobile-021-DEFECT.Params.keep-params-after-refresh-page","","JIT-Mobile-021-DEFECT.Params.keep-params-after-refresh-page","[DEFECT] As a user, I should check the params will be kept after refresh page","[DEFECT] As a user, I should check the params will be kept after refresh page",""
"broken","Thu May 04 17:47:09 UTC 2023","Thu May 04 17:47:59 UTC 2023","49733","","JIT-Database-011a-COLUMN-ENUM-default","","JIT-Database-011a-COLUMN-ENUM-default","[COLUMN] As a user, I should check the basic validation","[COLUMN] As a user, I should check the basic validation",""
"broken","Thu May 04 19:13:05 UTC 2023","Thu May 04 19:13:55 UTC 2023","49582","","JIT-API-003b-POST-update-info","","JIT-API-003b-POST-update-info","As a user, I update info for API POST","As a user, I update info for API POST",""
"broken","Thu May 04 17:16:11 UTC 2023","Thu May 04 17:17:01 UTC 2023","49978","","JIT-Web-001a-PAGE-Create-new","","JIT-Web-001a-PAGE-Create-new","[PAGE] As a user, I can create new screen with positive and negative cases","[PAGE] As a user, I can create new screen with positive and negative cases",""
"broken","Thu May 04 18:08:59 UTC 2023","Thu May 04 18:09:49 UTC 2023","49666","","JIT-Mobile-003-SCREEN-Delete","","JIT-Mobile-003-SCREEN-Delete","[MOBILE-SCREEN] As a user, I can delete screen","[MOBILE-SCREEN] As a user, I can delete screen",""
"broken","Thu May 04 17:19:12 UTC 2023","Thu May 04 17:20:02 UTC 2023","49617","","JIT-Web-001e-PAGE-Search","","JIT-Web-001e-PAGE-Search","[WEB-PAGE] As a user, I can search correct screen with keyword","[WEB-PAGE] As a user, I can search correct screen with keyword",""
"broken","Thu May 04 17:10:10 UTC 2023","Thu May 04 17:11:00 UTC 2023","49908","","JIT-Database-007-COLUMN-type-TEXT","","JIT-Database-007-COLUMN-type-TEXT","[COLUMN] As a user, I should check the validation of TEXT column definition","[COLUMN] As a user, I should check the validation of TEXT column definition",""
"broken","Thu May 04 18:14:56 UTC 2023","Thu May 04 18:15:45 UTC 2023","49794","","JIT-Mobile-012-JITDEF-remove-poperty-info-after-deleting-navigation","","JIT-Mobile-012-JITDEF-remove-poperty-info-after-deleting-navigation","[DEFECT] As a user, I should see the property infos need to be removed after the navigation was deleted","[DEFECT] As a user, I should see the property infos need to be removed after the navigation was deleted",""
"broken","Thu May 04 18:30:46 UTC 2023","Thu May 04 18:31:35 UTC 2023","49670","","JIT-Database-003a-COLUMN-empty","","JIT-Database-003a-COLUMN-empty","[COLUMN] As a user, I cannot add empty column definition","[COLUMN] As a user, I cannot add empty column definition",""
"broken","Thu May 04 18:58:20 UTC 2023","Thu May 04 18:59:10 UTC 2023","49550","","JIT-API-011-UPDATE-toggle-on-API","","JIT-API-011-UPDATE-toggle-on-API","As a user, I want to see the confirmation when deleting table/column, adding column, update table/column when the API is toggled on","As a user, I want to see the confirmation when deleting table/column, adding column, update table/column when the API is toggled on",""
"broken","Thu May 04 17:54:06 UTC 2023","Thu May 04 17:54:56 UTC 2023","49673","","JIT-Database-011e-COLUMN-ENUM-delete-all","","JIT-Database-011e-COLUMN-ENUM-delete-all","[COLUMN] As a user, I should delete all items and check all items are not displayed","[COLUMN] As a user, I should delete all items and check all items are not displayed",""
