"Status","Start Time","Stop Time","Duration in ms","Parent Suite","Suite","Sub Suite","Test Class","Test Method","Name","Description"
"passed","Fri Apr 14 02:12:22 UTC 2023","Fri Apr 14 02:13:23 UTC 2023","61369","","JIT-Web-001c-PAGE-Delete","","JIT-Web-001c-PAGE-Delete","[PAGE] As a user, I can delete page","[PAGE] As a user, I can delete page",""
"passed","Fri Apr 14 01:52:56 UTC 2023","Fri Apr 14 01:53:53 UTC 2023","56815","","JIT-Mobile-007-MOLECULE-Delete","","JIT-Mobile-007-MOLECULE-Delete","[MOBILE-MOLECULE] As a user, I can delete molecule","[MOBILE-MOLECULE] As a user, I can delete molecule",""
"passed","Fri Apr 14 02:31:59 UTC 2023","Fri Apr 14 02:33:28 UTC 2023","89528","","JIT-API-004c-GET-detail-relation","","JIT-API-004c-GET-detail-relation","As a user, I check column display when having relation for GET-detail","As a user, I check column display when having relation for GET-detail",""
"passed","Fri Apr 14 03:37:55 UTC 2023","Fri Apr 14 03:38:27 UTC 2023","31853","","JIT-Database-001e-TABLE-create-by-context-menu","","JIT-Database-001e-TABLE-create-by-context-menu","[TABLE] As a user, I can create new table by context menu","[TABLE] As a user, I can create new table by context menu",""
"passed","Fri Apr 14 02:16:45 UTC 2023","Fri Apr 14 02:18:11 UTC 2023","85737","","JIT-Web-002a-MOLECULE-Create-new","","JIT-Web-002a-MOLECULE-Create-new","[WEB-MOLECULE] As a user, I can create new molecule with positive and negative cases","[WEB-MOLECULE] As a user, I can create new molecule with positive and negative cases",""
"passed","Fri Apr 14 02:23:00 UTC 2023","Fri Apr 14 02:25:51 UTC 2023","170758","","JIT-Web-007a-ASSET-Upload","","JIT-Web-007a-ASSET-Upload","[ASSET] As a user, I can upload new image and store in Asset Manager and use it in all Image component","[ASSET] As a user, I can upload new image and store in Asset Manager and use it in all Image component",""
"passed","Fri Apr 14 02:30:04 UTC 2023","Fri Apr 14 02:32:02 UTC 2023","117827","","JIT-API-004a-GET-detail-check-default","","JIT-API-004a-GET-detail-check-default","As a user, I check default value in API GET-detail","As a user, I check default value in API GET-detail",""
"passed","Fri Apr 14 01:42:28 UTC 2023","Fri Apr 14 01:43:58 UTC 2023","89855","","JIT-Database-009-COLUMN-type-BOOLEAN","","JIT-Database-009-COLUMN-type-BOOLEAN","[COLUMN] As a user, I should check the validation of BOOLEAN column definition","[COLUMN] As a user, I should check the validation of BOOLEAN column definition",""
"passed","Fri Apr 14 01:53:49 UTC 2023","Fri Apr 14 01:54:55 UTC 2023","66542","","JIT-Mobile-011-JITDEF50-disable-add-duplicate-screen-in-stack","","JIT-Mobile-011-JITDEF50-disable-add-duplicate-screen-in-stack","[DEFECT] As a user, I could add duplicate screen in stack","[DEFECT] As a user, I could add duplicate screen in stack",""
"passed","Fri Apr 14 01:47:40 UTC 2023","Fri Apr 14 01:48:37 UTC 2023","57317","","JIT-Database-013-DEFECT-Check-default-value-when-changing-type","","JIT-Database-013-DEFECT-Check-default-value-when-changing-type","[DEFECT] As a user, I should check the default value when changing the type","[DEFECT] As a user, I should check the default value when changing the type",""
"passed","Fri Apr 14 02:01:53 UTC 2023","Fri Apr 14 02:02:39 UTC 2023","45676","","JIT-Mobile-041a-PREVIEW-NAVIGATION-no-navigation-setup","","JIT-Mobile-041a-PREVIEW-NAVIGATION-no-navigation-setup","[MOBILE-PREVIEW-NAVIGATION] As a user, I could open preview screen with notification should setup the screen navigation","[MOBILE-PREVIEW-NAVIGATION] As a user, I could open preview screen with notification should setup the screen navigation",""
"passed","Fri Apr 14 02:19:14 UTC 2023","Fri Apr 14 02:20:07 UTC 2023","52956","","JIT-Web-002f-MOLECULE-Navigate-edit-screen","","JIT-Web-002f-MOLECULE-Navigate-edit-screen","[WEB-MOLECULE-EDIT] As a user, I can see the molecule in Page and use Edit button see the content of this molecule","[WEB-MOLECULE-EDIT] As a user, I can see the molecule in Page and use Edit button see the content of this molecule",""
"passed","Fri Apr 14 02:06:16 UTC 2023","Fri Apr 14 02:07:30 UTC 2023","73491","","JIT-Module-006b-SMS-edit-infos","","JIT-Module-006b-SMS-edit-infos","[SMS], I can add module SMS login with Twilio and edit its infos","[SMS], I can add module SMS login with Twilio and edit its infos",""
"failed","Fri Apr 14 03:32:23 UTC 2023","Fri Apr 14 03:33:02 UTC 2023","39717","","JIT-Web-003a-PREVIEW-NAVIGATION-no-navigation-setup","","JIT-Web-003a-PREVIEW-NAVIGATION-no-navigation-setup","[WEB-PREVIEW-NAVIGATION] As a user, I could open preview screen with default page","[WEB-PREVIEW-NAVIGATION] As a user, I could open preview screen with default page",""
"passed","Fri Apr 14 02:09:47 UTC 2023","Fri Apr 14 02:10:39 UTC 2023","51773","","JIT-Module-019a-GOOGLE-ANALYTICS-default","","JIT-Module-019a-GOOGLE-ANALYTICS-default","[GOOGLE-ANALYTICS] As a user, I can add module Google Analytics and remove it","[GOOGLE-ANALYTICS] As a user, I can add module Google Analytics and remove it",""
"broken","Fri Apr 14 03:24:41 UTC 2023","Fri Apr 14 03:29:28 UTC 2023","286899","","JIT-Web-001a-PAGE-Create-new","","JIT-Web-001a-PAGE-Create-new","[PAGE] As a user, I can create new screen with positive and negative cases","[PAGE] As a user, I can create new screen with positive and negative cases",""
"passed","Fri Apr 14 02:40:35 UTC 2023","Fri Apr 14 02:42:47 UTC 2023","132405","","JIT-API-011-UPDATE-toggle-on-API","","JIT-API-011-UPDATE-toggle-on-API","As a user, I want to see the confirmation when deleting table/column, adding column, update table/column when the API is toggled on","As a user, I want to see the confirmation when deleting table/column, adding column, update table/column when the API is toggled on",""
"passed","Fri Apr 14 02:12:39 UTC 2023","Fri Apr 14 02:14:47 UTC 2023","128005","","JIT-Web-001e-PAGE-Search","","JIT-Web-001e-PAGE-Search","[WEB-PAGE] As a user, I can search correct screen with keyword","[WEB-PAGE] As a user, I can search correct screen with keyword",""
"passed","Fri Apr 14 03:40:43 UTC 2023","Fri Apr 14 03:42:19 UTC 2023","96055","","JIT-API-005b-PUT-update-info","","JIT-API-005b-PUT-update-info","As a user, I update info for API PUT","As a user, I update info for API PUT",""
"passed","Fri Apr 14 02:19:45 UTC 2023","Fri Apr 14 02:21:14 UTC 2023","89501","","JIT-Web-002g-MOLECULE-CRUD-category","","JIT-Web-002g-MOLECULE-CRUD-category","[WEB-MOLECULE-EDIT] As a user, I can see the molecule in Page and use Edit button see the content of this molecule","[WEB-MOLECULE-EDIT] As a user, I can see the molecule in Page and use Edit button see the content of this molecule",""
"passed","Fri Apr 14 01:42:28 UTC 2023","Fri Apr 14 01:43:52 UTC 2023","84151","","JIT-Database-010a-COLUMN-FILE-validation","","JIT-Database-010a-COLUMN-FILE-validation","[COLUMN] As a user, I should check the validation of FILE column definition","[COLUMN] As a user, I should check the validation of FILE column definition",""
"passed","Fri Apr 14 03:45:35 UTC 2023","Fri Apr 14 03:47:50 UTC 2023","134515","","JIT-API-009-Auto-fill","","JIT-API-009-Auto-fill","[AUTO-FILL] As a user, I could add request param by Auto-fill","[AUTO-FILL] As a user, I could add request param by Auto-fill",""
"passed","Fri Apr 14 02:03:02 UTC 2023","Fri Apr 14 02:04:31 UTC 2023","88351","","JIT-Mobile-045a-LAYER-TREE-Check-edit-and-action","","JIT-Mobile-045a-LAYER-TREE-Check-edit-and-action","[MOBILE-LAYER-TREE] As a user, I could update the name of the node in the layer tree and copy,paste,delete,wrap the node","[MOBILE-LAYER-TREE] As a user, I could update the name of the node in the layer tree and copy,paste,delete,wrap the node",""
"passed","Fri Apr 14 01:47:11 UTC 2023","Fri Apr 14 01:48:25 UTC 2023","73337","","JIT-Database-012c-RELATION-multiple-1-direction","","JIT-Database-012c-RELATION-multiple-1-direction","[RELATION], I should add multiple relation 1 direction","[RELATION], I should add multiple relation 1 direction",""
"passed","Fri Apr 14 03:20:09 UTC 2023","Fri Apr 14 03:20:46 UTC 2023","37184","","JIT-Module-015a-SCOUT-default","","JIT-Module-015a-SCOUT-default","[SCOUT] As a user, I can add module Scout and remove it","[SCOUT] As a user, I can add module Scout and remove it",""
"passed","Fri Apr 14 02:36:00 UTC 2023","Fri Apr 14 02:37:53 UTC 2023","113082","","JIT-API-007bb-GET-list-API-Check-datetime-static-value","","JIT-API-007bb-GET-list-API-Check-datetime-static-value","[GET-list-API] Set datetime static value","[GET-list-API] Set datetime static value",""
"passed","Fri Apr 14 02:44:20 UTC 2023","Fri Apr 14 02:46:01 UTC 2023","100877","","JIT-Database-015g-INDEX-FLOAT-column-config","","JIT-Database-015g-INDEX-FLOAT-column-config","[INDEX-FLOAT] As a user, I config index from column setting && check on index popup","[INDEX-FLOAT] As a user, I config index from column setting && check on index popup",""
"passed","Fri Apr 14 01:44:15 UTC 2023","Fri Apr 14 01:45:17 UTC 2023","62211","","JIT-Database-011a-COLUMN-ENUM-default","","JIT-Database-011a-COLUMN-ENUM-default","[COLUMN] As a user, I should check the basic validation","[COLUMN] As a user, I should check the basic validation",""
"passed","Fri Apr 14 02:36:13 UTC 2023","Fri Apr 14 02:38:07 UTC 2023","113778","","JIT-API-007c-GET-detail-API-Add-new-endpoint","","JIT-API-007c-GET-detail-API-Add-new-endpoint","[GET-detail-API] Create, update and delete new GET API endpoint","[GET-detail-API] Create, update and delete new GET API endpoint",""
"passed","Fri Apr 14 02:43:03 UTC 2023","Fri Apr 14 02:44:35 UTC 2023","92495","","JIT-Database-015e-INDEX-TEXT-column-config","","JIT-Database-015e-INDEX-TEXT-column-config","[INDEX-TEXT] As a user, I config index from column setting && check on index popup","[INDEX-TEXT] As a user, I config index from column setting && check on index popup",""
"passed","Fri Apr 14 02:25:44 UTC 2023","Fri Apr 14 02:26:48 UTC 2023","63429","","JIT-Web-010a-LAYER-TREE-Check-edit-and-action","","JIT-Web-010a-LAYER-TREE-Check-edit-and-action","[LAYER-TREE] As a user, I could update the name of the node in the layer tree and copy,paste,delete,wrap the node","[LAYER-TREE] As a user, I could update the name of the node in the layer tree and copy,paste,delete,wrap the node",""
"passed","Fri Apr 14 02:17:57 UTC 2023","Fri Apr 14 02:21:37 UTC 2023","220281","","JIT-Web-002d-MOLECULE-Duplicate","","JIT-Web-002d-MOLECULE-Duplicate","[WEB-MOLECULE] As a user, I can duplicate molecule with positive and negative cases","[WEB-MOLECULE] As a user, I can duplicate molecule with positive and negative cases",""
"passed","Fri Apr 14 01:51:19 UTC 2023","Fri Apr 14 01:52:06 UTC 2023","47096","","JIT-Mobile-003-SCREEN-Delete","","JIT-Mobile-003-SCREEN-Delete","[MOBILE-SCREEN] As a user, I can delete screen","[MOBILE-SCREEN] As a user, I can delete screen",""
"passed","Fri Apr 14 03:34:56 UTC 2023","Fri Apr 14 03:35:21 UTC 2023","25575","","JIT-Database-001b-TABLE-empty","","JIT-Database-001b-TABLE-empty","[TABLE] As a user, I cannot create table with empty name","[TABLE] As a user, I cannot create table with empty name",""
"passed","Fri Apr 14 02:09:32 UTC 2023","Fri Apr 14 02:10:13 UTC 2023","40961","","JIT-Module-017b-GOOGLE-ANAL-edit-infos","","JIT-Module-017b-GOOGLE-ANAL-edit-infos","[GOOGLE-ANAL] As a user, I can update module Google Analytics","[GOOGLE-ANAL] As a user, I can update module Google Analytics",""
"passed","Fri Apr 14 01:54:11 UTC 2023","Fri Apr 14 01:55:38 UTC 2023","86318","","JIT-Mobile-013-JITDEF-reflect-delete-screen-innavigation-tree","","JIT-Mobile-013-JITDEF-reflect-delete-screen-innavigation-tree","[DEFECT] As a user, I should see screen will be removed in navigation tree after deleting screen","[DEFECT] As a user, I should see screen will be removed in navigation tree after deleting screen",""
"passed","Fri Apr 14 02:32:09 UTC 2023","Fri Apr 14 02:34:20 UTC 2023","131330","","JIT-API-005a-PUT-check-default","","JIT-API-005a-PUT-check-default","As a user, I check default value in API PUT","As a user, I check default value in API PUT",""
"passed","Fri Apr 14 02:02:02 UTC 2023","Fri Apr 14 02:04:38 UTC 2023","155624","","JIT-Mobile-041b-PREVIEW-NAVIGATION-with-navigation-setup","","JIT-Mobile-041b-PREVIEW-NAVIGATION-with-navigation-setup","[MOBILE-PREVIEW-NAVIGATION] As a user, I could open preview screen with setting the screen navigation","[MOBILE-PREVIEW-NAVIGATION] As a user, I could open preview screen with setting the screen navigation",""
"passed","Fri Apr 14 02:23:30 UTC 2023","Fri Apr 14 02:26:14 UTC 2023","163950","","JIT-Web-007b-ASSET-Rename-and-delete","","JIT-Web-007b-ASSET-Rename-and-delete","[ASSET] As a user, I can rename and delete image asset","[ASSET] As a user, I can rename and delete image asset",""
"passed","Fri Apr 14 01:57:06 UTC 2023","Fri Apr 14 01:58:13 UTC 2023","66659","","JIT-Mobile-026b-BUTTON-General-info","","JIT-Mobile-026b-BUTTON-General-info","[MOBILE-BUTTON] As a user, I should check the general infomation of Button is correct: Name, Key, unique key, delete component","[MOBILE-BUTTON] As a user, I should check the general infomation of Button is correct: Name, Key, unique key, delete component",""
"passed","Fri Apr 14 02:45:57 UTC 2023","Fri Apr 14 02:47:15 UTC 2023","78083","","JIT-Database-015k-INDEX-BOOLEAN-column-config","","JIT-Database-015k-INDEX-BOOLEAN-column-config","[INDEX-BOOLEAN] As a user, I config index from column setting && check on index popup","[INDEX-BOOLEAN] As a user, I config index from column setting && check on index popup",""
"passed","Fri Apr 14 02:29:46 UTC 2023","Fri Apr 14 02:31:32 UTC 2023","106056","","JIT-API-003c-POST-relation","","JIT-API-003c-POST-relation","As a user, I check column display when having relation for API POST","As a user, I check column display when having relation for API POST",""
"passed","Fri Apr 14 01:58:04 UTC 2023","Fri Apr 14 01:59:19 UTC 2023","74428","","JIT-Mobile-028b-ICON-General-info","","JIT-Mobile-028b-ICON-General-info","[MOBILE-ICON] As a user, I should check the general infomation of Icon is correct: Name, Key, unique key, delete component","[MOBILE-ICON] As a user, I should check the general infomation of Icon is correct: Name, Key, unique key, delete component",""
"passed","Fri Apr 14 01:50:21 UTC 2023","Fri Apr 14 01:51:32 UTC 2023","70654","","JIT-Mobile-001-SCREEN-Create-new","","JIT-Mobile-001-SCREEN-Create-new","[MOBILE-SCREEN] As a user, I can create new screen with positive and negative cases","[MOBILE-SCREEN] As a user, I can create new screen with positive and negative cases",""
"passed","Fri Apr 14 02:00:08 UTC 2023","Fri Apr 14 02:01:11 UTC 2023","62880","","JIT-Mobile-033b-HEADER-General-info","","JIT-Mobile-033b-HEADER-General-info","[MOBILE-HEADER] As a user, I should check the general infomation of Header is correct: Name, Key, unique key, delete component","[MOBILE-HEADER] As a user, I should check the general infomation of Header is correct: Name, Key, unique key, delete component",""
"passed","Fri Apr 14 02:11:07 UTC 2023","Fri Apr 14 02:12:10 UTC 2023","62617","","JIT-Team-005-Invite-duplicate-email","","JIT-Team-005-Invite-duplicate-email","[INVITE-DELETE] Invite new email and invite again","[INVITE-DELETE] Invite new email and invite again",""
"passed","Fri Apr 14 01:56:33 UTC 2023","Fri Apr 14 01:57:42 UTC 2023","69746","","JIT-Mobile-022a-TEXT-General-info","","JIT-Mobile-022a-TEXT-General-info","[MOBILE-TEXT] As a user, I should check the general infomation of Text is correct: Name, Key, unique key, delete component","[MOBILE-TEXT] As a user, I should check the general infomation of Text is correct: Name, Key, unique key, delete component",""
"passed","Fri Apr 14 02:00:31 UTC 2023","Fri Apr 14 02:01:32 UTC 2023","61276","","JIT-Mobile-034b-SCROLLVIEW-General-info","","JIT-Mobile-034b-SCROLLVIEW-General-info","[MOBILE-SCROLLVIEW] As a user, I should check the general infomation of Scroll View is correct: Name, Key, unique key, delete component","[MOBILE-SCROLLVIEW] As a user, I should check the general infomation of Scroll View is correct: Name, Key, unique key, delete component",""
"passed","Fri Apr 14 02:27:41 UTC 2023","Fri Apr 14 02:29:22 UTC 2023","100790","","JIT-API-001-Check-general-info","","JIT-API-001-Check-general-info","As a user, I check general info","As a user, I check general info",""
"failed","Fri Apr 14 03:35:29 UTC 2023","Fri Apr 14 03:36:29 UTC 2023","60544","","JIT-Mobile-002-SCREEN-Update","","JIT-Mobile-002-SCREEN-Update","[MOBILE-SCREEN] As a user, I can update screen with positive and negative cases","[MOBILE-SCREEN] As a user, I can update screen with positive and negative cases",""
"passed","Fri Apr 14 02:13:41 UTC 2023","Fri Apr 14 02:15:16 UTC 2023","94819","","JIT-Web-001f-PAGE-Export-and-import","","JIT-Web-001f-PAGE-Export-and-import","[PAGE] As a user, I can create new screen by import and export the screen","[PAGE] As a user, I can create new screen by import and export the screen",""
"passed","Fri Apr 14 01:59:54 UTC 2023","Fri Apr 14 02:00:53 UTC 2023","59279","","JIT-Mobile-032b-CAROUSEL-General-info","","JIT-Mobile-032b-CAROUSEL-General-info","[MOBILE-CAROUSEL] As a user, I should check the general infomation of Carousel is correct: Name, Key, unique key, delete component","[MOBILE-CAROUSEL] As a user, I should check the general infomation of Carousel is correct: Name, Key, unique key, delete component",""
"passed","Fri Apr 14 01:50:27 UTC 2023","Fri Apr 14 01:52:09 UTC 2023","102485","","JIT-Mobile-001a-SCREEN-Search","","JIT-Mobile-001a-SCREEN-Search","[MOBILE-SCREEN] As a user, I can search correct screen with keyword","[MOBILE-SCREEN] As a user, I can search correct screen with keyword",""
"passed","Fri Apr 14 03:20:54 UTC 2023","Fri Apr 14 03:21:23 UTC 2023","28858","","JIT-Module-015b-SCOUT-edit-infos","","JIT-Module-015b-SCOUT-edit-infos","[SCOUT] As a user, I can update module Scout","[SCOUT] As a user, I can update module Scout",""
"passed","Fri Apr 14 03:42:27 UTC 2023","Fri Apr 14 03:43:54 UTC 2023","87513","","JIT-API-002a-GET-list-check-default","","JIT-API-002a-GET-list-check-default","As a user, I check default value in API GET list","As a user, I check default value in API GET list",""
"passed","Fri Apr 14 03:39:09 UTC 2023","Fri Apr 14 03:39:39 UTC 2023","30190","","JIT-Database-003a-COLUMN-empty","","JIT-Database-003a-COLUMN-empty","[COLUMN] As a user, I cannot add empty column definition","[COLUMN] As a user, I cannot add empty column definition",""
"passed","Fri Apr 14 02:13:45 UTC 2023","Fri Apr 14 02:15:02 UTC 2023","76326","","JIT-Web-001g-PAGE-FIGMA-Import","","JIT-Web-001g-PAGE-FIGMA-Import","[PAGE-FIGMA] As a user, I can import the figma file to the jitera studio","[PAGE-FIGMA] As a user, I can import the figma file to the jitera studio",""
"passed","Fri Apr 14 02:42:02 UTC 2023","Fri Apr 14 02:44:50 UTC 2023","167313","","JIT-Database-015c-INDEX-CRUD-multiple","","JIT-Database-015c-INDEX-CRUD-multiple","[INDEX] As a user, I check add and update single index","[INDEX] As a user, I check add and update single index",""
"passed","Fri Apr 14 02:15:32 UTC 2023","Fri Apr 14 02:17:13 UTC 2023","100259","","JIT-Web-001h02-PAGE-DEFECT-Expand-Collapse-folder","","JIT-Web-001h02-PAGE-DEFECT-Expand-Collapse-folder","[PAGE - DEFECT] As a user, I can check DEFECT expand and collapse folder","[PAGE - DEFECT] As a user, I can check DEFECT expand and collapse folder",""
"passed","Fri Apr 14 01:42:28 UTC 2023","Fri Apr 14 01:43:48 UTC 2023","80234","","JIT-Database-008-COLUMN-type-DATE-TIME","","JIT-Database-008-COLUMN-type-DATE-TIME","[COLUMN] As a user, I should check the validation of DATETIME column definition","[COLUMN] As a user, I should check the validation of DATETIME column definition",""
"passed","Fri Apr 14 01:57:24 UTC 2023","Fri Apr 14 01:58:25 UTC 2023","60969","","JIT-Mobile-027b-IMAGE-General-info","","JIT-Mobile-027b-IMAGE-General-info","[MOBILE-IMAGE] As a user, I should check the general infomation of Image is correct: Name, Key, unique key, delete component","[MOBILE-IMAGE] As a user, I should check the general infomation of Image is correct: Name, Key, unique key, delete component",""
"passed","Fri Apr 14 02:03:14 UTC 2023","Fri Apr 14 02:03:45 UTC 2023","30847","","JIT-Module-000-search","","JIT-Module-000-search","[SEARCH] As a user, I can Search module","[SEARCH] As a user, I can Search module",""
"passed","Fri Apr 14 01:44:23 UTC 2023","Fri Apr 14 01:45:26 UTC 2023","63084","","JIT-Database-011b-COLUMN-ENUM-add-items","","JIT-Database-011b-COLUMN-ENUM-add-items","[COLUMN] As a user, I should add new item and select in default dropdown","[COLUMN] As a user, I should add new item and select in default dropdown",""
"passed","Fri Apr 14 02:29:02 UTC 2023","Fri Apr 14 02:31:06 UTC 2023","123986","","JIT-API-003a-POST-check-default","","JIT-API-003a-POST-check-default","As a user, I check default value in API POST","As a user, I check default value in API POST",""
"passed","Fri Apr 14 01:46:07 UTC 2023","Fri Apr 14 01:47:17 UTC 2023","70233","","JIT-Database-012a-RELATION-basic","","JIT-Database-012a-RELATION-basic","[RELATION] check the basic relation","[RELATION] check the basic relation",""
"passed","Fri Apr 14 03:49:49 UTC 2023","Fri Apr 14 03:51:05 UTC 2023","76396","","JIT-Database-015i-INDEX-DATETIME-column-config","","JIT-Database-015i-INDEX-DATETIME-column-config","[INDEX-DATETIME] As a user, I config index from column setting && check on index popup","[INDEX-DATETIME] As a user, I config index from column setting && check on index popup",""
"passed","Fri Apr 14 02:11:21 UTC 2023","Fri Apr 14 02:13:17 UTC 2023","116207","","JIT-Web-001b-PAGE-Update","","JIT-Web-001b-PAGE-Update","[PAGE] As a user, I can update page with positive and negative cases","[PAGE] As a user, I can update page with positive and negative cases",""
"passed","Fri Apr 14 02:15:19 UTC 2023","Fri Apr 14 02:16:29 UTC 2023","69959","","JIT-Web-001h01-PAGE-DEFECT-Create-page-slug-contains-another-page","","JIT-Web-001h01-PAGE-DEFECT-Create-page-slug-contains-another-page","[PAGE - DEFECT] As a user, I can check DEFECT if create new page with slug contains existing page","[PAGE - DEFECT] As a user, I can check DEFECT if create new page with slug contains existing page",""
"passed","Fri Apr 14 03:39:47 UTC 2023","Fri Apr 14 03:40:32 UTC 2023","44755","","JIT-Database-003b-COLUMN-duplicated","","JIT-Database-003b-COLUMN-duplicated","[COLUMN] As a user, I cannot add duplicated column definition","[COLUMN] As a user, I cannot add duplicated column definition",""
"passed","Fri Apr 14 01:44:28 UTC 2023","Fri Apr 14 01:45:36 UTC 2023","68084","","JIT-Database-011c-COLUMN-ENUM-delete-items","","JIT-Database-011c-COLUMN-ENUM-delete-items","[COLUMN] As a user, I should delete 1 item and check not display in default dropdown","[COLUMN] As a user, I should delete 1 item and check not display in default dropdown",""
"passed","Fri Apr 14 01:53:53 UTC 2023","Fri Apr 14 01:55:50 UTC 2023","116692","","JIT-Mobile-012-JITDEF-remove-poperty-info-after-deleting-navigation","","JIT-Mobile-012-JITDEF-remove-poperty-info-after-deleting-navigation","[DEFECT] As a user, I should see the property infos need to be removed after the navigation was deleted","[DEFECT] As a user, I should see the property infos need to be removed after the navigation was deleted",""
"passed","Fri Apr 14 02:23:37 UTC 2023","Fri Apr 14 02:26:12 UTC 2023","155769","","JIT-Web-008a-ADMIN-PAGE-Create-new","","JIT-Web-008a-ADMIN-PAGE-Create-new","[ADMIN-PAGE] As a user, I can create new Admin page","[ADMIN-PAGE] As a user, I can create new Admin page",""
"passed","Fri Apr 14 03:44:02 UTC 2023","Fri Apr 14 03:45:28 UTC 2023","86182","","JIT-API-007e-PUT-API-Add-new-endpoint","","JIT-API-007e-PUT-API-Add-new-endpoint","[PUT-API] Create, update and delete new PUT API endpoint","[PUT-API] Create, update and delete new PUT API endpoint",""
"passed","Fri Apr 14 01:55:21 UTC 2023","Fri Apr 14 01:56:28 UTC 2023","66389","","JIT-Mobile-015-VIEW-General-info","","JIT-Mobile-015-VIEW-General-info","[MOBILE-VIEW] As a user, I should check the general infomation of View is correct: Name, Key, unique key, delete component","[MOBILE-VIEW] As a user, I should check the general infomation of View is correct: Name, Key, unique key, delete component",""
"passed","Fri Apr 14 03:36:37 UTC 2023","Fri Apr 14 03:37:08 UTC 2023","30650","","JIT-Database-001c-TABLE-duplicate","","JIT-Database-001c-TABLE-duplicate","[TABLE] As a user, I cannot create table with duplicate name","[TABLE] As a user, I cannot create table with duplicate name",""
"passed","Fri Apr 14 02:38:18 UTC 2023","Fri Apr 14 02:40:01 UTC 2023","103352","","JIT-API-007f-DELETE-API-Add-new-endpoint","","JIT-API-007f-DELETE-API-Add-new-endpoint","[DELETE-API] Create, update and delete new DELETE API endpoint","[DELETE-API] Create, update and delete new DELETE API endpoint",""
"passed","Fri Apr 14 03:29:37 UTC 2023","Fri Apr 14 03:31:03 UTC 2023","85860","","JIT-Web-001h-PAGE-Create-multiple-level-slug","","JIT-Web-001h-PAGE-Create-multiple-level-slug","[PAGE] As a user, I can create new screen with multiple level slug","[PAGE] As a user, I can create new screen with multiple level slug",""
"passed","Fri Apr 14 01:52:13 UTC 2023","Fri Apr 14 01:53:18 UTC 2023","64569","","JIT-Mobile-005-MOLECULE-Create-new","","JIT-Mobile-005-MOLECULE-Create-new","[MOBILE-MOLECULE] As a user, I can create new molecule with positive and negative cases","[MOBILE-MOLECULE] As a user, I can create new molecule with positive and negative cases",""
"passed","Fri Apr 14 02:27:54 UTC 2023","Fri Apr 14 02:29:43 UTC 2023","109160","","JIT-API-002c-GET-list","","JIT-API-002c-GET-list","As a user, I check column display when having relation for GET-list","As a user, I check column display when having relation for GET-list",""
