"Status","Start Time","Stop Time","Duration in ms","Parent Suite","Suite","Sub Suite","Test Class","Test Method","Name","Description"
"passed","Thu Jan 12 18:52:15 GMT 2023","Thu Jan 12 18:53:34 GMT 2023","78465","","JIT-Database-015e-INDEX-TEXT-column-config","","JIT-Database-015e-INDEX-TEXT-column-config","[INDEX-TEXT] As a user, I config index from column setting && check on index popup","[INDEX-TEXT] As a user, I config index from column setting && check on index popup",""
"passed","Thu Jan 12 18:39:31 GMT 2023","Thu Jan 12 18:42:03 GMT 2023","151790","","JIT-Web-002b-MOLECULE-Update","","JIT-Web-002b-MOLECULE-Update","[WEB-MOLECULE] As a user, I can update molecule with positive and negative cases","[WEB-MOLECULE] As a user, I can update molecule with positive and negative cases",""
"failed","Thu Jan 12 19:13:45 GMT 2023","Thu Jan 12 19:14:42 GMT 2023","57065","","JIT-Web-007a-ASSET-Upload","","JIT-Web-007a-ASSET-Upload","[ASSET] As a user, I can upload new image and store in Asset Manager and use it in all Image component","[ASSET] As a user, I can upload new image and store in Asset Manager and use it in all Image component",""
"passed","Thu Jan 12 18:31:58 GMT 2023","Thu Jan 12 18:33:32 GMT 2023","93966","","JIT-Module-006b-SMS-edit-infos","","JIT-Module-006b-SMS-edit-infos","[SMS], I can add module SMS login with Twilio and edit its infos","[SMS], I can add module SMS login with Twilio and edit its infos",""
"passed","Thu Jan 12 19:58:52 GMT 2023","Thu Jan 12 20:09:18 GMT 2023","625752","","JIT-Preview-004-Preview-[BUTTON]","","JIT-Preview-004-Preview-[BUTTON]","[PREVIEW-BUTTON] As a user, I check preview function for Button component","[PREVIEW-BUTTON] As a user, I check preview function for Button component",""
"passed","Thu Jan 12 18:22:21 GMT 2023","Thu Jan 12 18:23:35 GMT 2023","73792","","JIT-Mobile-022a-TEXT-General-info","","JIT-Mobile-022a-TEXT-General-info","[MOBILE-TEXT] As a user, I should check the general infomation of Text is correct: Name, Key, unique key, delete component","[MOBILE-TEXT] As a user, I should check the general infomation of Text is correct: Name, Key, unique key, delete component",""
"passed","Thu Jan 12 19:29:34 GMT 2023","Thu Jan 12 19:30:16 GMT 2023","41643","","JIT-Export-006-Existing-Scenario-ROR-nokey","","JIT-Export-006-Existing-Scenario-ROR-nokey","As a user, I check export the existing project type ROR no key successfully","As a user, I check export the existing project type ROR no key successfully",""
"passed","Thu Jan 12 18:22:28 GMT 2023","Thu Jan 12 18:27:27 GMT 2023","298533","","JIT-Mobile-022b-TEXT-Check-TEXT","","JIT-Mobile-022b-TEXT-Check-TEXT","[MOBILE-TEXT] As a user, I should check the TEXT infomation of Text is correct: Text content, Font, Size, Font weight, Line Height, Spacing, Color, Italic, Underline","[MOBILE-TEXT] As a user, I should check the TEXT infomation of Text is correct: Text content, Font, Size, Font weight, Line Height, Spacing, Color, Italic, Underline",""
"passed","Thu Jan 12 18:24:31 GMT 2023","Thu Jan 12 18:26:26 GMT 2023","115010","","JIT-Mobile-029b-TOUCHABLE-General-info","","JIT-Mobile-029b-TOUCHABLE-General-info","[MOBILE-TOUCHABLE] As a user, I should check the general infomation of Touchable is correct: Name, Key, unique key, delete component","[MOBILE-TOUCHABLE] As a user, I should check the general infomation of Touchable is correct: Name, Key, unique key, delete component",""
"passed","Thu Jan 12 18:16:10 GMT 2023","Thu Jan 12 18:18:09 GMT 2023","119003","","JIT-Database-012c-RELATION-multiple-1-direction","","JIT-Database-012c-RELATION-multiple-1-direction","[RELATION], I should add multiple relation 1 direction","[RELATION], I should add multiple relation 1 direction",""
"passed","Thu Jan 12 18:32:18 GMT 2023","Thu Jan 12 18:34:07 GMT 2023","108653","","JIT-Module-007a-APPLE-LOGIN-default-edit","","JIT-Module-007a-APPLE-LOGIN-default-edit","[APPLE-LOGIN], I can add module Apple Login and edit its infos","[APPLE-LOGIN], I can add module Apple Login and edit its infos",""
"passed","Thu Jan 12 19:17:13 GMT 2023","Thu Jan 12 19:17:38 GMT 2023","24355","","JIT-Database-002-COLUMN-default","","JIT-Database-002-COLUMN-default","[COLUMN] As a user, I should see the default column definition","[COLUMN] As a user, I should see the default column definition",""
"passed","Thu Jan 12 18:40:50 GMT 2023","Thu Jan 12 18:42:04 GMT 2023","73891","","JIT-Web-002f-MOLECULE-Navigate-edit-screen","","JIT-Web-002f-MOLECULE-Navigate-edit-screen","[WEB-MOLECULE-EDIT] As a user, I can see the molecule in Page and use Edit button see the content of this molecule","[WEB-MOLECULE-EDIT] As a user, I can see the molecule in Page and use Edit button see the content of this molecule",""
"passed","Thu Jan 12 18:34:49 GMT 2023","Thu Jan 12 18:35:45 GMT 2023","56165","","JIT-Module-015a-SCOUT-default","","JIT-Module-015a-SCOUT-default","[SCOUT] As a user, I can add module Scout and remove it","[SCOUT] As a user, I can add module Scout and remove it",""
"passed","Thu Jan 12 19:30:23 GMT 2023","Thu Jan 12 19:30:56 GMT 2023","33884","","JIT-Export-007-Existing-Scenario-ROR-withkey","","JIT-Export-007-Existing-Scenario-ROR-withkey","As a user, I check export the existing project type ROR with key successfully","As a user, I check export the existing project type ROR with key successfully",""
"passed","Thu Jan 12 20:07:53 GMT 2023","Thu Jan 12 20:18:08 GMT 2023","614737","","JIT-Preview-005-Preview-[TOAST-MESSAGE]","","JIT-Preview-005-Preview-[TOAST-MESSAGE]","[PREVIEW-TOAST-MESSAGE] As a user, I check preview function for Toast message action","[PREVIEW-TOAST-MESSAGE] As a user, I check preview function for Toast message action",""
"passed","Thu Jan 12 18:18:20 GMT 2023","Thu Jan 12 18:20:03 GMT 2023","103199","","JIT-Mobile-001a-SCREEN-Search","","JIT-Mobile-001a-SCREEN-Search","[MOBILE-SCREEN] As a user, I can search correct screen with keyword","[MOBILE-SCREEN] As a user, I can search correct screen with keyword",""
"passed","Thu Jan 12 18:13:00 GMT 2023","Thu Jan 12 18:15:11 GMT 2023","130515","","JIT-Database-005-COLUMN-type-FLOAT","","JIT-Database-005-COLUMN-type-FLOAT","[COLUMN] As a user, I should check the validation of FLOAT column definition","[COLUMN] As a user, I should check the validation of FLOAT column definition",""
"passed","Thu Jan 12 19:31:03 GMT 2023","Thu Jan 12 19:40:34 GMT 2023","571535","","JIT-Export-010b-Export-RN-TODO","","JIT-Export-010b-Export-RN-TODO","[SMOKE] As a user, I check exprting project TODO with React Native","[SMOKE] As a user, I check exprting project TODO with React Native",""
"broken","Thu Jan 12 19:30:37 GMT 2023","Thu Jan 12 19:30:56 GMT 2023","19357","","JIT-Export-010a-Export-RoR-TODO","","JIT-Export-010a-Export-RoR-TODO","[SMOKE] As a user, I check exprting project TODO with RoR","[SMOKE] As a user, I check exprting project TODO with RoR",""
"passed","Thu Jan 12 19:14:55 GMT 2023","Thu Jan 12 19:15:30 GMT 2023","35222","","JIT-Database-001a-TABLE-new","","JIT-Database-001a-TABLE-new","[TABLE] As a user, I can create new table","[TABLE] As a user, I can create new table",""
"passed","Thu Jan 12 18:42:56 GMT 2023","Thu Jan 12 18:45:04 GMT 2023","127163","","JIT-Web-008a-ADMIN-PAGE-Create-new","","JIT-Web-008a-ADMIN-PAGE-Create-new","[ADMIN-PAGE] As a user, I can create new Admin page","[ADMIN-PAGE] As a user, I can create new Admin page",""
"passed","Thu Jan 12 18:38:02 GMT 2023","Thu Jan 12 18:39:44 GMT 2023","101852","","JIT-Web-002a-MOLECULE-Create-new","","JIT-Web-002a-MOLECULE-Create-new","[WEB-MOLECULE] As a user, I can create new molecule with positive and negative cases","[WEB-MOLECULE] As a user, I can create new molecule with positive and negative cases",""
"passed","Thu Jan 12 18:16:42 GMT 2023","Thu Jan 12 18:18:36 GMT 2023","114252","","JIT-Database-014-DEFECT-Check-duplicate-table-name","","JIT-Database-014-DEFECT-Check-duplicate-table-name","[DEFECT] As a user, I cannot update to duplicate name","[DEFECT] As a user, I cannot update to duplicate name",""
"failed","Thu Jan 12 19:14:11 GMT 2023","Thu Jan 12 19:15:23 GMT 2023","71975","","JIT-Web-007b-ASSET-Rename-and-delete","","JIT-Web-007b-ASSET-Rename-and-delete","[ASSET] As a user, I can rename and delete image asset","[ASSET] As a user, I can rename and delete image asset",""
"passed","Thu Jan 12 18:15:08 GMT 2023","Thu Jan 12 18:16:09 GMT 2023","61623","","JIT-Database-011e-COLUMN-ENUM-delete-all","","JIT-Database-011e-COLUMN-ENUM-delete-all","[COLUMN] As a user, I should delete all items and check all items are not displayed","[COLUMN] As a user, I should delete all items and check all items are not displayed",""
"passed","Thu Jan 12 19:12:43 GMT 2023","Thu Jan 12 19:13:38 GMT 2023","54347","","JIT-Database-009-COLUMN-type-BOOLEAN","","JIT-Database-009-COLUMN-type-BOOLEAN","[COLUMN] As a user, I should check the validation of BOOLEAN column definition","[COLUMN] As a user, I should check the validation of BOOLEAN column definition",""
"passed","Thu Jan 12 18:20:00 GMT 2023","Thu Jan 12 18:20:56 GMT 2023","55938","","JIT-Mobile-007-MOLECULE-Delete","","JIT-Mobile-007-MOLECULE-Delete","[MOBILE-MOLECULE] As a user, I can delete molecule","[MOBILE-MOLECULE] As a user, I can delete molecule",""
"passed","Thu Jan 12 18:19:15 GMT 2023","Thu Jan 12 18:20:31 GMT 2023","76017","","JIT-Mobile-005-MOLECULE-Create-new","","JIT-Mobile-005-MOLECULE-Create-new","[MOBILE-MOLECULE] As a user, I can create new molecule with positive and negative cases","[MOBILE-MOLECULE] As a user, I can create new molecule with positive and negative cases",""
"passed","Thu Jan 12 19:17:45 GMT 2023","Thu Jan 12 19:19:55 GMT 2023","130093","","JIT-Mobile-039a-OTP-Check-PreviewCode","","JIT-Mobile-039a-OTP-Check-PreviewCode","[MOBILE-OTP] As a user, I should check the Preview code of OTP component","[MOBILE-OTP] As a user, I should check the Preview code of OTP component",""
"passed","Thu Jan 12 19:26:53 GMT 2023","Thu Jan 12 19:29:07 GMT 2023","133572","","JIT-Export-003-Scenario_ROR_2","","JIT-Export-003-Scenario_ROR_2","As a user, I check export the project type ROR no key successfully with scenario 2","As a user, I check export the project type ROR no key successfully with scenario 2",""
"passed","Thu Jan 12 18:15:36 GMT 2023","Thu Jan 12 18:16:33 GMT 2023","56740","","JIT-Database-011f-COLUMN-ENUM-duplicated","","JIT-Database-011f-COLUMN-ENUM-duplicated","[COLUMN] As a user, I should check counld not add duplicated item","[COLUMN] As a user, I should check counld not add duplicated item",""
"passed","Thu Jan 12 18:32:21 GMT 2023","Thu Jan 12 18:34:13 GMT 2023","111975","","JIT-Module-008a-FB-LOGIN-default-edit","","JIT-Module-008a-FB-LOGIN-default-edit","[FACEBOOK-LOGIN], I can add module Facebook Login and edit its infos","[FACEBOOK-LOGIN], I can add module Facebook Login and edit its infos",""
"passed","Thu Jan 12 18:51:50 GMT 2023","Thu Jan 12 18:53:06 GMT 2023","76138","","JIT-Database-015d-INDEX-STRING-column-config","","JIT-Database-015d-INDEX-STRING-column-config","[INDEX-STRING] As a user, I config index from column setting && check on index popup","[INDEX-STRING] As a user, I config index from column setting && check on index popup",""
"passed","Thu Jan 12 18:30:55 GMT 2023","Thu Jan 12 18:31:41 GMT 2023","46665","","JIT-Module-002a-DEEPLINK-default","","JIT-Module-002a-DEEPLINK-default","As a user, I can add module Deeplink and remove it","As a user, I can add module Deeplink and remove it",""
"passed","Thu Jan 12 19:11:15 GMT 2023","Thu Jan 12 19:12:36 GMT 2023","80464","","JIT-Database-004-COLUMN-type-INTEGER","","JIT-Database-004-COLUMN-type-INTEGER","[COLUMN] As a user, I should check the validation of INTEGER column definition","[COLUMN] As a user, I should check the validation of INTEGER column definition",""
"passed","Thu Jan 12 18:54:47 GMT 2023","Thu Jan 12 18:56:10 GMT 2023","82769","","JIT-Database-015l-INDEX-ENUM-column-config","","JIT-Database-015l-INDEX-ENUM-column-config","[INDEX-ENUM] As a user, I config index from column setting && check on index popup","[INDEX-ENUM] As a user, I config index from column setting && check on index popup",""
"passed","Thu Jan 12 18:13:00 GMT 2023","Thu Jan 12 18:16:05 GMT 2023","185620","","JIT-Database-006-COLUMN-type-STRING","","JIT-Database-006-COLUMN-type-STRING","[COLUMN] As a user, I should check the validation of STRING column definition","[COLUMN] As a user, I should check the validation of STRING column definition",""
"passed","Thu Jan 12 18:34:45 GMT 2023","Thu Jan 12 18:35:54 GMT 2023","69256","","JIT-Module-014b-BASIC-AUTH-edit-infos","","JIT-Module-014b-BASIC-AUTH-edit-infos","[BASIC-AUTH] As a user, I can update module Basic Authentication","[BASIC-AUTH] As a user, I can update module Basic Authentication",""
"passed","Thu Jan 12 18:29:54 GMT 2023","Thu Jan 12 18:30:28 GMT 2023","33872","","JIT-Module-000-search","","JIT-Module-000-search","[SEARCH] As a user, I can Search module","[SEARCH] As a user, I can Search module",""
"passed","Thu Jan 12 18:37:44 GMT 2023","Thu Jan 12 18:39:57 GMT 2023","132789","","JIT-Web-001f-PAGE-Export-and-import","","JIT-Web-001f-PAGE-Export-and-import","[PAGE] As a user, I can create new screen by import and export the screen","[PAGE] As a user, I can create new screen by import and export the screen",""
"passed","Thu Jan 12 18:27:43 GMT 2023","Thu Jan 12 18:29:13 GMT 2023","90199","","JIT-Mobile-036a-DATETIMEPICKER-Check-PreviewCode","","JIT-Mobile-036a-DATETIMEPICKER-Check-PreviewCode","[MOBILE-DATETIMEPICKER] As a user, I should check the Preview code of DatetimePicker component","[MOBILE-DATETIMEPICKER] As a user, I should check the Preview code of DatetimePicker component",""
"passed","Thu Jan 12 18:17:45 GMT 2023","Thu Jan 12 18:19:54 GMT 2023","128674","","JIT-Database-016b-COUNTER-CACHE-Create-by-adding-column","","JIT-Database-016b-COUNTER-CACHE-Create-by-adding-column","[COUNTER-CACHE] create new counter cache column by adding column","[COUNTER-CACHE] create new counter cache column by adding column",""
"passed","Thu Jan 12 18:27:20 GMT 2023","Thu Jan 12 18:28:31 GMT 2023","71276","","JIT-Mobile-034b-SCROLLVIEW-General-info","","JIT-Mobile-034b-SCROLLVIEW-General-info","[MOBILE-SCROLLVIEW] As a user, I should check the general infomation of Scroll View is correct: Name, Key, unique key, delete component","[MOBILE-SCROLLVIEW] As a user, I should check the general infomation of Scroll View is correct: Name, Key, unique key, delete component",""
"passed","Thu Jan 12 19:29:15 GMT 2023","Thu Jan 12 19:31:09 GMT 2023","114264","","JIT-Export-004-Scenario_ROR_2","","JIT-Export-004-Scenario_ROR_2","As a user, I check export the project type ROR with key successfully with scenario 2","As a user, I check export the project type ROR with key successfully with scenario 2",""
"passed","Thu Jan 12 18:31:26 GMT 2023","Thu Jan 12 18:32:42 GMT 2023","75127","","JIT-Module-004a-EMAIL-LOGIN-default","","JIT-Module-004a-EMAIL-LOGIN-default","[EMAIL-LOGIN] - Check adding and auto-generated API","[EMAIL-LOGIN] - Check adding and auto-generated API",""
"passed","Thu Jan 12 18:28:40 GMT 2023","Thu Jan 12 18:31:50 GMT 2023","190353","","JIT-Mobile-041b-PREVIEW-NAVIGATION-with-navigation-setup","","JIT-Mobile-041b-PREVIEW-NAVIGATION-with-navigation-setup","[MOBILE-PREVIEW-NAVIGATION] As a user, I could open preview screen with setting the screen navigation","[MOBILE-PREVIEW-NAVIGATION] As a user, I could open preview screen with setting the screen navigation",""
"passed","Thu Jan 12 18:37:19 GMT 2023","Thu Jan 12 18:40:41 GMT 2023","202380","","JIT-Web-001a-PAGE-Create-new","","JIT-Web-001a-PAGE-Create-new","[PAGE] As a user, I can create new screen with positive and negative cases","[PAGE] As a user, I can create new screen with positive and negative cases",""
"passed","Thu Jan 12 18:37:15 GMT 2023","Thu Jan 12 18:38:37 GMT 2023","81695","","JIT-Team-005-Invite-duplicate-email","","JIT-Team-005-Invite-duplicate-email","[INVITE-DELETE] Invite new email and invite again","[INVITE-DELETE] Invite new email and invite again",""
"passed","Thu Jan 12 18:47:55 GMT 2023","Thu Jan 12 18:49:31 GMT 2023","95838","","JIT-API-007ba-GET-list-API-Add-new-endpoint","","JIT-API-007ba-GET-list-API-Add-new-endpoint","[GET-list-API] Create, update and delete new GET API endpoint","[GET-list-API] Create, update and delete new GET API endpoint",""
"passed","Thu Jan 12 19:13:12 GMT 2023","Thu Jan 12 19:14:00 GMT 2023","48152","","JIT-Database-010a-COLUMN-FILE-validation","","JIT-Database-010a-COLUMN-FILE-validation","[COLUMN] As a user, I should check the validation of FILE column definition","[COLUMN] As a user, I should check the validation of FILE column definition",""
"passed","Thu Jan 12 18:16:04 GMT 2023","Thu Jan 12 18:17:16 GMT 2023","72878","","JIT-Database-012a-RELATION-basic","","JIT-Database-012a-RELATION-basic","[RELATION] check the basic relation","[RELATION] check the basic relation",""
"passed","Thu Jan 12 18:21:06 GMT 2023","Thu Jan 12 18:23:31 GMT 2023","145407","","JIT-Mobile-014-JITDEF-status-bar","","JIT-Mobile-014-JITDEF-status-bar","[DEFECT] As a user, I should see screen will be removed in navigation tree after deleting screen","[DEFECT] As a user, I should see screen will be removed in navigation tree after deleting screen",""
"passed","Thu Jan 12 18:13:17 GMT 2023","Thu Jan 12 18:15:28 GMT 2023","130694","","JIT-Database-010b-COLUMN-FILE-format-file","","JIT-Database-010b-COLUMN-FILE-format-file","[COLUMN] As a user, I should check the validation of FILE column definition for Format Area","[COLUMN] As a user, I should check the validation of FILE column definition for Format Area",""
"passed","Thu Jan 12 19:17:06 GMT 2023","Thu Jan 12 19:18:21 GMT 2023","74625","","JIT-Database-001e-TABLE-create-by-context-menu","","JIT-Database-001e-TABLE-create-by-context-menu","[TABLE] As a user, I can create new table by context menu","[TABLE] As a user, I can create new table by context menu",""
"passed","Thu Jan 12 18:23:01 GMT 2023","Thu Jan 12 18:25:13 GMT 2023","131267","","JIT-Mobile-022d-TEXT-Check-PADDING-MARGIN","","JIT-Mobile-022d-TEXT-Check-PADDING-MARGIN","[MOBILE-TEXT] As a user, I should check the PADDING & MARGIN infomation of Text is correct: Top, Bottom, Right, Left.","[MOBILE-TEXT] As a user, I should check the PADDING & MARGIN infomation of Text is correct: Top, Bottom, Right, Left.",""
"passed","Thu Jan 12 19:12:22 GMT 2023","Thu Jan 12 19:13:05 GMT 2023","42980","","JIT-Database-008-COLUMN-type-DATE-TIME","","JIT-Database-008-COLUMN-type-DATE-TIME","[COLUMN] As a user, I should check the validation of DATETIME column definition","[COLUMN] As a user, I should check the validation of DATETIME column definition",""
"passed","Thu Jan 12 19:56:33 GMT 2023","Thu Jan 12 20:07:46 GMT 2023","673867","","JIT-Preview-003-Preview-[REACT-NATIVE]","","JIT-Preview-003-Preview-[REACT-NATIVE]","[PREVIEW-REACT-NATIVE] As a user, I check preview function for React Native","[PREVIEW-REACT-NATIVE] As a user, I check preview function for React Native",""
"passed","Thu Jan 12 18:37:43 GMT 2023","Thu Jan 12 18:41:23 GMT 2023","220030","","JIT-Web-001e-PAGE-Search","","JIT-Web-001e-PAGE-Search","[WEB-PAGE] As a user, I can search correct screen with keyword","[WEB-PAGE] As a user, I can search correct screen with keyword",""
"passed","Thu Jan 12 18:31:11 GMT 2023","Thu Jan 12 18:32:27 GMT 2023","76287","","JIT-Module-002b-DEEPLINK-edit-infos","","JIT-Module-002b-DEEPLINK-edit-infos","As a user, I can update module Deeplink","As a user, I can update module Deeplink",""
"passed","Thu Jan 12 18:25:49 GMT 2023","Thu Jan 12 18:27:01 GMT 2023","72107","","JIT-Mobile-031b-DIVIDER-General-info","","JIT-Mobile-031b-DIVIDER-General-info","[MOBILE-DIVIDER] As a user, I should check the general infomation of Divider is correct: Name, Key, unique key, delete component","[MOBILE-DIVIDER] As a user, I should check the general infomation of Divider is correct: Name, Key, unique key, delete component",""
"passed","Thu Jan 12 19:44:39 GMT 2023","Thu Jan 12 19:56:26 GMT 2023","706208","","JIT-Preview-001-Preview-[NEW]-NextJS-TODO","","JIT-Preview-001-Preview-[NEW]-NextJS-TODO","[PREVIEW-NEW] As a user, I check preview function for project TODO with NextJS","[PREVIEW-NEW] As a user, I check preview function for project TODO with NextJS",""
"passed","Thu Jan 12 19:15:33 GMT 2023","Thu Jan 12 19:16:22 GMT 2023","48876","","JIT-Database-011c-COLUMN-ENUM-delete-items","","JIT-Database-011c-COLUMN-ENUM-delete-items","[COLUMN] As a user, I should delete 1 item and check not display in default dropdown","[COLUMN] As a user, I should delete 1 item and check not display in default dropdown",""
"passed","Thu Jan 12 18:34:42 GMT 2023","Thu Jan 12 18:35:42 GMT 2023","59404","","JIT-Module-014a-BASIC-AUTH-default","","JIT-Module-014a-BASIC-AUTH-default","[BASIC-AUTH] As a user, I can add module Basic Authentication and remove it","[BASIC-AUTH] As a user, I can add module Basic Authentication and remove it",""
"passed","Thu Jan 12 18:53:06 GMT 2023","Thu Jan 12 18:54:27 GMT 2023","80996","","JIT-Database-015f-INDEX-INTEGER-column-config","","JIT-Database-015f-INDEX-INTEGER-column-config","[INDEX-INTEGER] As a user, I config index from column setting && check on index popup","[INDEX-INTEGER] As a user, I config index from column setting && check on index popup",""
"passed","Thu Jan 12 18:45:55 GMT 2023","Thu Jan 12 18:47:02 GMT 2023","66640","","JIT-API-001-Check-general-info","","JIT-API-001-Check-general-info","As a user, I check general info","As a user, I check general info",""
"passed","Thu Jan 12 18:27:03 GMT 2023","Thu Jan 12 18:28:14 GMT 2023","71364","","JIT-Mobile-033b-HEADER-General-info","","JIT-Mobile-033b-HEADER-General-info","[MOBILE-HEADER] As a user, I should check the general infomation of Header is correct: Name, Key, unique key, delete component","[MOBILE-HEADER] As a user, I should check the general infomation of Header is correct: Name, Key, unique key, delete component",""
"failed","Thu Jan 12 19:20:58 GMT 2023","Thu Jan 12 19:22:45 GMT 2023","106266","","JIT-Database-015c-INDEX-CRUD-multiple","","JIT-Database-015c-INDEX-CRUD-multiple","[INDEX] As a user, I check add and update single index","[INDEX] As a user, I check add and update single index",""
"passed","Thu Jan 12 18:23:38 GMT 2023","Thu Jan 12 18:24:48 GMT 2023","70181","","JIT-Mobile-027b-IMAGE-General-info","","JIT-Mobile-027b-IMAGE-General-info","[MOBILE-IMAGE] As a user, I should check the general infomation of Image is correct: Name, Key, unique key, delete component","[MOBILE-IMAGE] As a user, I should check the general infomation of Image is correct: Name, Key, unique key, delete component",""
"passed","Thu Jan 12 18:36:01 GMT 2023","Thu Jan 12 18:36:51 GMT 2023","50271","","JIT-Module-017a-GOOGLE-ANAL-default","","JIT-Module-017a-GOOGLE-ANAL-default","[GOOGLE-ANAL] As a user, I can add module Google Analytics and remove it","[GOOGLE-ANAL] As a user, I can add module Google Analytics and remove it",""
"passed","Thu Jan 12 18:29:57 GMT 2023","Thu Jan 12 18:30:46 GMT 2023","48653","","JIT-Module-001a-CLOUDINARY-default","","JIT-Module-001a-CLOUDINARY-default","As a user, I can add module Cloudinary and remove it","As a user, I can add module Cloudinary and remove it",""
"passed","Thu Jan 12 18:16:09 GMT 2023","Thu Jan 12 18:18:08 GMT 2023","119028","","JIT-Database-012d-RELATION-multiple-2-direction","","JIT-Database-012d-RELATION-multiple-2-direction","[RELATION], I should add multiple relation 2 directions","[RELATION], I should add multiple relation 2 directions",""
"broken","Thu Jan 12 19:19:17 GMT 2023","Thu Jan 12 19:20:45 GMT 2023","88292","","JIT-Mobile-043a-ACTION-AUTHENTICATION-PHONE-no-param","","JIT-Mobile-043a-ACTION-AUTHENTICATION-PHONE-no-param","[MOBILE-ACTION-AUTHENTICATION-PHONE] As a user, I could add action type authentication without params and check preview code","[MOBILE-ACTION-AUTHENTICATION-PHONE] As a user, I could add action type authentication without params and check preview code",""
"passed","Thu Jan 12 18:36:13 GMT 2023","Thu Jan 12 18:36:54 GMT 2023","41613","","JIT-Module-017b-GOOGLE-ANAL-edit-infos","","JIT-Module-017b-GOOGLE-ANAL-edit-infos","[GOOGLE-ANAL] As a user, I can update module Google Analytics","[GOOGLE-ANAL] As a user, I can update module Google Analytics",""
"passed","Thu Jan 12 18:20:45 GMT 2023","Thu Jan 12 18:21:44 GMT 2023","59369","","JIT-Mobile-012-JITDEF-remove-poperty-info-after-deleting-navigation","","JIT-Mobile-012-JITDEF-remove-poperty-info-after-deleting-navigation","[DEFECT] As a user, I should see the property infos need to be removed after the navigation was deleted","[DEFECT] As a user, I should see the property infos need to be removed after the navigation was deleted",""
"passed","Thu Jan 12 18:31:55 GMT 2023","Thu Jan 12 18:34:07 GMT 2023","131757","","JIT-Module-005b-FORCE-MOBILE-UPDATE-api","","JIT-Module-005b-FORCE-MOBILE-UPDATE-api","[FORCE-MOBILE-UPDATE] - Check api","[FORCE-MOBILE-UPDATE] - Check api",""
"passed","Thu Jan 12 19:26:46 GMT 2023","Thu Jan 12 19:29:05 GMT 2023","138663","","JIT-Export-005a-Scenario-RN-login-screen","","JIT-Export-005a-Scenario-RN-login-screen","[RN-Login-screen] As a user, I check export the project type React Native and Nextjs successfully with scenario 1","[RN-Login-screen] As a user, I check export the project type React Native and Nextjs successfully with scenario 1",""
"passed","Thu Jan 12 18:16:20 GMT 2023","Thu Jan 12 18:19:46 GMT 2023","205763","","JIT-Database-012e-RELATION-trigger-by-button","","JIT-Database-012e-RELATION-trigger-by-button","[RELATION] check the basic relation","[RELATION] check the basic relation",""
"passed","Thu Jan 12 18:31:57 GMT 2023","Thu Jan 12 18:33:31 GMT 2023","94071","","JIT-Module-006a-SMS-default","","JIT-Module-006a-SMS-default","[SMS], I can add module SMS login with Twilio and remove it","[SMS], I can add module SMS login with Twilio and remove it",""
