"Status","Start Time","Stop Time","Duration in ms","Parent Suite","Suite","Sub Suite","Test Class","Test Method","Name","Description"
"passed","Thu Jan 12 18:37:20 GMT 2023","Thu Jan 12 18:41:13 GMT 2023","233391","","JIT-Web-001b-PAGE-Update","","JIT-Web-001b-PAGE-Update","[PAGE] As a user, I can update page with positive and negative cases","[PAGE] As a user, I can update page with positive and negative cases",""
"passed","Thu Jan 12 18:35:08 GMT 2023","Thu Jan 12 18:35:53 GMT 2023","45217","","JIT-Module-015b-SCOUT-edit-infos","","JIT-Module-015b-SCOUT-edit-infos","[SCOUT] As a user, I can update module Scout","[SCOUT] As a user, I can update module Scout",""
"passed","Thu Jan 12 18:33:05 GMT 2023","Thu Jan 12 18:34:52 GMT 2023","107296","","JIT-Module-009a-GOOGLE-LOGIN-default-edit","","JIT-Module-009a-GOOGLE-LOGIN-default-edit","[GOOGLE-LOGIN], I can add module Google Login and edit its infos","[GOOGLE-LOGIN], I can add module Google Login and edit its infos",""
"passed","Thu Jan 12 19:26:36 GMT 2023","Thu Jan 12 19:28:18 GMT 2023","101271","","JIT-Export-001-Scenario_ROR_1","","JIT-Export-001-Scenario_ROR_1","As a user, I check export the project type ROR no key successfully with scenario 1","As a user, I check export the project type ROR no key successfully with scenario 1",""
"failed","Thu Jan 12 19:44:39 GMT 2023","Thu Jan 12 19:58:37 GMT 2023","837965","","JIT-Preview-002-Preview-[EMAIL-LOGIN]","","JIT-Preview-002-Preview-[EMAIL-LOGIN]","[PREVIEW-EMAIL-LOGIN] As a user, I check preview function for Email login module","[PREVIEW-EMAIL-LOGIN] As a user, I check preview function for Email login module",""
"passed","Thu Jan 12 18:53:15 GMT 2023","Thu Jan 12 18:54:37 GMT 2023","82275","","JIT-Database-015g-INDEX-FLOAT-column-config","","JIT-Database-015g-INDEX-FLOAT-column-config","[INDEX-FLOAT] As a user, I config index from column setting && check on index popup","[INDEX-FLOAT] As a user, I config index from column setting && check on index popup",""
"broken","Thu Jan 12 19:29:12 GMT 2023","Thu Jan 12 19:29:27 GMT 2023","15325","","JIT-Export-005b-Scenario-RN-all-default-component","","JIT-Export-005b-Scenario-RN-all-default-component","[RN-Default] As a user, I check export the project type React Native with all default component","[RN-Default] As a user, I check export the project type React Native with all default component",""
"passed","Thu Jan 12 18:45:55 GMT 2023","Thu Jan 12 18:47:39 GMT 2023","103623","","JIT-API-002a-GET-list-check-default","","JIT-API-002a-GET-list-check-default","As a user, I check default value in API GET list","As a user, I check default value in API GET list",""
"passed","Thu Jan 12 18:28:33 GMT 2023","Thu Jan 12 18:29:25 GMT 2023","52251","","JIT-Mobile-041a-PREVIEW-NAVIGATION-no-navigation-setup","","JIT-Mobile-041a-PREVIEW-NAVIGATION-no-navigation-setup","[MOBILE-PREVIEW-NAVIGATION] As a user, I could open preview screen with notification should setup the screen navigation","[MOBILE-PREVIEW-NAVIGATION] As a user, I could open preview screen with notification should setup the screen navigation",""
"passed","Thu Jan 12 18:40:46 GMT 2023","Thu Jan 12 18:43:20 GMT 2023","153817","","JIT-Web-002e-MOLECULE-Search","","JIT-Web-002e-MOLECULE-Search","[WEB-PAGE] As a user, I can search correct molecule with keyword","[WEB-PAGE] As a user, I can search correct molecule with keyword",""
"passed","Thu Jan 12 18:14:21 GMT 2023","Thu Jan 12 18:15:35 GMT 2023","74173","","JIT-Database-011d-COLUMN-ENUM-delete-selected-items","","JIT-Database-011d-COLUMN-ENUM-delete-selected-items","[COLUMN] As a user, I should delete 1 selected item and check is will be removed in default dropdown","[COLUMN] As a user, I should delete 1 selected item and check is will be removed in default dropdown",""
"passed","Thu Jan 12 18:29:45 GMT 2023","Thu Jan 12 18:31:21 GMT 2023","95806","","JIT-Mobile-045a-LAYER-TREE-Check-edit-and-action","","JIT-Mobile-045a-LAYER-TREE-Check-edit-and-action","[MOBILE-LAYER-TREE] As a user, I could update the name of the node in the layer tree and copy,paste,delete,wrap the node","[MOBILE-LAYER-TREE] As a user, I could update the name of the node in the layer tree and copy,paste,delete,wrap the node",""
"passed","Thu Jan 12 18:33:27 GMT 2023","Thu Jan 12 18:35:26 GMT 2023","119086","","JIT-Module-010a-LINE-LOGIN-default-edit","","JIT-Module-010a-LINE-LOGIN-default-edit","[LINE-LOGIN], I can add module Line Login and edit its infos","[LINE-LOGIN], I can add module Line Login and edit its infos",""
"passed","Thu Jan 12 18:45:58 GMT 2023","Thu Jan 12 18:47:15 GMT 2023","76079","","JIT-API-002c-GET-list","","JIT-API-002c-GET-list","As a user, I check column display when having relation for GET-list","As a user, I check column display when having relation for GET-list",""
"passed","Thu Jan 12 19:18:28 GMT 2023","Thu Jan 12 19:19:08 GMT 2023","39822","","JIT-Database-003b-COLUMN-duplicated","","JIT-Database-003b-COLUMN-duplicated","[COLUMN] As a user, I cannot add duplicated column definition","[COLUMN] As a user, I cannot add duplicated column definition",""
"passed","Thu Jan 12 18:35:25 GMT 2023","Thu Jan 12 18:36:14 GMT 2023","49610","","JIT-Module-016a-SENDGRID-default","","JIT-Module-016a-SENDGRID-default","[SENDGRID] As a user, I can add module SendGrid and remove it","[SENDGRID] As a user, I can add module SendGrid and remove it",""
"passed","Thu Jan 12 18:22:16 GMT 2023","Thu Jan 12 18:23:25 GMT 2023","68338","","JIT-Mobile-021-DEFECT.Params.keep-params-after-refresh-page","","JIT-Mobile-021-DEFECT.Params.keep-params-after-refresh-page","[DEFECT] As a user, I should check the params will be kept after refresh page","[DEFECT] As a user, I should check the params will be kept after refresh page",""
"passed","Thu Jan 12 18:43:17 GMT 2023","Thu Jan 12 18:45:03 GMT 2023","105778","","JIT-Web-010a-LAYER-TREE-Check-edit-and-action","","JIT-Web-010a-LAYER-TREE-Check-edit-and-action","[LAYER-TREE] As a user, I could update the name of the node in the layer tree and copy,paste,delete,wrap the node","[LAYER-TREE] As a user, I could update the name of the node in the layer tree and copy,paste,delete,wrap the node",""
"passed","Thu Jan 12 18:40:32 GMT 2023","Thu Jan 12 18:45:11 GMT 2023","279416","","JIT-Web-002d-MOLECULE-Duplicate","","JIT-Web-002d-MOLECULE-Duplicate","[WEB-MOLECULE] As a user, I can duplicate molecule with positive and negative cases","[WEB-MOLECULE] As a user, I can duplicate molecule with positive and negative cases",""
"passed","Thu Jan 12 18:34:32 GMT 2023","Thu Jan 12 18:35:20 GMT 2023","48744","","JIT-Module-013a-AWS-default","","JIT-Module-013a-AWS-default","[AWS] As a user, I can add module AWS SES Integration and remove it","[AWS] As a user, I can add module AWS SES Integration and remove it",""
"passed","Thu Jan 12 18:19:40 GMT 2023","Thu Jan 12 18:21:34 GMT 2023","113780","","JIT-Mobile-005b-MOLECULE-Navigate-edit-screen","","JIT-Mobile-005b-MOLECULE-Navigate-edit-screen","[MOBILE-MOLECULE-EDIT] As a user, I can see the molecule in Screen and use Edit button see the content of this molecule","[MOBILE-MOLECULE-EDIT] As a user, I can see the molecule in Screen and use Edit button see the content of this molecule",""
"passed","Thu Jan 12 18:17:06 GMT 2023","Thu Jan 12 18:18:30 GMT 2023","83851","","JIT-Database-016a-COUNTER-CACHE-Create-by-relation","","JIT-Database-016a-COUNTER-CACHE-Create-by-relation","[COUNTER-CACHE] create new counter cache column by selecting in relation popup","[COUNTER-CACHE] create new counter cache column by selecting in relation popup",""
"passed","Thu Jan 12 18:18:52 GMT 2023","Thu Jan 12 18:19:45 GMT 2023","52768","","JIT-Mobile-003-SCREEN-Delete","","JIT-Mobile-003-SCREEN-Delete","[MOBILE-SCREEN] As a user, I can delete screen","[MOBILE-SCREEN] As a user, I can delete screen",""
"passed","Thu Jan 12 18:34:42 GMT 2023","Thu Jan 12 18:35:40 GMT 2023","58296","","JIT-Module-013b-AWS-edit-infos","","JIT-Module-013b-AWS-edit-infos","[AWS] As a user, I can update module AWS SES Integration","[AWS] As a user, I can update module AWS SES Integration",""
"passed","Thu Jan 12 18:28:50 GMT 2023","Thu Jan 12 18:30:30 GMT 2023","100270","","JIT-Mobile-042a-ACTION-NAVIGATION-no-param","","JIT-Mobile-042a-ACTION-NAVIGATION-no-param","[MOBILE-ACTION-NAVIGATION] As a user, I could add action type navigation without params and check preview code","[MOBILE-ACTION-NAVIGATION] As a user, I could add action type navigation without params and check preview code",""
"passed","Thu Jan 12 18:16:46 GMT 2023","Thu Jan 12 18:17:49 GMT 2023","63024","","JIT-Database-015a-INDEX-Check-duplicate-empty","","JIT-Database-015a-INDEX-Check-duplicate-empty","[INDEX] As a user, I check empty and duplicate index","[INDEX] As a user, I check empty and duplicate index",""
"passed","Thu Jan 12 18:36:27 GMT 2023","Thu Jan 12 18:37:14 GMT 2023","46585","","JIT-Module-019a-GOOGLE-ANALYTICS-default","","JIT-Module-019a-GOOGLE-ANALYTICS-default","[GOOGLE-ANALYTICS] As a user, I can add module Google Analytics and remove it","[GOOGLE-ANALYTICS] As a user, I can add module Google Analytics and remove it",""
"passed","Thu Jan 12 18:18:36 GMT 2023","Thu Jan 12 18:20:25 GMT 2023","108777","","JIT-Mobile-002-SCREEN-Update","","JIT-Mobile-002-SCREEN-Update","[MOBILE-SCREEN] As a user, I can update screen with positive and negative cases","[MOBILE-SCREEN] As a user, I can update screen with positive and negative cases",""
"passed","Thu Jan 12 18:21:09 GMT 2023","Thu Jan 12 18:22:19 GMT 2023","70072","","JIT-Mobile-015-VIEW-General-info","","JIT-Mobile-015-VIEW-General-info","[MOBILE-VIEW] As a user, I should check the general infomation of View is correct: Name, Key, unique key, delete component","[MOBILE-VIEW] As a user, I should check the general infomation of View is correct: Name, Key, unique key, delete component",""
"passed","Thu Jan 12 19:16:08 GMT 2023","Thu Jan 12 19:17:06 GMT 2023","57624","","JIT-Database-001c-TABLE-duplicate","","JIT-Database-001c-TABLE-duplicate","[TABLE] As a user, I cannot create table with duplicate name","[TABLE] As a user, I cannot create table with duplicate name",""
"passed","Thu Jan 12 18:14:21 GMT 2023","Thu Jan 12 18:15:34 GMT 2023","73473","","JIT-Database-011a-COLUMN-ENUM-default","","JIT-Database-011a-COLUMN-ENUM-default","[COLUMN] As a user, I should check the basic validation","[COLUMN] As a user, I should check the basic validation",""
"passed","Thu Jan 12 19:15:38 GMT 2023","Thu Jan 12 19:16:00 GMT 2023","21930","","JIT-Database-001b-TABLE-empty","","JIT-Database-001b-TABLE-empty","[TABLE] As a user, I cannot create table with empty name","[TABLE] As a user, I cannot create table with empty name",""
"passed","Thu Jan 12 19:16:29 GMT 2023","Thu Jan 12 19:16:58 GMT 2023","28878","","JIT-Database-001d-TABLE-update","","JIT-Database-001d-TABLE-update","[TABLE] As a user, I can update the value of the table","[TABLE] As a user, I can update the value of the table",""
"passed","Thu Jan 12 18:31:28 GMT 2023","Thu Jan 12 18:32:40 GMT 2023","72337","","JIT-Module-005a-FORCE-MOBILE-UPDATE-database","","JIT-Module-005a-FORCE-MOBILE-UPDATE-database","[FORCE-MOBILE-UPDATE] - Check adding and auto-table & columns","[FORCE-MOBILE-UPDATE] - Check adding and auto-table & columns",""
"passed","Thu Jan 12 18:53:47 GMT 2023","Thu Jan 12 18:55:11 GMT 2023","84500","","JIT-Database-015h-INDEX-DATE-column-config","","JIT-Database-015h-INDEX-DATE-column-config","[INDEX-DATE] As a user, I config index from column setting && check on index popup","[INDEX-DATE] As a user, I config index from column setting && check on index popup",""
"passed","Thu Jan 12 18:11:42 GMT 2023","Thu Jan 12 18:12:43 GMT 2023","61929","","JIT-Database-003a-COLUMN-empty","","JIT-Database-003a-COLUMN-empty","[COLUMN] As a user, I cannot add empty column definition","[COLUMN] As a user, I cannot add empty column definition",""
"passed","Thu Jan 12 18:37:28 GMT 2023","Thu Jan 12 18:39:05 GMT 2023","97319","","JIT-Web-001c-PAGE-Delete","","JIT-Web-001c-PAGE-Delete","[PAGE] As a user, I can delete page","[PAGE] As a user, I can delete page",""
"passed","Thu Jan 12 18:25:07 GMT 2023","Thu Jan 12 18:26:25 GMT 2023","78131","","JIT-Mobile-030b-WEBVIEW-General-info","","JIT-Mobile-030b-WEBVIEW-General-info","[MOBILE-WEBVIEW] As a user, I should check the general infomation of Webview is correct: Name, Key, unique key, delete component","[MOBILE-WEBVIEW] As a user, I should check the general infomation of Webview is correct: Name, Key, unique key, delete component",""
"passed","Thu Jan 12 18:45:55 GMT 2023","Thu Jan 12 18:47:57 GMT 2023","121925","","JIT-API-002b-GET-list-update-info","","JIT-API-002b-GET-list-update-info","As a user, I update info for GET-list","As a user, I update info for GET-list",""
"passed","Thu Jan 12 18:47:59 GMT 2023","Thu Jan 12 18:49:20 GMT 2023","81134","","JIT-API-007bb-GET-list-API-Check-datetime-static-value","","JIT-API-007bb-GET-list-API-Check-datetime-static-value","[GET-list-API] Set datetime static value","[GET-list-API] Set datetime static value",""
"passed","Thu Jan 12 18:27:39 GMT 2023","Thu Jan 12 18:28:54 GMT 2023","75272","","JIT-Mobile-035b-FLATLIST-General-info","","JIT-Mobile-035b-FLATLIST-General-info","[MOBILE-FLATLIST] As a user, I should check the general infomation of FlatList is correct: Name, Key, unique key, delete component","[MOBILE-FLATLIST] As a user, I should check the general infomation of FlatList is correct: Name, Key, unique key, delete component",""
"passed","Thu Jan 12 18:49:26 GMT 2023","Thu Jan 12 18:50:45 GMT 2023","78725","","JIT-API-007d-POST-API-Add-new-endpoint","","JIT-API-007d-POST-API-Add-new-endpoint","[GET-POST] Create, update and delete new POST API endpoint","[GET-POST] Create, update and delete new POST API endpoint",""
"passed","Thu Jan 12 18:20:51 GMT 2023","Thu Jan 12 18:22:08 GMT 2023","77469","","JIT-Mobile-013-JITDEF-reflect-delete-screen-innavigation-tree","","JIT-Mobile-013-JITDEF-reflect-delete-screen-innavigation-tree","[DEFECT] As a user, I should see screen will be removed in navigation tree after deleting screen","[DEFECT] As a user, I should see screen will be removed in navigation tree after deleting screen",""
"passed","Thu Jan 12 18:18:01 GMT 2023","Thu Jan 12 18:19:01 GMT 2023","59993","","JIT-Mobile-001-SCREEN-Create-new","","JIT-Mobile-001-SCREEN-Create-new","[MOBILE-SCREEN] As a user, I can create new screen with positive and negative cases","[MOBILE-SCREEN] As a user, I can create new screen with positive and negative cases",""
"passed","Thu Jan 12 18:49:33 GMT 2023","Thu Jan 12 18:51:41 GMT 2023","128083","","JIT-API-007e-PUT-API-Add-new-endpoint","","JIT-API-007e-PUT-API-Add-new-endpoint","[PUT-API] Create, update and delete new PUT API endpoint","[PUT-API] Create, update and delete new PUT API endpoint",""
"passed","Thu Jan 12 18:20:26 GMT 2023","Thu Jan 12 18:27:51 GMT 2023","445116","","JIT-Mobile-009-SEARCH-Components","","JIT-Mobile-009-SEARCH-Components","[MOBILE-SEARCH] As a user, I search component and drag them to preview screen","[MOBILE-SEARCH] As a user, I search component and drag them to preview screen",""
"passed","Thu Jan 12 18:23:21 GMT 2023","Thu Jan 12 18:24:36 GMT 2023","74885","","JIT-Mobile-026b-BUTTON-General-info","","JIT-Mobile-026b-BUTTON-General-info","[MOBILE-BUTTON] As a user, I should check the general infomation of Button is correct: Name, Key, unique key, delete component","[MOBILE-BUTTON] As a user, I should check the general infomation of Button is correct: Name, Key, unique key, delete component",""
"passed","Thu Jan 12 18:24:11 GMT 2023","Thu Jan 12 18:26:11 GMT 2023","120445","","JIT-Mobile-028b-ICON-General-info","","JIT-Mobile-028b-ICON-General-info","[MOBILE-ICON] As a user, I should check the general infomation of Icon is correct: Name, Key, unique key, delete component","[MOBILE-ICON] As a user, I should check the general infomation of Icon is correct: Name, Key, unique key, delete component",""
"passed","Thu Jan 12 18:54:36 GMT 2023","Thu Jan 12 18:55:38 GMT 2023","62051","","JIT-Database-015k-INDEX-BOOLEAN-column-config","","JIT-Database-015k-INDEX-BOOLEAN-column-config","[INDEX-BOOLEAN] As a user, I config index from column setting && check on index popup","[INDEX-BOOLEAN] As a user, I config index from column setting && check on index popup",""
"passed","Thu Jan 12 18:35:54 GMT 2023","Thu Jan 12 18:36:42 GMT 2023","47821","","JIT-Module-016b-SENDGRID-edit-infos","","JIT-Module-016b-SENDGRID-edit-infos","[SENDGRID] As a user, I can update module SendGrid","[SENDGRID] As a user, I can update module SendGrid",""
"passed","Thu Jan 12 18:36:30 GMT 2023","Thu Jan 12 18:37:14 GMT 2023","44364","","JIT-Module-019b-GOOGLE-ANALYTICS-edit-infos","","JIT-Module-019b-GOOGLE-ANALYTICS-edit-infos","[GOOGLE-ANALYTICS] As a user, I can update module Google Analytics information for each environment","[GOOGLE-ANALYTICS] As a user, I can update module Google Analytics information for each environment",""
"passed","Thu Jan 12 18:53:47 GMT 2023","Thu Jan 12 18:55:11 GMT 2023","83970","","JIT-Database-015i-INDEX-DATETIME-column-config","","JIT-Database-015i-INDEX-DATETIME-column-config","[INDEX-DATETIME] As a user, I config index from column setting && check on index popup","[INDEX-DATETIME] As a user, I config index from column setting && check on index popup",""
"passed","Thu Jan 12 18:49:48 GMT 2023","Thu Jan 12 18:52:07 GMT 2023","138735","","JIT-API-009-Auto-fill","","JIT-API-009-Auto-fill","[AUTO-FILL] As a user, I could add request param by Auto-fill","[AUTO-FILL] As a user, I could add request param by Auto-fill",""
"passed","Thu Jan 12 18:20:44 GMT 2023","Thu Jan 12 18:22:23 GMT 2023","98874","","JIT-Mobile-011-JITDEF50-disable-add-duplicate-screen-in-stack","","JIT-Mobile-011-JITDEF50-disable-add-duplicate-screen-in-stack","[DEFECT] As a user, I could add duplicate screen in stack","[DEFECT] As a user, I could add duplicate screen in stack",""
"passed","Thu Jan 12 18:49:37 GMT 2023","Thu Jan 12 18:50:43 GMT 2023","65666","","JIT-API-007f-DELETE-API-Add-new-endpoint","","JIT-API-007f-DELETE-API-Add-new-endpoint","[DELETE-API] Create, update and delete new DELETE API endpoint","[DELETE-API] Create, update and delete new DELETE API endpoint",""
"passed","Thu Jan 12 18:47:56 GMT 2023","Thu Jan 12 18:49:16 GMT 2023","80763","","JIT-API-007a-GROUP-API-CRUD","","JIT-API-007a-GROUP-API-CRUD","[GROUP-API] Create, update and delete group API","[GROUP-API] Create, update and delete group API",""
"passed","Thu Jan 12 18:30:06 GMT 2023","Thu Jan 12 18:31:19 GMT 2023","72612","","JIT-Module-001b-CLOUDINARY-edit-infos","","JIT-Module-001b-CLOUDINARY-edit-infos","As a user, I can update module Cloudinary","As a user, I can update module Cloudinary",""
"passed","Thu Jan 12 18:55:23 GMT 2023","Thu Jan 12 18:56:57 GMT 2023","94115","","JIT-Database-015m-INDEX-ALL-column-config","","JIT-Database-015m-INDEX-ALL-column-config","[INDEX-ALL] As a user, I config with multiple column and check show multiple on index pop-up","[INDEX-ALL] As a user, I config with multiple column and check show multiple on index pop-up",""
"passed","Thu Jan 12 18:41:29 GMT 2023","Thu Jan 12 18:42:32 GMT 2023","63601","","JIT-Web-003a-PREVIEW-NAVIGATION-no-navigation-setup","","JIT-Web-003a-PREVIEW-NAVIGATION-no-navigation-setup","[WEB-PREVIEW-NAVIGATION] As a user, I could open preview screen with default page","[WEB-PREVIEW-NAVIGATION] As a user, I could open preview screen with default page",""
"passed","Thu Jan 12 18:25:10 GMT 2023","Thu Jan 12 18:27:08 GMT 2023","118419","","JIT-Mobile-031a-DIVIDER-Check-PreviewCode","","JIT-Mobile-031a-DIVIDER-Check-PreviewCode","[MOBILE-DIVIDER] As a user, I should check the Preview code of Divider component","[MOBILE-DIVIDER] As a user, I should check the Preview code of Divider component",""
"passed","Thu Jan 12 18:13:00 GMT 2023","Thu Jan 12 18:15:58 GMT 2023","178346","","JIT-Database-007-COLUMN-type-TEXT","","JIT-Database-007-COLUMN-type-TEXT","[COLUMN] As a user, I should check the validation of TEXT column definition","[COLUMN] As a user, I should check the validation of TEXT column definition",""
"passed","Thu Jan 12 18:48:09 GMT 2023","Thu Jan 12 18:49:24 GMT 2023","75493","","JIT-API-007c-GET-detail-API-Add-new-endpoint","","JIT-API-007c-GET-detail-API-Add-new-endpoint","[GET-detail-API] Create, update and delete new GET API endpoint","[GET-detail-API] Create, update and delete new GET API endpoint",""
"passed","Thu Jan 12 18:43:06 GMT 2023","Thu Jan 12 18:44:52 GMT 2023","106243","","JIT-Web-009a-TABLE-Add-new","","JIT-Web-009a-TABLE-Add-new","[TABLE] As a user, I can create new Admin page","[TABLE] As a user, I can create new Admin page",""
"passed","Thu Jan 12 18:14:21 GMT 2023","Thu Jan 12 18:15:31 GMT 2023","70301","","JIT-Database-011b-COLUMN-ENUM-add-items","","JIT-Database-011b-COLUMN-ENUM-add-items","[COLUMN] As a user, I should add new item and select in default dropdown","[COLUMN] As a user, I should add new item and select in default dropdown",""
"passed","Thu Jan 12 19:11:15 GMT 2023","Thu Jan 12 19:12:14 GMT 2023","58997","","JIT-Module-011a-GUEST-LOGIN-default-edit","","JIT-Module-011a-GUEST-LOGIN-default-edit","[GUEST-LOGIN], I can add module Guest Login and edit its infos","[GUEST-LOGIN], I can add module Guest Login and edit its infos",""
"passed","Thu Jan 12 18:50:57 GMT 2023","Thu Jan 12 18:53:34 GMT 2023","156750","","JIT-Database-015b-INDEX-CRUD-single","","JIT-Database-015b-INDEX-CRUD-single","[INDEX] As a user, I check add and update multiple index","[INDEX] As a user, I check add and update multiple index",""
"passed","Thu Jan 12 18:24:04 GMT 2023","Thu Jan 12 18:26:47 GMT 2023","162729","","JIT-Mobile-028a-ICON-Check-PreviewCode","","JIT-Mobile-028a-ICON-Check-PreviewCode","[MOBILE-ICON] As a user, I should check the Preview code of Icon component","[MOBILE-ICON] As a user, I should check the Preview code of Icon component",""
"passed","Thu Jan 12 19:28:24 GMT 2023","Thu Jan 12 19:30:08 GMT 2023","103532","","JIT-Export-002-Scenario-ROR-withkey-1","","JIT-Export-002-Scenario-ROR-withkey-1","As a user, I check export the project type ROR with key successfully with scenario 1","As a user, I check export the project type ROR with key successfully with scenario 1",""
"passed","Thu Jan 12 18:16:33 GMT 2023","Thu Jan 12 18:17:32 GMT 2023","59626","","JIT-Database-013-DEFECT-Check-default-value-when-changing-type","","JIT-Database-013-DEFECT-Check-default-value-when-changing-type","[DEFECT] As a user, I should check the default value when changing the type","[DEFECT] As a user, I should check the default value when changing the type",""
"passed","Thu Jan 12 18:39:56 GMT 2023","Thu Jan 12 18:41:26 GMT 2023","89534","","JIT-Web-002c-MOLECULE-Delete","","JIT-Web-002c-MOLECULE-Delete","[WEB-MOLECULE] As a user, I can delete molecule","[WEB-MOLECULE] As a user, I can delete molecule",""
"passed","Thu Jan 12 18:27:01 GMT 2023","Thu Jan 12 18:28:08 GMT 2023","67593","","JIT-Mobile-032b-CAROUSEL-General-info","","JIT-Mobile-032b-CAROUSEL-General-info","[MOBILE-CAROUSEL] As a user, I should check the general infomation of Carousel is correct: Name, Key, unique key, delete component","[MOBILE-CAROUSEL] As a user, I should check the general infomation of Carousel is correct: Name, Key, unique key, delete component",""
"passed","Thu Jan 12 18:42:09 GMT 2023","Thu Jan 12 18:44:47 GMT 2023","158592","","JIT-Web-004a-ACTION-NAVIGATION-no-param","","JIT-Web-004a-ACTION-NAVIGATION-no-param","[WEB-ACTION-NAVIGATION] As a user, I could add action type navigation without params and check preview code","[WEB-ACTION-NAVIGATION] As a user, I could add action type navigation without params and check preview code",""
